,Positive,Negative
0,5,3
1,"New case of the novel #coronavirus in Thailand. Sharing of the sequence data was an important step to allow other countries to be prepared to detect this virus.
https://www.who.int/news-room/detail/13-01-2020-who-statement-on-novel-coronavirus-in-thailand …",@arambaut from the ARTIC network sharing his thoughts about the novel #coronavirus outbreak in #Wuhan China. Similarity with bat coronavirus does not necessarily predict it's origins from bats. https://twitter.com/arambaut/status/1215994825679474688 …
2,WHO has produced interim guidance for countries related to the novel #coronavirus outbreak in #wuhanhttps://twitter.com/WHO/status/1215916433827356672 …,"Q&A discussing the novel #coronavirus  in #wuhan ""The virus is similar to some of the published viruses collected from bats. But it is not close to SARS and not close to MERS.""https://www.sciencemag.org/news/2020/01/mystery-virus-found-wuhan-resembles-bat-viruses-not-sars-chinese-scientist-says …"
3,"Sequence for novel #coronavirus  now available, important development after potential first death reported in #Wuhanhttp://virological.org/t/initial-genome-release-of-novel-coronavirus/319 …",
4,"New case of the novel #coronavirus  detected in Japan. @WHOWPRO said 'It is not surprising that there are cases outside of China, and it is possible that there will be cases in other countries in the future.' 

This is where all the preparation comes into action.https://twitter.com/WHOWPRO/status/1217646736451100672 …",
5,Really interesting analysis. Modelling suggests that there may be over 1000 cases linked to the outbreak in #Wuhan of the novel #coronavirus. https://twitter.com/MRC_Outbreak/status/1218175738337284096 …,
