,Positive,Negative
0,13,0
1,Wait....What #CoronaVirusReinfection #CoVid19 #CoronaVirus,Bad state data hides coronavirus threat as Trump pushes reopening 
2,"It’s a a different strain of the already existing coronavirus that is new and called the wuhan coronavirus. It’s dangerous because it isn’t reacting to medication as well and spreading fast w/ no vaccine, and it leads to respiratory infection/pneumonia","Did anyone say all viruses matter when discussing coronavirus? No, so why are we still doing this all lives matter thing!?"
3,Mike Pence gonna tell us to pray the Coronavirus away.,"Man, I wish the histories of medicine and of epidemics didn't keep recurring, but here it is. Germs and plagues and ""immunity"" always, always entangled with xenophobia. As Coronavirus Spreads, So Does Anti-Chinese Sentiment "
4,coronavirus Boutta have the world on lock,Switzerland just banned events with over 1000 ppl and Germany quarantined a small town. South Korea is grounding flights and have 2000+ confirmed cases. Are y'all going to start getting serious about coronavirus now or y'all still want to pretend it's not a thing? #COVID19
5,RT @enfynyty: Big up to .@GovPritzker and .@chicagosmayor for getting us to green. Thank you for following the science! #allinillinois 🙌🏽 h…,"LET’S TALK ABOUT IT” ..... HOW READY ARE YOU FOR THE CORONA VIRUS IF IT INFECTS YOUR SURROUNDINGS? DO YOU KNOW WHAT IT ENTAILS, HOW TO AVOID IT? WHO TO AVOID? AND WHATS REAL AND FAKE? AND WHAT HAS CHANGED FOR YOU… https://www.instagram.com/p/B8xIQWuF2pB/?igshid=1oji80e0113l8 …"
6,"chopped: coronavirus quarantine, where you have to make a meal with whatever was in your cabinets before you went grocery shopping yesterday or today",Waiting for the coronavirus to hurry up and blow over so me and @Kenjo0614  can go to Japan
7,Thursday night #Covid_19 #coronavirus ice cream cake pic.twitter.com/LIYCE95Pi1,
8,"Make sure you take disinfectant wipes to all #LightSwitches, #DoorKnobs & #Handles! #coronapocolypse BeSafe #QuarantineLife #stayhomechallenge #Coronavirus #TheWalkingDead #StayHomeSaveLives",
