,Positive,Negative
0,0,2
1,"The Chinese have literally passed this Coronavirus around from eating bats, absolutely fucking rottern man. Could potentially wipe out hundreds of thousands of people because they want to be disgusting and eat shit like that. ",
2,"The Chinese have literally passed this Coronavirus around from eating bats, absolutely fucking rottern man. Could potentially wipe out hundreds of thousands of people because they want to be disgusting and eat shit like that.  pic.twitter.com/RFBTCKIaSI",
3,"I’d rather catch an STD than coronavirus 

-Isaac",
