,Positive,Negative
0,54,29
1,Coronavirus government response: Trump rejects a new normal: ‘This is going away’ ,"Fed holds interest rates near zero, vows forceful action amid coronavirus's economic fallout "
2,Shipping container medical rooms for #coronavirus patients now in D.C. - Washington Business Journal https://buff.ly/355swHC #COVID19 #shippingcontainer,"The coronavirus started in bats, then may have jumped t rateo pangolins In the past 45 years, at least three other pandemics (besides SARS) have been traced back to bats. Ebola, which has killed 13,500 since 1976; Mes, found in r28 countries; the Nipah virus, has a 78% fatality "
3,‘World vs. Virus’: Trump White House selling coronavirus souvenir coins https://coronaviruscall.com/world-vs-virus-trump-white-house-selling-coronavirus-souvenir-coins/,"It seems there's also lack of diversity among the recently deceased from coronavirus, at least for now."
4,How Coronavirus Created The Perfect Conditions For Conspiracy Theories https://www.huffpost.com/entry/coronavirus-conspiracy-theories-misinformation-social-media_n_5ea9e762c5b6a89866f9cec6 #COVID19,Is your child concerned about #coronavirus and other recent events? Our expert Sharon Selby (@child_family) shares tips on how you can help them manage their #anxiety.
5,"Russia to start coronavirus vaccine clinical trials in two weeks, health minister says ","Crazy, #KimJongUn just put the world on notice. He's prepared to cull his population or shoot anyone who enters the country infected. #COVID19"
6,Guest At Packed Memorial Day Weekend Pool Party Tests Positive For Coronavirus https://www.huffpost.com/entry/lake-of-the-ozarks-partygoer-coronavirus_n_5ed22951c5b65c5a49952b60 #COVID19,"See, how do you deal with a situation where a barista visibly looks sick, but she's still working? I asked her if she is well. She says, yes. Points to her nose, says ok. She doesn't speak a lick of english. Doesn't understand it much either. No COVID19 awareness Spread?"
7,#Flu season is basically November to May .. Expect the #PPE nonsense to start again in November tho ‘they’ are promising this time you will have a reason to wear it. #Covid19 #Coronavirus,"Three U.S. Airports to Screen Passengers for Chinese Coronavirus 
Passengers from Wuhan, China, will screened for infection at J.F.K. beginning Friday night, and in San Francisco and Los Angeles starting Saturday. https://nyti.ms/2G0j1Os "
8,Good news for the astronauts: the coronavirus doesn't exist in outer space.,God!  The stupidity has started!  I’m not going to comment on the coronavirus going forward. Too many experts who have zero medical training! https://twitter.com/barogue1_can/status/1221213696841715713 …
9,"SPR member, Dr. Mark Denison, was featured in a Bloomberg @business article discussing the spread of #Coronavirus. Denison is Director of #InfectiousDiseases and #pediatrics professor at @VUmedicine. Read the article here: https://bloom.bg/2HEBUXU #COVID19 ","From NPR News How Does Wuhan Coronavirus Compare With MERS, SARS And The Common Cold? https://www.npr.org/sections/goatsandsoda/2020/01/22/798277557/how-does-wuhan-coronavirus-compare-to-mers-sars-and-the-common-cold?sc=18&f=798277557 …"
10,"When planning international #businesstravel, are you prepared for the risks you may face? Read our tips to help protect your health, safety and security. @TravelGov @WHO @CDCtravel #COVID19 ",BI-WEEKLY DUE DILUGENCE - FLU SEASON: UPDATE - how does coronavirus flu kill - Google Search - https://www.google.com/search?client=ms-android-metropcs-us&biw=412&bih=652&sxsrf=ACYBGNSN3qd71mtk83KEG0_tucQGDTIbHA%3A1582068205308&ei=7XFMXoqwEoqe-gS-hYKoCA&q=how+does+coronavirus+flu+kill+&oq=how+does+coronavirus+flu+kill+&gs_l=mobile-gws-wiz-serp.3..33i160j33i299j33i22i29i30.10314.16731..17281...1.0..0.166.430.0j3......0....1.eK774fQwzbk#scso=_AHJMXomHJMjh-gSbw6yYDg23:32 …
11,They destroyed the world's ocean fish and now they conduct disease from where we expect it.  -Japan Confirms First Case of New Chinese Coronavirus - The New York Times - https://www.nytimes.com/2020/01/15/world/asia/coronavirus-japan-china.html …,Nemos reminds me of ink squirts from a squid on the topic of the new coronavirus.  He has been peddling every conspiracy notion that Zerohedge can supply. I wish you guys would take a hard look at his business ...
12,"Track #coronavirus in real time 
https://gisanddata.maps.arcgis.com/apps/opsdashboard/index.html?fbclid=IwAR09VJxDS7H8PoeHts30UoKsxcBdDg-M8LhDfGh3FlBOyhhBTcH9UWVYhO8#/bda7594740fd40299423467b48e9ecf6 … https://gisanddata.maps.arcgis.com/apps/opsdashboard/index.html?fbclid=IwAR09VJxDS7H8PoeHts30UoKsxcBdDg-M8LhDfGh3FlBOyhhBTcH9UWVYhO8#/bda7594740fd40299423467b48e9ecf6 …",Hey maybe coronavirus will kill trump if not him then settle for his occupation of The WH. He's definitely the most dangerous terrorist in the 
13,"There area many variants of #coronavirus, those of reptilians, birds,  mammals, etc., used in other industries 

There is this NOVEL, new one, that is new to all the scientific community. Even to big pharma.",U.S. stocks close sharply lower as investors grapple with the potential economic fallout from mounting coronavirus infections https://www.wsj.com/articles/stocks-fall-as-coronavirus-spread-accelerates-outside-china-11582533308 … via @WSJ
14,I am amazed at the speed some academics started cranking out papers about how to respond to the #coronavirus even though the crisis is not over yet. #china,"RT @XHNews: An American Indian territory has seen the highest per-capita #COVID19 infection rate in the country, media in Arizona state rep…"
15,"People in the West who have democratic governments should be grateful they don’t live in places like #Wuhan China. 

Where an individual life means zero

It’s a hell hole on earth. 

What an awful peace of shit top down government they have.

#coronavirus","RT @Q172018: Save the children End the LOCKDOWN &amp; arrest these Sick &amp; Evil people!

Report: Coronavirus Lockdown Fuels Child Rape in Uganda…"
16,"China’s Leader, Under Fire, Says He Led Coronavirus Fight Early On 

Xi Jinping was aware of the outbreak nearly two weeks before he first spoke publicly about it. It could draw him directly into questions about whether officials did too little, too late. https://nyti.ms/31ZKsli ","Read this from May 2018. @realDonaldTrump The deaths of Am from the Coronavirus is on YOU. 

https://www.washingtonpost.com/news/to-your-health/wp/2018/05/10/top-white-house-official-in-charge-of-pandemic-response-exits-abruptly/ …"
17,And fyi you can't get coronavirus from drinking Coronas. It's different.,"Spanish flu, German measles.....and yes coronavirus originated in China therefore it’s called Chinese virus."
18,"Is this speculation specifically regarding coronavirus and the presidential election? Are you assuming trump vs Bernie is bad for markets even if trump again, is victorious? Or, having Bernie as the democratic nominee will scare potential investors and large companies?",
19,"#noBordersNoNationsNoDeportations kids can’t spell #coronaVirus
#woke #progressive",
20,RT @chatcher2: Rep. Ted Budd and the Incompetent Trump / Republican Administration is what happened #votebluehousesenatewhlocal #VoteBlueTo…,
21,RT @HarryLaneGroup: The New Bull Run is only beginning after the #COVID19 driven shutdown and this recovery is more than V-Shaped it more l…,
22,"RT @Tejasvi_Surya: The only CM in India today who can start his weekend with a breakfast at MTR - city’s most famous joint. 

Sri @BSYBJP’s…",
23,RT @disclosetv: Footage of the People’s Armed Police marching into #XinFaDi wholesale market in #Beijing earlier today as parts of #China g…,
24,"RT @Ironhorse76: Let's get this show on the road!  FOLLOW ALL WHO: 

LIKE 
RT
COMMENT 

Nov will soon be upon us &amp; the #OrangeShitGibbon mu…",
25,"Yes and it’s likely that pneumonia was being classified as such, rather than something derived from the coronavirus.",
26,"Carry on with your meetings and events, but encourage alternatives to the handshake and offer ample hand sanitizer. At #HIPR hospitality showcase in New York. 
#eventprofs #coronavirus #bizbash @ Union Park Events https://www.instagram.com/p/B9VLhBZDwCd/?igshid=y9d3nxrdd4s5 …",
27,Get more coronavirus tests. No one cares about you grandpa but others have seniors they love.,
28,"To defeat coronavirus, we must first combat the mental afflictions — irrationality, conspiracy-mongering and Dear Leader-like devotion to Trump — spread by exposure to right-wing media. https://www.washingtonpost.com/opinions/2020/03/10/right-wing-medias-contempt-truth-has-never-been-more-dangerous/ …",
29,"More NBA players testing positive for #coronavirus  Lakers , Celtic",
30,3/20/20 Update to Coronavirus Advisory: We have one report of a performer with a presumptive case of coronavirus. https://www.freespeechcoalition.com/blog/2020/03/06/adult-industry-coronavirus-covid-19-advisory/ …pic.twitter.com/q6kttxZKAK,
31,Where Students Can Get School Meals In San Diego County During Coronavirus Shutdown https://www.kpbs.org/news/2020/mar/14/where-students-can-get-school-meals-san-diego-coun/ … via @KPBSnews,
32,Coronavirus Live Updates: Third Sailor In San Diego Contracts COVID-19 https://www.kpbs.org/news/2020/mar/17/coronavirus-live-updates/ … via @KPBSnews,
33,Five things to help stop the spread of coronavirus https://twitter.com/i/events/1239712380373708800 …,
