,Positive,Negative
0,9,13
1,"As Coronavirus Spreads To Wisconsin, Media Says ""Shoot The Messenger!"" https://youtu.be/R183wM-oTjk  via @YouTube","THE BAD NEWS: Dr. Fauci Says ""It's Inevitable"" the Coronavirus Will Return - THE GOOD NEWS: He's Wrong About Most Everything (VIDEO) https://www.thegatewaypundit.com/2020/04/bad-news-dr-fauci-says-inevitable-coronavirus-will-return-good-news-wrong-everything-video/?utm_source=Twitter&amp;utm_campaign=websitesharingbuttons via @gatewaypundit"
2,More than two dozen people in Iowa being monitored for coronavirus https://www.newsbreakapp.com/n/0O7n7uCg?s=a2&pd=0388lSlm …,American Farmer Sends Dire Warning In Viral Video: “Our Food Supply Is In Trouble” Because Of Coronavirus Lockdowns https://www.thegatewaypundit.com/2020/04/american-farmer-sends-dire-warning-viral-video-food-supply-trouble-coronavirus-lockdowns/?utm_source=Twitter&amp;utm_campaign=websitesharingbuttons via @gatewaypundit
3,Dr. Andrew Bostom: THE TIME IS NOW! Use Chloroquine (CQ) as Coronavirus Prophylaxis https://www.thegatewaypundit.com/2020/03/dr-andrew-bostom-the-time-is-now-use-chloroquine-cq-as-coronavirus-prophylaxis/ … via @gatewaypundit,
4,Seasonality Could Likely Flatten Exponential Growth Rate of Coronavirus in Coming Weeks If Not Days https://www.thegatewaypundit.com/2020/03/seasonality-could-likely-flatten-exponential-growth-rate-of-coronavirus-in-coming-weeks-if-not-days/ … via @gatewaypundit,
5,Biden's Campaign Uses Obama's Ebola Czar as Hired Gun to Attack President Trump's Coronavirus Response - As Joe Hides at Home (VIDEO) https://www.thegatewaypundit.com/2020/03/wheres-old-joe-bidens-campaign-uses-obamas-ebola-czar-as-hired-gun-to-attack-president-trumps-coronavirus-response-video/ … via @gatewaypundit,
6,"WAYNE ALLYN ROOT: Mr. President, Follow the South Korean Model to Defeat Coronavirus https://www.thegatewaypundit.com/2020/03/wayne-allyn-root-mr-president-follow-the-south-korean-model-to-defeat-coronavirus/ … via @gatewaypundit",
7,"Biden Emerges From Hiding, Plans to Attack President Trump with Shadow Coronavirus Briefings From His Home in Delaware https://www.thegatewaypundit.com/2020/03/biden-emerges-from-hiding-plans-to-attack-president-trump-with-shadow-coronavirus-briefings-from-his-home-in-delaware/ … via @gatewaypundit",
