,Positive,Negative
0,21,60
1,Rich people are responsible for spreading the coronavirus ,anyone saying Hillary Clinton would’ve stopped coronavirus has brain worms plain and simple
2,"in the uk it’s one of the main headlines but i’m that doesn’t mean people see it, coronavirus news has become its own section that’s always at the top of any news website and takes up most of news broadcasts. not many ppl off twt are talking about it","Damn... i kinda hope they get infected with coronavirus,,, "
3,"i’m heading off for today,,, remember to stay safe for both coronavirus and protests if you’re going &amp; not to praise rich white men for doing the bare minimum &lt;3","just realized i called coronavirus ""miss rona"" in my reply to danielle WELL "
4,"Don’t talk to me tomorrow. Katie Hopkins may have gotten suspended ( ), but Brexit is here. We still have 5 more years of the Tories. Piers Morgan is still on tv and Tommy Robinson and his fans are still a disease. The UK in 2020. Coronavirus cannot get us fast enough #brexiteve",hate that coronavirus is happening rn because it makes these protests even riskier
5,"if ever i get scared with this corona virus thing i just have to remember that i have lived through viruses. i have lived through bird flu, sars, ah1n1, swine flu, etc. what's another one, eh? i got this. i'm gonna be a clean and brave motherfucker.","I’m not standing up for police here , but this is a anti vaxxer protesting against corona virus lockdowns when nsw was told if we leave the house and are caught without a valid reason we would be arrested"
6,"I think abt this a lot for #COVID19. For those who have worked in the service industry or have family who currently do, then I don’t have to explain just how difficult/impossible it is to “take off work” or “work from home”. Not possible w/o pay cut &amp; many just can’t afford that. ",She was literally protesting against the corona virus lockdown laws .
7,So Netflix just happened to release pandemic right when coronavirus started spreading? Sus,"If I was a business owner watching 30 cities burning over the last 4 days, I would probably try and protect my investments too. Some of these folks barely survived the coronavirus shutdowns."
8,"xenophobia... so you’re telling me someone asking for an ASIAN leg of the tour warrants the response that they need a vaccine? the coronavirus is populated in china, but how tf does that correlate to the whole of asia please explain. and how him being filipino correlates as well",has everyone just forgotten that coronavirus exists or....???
9,Arizona researchers are developing an additional test to diagnose the coronavirus and seek approval from the FDA. Read this @cronkitenews article for more.https://cronkitenews.azpbs.org/2020/02/11/coronavirus-test-arizona/ …,hopefully the train will be empty tomorrow cause everyone is panicking about coronavirus
10,RT @MileyCyrus: Italy🇮🇹 and the world united in solidarity with Black Lives Matter in the US. We must stay united to tackle #COVID19 and it…,the first person i thought of when i heard about the coronavirus was u because of how much u would talk about thr plauge
11,"RT @priyadamini24: #Thread 🧵 

As India’s #COVID19 tally inches towards the 3 lakh mark, here is a thread of IMPORTANT CRUCIAL THINGS THE G…","people are dying from the coronavirus and y’all are still being ignorant on this app making jokes about how it has the word ‘corona’ in it, like we’re 12"
12,"RT @sanchezcastejon: Spain is coleader in initiatives such as the ACT-Accelerator to achieve equitable access to vaccines, treatments and d…",everyone on twitter: influenza is more dangerous than the corona virus me: *vibes in i don't have a flu shot*
13,go off mr handsome,ive been coughing all day i swear my paranoid ass makes me think i have coronavirus
14,RT @CDCgov: #Employers: Antibody tests for #COVID19 should not be used to determine if someone can return to work. There is not enough info…,people think the corona virus is here in sa*t* cl*ri*a 
15,holy shit i thought 48% of americans have the coronavirus and my heart stopped,"#lrt a girl in my bestie‘s class (she’s at my art school too) said she’s a little afraid of the Chinese girl in their class bc she might have the corona virus Just imagine being that racist, delusional and prejudging "
16,"can’t go back to work bc they’re closing over the coronavirus 

...fuck ",so one of my friends messaged me 3 days ago saying he’d heard there were suspected cases of coronavirus in my hospital and he hoped i was ok.. so i replied immediately with an update and he still hasn’t read the message.. clearly ain’t that worried about me huh
17,coronavirus STOP. like forreal just stop!,"can i just say that jokes abt corona virus is not even funny??? imagine making fun of a virus that kills people, yall just brainless at this point"
18,,@people who think the coronavirus is going to wipe out the human race: 
19,,my little brother watching this stupid ass sml video and they just made a joke about asians and corona virus 
20,,this is so fucking sick a 60 yr old chinese man had a heart attack in sydney’s chinatown but no one was willing to help bc they were afraid of coronavirus so he died on the street... absolutely disgusted by the sinophobia lately
21,,"more people have died from the flu than the corona virus in the us this flu season so shut up, stop being racist, and wash your hands"
22,,"this whole quadrant is ridiculous, am i supposed to believe murasakibara can cook??? and DOES COOK???? is he being quarantined bc of covid19???? "
23,,"hey why isn't the CDC running infectious disease screenings at SEA.. you know.. the one airport that had a confirmed coronavirus case go through it

why the heck's it just LAX and SFO on the west coast"
24,,i cried over the coronavirus before i'm really scared honestly
25,,"it looks like minho and jisung are wearing surgical type n95 masks, i’m guessing because of corona virus"
26,,omg corona virus has officially spread to toronto
27,,my dad using the corona virus as a way to talk shit about my kpop boys byeee
28,,"everyone on twitter: influenza is more dangerous than the corona virus 

me: *vibes in i don't have a flu shot*"
29,,"Turns out James and I didn’t have coronavirus a few years ago, it was gastroenteritis. I’ve been telling people my funny story about it for years and now people probably think this is all my fault."
30,,uhh should we be worried about this coronavirus thing
31,,not really i swear worst case you get the flu or pneumonia. it’s weak. coronavirus isn’t all that! https://twitter.com/irisckp/status/1219766980800131072 …
32,,hope i get coronavirus  the ebola of 2020 
33,,wait apparently there’s a case of the coronavirus in my super tiny town y’all imma die
34,,someone at my school has the corona virus and I have a cold it was nice knowing you guys 
35,,my mom will go to a korean restaurant instead of a chinese one bc of the coronavirus but won’t get a flu shot mom ur worried about the wrong virus
36,,just overheard somebody say their friend is being tested for corona virus let’s go girls
37,,i thought this was about that coronavirus..
38,,"omg DANIOLA the queen, also they have detected cases of the coronavirus in paris and bordeaux, I ain’t getting anywhere near, also WHY ARE YOU TALKING ABOUT PARIS"
39,,"I don't understand why people think it's okay to be racist to Asians because of the coronavirus and say ""it's just a joke"" like obviously it's not it's just plain racist"
40,,"Crazy how, at a glance, I can tell that most of the people using coronavirus as an excuse to be racist to Asian people probably don’t wash their crusty hands after using the bathroom both in and out of their homes"
41,,Coronavirus has taught me 1 thing and 1 thing only: white people still think that all Asians are the same.
42,,how do u know its the corona virus?? i feel like that would’ve been on the news
43,,I can’t believe I sent my dad a million articles about coronavirus and why he should cancel his trip to Thailand and he left me a voicemail of his last will and testament saying I could have his car... like sir.... excuse me....
44,,this just in: coronavirus is up 2 points and has beaten joe biden in the latest poll https://twitter.com/coronavcharts/status/1220895316897140738 …
45,,some people really be joking about coronavirus when people are in serious risk 
46,,"okay so much going on the tline rn, 127 precomeback song dropping, johnny rapping, corona virus now in SoCal right before SuperM series.... I’ll be on later as today is a rough day"
47,,How would experiments on other diseases have any effect on the outbreak of coronavirus?
48,,this wh*te boy in my class really brought a hospital mask to school and wore it bc our drama teacher is asian.....you know..cuz..he thinks that every asian person has the coronavirus. its not even an assumption because he deadass told me this-
49,,I JUST COUGHED IN MY UBER AND HE ASKED IF IT WAS THE CORONAVIRUS. MOM COME PICK ME UP
50,,if i see ONE MORE INSENSITIVE JOKE about coronavirus on my timeline.........
51,,the death toll of corona virus is getting much bigger :(
52,,the red circle is where they r being quarantined :) im going to die of corona virus x pic.twitter.com/iCUCBhmVg2
53,,"if i get the coronavirus that’s on ME, they caught MY immune system slippin"
54,,Coronavirus is at UMass bro it’s fucking game over
55,,"because that girl is showing that chinese ppl have the coronavirus, is disrespectful because that’s not true (I DON’T KNOW HOW TO EXPLAIN MYSELF CORRECTLY IN ENGLISH UGH)"
56,,this coronavirus is actually terrifying me
57,,being Asian is choking on ramen in a tiny restaurant and holding back on coughing so you don't get kicked out for having coronavirus ::))
58,,sneezed n my mom backed away saying i had the coronavirus 
59,,"Whelp. If this doesn't make you cry, then frankly, you have no heart. #coronavirus
https://shanghai.ist/2020/02/13/wuhan-doctor-quarantines-herself-from-family-husband-lights-her-way-to-work-each-night/?fbclid=IwAR2xe2SMaTmRlEJEdzFq2UitHKu51C8R6n4TLXmbUonQOAzAHbM-BIi-AEY#.XkcuaXUf1uk.twitter …"
60,,the corona virus is a ten min train away do i go get barricade tomroow
61,,the coronavirus means the economy is not thriving what if this leads to another global depression and then that causes even more conflict and tension and then that leads to ww3
62,,wait what just heard the coronavirus can kill you if you have asthma
63,,kcon better not get canceled b/c of the fricking corona virus
64,,“i think i have the coronavirus. if i don’t respond in 3-5 business days alert the authorities bc we will have lost another bad bitch”
65,,simon’s.. i just saw an artist cancelling a show in italy because of the coronavirus... what if the same happens for us:(((
66,,Yup D12
67,,"RT @GrandmaSaidNo: Never forget that the US federal government is responsible for the high COVID-19 death toll on our Nation. 

The magnitu…"
68,,"RT @YourAnonNews: Yesterday, there were 140,927 new cases of #COVID19 and 4,603 additional deaths were reported in the past 24 hours.

This…"
69,,FTUJVFEUIK HE RESPONDED WTF I FUCKING LIVING IT
70,,"RT @SalliePermar: As plans for school reopening are developed, will child-specific metrics be applied to decide what the school year will l…"
71,,never thought id see our president chatting with miley cyrus tbh
72,,"RT @SafeSpacesDC: If you're at a protest today &amp; experience increased cop-related exposure, report it to the #COVID19 Policing Project: the…"
73,,MILEY MENTIONING MY PRESIDENT WHAT THE-
74,,im not saying it would be lit if my ex got coronavirus but it would be lit if my ex got coronavirus
75,,"my hand: hurts
me: looks up the coronavirus symptoms"
76,,if black widow gets delayed because of the corona virus i'm gonna throw hands
77,,the corona virus came to berkeley cause theres a bitch on my floor who doesn’t wash her hands
78,,if i could stop hearing abt the coronavirus every five seconds that would be fun. i don’t have it so i don’t care and that’s. THAT
79,,the coronavirus is spreading in my city tho 
80,,@florianalima you're a bad bitch coronavirus cant kill you but also good for you that you cancelled pls stay safe but also the way i was gonna yeet myself to america for one weekend for you n e ways cant wait to see darcy tonight love you see you soon i hope
81,,Can’t believe girls are actually texting me saying Dennis has Coronavirus lol that’s exactly what he want y’all to think. I call 
82,,Get corona virus for you just let me adore you 
83,,"Might have to stop going to yoga. Tonight the instructor wrapped class by putting essential oil on each person's wrist, then asking everyone to rub their wrists together and inhale deeply. I was thinking, ""Is this like a chicken pox party?"" and took a hard pass. #coronavirus"
84,,givbe me one 20p energy drink and ill single handed destroy the corona virus
85,,Dying from coronavirus and not from a lost bullet wouldn't be really Mexican on my part
86,,can we cancell coronavirus cmon Ami cancell coronavirus <3
87,,corona virus: if i don’t eliminate trump https://twitter.com/hopesmaya/status/1238226340882645001/video/1 …
88,,what if we met and fell in love in the coronavirus clinic and justin baldoni made our story into a movie because he’s bored of his cancer films. just kidding... unless?
89,,"Corona Virus is getting serious.
What do we all think? pic.twitter.com/7w6cdN1f4E"
90,,"because there is no history of racism behind associating asians w the word dumb, there is now a lot of racism behind associating asians w the corona virus, therefor making jokes that associate someone asian with the corona virus is racist. its really not that hard to understand."
91,,what if i had mild coronavirus a month ago..
92,,my dog doesn’t have corona virus whos he hurting https://twitter.com/LuciferThought/status/1237784238809849856 …
93,,"it kind of sucks having a heart disease and an immunocompromised family member and having to deal with people acting like the coronavirus isn't dangerous. it may not be dangerous to you personally, but it could kill me and my mom, so keep others in mind."
94,,these pictures singlehandedly cured coronavirus https://twitter.com/hbarnes98/status/1240784775444459520 …
95,,"who the fuck just set off a firework? for what, coronavirus? headass"
96,,someone in my town just died bc coronavirus.     anxiety time.
97,,Me every five minutes : I don't think I have coronavirus bUT
98,,"me, wanting something to distract me from the impending doom of the Coronavirus: ah, music

Spotify: pic.twitter.com/EkXZMzAiAU"
99,,who wants to talk about anything BUT the coronavirus  needa get my mind off the apocalypse 
100,,"the coronavirus is messing up my routine with my crush, i’m tired"
