,Positive,Negative
0,2,5
1,Imagine... a key outcome of the coronavirus maybe a faster move to even greater automation in food mfg. &amp; meat processing facilities. #UBI, Dr. Fauci Backed Controversial Wuhan Lab with Millions of U.S. Dollars for Risky Coronavirus Research 
2,"I rarely ever say anything negative about a doctor, but the US & the World deserves a deep proctological exam on exactly what happened in China, & America’s role in funding the coronavirus study. We also need to better understand the WHO dynamic. Trump Admin role???","COVID19 outbreak now signals that CANADA will shift from #passive testing on patients who come in with symptoms of the disease, to an #active surveillance model. #All patients with severe respiratory disease whose cause is unknown to be tested."
3,"Mr. Fauci - an underwriter of Coronavirus research in China - is, likely, hoping a cure materializes &amp; quickly. https://www.google.com/amp/s/www.newsweek.com/dr-fauci-backed-controversial-wuhan-lab-millions-us-dollars-risky-coronavirus-research-1500741%3famp=1",".@CBCPolitics 

Canada has deployed a specialized unit of emergency response officials to China to co-ordinate the logistics of a planned airlift to repatriate Canadians as the number seeking to leave the region where the novel coronavirus originated continues to increase. pic.twitter.com/aAUsHLXNb4"
4,Trump Claims Coronavirus Will “Miraculously” Go Away by April https://www.vanityfair.com/news/2020/02/donald-trump-coronavirus-warm-weather?utm_source=twitter&utm_medium=social&utm_campaign=onsite-share&utm_brand=vanity-fair&utm_social-type=earned … via @VanityFair,
