,Positive,Negative
73,,"More coronavirus cases detected in China, global alert for Chinese New Year - more at https://thethaiger.com/news/world/more-coronavirus-cases-detected-in-china-global-alert-for-chinese-new-year … #China #Coronavirus #Spread #Screening #US #Thailand
Chinese medical officials have now reported four more cases of the viral pneumonia strain caused by a new coronav...pic.twitter.com/QcqijAuuVQ"
74,,"#Thailand's second case of a Chinese national infected with Novel #Coronavirus 2019 was confirmed on Thursday night while lab results for a Thai suspected of being infected are pending.
China reports 17 new cases of mystery virus. https://www.bangkokpost.com/thailand/general/1839049/china-reports-17-new-cases-of-mystery-virus …"
75,,The Wuhan novel coronavirus no human-to-human transmission narrative is unraveling. Expect to hear a lot more about this virus in the days and weeks ahead. https://twitter.com/Fla_Medic/status/1218751450244964353 …
76,,Coronavirus: what airport measures are in place to detect sick passengers? https://www.theguardian.com/world/2020/jan/18/coronavirus-what-airport-measures-are-in-place-to-detect-for-sick-passengers?CMP=share_btn_tw …
77,,"BREAKING NEWS! Study From London Research Centre Says almost Two Thousand People Infected With Mysterious Virus In China..more..https://www.thailandmedical.news/news/study-from-london-research-centre-says-almost-two-thousand-people-infected-with-mysterious-virus-in-china …
#pandemic #virus #China #pneumonia #coronavirus #deaths #epidemic #health #breakingnews #newspic.twitter.com/7ZTYxNVBop"
78,,Elderly Chinese tourist is Thailand’s second Coronavirus pneumonia case http://dlvr.it/RNHT42 
79,,Elderly Chinese tourist is Thailand’s second Coronavirus pneumonia case http://dlvr.it/RNHNh8 
80,,"#Thailand has found a second case of a new Chinese #coronavirus, authorities said on Friday, as they ramped up checks on Chinese visitors, nearly a million of whom are expected for Lunar New Year holidays next week.
The https://bangkokjack.com/2020/01/18/second-case-chinese-virus/ …pic.twitter.com/RpWUrTAfrV"
81,,"#Coronavirus #Outbreak #Pneumonia 
""We estimate that a total of 1,723 cases of 2019-nCoV in Wuhan City (95% CI: 427 – 4,471) had onset of symptoms by 12th January 2020 (the last reported onset date of any case).""https://twitter.com/MRC_Outbreak/status/1218175738337284096 …"
82,,Coronavirus: more cases and second death reported in China #epidemichttps://www.theguardian.com/world/2020/jan/17/corona-second-death-in-china-after-sars-like-outbreak?CMP=Share_iOSApp_Other …
83,,Public Health Screening to Begin at 3 U.S. Airports for 2019 Novel Coronavirus (“2019-nCoV”) | CDC Online Newsroom | CDC http://www.cdc.gov/media/releases/2020/p0117-coronavirus-screening.html … via @CDCgov
84,,"America Begins Airport Screenings As SARS-Linked Virus Kills 2 In China...more..https://www.thailandmedical.news/news/america-begins-airport-screenings-as-sars-linked-virus-kills-2-in-china …
#China #SARS #Coronavirus #epidemic #deaths #pneumonia #virus #airports #Screenings #news #breakingnews #America #US #Chinesepic.twitter.com/hGW8M0a5b3"
85,,#Thailand Confirms Second Case of #Coronavirus from China - https://www.chiangraitimes.com/health/thailand-confirms-second-case-of-coronavirus-from-china/ … - https://www.chiangraitimes.com/wp-content/uploads/2020/01/Thailand-Confirms-2nd-Case-of-Coronavirus-from-China.jpg … -#Thailand's Public Health ... -pic.twitter.com/Y06KtD4enn
86,,Chinese New Year sparks full alert for coronavirus https://www.bangkokpost.com/thailand/general/1838299/chinese-new-year-sparks-full-alert-for-coronavirus … via @bangkokpostnews
87,,"#Thailand has found a second case of a new Chinese #coronavirus, authorities said on Friday, as they ramped up checks on Chinese visitors, nearly a million of whom are expected for Lunar New Year holidays next week. https://bangkokjack.com/2020/01/18/second-case-chinese-virus/ …pic.twitter.com/wFM5Vt06Fw"
88,,Now millions of chinese tourists are on #ChineseNewYear holidays in Thailand and elsewhere in the world. #Wuhan #coronavirus #GongXiFaCai
89,,"Japan and Thailand have confirmed new cases of the coronavirus, sparking fears that the virus will spread further outside of China’s borders.

IDSA Global Health Committee Member Daniel Lucey, MD, FIDSA, provides updates on the outbreak on Science... https://bit.ly/2FXVOwj "
90,,"Second person dies from SARS-linked #coronavirus in #China | The Japan Times https://www.japantimes.co.jp/news/2020/01/17/asia-pacific/science-health-asia-pacific/second-person-dies-coronavirus-china/ …
@japantimes"
91,,"#Coronavirus : second death in #China after Sars-like outbreak https://www.theguardian.com/world/2020/jan/17/corona-second-death-in-china-after-sars-like-outbreak?CMP=share_btn_tw …
@guardiannews"
92,,Second Chinese tourist found infected with coronavirus https://wp.me/p1onxg-gMS  #Chinese #CoronaVirus #Outbreak
93,,"Thailand finds second case of new Chinese virus, says no outbreak #epidemic #coronavirus https://reut.rs/36558Zz "
94,,A second case of infection with a new Chinese coronavirus has been found in Thailand as health authorities ramp up checks on Chinese visitors arriving for the Lunar New Year holiday. #BangkokPost #Thailandhttps://www.bangkokpost.com/thailand/general/1838009/second-chinese-tourist-found-infected-with-coronavirus …
95,,Another Chinese tourist to Thailand has been quarantined after it was confirmed that he carried the latest Wuhan coronavirus. #corona_virus #Thailandnews #TheNationThailandhttps://www.nationthailand.com/news/30380703 
96,,Scary stuff #coronavirus https://twitter.com/ABC/status/1217986675273609217 …
97,,"Officials in China’s Wuhan city revealed that another man had died after being infected by the coronavirus.
#China #corona_virus #TheNationThailandhttps://www.nationthailand.com/news/30380691 "
98,,China confirms second death from coronavirus infection #ศาสตร์เกษตรดินปุ๋ย https://sootinclaimon.wordpress.com/2020/01/17/china-confirms-second-death-from-coronavirus-infection-%e0%b8%a8%e0%b8%b2%e0%b8%aa%e0%b8%95%e0%b8%a3%e0%b9%8c%e0%b9%80%e0%b8%81%e0%b8%a9%e0%b8%95%e0%b8%a3%e0%b8%94%e0%b8%b4%e0%b8%99%e0%b8%9b%e0%b8%b8/ …pic.twitter.com/rOzMM9zeDO
99,,China confirms second death from coronavirus infection #ศาสตร์เกษตรดินปุ๋ย https://sootinclaimon.wordpress.com/2020/01/17/china-confirms-second-death-from-coronavirus-infection-%e0%b8%a8%e0%b8%b2%e0%b8%aa%e0%b8%95%e0%b8%a3%e0%b9%8c%e0%b9%80%e0%b8%81%e0%b8%a9%e0%b8%95%e0%b8%a3%e0%b8%94%e0%b8%b4%e0%b8%99%e0%b8%9b%e0%b8%b8/ …pic.twitter.com/SsjYmjVg4Z
100,,Thai Public Health Min reports the second Wuhan coronavirus case in Thailand: a 74 year Chinese tourist traveling from Wuhan detected at BKK with high fever and pneumonia. She is responding well to treatment and recovering. https://twitter.com/pr_moph/status/1218011451421446144 …
101,,Japanese man who visited Wuhan infected with coronavirus #ศาสตร์เกษตรดินปุ๋ย https://sootinclaimon.wordpress.com/2020/01/17/japanese-man-who-visited-wuhan-infected-with-coronavirus-%e0%b8%a8%e0%b8%b2%e0%b8%aa%e0%b8%95%e0%b8%a3%e0%b9%8c%e0%b9%80%e0%b8%81%e0%b8%a9%e0%b8%95%e0%b8%a3%e0%b8%94%e0%b8%b4%e0%b8%99%e0%b8%9b/ …pic.twitter.com/Uypo2r0OIK
102,,Japanese man who visited Wuhan infected with coronavirus #ศาสตร์เกษตรดินปุ๋ย https://sootinclaimon.wordpress.com/2020/01/17/japanese-man-who-visited-wuhan-infected-with-coronavirus-%e0%b8%a8%e0%b8%b2%e0%b8%aa%e0%b8%95%e0%b8%a3%e0%b9%8c%e0%b9%80%e0%b8%81%e0%b8%a9%e0%b8%95%e0%b8%a3%e0%b8%94%e0%b8%b4%e0%b8%99%e0%b8%9b/ …pic.twitter.com/DwR6MUWDFC
103,,TAT sees no impact from coronavirus on Chinese tourists visiting Thailand #ศาสตร์เกษตรดินปุ๋ย https://sootinclaimon.wordpress.com/2020/01/17/tat-sees-no-impact-from-coronavirus-on-chinese-tourists-visiting-thailand-%e0%b8%a8%e0%b8%b2%e0%b8%aa%e0%b8%95%e0%b8%a3%e0%b9%8c%e0%b9%80%e0%b8%81%e0%b8%a9%e0%b8%95%e0%b8%a3%e0%b8%94%e0%b8%b4/ …pic.twitter.com/wBebP8AgJ8
104,,TAT sees no impact from coronavirus on Chinese tourists visiting Thailand #ศาสตร์เกษตรดินปุ๋ย https://sootinclaimon.wordpress.com/2020/01/17/tat-sees-no-impact-from-coronavirus-on-chinese-tourists-visiting-thailand-%e0%b8%a8%e0%b8%b2%e0%b8%aa%e0%b8%95%e0%b8%a3%e0%b9%8c%e0%b9%80%e0%b8%81%e0%b8%a9%e0%b8%95%e0%b8%a3%e0%b8%94%e0%b8%b4/ …pic.twitter.com/XcKHoMilbS
105,,"First 'China coronavirus' case confirmed in Japan - more at https://thethaiger.com/thai-life/well-being/first-china-coronavirus-case-confirmed-in-japan … #Wuhan #Virus #coronavirus #Japan #Tokyo #Patient #China
As Thailand's airports continue screening passengers arriving from China, Japan has confirmed its first case of the new China coronavir...pic.twitter.com/uf2WOuUA8F"
106,,"WHO says coronavirus spreads more easily than previously thought
https://cnn.it/30K1a7G "
107,,Coronavirus: International airports step up screening protocols https://www.euronews.com/2020/01/23/coronavirus-international-airports-step-up-screening-protocols …
108,,Coronavirus: airports around the world carry out screenings https://www.theguardian.com/science/2020/jan/21/coronavirus-screenings-global-travelling-airport?CMP=share_btn_tw …
109,,"The #coronavirus outbreak, if prolonged until March, could cost the #Thai tourism industry between Bt80 billion to Bt100 billion or between 0.5 percentage point and 0.7 https://bangkokjack.com/2020/01/29/coronavirus-thailand-100-billion-baht/ …pic.twitter.com/hSN1PK80fg"
110,,"#Coronavirus is expected to affect #Thailand the most as a destination market by “quite a long margin”, m1nd-set has revealed, according to data from its Business 1ntelligence Service (B1S).
Figures https://bangkokjack.com/2020/01/28/thailand-most-affected-coronavirus/ …pic.twitter.com/WiTnBMyppN"
111,,"The 20 officers inspecting the navy's submarine construction in China's city of Wuhan -- the epicentre of the new coronavirus outbreak -- have not been affected by the disease, according to the navy. #BangkokPost #Thailandhttps://www.bangkokpost.com/thailand/general/1843569/officials-watching-over-sub-in-wuhan-safe-from-virus …"
112,,"Public health and airport authorities are doubling down on efforts to prevent an outbreak by screening travellers from cities near China's Wuhan, as they step up a probe into a suspected new coronavirus case in Hua Hin. #BangkokPost #Thailandhttps://www.bangkokpost.com/thailand/general/1843564/thermal-screening-for-all-china-arrivals …"
113,,Japan braces for Chinese New Year tourist influx as concerns over coronavirus grow | The Japan Times https://www.japantimes.co.jp/news/2020/01/25/national/japan-second-case-coronavirus/#.XizSgIsmmzA.twitter …
114,,"In #China, authorities have expanded the number of cities on lockdown to 10, affecting some 33 million people, as medical workers struggle to slow the spread of a novel strain of #coronavirus.
At https://bangkokjack.com/2020/01/26/quarantined-china-coronavirus/ …pic.twitter.com/KhQPd60PVO"
115,,Govt steps up measures to tackle coronavirus situation - https://bit.ly/2uBg97S pic.twitter.com/7wpOpFcBB4
116,,BBC News - Coronavirus declared global health emergency by WHO .He also said that there is no reason to limit international trade or travel to China. #CORONAVIRUS #ไวรัสโคโรน่าสายพันธุ์ใหม่https://www.bbc.com/news/world-51318246 …
117,,Thousands of doctors and nurses are saying goodbye to their families as they're deployed to Wuhan to fight the #coronavirus outbreak. It has been described as a “coronavirus suicide mission”. #ServiceForHumanity #Chinapic.twitter.com/Om4LLRQi93
118,,Govt confirms Thai coronavirus case https://www.bangkokpost.com/thailand/general/1841589/govt-confirms-thai-coronavirus-case … via @bangkokpostnews
119,,"Dow falls more than 100 points amid first US case of coronavirus, big decline in Boeing - https://www.cnbc.com/2020/01/21/us-futures-point-sharply-lower.html …"
120,,"...and my embassy says ""reconsider travelling"" to China #coronavirus pic.twitter.com/0GP2eWFKdI – at Phangan Beach"
121,,"The fate of Thai students in Wuhan hangs in the balance after authorities locked down the city in central China to control the outbreak of the deadly coronavirus, preventing Thailand from evacuating 64 of its nationals. #BangkokPost #Thailandhttps://www.bangkokpost.com/thailand/general/1844944/thais-in-wuhan-living-under-shadow-of-deadly-virus …"
122,,"Wa are on it. ""Wa shut down nightclubs to prevent entry of coronavirus"" https://www.mmtimes.com/news/wa-shut-down-nightclubs-prevent-entry-coronavirus.html#.Xi92XYnAb5g.twitter …"
123,,The Public Health Ministry yesterday confirmed the fifth case of a Sars-like coronavirus in Thailand but assured that all necessary precautionary measures had been taken to prevent the disease from spreading. #BangkokPost #Thailandhttps://www.bangkokpost.com/thailand/general/1843109/discovery-of-fifth-case-shows-screening-effective …
124,,[01.23] The collapsing of Wuhan (Wuhan coronavirus uncensored footage) |... https://youtu.be/Jv_ScEYMQ0s  via @YouTube #Wuhan #coronavirus #footage
125,,Can Airport Screening Help Stop The Spread Of Wuhan Coronavirus? https://www.npr.org/sections/health-shots/2020/01/23/798919318/can-airport-screening-help-stop-the-spread-of-wuhan-coronavirus?utm_campaign=storyshare&utm_source=twitter.com&utm_medium=social …
126,,No wonder the Coronavirus is spreading...The damn millennials won't quit eating ass.
127,,#China Suspends #Tourism to Contain the Coronavirus - https://www.chiangraitimes.com/thailand-national-news/china-suspends-tourism-to-contain-the-coronavirus/ … - https://www.chiangraitimes.com/wp-content/uploads/2020/01/China-orders-travel-agencies-to-suspend-tours-over-coronavirus-outbreak.jpg … -Kasikorn Research ... -#NewCoronavirus #Suspendedpic.twitter.com/noxC69ues4
128,,"The Department of National Parks, Wildlife and Plant Conservation plans to screen cave bats amid health concerns after the creatures might be linked to the outbreak of the deadly Wuhan coronavirus in China. #BangkokPost #Thailandhttps://www.bangkokpost.com/thailand/general/1846454/bats-face-checks-over-virus-fears …"
129,,"Bangkok Post headlines on Monday: 
Wuhan evacuation plan eyed https://www.bangkokpost.com/thailand/general/1844174/wuhan-evacuation-plan-eyed …
Crisis deals B50bn hit to tourism https://www.bangkokpost.com/thailand/general/1844209/crisis-deals-b50bn-hit-to-tourism … #Thailand #ไวรัสโคโรน่า #coronavirus pic.twitter.com/LTK0nfE0Bv"
130,,WHO Chief Traveling to Beijing to Discuss Coronavirus Outbreak With Chinese Officials: https://sputniknews.com/asia/202001261078144025-who-chief-traveling-to-beijing-to-discuss-coronavirus-outbreak/ … via @SputnikInt
131,,Coronavirus vs. SARS: How similar are they? Data tells https://news.cgtn.com/news/2020-01-26/Coronavirus-vs-SARS-How-similar-are-they-Data-tells-NzBCywlxmg/index.html … via @cgtnofficial
132,,"In January, the Thai equity market was buffeted by several negative factors. The spread of the coronavirus drove the SET index sharply lower to finish the month at 1.514.14 points. #BangkokPost #Businesshttps://www.bangkokpost.com/business/1853089/three-investment-themes-for-february …"
133,,"As coronavirus travel restrictions keep Chinese tourists at home, a world that has grown dependent on them feels their absence https://www.washingtonpost.com/world/europe/coronavirus-as-chinese-tourists-stay-home-a-world-that-has-grown-dependent-on-them-feels-their-absence/2020/02/07/0ff7a37e-46a4-11ea-91ab-ce439aa5c7c1_story.html …"
134,,"News • Re: China Coronavirus: HHTel wrote: ↑Fri Feb 07, 2020 5:11 pmMr Anutin was distributing masks at the Siam skytrain station entrance and complained that ""farang"" tourists did not take them and acted as if they ""don't care"". ""These kinds of… http://dlvr.it/RPcH2f "
135,,Coronavirus Outbreak Is Affecting Nintendo Switch Supply in Japan via @Entrepreneur @jonfingashttp://entm.ag/6va1 
136,,Bill & Melinda Gates Foundation donates $100M to coronavirus treatment https://www.sfgate.com/cnet/article/Bill-Melinda-Gates-Foundation-donates-100M-to-15032791.php?utm_campaign=socialflow&utm_source=facebook.com&utm_medium=referral&fbclid=IwAR3cdD0IZl1H6qVuP1horSD1SJ69lHV4NTHE0DyIUyJJ7cUj0gZhpFLAKdY&utm_campaign=CMS%20Sharing%20Tools%20(Desktop)&utm_source=t.co&utm_medium=referral … via @SFGate
137,,South-east Asian central banks respond to coronavirus impact  https://on.ft.com/2S2fiGY 
138,,Thai Tourism Operators Report Zero Bookings Due to Coronavirus https://www.chiangraitimes.com/tourism/thai-tourism-operators-report-zero-bookings-due-to-coronavirus/ …pic.twitter.com/rBro1HQ3ze
139,,Will you come to Asia? Please come after Corona virus has been cleared.
140,,"Bangkok Post headlines on Sunday:
Thais to be flown home from Wuhan https://www.bangkokpost.com/thailand/general/1848569/thais-to-be-flown-home-from-wuhan …
Coronavirus deals severe blow to tourism industry https://www.bangkokpost.com/thailand/special-reports/1848579/coronavirus-deals-severe-blow-to-tourism-industry … #ไวรัสโคโรน่า #coronavirus #Thailandpic.twitter.com/9wAKGQuctS"
141,,"17 Surat Thani students fly back from Hubei, test negative for coronavirus - https://thai.vi/36QgiSD pic.twitter.com/228eullT9x"
142,,"The novel coronavirus outbreak in China and other parts of the world has struck fear among the masses, with a global health emergency declared by the World Health Organization (WHO). #BangkokPost #Businesshttps://www.bangkokpost.com/business/1849349/a-study-in-panic …"
143,,The World Health Organization warns the evacuation of nationals from China to their home countries carries the risk of spreading the deadly coronavirus. https://www.voacambodia.com/a/5263837.html 
144,,Deputy Prime Minister Somkid Jatusripitak has asked the public not to panic about the coronavirus outbreak or economic problems by giving assurances that Thailand will be steered through difficult times. #BangkokPost #Businesshttps://www.bangkokpost.com/business/1852059/somkid-tells-public-not-to-panic …
145,,"[Thu, 06 Feb 2020 23:54:30 +0000] [Espeednews] Chinese Crypto Mine Stop or Stall Operations Due to Coronavirus Outbreak - https://espeednews.com/2020/02/06/chinese-crypto-mine-stop-or-stall-operations-due-to-coronavirus-outbreak/ …"
146,,Chinese doctor who raised early alarm over coronavirus dies https://thai.vi/385tHY9  #WorldNewspic.twitter.com/jTQKurzjFf
147,,Deputy Prime Minister Somkid Jatusripitak has asked the public not to panic about the coronavirus outbreak or economic problems by giving assurances that Thailand will be steered through difficult times. #BangkokPost #Thailandhttps://www.bangkokpost.com/thailand/general/1852059/somkid-tells-public-not-to-panic …
148,,"News • Re: China Coronavirus: Here we have a young, healthy 34 year old. Coronavirus kills Chinese whistleblower doctor https://www.bbc.com/news/world-asia-china-51403795 … A Chinese doctor who tried to issue the first warnings about the deadly coronavirus outbreak has died, the… http://dlvr.it/RPXfvh "
149,,"#Thailand is estimating the tourism loss due to coronavirus will be about 1.6 billion US Dollars.
Last year 340 Chinese speaking tour guides in Thailand took care of groups of 60-70 Chinese visitors. https://bangkokjack.com/2020/02/04/billion-dollar-tourism-loss/ …pic.twitter.com/GaOniFnzug"
150,,Prime Minister Prayut Chan-o-cha on Monday threatened swift legal action against people who politicise the government's handling of the coronavirus outbreak and the ultra-fine dust pollution to stoke public fears. #BangkokPost #Thailandhttps://www.bangkokpost.com/thailand/politics/1849794/dont-politicise-outbreak-pm …
151,,Japan screening cruise ship for coronavirus | NHK WORLD-JAPAN News https://www3.nhk.or.jp/nhkworld/en/news/20200204_03/ …
152,,"Frightened Asian tourists cancel flights, stay home
The South Korean government’s advisory to its citizens to delay trips to countries and territories where the Covid-19 coronavirus has been found has resulted in numerous flight cancellations to… https://news-guru-magazine.blogspot.com/2020/02/frightened-asian-tourists-cancel.html …pic.twitter.com/Z9yymRlcol"
153,,"The government has earmarked emergency relief for domestic Mice (meetings, incentives, conferences, exhibitions) after the international segment declined by almost 50% because of the coronavirus outbreak. #BangkokPost #Businesshttps://www.bangkokpost.com/business/1855454/mice-slump-prompts-rescue-funding …"
154,,Asia-Pacific currencies (incl the THB) tumble under the weight of the coronavirus https://on.ft.com/39jPmfE 
155,,"With stricken cruise ship, Japan draws criticism over coronavirus response https://bit.ly/328U8KB  #WorldNewspic.twitter.com/MTvWE85YZG"
156,,"""Coronavirus poses risks to fragile recovery in global economy - IMF""

https://uk.investing.com/news/economy/coronavirus-poses-risks-to-fragile-recovery-in-global-economy--imf-2055025 …"
157,,Coronavirus deaths taper in Hubei province with 108 confirmed https://www.scmp.com/news/china/society/article/3051492/coronavirus-deaths-taper-hubei-108-confirmed-thursday … via @scmpnews
158,,Guide to using masks for prevention against novel coronavirus https://news.cgtn.com/news/2020-02-19/Guide-to-using-masks-for-prevention-against-novel-coronavirus-ObjNzHfTUY/index.html … via @cgtnofficial
159,,"Coronavirus 'bioweapon theory' is bogus, say 27 experts in Lancet https://news.cgtn.com/news/2020-02-19/Lancet-releases-statement-supporting-Chinese-scientists--Od24bUkvOE/index.html … via @cgtnofficial"
160,,"Airport suffers worst January in five years amid protests, coronavirus https://www.scmp.com/news/hong-kong/transport/article/3050858/coronavirus-hong-kong-airport-suffers-worst-january-five … via @scmpnews"
161,,"Many events here this month cancel due to coronavirus outbreak. Im sad but actually it's good for their safety. Take care of yourself na. We’ll wait, see you next time 
#kdppe
#marksiwat
#หัวใจศิวัช
#รอยยิ้มของชูครีม
#perthmark
#เพิร์ธมาร์ค
#thxvidpic.twitter.com/IHuaL3Fo6G"
162,,"Coronavirus is not here yet, but the Chinese panic order and shopping army must be here already. And they must be big buyers from the factories."
163,,How the Coronavirus has Affected Business in the Asia-Pacific Region https://www.chiangraitimes.com/economy-business/how-the-coronavirus-has-affected-business-in-the-asia-pacific-region/ …pic.twitter.com/3EO3gVdYYd
164,,Treasury yields fall after surge in reported coronavirus cases - https://www.cnbc.com/2020/02/13/us-bonds-treasury-yields-in-focus-after-surge-in-coronavirus-cases.html …
165,,"Dow drops more than 100 points, slips from record high as reported coronavirus cases jump - https://www.cnbc.com/2020/02/13/us-futures-point-to-lower-open-on-wall-street.html …"
166,,"China reports big rise in coronavirus deaths, WHO sees no 'tip of iceberg' https://bit.ly/3bE5WZo  #WorldNewspic.twitter.com/CmAaelcW1M"
167,,"Royal Caribbean cancels 18 cruises, warns coronavirus hit to yearly profit https://bit.ly/3bD71Ru  #WorldNewspic.twitter.com/4OzkFvpc0T"
168,,A Thai working in the United Kingdom was physically assaulted in what he claimed was a racist attack linked to the current global coronavirus outbreak. #BangkokPost #Thailandhttps://www.bangkokpost.com/thailand/general/1859664/racist-london-attack-on-thai …
169,,"Kind of insane that the frontline #Chinese medical personnel have to buy their own masks & protective equipment while fighting #coronavirus. No excuse for this, powers that be in #Beijing #China. #WuFlu #WuhanFluhttps://www.nytimes.com/2020/02/14/world/asia/china-coronavirus-doctors.html?smid=tw-nytimes&smtyp=cur …"
170,,Coronavirus Cases Appear in Five European Countries https://www.chiangraitimes.com/thailand-national-news/world-news/coronavirus-cases-appear-in-five-european-countries/ …pic.twitter.com/fn9pFZ7aGb
171,,"A Bloodbath in Wall Street, Dow Plunges over 1,000pts as Fears over Coronavirus Rise - https://www.kaohoon.com/content/343727 pic.twitter.com/WWro2fhknc"
172,,You’re Likely to Get the Coronavirus https://www.theatlantic.com/health/archive/2020/02/covid-vaccine/607000/?utm_source=feed …
173,,Coronavirus: Store Shelves Empty as Panic Buying Hits Italy https://www.infowars.com/coronavirus-store-shelves-empty-as-panic-buying-hits-italy/ …
174,,Maybe we need a coronavirus outbreak so we get quarantined. That should help the air quality!
175,,"NZ Coronavirus: patient who travelled from Iran not subject to health checks upon arrival and now they want other travellers from Iran to 'self-isolate' after the fact - this is a failure, reflecting a weak governance and the unrealistic PC world of NZ 
 https://www.stuff.co.nz/national/health/119913458/coronavirus-new-zealand-patient-not-subject-to-health-checks-upon-landing-at-auckland-airport …"
176,,Here's how Thailand would respond to a 'worst case' coronavirus scenario - https://bit.ly/37PQFBU pic.twitter.com/FIU4aWtXs6
177,,Gold surges 1.5% on growing coronavirus concerns - https://www.cnbc.com/2020/02/21/gold-markets-coronavirus-chinese-stimulus-in-focus.html …
178,,30-year Treasury yield drops to all-time low of 1.89% amid coronavirus fears - https://www.cnbc.com/2020/02/21/us-bonds-treasury-yields-in-focus-as-coronavirus-concerns-grow.html …
