,Positive,Neutral,Negative
99,"""Dr. Redfield... You have the existing authority. Will you commit right now to using the authority that you have vested in you, under law, ... to provide for coronavirus testing [without cost] for every American regardless of insurance coverage?""

""My answer is yes."" https://twitter.com/RepKatiePorter/status/1238147835859779584 …","Most of Apple's stores in China will remain closed next week due to coronavirus
https://cnet.co/2H3EGWv ","Two weeks later, first Santa Clara County coronavirus victim still isolated https://bayareane.ws/2UU08FA  via @mercnews @JohnWoolfolk1"
100,"Loving this creative way to take care of their employees, their community, & their business. Well done, @canlis #coronavirus 
Bay Area restaurants: your turn!
@hooleil @lucchesihttps://twitter.com/canlis/status/1238152539909967872 …","Seems to be mostly from one cruise ship: https://www.bloomberg.com/news/articles/2020-02-07/cruise-ship-virus-infection-tally-grows-to-biggest-outside-china … ""Japan confirmed 41 more cases of the new coronavirus aboard a quarantined cruise ship""",Facebook cancels San Francisco summit on coronavirus fears (Reuters: Money News) http://dlvr.it/RQ3vw0 
101,"#UniteLR Update—@CARKW understands water is critical in the fight against the spread of #coronavirus. To ensure everyone is able to practice good hygiene, CAW suspended water shut-offs and worked over the weekend to restore service to all. More: http://www.carkw.com/covid19/ pic.twitter.com/kjM8oXbAHV",Apple Stores in China won’t reopen as planned due to coronavirus (MacDailyNews/MacDailyNews) http://dlvr.it/RPcGdr ,"When Xi Jinping staked his claim as ""leader for life,"" he did so on the promise that he would ensure the health, wealth and security of China’s 1.4 billion people. His government’s failed response to the #coronavirus has given lie to that social contract https://bit.ly/39GL2Y9 "
102,"llᐈ Cleaning Services in Response to Coronavirus | Maid In Allen - To clean your home and workplace to reduce the spread of COVID-19  In this way, we can make sure we have everything In this way, we can make sure. https://maidinallentx.com/cleaning-services-in-response-to-coronavirus/ …",Parasite + The host = coronavirus,"Coronavirus Slows iPhone Production; Apple Will Miss Quarterly Sales (John Koetsier, Contributor/Forbes.com Market News) http://dlvr.it/RQDcGX "
103,Brings up many important considerations. I would add that China must end all wildlife meat markets such as the one in Wuhan suspected of being the source of the animal to human transmission of the novel Coronavirus.,Maybe I should go to Kyoto in March. Just saw a news saying the city is empty because of cancellation by coronavirus…,everyone asking for more info like ????? use your braincells THIS IS WRONG AND ITS DANGEROUS BECAUSE OF THAT FUCKN CORONAVIRUS https://twitter.com/LiveNation_LA/status/1232440140947021825 …
104,Seemed like a good time to take up mocktails since it can’t be healthful to drink alcohol every day of this shelter in place! #pandemic #ShelterInPlace #ShelterAtHome #CoronaVirus pic.twitter.com/NEfmhkoPMY,"Hey... Your Asian neighbor who you know for years and hasn't been to China... DOESN'T HAVE #CORONAVIRUS they are not BORN WITH IT!!!!

You racist, xenophobic fuck!!!

HAVE A NICE DAY!!!",#SanFrancisco declares state of emergency to help prepare for an #outbreak of #coronavirus; there are currently no confirmed cases in the city  https://twitter.com/LANow/status/1232450204386779137 …
105,"Reviewing stage 3 coronavirus tax relief as proposed by GOP Senate (so, pre-negotiation)",What Questions Should Global Health Policy Makers Be Asking About The Novel Coronavirus? | Health Affairs https://www.healthaffairs.org/do/10.1377/hblog20200203.393483/full/#.XjoC0y8NcmI.twitter … This policy made by the WHO will allow more help on the ground. Hopefully China will be more transparent and keep this humane. @DrGHealthPolic1,The problem is that the corona virus deaths will be in addition to the “normal” flu virus deaths and may even “piggyback” on the flu virus both infecting people at the same time!
106,"A question I just asked, in lieu of church being cancelled: 

“Do Goldfish count as unleavened bread?” 

Thank you coronavirus for prompting these philosophical questions",Clave reyyy coronavirus,Funny to hear this when POTUS appoints a politician (Pence) to be the coronavirus czar and none of you have a courage to stand up to him.
107,"Zhu was telling everyone here that masks didn't work, she failed at everything including being Asian.","#Sanfrancisco, #coronavirus, #exposure,  I  am exposing myself to the corona virus, I  like to take the proactive approach https://www.instagram.com/p/B8FXOdEp5S4/?igshid=fdnp9hrrj8oh …","AFRAID WE'LL ALL DIE IN ARGENTINA...  with coronavirus. Only way to end crimes of Kirchner. Proof of Crimes in KIRCHNER ARGENTINE STATE NARCO CRIMINAL HOMICIDAL, Schemes of False Causas, concealed by Supreme Court, Cassation, Criminal Justice,2007/20  https://mega.nz/#!BF42DayI!jTRTyrSwNZuRTG_v7xTc3dpy9clLUHtX_52n21I-Tcc …"
108,"Biden trashes Trump over coronavirus response: 'Step up and do your job, Mr. President' https://www.nbcnews.com/politics/2020-election/biden-trashes-trump-over-coronavirus-response-step-do-your-job-n1165186 …","#UPDATE: The #Arkansas Department of Health confirms the Arkansas person who was under investigation for novel #coronavirus has tested negative.
https://bit.ly/390Xp0D pic.twitter.com/lcwBPBqqmW","Our #COVID19 tracker provides a global, interactive map of which countries have cases and deaths, and how many. 
 
It's been updated today with official @WHO #coronavirus reports. https://www.kff.org/global-health-policy/fact-sheet/coronavirus-tracker/ …"
109,Report: Trump Dropped the Ball on Coronavirus Testing Because He Only Wanted Good News https://www.rollingstone.com/politics/politics-news/trump-coronavirus-testing-reelection-966872/ … via @RollingStone,"@""Why the “Coronavirus” (2019-nCoV) is going to significantly disrupt global growth ""https://www.linkedin.com/pulse/why-coronavirus-2019-ncov-going-significantly-disrupt-stephen-kawaja … on @LinkedIn",Already bracing myself for the antivirus/coronavirus infosec “jokes” during RSA.
110,"If a natural cure for coronavirus is ever proven, this Chinese Medicine herb is likely to be the one (and no, we don’t sell it) – http://NaturalNews.com https://www.naturalnews.com/2020-03-17-natural-cure-for-coronavirus-chinese-medicine-herb-artemisinin-sweet-wormwood.html …",*Coronavirus attack*,"""Microsoft Issues Financial Warning Because of Coronavirus"" by BY KAREN WEISE via #NYThttps://ift.tt/32w1LuK "
111,,Coronavirus: China set to open speed-built hospital https://www.bbc.co.uk/news/world-asia-51349154 …,"Chineke ekwekwala ihe ojö!!! Before you know now, it will be breaking new!!! *camrina virus neighbor to Corona virus*... Wazrili-goininon???"
112,,"Like everyone else with a Twitter account, I am an expert on the #coronavirus. For a sizable donation, I will gladly espouse my unique wisdom on this global epidemic.","A graph shows the coronavirus dominating SARS, MERS and Ebola when it comes to total infections, but it doesn't tell the whole story. https://www.5newsonline.com/article/news/verify/verify-viral-coronavirus-vs-sars-mers-ebola-swine-flu-graphic-is-accurate-but-leaves-out-important-context/507-25724e92-3c04-4e3c-b4fe-8d401dfe8af7 …"
113,,imagine if kevin bacon got coronavirus.,"U.S. spy agencies monitor coronavirus spread, concerns about India... https://reut.rs/2PuFMPC "
114,,Still think this disease is not dangerous and under control? There is no way to trust the real statistics from China #coronavirus #malaysiapic.twitter.com/3PpwkR2KRr,"yes, and if you have problems with NiH credibility because it doesn't fit your narrative, you'll have real problems because that same NiH is handling quarantines now for the coronavirus  < one way elected officials can become hazardous to public health"
115,,"Epidemiology and Clinical Presentations of the Four Human #Coronavirus 229E, HKU1, NL63, and OC43 Detected over 3 Years Using a Novel Multiplex Real-Time PCR Method https://jcm.asm.org/content/48/8/2940 …",RT @nighealthwatch: Funding epidemic preparedness is no longer an option. It is a necessity. #COVID19 has shown epidemics do happen and can…
116,,Info #coronavirus https://twitter.com/SAVE_oficial/status/1224403996909211651 …,"Help slow the spread of #COVID19 and identify at risk cases sooner by self-reporting your symptoms daily, even if y… https://t.co/6eewdtatVy"
117,,"Coronavirus outbreak: SF hospital caring for 2 patients diagnosed in San Benito County, officials say https://abc7news.com/health/san-francisco-hospital-caring-for-2-patients-with-coronavirus/5900896/ … via @abc7newsbayarea","RT @UN_Women: In some countries, #COVID19 infections among female health workers are 2x that of their male counterparts. 

Governments must…"
118,,Egypt records First Confirmed Case of Coronavirus in Africa https://www.ariyabase.com.ng/egypt-records-first-confirmed-case-of-coronavirus-in-africa/ …pic.twitter.com/FRXMhN4Z3N,RT @ThatTimWalker: This will be an odd chapter in The Decline and Fall of Great Britain. In the same month Michael Gove committed the count…
119,,Hear this powerful word about what God is saying regarding the Coronavirus! https://youtu.be/EuIOrjhAC-Y  via @YouTube,RT @tmprowell: The US has performed its first double lung transplant for lung damage caused by #COVID19. The recipient is a 20 yr old woman…
120,,Coronavirus 'could infect SIXTY PER CENT of the global population' https://mol.im/a/7990511  via @MailOnline,"RT @electroboyusa: Why do Republicans think we're EMERGING from the #COVID19 epidemic when these are the facts?

116,831 dead 
2,117,027 ca…"
121,,Don't Let Coronavirus Fears Keep You From Supporting Chinese Restaurants https://skillet.lifehacker.com/dont-let-coronavirus-fears-keep-you-from-supporting-chi-1841606402?utm_medium=sharefromsite&utm_source=lhskillet_twitter … via @@SkilletLH,RT @DCBMEP: Does the public have any idea of these dangerous associations BLM has?
122,,"Flick it off with one of those air safety cards. At this point in time, he probably doesn’t have the coronavirus, but who knows what else he might have! No one reads those cards anyway, so put the card back in the seat pocket, and hope no one touches it for nine days.","RT @mollysmcdonough: @parscale 💥 WARNING TO TRUMPISTS 💥

You have to sign a waiver to get in! 

If you get sick from #COVID19 
you are ON Y…"
123,,when your akko figurine you shipped from china gives you coronavirus,RT @RadioFreeTom: I guess it's not a hoax
124,,"FFS people, we haven't had even a single case of #Coronavirus in San Francisco and yet businesses are suffering. https://sf.eater.com/2020/2/12/21135104/novel-coronavirus-chinatown-oakland-san-francisco …","RT @MelissaFleming: ...Including outrageous misinformation claiming people with albinism are to blame for #COVID19 

Standing with them in…"
125,,You and @boxmining have been providing more helpful coverage of the #coronavirus than the msm,"RT @Refinitiv: Old Crime, New Tricks? Phil Cotter, Managing Dir. of #Refinitiv's Risk Business, discusses money laundering &amp; the evolving t…"
126,,"'It's Coming': CDC Director Warns Coronavirus To Become Widespread Throughout United States, 'Probably Beyond 2020' | Zero Hedge https://www.zerohedge.com/health/its-coming-cdc-director-warns-coronavirus-become-widespread-throughout-united-states …","RT @YourAnonNews: Yesterday, there were 140,927 new cases of #COVID19 and 4,603 additional deaths were reported in the past 24 hours.

This…"
127,,"Roses are red, IBM is Big Blue. It's out of RSA Conference after coronavirus review https://www.theregister.co.uk/2020/02/14/ibm_rsa_cancel/ … via @theregister",RT @JAMA_current: Latin America and its global partners toil to procure medical supplies as #COVID19 pushes the region to its limit https:/…
128,,Health officials distribute iPhones to cruise ship hit with coronavirus (David Pierini/Cult of Mac) http://dlvr.it/RQ3vw4 ,"RT @LotusOak2: Inflammatory Syndrome Affecting Children: #Kawasaki Disease, #COVID19... or Something Else?

https://t.co/S9PurMumhE

#KD #L…"
129,,"Roses are red, IBM is Big Blue. It's out of RSA Conference after coronavirus review https://www.theregister.co.uk/2020/02/14/ibm_rsa_cancel/ …",RT @NEJM: Eighteen brains of patients who died 0 to 32 days after the onset of symptoms of SARS-CoV-2 infection showed hypoxic–ischemic cha…
130,,Expedia suggests it will be able to maintain bookings in the face of slowing global travel demand caused by the spreading coronavirus https://trib.al/3mboWnZ ,"What is happening in the world, people using Covid19, BLM protests and Brexit to have a pop at anyones political st… https://t.co/NoifieDNe4"
131,,Asian student who coughed in class sent to dean's office. #Coronavirus https://asamnews.com/2020/02/13/asian-american-student-sent-out-of-class-for-coughing-blames-coronavirus-hysteria/ …,An antibody recovered from a survivor of the SARS epidemic in the early 2000s has revealed a potential vulnerabilit… https://t.co/KSTWv8vCFP
132,,Apple says will not meet revenue guidance for March quarter due to coronavirus outbreak (Reuters: Company News) http://dlvr.it/RQDcJB ,"RT @yourICM: #COVID19 induced #AKI in critically ills with #SARSCoV2 #Coronavirus infection: several mechanisms possibly involved, prevalen…"
133,,"NEW CASES OF CORONAVIRUS CONFIRMED IN AZEROTH!

HERE IS THE PROOF I WAS SENT! pic.twitter.com/z6enS821zd",RT @thisfeedsme: NC's first + only #COVID19 pediatric death was 8-year-old Aurea Yolotzin Soto Morales. I spoke to her family + several Lat…
134,,"The coronavirus effects on tech have been long rumored, and we are hearing from public companies first due to their reporting requirements. This is a big topic in many startup boardrooms, but the full impact won’t hit the press for sometime, if ever. https://twitter.com/arrington/status/1229524403601338369 …","RT @Carnegie_Europe: The #COVID19 emergency spirit of consensus in many EU countries is not fracturing completely.

But acute political dif…"
135,,The United Arab Emirates banned flights to all cities in Iran with the exception of Tehran in an effort to prevent the spread of coronavirus https://trib.al/GFpKJ7Z ,"Unfortunately for the local paranoiac community including myself, there will be no on-demand testing for the coronavirus at the new SF facility, but test turnaround time will go down to one or two days from seven. https://sfist.com/2020/03/02/anticipating-first-local-cases-sf-opens-public-coronavirus-testing-lab/ …"
136,,"Coronavirus: Communities Must Prepare Now

https://www.mercurynews.com/2020/02/25/coronavirus-how-to-prepare-for-likely-outbreak/ …
#FBRParty #BlueWave2020 #RESISTANCE #VoteBlue2020 #TheResistance #Uniteblue #BlueWave #VetsResistSquadron",Twitter to suspend 'non-critical' travel over coronavirus concerns https://on.mktw.net/2TcbtiI 
137,,"On at 4:06pm: Senators warn Trump not to blow coronavirus response. @chipfranklin & @TomHowellJr discuss the implications of this.

Listen live: http://kgoradio.com 
: Andrew Harnik/AP Imagespic.twitter.com/fTdo6RMZqI",Raise your hand if you don't believe what governments and the news are telling you regarding #coronavirususa #coronavirusus #Coronavirustruth #coronavirus -- I fully believe this virus was man-made in a laboratory as a bioweapon.
138,,Note high mortality rate per WHO for coronavirus! https://twitter.com/NBCPolitics/status/1232429428954759168 …,"As you may have heard, stock markets worldwide are suffering their worst week since the global financial crisis of 2008, due to fears over the coronavirus outbreak. Dow futures drop more than 300 points, indicating another rough week ahead for Wall Street https://www.cnbc.com/2020/03/01/awaiting-us-stock-futures-open-at-6-pm-after-wall-streets-worst-week-since-2008.html …"
139,,Moderna ships mRNA vaccine against novel coronavirus (mRNA-1273) to the NIH to be used in the planned Phase 1 study in the U.S. https://www.businesswire.com/news/home/20200224005955/en/Moderna-Ships-mRNA-Vaccine-Coronavirus-mRNA-1273-Phase …,"The coronavirus so far has killed 500 more people than died in 911. Wow. It is all happening so quickly. I just don't want anyone else to die, this is horrible. #coronavirus"
140,,Some Apple retail stores re-open in China after coronavirus closings https://cnb.cx/2Pp66uu ,#coronavirusupdates Italy is closing all schools and universities nationwide until March 15 to contain the coronavirus outbreak https://www.businessinsider.com/italy-closing-schools-nationwide-amid-coronavirus-outbreak-2020-3?utmSource=twitter&utmContent=referral&utmTerm=topbar&referrer=twitter … via @businessinsider
141,,@realDonaldTrump be careful of the coronavirus,"It may be true that Coronavirus started because Chinese people ate infected bat, but millions of Americans die from Obesity every year and they still order pizza delivery."
142,,"Chinese scientists desperately researching coronavirus discover that it shares human cell binding site with HIV, Ebola — RT World News https://www.rt.com/news/481837-coronavirus-research-cell-binding-hiv/ …","How founders can prepare for the tail risk of #COVID-19 - AgFunderNews http://bit.ly/32PXKkV  
#CoronaVirus #AgFunder #AgFunderNewspic.twitter.com/9AjGP9xqJv"
143,,"I was mad about the possibility of dying from coronavirus, but Trump said he’d give me like $30 so nbd https://twitter.com/damianpaletta/status/1233486006474674176 …","Coronavirus death toll raises as the first death in Placer County, California occurred today.

https://www.kgoradio.com/?p=1166726 "
144,,The coronavirus just killed a 29-year-old doctor who postponed his wedding to fight the disease http://sg.newsrepublic.net/s/hdFhjZYcS ,If we had #MedicareForAll we wouldn't have to worry about people not getting tested/treated for #coronavirus because they couldn't afford it. https://twitter.com/ReedAbelson/status/1234980068532768771 …
145,,Coronavirus is the last thing the global smartphone industry needs (Amrita Khalid/Quartz) http://dlvr.it/RQWCcp ,"You can’t/shouldn’t be concerned about the coronavirus if you fucking raw

I said what I said"
146,,"Coronavirus outbreak edges closer to pandemic https://www.washingtonpost.com/health/coronavirus-outbreak-edges-closer-to-pandemic/2020/02/21/03afafc0-5429-11ea-9e47-59804be1dcfb_story.html …

""“The window of opportunity is still there, but the window of opportunity is narrowing,” WHO Director General Tedros Adhanom Ghebreyesus said on Friday.
 
I thought you said China did a good job? Fucking hack.",Coronavirus is coming for your workout classes and I'm very concerned about how the Marina is going to handle it.
147,,See more downside into March with coronavirus fears impeding production - companies are likely to lower guidance for next quarter. Will sell premium above for upside short-covering.,the people stockpiling for the corona virus like it’s armageddon approaching are gonna be the first to die when the actual apocalypse happens
148,,"On at 4:05pm: @SingletaryM of the @washingtonpost joins @MFinney to discuss travel insurance and the coronavirus.

Listen live: http://kgoradio.com pic.twitter.com/JLYEzC3ttA","This #coronavirus emergency response package gives our government the resources it needs to confront this public health crisis – without stealing a dime from other critical initiatives. With my signature, it goes to the President’s desk. pic.twitter.com/stxLFdcdcj"
149,,Anybody know what happened to @boxmining? That dude was doing awesome #coronavirus updates and then straight up disappeared.,The expression “bat-shit crazy” makes so much more sense now #coronavirus #COVID19
150,,Just got my coronavirus in from amazon prime .com,"Just watching #WorldNewsTonight they spent 17m talking about how bad coronavirus is and how bad it is affecting the economy. Hidden in there, one sentence about dramatic drop of Chinese cases. #FakeNews"
151,,"VP Pence appointed head of the Coronavirus Task Force. Can you imagine Biden ever having to do something like that while he was VP?....Trump says coronavirus vaccine coming along 'rapidly,' risk to US 'remains very low'

https://www.foxnews.com/politics/trump-coronavirus-primetime-address …","Investors reacted strongly as oil prices and coronavirus worries disrupted markets. Chief Cross-Asset Strategist Andrew Sheets and Chief U.S. Economist Ellen Zentner debate what’s next.
 https://www.morganstanley.com/ideas/thoughts-on-the-market-special-episode?workspace_id=391319&suggested_content_id=1345873&social_network=twitter&cid=whmt-smfa-totmspe-4495&ET_MID=noloc …"
152,,"Something I think a lot would pay for: ""Coronavirus preparation kit"" 

~200-500 dollars, gives you food reserves and essentials in a box to last you a month or so","And cruise ship to must be dirt cheap. 

Of course,  getting Coronavirus  could be a bit of trouble."
153,,"https://apple.news/Au5O2SjCoQLWPjew_j5KOFQ …

I am not buying news coming out of #China on #coronavirus. 

This is a difference between #communism and Scandanavian #socialism. #FreePress",The main thing that this coronavirus outbreak has taught me is that some of y’all are NASTY. #gaspumpshavealwaysbeenDIRTY #washyourhandsyearround #cleanyourhousetoo #somuchhandsanitizeralways 
154,,PM Abe asks all of Japan schools to close over coronavirus https://reut.rs/2vc616z ,Millennials have engineered a corona virus to kill the Boomer industry
155,,"Ojalá!!! Israeli scientists: 'In a few weeks, we will have coronavirus vaccine' - The Jerusalem Post https://www.jpost.com/HEALTH-SCIENCE/Israeli-scientists-In-three-weeks-we-will-have-coronavirus-vaccine-619101 …",Taking the Pulse of Commercial Real Estate in the Face of a Coronavirus Outbreak http://blog.naiop.org/2020/03/taking-the-pulse-of-commercial-real-estate-in-the-face-of-a-coronavirus-outbreak/ … via @NAIOP
156,,Don't buy China's story: The coronavirus may have leaked from a lab https://nypost.com/2020/02/22/dont-buy-chinas-story-the-coronavirus-may-have-leaked-from-a-lab/?utm_source=twitter_sitebuttons&utm_medium=site%20buttons&utm_campaign=site%20buttons … via @nypost @Resacaa,corona virus said my name means crown and im coming for it
157,,"RT @brexit_sham: Astounding footage of @BorisJohnson 'cramming covid' on his return from a two week Kent jolly with Carrie Symonds. 

Crimi…","Inovio Pharmaceuticals’s meteoric rise on the back of hype for a coronavirus vaccine drew the ire of noted short-seller Citron Research, which called the claim ""ludicrous and dangerous"" https://trib.al/8jWpFqQ "
158,,"Most likely, the assumptions behind your #data science model or the patterns in your data did not survive the… https://t.co/cpg4GBogUw",Uff coronavirus was found dead https://twitter.com/DamonUnofficial/status/1239335469894287360 …pic.twitter.com/YaMK8paW8o
159,,"RT @threadreaderapp: @albertabats Hello, you can read it here: @KJPatriquin: I made a basic presentation explaining why #bats are NOT to bl…","Corona Virus attack really bad elders, so that's why I remove a couple of years of my face @ Fort Greene, Brooklyn https://www.instagram.com/p/B9xgfZ4nF-p/?igshid=1p63vcgf79n9a …"
160,,RT @FRubinoMD: #COVID19 and #diabetes: the clash of two pandemics. Our piece just out @NEJM about new-onset diabetes and possible diabetoge…,#LackOfLeadership #DerelictionOfDuty #HowManyWillDie because Trump and Murdoch and Hannity decided to call Coronavirus a hoax and delay preparedness #TrumpPandemichttps://twitter.com/MyWchu/status/1240786492278157319 …
161,,RT @NnamdiFans: The new shiny Chinese face of #TheZooCalledNigeria after Jubril had died of the #COVID19 along with Abba Kyari. @MaziNnamdi…,"Restaurant group projects $225B loss, up to 7M lost jobs due to coronavirus https://news.yahoo.com/restaurant-group-projects-225b-loss-211142229.html …"
162,,"RT @atiku: Even as restrictions are being lifted, Nigerians cannot afford to be complacent about #COVID19. Despite our best efforts, we con…",I remember I was already sick of hearing about the Corona virus at the end of january.
163,,"RT @JohnWest_JAWS: Hancock STATES that they knew and DISCUSSED at the start of January.

So, everyone saying otherwise is talking bollox ht…","The show will go on — in-person or virtual, we're planning for both. The CMX team has thought long and hard about how to adapt plans for Summit 2020 in October given the coronavirus pandemic. 1/3"
164,,The latest The Fetalgroup Daily! https://t.co/G3VE6Fsuah Thanks to @Minsa_Peru #covid19 #mitocondrias,"Yes, other strains of coronavirus have been around for a while. This is completely new strain never before introduced to humans."
165,,RT @JoeThompsonMD: Arkansas’s record one-day increase of 731 new #COVID19 cases underscores the need for responsible behavior. If you walk…,Coronavirus infection rate drops to: 0 https://twitter.com/Lautaro_zap/status/1239716716126576641 …
166,,"@ChKlaue @Athlete365 Mr. KLAUE

This ##DonatoSansone ¿Artist? 
The International Olympic Committee HIRED to be in C… https://t.co/UBxaBSStD3",how could I be scared of the corona virus when I’ve ate at Waffle House in west Memphis..
167,,"RT @HotMenFantasy: RT if gusto niyo MORE #Kantot #Sex #Malibog #Pinoy #Daddy Videos! FOLLOW, COMMENT &amp; RT, more vids to come! #alterpinoy #…",Downplaying To Severe Concern: Fox Hosts And Pundits Evolving Tone On Coronavirus https://www.mediaite.com/tv/supercut-before-pro-trump-pundits-took-coronavirus-seriously-they-downplayed-the-crisis/ …
