,Positive,Neutral,Negative
52,#SantaFe safe del #Coronavirus,Corona virus with a little spritz of lime disease is a perfect way to die on a hot summer day,"“Culprit in Mystery Pneumonia in China Found?
New coronavirus strain sequenced from patient samples, the Wall Street Journal reports” https://buff.ly/36Eb39p pic.twitter.com/K7xj1z6zck"
53,Everyone needs tiny Trump hands to lower their chances of spreading Coronavirus,When someone in NW Arkansas gets the Coronavirus mom steps up quick! ,Mystery China coronavirus may have just hit an ominous milestone https://www.slashgear.com/mystery-china-coronavirus-may-have-just-hit-an-ominous-milestone-15606918/ …pic.twitter.com/NQYKdD621L
54,"“When we got to Starbucks, employees would not let us come in. While we waited for r lattes, [they] took r temperatures & recorded our info” US couple in China ... under coronavirus quarantine: ""It’s not easy to maintain sanity, even w/ this self-care."" https://www.huffpost.com/entry/coronavirus-covid19-life-china-precautions_n_5e4eaa73c5b6df1e8be3d4d7?ncid=engmodushpmg00000004 …",Still waiting for @GeorgeMasonU #gmu to reply regarding Coronavirus. Been a while!,First case of mysterious coronavirus confirmed outside of China https://www.slashgear.com/first-case-of-mysterious-coronavirus-confirmed-outside-of-china-14606788/ …pic.twitter.com/VcJqmjyBRR
55,Trump admin lacks credibility to calm markets on coronavirus news https://www.msnbc.com/rachel-maddow/watch/trump-admin-lacks-credibility-to-calm-markets-on-coronavirus-news-79444549924 … via @msnbc BigOrange is full of credibility cracks. All of WH Admin is,is that what coronavirus does? Does it make your ass flat?,New Coronavirus May be Cause of Illness Outbreak in China http://dlvr.it/RN2Xt8 pic.twitter.com/ZtyL9N72ck
56,Let's hope #Pence's reading and following important instructions have gotten better.  #coronavirus #CoronavirusOutbreak #Trumppic.twitter.com/BpKVTelYMK,"what about the Coronavirus? International travel seems to be a little dangerous at the moment, I don't see it getting better in the next few weeks?","China SARS-like coronavirus spreads to Japan as epidemic fears grow

https://www.dailystar.co.uk/news/world-news/breaking-sars-like-coronavirus-spreads-21290545?utm_source=twitter.com&utm_medium=social&utm_campaign=sharebar …
#China #Japan #Sars #Outbreak"
57,"#CDC says first native #coronavirus case found in Northern #California. #COVID2019. In order to have calm, we need #information. We must also be vigilant against #discrimination. #COVID19Info @lihanlihan @chrismit94 @joannebryantsfhttps://www.washingtonpost.com/world/asia_pacific/coronavirus-china-live-updates/2020/02/26/f889693a-580e-11ea-9000-f3cffee23036_story.html?utm_campaign=wp_news_alert_revere&utm_medium=email&utm_source=alert&wpisrc=al_news__alert-hse--alert-national&wpmk=1 …",This letter from the CDC about the coronavirus in Carson is obviously fake. The address for LA Counts public health is wrong.. ,Three U.S. Airports to Check Passengers for a Deadly Chinese Coronavirus https://www.nytimes.com/2020/01/17/health/china-coronavirus-airport-screening.html?action=click&module=Well&pgtype=Homepage&section=Health …
58,"Covid-19 is a coronavirus. The article details scientific knowledge of coronavirus transmission & inactivation. For the sake of myself and those in the community around me, I’ll employ the findings, as the statistical likelihood is that will be more effective than ignoring them.",#Coronavirus - #Israel: “We were able to develop a vaccine against the disease” @OfirAkunis @most_il @WHO #AskWHO #COVID19 @ErelMargalit #MIGAL #GalileeResearchInstitute,"SFO will start screening passengers arriving from central China for a deadly coronavirus that's sickened over 40 people, JetBlue announced they'll no longer serve OAK, and various Women's Marches are scheduled throughout the Bay Area today. https://sfist.com/2020/01/18/saturday-links-sfo-starts-screening-for-deadly-chinese-coronavirus/ …"
59,Frankly I'd prefer if the coronavirus task force was lead by someone who believes in science,What in the holy heck is going on @RepFrenchHill @JohnBoozman @SenTomCotton? Why is this administration muzzling doctors fighting #COVID19?,"China reported four more cases of pneumonia believed to be caused by a new coronavirus strain, causing rising concern globally that a disease health officials do not yet fully understand could spread during a key holiday period - Reuters"
60,"RT @sanchezcastejon: Spain is coleader in initiatives such as the ACT-Accelerator to achieve equitable access to vaccines, treatments and d…","#COVID19 might have you panicking about your health and your investments, but should you be? Straight talk Wednesday at 11:30! Set your reminder: http://bit.ly/GRFTFSCorona","Patient in #Japan confirmed as having new virus from #China
https://apnews.com/3845a158612c6cc556c8cb7b91f5d078 …
#coronavirus #outbreak"
61,RT @NEJM: Correspondence: Brain Autopsy Series in Patients with Covid-19 #COVID19 #SARSCoV2,"This could go down very poorly for Japan. If #covid19 infects more of the global population, how many countries will be able to participate in the summer games? ","The epicenter of the Coronavirus (SARS-CoV) outbreak is concentrated in the Hubei Province, Wuhan, the location of China's most advanced virology lab -  an accidental release of the virus is likely.  https://summit.news/2020/01/23/chinese-lab-that-studies-worlds-most-dangerous-pathogens-is-based-in-wuhan/ … #Health #Biosafety #Pathology #ViralEngineering"
62,"RT @MileyCyrus: Spain, you united in solidarity with Black Lives Matter in the US. We must keep standing together to tackle #COVID19 and it…",Happening Now: San Mateo Co. Office of Education is meeting with health dept. and county school districts on how to prepare in the event that #coronavirus spreads through San Mateo County. Update on @abc7newsbayarea at 11AM. #BayArea #health #COVID19 ,Coronavirus live updates: China’s leader warns of ‘accelerating spread’ of virus https://www.washingtonpost.com/world/coronavirus-china-live-updates/2020/01/25/0ca57a5e-3ed7-11ea-afe2-090eb37b60b1_story.html …
63,"RT @Fmohnigeria: The spread of #COVID19 in various parts of the country has led to several deaths.

Watch &amp; share this video of Oba of Eleg…",Noting all four Little Rock stations dropped the live presser on #COVID19. Maybe someone ought to lodge a complaint to an FCC Public File. Watch it online here: http://YouTube.com/watch?v=i6zmlgiKLDE #arpx,"Why are people making joke about coronavirus are y'all stupid or what, it's not funny"
64,"RT @rebecasrz: Miley I get you girl, our president is hot, but he is in a serious relationship with our VP The Ponytails, so please, back o…",Arkansas has sent another sample to the @CDCgov for #COVID19 testing. This is the second time. No confirmed cases in the state at this time. ,All governments of ALL countries should be VERY concerned about this coronavirus that appears to be spreading all over from China. This will reach millions of people within months and cause untold misery & suffering. Come on get a grip!! #coronavirus
65,RT @ArkansasJacob: French Hill thinks these UAMS doctors are acting like spoiled children on a woke-bender. How insulting. #arpx #BLM #COVI…,We're starting to get calls from other hospitals re: resources for preparing for/managing #covid19. My @UCSFHospitals quality/infection colleagues keep this website of resources for patients/providers/systems constantly updated: http://bit.ly/32C3WwT Thx Deb Yokoe &amp; team @ucsf,"AP

Stock Mkts Slide as Coronavirus Virus Spread in-and-beyond China, the World’s 2nd-Largest Economy

Economic harm anticipated

Six have died, 291 infected in China; Coronavirus has spread to US, Thailand, Japan, So Korea

https://apnews.com/f85b4d3a7093f5cd2bdfcd1ab21fa710 …
#BlueWave #RESISTANCE #VoteBlue"
66,RT @WesElyMD: #COVID19 Management: Our take on best ways to adapt Evidence Based Care via #A2Fbundle for world’s sickest 🦠 ICU patients to…,Click on this link to watch the interview @nancyilloh had with @ekemma &amp; @johnsonchukwue on the recent #COVID19 report in Nigeria and the Govt Preparedness. #MoneylinewithNancy: First case of #Coronavirus disease (COVID-19) in La... https://youtu.be/p58BuVoj_xs via @YouTube,The first case of #coronavirus from #China has been reported in the US--in Washington State. @jbellnews and I will talk to an #infectiousdisease expert from @ucdavis at 5:20PM @KCBSRadio about the threat to public health
67,"1/3 of the state are tenants
Small businesses are closing for good
Another coronavirus wave
Social injustice protes… https://t.co/oknp2D6OQY",How do you prepare for the #coronavirus? Are we on the verge of a universal #flu vaccine? Get answers to these questions and more in our latest blog post! https://www.pmd.com/blog/post/health-care-week-in-review-how-to-prepare-your-home-for-coronavirus-walmart-introduces-low-price-health-care-clinics-one-percent-of-people-account-for-twenty-two-percent-of-total-healthcare-spendin #healthcare #covid19 #walmart,Corona virus outfit
68,"RT @Ironhorse76: Let's get this show on the road!  FOLLOW ALL WHO: 

LIKE 
RT
COMMENT 

Nov will soon be upon us &amp; the #OrangeShitGibbon mu…","$BCRX So I'm keeping faith, and hoping for an enormous COVID19-related squeeze. Mileage may and should differ.","As coronavirus sparks new interest in Plague Inc., dev warns it's 'not a scientific model' https://buff.ly/2RQNqnT pic.twitter.com/PhoFl4Pl7i"
69,RT @UN_SPExperts: States must protect children's rights &amp; take urgent action to avoid a spike in #ChildLabour due to #COVID19. Economic sho…,People are asking for a download link so here is this Pastebin of the Covid19 RNA that I found online: ,The one year I don’t get my flu shot the corona virus is in the U.S. my bad luck is stellar at this point
70,"RT @GlblCtznImpact: Thank you 💙 @mileycyrus 💙 for calling on world leaders to unite &amp; commit billions of dollars to make testing, treatment…",Equine coronavirus-associated colitis in horses: A retrospective study https://www.sciencedirect.com/science/article/pii/S0737080619306550 …,We want to correct any rumors: we have zero confirmed coronavirus cases at this time in SF.  Please get emerging info from https://cdc.gov/coronavirus/2019-ncov/summary.html …
71,"RT @UNICEF: Singing 🎤, filming 🎥 and learning 📖 

This is how nine-year-old Ria stays connected and healthy during New York's #COVID19 lock…",China travel ban? WHO warns NEW coronavirus linked to lethal SARS bug could be behind Chinese pneumonia flare-up https://www.rt.com/news/477777-chinese-pneumonia-coronavirus-sars/ … #,Google Is Temporarily Shutting Down All China Offices Due To Coronavirus Outbreak (Slashdot) http://dlvr.it/RP17P0 
72,"RT @ggonzzalezz: Well said, Jean-Philippe. #COVID19 offers the opportunity for a reinvigorated multilateralism, where bodies such as @OIEAn…",New #coronavirus in China https://twitter.com/MRC_Outbreak/status/1218175738337284096 …,"Tears, fear and panic grip China as coronavirus spreads http://a.msn.com/05/en-us/BBZpOyX?ocid=st2 …"
73,RT @usairforce: Welcome home! 389th Fighter Squadron Amn returned from a deployment that got extended by 2 months due to #COVID19. They fle…,"#SFO will begin screening #passengers for the #coronavirus on Saturday when the first direct flight arrives from #Wuhan. 
Some passengers arriving from #Beijing say they had their temperature checked before boarding their flights to the #USA.
 #China
https://abc7ne.ws/3ahULFg pic.twitter.com/N2R6E2otOu",Tim Cook said Apple has some suppliers in the Wuhan area of China and is working with them to mitigate any impact from the coronavirus outbreak https://trib.al/fBioJ4c 
74,"RT @iamGrvJ: How CEOs Can Win the Fight and Transform to Win the Future

#COVID19 #coronavirus #global #economy #healthtech #healthcare #ma…","“Dr. Christian Drosten, the director of the Institute for Virology at Berlin’s Charite hospital, said the test developed by his team will allow labs to reliably diagnose the so-called novel coronavirus “in a very short period of time.” https://lnkd.in/enUezMd ","Ebola talk to coronavirus: Listen to me, I'm the virus here! https://twitter.com/OlaTinee/status/1225741981621637121 …"
75,"RT @ShobhaBJP: Major boost for the use of Indian medicines to treat #Covid19!

Happy to see Tamil #Siddha treatment finding way out for thi…","""Officials investigate possible coronavirus case in Texas""  https://twitter.com/i/events/1220482618870792192 …","For influenza and coronavirus, cancer, all-cause mortality rate, etc., 40 ng/ml (100 nmol/l) up to 60 ng/ml is supported by observational studies and clinical trials. For more info:
http://vitaminDWiki.com  and http://grassrootsHealth.net https://twitter.com/Cblinn3/status/1226266276093472768 …"
76,RT @OVargas52: Prediction: Bolivia won't have elections on September 6th. The regime is already hated and the little support they have curr…,Chinese People Eating Bat Soup Linked to the Coronavirus-Video - Julie Reichwein ⁦@JesseBWatters⁩ ⁦@BretBaier⁩ ⁦@greggutfeld⁩ ⁦@marthamaccallum⁩ ⁦@ShannonBream⁩ ⁦@dagenmcdowell⁩https://juliereichwein.info/chinese-people-eating-bat-soup-linked-to-the-coronavirus-video/ …,"I long suspect that it came from that lab. Coronavirus in of itself is not as bad compared to influenza virus. But if in fact, came from that lab, God knows what that entails. As of now, influenza virus carries much greater risk in US, with deaths up to 10,000 per CDC."
77,RT @wregional: Washington Regional has seen a 350% increase in the number of hospitalized #COVID19 patients in the past week. We are not se…,"Elena, is this real or fake? We can’t trust pics? Should I share it with Jesse & Greg? LOL! I’m to old to travel, no way could I watch someone eat this! Chinese People Eating Bat Soup Linked to the Coronavirus-Video -Julie Reichwein ⁦@ElenaMoussa⁩https://juliereichwein.info/chinese-people-eating-bat-soup-linked-to-the-coronavirus-video/ …",Oh fuck. One infected person has spread it to 20 so far. Scary as hell. #coronavirus https://twitter.com/BNODesk/status/1225205249910149120 …
78,Looks like from local reps Sonia Barker signed but Speaker Matthew Shepherd didn’t. Is it a good idea to let busine… https://t.co/9wKCA9oFFn,"Coronavirus, Huawei in Britain, Impeachment: Your Wednesday Briefing (Melina Delkic/New York Times - Asia Pacific) http://dlvr.it/RNxNGY ","Amazon pulls out of MWC 2020, citing coronavirus concerns - CNET (Jackson Ryan/CNET - Business Tech) http://dlvr.it/RPjbdy "
79,RT @colombus: Swiss want to work from home more frequently after pandemic : Our exclusive opinion pool with @swissinfo_fr #COVID19 #coronav…,"Tim Cook addresses AirPods and Apple Watch supply constraints, coronavirus uncertainty, more (Chance Miller/9 to 5 Mac) http://dlvr.it/RNxN90 ",Coronavirus fears are prompting shipping restrictions on vessels from China. These are some of the latest efforts. https://trib.al/IWgljJS 
80,"RT @CAO916: @bessbell So let’s see,  about 14ish days ago was Memorial Day? Yeah, about right then. It’s almost like the science/medical co…",Y’all keep that coronavirus over there. I drink Bud Light anyway...,"Hitting 'critical milestone,' FDA allows emergency use of CDC coronavirus diagnostic https://www.fda.gov/news-events/press-announcements/fda-takes-significant-step-coronavirus-response-efforts-issues-emergency-use-authorization-first?utm_campaign=020420_PR_FDA%20Issues%20EUA%20for%20First%202019%20Novel%20Coronavirus%20Diagnostic&utm_medium=email&utm_source=Eloqua …"
81,"From reopening your business to hosting a backyard #BBQ
@CDCgov has you covered with an inside look at “best practi… https://t.co/FdT3Tbanhj","The coronavirus jumped from bats to snakes to humans in China in wetmarkets. Well probably NOT everything that moves SHOULD be eaten. 
This is the 4th zoonotic virus originating from Chinese wetmarkets
https://www.businessinsider.com/wuhan-coronavirus-sars-bats-animals-to-humans-2020-1 …","The last three are from a 93 episode called Marge in Chains, but the first one is from a 2010 episode called The Fool Monty, and talked about ""Apocalypse Meow"", not the Corona virus which has been photoshopped over it."
82,RT @CDCgov: #Employers: Antibody tests for #COVID19 should not be used to determine if someone can return to work. There is not enough info…,Earlier today Health Ministry of Singapore confirms its fourth case of #coronavirus. https://www.channelnewsasia.com/news/singapore/4th-confirmed-case-of-wuhan-pneumonia-virus-in-singapore-moh-12339912 …,Evidence Corona Virus is Bio-Engineered Weapons Test pic.twitter.com/uVlpxvj6dN
83,"RT @RichardAngwin: Today's award for best
bumper sticker goes to...

#Resist #Trump #1u #tcot #maga #kag #QAnon #WWG1GWA #COVID19 #coronavi…",he did it he ended coronavirus https://twitter.com/multivisionfed/status/1223014297694953472 …,"Pentagon to provide housing for up to 1,000 people over coronavirus concerns - CNNPolitics https://www.cnn.com/2020/02/01/politics/defense-department-housing-coronavirus/index.html …"
84,Info worth noting. Obtained from a trusted health organization.  #coronavirus #COVID19pic.twitter.com/TIFR6rpPy5,The Centers for Disease Control and Prevention says a Seattle-area man has been diagnosed with the Wuhan Coronavirus.  KCBS reporter @bobbutler7 has been talking with passengers at @flySFO.  Reports throughout the afternoon on @KCBSRadio.,"China’s Crude Oil Demand Plunges 20% After Coronavirus Measures: Industry Sources: “Largest demand shock the oil market has suffered since the global financial crisis, and the most sudden since the Sept. 11 attacks.” 
https://wolfstreet.com/2020/02/03/chinas-crude-oil-demand-plunges-20-after-coronavirus-measures-industry-sources/ …"
85,Trump fired America's pandemic response team. Demand he reassemble it to confront the coronavirus pa #care2https://www.thepetitionsite.com/tell-a-friend/65229506 …,The coronavirus waiting when you go to pick up chicken at the store pic.twitter.com/L2BhECPOQS,"𝗩𝗶𝗿𝘂𝘀 𝗨𝗽𝗱𝗮𝘁𝗲: #Coronavirus death toll crosses 400, approaching 20K cases worldwide

$SPY $QQQ $VIX $TNX $TLT $GLD $USO $CL_F $HG_Fpic.twitter.com/6iNSfrtK4A"
86,Surgeon general wants you to stop buying masks to protect yourself from coronavirus: ‘They are NOT effective’ https://on.mktw.net/2PFrDiq ,"2 people to undergo testing for possible coronavirus in Oklahoma, health officials say https://www.4029tv.com/article/2-people-to-undergo-testing-for-possible-coronavirus-in-oklahoma-health-officials-say/30681843 …",That’s worse than the coronavirus.
87,LOViT gave me coronavirus or allergies. Popping Benadryl and plan to be knocked out in one hour tops.,"United Travel Waiver for China Novell Coronavirus
Customers traveling to, from or through the following airports are permitted to make voluntary changes to their plans within the parameters provided.

Travel dates and affected cities

Original ticketed…https://lnkd.in/eP3g3nb ","China's daily death toll from virus tops 100 for the first time; more than 1,000 total deaths recorded - Los Angeles Times #coronavirus https://www.latimes.com/world-nation/story/2020-02-09/mainland-china-virus-cases-rise-again-after-earlier-decline …"
88,"Holistic and natural ways to boost your immunity. How to eat well during Coronavirus outbreak 

#COVID19 #FridayMotivationhttps://worldaffairs.blog/2020/03/01/how-to-boost-your-immunity-coronavirus-edition/ …",Before we all get wiped out by the coronavirus does anyone wanna buy some beats,"Santa Clara declares #coronavirus emergency. Maybe it is an overkill but every govt should do what the Chinese govt didnt-notify the population of the danger of virus. The pandemic is purely thanks to the Chinese govt's stupidity n lack of conscience. 
https://abc7news.com/5919991/ "
89,"Just like coronavirus patients, this won't age well",Coronavirus is what Dr Amherst was working on? @TheDivisionGame,"Sony pulls out of PAX East in Boston, citing coronavirus concerns - CNET (Jackson Ryan/CNET http://News.com ) http://dlvr.it/RQMyv3 "
90,"My family has flu like symptoms. And we are not being tested for #Coronavirus ""because there aren't enough testing kits"". Wow!",The people in Alameda County who are being tested for #coronavirus are all quarantined at their homes.  County not being specific on exactly how many people. @kron4news,"COVID-19 is the coronavirus causing pneumonia, infecting >75,000, killing >2,000 since it was identified in Dec

Johns Hopkins University tracker shows a ~2000 cases since the prior day's WHO rpt

https://www.newsweek.com/coronavirus-update-map-75000-confirmed-cases-2000-deaths-1488061 …
#BlueWave2020 #RESISTANCE #VoteBlue2020 #TheResistance"
91,Austin's iconic SXSW festival was just canceled for the first time in its 34-year history over coronavirus concerns. Here's what it's like in the growing tech hub of 'Silicon Hills.' http://dlvr.it/RRPRlw ,Here's A Running List Of Disinformation Spreading About The Coronavirus https://www.buzzfeednews.com/article/janelytvynenko/coronavirus-disinformation-spread … via @janelytv,"China on Friday released 14,000 tonnes of pork from its central reserves in a bid to ensure market supply amid efforts to fight the novel coronavirus outbreak, according to the Ministry of Commerce - Xinhua"
92,This apology is unacceptable. He must be fired immediately.....’Most ignorant': CNBC editor apologizes for suggesting 'everybody' should get coronavirus to boost economy https://washex.am/2THVYy5 ,coronavirus fashion pic.twitter.com/prLbK9SFYZ,Tom Cotton repeats debunked conspiracy theory about coronavirus - The Washington Post https://www.washingtonpost.com/politics/2020/02/16/tom-cotton-coronavirus-conspiracy/ …
93,First two patients diagnosed with novel coronavirus in San Francisco https://www.sfexaminer.com/news/two-patients-diagnosed-with-novel-coronavirus-in-san-francisco/ …,"Coronavirus update: Vaccine expected in Phase 1 trial within months, WHO to reconvene on Thursday https://www.marketwatch.com/story/coronavirus-update-vaccine-expected-in-phase-1-trial-within-months-who-to-reconvene-on-thursday-2020-01-29 …","The number of reported coronavirus cases stood at more than 68,500, with nearly 1,700 deaths, including a man in Taiwan with no history of travel to mainland China."
94,"These coronavirus emails about taking precautions from every sports club/league, gym, office I'm affiliated with...did they just copy & paste? It's like a chain letter!",NEW: The Arkansas Department of Health is investigating the state’s first possible case of the new coronavirus. What we know » https://www.arkansasonline.com/news/2020/jan/29/department-health-investigating-arkansas-first-pos/ …,Mobile World Congress in Barcelona called off over coronavirus fears (Reuters: Money News) http://dlvr.it/RPwY3j 
95,"Really people?! There is ZERO reason to hoard toilet paper right now. Including the lady in the aisle with 4 packages, whispering, “well, you know, coronavirus. There just won’t be any” if anyone needs me, I’ll be in the freezer aisle stocking up on @benandjerrys #serenitynowpic.twitter.com/BtcnpO3ZAp",China Turns Construction of Coronavirus Hospitals into Reality TV Program http://dlvr.it/RP163f pic.twitter.com/t5A3CXxk9w,GSMA cancels MWC Barcelona over coronavirus fears (Kelly Hill/RCR Wireless News) http://dlvr.it/RPwY3D 
96,LOVE AND CORONAVIRUS IS IN THE AIR,"With Coronavirus fears spreading, it might be a good time to follow airline stocks. United is already down 8%.","After some of the biggest telecom companies withdrew from the wireless industry’s top annual event because of concerns about the coronavirus, MWC Barcelona 2020 is all but dead https://trib.al/koy9Y2E "
97,This is very good information on what the #coronavirus actually does when it infects a person. HIGHLY RECOMMENDED TO READ: https://www.nytimes.com/article/coronavirus-body-symptoms.html …pic.twitter.com/IZxQJx4MjK,"Our new #coronavirus tracker provides the number of cases and deaths by country as well as trends over time. 

It will be updated regularly based on @WHO situation reports. https://www.kff.org/global-health-policy/fact-sheet/coronavirus-tracker/ …pic.twitter.com/zCGMnOucmP","We analyzed how the #coronavirus and an economic slowdown in China could impact the U.S. economy, including the vulnerable Heartland trucking industry. Read more here: https://bit.ly/38zUoEY  #HeartlandEconpic.twitter.com/ht2mqvkBSv"
98,"I trust this guy! 
Dr. Anthony Fauci addresses COVID-19 mortality rate. “It’s ten times more lethal than the seasonal flu.” @cspan #coronavirus #COVID19 #FlattenTheCurve https://www.c-span.org/video/?c4860450/user-clip-dr-anthony-fauci-addresses-covid-19-mortality-rate …pic.twitter.com/qzOs7KaU53",Dr. Francis Boyle Creator Of BioWeapons Act Says Coronavirus Is Biological Warfare Weapon | GreatGameIndia https://greatgameindia.com/dr-francis-boyle-creator-of-bioweapons-act-says-coronavirus-is-biological-warfare-weapon/ …,"Can an ultraviolet disinfection lamp kill the new coronavirus?

#COVID19pic.twitter.com/6F0eInB6Ju"
