,Positive,Neutral,Negative
0,304,Book Tour in the Early Days of Coronavirus https://lithub.com/book-tour-in-the-early-days-of-coronavirus/ via @lithub,337
1,"How a toxic alliance between Trump and Jared Kushner, two thuddingly ignorant, stubborn, and sociopathic men who are convinced they're geniuses, condemned thousands of Americans to death of #coronavirus. ","Oooh la la: All-star tribute to proto-punk-glam-folksters T.Rex due Sept. 4, created by visionary producer Hal Willner before he died of #coronavirus. ","""If you have 20% of the workforce out sick, you can't open the plant. ... you cannot have a secure #FoodSupply in this nation if workers don't have a secure place to go to work."" --Marc Perrone of UFCW union on MSNBC. #coronavirus"
2,This will be a great discussion. Any questions you'd like addressed? WATCH THURSDAY: 'Race & Coronavirus: A Bay Area Conversation' virtual town hall about COVID-19 impact on African American community https://abc7news.com/society/watch-thursday-race-and-coronavirus-a-bay-area-conversation/6133506/ via @abc7newsbayarea,Controversial smartphone app tracking people exposed to coronavirus (http://CBSNews.com: Sci-Tech) http://dlvr.it/RVjplD,"""People choose not to stop the Corona Virus in the United States"". @realDonaldTrump made it again: blame his voters for the Corona Virus spread."
3,I cleaned out my old barn today and now have a pickup load of trash and junk to haul off only to find out our dump is closed because of Coronavirus. How does not dumping trash keep us safe? ,Im going to fight the next person that talks about coronavirus,"God I pray for the Nations , Let's your Holy Blood wash away this corona virus. "
4,"The state of California is under shelter in place rules. What sense of #privilege allows Ford to be out flying in the first place? Before the FAA makes a ruling, he should be punished for just being out and about for no good reason. #HarrisonFord #coronavirus #ShameOnYou",ICE Moved Dozens Of Detainees Across The Country During The Coronavirus Pandemic. Now Many Have COVID-19. https://www.buzzfeednews.com/article/hamedaleaziz/ice-immigrant-transfer-jail-coronavirus via @haleaziz,Cubs and White Sox season ticket holders can choose credit or refunds for games lost to the coronavirus shutdown https://www.chicagotribune.com/sports/breaking/ct-chicago-cubs-white-sox-ticket-refunds-20200429-knkxfuwtibeevisqoju5exg3ga-story.html?utm_source=dlvr.it&amp;utm_medium=twitter#ed=rss_www.chicagotribune.com/arcio/rss/category/sports/ #
5,"US study finds Gilead drug remdesivir works against coronavirus. It shortened the time to recovery by 31%. This will be the standard of care, and any other potential treatments will now have to be tested against or in combination with remdesivir. ","“Never underestimate an Assistant Principal who survived 2020 Coronavirus Pandemic!” Photo credit alaina.436 #assistantprincipallife #skirtsportsambassadors @Allen, Texas https://www.instagram.com/p/B_lUyp5HiiC/?igshid=1xgizpjv7yl9i",The #NM Health Department has taken legal action to require two coronavirus patients to self-isolate -- marking the first time an isolation provision in a 2003 state law has been evoked during the COVID-19 outbreak: https://www.abqjournal.com/1449139/nm-health-agency-has-issued-two-covid-isolation-orders.html via @ABQJournal h/t @phaedraann #nmpol
6,"Anyone else finding this $TSLA call super awkward with zero mention of coronavirus, pandemic, COVID-19....?","‘Race & #Coronavirus: A #BayArea Conversation,’ to air on KGO with @RepBarbaraLee, @Greenlining's Debra Gore-Mann and more. https://www.eastbaytimes.com/2020/04/29/race-coronavirus-a-bay-area-conversation-to-air-on-kgo/ via @eastbaytimes",my favorite take is that COVID-19 doesn't kill anyone because the cause of death is actually the pre-existing conditions and the coronavirus just makes those things flare up.
7,Anyone think trump made him do that with Hope's of him coming down with Coronavirus?,"FAKE News: Trump said Tuesday that the 1M cases figure is misleading because “we’re doing much, much more testing than anybody else in the world.” FACT: The number of coronavirus tests performed per 1,000 people in the United States is below average of the 36 member countries.",Does anyone else get a creepy feeling when Fauchi talks about giving dying people a placebo? #coronavirus #DrFauci #placebo
8,"The Pentagon has not released UFO footage to distract you from how bad Trump has messed up the governments response to the Coronavirus. They released UFO footage to make you think we need Trump's Space Force, instead of the Pandemic Response Team he fired in 2018.",Apple and Google Team Up to ‘Contact Trace’ the Coronavirus: the elephant in the room ,87 in lagos and banks wants to open on Monday LMAOOOOOO... Corona virus is ordering calculators from China... They can't believe what's coming... NCDC 
9,GlaxoSmithKline joins drugmakers whose sales have benefited from patients’ stockpiling ahead of coronavirus lockdowns ,"""Gilead says early results of coronavirus drug trial show improvement with shorter remdesivir treatment"" ",Marijuana is killing more than coronavirus 
10,When planing that special day remember after the #coronavírus check out @jolielaushi where all the magic is brought life . Making ur special unforgettable!!! Please stay safe and we look forward to creating amazing… https://www.instagram.com/p/B_lN1UXHUyC/?igshid=1fb6vk4wd9w9p,Coronavirus pandemic threatens controversial fracking project in Argentina https://www.theguardian.com/environment/2020/apr/29/fate-of-vaca-muerta-oil-and-gas-fields-may-point-way-forward-on-fossil-fuels-after-coronavirus?CMP=share_btn_tw.,Oh no! The Corona Virus has got all of @KATVNews Where is our news?
11,"Glad to be part of this project for @NYTNational. ""The coronavirus destroyed all the traditional ways of saying goodbye"" -- to high school, sure, but also childhood. ","My first time out the front door (with my mask tightly in place!), since the coronavirus inspired “shelter in place”, even though I have re-edited and reposted a few archived photographs, this is my first new… https://www.instagram.com/p/B_lGCCKn2UB/?igshid=1dwrwyz8tbldi","The National Institutes of Health on Wednesday announced a new $1.5 billion initiative to rapidly develop #coronavirus #diagnostics, an effort it says will result in the deployment of “millions of tests per week” by late summer or fall of this year."
12,"We read or write, say and are told about the increasing news of the coronavirus minute by minute, hour by hour, day by day. It’s the news tyranny taken to the edge of the precipice. But, what is a good source today? When is it a good source?",An old 1920s movie theater converted into a theater showing Broadway shows etc. The Golden Gate Theater in the center of San Francisco-from my archives during the coronavirus-soon I’ll start very cautiously… https://www.instagram.com/p/B_lAhhMHFac/?igshid=b5ecbq2ygu69,"Observant people have understood this for a while, but we need to shout it for the folks in the back: #coronavirus deaths have been UNDERESTIMATED because many who die from it never get tested. "
13,"I said this earlier this month! Glad the @CDCgov is finally figuring it out. When did the coronavirus start spreading in the U.S.? Likely in January, CDC analysis suggests https://www.statnews.com/2020/05/29/cdc-local-transmission-coronavirus-united-states/ via @statnews (See my own assessment: https://www.medpagetoday.com/blogs/working-stiff/86291)",D.A. warns public of 7 ‘high-risk’ sex offenders released in California amid coronavirus pandemic ,What is Corona virus? We have WHO
14,Oh Bean here’s to a happy new life Street dog now named Bean helps nurse in China through the Coronavirus traumas... https://mynorthwest.com/1900615/street-dog-helps-see-chinese-nurse-through-virus-traumas/ #Inspiration #dogswelove #COVIDkindness,An old 1920s movie theater converted into a theater showing Broadway shows etc. The Golden Gate Theater in the center of San Francisco-from my archives during the coronavirus-soon I’ll start very cautiously… https://www.instagram.com/p/B_lAhhMHFac/?igshid=7st9t94j9jav,"Is it COVID-19 or Allergies? (Source: AA0 website) In the midst of the COVID-19 pandemic, your spring allergies may be adding to your anxiety about your health. Are those watery eyes and stuffy nose symptoms of the new coronavirus or allergies? "
15,The curious case of the SF doctor who’s been coronavirus-positive nearly 90 days and counting - http://SFChronicle.com Persistent positives Covid-19? https://www.sfchronicle.com/bayarea/article/The-curious-case-of-the-SF-doctor-who-s-been-15304660.php #SmartNews,Coronavirus impact will be reported on Q2 results.,2 Georgia men drank cleaning products to fight #coronavirus as ⁦@realDonaldTrump⁩ continues to lie he was joking #COVID19 #gaslighting
16,"In this #coronavirus pandemic Harper would have call confined people: faker, lazy or Culture Of Defeat. this is why #iStandWithTrudeau despite some mistakes, he managed the situation very well","Results from two studies of #remdesivir for #COVID19 released today (one placebo-controlled, one not), plus previously leaked data now published in @TheLancet. #coronavirus @eBARnews @NIAIDNews @ScottGottliebMD @GileadSciences",Apple Q2 2020 earnings will be all about assessing the damage from coronavirus 
17,".@DrewAltman discusses how almost half of African Americans and Latinos are struggling to pay their bills because of #coronavirus, which suggests that even if Congress’ relief efforts are helping, they’re not nearly enough. Read more @axios: https://www.axios.com/coronavirus-economy-jobs-unemployent-racial-disparities-29e3c6c4-bb43-4eaf-bf90-04697ca66b2d.html","Without explicitly stating it, an executive explained Tesla ""experienced global shutdowns."" Dudes, just talk about coronavirus, we're ALL dealing with it, it's a pandemic.","""Frostbite"" toes and rashes may be signs of a coronavirus infection "
18,Forbes Coronavirus Coverage best summary I’ve found. https://www.forbes.com/coronavirus/,Qualcomm Sees Coronavirus Pandemic Hurting Smartphone Sales (PATRICK SEITZ/Investor's Business Daily - Business) http://dlvr.it/RVjjwL,"""From a famine of 'biblical' proportions to a deluge of undiagnosed cancers, while we’re all worrying about the coronavirus, most fatalities could be collateral damage."" "
19,@MSNBC @DeadlineWhitehouse Could you PLEASE make a clip available on Twitter of Frank Figliuzzi's advice for how the White House should address messaging and transparency Re: #COVID19?, coronavirus sign of times ,"State’s coronavirus cases top 7,000; death toll rises by one "
20,@MSNBC @DeadlineWhitehouse Could you PLEASE make a clip available on Twitter of Frank Figluzzi's advice for how the WH should address messaging and transparency Re: #COVID19?,Whaaattttt???? “The World Health Organization lauded Sweden as a ‘model’ for battling the coronavirus as countries lift lockdowns.” ,Should I wash my clothes after I go outside to prevent coronavirus infection? 
21,"You HAVE to only send highly trained, qualified and appropriately-equipped (with Personal Protective Equipment) employees to deal with #covid19 cases or suspected potential ones. And chain of command needs to be clear. Trump *should not* be involved but can still call it success.","Bolinas offers test to every resident for coronavirus, one of the first in the world to do so https://www.sfgate.com/coronavirus/article/west-marin-coronavirus-covid-test-free-15211203.php?utm_campaign=CMS%20Sharing%20Tools%20(Desktop)&amp;utm_source=t.co&amp;utm_medium=referral via @SFGate",How many of these anarchist scum looting and stealing were also given a 1200 dollar check from the government as compensation for work/hours lost due to #Covid19/#CoronaVirus? What a waste of tax money! #riots2020 #protests #GeorgeFloydMurder #chicagoprotest #MinneapolisRiot
22,I've seen some scammy #coronavirus #pandemic #COVID19 tagging the @who lately to cash in on free twitter followers and engagement by hyping up a potentially scary issue. ...no fear-mongering here... You really want to protect yourself? Do. Some. Cardio. *Not Medical Advice*,"tiktok, not the chinese government, created the coronavirus",Rwandan Medical Workers Deploy Robots to Minimize Coronavirus Risk 
23,.@AsaHutchinson: State level testing of #COVID19 through the Department of Health should be available next week.,Hyatt is latest hotel chain to announce new cleaning program amid coronavirus. Here's what hotels are doing https://www.usatoday.com/story/travel/hotels/2020/04/29/coronavirus-hyatt-announces-new-cleaning-goals-following-hilton-marriott/3046386001/ via @USATODAY #Hyatt,If the coronavirus don’t spike with all these protests then I know something wrong .
24,Trump’s failed response to Covid19 spooks markets even more #failed,coronavirus check,"At like the Corona Virus, in numbers all races marching together, it's hard to be a black person in America and not be racist look at our history in America, its fucked up. But we still need to stand together and stand strong for this situation, and will have to endure many more"
25,"SAVE MONEY! Cough on a rich person Apologize profusely making sure to mention ""It's okay my sister was tested at the airport"" Let them pay fo get tested. If @CDC doesn't call you, you're fine. #CoronaVirus #COVID19 #COVID19US #MedicareForAll",Coronavirus: New antibody test 'with 99 per cent accuracy' approved for use across Europe | The Independent ,It has a mortality rate similar to the flu. It's a consequence of eating wild animals. It came out of a lab. It's an invention of this or that country with this or that intention. The virus survives X time on X surface. The coronavirus remains in the air.
26,"SAVE MONEY! Cough on a rich person. Apologize profusely making sure to mention ""It's okay my sister was tested at the airport"" Let them pay fo get tested. If @CDC doesn't call you, you're fine. #CoronaVirus #COVID19US #COVID19 https://www.businessinsider.com/coronavirus-treatment-costs-americans-health-care-broke-2020-2?utmSource=twitter&amp;utmContent=referral&amp;utmTerm=topbar&amp;referrer=twitter @businessinsider",Oh God ventilator and coronavirus testing kit? ,"Coronavirus in Ark.: 7,013 confirmed cases with 133 deaths, according to Aransas Department of Health #NotABellCurve #COVID19 #Arkansas"
27,"Perhaps we have a little good #Coronavirus news! Israeli scientists: In a few weeks, we will have coronavirus #vaccine https://www.jpost.com/HEALTH-SCIENCE/Israeli-scientists-In-three-weeks-we-will-have-coronavirus-vaccine-619101 #COVID #COVID19 #COVID-19 #FridayThoughts",So I guess coronavirus just disappeared?,"The ACA provides a new safety net for people losing coverage during #coronavirus’ health and economic crises, which could re-frame the debate on health care heading into #Election2020. @larry_levitt explains @JAMAHealthForum: https://jamanetwork.com/channels/health-forum/fullarticle/2766729"
28,"I don't watch a lot of presidential press conferences. But I was struck during @realDonaldTrump's #covid19 by how many times Pence and Azar said about the response so far that ""President Trump has ..."", instead of ""We have ..."".",I mean the coronavirus thing,Autopsy Shows George Floyd Did Not Die of Traumatic Asphyxiation or Strangulation https://link.theepochtimes.com/mkt_app/autopsy-shows-george-floyd-did-not-die-of-traumatic-asphyxiation-or-strangulation_3370628.html Download The Epoch Times app to see our exclusive Coronavirus coverage and daily updates:
29,"Alright enough of the COVID19, back to my country... Whose money are you using to provide foreign education for those 'repentant' BH members ? whose money?",And now there is no more coronavirus! Especially in Minneapolis!,I ain’t heard shit bout corona virus that shit gone now? 
30,"4 diagnostic testing facilities are ready and available at National Reference Laboratory in Abuja, LUTH in Lagos, Irrua in Edo State and Redeemer’s University in Osun State to respond to #coronavirusnigeria pandemic #COVID19 #CoronaVirusUpdates #CoronavirusOutbreak #Nigeria","""Sending children back to schools and day care centres in Denmark, the first country in Europe to do so, did not lead to an increase in coronavirus infections, according to official data, confirming similar findings from Finland on Thursday."" ","This Week in Noe Valley: Coronavirus Lockdown Week 11 - the slow, slow reopening continues https://tinyurl.com/ya8ksy2r"
31,"Fun fact: coronavirus is named for the latin word ""crown"" or ""halo"" because it looks like a circle with a bunch of nubs sticking out. https://twitter.com/WSJ/status/1215019129075306497 …",Noam Chomsky: What History Shows Us About Responding to Coronavirus https://lithub.com/noam-chomsky-what-history-shows-us-about-responding-to-coronavirus/ via @lithub,Global coronavirus death toll could be 60% higher than reported | Free to read https://www.ft.com/content/6bd88b7d-3386-4543-b2e9-0d5c6fac846c a través de @financialtimes
32,Preventio is better than cure. Please please be aware mo diha Cebu people. #coronavirus pic.twitter.com/fKB5DcmHaE,Five-month-old Brazilian baby survives coronavirus after 32 days in coma - CNN ,$NNVC NanoViricides confirms it has been working on treatment for the Wuhan Corona virus.
33,"Wuhan mystery virus, temperature sensors have been set up for arrivals at Los Angeles, NYC, SF airports. (Shouldn't it be part of departing security screens?) It's a Coronavirus, serious like SARS was in SE Asia or MERS was in Mideast. Good sleep boosts immune system function....",#CORONAVIRUS INFORME 94 #pergamino,"Yall, WHO has declared the coronavirus a public health emergency!"
34,"Yea, #trump got this under control Texas A&M Student Is Examined for Suspected Case of Wuhan Coronavirus https://nyti.ms/30OXhP0 ",I've gotten blocked by people just for telling them everybody will get coronavirus eventually. Some people cant handle the truth so they block it out wherever they can.,Hong Kong is Desperate for Face Masks as Coronavirus Spreads - VICE News https://www.youtube.com/watch?v=vUb5wdHcbxI via @GoogleNews
35,How does someone test positive for Coronavirus? Is there a Coronavirus test kit or something?,"An international team of researchers has tested more than 10,000 compounds to identify six drug candidates that may help treat COVID-19. https://www.dovemed.com/current-medical-news/covid-19-drug-lead-treatments-identified/ #coronavirus #covid19",Expect limited visa appointment availability at posts in China as diplomatic staff are placed on authorized departure due to the coronavirus. 
36,"Muchas Gracias to #MuchoGusto winner of the #PegasusWorldCup. On a day of #coronavirus #TrumpDefense and #earthquake, nice to have some good news. @HorseRiderSoCal @HorseRaceSite @7horseracing #Floridahttps://twitter.com/PegasusWorldCup/status/1221204303827886087 …",Applying to college has gotten more complicated and confusing because of the coronavirus pandemic. Myles (@itsthelake) and @ReportingLabs teens discuss how standards have changed and learn tips for adapting. #AboveTheNoise @KQEDedspace @pbdss https://youtu.be/XyEHJsvS9l4,WHO declares China coronavirus that's killed 171 a global health emergency 
37,"STAY HEALTHY: With the novel (new) coronavirus now in the U.S. and flu season still upon us, the Arkansas Department of Health is helping to remind people on how best to stay healthy. More here --> http://bit.ly/2RNCiI4 ","Coronavirus May Be a Blood Vessel Disease, Which Explains Everything by @SmithDanaG in @elemental",Watch Live: The World Health Organization Declares International Health Emergency for Coronavirus - YouTube 
38,The Coronavirus sounds like something I would make up when I called into work sick when I was really just hungover,"“Eventually doctors will find a coronavirus vaccine, but black people will continue to wait for a cure for racism” - @rgay",Coronavirus Anger Boils Over in China and Doctors Plead for Supplies - The New York Times 
39,"China travel ban in US over coronavirus? it's too late for that to work, it's already in the US, and is most likely spreading.",Eight Emerging Lessons: From Coronavirus to Climate Action by Otto Scharmer ,"It's time to end this sherade! We have much bigger problems at hand. Corona virus, Health Care, Right to life, Illegal immigration, Mental health, California, Chicago, Baltimore. Liberals progression towards normalizing pedophilia, Ect."
40,That coronavirus got here faster than my order on http://wish.com . ,"one of the sillier things of the pandemic dominating life is that all these algorithmic things (news, ads, etc.) seem to have decided what I want is more coronavirus information and infinite amounts of hand sanitizer",CORONAVIRUS What is the Federal Government of Nigeria doing to assist Nigerians in China / Wuhan region? *World Health Organisation declares public health emergency.
41,Thank you President Trump for Keeping America Great and Investigating the source of Coronavirus!,"Arkansas coronavirus cases rise by 236, to pass 7,000 total #ARNews #KTLOnews https://www.ktlo.com/2020/05/30/arkansas-coronavirus-cases-rise-by-236-to-pass-7000-total/","WHO, China leaders discuss next steps in battle against coronavirus outbreak "
42,Wow! Is that because or CoronaVirus?,"The coronavirus pandemic is shattering the weakling certainties that kept journalism standing up. It has kicked the cane that allowed the profession to walk more or less upright, more or less proud.","Perfect setting for a modern-day film adaptation of Masque of the Red Death, wouldn't you think @Styx666Official? From The Guardian: 6,000 passengers stuck on cruise ship in Italy over coronavirus fears. "
43,"My dude, maybe you can spend some of this energy you're pouring into this coronavirus stuff on trying to get the Senate to actually do their jobs and get some of that legislation going. Like, I'm glad you're tryna do something but maybe do something about that?","A deep dive into the genetics of the novel coronavirus shows it seems to have spent some time infecting both bats and pangolins before it jumped into humans, researchers said Friday. ",‘No Chinese allowed’: Racism and fear are now spreading along with the coronavirus 
44,Xi Jinping is handling coronavirus just like the Soviets handled Chernobyl https://washex.am/39pE8q0 ,"If u carry belle, e no better pass make u go carry corona virus?",WHO declares coronavirus outbreak a global health emergency - STAT 
45,My mailbox lady is scared of coronavirus and her friend is telling her she had Ebola. Great pair,Widow of coronavirus whistle-blower doctor Li Wenliang opposes US plan to name street outside Chinese embassy after him http://dlvr.it/RXgZ7s,THE FIGHT AGAINST CORONAVIRUS &amp; LASSA FEVER CAN ONLY BE WON THROUGH ENLIGHTENMENT Join the event and invite others with this link:- https://lnkd.in/gMaQ3cn #coronavirus #lassafever
46,Nvidia forecast tops expectations on cloud sales despite coronavirus hit (Reuters: Technology) http://dlvr.it/RQ0JrT ,UK suffers second-highest death rate from coronavirus | Free to read https://www.ft.com/content/6b4c784e-c259-4ca4-9a82-648ffde71bf0 a través de @financialtimes,How much risk does the coronavirus present to the markets? Kirk Hartman discusses on @CNBC :
47,"OMG, this is socialized medicine!

""Then they sent her home to wait for her lab results.""

London Coronavirus Patient Took Uber To Hospital - Then They Sent Her Home | Zero Hedge https://www.zerohedge.com/political/london-coronavirus-patient-took-uber-hospital-then-they-sent-her-home …",he did it he ended coronavirus ,"When the WH is failing, bring out the designated surrogates to spread propaganda and blame the media and scientists. #COVID19 "
48,UPDATE 1-Apple says will not meet revenue guidance for March quarter due to coronavirus impact (Reuters: Company News) http://dlvr.it/RQDcK3 ,Can Coronavirus Be Spread By Packages Shipped From China? http://trb.tv/2aCKX via @5news,It would be a huge hit to reputation and a historical blemish on Japan's image as host of the #Olympics2020 if the infection is not under control by summer. All forms of media will be following and covering this event because of the potential drama that will unfold. #covid19
49,Apple won't meet its revenue guidance for the March quarter due to work slowdowns from the outbreak of novel coronavirus in China https://trib.al/UyJybPm ,"Didn't they say we had nothing to worry about with the coronavirus like a week ago. Didn't believe that for a second. I've seen movies, I know how this story ends.",With the covid19 case registered in Lagos Nigeria. Can federal government agencies for control of disease begin an emergency distribution of materials for prevention. Especially nose masks please #original. @WHO @AITFocusNigeria @aitkakaaki @937RhythmFm @BBCWorld
50,Love and Coronavirus https://twitter.com/capturebizarre/status/1226705644738224129 …,"1st Person-To-Person Spread Of Coronavirus Has Occurred In U.S., CDC Says - NPR https://www.npr.org/sections/health-shots/2020/01/30/801235064/1st-person-to-person-spread-of-coronavirus-has-occurred-in-u-s-cdc-says via @GoogleNews",Preparing cities for epidemics: Lessons from the #COVID19 outbreak https://www.ijurr.org/the-urban-now/preparing-cities-for-epidemics/ #IJURR #UrbanNow essay by Ming Hang
51,"Coronavirus could be a 'catalyst' for China to boost its mass surveillance machine, experts say https://cnb.cx/2PmVE6v ","Coronavirus There are currently 9,171 confirmed cases worldwide, including 213 fatalities.",MERS - Middle East respiratory syndrome SARS - Severe Acute Respiratory Syndrome #coronavirusnigeria #coronavirusnigeria #COVID19
