,Positive,Neutral,Negative
48,Sony is the first to say they are skipping out on PAX East because of coronavirus concerns. I can happily voice my many reasons I'm glad I'm not going now.,"Accom's Razor - the simplest answer is correct. In this case, there is ample evidence for Accom's Razor in either scenario - A. Normal exposure in a mkt to bats and other animals or B. Accidental release from the Wuhan lab. (9/9) #coronavirus #CoronavirusOutbreak #WuhanVirus","In the face of #COVID19 big and bold policy responses are required and required fast. Unfortunately, @realDonaldTrump's @GOP administration and the @VP, they don't inspire any confidence that it’s up to this enormous task."
49,"700 is an arbitrary number. What were they doing? Someone (not Trump) thought they were not important to the CDC's mission.

Would hiring back the 700 plus 700 more save the US from Coronavirus? Maybe. But also maybe not. https://twitter.com/DrEricDing/status/1227692585109610497 …","The Coronavirus Quarantines, From Bizarre to Heartbreaking a ","This is a stupid thing to do. Mass of people together? Of course COVID19 is going to spread, and this is one way. Just can't overlook your own self gratification for your country, huh?"
50,"Pretty huge news, Mobile World Congress just got canceled due to Coronavirus fears.  Probably a good call given the circumstances. https://lnkd.in/eceFSNM ",The flu is much deadlier than the Chinese coronavirus ,"Go and shake a few more hands, meet a few more thousand people in an enclosed space. Especially the kind you attract, they listen to you and Fox as if it is their bible: practice poor hygiene because handwashing is for the ""wuss"". Toughen up! Get used to COVID19; it's just a flu."
51,"Super Lab created vaccine in 3 hours using sequencing from China

San Diego lab discovers COVID-19 / coronavirus va…: https://youtu.be/GWI5oLTETdU ", I suspect even the Coronavirus wouldn't go near him.,"He’s certainly careless about getting his daughter sick, but should we be concerned that he has COVID19? Is the test inaccurate?"
52,"I wondered what might be the trigger to finally turn this thing around, and AAPL adjusted guidance downward, only 19-days after earnings release, due to the effects of Coronavirus...
.
.
There's support for the… https://www.instagram.com/p/B8r-pdGA1FD/?igshid=1rkj3i9415olc …",Maybe it's bio warfare #CoronaVirus,"Given the US political climate, some (eg. Trump ACoS Mulvaney) are characterizing the HHS whistleblower complaint as a new attempt to hurt Trump’s re-election chances vice genuine professionals concerned about addt’l #coronavirus #COVID19 spread in the US. https://twitter.com/atrupar/status/1233396432838840321?s=20"
53,How many surfaces did this guy touch in the last week? How many people did he have contact with? He’s a mini patient zero. #coronavirus,"The Colombian government is again embarrassing all of us: there are only 14 Colombian citizens in Wuhan, but only 7 can be evacuated by the COL gov't, so a draw is planned. #coronavirus #2019nCoV #2019新型冠狀病毒 #2019新型コロナウイルス #緊急事態宣言 #武漢肺炎",". #Legit What worries me is plane travel. As a consultant that flies everywhere, the number of people being absolutely disgusting was really, really gross. I saw snot flying everywhere in front of me, a whole lot of coughing with no mouth covering. It was gross. #COVID19"
54,Iran's deputy health minister tests positive for coronavirus after appearing ill in presser https://www.bizpacreview.com/2020/02/25/irans-deputy-health-minister-tests-positive-for-coronavirus-after-downplaying-outbreak-appearing-ill-in-presser-890993 … via @BIZPACReview,"Colorado is Brewing Things. RT @kanthMD: CBS Denver: Coronavirus Has Nothing To Do With Corona Beer, But Some People In Colorado Think It Does.… https://twitter.com/i/web/status/1223014584451305475","“While the #coronavirus #COVID19 #武汉肺炎 epidemic 1st appeared in China, the epidemic did not necessarily originate in China.”—Zhong Nanshan #钟南山, Chinese epidemiologist, pulmonologist &amp; leading advisor in managing the crisis"
55,TEA Press Release: Novel Coronavirus (COVID-19)... Good Information  pic.twitter.com/fbxEzTQZr6,Please God stop this #coronavirus #worldhealthorganization,"Calling it now, once the US begins testing for Covid19 next week, cases will spike to hundreds or thousands, and the panic will begin."
56,The Diamond Princess is offering free porn to its passengers in quarantine. #Coronavirus @ Bogotá D.C https://www.instagram.com/p/B82Rpv0Jeu9/?igshid=1ov3uh12fiuui …,"Y’all the #coronavirus is officially in SoCal. If you live in Carson, check this out. ","@ccodag was interviewed in Italy on the relationship between science and public policy, due to recent #CoViD19 crisis and he talks about our book #scienzainvendita"
57,It was a matter of time before global shipping was hit by coronavirus. We need to revaluate our goods being concentrated in one country because this is what happens when countries are not prepared.,I’m going on leave if the novel coronavirus hits my city ,"WHO issues warning 
after 'mysterious' Chinese coronavirus spreads to Japan https://twitter.com/i/events/1217928133917044736 …"
58,Trump has the creepiest eyes as he scans the room. #Coronavirus #TheBeat,"This column isn't about the #coronavirus, but it is about attempting to stop the spread of the flu. #Vaccination #Editorial Not getting vaccinated is harmful in more ways than one","BREAKING: @CDCgov and @CBP will implement enhanced health screenings to detect ill travelers traveling to US on direct or connecting flights from Wuhan, China at SFO, JFK & LAX airports in response to coronavirus outbreak."
59,@POTUS @realDonaldTrump thank you for speaking on the CoronaVirus..I'm afraid for my family..my mother who is up in age as well as everyone else and their families..thank you for putting my mind at ease..,"According to USA Today, the World Health Organization has declared coronavirus a global public health emergency. https://bit.ly/2GBhK0z #coronarvirus",Coronavirus killing people is sad and all but I’m different
60,"Well gunnery might be cancelled bc of the Coronavirus, never been so happy about a pandemic before ","The Chinese likely lost control of a biological experiment, which has led to the coronavirus crisis. I believe SARS had a similar beginning.","My Virus, called Coronavirus, just wiped out the world in 408 days! #PlagueIncpic.twitter.com/SC1xbqMOTM"
61,HHS whistleblower claims US workers received coronavirus evacuees without proper precautions https://flip.it/QErLpE  via @flipboard,No. But they *are* blaming him for #COVID19 Go figure.,"EVACUATION: The US government is arranging a charter flight to evacuate American diplomats and citizens from the Chinese city that has become ground zero for a new deadly strain of coronavirus.
https://kdvr.com/2020/01/25/us-arranging-charter-flight-to-evacuate-american-diplomats-and-citizens-out-of-china-amid-coronavirus-outbreak-official-says/ …"
62,"RT @MileyCyrus: Spain, you united in solidarity with Black Lives Matter in the US. We must keep standing together to tackle #COVID19 and it…","No one expects the Trump administration to cure #COVID19 overnight. But they’re not even taking it seriously as a public health crisis, just a public relations problem and investment opportunity.","I believe that the coronavirus could have been strategically release by the @XHNews govt to this the herd and the  lost control of it and it went Pandemic 

@who
@cdc
@realDonaldTrump"
63,RT @MileyCyrus: All across Ireland 🇮🇪 citizens joined in solidarity with Black Lives Matter in the US. We must stay united with the world t…,The first session of the day on Wednesday will feature Gebeyehu Ayele from @livingwater presenting on lessons learned in Liberia on CLTS and Infectious Disease Prevention - what can the #WASH response to #Ebola teach us about #COVID19?,"How does coronavirus spread?
How can you protect yourself?

The Wuhan coronavirus outbreak is a new illness and scientists are still assessing how it spreads from person to person.

*Hand-washing is a first line of defense.

(Click blue line for info!)
https://www.theguardian.com/world/2020/jan/30/how-does-coronavirus-spread-and-how-can-you-protect-yourself …
*"
64,"RT @sanchezcastejon: Spain is coleader in initiatives such as the ACT-Accelerator to achieve equitable access to vaccines, treatments and d…",I made this #CoronaVirus stinger animation for today's @dailyblastlive show. #WashYourHands #covid19 #JeffJag Feb 2020 . . #C4D #Redshift #Cinema4D #render #cgarts #3dart #3dgraphics #Abstract3D #3dDesign… https://www.instagram.com/p/B9H2aPyJsJp/?igshid=1rujq5qy4aiqi,If the government wanted to kill a bunch of Chinese people they could’ve just pulled down the “don’t feed the buffalo” signs at Yellowstone instead of using the corona virus
65,"RT @SSnakeFHL: ""Ours is a strong commitment, Miley.""
Han tenido rollo fijo.",It is BS Follow the world health organization WHO They are doing daily media briefing on #COVID19,"Yup...""Authorities limit the travel of 11 million residents, shut down transportation in Wuhan amid Coronavirus outbreak""  https://twitter.com/i/events/1220065224117481472 …"
66,"RT @FranciscoMarty_: Like most things at the #NEJM, the most interesting stuff is in the appendix!

Great work by my colleague Issac Solomo…",Is it wrong to wonder how COVID19 affect those with inhumanly orange skin?,The #coronavirus is in the US now? Damn 2020 really ain’t our year.
67,RT @AmHeartAdvocacy: A5: More kids will be eligible for free meals in the fall due to #COVID19. Programs like CEP and universal free meals…,Concerns about 28-31 Jan HHS team visits to repatriated US citizens stationed in Wuhan—may have sparked addt’l spread of #coronavirus #COVID19 #武汉肺炎 b/c HHS teams who interacted w/them “[appear] to have done so w/out appropriate personal protective equipment (PPE) &amp; training.,.@WHO LIVE: Press conference on the Emergency Committee meeting on new #coronavirus (2019-nCoV) https://www.pscp.tv/WHO/1vAxRqQZyMrJl?t=17s …
68,"RT @rebecasrz: Miley I get you girl, our president is hot, but he is in a serious relationship with our VP The Ponytails, so please, back o…",#Lituania #Lithuania 1 caso confirmado #coronavirus #COVID2019 #COVID19 #epitwitter,"1) recently-confirmed cases have no history of exposure to Seafood Market; 2) human-to-human transmission occurred 3) HCWs have been infected by the coronavirus. 

Measures to reduce transmission should be implemented -school closures, cancellation of gatherings, exit screenings."
69,"RT @JohnsHopkinsSPH: ""Even if we can’t stop all transmission, it’s still a really important effort to keep [#COVID19] case counts low,"" sai…",#Mexico 1 caso confirmado #COVID2019 #coronavirus #COVID19 #epitwitter,"If we can take anything positive from the coronavirus outbreak, it's that microscopically small things can make global impacts.

Remember that with every word you speak, every smile you give or don't, and every second you worry instead of trying."
70,"RT @UNICEF: ✋ ""Tadaaaaaa!"" 🤚

Two-year-old Natalie shows us how fun handwashing can be at her home in South Sudan as she protects herself f…",#NewZealand 1 caso confirmado #coronavirus #COVIDー19 #covid19 #epitwitter,$SPX Movers: Coronavirus fears lead to a big sell off in Leisure/Travel related stocks. Energy and Basic Material stocks also hit as global growth fears get shaken. $XLY $XLB $XLEpic.twitter.com/xUyXcoveWv
71,Nice when an asshole does the work for you!  Karma is just getting staring on this jackass!,Cryo-EM analysis of a feline coronavirus spike protein reveals a unique structure and camouflaging glycans https://www.pnas.org/content/early/2020/01/02/1908898117.abstract …pic.twitter.com/ZfkEZDtHoS,"$SPX -0.3%
Coronavirus takes markets lower
US/France kick tariff can to yr end
NatGas < $2 bad for US energy cos
McDermott files for Ch 11
$BA -4% on new 737 Max delays
Risk-Off Day…
Best: Bonds, REITs, Utes, Staples
Worst: EM, Energy, Materials, Industrials"
72,RT @UNESCO: Modern technology like #AI can be key when navigating through the #COVID19 crisis. But it's crucial to understand the trade-off…,"“Japan confirms its
first case of the SARS-like coronavirus” by @QuickTakehttps://twitter.com/i/events/1217743831027728385 …","Listen to the most recent episode of my podcast: Episode #36 Charity, Coronavirus, Cancer cure, and NFL https://anchor.fm/blake-anderson8/episodes/Episode-36-Charity--Coronavirus--Cancer-cure--and-NFL-eab6s4 … #pimpinjoy #Cancer #cureforcancer #NFLPlayoffs #CharityTuesday #stjude #coronavirus"
73,"RT @Thicklilbae1: OMG SHE REALLY DID IT ON A PUBLIC BUS? 😱💦 @kathalina7777

FULL VIDEO FOR FREE 👇🏻

https://t.co/lx3y5DbLqY

#voyeur #squir…",Japan Confirms First Case of New Chinese Coronavirus http://dlvr.it/RN9Ms9 pic.twitter.com/2xFK3ZVpi2,"WHUT? Is @hughhewitt  suggesting we hope for a coronavirus outbreak to reduce attention on the impeachment trial, which is at least supposed to be one of the most solemn assignments the Senate can undertake. I certainly hope not. And, hey, you misspelled theater. It's ""a coverup"" https://twitter.com/hughhewitt/status/1219731374200041473 …"
74,"State Reopenings: A Picture’s Worth a Thousand Words, or Is It? https://t.co/4nUAx4lcwZ #USEconomy #COVID19 #COVIDSpike #EconomicREcovery","Coronavirus, zombie apocalypse call it what you want it's a fact of over population and poverty in one area that has been ignored for too long it's all the same shit in the end dead bodies that the rich dont care about until it hits them",CORONAVIRUS : Chinese Tell You IT IS WORSE ! https://youtu.be/MuDW6ocvH44  via @YouTube
75,RT @XHNews: Beijing's major wholesale market has been suspended after personnel working there tested positive for #COVID19 https://t.co/056…,"Feds conducting health screenings at LAX, San Francisco Intl. and JFK in New York of travelers arriving from Wuhan, China, aiming to prevent transmission of a new infectious coronavirus, spreading in Asia that has sickened at least 40 people and killed 2 in China.",This Coronavirus is a very big threat to the world and the world is leaving all the responsibility to China to contain it. It is vitally important that all countries collaborate with sufficient resources to China so that it can handle this virus more effectively.
76,"RT @Minuteman04: When you look at places like Florida, Arizona and Texas with huge #COVID19 spikes, the question ""Did we reopen too soon?""…",#coronavirus oupss #sunsetpic.twitter.com/nZN1nfUUlk,@NBCNews This Coronavirus is a very big threat to the world and the world is leaving all the responsibility to China to contain it.  It is vitally important that all countries collaborate with sufficient resources to China so that it can handle this virus more effectively.
77,"RT @kikebotwin: “Ours is a strong commitment, Miley.”
🥰😍🥰😍
Me desmayo. https://t.co/hebwgid8EF","Listen to the most recent episode of my podcast: Episode #37 Kobe, Coronavirus, Guns, and SB predictions  https://anchor.fm/blake-anderson8/episodes/Episode-37-Kobe--Coronavirus--Guns--and-SB-predictions-eaghni ….  #KobeandGianna #KobeFarewell #kobe #guns #WuhanVirus #SuperBowlLIV #coronoavirus #NFL","@nytimes This Coronavirus is a very big threat to the world 
 and the world is leaving all the responsibility to China to contain it. It is vitally important that all countries collaborate with sufficient resources to China so that it can handle this virus more effectively."
78,"RT @VANurse1212: ➡️ Covid Poll 

🔄 Please RT After Voting For a Better Illustration

➡️ Did Anyone You Personally Know Test Positive For #C…",A Colorado native who has lived in China for nearly a decade says he and his family are stranded as Chinese authorities respond to the coronavirus outbreak. https://dpo.st/2U2t4dP ,@TheEconomist This Coronavirus is a very big threat to the world and the world is leaving all the responsibility to China to contain it. It is vitally important that all countries collaborate with sufficient resources to China so that it can handle this virus more effectively.
79,"RT @PoliticsReid: Wow, 37 states reporting more than 10,000 #COVID19 cases. H/t @V2019N",The nCoV2019 API for Wahun outbreak monitoring is now available!https://rpst.page.link/qhcZ  #publichealth #hospitals #infectiousdiseases #healthcare #pandemic #coronavirus #ChinaCoronaVirus #coronaviruesue #nvoc2019 #2019ncov #Wuhan #WHO #WuhanCoronavirus #digitalhealth #apipic.twitter.com/XCE1fwzl6I,@XHespanol This Coronavirus is a very big threat to the world and the world is leaving all the responsibility to China to contain it. It is vitally important that all countries collaborate with sufficient resources to China so that it can handle this virus more effectively.
80,"RT @GovMurphy: The evidence is overwhelming and the experts are clear: #COVID19 is more lethal inside than outside.

It's too soon to open…","If getting the coronavirus is the price to pay for enjoying my delicious boxed wines, so be jt",@UN This Coronavirus is a very big threat to the world and the world is leaving all the responsibility to China to contain it. It is of vital importance that the other countries collaborate with enough resources to this country so that it can handle this virus more effectively.
81,Great way to spread Coronavirus!,Xi Jinping: Accelerating Spread of Coronavirus ‘Grave Situation’ — Suspends Tourist Travel Abroad http://bit.ly/2TWDMTm  via @BreitbartNews,"Me: *walking down the street*
A little kid talking to his friend: ""Did you know that if you drink too many Corona's you will get a virus?""
Me: 

I wish I could make this up  but in all seriousness I am sending my blessings to all those affected by the  #coronavirus"
82,Must be nice not believing in science and thinking that climate change and the coronavirus are irrelevant...,"Cuando el #coronavirus llegue a chapinero:

- its ok, I’m on PrEP.","if you get the corona virus, just drink modelo "
83,5 Presumptive Positive Coronavirus Cases Confirmed In Colorado https://trib.al/FOXnOLU ,I think this is how the Coronavirus started...,Wuhan Coronavirus Infections Could Be 30 Times Higher Than Official Tota... https://youtu.be/LZeKzqphlzM  vía @YouTube
84,"Two Denver residents and an El Paso County resident have tested 'presumptive positive' for the new coronavirus, health officials said. https://trib.al/JeKf1aj ","UCCS doesn't have any students currently in China, but CU Boulder is taking precautions in response to the coronavirus outbreak. https://krdo.com/news/2020/01/30/cu-boulder-suspends-study-abroad-programs-in-china-due-to-coronavirus-concerns/ …","Human to Human confirmation.

Time for a elevation to ""GLOBAL CRISIS"" folks.  Cant avoid it now WHO.

#nCoV2019
#coronavirus https://twitter.com/L0gg0l/status/1220858374096551936 …"
85,"21 people on Grand Princess cruise ship off California test positive for coronavirus, Pence says

https://www.foxnews.com/politics/pence-coronavirus-white-house-efforts …","Coronavirus, es tiempo.
???
  https://www.facebook.com/story.php?story_fbid=10158159193583746&id=627698745 …","BREAKING: St. Anthony Hospital is contacting the CDC to see if a patient with a potential respiratory illness should be evaluated for coronavirus.
https://kdvr.com/2020/01/24/st-anthony-hospital-contacting-cdc-to-see-if-patient-should-be-evaluated-for-coronavirus/ …"
86,men are a disease. coronavirus would never tell me i would look better if i smiled more,OMG!!  que heavyyy #coronavirus #CoronavirusChinohttps://twitter.com/DoctorAkicol/status/1220108052323610626 …,Oil prices likely to ‘stay down’ for months: Energy analysts fear impact of fast-spreading coronavirus http://bit.ly/2U3cYAD pic.twitter.com/WtSheaQm4b
87,Colorado health officials: eight people so far have tested positive for coronavirus in the state.,Oh no!  First confirmed coronavirus case identified in the US https://twitter.com/i/events/1219687502237167616 …,Don't search #coronavirus + fake news on Twitter. You'll find all the weirdos and conspiracy theorists having a party. pic.twitter.com/vn7Pt4bAht
88,"#UPDATE We've just learned of another presumptive positive #coronavirus test in Eagle County, a woman in her 50s. This brings the total to 8 in Colorado. At least five of the patients traveled internationally. @CDPHE is coordinating with @CDCgov on flights affected.",1st Case Of New Coronavirus Detected In U.S. http://www.tinyurl.com/yx5gannw ,Burberry warns coronavirus outbreak is hitting sales in China and it has shut more than a third of its stores
89,"Two Denver residents and an El Paso County resident have tested 'presumptive positive' for the new coronavirus, health officials said. https://trib.al/wWpIVZT ",1st confirmed case of new coronavirus reported in Washington state: CDC https://abcn.ws/36eGHJl ,"A U.S. citizen diagnosed with the coronavirus has died in Wuhan, the Chinese city at the center of the outbreak, marking the first known American death from the disease https://www.wsj.com/articles/an-american-citizen-diagnosed-with-coronavirus-has-died-in-china-11581141185 …"
90,"#Democrats luck...

They want: Trump and Republicans to contract the #Coronavirus 

Instead: The Virus spreads to Democrat voters who decided to cast their Primary votes for Bernie, which actually were counted for Joe... 

Welcome to the Left...where nothing can go Right. #MAGA",I’m sick in bed reading up on this new coronavirus infecting China that now just was found in someone in DC. Lmaoo great,"Forget coronavirus, I have XFL Fever!"
91,"Si no me mata el coronavirus me mata I don't know what to say about this one but I think it is a good idea to have a good time with you and your family.

JAJAJAAJ QUÉ PUTAS https://twitter.com/_onerolita/status/1234999382090514432 …",CDC confirms first U.S. case of China coronavirus #SmartNews   ⁦@realDonaldTrump⁩ ⁦@greggutfeld⁩ ⁦@JesseBWatters⁩ ⁦@TheFive⁩  @danaPerinohttps://www.reuters.com/article/us-china-health-usa-idUSKBN1ZK2FF …,"""This is not to say that we shouldn’t be concerned about people getting sick...We just shouldn’t treat this as something catastrophic.""
@UofDenver @josefkorbel professor Sandy Johnson is optimistic about stopping #Coronavirus. #DUResearch #DUNewsroomhttps://twitter.com/UofDenver/status/1225119777149972481 …"
92,"Denver Democrat faces backlash after tweeting ‘solidarity’ for spreading coronavirus at Trump rallies

https://www.foxnews.com/politics/denver-democrat-faces-backlash-after-tweeting-solidarity-for-spreading-coronavirus-at-trump-rallies …",coronavirus and chill?,"Coronavirus: how dangerous is it? https://youtu.be/jEPi1KYanh4 

V I R A L I T Y"
93,"Wow Google canceling I/O 2 months early over coronavirus
https://www.cnn.com/2020/03/03/tech/google-i-o-canceled-coronavirus/index.html …

via @GoogleNews",Wuhan China Coronavirus is spreading EVERYWHERE! People are collapsing a... https://youtu.be/03k7F3ygNAQ  vía @YouTube,https://youtu.be/ZQz3xaF1-bA  See the Coronavirus through the eyes of Wuhan citizens.#2019ncov #coronavirus #wuhan #wuhanchina #ncov #outbreak #pandemic #cdc #zombievirus #2020coronavirus #outbreak #chinaoutbreak #nottheflu #flu #wuhanchina #quarantinezone #osmosis #coronavirusnews
94,"Times like these I’m glad I have/had no money to invest in the stock market....

Perks to being a only parent Geriatrician with loans and nothing to  invest.

The #coronavirus #StockMarket  crash has really not impacted me in any way whatsoever",The Coronavirus w/parsley https://twitter.com/jim_cooks/status/1221930940127236096 …,It's probably hiv so.... Black blue bonnet rage 1 quit plague? Canada won't follow U.S. and declare national emergency over coronavirus: health minister - https://www.cbc.ca/news/politics/champagne-coronavirus-airlift-china-1.5447130 …
95,"""With recent volatility associated with the Coronavirus, it’s worth revisiting how we can help clients in navigating these turbulent times. The temptation for many..."" Continue reading Tony Davidows advice here
https://hubs.ly/H0nk6j-0 pic.twitter.com/IARe964y3y",#us state department has raised the travel advisory to level 3 meaning citizens should reconsider travel to all of China due to the #coronavirus,"Purports to show a Wuhan citizen saying infected people are basically ""left for dead"" by the hospitals, which are in total chaos, among other things

#coronavirus https://twitter.com/the_bad_raccoon/status/1221405485611585536 …"
96,It was nice knowing you. No amount of astrology will save from the coronavirus.,"Coronavirus Spread Self-Sustaining, Won't Stop With Warmer Weather: CFR https://youtu.be/ZO_XC3jI2c4  vía @YouTube","Early non-peer-reviewed research suggests R0 of 4.08 & fatality rate of 6.5%

Infected people may be spreading the virus for a surprisingly long period of time before showing symptoms, and after disappearance of symptoms

Very early stuff but from mainstream source

#coronavirus https://twitter.com/DrEricDing/status/1223664578703319041 …"
