,Positive,Neutral,Negative
97,"#coronavirus is the greatest potential threat to humanity 
1. $$ into testing kits now
2. $$ into research now
3. New regiments to protect military & all first responders
4. Close schools
5. New protocols for nursing homes
6. Cancel large gatherings now
7. Protect supply chains",$SPX Movers: Coronavirus infects the down movers today as Casino/Cruiseship/Airline stocks hit. Tech and Energy join the down moves as China pressures global growth outlook. $XLY $XLE $XLKpic.twitter.com/vJ4PRWkmbx,"Via @Reuters
https://reut.rs/2GObGSw 
@zerohedge has been banned by @Twitter 
on violating #Twitter’s rules after exposing personal data ofchinese scientist
As u know there're gossips on#coronavirus outbreak and #Wuhan Institute of Virology(military #biowarfare program?)pic.twitter.com/Rwv71WKLkZ"
98,Colorado has its first presumptive case of coronavirus; patient was visiting Summit County – The Colorado Sun. ⁦@lookner⁩https://coloradosun.com/2020/03/05/colorado-first-coronavirus-case-confirmed/ …,This coronavirus shit is crazzzyyyyyyyyyy.,"This is the most horrifying thing I’ve seen in quite awhile. This poor boy dying alone, unable to help himself. Coronavirus: Disabled boy dies in China after father quarantined - BBC News https://www.bbc.com/news/world-asia-china-51362772 …"
99,First Positive Coronavirus Case In Colorado Identified Is An Out-Of-State Visitor To Summit County https://www.cpr.org/2020/03/05/colorado-coronavirus-case-is-states-first-positive-health-officials-say/ …,"$NNVC #coronavirus play just insane action last 4 days.  Pressing 11.2s here in after hours.

75min to go. I expect action in $NVAX $LAKE $APT $INO .. 

Im shocked at how uninformed the financial media is .. almost just saying we've seen this before.  Uh, no we havent.  Not this.",Agree with it all but also agreed with what Epidemiologist Dr W. Ian Lipkin said that the reason Coronavirus is such a big worry is because its a brand new strand that we know nothing about and it could mutate before we learn anything.
100,It will be interesting to see how Coronavirus and how people/company/government response changes this prospectively. Less flu/illness? More openness to remote employees? ,"Weekly Chart Check-Up ... ""The Coronavirus and where it comes from and what it does.""

http://ow.ly/TEx650y4zzi ",Coronavirus Outbreak: Royal Caribbean Cancels 18 Sailings - https://wp.me/p6WPz2-7Q2 pic.twitter.com/Cm2xxLozRH
101,"I wonder if @realDonaldTrump realizes that the elderly are a big chunk of his base and his coronavirus response will kill a lot of them? Like he knows that they can't vote once they're dead, right? https://twitter.com/maddow/status/1237064582717472768 …",2nd U.S. Case Of Wuhan Coronavirus Confirmed http://www.tinyurl.com/sb4p89p ,"I think that for now they will not go to Europe, because the coronavirus is very danger, I think you need to wait one year."
102,Tips for staying healthy while flying in the age of coronavirus http://ow.ly/G0vP30qo0r0 ,i think i have coronavirus,@save_the_tweet #save Coronavirus scares Chinese investors. They sell all stock positions causing another global recession. Bitcoin is immune to the coronavirus just saying.
103,Round trip flight to Chicago $77. Thank you Coronavirus.,No joke.. the Corona virus is actually getting pretty bad. It’s growing exponentially faster and killing more people than any modern day outbreak. We’re far overdue for a pandemic. This might be the one that thins the population. The vaccine is a year out and over 100 have died.,WHO Concerned Over New Coronavirus Cases Outside China https://learningenglish.voanews.com/a/world-health-organization-concerned-over-new-coronavirus-cases-outside-china/5282010.html …
104,"As part of the CSU community, CIRA will be supporting all actions related to CSU's efforts regarding coronavirus.  

Updates continually online at: https://safety.colostate.edu/coronavirus https://twitter.com/ColoradoStateU/status/1237886453201268737 …","I’m calling it now. Trump will blame Mexico for the Coronavirus. 

","Time to stock up on meds. Even if #coronavirus doesn’t outbreak in the US, it will still have an impact on our most essential items. https://twitter.com/Laurie_Garrett/status/1230270375893884931 …"
105,"One day we are all going to wake up and no one will be talking about the coronavirus. No one will know when it stopped but it will, right after the government gets what they want out of this overally dramatized virus. And for that my friends, I can't wait.",Japan carmakers brace for supply and demand nightmares due to coronavirus...,Worried about #Coronavirus? Tell Trump to reverse cuts to critical US agencies | The Hill https://thehill.com/blogs/congress-blog/healthcare/483320-worried-about-coronavirus-tell-trump-to-reverse-cuts-to …
106,i went to public school AND worked in retail so coronavirus can get its ass kicked by my fuckn immune system lmaoooo,Increase to 564 the number of fatalities from the coronavirus - RT https://actualidad.rt.com/actualidad/342211-epicentro-coronavirus-china-muertes-casos-nuevos …,#coronavirus  this is some scary stuff coming out of China. This regime ... https://youtu.be/5fIQGkdCFR4  vía @YouTube
107,"You know you’re in a college town affected by #coronavirus when you see half of the people bulk buying dried goods and the other half bulk buying beer at the grocery store. 

In other news, $3 can buy you a lot of beans",Markets soar on unconfirmed reports of coronavirus treatment http://dlvr.it/RPSxMh pic.twitter.com/umG9FcXilc,"Mobile World Congress, the biggest smartphone tech show of the year, was canceled on Wednesday because of concerns about the coronavirus << This probably means #5G won't arrive for a few more years now. #MWC20"
108,Denver International Airport employee tests positive for coronavirus https://www.denverpost.com/2020/03/11/denver-airport-coronavirus/ … via @denverpost,"Chinese policymakers are readying measures to support an economy jolted by a coronavirus outbreak that is expected to have a devastating impact on first-quarter growth, policy sources said. #tesla https://finance.yahoo.com/news/us-stocks-rise-china-stimulus-073311849.html …pic.twitter.com/QlV14j4a7U",Netflix Smashes 52-Week High Even as Coronavirus Fears Ravage Stock Market https://www.ccn.com/netflix-smashes-52-week-high-even-as-coronavirus-fears-ravage-stock-market/ … vía @ccnmarkets
109,"#CancelEverything While the #coronavirus is circumferencing the world, could #Millenials please cancel production of half-baked quirky fusions of #Craftbeer? Please? Enough is enough. This #entrepreneurial wet dream is becoming a cliche, and being burdened to the bearded bruh.","Coronavirus Map:

https://bit.ly/39aDPyW 

I've shortened the URL.  The below is an example of the data received.pic.twitter.com/ShH62gtXWR","That’s great! Please break in & rescue our pets. 

Animal Rescuers Are Breaking Down Doors Of Private Apartments To Rescue Animals Left Behind Due To Coronavirus Outbreak #SmartNewshttps://www.boredpanda.com/rescue-pets-left-behind-wuhan-coronavirus/ …"
110,Thank god I snatched a boyfriend before coronavirus got crazy. Dating right now must be insane. It’s just “love in the time of cholera” all over again ,Scientist And Mom-Of-Two Sleeps Just Two Hours A Night To Invent A Vaccine For Coronavirus http://dlvr.it/RPPCLQ pic.twitter.com/MoGD4aAHPq,CSU will host a special forum focused on the science of coronavirus tomorrow at 5 p.m. in LSC Ballroom D. Hear our distinguished researchers address the relevant questions about this illness and its impact on global public health. CSU is committed to educating our community.
111,"The Colorado Sun is doing great reporting on coronavirus  in Colorado. One thought for everyone: We know with certainty there are more cases. Why don't we start calling these ""newly diagnosed cases""? https://twitter.com/JesseAPaul/status/1237527547925037057 …",Guy Who Stood Up On A Flight And Told An Entire Plane Full Of People He Had Coronavirus Really Deserves To Be Punched #SmartNewshttps://brobible.com/culture/article/coronavirus-airplane-toronto-flight/ …,Hah! Unfortunately I'm caught in #coronavirus limbo with an indeterminate delay before I get the 100 prototypes from my CM...  Orders were placed before the epidemic started so now I'm stuck with wait and see what happens. 
112,Thank God so far the coronavirus has not gotten to Colorado too much.  I pray it doesn't and I'm praying for all of you,"Dow surges a second day as manufacturing data, strong earnings offset coronavirus fears http://dlvr.it/RPPBBk pic.twitter.com/UIttZRNFj2","This is not third world, that's almost impossible. There is more chance to die in a fire shot in USA that getting coronavirus in Spain."
113,"Frankly if any of them two does contract the coronavirus, chances are pretty big they will die. That usually comes with choosing over two 78 year olds",Because SARS IS a type of Coronavirus.,Agreed! Hong Kongers have to save yourself especially now with the coronavirus which is giving them more of an excuse to imprison more Hong Kongers.
114,Do y’all know what would help with people not being able to work due to coronavirus? UBI. Like Yang said a couple months ago. #Yang," Adapt, improvise, overcome!
.
.
.
@nurselifern
#coronavirus #ncov
#nurselife #nurseproblems #scrublife #nursesbelike #nurseonduty #nursesunite #nurseprobs #instanurse #nursingstudent
#nursehumor #furnishedfinder #travelnursehousing #nursememe #nursememespic.twitter.com/Yzrcd1HUBE","Viruses are far smaller than the particles filtered by the Tesla HEPA filter, and Coronavirus is spread through contact, not air. https://www.ucsf.edu/news/2020/02/416671/how-new-coronavirus-spreads-and-progresses-and-why-one-test-may-not-be-enough …"
115,"I will NOT be getting one of these... Fast tracking so fast we are requiring ZERO safety tests, oh yeah and the makers have ZERO LIABILITY. #Merica
#coronavirus #bigpHARMa #dangerous #humanexperiments @AristeaBrady
@FOX31 @denverpost @9NEWS https://www.livescience.com/amp/coronavirus-vaccine-trial-no-animal-testing.html?__twitter_impression=true …","BBC News - Coronavirus:10 days of hospital building in 60 seconds
https://www.bbc.co.uk/news/world-asia-china-51348297 …","It's sounds like our government is down playing how serious this is!!!Coronavirus disruption to ‘everyday’ life in US ‘may be severe,’ CDC official says

https://www.foxnews.com/health/coronavirus-disruption-in-us-might-be-severe-cdc-official-says …"
116,Bro great Wolf lodge is closed for like 3 weeks because of the Coronavirus. I’m still getting paid. This is amazing,"It’s the second novel coronavirus case announced in Santa Clara County in the past three days but the two cases are not related, officials say. https://dpo.st/2UkeD5e ",CC: @Breaking57 - DO NOT PANIC... yet. #coronavirus https://twitter.com/630khow/status/1232444886407757824 …
117,Me trying to protect myself from the #Coronavirus pic.twitter.com/RJi5uGEoSi,"Check out my podcast, Conversations with Phil and Pete , on @anchor! https://anchor.fm/phil-pete  #podcast #SuperBowl #PrayForRush #coronavirus",Really? The Corona virus can only be brought here by illegal immigrants? Your stupidity is incredible.
118,THIS! We JUST wrote about the same thing- social distancing and #SelfQuarantine are the only ways we as individuals can control #coronavirus. Thanks for the update & thank you for doing a self-quarantine. https://www.starternoise.com/how-to-control-coronavirus-social-distancing/ …,"I sent out a YouTube video about event201, the simulation before the release of the Coronavirus back in October. It's a genetically engineered virus, but they're telling you it came from a bat like they said HIV came from a monkey! Foolishness!","Over the next few weeks; we’re going to see billions of dollars invested from governments, companies, and billionaires to fight the #CoronaVirus. 

This virus will erase years of economic growth, and have a disastrous effect on the world."
119,.@premierleague will meet Friday to discuss whether to proceed with matches after Mikel Arteta's positive #coronavirus test,"Egypt 

 has reported their 1st case of #coronavirus. The patient is a foreigner with no symptoms. This is the first case in Africa....NO Symptoms Troy ~~Open borders~~","Rush is right! Coronavirus being weaponized by China, respiratory infection yes, 98% survival. Goal to scare investors, take down the stock market. MSM aiding to scare people. NOT a pandemic. NOT close. @realDonaldTrump What is clear is that we should manufacture medicines in US."
120,"Even before all the coronavirus talk, I’ve seen people just walk away and not clean ","Going a cruise? Worried about the Corona Virus? Well check out this article for reassurance that you will be fine to travel!
#cruising #coronavirus #travel #dontworryhttps://newmavmedia.wordpress.com/2020/02/13/cruising-with-the-corona-virus/ …",Market melts down over coronavirus fears https://youtu.be/mBCc5t-bF-o  via @YouTube
121,@UNALOficial  has suspended classes nationwide and has moved virtual. Best decision ever #coronavirus https://twitter.com/UNALOficial/status/1239304621144838146 …,"For the love of all that is holy, please, talk to an expert in #phethx and/or #phlaw (who have often spent YEARS thinking about these kinds of problems).

Cruise ship passengers riled over order for added 2-week coronavirus quarantine in U.S. https://www.washingtonpost.com/world/us-to-evacuate-americans-from-cruise-ship-and-put-them-in-14-days-quarantine/2020/02/15/8b05eadc-4fc1-11ea-a4ab-9f389ce8ad30_story.html …","@rushlimbaugh @foxandfriends @seanhannity @realDonaldTrump @WhiteHouse @VP @Varneyco @foxandfriends Rush is right! Coronavirus is a respiratory infection, like a common cold BUT is weaponized by China; spreading fear by MSM to scare investors, tank stock market, why? Hurt TRUMP!"
122,"The best thing everyday Americans can do to fight coronavirus? #StayHome, save lives #COVID19https://www.usatoday.com/story/opinion/2020/03/15/coronavirus-stay-home-hel-america-save-lives-column/5054241002/ …",Anyone else want to use coronavirus as an opportunity to suggest we go back to laity only receive the Eucharist under one species?,"CORONAVIRUS PERINATAL NEONATAL
Chinese expert consensus on the perinatal and neonatal management for the prevention and control of the 2019 novel coronavirus infection (First edition)
Ann Transl Med 2020;8(3):47 | http://dx.doi.org/10.21037/atm.2020.02.20 …"
123,Coronavirus got me trying foods I didn't know existed like sweet potato rice and organic dried cherries.,Coronavirus scaring China  Investors pulling out of stock investments and buying bitcoin it’s immune to the coronavirus ,"White Supremacist #realDonaldTrump goes full racist to cover up his coronavirus lies and incompetence

@SenCoryGardner and @RepDLamborn endorse The #GOP Lifestylehttps://www.rawstory.com/2020/02/trump-goes-full-racist-to-cover-up-his-coronavirus-lies-and-incompetence/#.XlmndMCkTqc.twitter …"
124,"Haha yes sir bro. Out here collecting all this Coronavirus mayne! Our drivers and shopworkers handle this shit daily. All good tho, that's money baby!! ",Russian media outlets are blaming the coronavirus on the United States https://www.motherjones.com/politics/2020/02/russian-disinformation-coronavirus/ … via @MotherJones,He doesn't care that Americans may lose their lives. He is doing nothing to help stop the spread of the virus. He's only worried about its effect on his reelection...  'Trump Is Worried The Coronavirus Will Cost Him The Election' https://www.politicususa.com/2020/02/21/trump-is-worried-the-coronavirus-will-cost-him-the-election.html … via @politicususa
125,Ain't no coronavirus coming up in here. My house smells like Fabuloso. That shit clean third world dirt. Keep it purple ya'all,Coronavirus fight: Hundreds of trucks were dispatched to spray disinfect... https://youtu.be/wYbTkcZCRq8  vía @YouTube,"Coronavirus headlines worry employers and workers, but health experts seek to dispel fears: https://hubs.ly/H0mT9D_0  by @RH_restaurantpic.twitter.com/qeD53hOWxO"
126,"@Microsoft sent my fiancé @art_by_night who works for them, this package! 
Talk about a company who shows care for their employees, thank you!  
We plan on donating the extras, but have needed this desperately #coronavirus #COVID19US #MSFTAdvocate #CoronaCrisispic.twitter.com/Pdfh3bMJvV","Most coronavirus cases are mild, complicating the response https://www.washingtonpost.com/health/most-coronavirus-cases-are-mild-complicating-efforts-to-respond/2020/02/12/213603a4-4dc2-11ea-bf44-f5043eb3918a_story.html …","#coronavirus #covid19 ""10 Italian Towns In Lockdown Over Coronavirus Fears"" Over 50,000 people have been asked to stay at home in the areas concerned, while all public activities (...) have been banned for up to a week.
https://www.ibtimes.com/10-italian-towns-lockdown-over-coronavirus-fears-2926762 …"
127,"Pandemics affect men and women differently, and the coronavirus is going to set back women's rights, @helenlewis reports:https://www.theatlantic.com/international/archive/2020/03/feminism-womens-rights-coronavirus-covid19/608302/?utm_source=twitter&utm_medium=social&utm_campaign=share …",Pangolins Are Suspected as a Potential Coronavirus Host - The New York Times https://www.nytimes.com/2020/02/10/science/pangolin-coronavirus.html …,"Public confidence is not the main concern. By withholding/manipulating data, China is allowing a false sense of hope & eliminating the world's ability to take precautions & implement aggressive countermeasures. Could cost thousands or millions of lives. #coronavirus #COVID19"
128,"While washing your hands is absolutely a good idea in fighting #coronavirus, my problem is that my faucet only has two settings: not hot enough, and OH MY GOD I’M GOING TO BURN MY HANDS OFF...which I guess would solve the problem.",Cancelando el Mobile World Congress de Barcelona por el coronavirus https://guapacho.com/cancelando-el-mobile-world-congress-de-barcelona-por-el-coronavirus/ …,Coronavirus Outbreak: Italy has reported its second death | WION News | ... https://youtu.be/EZtvFKyh5xA  via @YouTube
129,My wife.  Second day in her new job and the person assigned to train her in the skilled nursing facility is having her first day back to work after testing positive for coronavirus.  Some orientation.  #AboveAndBeyond #RN #coronavirus https://twitter.com/budweiserusa/status/1240752563995258882 …pic.twitter.com/XmovVT2o2R,Imagine the panic if cigarettes killed exponentially more people than coronavirus. Oh...well...this is awkward. https://twitter.com/cnnbrk/status/1229909687987994625 …,"Mike Pence. If you have elderly or sick relatives you care about, it is probably a good idea to get in contact with them. The odds of them surviving the impending coronavirus outbreak just dropped significantly. Fuck."
130,"Fun fact: One of the fathers of #EPIDEMIOLOGY is named John Snow #coronavirus
https://en.wikipedia.org/wiki/John_Snow ","Bishop Joseph Zhu Baoyu, Bishop Emeritus of Nanyang, has recovered from coronavirus. At age 98, he is among the oldest infected patients to have recovered. http://bit.ly/2P57UIF ",Is a Coronavirus joke considered black or yellow humor? Does it have a bigger chance to become a viral joke?
131,"I had plans to go to Vegas for my 23rd bday this weekend. That shit ain’t happening no more.

I was actually excited to celebrate my bday this year and hoe ass coronavirus was like “Nah fam” ","Coronavirus (COVID-19) will burn itself out in 6 months w/out any vaccine

https://news-yahoo-com.cdn.ampproject.org/v/s/news.yahoo.com/amphtml/coronavirus-expert-says-knows-virus-204850255.html?amp_js_v=a2&amp_gsa=1&usqp=mq331AQCKAE%3D#aoh=15814719226532&referrer=https%3A%2F%2Fwww.google.com&amp_tf=From%20%251%24s&ampshare=https%3A%2F%2Fnews.yahoo.com%2Fcoronavirus-expert-says-knows-virus-204850255.html …","""Covering your cough, staying home when you're sick, and washing your hands"" can prevent spread of coronavirus (and other diseases). This advice from the CDC seems so obvious but practically every day I see people ignoring the advice."
132,Lockdown releases geniuses @danajaybein and her Coronavirus Rhapsody  #Covid_19 https://threadreaderapp.com/thread/1240307541491494912.html …,"@realDonaldTrump Thought you said you had this under control?  @ny_red1. 
44 Americans On The Diamond Princess Cruise Ship Diagnosed With Coronavirus https://www.npr.org/2020/02/16/806470340/americans-evacuate-diamond-princess-cruise-ship-amid-spread-of-infection?sc=18&f=1001 …","Coronavirus travels from animals to humans. So animals can carry it. I also dont believe it only kills 2%, why the fuck would are they quarantining everything. That by itself shows how deadly this shit is."
133,"The Senate vote was 90 to 8 Just minutes after the SCDHEC announced the Palmetto State had 60 presumed positive #coronavirus cases @LindseyGrahamSC  voted in favor of the bill, but @SenatorTimScott  voted against it. 
https://www.newsobserver.com/news/state/south-carolina/article241231881.html#storylink=cpyhttps://www.newsobserver.com/news/state/south-carolina/article241231881.html …https://twitter.com/NBCNews/status/1240371284959256580 …","Wonder if my work, who makes us drive in during a severe blizzard or use PTO, will force us to come into the office during the #coronavirus outbreak instead of working remotely",RT @tedlieu: Dear @realDonaldTrump: Your racism is no longer working. Perhaps you should try bringing the American people together. Or maki…
134,The Dow's gains under Trump have been wiped out by coronavirus - FORTUNE #ChinaLiedPeopleDiedhttps://apple.news/AusY4c2CnSyKoS-1GNOvDjw …,DHS deputy chief won’t rule out theory that coronavirus was created in a Chinese lab https://www.bizpacreview.com/2020/02/25/dhs-deputy-chief-wont-rule-out-theory-that-coronavirus-was-created-in-a-chinese-lab-890979 … via @BIZPACReview,RT @NEJM: The outbreak on the cruise ship Diamond Princess led to the identification of 96 persons who were infected with SARS-CoV-2 but we…
135,"NBC News: Trump says it may be 'the story of life' that well-connected get coronavirus testing first.
https://www.nbcnews.com/news/us-news/coronavirus-nyc-mayor-slams-nets-over-testing-trump-weighs-n1162971?cid=googlenews-usnews …

via @GoogleNews","Coronavirus disease (COVID-19) advice for the public: Myth busters from @WHO: https://www.who.int/emergencies/diseases/novel-coronavirus-2019/advice-for-public/myth-busters …

CDC: https://www.cdc.gov/coronavirus/2019-ncov/summary.html …

Please go to trusted sources, not internet graphics and memes.https://twitter.com/nytimes/status/1232358387142287362 …",Fight The Virus - Miley Cyrus ft. Pedro Sanchez
136,Naps are an important part of #SocialDistancing and #coronavirus health .,Someone tell Trump the Corona Virus is coming from Mexico and he will shut that shit down. Everyone at the CDC will be drinking Budweiser,"RT @electroboyusa: Why do Republicans think we're EMERGING from the #COVID19 epidemic when these are the facts?

116,831 dead 
2,117,027 ca…"
137,"Clinical Characteristics of Patients With 2019 Novel Coronavirus (2019-nCoV)–Infected Pneumonia in Wuhan, China https://ja.ma/3a2uVo4 ",Moderna delivers first coronavirus vaccine for human testing https://youtu.be/Y76m1KRj-UU  via @YouTube,"RT @yourICM: #COVID19 induced #AKI in critically ills with #SARSCoV2 #Coronavirus infection: several mechanisms possibly involved, prevalen…"
138,"I had a genius idea in the lab to develop a treatment for coronavirus infected patients, but we don't have the resources where I'm at. I don't think we have the resources for this much more realistic endeavor either.","CNN's coronavirus coverage criticized: ‘Trump Derangement Syndrome strikes again’

https://www.foxnews.com/media/cnn-coronavirus-trump …",In coffee fields around the world the 20c per poundFairtrade premium is many times less than the income lost by far… https://t.co/ZLsHaqAjSN
139,The first case of coronavirus in the UK was on 31 January... now @MattHancock decides we don't have enough ventilators a whole 45 days later. Scandalous.https://twitter.com/MattHancock/status/1239521271282577416 …,I guarantee you Trump only put a gag-order on doctors that visited the White House over the coronavirus has nothing to do with public fear or outcry but everything to do with The DOW,"RT @YourAnonNews: Yesterday, there were 140,927 new cases of #COVID19 and 4,603 additional deaths were reported in the past 24 hours.

This…"
140,"I work in the food industry, so you may find it valuable to learn that  there is **no evidence** that COVID-19 Coronavirus can be transmitted on food or packaging.

https://plantingseedsblog.cdfa.ca.gov/wordpress/?p=20908 …""",Trump furious Americans infected with coronavirus flew back to US without his permission: report https://fxn.ws/2Ta9ESt  #FoxNews,"RT @GrandmaSaidNo: Never forget that the US federal government is responsible for the high COVID-19 death toll on our Nation. 

The magnitu…"
141,Thankfully no one really likes reduced calorie hot cocoa #coronavirus,Stocking up for the Coronavirus?,"RT @BombshellDAILY: VIRUS HERE TO STAY
Unlike all other countries, America’s ignoring the pandemic, has only furthered its deadly progress.…"
