,Tweets,Date
152,4 ways to protect our jails and prisons from coronavirus https://thehill.com/opinion/criminal-justice/485236-4-ways-to-protect-our-jails-and-prisons-from-coronavirus#.Xl7tidrihc4.twitter …,2020-03-03 23:51:44
153,17th Israeli diagnosed with coronavirus https://www.jpost.com/Breaking-News/16th-Israeli-diagnosed-with-coronavirus-619908 …,2020-03-05 23:59:54
154,This was the reason for the Coronavirus https://twitter.com/HoldOffOnYoHate/status/1235063939475451905 …,2020-03-05 23:59:37
155,"Impact of the Coronavirus on the U.S. Housing Market: The Coronavirus (COVID-19) has caused massive global uncertainty, including a U.S. stock market correction no one could have seen coming. While much of the news has been about the effect on various… http://dlvr.it/RRKws5 pic.twitter.com/5Ni9yjya8c",2020-03-05 23:59:32
156,when leslie and i get coronavirus after visting new york next weekend ,2020-03-05 23:52:16
157,"One of the better dashboards for tracking the Coronavirus threat

- Started by HS students
- Global data aggregator
- Crowdsourced*
- Constantly upgrading
- Visual Optimization

 Live Updates:
https://ncov2019.live/data 
#Coronavirus #analytics #panicbuyers #KAG #Tulsi2020 #M4A",2020-03-08 23:57:08
158,Ain’t nobody give a fuck about the coronavirus old town is still lit and packed ,2020-03-08 23:54:27
159,Mixed White House messaging on coronavirus sparks internal frustration.  They’re fighting in the WH boys and girls. It’s quite a challenge to get #POTUS to tell the truth - even in matters of life and death. ⁦@realDonaldTrump⁩ is a #SerialLiar so...https://www.nbcnews.com/politics/white-house/mixed-white-house-messaging-coronavirus-sparks-internal-frustration-n1152606 …,2020-03-08 23:50:49
160,Coronavirus: New Data Introduces (Some) Hope https://youtu.be/Rb94GXQVEKQ  via @YouTube,2020-03-09 23:59:56
161,"Sixth Coronavirus Case Confirmed in Arizona, This Time in Pima County https://www.phoenixnewtimes.com/news/sixth-coronavirus-case-confirmed-in-arizona-this-time-in-pima-county-11455339?utm_source=dlvr.it&utm_medium=twitter …pic.twitter.com/rEPgq9ymIj",2020-03-09 23:57:03
162,"@DHSgov Is the fact that we have had 36,660 Illegals in Jan and 37,119 Feb 2020 illegals coming from all over the world (China Yemen++) traveling to 48 contiguous states might have anything to do with #coronavirus?  #BuildTheWall @realDonaldTrumppic.twitter.com/XcdEF2uqdX",2020-03-11 23:57:57
163,"Bro I'm from Sasabe, Sonora the fuck is a coronavirus?",2020-03-11 23:57:06
164,#coronavirus @ASU taking classes online in response to #COVID19,2020-03-11 23:57:00
165,NCAA: Allow Ivy League student-athletes to keep a year of eligibility from Coronavirus outbreak. - Sign the Petition! http://chng.it/YFgqZrHY  via @Change,2020-03-11 23:56:41
166,He had a reason.  He closed it because Obama created it.  His irrational obsession with Obama is costing us in so many ways. #Coronavirus #Trumpdemic #TrumpLiesAboutCoronavirushttps://twitter.com/brhodes/status/1237525438588547072 …,2020-03-10 23:56:29
167,Update: any mention of “Coronavirus” in any iteration will result in video takedown,2020-03-10 23:56:11
168,Hold on- this coronavirus got me a little scared ,2020-03-10 23:54:50
169,"Thanks for the email on coronavirus, airport parking service I used that one time over six years ago.",2020-03-13 23:59:27
170,I hope the Coronavirus is ended soon,2020-03-13 23:56:50
171,ACT NOW! Fire Anti-Semitic Professor Exploiting Coronavirus to Slander Israel https://unitedwithisrael.org/act-now-fire-anti-semitic-professor-exploiting-coronavirus-to-slander-israel/ …,2020-03-12 23:59:45
172,"Coronavirus V. Capitalism, who you got?",2020-03-12 23:58:47
173,Didnt you just tweet earlier that the flu is deadlier and the Coronavirus isnt as big of a deal as people are making out to be??,2020-03-12 23:58:42
174,"More Americans have died this year from DOG MAULINGS &
BATHTUB DROWNINGS than from Coronavirus.STOPTHEPANIC https://twitter.com/AnthemRespect/status/1238200452526702593 …",2020-03-12 23:58:32
175,One good thing out of #coronavirus is that I found out I wasting a ton of Tee Pee.  I would give it a roulette wheel spin and use 16 squares.... lol. Not anymore #toiletpaperConservation,2020-03-12 23:58:21
176,so when is the coronavirus going to make gas prices drop?,2020-03-12 23:57:54
177,I wish tik tok would get the coronavirus,2020-03-12 23:57:47
178,Some of you who think people are overreacting over the coronavirus need to get educated. This is very serious and only the beginning.,2020-03-12 23:57:28
179,I just Bought Avischiffmann a Coffee on Ko-fi!  https://Ko-fi.com/home/coffeeshop?txid=f37306e5-9486-4c80-941e-00e15f7052c4&mode=public&img=ogiboughtsomeone … -- Coronavirus Dashboard: http://ncov2019.live ,2020-03-15 23:57:21
180,AVOID CANDYTOPIA!!!  In the wake of our country being  almost completely shut down due to the Coronavirus this place absolutely refuses to refund tickets!  We asked several times for reimbursement and continually get refused.,2020-03-15 23:57:07
181,Don't tell me that the Coronavirus will postponed the beginning of the WNBA season,2020-03-15 23:56:48
182,Given what I have just read about Donald tRump & the Coronavirus Vaccination he wanted to purchase it only for the United States of America. What a piece of CRAP he is! #DumpTrump #BlueTsunami2020 #VoteHimOut,2020-03-15 23:56:32
183,Sherrod Brown explodes in rant slamming Donald Trump and Mitch McConnell's handling of coronavirus https://www.dailykos.com/story/2020/3/18/1928676/-Sherrod-Brown-explodes-in-rant-slamming-Donald-Trump-and-Mitch-McConnell-s-handling-of-coronavirus …,2020-03-19 23:59:40
184,Will the People Vote Out Politicians Instituting a Coronavirus Crackdown? http://dlvr.it/RSKR6M ,2020-03-21 23:58:02
185,Will the People Vote Out Politicians Instituting a Coronavirus Crackdown? http://dlvr.it/RSKR5Z ,2020-03-21 23:58:02
186,"Richard Burr, Kelly Loeffler urged to resign for selling stocks after coronavirus briefing https://nypost.com/2020/03/20/richard-burr-kelly-loeffler-urged-to-resign-for-selling-stocks-after-coronavirus-briefing/ …",2020-03-21 23:57:48
187,Yuval Noah Harari: the world after coronavirus https://www.ft.com/content/19d90308-6858-11ea-a3c9-1fe6fedcca75 … via @financialtimes,2020-03-21 23:57:37
188,"Nearly 5,500 National Guard troops deployed to combat coronavirus https://thehill.com/policy/defense/488806-nearly-5500-national-guard-troops-deployed-to-combat-coronavirus?fbclid=IwAR1hH5UxjE8zTUf1E2PTI1ViRrn7BHFoZ3BKQRCINoeI8syu_A6k6Rv3uiE …",2020-03-21 23:55:55
189,Governor Ducey Announces That Arizona To Receive Vital Supplies For Health Care Workers https://theumphx.com/2020/03/21/governor-ducey-announces-that-arizona-to-receive-vital-supplies-for-health-care-workers/ … #arizonahealthupdate #coronavirus #arizonacovid19,2020-03-21 23:55:07
190,"Coronavirus update: there are 7,799,931 people in Arizona who don’t have corona. There are 69 cases and zero deaths. Is the reaction proportional?",2020-03-20 23:58:04
191,"This just in:

#IRS has extended the federal income tax filing deadline to match the July 20 payment deferral. 

Americans now have a little more time to financially regroup in the midst of the #coronavirus pandemic. Get the update on our blog!

https://www.redw.com/blog/2020/03/20/federal-tax-filing-deadline-extended-to-july-15/ …",2020-03-20 23:57:30
192,"I see that #ToneDeafMegyn makes another appearance. 

Now, we know what $69 million CAN'T buy.

#WorstPresidentEver #PANDUMBIC #COVID19 #coronavirus pic.twitter.com/YEAZnHJgaG",2020-03-18 23:58:44
193,Time will tell how coronavirus impacts the housing market – Here are 2 areas to monitor in the meantime https://www.housingwire.com/articles/time-will-tell-how-coronavirus-impacts-the-housing-market-here-are-2-areas-to-monitor-in-the-meantime/ …,2020-03-18 23:57:55
194, ICE agents make arrests on first day of CA coronavirus lockdown  https://twitter.com/i/events/1239985474606784512 …,2020-03-17 23:59:39
195,Momma and I are making chuchitos  Coronavirus a la mierda,2020-03-17 23:58:33
196,"@Grubhub @Postmates @DoorDash @UberEats Now is the time to step your game up. I hope you guys are offering incentives to get more drivers on the road to handle the upcoming increase in delivery orders.
#IMO #coronavirus",2020-03-17 23:58:00
197,These simulations show how to flatten the coronavirus growth curve https://wapo.st/corona-simulator?tid=ss_tw …,2020-03-15 23:59:43
198,"“It’s new for all of us but we really are trying to continue to keep business going in the city but making sure that we’re protecting our residents,” said @DebraStarkPHX #Phoenix #COVID19 #coronavirus | KJZZ https://kjzz.org/content/1490256/how-do-publics-business-while-limiting-public-interaction …",2020-03-17 23:56:50
199,"The oddest thing, ppl are buying bullets and guns ? For the coronavirus",2020-03-16 23:58:39
200,Fuck the coronavirus..... that’s all,2020-03-16 23:58:03
201,The Health and Human Services Department suffered a cyber-attack on its computer system during the response to the coronavirus pandemic https://www.bloomberg.com/news/articles/2020-03-16/u-s-health-agency-suffers-cyber-attack-during-covid-19-response … via @bpolitics,2020-03-16 23:57:55
202,MUCH NEEDED  Otter livestream by #California aquarium brings 'pawsitivity' during coronavirus pandemic http://bit.ly/2w4QOVk ,2020-03-16 23:57:44
203,"Coronavirus update: there are 7,799,931 people in Arizona who don’t have corona. There are 69 cases and zero deaths. Is the reaction proportional?",2020-03-20 23:58:04
204,"This just in:

#IRS has extended the federal income tax filing deadline to match the July 20 payment deferral. 

Americans now have a little more time to financially regroup in the midst of the #coronavirus pandemic. Get the update on our blog!

https://www.redw.com/blog/2020/03/20/federal-tax-filing-deadline-extended-to-july-15/ …",2020-03-20 23:57:30
205,"I see that #ToneDeafMegyn makes another appearance. 

Now, we know what $69 million CAN'T buy.

#WorstPresidentEver #PANDUMBIC #COVID19 #coronavirus pic.twitter.com/YEAZnHJgaG",2020-03-18 23:58:44
206,Time will tell how coronavirus impacts the housing market – Here are 2 areas to monitor in the meantime https://www.housingwire.com/articles/time-will-tell-how-coronavirus-impacts-the-housing-market-here-are-2-areas-to-monitor-in-the-meantime/ …,2020-03-18 23:57:55
207,They should have announced this even before the coronavirus....,2020-03-18 23:56:19
208,"The oddest thing, ppl are buying bullets and guns ? For the coronavirus",2020-03-16 23:58:39
209,Fuck the coronavirus..... that’s all,2020-03-16 23:58:03
210,The Health and Human Services Department suffered a cyber-attack on its computer system during the response to the coronavirus pandemic https://www.bloomberg.com/news/articles/2020-03-16/u-s-health-agency-suffers-cyber-attack-during-covid-19-response … via @bpolitics,2020-03-16 23:57:55
211,MUCH NEEDED  Otter livestream by #California aquarium brings 'pawsitivity' during coronavirus pandemic http://bit.ly/2w4QOVk ,2020-03-16 23:57:44
212,Sherrod Brown explodes in rant slamming Donald Trump and Mitch McConnell's handling of coronavirus https://www.dailykos.com/story/2020/3/18/1928676/-Sherrod-Brown-explodes-in-rant-slamming-Donald-Trump-and-Mitch-McConnell-s-handling-of-coronavirus …,2020-03-19 23:59:40
213,Will the People Vote Out Politicians Instituting a Coronavirus Crackdown? http://dlvr.it/RSKR6M ,2020-03-21 23:58:02
214,Will the People Vote Out Politicians Instituting a Coronavirus Crackdown? http://dlvr.it/RSKR5Z ,2020-03-21 23:58:02
215,"Richard Burr, Kelly Loeffler urged to resign for selling stocks after coronavirus briefing https://nypost.com/2020/03/20/richard-burr-kelly-loeffler-urged-to-resign-for-selling-stocks-after-coronavirus-briefing/ …",2020-03-21 23:57:48
216,Yuval Noah Harari: the world after coronavirus https://www.ft.com/content/19d90308-6858-11ea-a3c9-1fe6fedcca75 … via @financialtimes,2020-03-21 23:57:37
217,"Nearly 5,500 National Guard troops deployed to combat coronavirus https://thehill.com/policy/defense/488806-nearly-5500-national-guard-troops-deployed-to-combat-coronavirus?fbclid=IwAR1hH5UxjE8zTUf1E2PTI1ViRrn7BHFoZ3BKQRCINoeI8syu_A6k6Rv3uiE …",2020-03-21 23:55:55
218,Governor Ducey Announces That Arizona To Receive Vital Supplies For Health Care Workers https://theumphx.com/2020/03/21/governor-ducey-announces-that-arizona-to-receive-vital-supplies-for-health-care-workers/ … #arizonahealthupdate #coronavirus #arizonacovid19,2020-03-21 23:55:07
219,I just Bought Avischiffmann a Coffee on Ko-fi!  https://Ko-fi.com/home/coffeeshop?txid=f37306e5-9486-4c80-941e-00e15f7052c4&mode=public&img=ogiboughtsomeone … -- Coronavirus Dashboard: http://ncov2019.live ,2020-03-15 23:57:21
220,AVOID CANDYTOPIA!!!  In the wake of our country being  almost completely shut down due to the Coronavirus this place absolutely refuses to refund tickets!  We asked several times for reimbursement and continually get refused.,2020-03-15 23:57:07
221,Don't tell me that the Coronavirus will postponed the beginning of the WNBA season,2020-03-15 23:56:48
222, ICE agents make arrests on first day of CA coronavirus lockdown  https://twitter.com/i/events/1239985474606784512 …,2020-03-17 23:59:39
223,Momma and I are making chuchitos  Coronavirus a la mierda,2020-03-17 23:58:33
224,"@Grubhub @Postmates @DoorDash @UberEats Now is the time to step your game up. I hope you guys are offering incentives to get more drivers on the road to handle the upcoming increase in delivery orders.
#IMO #coronavirus",2020-03-17 23:58:00
225,These simulations show how to flatten the coronavirus growth curve https://wapo.st/corona-simulator?tid=ss_tw …,2020-03-15 23:59:43
226,"“It’s new for all of us but we really are trying to continue to keep business going in the city but making sure that we’re protecting our residents,” said @DebraStarkPHX #Phoenix #COVID19 #coronavirus | KJZZ https://kjzz.org/content/1490256/how-do-publics-business-while-limiting-public-interaction …",2020-03-17 23:56:50
