,Tweets,Date
0,The same thing will happen here no matter how often or how loudly Trump applauds his unparalleled response to the coronavirus. Viruses can’t hear.,2020-04-29 23:58:17+00:00
1,Everyone post the most representative photo of themselves living quarantine life. #QuarantineLife #COVID19 #coronavirus ,2020-04-29 23:56:01+00:00
2,"Trump please arrange as many rallies as you can and certainly they have to be side by side so you can get 400,000 in the arena. Go get em Trump. What are you waiting for? The coronavirus is just a hoax, remember. Make arrangements as soon as possible and invite your klan okay?",2020-04-29 23:50:08+00:00
3,Oxford University Coronavirus Vaccine's 500 Human Trials Begin From Thursday https://www.indiatimes.com/technology/science-and-future/oxford-university-coronavirus-vaccines-500-human-trials-begin-from-thursday-511469.html via @indiatimes,2020-04-29 23:30:58+00:00
4,"Reading/listening to The Great Influenza, a book that was published 15 years ago. Hearing Corona Virus named when discussing flu is chilling, even though, yes, I understand Coronas have existed for ages...",2020-04-29 23:28:00+00:00
5,Big commercial labs given priority for coronavirus testing equipment by feds ,2020-04-29 23:52:48+00:00
6,A Doctor Reviews DIY Coronavirus Face Masks https://www.radiofr.ee/59s #RadioFree #News,2020-04-29 23:23:37+00:00
7,Fighting Coronavirus in London: A Junior Doctor's Journey on the Frontline https://www.radiofr.ee/59r #RadioFree #News,2020-04-29 23:23:29+00:00
8,House Democrats Aren't Going to Impeach Trump Over Coronavirus — But They're Watching Him https://www.radiofr.ee/59q #RadioFree #News,2020-04-29 23:23:21+00:00
9,Fuck you coronavirus this some bullshit,2020-04-29 23:22:53+00:00
10,"3 of 4 Arizonans who've died of the coronavirus were 65 or up. Meanwhile,18% were Native Americans. That's more than triple the rate of their representation in the state of 5.3 percent or nearly 1 of 5 Arizonans killed by the disease. https://www.azcentral.com/story/news/local/arizona-health/2020/04/29/coronavirus-arizona-cases-exceed-7-200-304-deaths/3043292001/ via @azcentral",2020-04-29 23:10:59+00:00
11,What ever happened to stay at home being about not overwhelming hospitals. Hospitals aren’t even at 20% capacity with Coronavirus patients.,2020-04-29 23:09:57+00:00
12,"Written by a Phoenix, AZ native. @dougducey @CityofPhoenixAZ #coronavirus #quarantine #healthalert #ringtone",2020-04-29 23:05:59+00:00
13,"CORONA VIRUS: With this virus, Americans move one more step closer to complete slavery. Insertion of computer chips in the human body. Paperwork a mile long just to take shit. Slavery, will be wonderful for your children, as they learn to obey all the wonderful rules! Utopia!",2020-04-29 22:58:56+00:00
14,"Two guards at an immigration detention center in Louisiana have died after contracting the coronavirus, raising new questions about whether the U.S. government is adequately protecting staff and immigrants in custody. Read more &gt;&gt; http://bit.ly/2SjsWoM",2020-04-29 22:56:48+00:00
15,"He couldn't get your vote in the first place, they're called ""term limits"" for a reason genius. I'm betting you probably don't even really live in Arizona. Enjoy your coronavirus though, you won't be able to vote at all from the ICU! ",2020-04-29 22:40:37+00:00
16,"After halting operations last month due to the coronavirus, the U.S. #Census Bureau has a new schedule to get back on track to count everyone in America. #ChamberBizNews",2020-04-29 22:38:59+00:00
17,"Burbidge: ‘Our business survived two world wars, but coronavirus is one of our biggest challenges’ | Sage Advice United Kingdom ",2020-04-29 22:36:04+00:00
18,"Couple married for 73 years, both positive for coronavirus, die hours apart ",2020-04-29 23:08:32+00:00
19,"Earlier this year, KJZZ took you to the town of Guadalupe as part of our Untold Arizona series. At the time, Guadalupe’s leaders hoped to grow their economy — but then came the coronavirus pandemic. @kathymritchie followed up with the town’s mayor.",2020-04-29 22:34:00+00:00
20,Many people in Arizona can now be tested. Less restrictions. Where in #AZ: #AZtestingblitz #aztogether #COVID19 #coronavirus #test #CoronaVirusUpdate #TestTraceIsolate #healthcare #GroceryWorkers #EssentialWorkers,2020-04-29 22:33:02+00:00
21,One experimental vaccine trial seems to be way ahead of the game. #Coronavirus #Health #Science #WorldNews,2020-04-29 22:30:33+00:00
22,Coronavirus has created a crisis for primary care doctors and their patients https://www.vox.com/2020/4/27/21231528/coronavirus-covid-19-primary-care-doctors-crisis?utm_campaign=vox&amp;utm_content=entry&amp;utm_medium=social&amp;utm_source=twitter via @voxdotcom,2020-04-29 22:30:02+00:00
23,And here’s a look at what Gov @dougducey says is open. #coronavirus #briefing #abc15 #cw61,2020-04-29 22:27:31+00:00
24,"""Trump appointees manipulate""-no surprise there....that's like saying ""coronavirus deadly....""",2020-04-29 22:25:29+00:00
25,Here’s a list of what Gov @dougducey says is staying closed. #coronavirus #briefing,2020-04-29 22:25:14+00:00
26,"From Ukraine to Coronavirus: Trump's Abuse of Power Continues, featuring... https://youtu.be/0c9iaM18r8Y via @YouTube",2020-04-29 23:59:24+00:00
27,".@dougducey: tests for #coronavirus growing in #Arizona, almost anyone can get one. LIVE NOW @KTAR923 – at Arizona Commerce Authority",2020-04-29 22:16:47+00:00
28,AZ HOSPITAL DATA AS OF 4/28: -10% of hospital beds are being used for coronavirus cases. -19% of ICU hospital beds are being used for coronavirus cases. -11% of state’s ventilators are being used for coronavirus patients. #12News,2020-04-29 22:16:13+00:00
29,All my friends protesting pls be careful and safe. The number of confirmed coronavirus cases in AZ also reached a record high yesterday. Take care of yourselves.,2020-05-30 23:23:58+00:00
30,laughable. If I was an enemy and after seeing the United States response to coronavirus I’d just create a bio weapon and win.,2020-05-30 22:51:39+00:00
31,"None of them killed 104,000+ Americans. You did. #TrumpDeathToll104K #TrumpVirus #TrumpOwnsEveryDeath #ImpeachedForever #coronavirus ",2020-05-30 22:50:05+00:00
32,Coronavirus: How 'overreaction' made Vietnam a virus success ,2020-05-30 22:30:24+00:00
33,It should be clear to everyone by now that the #GeorgeFloydProtests have NOTHING to do with the #GeorgeFloydMurder. The #rioters are violently “protesting” the #Trump presidency. [The economic hardship from the #coronavirus #Shutdown may also be a contributing factor.],2020-05-30 22:28:13+00:00
34,Smart move. Coronavirus rips through a congregation.,2020-05-30 22:05:25+00:00
35,"Then tell your racist supporters to stop. And don’t forget: you’re responsible for 104,000+ American deaths. #TrumpDeathToll104K #TrumpVirus #TrumpOwnsEveryDeath #coronavirus ",2020-05-30 21:46:27+00:00
36,".....while marchers descend upon the White House and the capitol, chanting justice for George Floyd, demonstrators march across the country for social justice and the coronavirus is still around-while our leaders watch a plastic-looking rocket shot into space-great",2020-05-30 21:32:39+00:00
37,Arizona reports second consecutive day of record coronavirus numbers #SmartNews,2020-05-30 20:33:56+00:00
38,"Yes, the loss of signal wasn't enough time for the stage to land... Also, did you see them cut the feed for a second when the NASA administrator mentioned coronavirus? He already had the word halfway out :)",2020-05-30 19:58:10+00:00
39,"""California crosses 100,000 coronavirus cases, 4th state to do so"" ",2020-05-30 19:55:30+00:00
40,#China #NeedsToBeHeldAccountable for the #Coronavirus. #Democrats #Leftists and #Liberals need to be held accountable for these #NationWideRiots. #WeThePeople,2020-05-30 19:38:30+00:00
41,Depends on Coronavirus. No one knows,2020-01-30 23:54:59+00:00
42,Coronavirus really be exposing the closet ray sis in here ,2020-01-30 23:36:40+00:00
43,This that coronavirus bruh ,2020-01-30 23:31:12+00:00
44,Awesome What did we do with the pig Not get coronavirus I hope,2020-01-30 23:21:49+00:00
45,"The latest #coronavirus update according to @BNODesk #ChinaVirus - 9,171 confirmed cases worldwide - 12,167 suspected cases - 213 fatalities - 1,476 in serious/critical condition - 150 treated and released - All regions of China reporting cases - 20 countries reporting cases",2020-01-30 23:20:51+00:00
46,REPORT: American Airlines sued over coronavirus https://dennismichaellynch.com/report-american-airlines-sued-over-coronavirus/ via @realdennislynch,2020-01-30 23:18:57+00:00
47,*World Health Organization declares Coronavirus a global emergency* ASU: bro just wash your hands,2020-01-30 23:11:27+00:00
48,"People trippin about the Coronavirus, bruh just download Norton",2020-01-30 23:11:12+00:00
49,All while potentially being exposed to the Coronavirus!!,2020-01-30 22:41:44+00:00
50,From the director of the @AZDHS. #covid19 ,2020-02-28 23:24:04+00:00
51,Practicing these everyday health habits can help prevent the spread of #COVID19. More info: http://www.health.arizona.edu/healthalerts,2020-02-28 21:06:57+00:00
52,1/ The words “prepare” and “pandemic” have been in headlines. #COVID19 is not considered a pandemic currently. But it’s always good to be prepared for ANY emergency: visit our webpage for more on preparing your household. https://webcms.pima.gov/cms/one.aspx?portalId=169&amp;pageId=18533,2020-02-28 18:56:20+00:00
53,In other news these are the mortality rates for the #COVID19 #coronavirus Debs constituents in #AZ08 are in trouble. She doesn’t care,2020-02-28 18:45:22+00:00
54,"With all the hand washing talk, I thought Arizonans of a certain age needed an ear-worm. We could update this for Covid19 - same number of syllables as hepatitis. You are welcome. #CusYouDontWantCovid19ToGetYou",2020-02-28 13:54:33+00:00
55,It’s the flu. Covid19 doesn’t cause runny nose. ,2020-02-28 11:12:42+00:00
56,"If we called covid19, “dowjonavirus” would he take it more seriously?",2020-02-28 10:18:02+00:00
57,via @nytimes Japan and Thailand Confirm New Cases of Chinese Coronavirus https://nyti.ms/388fWrq ,2020-01-18 14:23:30
58,Hopefully the coronavirus takes out  all these mfs https://twitter.com/CEOSho/status/1221903063260311559 …,2020-01-28 23:56:19
59,"I heard you can combat Coronavirus with  an injection of limes disease..

*drinks another beer*",2020-01-28 23:42:38
60,ASU students: ASU Coronavirus - Sign the Petition! http://chng.it/Jbhzjszy  via @Change,2020-01-28 23:42:19
61,"Would you go in?

#coronavirus
#CoronaOutbreakpic.twitter.com/PUw0rK2ubI",2020-01-28 23:37:33
62,I just had to have our health inspector calm me down because that coronavirus has me so paranoid ,2020-01-28 23:33:01
63,"y’all said “2020 finna be a movie” yeah the movie is 28 days later 

#coronavirus",2020-01-25 23:53:45
64,Coronavirus really be exposing the closet ray sis in here,2020-01-30 23:36:40
65,So i am a huge hypochondriac and I've already got shit to prevent myself from catching #coronavirus get face masks vitamin c tablets hand sanitizer and disinfecting spray. tbh im gonna lay low on going to social settings because thats how these things spread. other people.,2020-01-21 23:59:41
66,CDC Confirms First U.S. Case Of Coronavirus From China http://dlvr.it/RNV6ls pic.twitter.com/g9gcRmNMok,2020-01-21 22:52:02
67,So like do we still go to school or not? I’m honestly confused bc appears you the guy that has the coronavirus has been walking around campus...,2020-01-27 23:52:43
68,Wash your hands and go to classes: Novel Coronavirus at ASU https://twitter.com/ASU/status/1221618256651247616 …,2020-01-27 23:42:40
69,What’s the state Department of Health Services saying about the confirmed coronavirus case? Our story tonight at 5 on #fox10phoenix,2020-01-27 23:39:27
70,brehhhh this is all i think abt when i hear abt coronavirus. i’m like damn so we really in the game??? https://twitter.com/brynnodog/status/1221845095315492864 …,2020-01-27 23:34:22
71,"""ASU students want their classes canceled."" Somebody has started a http://Change.org  petition to stop the spread of #coronavirus at @ASU. So far 12,700+ votes. @abc15https://www.change.org/p/asu-students-asu-coronavirus?utm_content=cl_sharecopy_20145131_en-US%3Av7&recruiter=1037174828&recruited_by_id=4e164860-4125-11ea-8b2a-1be680c6934a&utm_source=share_petition&utm_medium=copylink&utm_campaign=psf_combo_share_initial …",2020-01-27 23:32:01
72,With this coronavirus shit don’t be surprised if you see me out in public with a mask on ,2020-01-24 23:43:15
73,I guess China signed the new trade deal #China #coronavirus #CoronavirusOutbreak #USA #TradeDealpic.twitter.com/N5o3ZPdSF1,2020-01-24 23:20:29
74,"Your afternoon cocktale today:

The internet was supposed to make us all smarter but instead its just keeps proving how dumb we are.. - @DustinALTAZ
#Coronavirus
https://www.vice.com/en_us/article/qjdvvd/a-disturbing-number-of-people-think-coronavirus-is-related-to-corona-beer?fbclid=IwAR0TrHgnsRxMmekYgdKF5KD7j7dpA2mJzKuJUsOjVkjoLCuHtfr-9hW2e0g&utm_source=reddit.com …",2020-01-29 23:54:31
75,I wonder how Corona’s stock is doing with all this talk of a corona virus  pic.twitter.com/X0fLzk6chL,2020-01-29 23:47:05
76,my dad thought the corona virus was a saying like “modelo time”,2020-01-29 23:45:23
77,When the first Coronavirus case hits the county you live in. https://www.youtube.com/watch?v=YWAFfGpQ9lU …,2020-01-26 23:57:39
78,PHOENIX — The Arizona Department of Health Services and the Maricopa County Department of Public Health announced Sunday that a Maricopa County resident has been diagnosed with the 2019 Novel Coronavirus. https://www.eacourier.com/free-access/coronavirus-case-confirmed-in-arizona/article_9cf5db4c-4096-11ea-a79f-af7d8836f208.html#utm_campaign=blox&utm_source=twitter&utm_medium=social …,2020-01-26 23:53:05
79,I'm live at 5 on @abc15 with more about the first confirmed case of #coronavirus in Maricopa County. pic.twitter.com/Y4WYXrGvrQ,2020-01-26 23:52:53
80,Fuck. The only thing that is safe from the ravers and cyber punks is the coronavirus,2020-01-26 23:49:53
81,"Bro I told y’all we all bout to GO

 US registers fifth coronavirus case, Arizona health officials say  https://twitter.com/i/events/1221355655769944067 …",2020-01-26 23:40:52
82,Coronavirus now in Arizona lets fucking goooooo,2020-01-26 23:38:27
83,girls at asu wanna have coronas but don’t want the coronavirus,2020-01-26 23:37:32
84,If u had the Coronavirus id still kiss kiss u babygirl,2020-01-26 23:31:12
85,I’ll be lining up early for my Zithromax to treat my Coronavirus.,2020-01-26 23:21:09
86,"Why is it that China is able to test and process thousands #Coronavirus test cases each day, but our @CDCgov is not even able to make it through a backlog of 100?",2020-02-08 23:34:01
87,No just logical. Why do u think there sending all the Coronavirus patients to Cali ? To thin out the state from garbage,2020-02-05 23:52:56
88,"A Chinese citizen journalist who went viral for his reporting on coronavirus from Wuhan has gone missing, and his family says he's been forcibly quarantined https://news.yahoo.com/chinese-citizen-journalist-went-viral-154637367.html …",2020-02-09 23:56:20
89,I hope 60 percent of y’all catch the coronavirus,2020-02-04 23:35:58
90,"The coronavirus has a US patent number, so yeah, someone created it. http://uspto.gov  # 10130701",2020-02-01 23:59:30
91,JUST IN: Second coronavirus case confirmed in Santa Clara County http://bit.ly/37SpU0j ,2020-02-02 23:26:53
92,"He has a point. This Coronavirus is not just a one off. Manufacturing may take a hit over the next years.

BTW, this is also one reason Trump wanted to bring back factories to the US. This problem will get worse. https://twitter.com/IceAgeFarmer/status/1225475943667363843 …",2020-02-06 23:37:16
93,3D map shows how the coronavirus is spreading worldwide https://tek.io/2uYgYbe  via @techrepublic,2020-02-03 23:59:38
94,"A fun Game considering the Corona Virus  HA HA
https://twitch.tv/ruskie1977 ",2020-02-03 23:58:21
95,"China completes #coronavirus hospital in #Wuhan in 10 days, with a second hospital almost finished -https://ab.co/2GQetuf ",2020-02-03 23:48:38
96,Mostly coronavirus. Some repo. Very little Tesla - not as much as I thought.,2020-02-15 23:16:07
97,"""#China's National #Health Commission said the coronavirus could affect cats and dogs,"" The Sun reported. #animals #China #Health #pets #socialmedia #Virushttps://www.westernjournal.com/furry-friend-catch-coronavirus-many-owners-taking-precautions/?utm_source=twitter&utm_medium=westernjournalism&utm_campaign=twitter&utm_content=2020-02-15 …",2020-02-15 23:16:01
98,"A list of MWC coronavirus cancellations so far: Facebook, AT&#038;T, Sprint, Intel now also staying away https://tcrn.ch/38hg20z  via @techcrunch",2020-02-11 23:35:58
99,We import so much shit from China. You probably already have the Coronavirus.,2020-02-16 23:44:31
100,#Coronavirus Update: Currently the risk is low both on campus and in Southern Arizona. Get the facts on Coronavirus and how to protect yourself and others – practice compassion.  http://bit.ly/2UWim9d pic.twitter.com/5mpMKktP54,2020-02-14 23:44:03
101,"I just received one of ASU’s $1000 study abroad scholarships for what I hope to be another amazing Summer in Taiwan! Was planning on going to Shanghai, but all Mainland China programs have been cancelled due to the coronavirus. But this offsets my disappointment! ",2020-02-17 23:57:17
102,Senior IOC member says Tokyo Olympics could be canceled if coronavirus isn't under control in time http://bit.ly/2SWvFVQ ,2020-02-25 23:51:00
103,"My thoughts on the market swing and coronavirus
https://www.phxplan.com/investment-alert-coronavirus/ …",2020-02-25 23:50:32
104,U.S. officials: Four more Diamond Princess passengers have coronavirus; U.S. cases at 57 https://www.usatoday.com/story/travel/2020/02/25/four-more-diamond-princess-cruise-ship-passengers-have-coronavirus/4872259002/ … via @usatoday,2020-02-25 23:48:51
105,"You can quiz her when she’s in charge of corona virus. Until then, I’m certain that she still has more knowledge about infectious diseases than Pence does. Nobody in this administration has a flipping clue what to do or the background to do it, so hopefully your families go 1st.",2020-02-28 23:59:29
106,I see he was a non-smoker.. I wondered if smoking and/or environmental pollution caused some people to get #coronavirus  https://twitter.com/timothysheahan/status/1223352526604398593 …,2020-02-28 23:55:26
107,"Is this what happens when exposed to #CoronaVirus?

#AskingForAFriendpic.twitter.com/OufVnA0uR4",2020-02-28 23:52:49
108,"US Officials Preparing for ‘Likely’ Spread of New Coronavirus
https://www.theepochtimes.com/us-officials-preparing-for-likely-spread-of-new-coronavirus_3246277.html …

For the latest US and political news download The Epoch Times app now!https://ept.ms/2mCEjel ",2020-02-21 23:53:33
109,The CDC says the coronavirus is likely to spread in the U.S. Here’s what to know. - Apple News Spotlight https://apple.news/AbbqlY8alRzOaIuNoZ-qeog …,2020-02-26 23:57:03
110,Wait!!! Did Hunter Biden pop up claiming he's an expert in CoronaVirus??,2020-02-26 23:56:05
111,.@vp can't organize a two-person motorcade let alone a response to #Coronavirus.,2020-02-26 23:55:41
112,VIDEO: California monitoring THOUSANDS for coronavirus who have entered state from China in Feb https://dennismichaellynch.com/video-california-monitoring-thousands-for-coronavirus-who-have-entered-state-from-china-in-feb/ … via @realdennislynch,2020-02-27 23:59:10
113,Shame on you.  Diamond and Silk were helping the president prepare for Coronavirus,2020-02-27 23:56:17
114,A Guide: How To Prepare Your Home For Coronavirus https://www.npr.org/sections/goatsandsoda/2020/02/26/809650625/a-guide-how-to-prepare-your-home-for-coronavirus?utm_campaign=storyshare&utm_source=twitter.com&utm_medium=social … #health,2020-02-27 23:55:00
115,The #Coronavirus Will Win - The Atlantic | Sadly too many people won’t believe the science until someone close to t… https://t.co/SDBnnPmB8A,Sat Jun 13 07:58:32 +0000 2020
116,Now u know how Jews feel Winston #COVID19 #JewsLivesMatter https://t.co/T41RomPwQd,Sat Jun 13 10:05:48 +0000 2020
117,RT @azbishop: Grateful to meet today with @dougducey  and @AZDHS Cara Christ and @AZCorrections Director Shinn about keeping our prisons sa…,Sat Jun 13 10:27:37 +0000 2020
118,"RT @UNDPAzerbaijan: The #COVID19 lockdown did not prevent the Art School in Baku to carry out a series of 15 virtual classes on knitting, d…",Sat Jun 13 10:52:28 +0000 2020
119,Brought to you by #COVID19 👇,Sat Jun 13 10:54:39 +0000 2020
120,RT @BuckSexton: CCP has shut down one of #Beijing's main #seafood and markets after more than 50 people in the #China's capital tested posi…,Sat Jun 13 12:16:36 +0000 2020
121,"@MominHighHeels @imcorinnemec ""The covid test"" has 80% false positive, Medicare incentivizes #COVID19 diagnosis, &amp;… https://t.co/SxxTJ9NQD0",Sat Jun 13 12:28:08 +0000 2020
122,May Allah(SWT) give your complete shifaa!,Sat Jun 13 13:19:15 +0000 2020
123,Arizona has seen single day record increases in COVID-19 cases. Asymptomatic people can exhale thousands of infecti… https://t.co/baKPKfEjcB,Sat Jun 13 13:20:11 +0000 2020
124,"RT @TheDailyEdge: Fact Check: Joe Biden oversaw the longest period of uninterrupted job growth in HISTORY.

Meanwhile, @realDonaldTrump cau…",Sat Jun 13 13:09:57 +0000 2020
125,"RT @ConservativeJi1: On Wednesday of this week, there was ONLY ONE (1) hospitalization in the ENTIRE State of #Arizona for #COVID19!

If yo…",Sat Jun 13 09:59:43 +0000 2020
126,RT @FLOTUS: As we continue to battle #COVID19 this administration released approx $700 million to provide communities w/ resources to expan…,Sat Jun 13 11:24:05 +0000 2020
127,"RT @meganranney: ""The new Trump administration rule allows health care providers to deny care to anyone they perceive as trans or gay....""…",Sat Jun 13 10:24:43 +0000 2020
128,@PaulKeim on #SARSCoV2 super-spreader events and pandemic control,Sat Jun 13 14:05:05 +0000 2020
129,#Biden2020 #Resist #BlueWave Resisters unite!,Sat Jun 13 14:15:49 +0000 2020
130,"Check out my store, Stem k12, on @StoreFrontier https://t.co/mPdYnu3Vrw 

#COVID19 #Facemasks #Coronavirus2020… https://t.co/nuVpG5QYNy",Sat Jun 13 14:29:39 +0000 2020
131,Mapping #COVID19 in our #foodsystem &amp; more; check it. https://t.co/gYrvRPP3QW #farming #news,Sat Jun 13 14:30:24 +0000 2020
132,Read this thread to see some of the options we have in AZ for dealing with #COVID19. A bit of a long thread but wor… https://t.co/z8VOL5TxX5,Sat Jun 13 14:33:02 +0000 2020
133,"RT @FlinnFoundation: Arizona today announced:

• New record for daily confirmed #COVID19 cases;
• New record for current COVID-19 hospitali…",Sat Jun 13 14:39:14 +0000 2020
134,EXCLUSIVE: Poll results: Your thoughts on the coronavirus https://dennismichaellynch.com/exclusive-poll-results-your-thoughts-on-the-coronavirus/ … via @realdennislynch,2020-03-02 23:56:05
135,Which NBA player is most likely to catch coronavirus first (poll) https://twitter.com/wojespn/status/1234625139599429632 …,2020-03-02 23:55:38
136,Senator McSally talks coronavirus preparedness in Arizona: https://bit.ly/2x2Zvzx  #abc15,2020-03-01 23:57:00
137,"Snow in the Mountains, A Touch of Snow in the Lowlands, and A Question about the Coronavirus http://dlvr.it/RR3KXP pic.twitter.com/pN9hGPX6Ib",2020-03-01 23:51:02
138,"Religion in the Modern World:

BBC News - Coronavirus: South Korea sect leader to face probe over deaths https://www.bbc.com/news/world-asia-51695649 …",2020-03-01 23:47:54
139,Trump made this Coronavirus about politics when he called it a Democratic hoax!,2020-03-01 23:47:23
140,Waiting for your #coronavirus statistics.,2020-03-06 23:57:37
141,Stock-market investors are dreading weekends as coronavirus spread accelerates https://www.marketwatch.com/story/tgif-dow-industrials-are-on-pace-for-the-longest-friday-losing-streak-in-14-years-as-coronavirus-has-wall-street-dreading-weekends-2020-03-05?reflink=mw_share_twitter …,2020-03-06 23:57:33
142,"One thing I'll say about Coronavirus

It'll help you identify who the real ones are

Watch closely how people react

https://twitter.com/Sociopathlete/status/1235944092565008384 …",2020-03-06 23:56:40
143,Funny how the coronavirus has been real quiet since Musk tweeted this. https://twitter.com/elonmusk/status/1236029449042198528 …,2020-03-06 23:55:33
144,Rudy your buddy Trump has failed miserably in handling the corona virus!!!,2020-03-06 23:54:51
145,"The #WHO declaring the #COVID19 #pandemic is acting like the #NBER declaring a #recession, by waiting for 6 months after it starts... #Coronavirus @NorthmanTrader (apologies in advance for all the hash)",2020-03-06 23:54:06
146,The conspiracy theory that the Coronavirus was created in a lab looks more realistic! #coronavirus! https://twitter.com/KEEMSTAR/status/1235206469655683072 …,2020-03-04 23:54:32
147,"coronavirus in LA, brady leaving the pats...  someone check on @billburr",2020-03-04 23:52:20
148,Comforting: Americans With Coronavirus Symptoms Are Being Turned Away For Testing https://www.vanityfair.com/news/2020/03/coronavirus-delayed-testing-us … #SmartNews,2020-03-04 23:51:09
149,"BBC News - Coronavirus: Iran temporarily frees 54,000 prisoners to combat spread https://www.bbc.com/news/world-middle-east-51723398 …",2020-03-03 23:59:53
150,Trump lied about coronavirus all day.,2020-03-03 23:57:12
151,My work is worried about the coronavirus because we get a lot of shipments from Asia. They gave everyone a bottle of hand sanitizer for our desks. I was also asked if I wanted to take a have a day off tomorrow since I was coughing a lot today.,2020-03-03 23:51:52
