,Tweets,Date
0,follow me on Facebook and come hang out! http://www.facebook.com/cwademusic #show #coronavirus #covers #original #music #musician #followme #guitarist #guitarplayer,2020-04-29 23:52:55+00:00
1,.@Judge_wolff and @Ron_Nirenberg have been wannabe tyrants through all of this. They're now extending the stay at home order for San Antonio and Bexar county to May 19th. Why? Because they are pushing back against @GovAbbott. Next election? Vote them out! #coronavirus,2020-04-29 23:34:27+00:00
2,"Please RT! Both me/my husband work 2 jobs. With coronavirus, we have lost this additional income. I could really use help getting ready for the fall! After this trauma, I'm hoping to start it off great! #amazonwishlist #clearthelists #support_a_teacher https://www.amazon.com/hz/wishlist/ls/TAR4VESI6I65?ref_=wl_share",2020-04-29 23:33:09+00:00
3,I Got Divorced on a Conference Call Because of Coronavirus - Yahoo Lifestyle http://dlvr.it/RVjpcS,2020-04-29 23:32:33+00:00
4,"Please RT! Both me/my husband work 2 jobs. With coronavirus, we have lost this additional income. I could really use help getting ready for the fall! After this trauma, I'm hoping to start it off great! #amazonwishlist #clearthelists #support_a_teacher https://www.amazon.com/hz/wishlist/ls/TAR4VESI6I65?ref_=wl_share",2020-04-29 23:33:09+00:00
5,"Starting soon! Have questions for our team, Robert Rivard, the Mayor, or the Judge? Want to hear more about the survey, SA’s Coronavirus response, etc? Comment below! ",2020-04-29 23:19:33+00:00
6,Welp!!! #Sydney #Australia #COVID19 #coronavirus #travel,2020-04-29 23:16:58+00:00
7,The race for coronavirus vaccines: a graphical guide ,2020-04-29 23:13:33+00:00
8,"Latest batches. Just need elastic. I got 3 more batches to make. Yes, I am selling. #makingmask #makingmasks #masks #maskmaking #maskprotection #coronavirus #covid19 #coronavirusmask #sewing #sewlikethewind… https://www.instagram.com/p/B_lQ0Mpjqla/?igshid=1lc8gcshevswk",2020-04-29 22:52:58+00:00
9,The city says 44% of residents that tested positive for coronavirus have recovered but Metro Health doesn't require a follow-up test before they consider them healed. So how do we know if the virus is *really* out of someone's system? Metro Health doesn't even know. @KENS5,2020-04-29 22:40:43+00:00
10,"Will a pneumonia shot prevent coronavirus? No. That and other questions addressed by the EN's answerman, @JohnMacCormack |",2020-04-29 22:27:32+00:00
11,"Oh my God, this pisses me off. As a movie thearter employee and a fan of Halloween, I could understand where the company is coming from. If alot of people show up to theater, someone is going to get sick.#HalloweenKills #coronavirus ",2020-04-29 22:21:43+00:00
12,BBC News - Coronavirus: India to loosen lockdown despite record cases ,2020-05-30 23:51:45+00:00
13,"Meanwhile...amid the protest, mayor @Ron_Nirenberg giving his daily coronavirus briefing. Big jump in overall confirmed cases. Total of 2,825 (189 new cases), HOWEVER, the mayor attributes that to a back log of tests from mid May. Good news...hospitalizations went down a bit ",2020-05-30 23:17:24+00:00
14,"Coronavirus live updates: Merkel declines Trump’s invitation to G-7 summit in Washington, citing pandemic - The Washington Post ",2020-05-30 23:11:18+00:00
15,"#Coronavirus A #Belgian prince has contracted coronavirus after attending a party during #lockdown in #Spain, the country's royal palace says. #LockdownHouseParty #PrinceJoachim, 28, travelled from #Belgium to #Spain for an internship on 26 May, the palace said. Source: BBC",2020-05-30 23:10:02+00:00
16,Coronavirus wave 2 coming in from all the people protesting.,2020-05-30 22:44:39+00:00
17,"Coronavirus May Be a Blood Vessel Disease, Which Explains Everything by @SmithDanaG in @elemental",2020-05-30 23:53:56+00:00
18,Ensuring Biodiversity Now will Prevent Pandemics Later https://bit.ly/2ZT1fYA #Biodiversity #pandemics #COVID19Pandemic #Coronavirus ,2020-05-30 20:11:55+00:00
19,Coronavirus a has been the TOP excuse to bail on plans. #2020,2020-05-30 19:40:55+00:00
20,What Actually Happens If You Get Coronavirus? ,2020-01-30 23:57:57+00:00
21,“I have CoronaVirus”,2020-01-30 23:32:36+00:00
22,You got coronavirus,2020-01-30 23:09:02+00:00
23,Google launches 'SOS Alert' with WHO in response to the coronavirus http://bit.ly/31dqSSj,2020-01-30 23:08:21+00:00
24,same energy #coronavirus ,2020-01-30 23:06:49+00:00
25,The Coronavirus Is Now Infecting People Who Haven't Traveled to China | WIRED ,2020-01-30 22:57:25+00:00
26,Coronavirus knows better than to mess with @kaskade,2020-01-30 22:33:48+00:00
27,"The fact that this is even a remote belief (covid19 having anything to do w/ Corona beer) is a frightful example of public rampant ignorance. Our education system has failed, or is incredibly lacking. Folks need to read something other than rag mags. Non-fiction books, perhaps.",2020-02-28 19:49:02+00:00
28,"Observation: Kids naming their #hardcore #punk band #Coronavirus will sound campy and fun with psych and surf influenced sounds like Dead Kennedys, kids choosing #COVID19 will have an angrier snottier Regan Youth sound.",2020-02-28 14:52:32+00:00
29,"Novel #coronavirus (2019-nCoV) outbreak in China, no clear evidence of human to human transmission so far. https://twitter.com/WHO/status/1216393218625064968 …",2020-01-12 17:28:47
30,"""Japan Confirms First Case of New Chinese Coronavirus"" by BY SUI-LEE WEE via NYT https://ift.tt/36TRPfU ",2020-01-16 08:47:11
31,Im Gucci the coronavirus won’t effect me I only drink Modelo ,2020-01-23 23:46:25
32,I can’t get the coronavirus I only drink modelo,2020-01-23 23:45:27
33,Coronavirus by Lebouche ,2020-01-23 23:31:32
34,Psshh basic ass people getting that coronavirus. We all know da dosequivirus is where it’s at,2020-01-23 23:28:46
35,Can I put “ surviving coronavirus “ on my resume ??,2020-01-23 23:15:00
36,What Actually Happens If You Get Coronavirus? https://www.youtube.com/watch?v=OTYfke545vI …,2020-01-30 23:57:57
37,"The Wuhan Coronavirus:  What is it, how is it spread, what are the symptoms,and  whatever else you should know... sounds a lot like the flu to me!

CHECK IT OUT! and be in the know! https://www.cnn.com/2020/01/20/health/what-is-coronavirus-explained/index.html …",2020-01-21 23:26:41
38,Someone pls explain to San Antonio that the coronavirus is not the same thing as the modelovirus,2020-01-24 23:32:35
39,"Health officials: ⁦@Baylor⁩ University student being tested for possible case of #coronavirus
https://www.ksat.com/news/local/2020/01/24/health-officials-baylor-university-student-being-tested-for-possible-case-of-coronavirus/ …",2020-01-24 23:22:46
40,A competent POTUS would have done that as soon as even 1 case of coronavirus was confirmed in the US. Emphasis on competent. https://twitter.com/ABC/status/1221496723832496129 …,2020-01-26 23:30:33
41,"scp-049 >w> (although i want to draw a slime scp and lewd coronavirus too) 
#scp #scp049 #scpfoundation #plaguedoctorpic.twitter.com/oIuUsQ5L65",2020-02-07 23:50:43
42,American Dies From Coronavirus in Wuhan https://www.weather.com/health/cold-flu/news/2020-02-08-american-dies-from-coronavirus-in-wuhan-china …pic.twitter.com/3INKKVRE6E,2020-02-08 23:42:26
43,WHO Director-General Tweets: We are mobilizing the UN http://disq.us/t/3lzjvwp  #coronavirus #2019nCoV #kungflu,2020-02-09 23:58:56
44,The coronavirus is a population control stunt. They are spreading it on purpose. #wakeup #modern #day #plague,2020-02-01 23:57:49
45,"MSM Suppresses Coronavirus: ""UNCANNY Similarity to HIV?!?"" https://youtu.be/w0ahdrYFe9Q  via @YouTube",2020-02-01 23:45:41
46,i dont speak coronavirus,2020-02-06 23:37:01
47,"U.S. announces more coronavirus cases, details quarantine plans for... https://reut.rs/2RU6Mth  #coronavirus #2019nCoV #kungflu",2020-02-03 23:47:17
48,Are You Prepared To Shelter-In-Place Today? Imagine Turning On The News To Learn Coronavirus Had Arrived In Your City! Getting Ready For The Worst Case Scenario http://allnewspipeline.com/Shelter_In_Place_Coronavirus.php#.XjivuoZ5-W0.twitter … #coronavirus #2019nCoV #kungflu,2020-02-03 23:42:15
49,View From China: Coronavirus is Biowar! (Kevin Barrett Interviews Jeff Brown) https://www.veteranstoday.com/2020/02/19/jeff-brown-biowar/ … via @veteranstoday,2020-02-19 23:35:34
50,"#coronavirus Rep. Chip Roy sent a letter yesterday to Sectys. Azar + Esper asking 11 questions including why JBSA was chosen as a quarantine site; the reasoning on sending  Diamond Princess evacuees ""carrying the virus"" here + details of the testing/monitoring process. Good!",2020-02-19 23:23:10
51,Epeople are going to invade us all and take over the coronavirus,2020-02-12 23:44:38
52,#coronavirus Now we're hearing that Diamond Princess passengers will be barred from the USA until ok for 14 days. Finally the CDC is understanding what real quarantine means. But they flew many of the highest risk people right into San Antonio.,2020-02-18 23:43:50
53,Bexar County Judge Nelson Wolff asks for quarantined people to be tested for coronavirus at JBSA-Lackland rather than local hospitals http://www.kens5.com/article/news/bexar-county-judge-nelson-wolff-asks-for-quarantined-people-to-be-tested-for-coronavirus-at-jbsa-lackland-rather-than-local-hospitals/273-f5d64975-3367-4b90-8212-56df33b15dea … via @KENS5,2020-02-18 23:23:54
54,Let me hear your “yeeee” then we’ll talk coronavirus https://twitter.com/DamianCasiano1/status/1228016100488753153 …,2020-02-14 23:33:20
55,China vows to house all coronavirus patients. Treatment isn’t guaranteed - Inkstone https://www.inkstonenews.com/health/patients-complain-grim-conditions-wuhans-quarantine-centers/article/3050291 …,2020-02-13 23:53:49
56,Apple says coronavirus is screwing up iPhone sales http://bit.ly/38CtvjC pic.twitter.com/QJZ1dddOvJ,2020-02-17 23:39:26
57,More than sure Neriyah drew the coronavirus.... pic.twitter.com/su63ESmBW6,2020-02-17 23:35:43
58,you’re coming back with Coronavirus,2020-02-24 23:44:27
59,Harvard scientist: coronavirus pandemic likely will infect 40-70% of world this year | TheHill https://thehill.com/changing-america/well-being/prevention-cures/482794-officials-say-the-cdc-is-preparing-for …,2020-02-28 23:57:54
60,Mexico Confirms First Coronavirus Cases http://ihe.art/wjfFlLQ ,2020-02-28 23:54:28
61,Coronavirus and Energy Demand | SHALE Magazine https://buff.ly/2SOTbnN ,2020-02-21 23:46:39
62,Trump just named Pence to head Coronavirus response.  WTF is he going to do?  Blame it gays & pray?,2020-02-26 23:59:17
63,how does the coronavirus make u feel,2020-02-26 23:58:26
64,There’s like 7 strains under the term “coronavirus”. Only one is the COVID-19,2020-02-27 23:58:14
65,Be careful with the Coronavirus,2020-02-23 23:37:57
66,"RT @AFPphoto: #Coronavirus #COVID19 #Italy
Venice comes back to life after lockdown.
📸 Andrea Pattaro #AFP
More pictures on AFP Forum: http…",Sat Jun 13 08:00:53 +0000 2020
67,"My colleagues &amp; I are conducting a study on COVID-19. Please complete survey at link below, &amp; please share it! You… https://t.co/UzDkHiVepE",Sat Jun 13 10:10:00 +0000 2020
68,I got rejected from a job while on vacation and not even 20 minutes later I had another interview while I was on va… https://t.co/OlTZOJuR5J,Sat Jun 13 10:15:12 +0000 2020
69,os shippeo,Sat Jun 13 10:30:35 +0000 2020
70,"RT @globaltimesnews: Four areas in Beijing — Xiluoyuan community and Huaxiang township in Fengtai district, Changyang town in Fengtai distr…",Sat Jun 13 11:06:19 +0000 2020
71,"RT @DrMCecconi: Lots of public recognition for ""doctors AND anesthesiologists AND Intensivists"".I am an anesthesiologist and an intensivist…",Sat Jun 13 11:47:39 +0000 2020
72,"Despite #COVID19 crisis, #MarketingAutomation is among the top four #investment priorities for #enterprise digital… https://t.co/1z0R822gRw",Sat Jun 13 13:09:55 +0000 2020
73,RT @Brewskiesbrew: @WhiteHouse @realDonaldTrump In the midst of #COVID19  going on the #DoNothingDemocrats  #DemocratsAreDestroyingAmerica…,Sat Jun 13 09:58:03 +0000 2020
74,Texas #COVID19 daily new cases. https://t.co/zrqjOXHRBQ,Sat Jun 13 13:29:35 +0000 2020
75,RT @DoctorJesseMD: Wear a mask. Stay safe. #COVID19. @AmerMedicalAssn #MaskUp https://t.co/TguKsBN3K0,Sat Jun 13 13:00:07 +0000 2020
76,"RT @QuickTake: After being on #Covid19 lockdown since March 20, Buenos Aires residents are now allowed to run outside — but only after 8 p.…",Sat Jun 13 13:40:57 +0000 2020
77,"“We’ve not really had a first wave recede. What we’ve done is take the lid off simmering, long, controlled stretch… https://t.co/STMIlnNnbQ",Sat Jun 13 14:04:24 +0000 2020
78,"RT @JAMA_current: Face shields, which can be quickly and affordably produced and distributed, should be included as part of strategies to s…",Sat Jun 13 14:01:01 +0000 2020
79,They should be mandatory along with masks,Sat Jun 13 14:14:53 +0000 2020
80,All this corona virus shit is going to make my business boom! Fuck yeah I’ll disinfect your vehicle for $150,2020-03-02 23:57:35
81,Roses are red bluebonnets are blue. I don’t plan on getting #coronavirus do you? @APHAPHN @skneipp1 @DrNurseIronman @ttuhscsonpic.twitter.com/ksKFw9tLKw,2020-03-06 23:55:23
82,Coronavirus: Last Week Tonight with John Oliver (HBO) https://youtu.be/c09m5f7Gnic ,2020-03-02 23:56:28
83,The Editors: How Catholics should respond to the coronavirus https://www.americamagazine.org/politics-society/2020/03/05/editors-how-catholics-should-respond-coronavirus …,2020-03-05 23:54:06
84,Me being a plug at music festivals during the Coronavirus  @TexasEDMFamily @SA_EDM_FAMILYpic.twitter.com/sDopBOl8mP,2020-03-05 23:52:06
85,Science May Have Discovered Regular Drinkers Of Hard Liquor Are Better Protected From Coronavirus https://www.barstoolsports.com/blog/2023616/science-may-have-discovered-regular-drinkers-of-hard-liquor-are-better-protected-from-coronavirus …,2020-03-08 23:56:26
86,Maybe it’s time to dial back the coronavirus drama https://legalinsurrection.com/2020/03/maybe-its-time-to-dial-back-the-coronavirus-drama/ …,2020-03-08 23:55:13
87,"Meanwhile @realDonaldTrump has named Dr. Seuss, Dr. Phil and Dr. Frankenstein to head his #coronavirus task force.",2020-03-11 23:57:01
88,"There's a hole in the roof Coronavirus coming thru...
https://www.youtube.com/watch?v=THNUuxQc73k&list=RDTHNUuxQc73k&start_radio=1 …",2020-03-10 23:58:23
89,Reposted from thebaartman #covid #covid2019 #coronavirus  - #regrann https://www.instagram.com/p/B9koWzhAynB/?igshid=1kxjh10ce2rxn …,2020-03-10 23:56:38
90,Here Are All the U.S. Universities Suspending In-Person Classes Due to Coronavirus https://people.com/human-interest/universities-suspending-in-person-classes-amid-coronavirus/?utm_source=twitter.com&utm_medium=social&utm_campaign=social-share-article&utm_term=7718663 …,2020-03-10 23:56:33
91,even the dogs are hoarding the food because of the coronavirus!  #EnglishBulldog #SanAntonio #kens5eyewitness #CoronaVirus #covıd19 #covid_19 https://www.instagram.com/p/B9sVbEwhNwd/?igshid=9ak5ib2zjhc7 …,2020-03-13 23:58:01
92,"@hotelsdotcom I tried to cancel a reservation due to the postponement of @IRONMANtri #Texas, but it says my rate is non-refundable. However, your website says you can make changes if your trip is impacted by #coronavirus. What do I need to do?",2020-03-13 23:57:39
93,"*This week in lab*
-Please expose yourself to coronavirus and take samples to make cell cultures. Incubate for a week, check results and post online https://twitter.com/swagyolo_eli/status/1238603214578221057 …",2020-03-13 23:56:43
94,"Why wash your hands when you can just cut them off?

Can't get coronavirus if you dont have any hands",2020-03-12 23:59:27
95,INBOX: @uiwcardinals suspends athletics amid #coronavirus pic.twitter.com/ZkcyntcA06,2020-03-12 23:58:46
96,Just read the symptoms of corona virus. It was nice knowing y’all ,2020-03-12 23:58:43
97,@KatRamsland What the US military could and couldn't do in the fight against coronavirus - CNNPolitics https://www.cnn.com/2020/03/15/politics/andrew-cuomo-donald-trump-oped-coronavirus/index.html …,2020-03-15 23:58:10
98,Travis County (Austin area) now reporting 62 cases of coronavirus. pic.twitter.com/c3WqOZUIwI,2020-03-21 23:56:11
99,"What countries have been affected by the novel coronavirus known as COVID-19? 

https://infographics.channelnewsasia.com/covid-19/map.html … via @ChannelNewsAsia
#coronavirus #Covid_19 #pandemia #CoronaCrisis #AislamientoObligatorio #CuarentenaTotal #QuedateEnCasa",2020-03-20 23:57:20
100,"Coronavirus: What is 'flattening the curve,' and will it work? 
Many hundreds of thousands of infections will happen — but they don't all have to happen at once.
https://www.livescience.com/coronavirus-flatten-the-curve.html …",2020-03-18 23:59:23
101,"https://www.youtube.com/watch?v=xigleByIbUI …
During Coronavirus, what is church leadership focused on?",2020-03-18 23:58:43
102,"If you can help providing info from your country, go ahead.
#Coronavirus #COVID19 
Please RT.https://twitter.com/dx_uva/status/1240063962902740993 …",2020-03-17 23:57:29
103,"NEW, this evening: There are now at least six people in San Antonio confirmed to have the coronavirus. One case involved a traveler giving it to a San Antonian. 

MORE: https://www.expressnews.com/news/local/article/Medina-County-resident-is-hospitalized-in-San-15137971.php …",2020-03-17 23:56:46
104,This is an evolving situation please continue to check our coronavirus FAQ page for updates: http://bit.ly/2WlvJ3s ,2020-03-16 23:58:25
105,"What countries have been affected by the novel coronavirus known as COVID-19? 

https://infographics.channelnewsasia.com/covid-19/map.html … via @ChannelNewsAsia
#coronavirus #Covid_19 #pandemia #CoronaCrisis #AislamientoObligatorio #CuarentenaTotal #QuedateEnCasa",2020-03-20 23:57:20
106,"Coronavirus: What is 'flattening the curve,' and will it work? 
Many hundreds of thousands of infections will happen — but they don't all have to happen at once.
https://www.livescience.com/coronavirus-flatten-the-curve.html …",2020-03-18 23:59:23
107,"https://www.youtube.com/watch?v=xigleByIbUI …
During Coronavirus, what is church leadership focused on?",2020-03-18 23:58:43
108,This is an evolving situation please continue to check our coronavirus FAQ page for updates: http://bit.ly/2WlvJ3s ,2020-03-16 23:58:25
109,Travis County (Austin area) now reporting 62 cases of coronavirus. pic.twitter.com/c3WqOZUIwI,2020-03-21 23:56:11
110,@KatRamsland What the US military could and couldn't do in the fight against coronavirus - CNNPolitics https://www.cnn.com/2020/03/15/politics/andrew-cuomo-donald-trump-oped-coronavirus/index.html …,2020-03-15 23:58:10
111,"If you can help providing info from your country, go ahead.
#Coronavirus #COVID19 
Please RT.https://twitter.com/dx_uva/status/1240063962902740993 …",2020-03-17 23:57:29
112,"NEW, this evening: There are now at least six people in San Antonio confirmed to have the coronavirus. One case involved a traveler giving it to a San Antonian. 

MORE: https://www.expressnews.com/news/local/article/Medina-County-resident-is-hospitalized-in-San-15137971.php …",2020-03-17 23:56:46
