,Tweets,Date
431,Does Coronavirus make you want to scratch your eyes out?? Oh no wait that’s just the pollen...happy 1st day of spring from Georgia ,2020-03-19 23:57:23
432,"CORONAVIRUS IN GEORGIA: What’s happening today 
 https://www.wsbtv.com/news/local/coronavirus-georgia-whats-happening-today/L6LZ6JTRLVAULN2Q4FWJM3LBAM …",2020-03-18 23:59:04
433,"After Trump's failure on combating the Coronavirus, don't be surprise if Republicans tell their constituents that is totally find to get the virus. They will defend the virus as good for you. Just watch!",2020-03-18 23:59:00
434,"If my math’s correct (based on national confirmed cases), if you bump into 1,000 people, there’s a 94% chance you bumped into at least one person with the coronavirus.",2020-03-18 23:58:22
435,Also individualism begets coronavirus pandemic does not equal homosexuality begets AIDS. That’s not the same argument. Those who blamed AIDS on homosexuality were homophobic and bigoted. Not the case here.,2020-03-18 23:58:16
436,"The novel #coronavirus is shed in the feces of infected people, which may help explain why it’s spread so fast, according to Chinese researchers  https://trib.al/26ef2sC  04
#FBR",2020-03-18 23:58:16
437,With a lot of animal shelters closing for at least a few weeks due to the #Coronavirus @thagler and I have a short term addition to the family. Meet Maisy Night (at least that is what we are calling her for the next few weeks). If you can please  #Foster or #Adoptpic.twitter.com/vEVh27c9JQ,2020-03-18 23:57:19
438,A great #UX interactive slide-show on how (bad) infographics and information design can influence perception about #coronavirus https://growth.design/case-studies/coronavirus-dashboard-ux/ …,2020-03-18 23:57:17
439,"SICHEL: Before You Have An Opinion On Coronavirus, Ask Yourself These Questions | The Daily Wire https://www.dailywire.com/news/sichel-before-you-have-an-opinion-on-coronavirus-ask-yourself-these-questions …
#coronavirus #COVID2019 #CoronavirusOutbreak",2020-03-18 23:56:27
440, Penguins get free reign of the entire aquarium after it was closed to humans amid the coronavirus outbreak  https://twitter.com/i/events/1239672162618707968 …,2020-03-16 23:59:43
441,Fuck #coronavirus,2020-03-16 23:59:10
442,Or maybe let's just #VoteBlue2020 #coronavirus.,2020-03-16 23:58:19
443,Holy fuck now we have a Chinese Virus and the #coronavirus https://twitter.com/realDonaldTrump/status/1239685852093169664 …,2020-03-16 23:57:37
444,"Corona Virus is being passed thru money , a lot of y’all niggas safe asf out here ",2020-03-16 23:57:21
445,Bright side to the corona virus is that all my classes are now online. Yeet,2020-03-16 23:56:44
446,"***Breaking - Lumpkin County, Ga.*** The Georgia Department of Public Health (DPH) confirmed on Saturday, March 21, that Lumpkin County has recorded its first confirmed case of coronavirus (COVID-19).

https://lumpkin.fetchyournews.com/2020/03/21/confirmed-case-of-coronavirus-in-lumpkin-county/ …",2020-03-21 23:59:04
447,DOJ Wants to Suspend Certain Constitutional Rights During Coronavirus Emergency https://www.rollingstone.com/politics/politics-news/doj-suspend-constitutional-rights-coronavirus-970935/ … via @RollingStone,2020-03-21 23:59:20
448,Robert Reich says airlines ‘shouldn’t see a dime of taxpayer money’ in a coronavirus bailout https://flip.it/wHio36 ,2020-03-21 23:55:25
449,There goes most high school proms and graduation ceremonies. #coronavirus https://twitter.com/NicoleCarrWSB/status/1239334708372213760 …,2020-03-15 23:59:34
450,Fuck the Outlet Shoppers at Atlanta! This is fucking pathetic. We stand by you...as long as you stay open. #coronavirus pic.twitter.com/bJpCDw4YrM,2020-03-17 23:57:25
451,Soooo many babies about to be born in November.. .. #coronavirus #QuarantineLife,2020-03-17 23:57:14
