,Tweets,Date
0,"So this morning, I walked past the youngest, doodling. “Whatcha drawing?”, I asked. “Expectation vs Reality for Coronavirus”, she replied. Ummm... okay... sure! Dunno what I expected, but it wasn’t this...… https://www.instagram.com/p/B_lYe0bnRKd/?igshid=92c7fm2q6dw8",2020-04-29 23:59:57+00:00
1,So... I guess they’re going back to downplaying the #coronavirus 02 #FBR,2020-04-29 23:58:17+00:00
2,"Not surprised that @benshapiro, the inspiration for white supremacist terrorists in multiple countries, has this perspective on elderly people's agonizing, suffocating, lonely death. #coronavirus ",2020-04-29 23:56:09+00:00
3,"IN THIS NEW BOOK: ""Guide to Survival of the #Coronavirus in America."" See page 92 ""HVAC Systems &amp; Airborne Diseases"" It explains what hospitals already knew. That HVAC systems help spread diseases &amp; the risks of planes &amp; ships. https://VIPPUSA.ORG/free-book 14",2020-04-29 23:52:18+00:00
4,USING A SWAT TEAM TO COMBAT THE #CORONAVIRUS IS NOVEL FOR SURE. 02 #WednsdayWisdom,2020-04-29 23:50:12+00:00
5,"Chris Hayes described Fox News' coverage of the pandemic as ""coronavirus trutherism."" https://www.huffpost.com/entry/chris-hayes-tucker-carlson-fox-news-coronavirus_n_5ea92ca5c5b6106b8ecf9031?ncid=engmodushpmg00000004 #via @HuffPostPol",2020-04-29 23:48:42+00:00
6,What is a reason to eat out in public? #coronavirus,2020-04-29 23:47:13+00:00
7,Dr. Dean Kindler joined @Wgxa and @VictoriaWGXA to discuss the impact of #coronavirus. View it here! ,2020-04-29 23:42:54+00:00
8,"""That money belongs to somebody else, somebody who needs it, you know,"" says Barbara Tarnow. ""It says he's deceased on the check."" #fox5atl #COVID19 #coronavirus #StimulusChecks",2020-04-29 23:41:06+00:00
9,"My last #coronavirus diaries is about how Americans aren't healthy, and it's making the effects of the disease worse. ",2020-04-29 23:41:04+00:00
10,"""That money belongs to somebody else, somebody who needs it, you know,"" says Barbara Tarnow. ""It says he's deceased on the check."" #fox5atl #COVID19 #coronavirus #StimulusChecks",2020-04-29 23:41:06+00:00
11,INFECTIOUS DISEASE EXPERT & EPIDEMIOLOGIST-IN-CHIEF SAYS WE CAN USE THE FLU VACCINE TO FIGHT THE #CORONAVIRUS Medical experts at the WH have to patiently explain to him that his idea of using the flu vaccine to address the coronavirus will not work. #FBR,2020-04-29 23:40:14+00:00
12,"Evening update: Number of Georgia coronavirus deaths rises to nearly 1,100, cases surpass 25.6K ",2020-04-29 23:39:54+00:00
13,Andy believes he is immune to the coronavirus because he was bitten by a bat years ago. April thinks that the symptoms of coronavirus would be cool to have but helps Leslie put her plan into action.,2020-04-29 23:38:35+00:00
14,How This Local Real Estate Tycoon is Giving Frontline Workers Much Needed Piece of Mind for Their Families - Mark Spain https://www.myasbn.com/small-business-shows/atlanta-small-business-show/how-this-local-real-estate-tycoon-is-giving-frontline-workers-much-needed-piece-of-mind-for-their-families-mark-spain/ via @MyASBN @MarkSpainTeam #Atlanta #YMCA #Coronavirus #COVID-19,2020-04-29 23:33:16+00:00
15,WHERE THERE'S SMOKE... Watch Cardi B blast Trump's lack of leadership skills during the coronavirus pandemic 01 #ThursdayThoughts,2020-04-29 23:29:13+00:00
16,"White House asks agencies to find out if China, WHO hid coronavirus intel https://nypost.com/2020/04/29/white-house-wants-to-know-if-china-who-hid-coronavirus-intel/?utm_source=twitter_sitebuttons&amp;utm_medium=site%20buttons&amp;utm_campaign=site%20buttons via @nypost",2020-04-29 23:28:12+00:00
17,That’s why I usually don’t even do 9-5 but because I’m making very good money I decided to keep working during the corona virus but no amount of money going to make me ok with being harassed and disrespected so ima hit the pockets POINT BLANK,2020-04-29 23:19:19+00:00
18,Candidates Sought for Positions on ACCGov/Winterville Joint Development Authority by May 5. This is about coronavirus relief and distributing loans to small businesses. It sounds boring but it's important. https://www.accgov.com/civicalerts.aspx?AID=3895,2020-04-29 23:19:18+00:00
19,A couple spent 73 years together. They both died from coronavirus 6 hours apart ,2020-04-29 23:16:04+00:00
20,"""Monroe resident and co-owner of My Pet Chicken said she has seen a spike in chicken raising interest during the coronavirus pandemic."" #startupcost https://www.theridgefieldpress.com/arts-leisure/article/Monroe-resident-offers-tips-and-tricks-for-15223936.php",2020-04-29 23:15:10+00:00
21,"""You want your coronavirus scattered, smothered, or covered?""",2020-04-29 23:14:46+00:00
22,Black light photos show importance of washing hands properly amid coronavirus outbreak ,2020-04-29 23:13:33+00:00
23,Poop may tell us when the coronavirus lockdown will end https://www.chron.com/news/article/Poop-may-tell-us-when-the-coronavirus-lockdown-15234871.php?utm_campaign=socialflow&amp;utm_source=twitter.com&amp;utm_medium=referral&amp;utm_campaign=CMS%20Sharing%20Tools%20(Desktop)&amp;utm_source=t.co&amp;utm_medium=referral via @houstonchron,2020-04-29 23:10:34+00:00
24,Yikes. Why Georgia Is Reopening Amid the Coronavirus Pandemic - The Atlantic ,2020-04-29 22:58:50+00:00
25,US Housing Market Reverses Course in March with Coronavirus Shutdowns ,2020-04-29 22:56:29+00:00
26,"Beloved Brooklyn teacher, 30, dies of coronavirus after she was twice denied a COVID-19 test - ABC News Why do they hate us so much? https://abcnews.go.com/Health/beloved-brooklyn-teacher-30-dies-coronavirus-denied-covid/story?id=70376445",2020-04-29 22:54:08+00:00
27,So the coronavirus got a expiration date?,2020-04-29 22:53:01+00:00
28,"Dude, I need a haircut like everyone else but I’m damn sure not going to risk the health of young lady who cuts my hair. I don’t have Coronavirus; neither does she but you know all who comes in - thanks to jackass @GovKemp - have never been tested. Make America Respectful Again.",2020-04-29 22:52:45+00:00
29,"“[his] three companies made $2.2 billion in revenue in 2019. But in March, when U.S. businesses started to feel the fallout from the coronavirus pandemic, the companies laid off 95 percent of their employees.”",2020-04-29 22:52:21+00:00
30,Coronavirus Pandemic Update 63: Is COVID-19 a Disease of the Endothelium... https://youtu.be/Aj2vB_VITXQ via @YouTube,2020-04-29 22:51:02+00:00
31,How Coronavirus Created The Perfect Conditions For Conspiracy Theories ,2020-04-29 22:50:44+00:00
32,White House selling commemorative coronavirus coins for $100 ,2020-04-29 23:03:34+00:00
33,"""I don't know why, I don't know how, but I was spared,"" Papola said. #fox5atl #COVID19 #coronavirus ",2020-04-29 22:46:47+00:00
34,"""I don't know why, I don't know how, but I was spared,"" Papola said. #fox5atl #COVID19 #coronavirus https://www.fox5atlanta.com/news/dekalb-county-man-donates-plasma-to-help-covid-19-patients",2020-04-29 22:46:37+00:00
35,"true, but it seems to be more focused on coronavirus's impact on the entertainment company, so it felt random.",2020-04-29 22:45:41+00:00
36,WHERE THERE'S SMOKE... Watch Cardi B blast Trump's lack of leadership skills during the coronavirus pandemic 02 #WednsdayWisdom,2020-04-29 22:45:14+00:00
37,I’m just so tired of hearing about the coronavirus like gahhhh damn. It’s so fucking draining.,2020-04-29 22:44:53+00:00
38,Coronavirus got people passing out from smelling they own breath ,2020-04-29 22:40:14+00:00
39,Los Angeles-based CORE Response and the Arthur M. Blank Family Foundation on Thursday plan to open a coronavirus testing site at Mercedes-Benz Stadium. ,2020-04-29 22:33:04+00:00
40,Organizer of North Carolina group protesting quarantine rules sidelined with coronavirus https://nypost.com/2020/04/28/leader-of-north-carolina-anti-lockdown-protest-gets-covid-19/?utm_source=twitter_sitebuttons&amp;utm_medium=site%20buttons&amp;utm_campaign=site%20buttons via @nypost,2020-04-29 23:47:43+00:00
41,Blood of recovered coronavirus patients for sale on dark web – AM | #deepweb | #darkweb | #hacker https://nationalcybersecuritynews.today/blood-of-recovered-coronavirus-patients-for-sale-on-dark-web-am-deepweb-darkweb-hacker/,2020-04-29 22:24:51+00:00
42,I’m ready for my kids to go back to school and it’s not even summer break yet! #coronavirus #ronatime #ShelterInPlace #school2020 #homeschooling #whenthisisover,2020-04-29 22:23:58+00:00
43,"People who want to vote, yet show signs of COVID-19 will not be turned away. We go in depth tonight at 11 and WSB TONIGHT Coronavirus in Georgia. Join me and @JovitaMoore on Channel 2. @wsbtv",2020-04-29 22:23:20+00:00
44,THIS IS US SOON: ‘Testing wasn’t enough. It wasn't enough to stop this virus.’ — This political consultant’s #coronavirus experience in Italy should be a warning for Americans 01 #VoteBlueNoMatterWho,2020-05-30 23:52:10+00:00
45,"Cobb County has now had over 3,000 confirmed cases of the new coronavirus as of Saturday evening, per the latest report from the Georgia Department of Public Health. ",2020-05-30 23:51:06+00:00
46,Coronavirus and Unemployment. #FBR,2020-05-30 23:46:14+00:00
47,Yes Waffle House gives me 24/7 coronavirus vibes ,2020-05-30 23:43:00+00:00
48,Businesses way more scared of niggas than they were of coronavirus smh smh,2020-05-30 23:35:40+00:00
49,it’s like corona virus coverage has just ceased,2020-05-30 23:23:00+00:00
50,Coronavirus seems so yesterday's news.,2020-05-30 23:04:01+00:00
51,Coronavirus is officially over ,2020-05-30 22:57:32+00:00
52,"Coronavirus exposes vulnerabilities of world’s migrant workers, Middle East News &amp; Top Stories | #exploits | #vulnverabilities",2020-05-30 22:57:31+00:00
53,YOU THINK? #Coronavirus may have much longer incubation period--which would mean quarantines have been too short https://thehill.com/changing-america/well-being/prevention-cures/482978-chinese-researchers-suggest-coronavirus #SaturdayMorning,2020-05-30 22:55:13+00:00
54,"Protect yourselves, black people. And if you’re out protesting and/or rioting, still wear a damn mask. Coronavirus didn’t go anywhere. The white people are still quarantined and y’all wanna be out getting shot and/or sick. Mkay ",2020-05-30 22:54:23+00:00
55,Over 100K Americans dead from coronavirus and cities burning. Unemployment is higher than it was during the depression. Who thought this was a good time to spend money with Elon to send people to space.,2020-05-30 22:52:55+00:00
56,COVIDIOT VOICEOVER #griffindoor88 #griffindoor #voiceover #voiceovers #voicetag #voicetags #covid #griffinsofinstagram #covidー19 #covid19 #covid2019 #covid_19 #coronavirus #noun #covidiot #covidiots #protocol… https://www.instagram.com/p/CA1EE8aHc37/?igshid=1mwxxn7abd19c,2020-05-30 22:45:42+00:00
57,@CNN @cnnbrk Did coronavirus go away?,2020-05-30 22:16:54+00:00
58,@CNN @cnnbrk Can we please get a little coronavirus count box on the screen?,2020-05-30 22:15:30+00:00
59,Italians held a nationwide round of applause for the doctors and nurses who are helping fight the coronavirus outbreak #FBR,2020-05-30 22:14:12+00:00
60,More coronavirus coming!,2020-05-30 22:13:50+00:00
61,"THANK YOU JARED KUSHNER & STEPHEN MILLER: Understaffing, huge crowds of people stuck in small spaces, 4-hour-long lines to get screened — here’s what travelers at international airports across the U.S. faced over the weekend due to #coronavirus 06 #FBR",2020-05-30 22:03:18+00:00
62,New York governor Cuomo signs bill that provides death benefits to families of frontline workers who died battling the coronavirus pandemic. ,2020-05-30 21:35:28+00:00
63,"Canada will close its borders to non-Canadian citizens or permanent residents, with exemptions for U.S. citizens, diplomats and some other groups in an effort to stop the spread of the coronavirus. https://axios.com/canada-closes-borders-coronavirus-61d4d6fd-b5b3-4920-ac7f-9c8803df6e0c.html?utm_source=twitter&amp;utm_medium=social&amp;utm_campaign=organic&amp;utm_content=1100 #FBR",2020-05-30 21:35:17+00:00
64,"Georgia coronavirus: Thousands of Georgians heading back to offices Monday, but many aren’t ",2020-05-30 21:33:06+00:00
65,"The Georgia Department of Public Health confirmed 46,220 statewide coronavirus cases at 9 a.m. Saturday, an increase of 357 from Friday night. Statewide, 2,003 people have now died from the novel coronavirus, an increase of 19 since 7 p.m. Friday.",2020-05-30 22:06:36+00:00
66,How to get freelance work at any age during coronavirus crisis ,2020-05-30 21:15:04+00:00
67,"Mosaic Church Marietta Pastor Adrian Coetzer said they went from giving out about 100 boxes a month to roughly 1,400 boxes in the past two weeks. #fox5atl #COVID19 #coronavirus ",2020-05-30 21:04:02+00:00
68,"Mosaic Church Marietta Pastor Adrian Coetzer said they went from giving out about 100 boxes a month to roughly 1,400 boxes in the past two weeks. #fox5atl #COVID19 #coronavirus https://www.fox5atlanta.com/news/georgia-church-in-need-of-food-donations-to-continue-serving-students-families",2020-05-30 21:03:53+00:00
69,How various countries around the world are dealing with Coronavirus... #COVID19 via RexChapman 03 #SaturdayMorning,2020-05-30 20:33:21+00:00
70,"Gov. Brian Kemp continued to lift restrictions that were aimed at containing the coronavirus, signing an executive order that clears the way for larger gatherings and allows bars and nightclubs in Georgia to reopen if they follow guidelines. ",2020-05-30 20:30:03+00:00
71,"South Korea closes schools again amid coronavirus spike, days after reopening ",2020-05-30 22:07:52+00:00
72,#ScienceMatters @sciam Learn real information about #coronavirus and not #sciencefiction,2020-05-30 20:28:50+00:00
73,"GA Tops 2,000 Coronavirus Deaths, Hospital Cases Grow https://trib.al/2O4j5fA",2020-05-30 20:20:37+00:00
74,"GA Tops 2,000 Coronavirus Deaths, Hospital Cases Grow http://dlvr.it/RXgZ3G",2020-05-30 20:13:03+00:00
75,"GA Tops 2,000 Coronavirus Deaths, Hospital Cases Grow http://dlvr.it/RXgZ3C",2020-05-30 20:13:02+00:00
76,"GA Tops 2,000 Coronavirus Deaths, Hospital Cases Grow http://dlvr.it/RXgZ3B",2020-05-30 20:13:02+00:00
77,"GA Tops 2,000 Coronavirus Deaths, Hospital Cases Grow http://dlvr.it/RXgZ36",2020-05-30 20:13:02+00:00
78,"GA Tops 2,000 Coronavirus Deaths, Hospital Cases Grow http://dlvr.it/RXgYmw",2020-05-30 20:09:03+00:00
79,"GA Tops 2,000 Coronavirus Deaths, Hospital Cases Grow http://dlvr.it/RXgYlQ",2020-05-30 20:09:03+00:00
80,"GA Tops 2,000 Coronavirus Deaths, Hospital Cases Grow http://dlvr.it/RXgYlw",2020-05-30 20:09:03+00:00
81,"GA Tops 2,000 Coronavirus Deaths, Hospital Cases Grow http://dlvr.it/RXgYkR",2020-05-30 20:09:03+00:00
82,"GA Tops 2,000 Coronavirus Deaths, Hospital Cases Grow http://dlvr.it/RXgYlj",2020-05-30 20:09:03+00:00
83,"GA Tops 2,000 Coronavirus Deaths, Hospital Cases Grow http://dlvr.it/RXgYlB",2020-05-30 20:09:03+00:00
84,"GA Tops 2,000 Coronavirus Deaths, Hospital Cases Grow http://dlvr.it/RXgYmP",2020-05-30 20:09:02+00:00
85,"GA Tops 2,000 Coronavirus Deaths, Hospital Cases Grow http://dlvr.it/RXgYT1",2020-05-30 20:07:06+00:00
86,"GA Tops 2,000 Coronavirus Deaths, Hospital Cases Grow http://dlvr.it/RXgYTH",2020-05-30 20:07:06+00:00
87,"GA Tops 2,000 Coronavirus Deaths, Hospital Cases Grow http://dlvr.it/RXgYSw",2020-05-30 20:07:06+00:00
88,"GA Tops 2,000 Coronavirus Deaths, Hospital Cases Grow http://dlvr.it/RXgYT4",2020-05-30 20:07:05+00:00
89,"GA Tops 2,000 Coronavirus Deaths, Hospital Cases Grow http://dlvr.it/RXgYS9",2020-05-30 20:07:04+00:00
90,"GA Tops 2,000 Coronavirus Deaths, Hospital Cases Grow http://dlvr.it/RXgYSB",2020-05-30 20:07:04+00:00
91,"GA Tops 2,000 Coronavirus Deaths, Hospital Cases Grow http://dlvr.it/RXgYPS",2020-05-30 20:07:03+00:00
92,@CharlotteFan20 I hope Princess Charlotte would meet @MichelleObama too. I hope Lottie &amp; her brothers would visit the USA someday once that coronavirus pandemic is over.,2020-05-30 19:58:32+00:00
93,"READ MY OP-ED: Millennials May Help The #Coronavirus Spread Faster. ""Coronavirus COVID19 is a real threat to everyone in America. If you are young and healthy, you may feel that there's no need to worry. You're wrong."" https://tinyurl.com/srrjnzg 03 #COVID19",2020-05-30 19:58:12+00:00
94,So the Coronavirus still around?,2020-05-30 19:52:43+00:00
95,WHERE THERE'S SMOKE... Watch Cardi B blast Trump's lack of leadership skills during the coronavirus pandemic 04 #SaturdayMorning,2020-05-30 19:44:14+00:00
96,Lol at people caring about coronavirus in November. People barely care now,2020-05-30 19:41:55+00:00
97,#coronavirus could prove especially dicey for men of color wearing face masks.,2020-01-30 23:58:02+00:00
98,Americans quarantined after evacuation flight l ABC News https://youtu.be/TCvZjn1uhSU via @YouTube #WHO #Americans #quarantined #coronavirus,2020-01-30 23:54:53+00:00
99,Chicago man is first US case of person-to-person coronavirus spread https://www.usatoday.com/story/news/nation/2020/01/30/coronavirus-chicago-man-first-us-case-person-person-spread/2857083001/ via @usatoday #coronavirus #US #Chicago,2020-01-30 23:45:05+00:00
100,Coronavirus who? ,2020-01-30 23:44:22+00:00
101,Possible case of coronavirus being tested in Arkansas ,2020-01-30 23:37:03+00:00
102,"Person-to-person transmission of coronavirus reported in US, CDC says https://fxn.ws/2Gyw4qB #FoxNews",2020-01-30 23:21:28+00:00
103,This is how that Coronavirus got started!!,2020-01-30 23:20:08+00:00
104,I’m ready for the president to deny the existence of the coronavirus.,2020-01-30 23:19:46+00:00
105,"@realDonaldTrump nuke China, I dont want the coronavirus",2020-01-30 23:18:55+00:00
106,"So much for Hope Update (1730ET): Hubei Province has just confirmed another 42 coronavirus-related deaths Hubei diagnosed another 1,220 cases, bringing the total number for both China and the world above 9,000, well above SARS global total.",2020-01-30 22:58:04+00:00
107,It took me 45 minutes to go 4 miles after work. Y’all send some of that coronavirus over this way.,2020-01-30 22:58:01+00:00
108,Would you be interested in doing an Ask Me Anything on Reddit sometime next week? I'm trying to organize a coronavirus panel discussion on r/science.,2020-01-30 22:56:50+00:00
109,Me when the coronavirus hits Atlanta. ,2020-01-30 22:56:18+00:00
110,"Many of Coca-Cola’s 45 plants in China have remained closed to help prevent the spread of the coronavirus, but the company said some are reopening with the backing of China’s government. ",2020-01-30 22:45:00+00:00
111,The latest from the Arkansas Department of Health on the possible coronavirus case in the state. ,2020-01-30 22:31:47+00:00
112,People don't really believe this do they? #residentevil #capcom #umbrellacorporation #coronavirus https://www.instagram.com/p/B79cPjsBkBq/?igshid=1tp8avib2cybb,2020-01-30 22:09:02+00:00
113,"""Coronavirus will 'help to accelerate the return of jobs to North America,' Commerce Secretary Wilbur Ross says"". Who cares if someone dies? JOBS JOBS JOBS! ",2020-01-30 22:08:13+00:00
114,CDC confirms first case of person-to-person Coronavirus in the United States. Red more here... https://www.cdc.gov/media/releases/2020/p0130-coronavirus-spread.html,2020-01-30 22:05:45+00:00
115,"38 pallets of masks headed for Hubei Province, China to help healthcare workers fighting the spread of coronavirus. Thanks to @medshare, @UPS_Foundation, @mapintl and @projecthopeorg",2020-01-30 21:53:11+00:00
116,Familial cluster of pneumonia associated with novel coronavirus suggests person to person transmission. Via @TheLancet https://www.thelancet.com/journals/lancet/article/PIIS0140-6736(20)30154-9/fulltext,2020-01-30 21:52:09+00:00
117,WMUR Manchester: Coronavirus tests on 2 people in NH come back negative; patients fully recovered. https://www.wmur.com/article/coronavirus-test-results-new-hampshire-january-30-2020/30714321 via @GoogleNews,2020-01-30 21:46:08+00:00
118,If the coronavirus was a person. ,2020-01-30 21:45:10+00:00
119,"boutta order some coronavirus off aliexpress, y’all want anythin?",2020-01-30 21:32:00+00:00
120,A Timeline of How the Wuhan Coronavirus Has Spread—And How the World Has Reacted http://twib.in/l/zzqMLrLMzxzp,2020-01-30 21:29:17+00:00
121,it’s called Corona virus.. ,2020-01-30 21:28:57+00:00
122,"With Europe bracing for a #coronavirus outbreak, here's a look at the situation from a different angle. Here's some countries that need to work on hand-washing according to a @GallupPoll. Looking at you Netherlands. #covid19 http://statista.com/chart/4111/do- @MikeQuindazzi #Artificia",2020-02-28 23:33:16+00:00
123,Please come through!! #COVID19 #CoronaVirusUpdates #CoronavirusOutbreak #ATL #Coronavirus,2020-02-28 23:16:18+00:00
124,44 more coronavirus cases confirmed on Japanese cruise ship. DiamondPrincess COVID19 #coronavirus 2019nCoV Japan #FridayThoughts,2020-02-28 23:12:21+00:00
125,As the world rushes to develop new vaccines against #COVID19 there is a real risk that pregnant women and their babies will not be among those who are able to benefit from them. | via @statnews,2020-02-28 23:05:10+00:00
126,"CDC’s clinical team, working with state and local health departments to assess PUIs, has not declined any request for testing for #COVID19.",2020-02-28 22:09:03+00:00
127,"Given increased spread of novel coronavirus across the world, CDC has updated the definition of a person under investigation (#PUI) for #COVID19. https://bit.ly/3afhjFI",2020-02-28 21:52:01+00:00
128,"Based on what is known about how the novel coronavirus behaves, CDC and @CAPublicHealth expect to see #COVID19 infection in people who have had contact with the recently-identified patient, especially those who have had close, prolonged contact.",2020-02-28 21:43:02+00:00
129,CDC has sent a team to support @CAPublicHealth &amp; the local health depts to investigate a recently confirmed case of #COVID19 in a person who has not traveled internationally &amp; may have been exposed to the virus in their community. ,2020-02-28 21:43:02+00:00
130,"EVEN THOUGH THESE MASKS ARE PRACTICALLY USELESS AGAINST THE #CORONAVIRUS COVID19, THEY ARE REQUIRED BY LAW IN CHINA. China's automatic production line is trying its best to produce masks. How about the speed? 04 #VoteBlueNoMatterWho",2020-02-28 21:41:15+00:00
131,"Imagine seeing this in the lift, residents will hunker down for quarantine as a daily disinfectant aerosol is sprayed throughout #coronavirus COVID19 nCoV2019 https://twitter.com/IsChinar/status/1225179650713890816/video/1 01 #FridayThoughts",2020-02-28 21:06:14+00:00
132,Hey Trumpty Dumpty. How did #Obama cause #COVID19 ?,2020-02-28 21:05:13+00:00
133,"Based on what is known about how the novel coronavirus behaves, CDC and @CAPublicHealth expect to see #COVID19 infection in ppl who have had contact with the recently-identified patient, especially those who have had close, prolonged contact.",2020-02-28 21:01:17+00:00
134,A MASK CANNOT PROTECT YOU FROM THE #CORONAVIRUS OR COVID19. A mask is unlikely to be your best defense against the coronavirus — offering instead a false sense of security. It could actually put you and others at risk. http://bit.ly/CoronavirusBIT 09,2020-02-28 20:48:15+00:00
135,HUMAN RIGHTS ABUSES OR DEFENDING NATIONAL SECURITY? Anybody could be arrested for not wearing a mask in China. COVID19 #coronavirus 01 #FBR,2020-02-28 20:02:18+00:00
136,"Geez, even in a down economy alcohol still sells. #COVID19 #coronavirus #coronabeer #coronabeervirus",2020-02-28 18:47:49+00:00
137,@CDCgov Are we just waiting on Antarctica to confirm a case of #COVID19 for the #WHO to call this a Pandemic?,2020-02-28 18:38:37+00:00
138,"The COVID19 conspiracy theory that it's supposed to take down Trump fully misses that it actually HAS brought the protests in Hong Kong to a standstill. Not that Americans look much beyond our internal shitshow, but this seems like better tinfoil hat fodder.",2020-02-28 18:32:37+00:00
139,"Imagine seeing this in the lift, residents will hunker down for quarantine as a daily disinfectant aerosol is sprayed throughout #coronavirus COVID19 nCoV2019 https://twitter.com/IsChinar/status/1225179650713890816/video/1 02 #FridayThoughts",2020-02-28 17:47:11+00:00
140,How random mutations in the genome can help researchers track the spread and transmission of #COVID19. Via @TheScientistLLC https://www.the-scientist.com/news-opinion/coronaviruss-genetics-reveal-its-global-travels-67183,2020-02-28 17:45:53+00:00
141,Psyched that radio story on #COVID19 antiviral therapeutics from @sclaudwhitehead @wabenews made it to @Marketplace! @emoryhealthsci @DRIVEInnovate,2020-02-28 17:33:03+00:00
142,A MASK CANNOT PROTECT YOU FROM THE #CORONAVIRUS OR COVID19. A mask is unlikely to be your best defense against the coronavirus — offering instead a false sense of security. It could actually put you and others at risk. http://bit.ly/CoronavirusBIT 04,2020-02-28 17:18:18+00:00
143,Hot off the press the most recent viewpoint ⁦@PreetiNMalani⁩ and I wrote on #COVID19 for ⁦@JAMA_current⁩ “New Insights on a Rapidly Changing Epidemic”.,2020-02-28 16:53:01+00:00
144,"EVEN THOUGH THESE MASKS ARE PRACTICALLY USELESS AGAINST THE #CORONAVIRUS COVID19, THEY ARE REQUIRED BY LAW IN CHINA. China's automatic production line is trying its best to produce masks. How about the speed? 05 #BlackHistoryMonth",2020-02-28 16:48:16+00:00
145,Here's What These Public Health Experts Had To Say About 6 FAQs On The #Coronavirus #COVID19 #COVID19US,2020-02-28 16:47:58+00:00
146,A MASK CANNOT PROTECT YOU FROM THE #CORONAVIRUS OR COVID19. A mask is unlikely to be your best defense against the coronavirus — offering instead a false sense of security. It could actually put you and others at risk. http://bit.ly/CoronavirusBIT 07,2020-02-28 15:48:20+00:00
