"http://dld.bz/tw-f  New Tech, Sharp Docs Made Fast ID of Wuhan Coronavirus Possible https://www.voanews.com/science-health/new-tech-sharp-docs-made-fast-id-wuhan-coronavirus-possible … #nouvellespic.twitter.com/OWHepz0rx3"
http://dld.bz/tw-f  Four More Americans Test Positive for Coronavirus After Evacuation From Cruise Ship   https://www.voanews.com/science-health/coronavirus-outbreak/four-more-americans-test-positive-coronavirus-after-evacuation … #nouvellespic.twitter.com/oUPlysIn0a
Katy Perry and Orlando Bloom's Japan Wedding Plans Stalled Due to Coronavirus https://www.eonline.com/news/1128521/katy-perry-and-orlando-bloom-s-japan-wedding-plans-stalled-due-to-coronavirus?cmpid=rss-000000-rssfeed-365-topstories&utm_source=eonline&utm_medium=rssfeeds&utm_campaign=rss_topstories … #newspic.twitter.com/GfQjFTifu8
Coachella and Stagecoach 2020 Music Festivals Officially Postponed Due to Coronavirus https://www.eonline.com/news/1129904/coachella-and-stagecoach-2020-music-festivals-officially-postponed-due-to-coronavirus?cmpid=rss-000000-rssfeed-365-topstories&utm_source=eonline&utm_medium=rssfeeds&utm_campaign=rss_topstories … #newspic.twitter.com/zCcW09FldT
Debi Mazar Says She Has Coronavirus and Reveals Just How Hard it Was to Get Tested https://www.eonline.com/news/1133248/debi-mazar-says-she-has-coronavirus-and-reveals-just-how-hard-it-was-to-get-tested?cmpid=rss-000000-rssfeed-365-topstories&utm_source=eonline&utm_medium=rssfeeds&utm_campaign=rss_topstories … #newspic.twitter.com/V8uYG81GcG
Debi Mazar Says She Has Coronavirus and Reveals Just How Hard it Was to Get Tested https://www.eonline.com/news/1133248/debi-mazar-says-she-has-coronavirus-and-reveals-just-how-hard-it-was-to-get-tested?cmpid=rss-000000-rssfeed-365-topstories&utm_source=eonline&utm_medium=rssfeeds&utm_campaign=rss_topstories … #newspic.twitter.com/V8uYG81GcG
