"Coronavirus, murder hornet, aliens, parallel universe, now the country on fire"
Also in this very thread I laid out why the Corona Virus can actually be dangerous because of the steps normal people can take to avoid the flu.. Yet &amp; still you are right and my conversation is wack.. Or maybe you lack the intellect to have a conversation without being biased
RT @karynmaughan: South Africa now ranked 21 in the world for its number of #COVID19 infections. It has most cases in Africa - 20000 more t…
People are scared of the Coronavirus but will sit in rotation on a blunt with 12 people they don’t know just to try and suck on the roach
«#Canada reports new coronavirus cases in Ontario and Alberta»  https://twitter.com/i/events/1235182461576863745 …
So I just seen a post that said” If you’re Christian you’re safe from the corona virus” like niiggggaaa fuck is you talkin’ bout 
That coronavirus is all fun and games until a loved one you know gets it.
That coronavirus is all fun and games until a loved one you know gets it.
