"Insights Into 2020 – Day 21 of 365Well ... it's all beginning. We're still only in January 2020, and we're getting a taster of just how bad it's going to get ...Chinese Coronavirus OutbreakRight on cue we ar... https://mara-gamiel.blogspot.com/2020/01/insights-into-2020_21.html …pic.twitter.com/KMMEuaooRv"
"Virologist Who Visited Wuhan Says Coronavirus is “Out of Control” – [Humans Are Free]: A top virologist who was involved in the response to SARS says he has visited Wuhan, China and believes ... https://mara-gamiel.blogspot.com/2020/01/virologist-who-visited-wuhan-says.html …pic.twitter.com/ApVKxBUbre"
Coronavirus: finding the ambiguous reality behind the fear porn headlines – [David Icke]: According to the World Health Organisation the latest viral panic – the infamous allegedly ‘new�... https://mara-gamiel.blogspot.com/2020/02/coronavirus-finding-ambiguous-reality.html …pic.twitter.com/aEWCpQOP4n
STAGED CORONAVIRUS PANDEMIC: An International Criminal Conspiracy of Epic Proportions – [Before Its News]: Is the bioengineered coronavirus pandemic being purposefully propagated globally in order t... https://mara-gamiel.blogspot.com/2020/02/staged-coronavirus-pandemic_14.html …pic.twitter.com/xS65DEMJDk
"Since Jan. 20th, the number of coronavirus cases outside China has exploded from 4 to 523… and the media still tells us this pandemic is contained? – [Natural News]: Not even a month ago, th... https://mara-gamiel.blogspot.com/2020/02/since-jan-20th-number-of-coronavirus.html …pic.twitter.com/bdFquUPUhJ"
"Nearly 10K Military Personnel From 110 Nations In Wuhan China Weeks Before Coronavirus Outbreak! – [David Icke]: An important update regarding Wuhan China, which is ground zero for the  coro... https://mara-gamiel.blogspot.com/2020/02/nearly-10k-military-personnel-from-110.html …pic.twitter.com/T3Wbf6Ij0j"
Because symptoms are almost identical and we are in flu season ... watch for the majority of the 'new' virus cases rising dramatically as they will deviously claim normal flu cases are coronavirus to make it look like its out of control. Its all a NWO take over
