"China coronavirus: at least three suspected cases in Shenzhen, Shanghai https://www.scmp.com/news/china/society/article/3046681/china-coronavirus-least-three-suspected-cases-found-shenzhen … di @scmpnews"
"I social network contro le notizie false sul coronavirus: le mosse di Facebook, Twitter e YouTube @mashableitaliahttps://it.mashable.com/social-media/1835/i-social-network-contro-le-notizie-false-sul-coronavirus-le-mosse-di-facebook-twitter-e-youtube …"
"After chaos, Dr Li Wenliang, coronavirus whistle-blower, confirmed dead at 34 https://www.scmp.com/news/china/society/article/3049411/coronavirus-li-wenliang-doctor-who-alerted-authorities-outbreak … di @scmpnews"
"RT @MileyCyrus: Spain, you united in solidarity with Black Lives Matter in the US. We must keep standing together to tackle #COVID19 and it…"
Yuval Noah Harari: the world after coronavirus https://www.ft.com/content/19d90308-6858-11ea-a3c9-1fe6fedcca75 …
Yuval Noah Harari: the world after coronavirus https://www.ft.com/content/19d90308-6858-11ea-a3c9-1fe6fedcca75 …
