"Manchester Evening News: Children have died from new rare 'disease' believed to be linked to coronavirus, says Health Secretary. https://www.manchestereveningnews.co.uk/news/uk-news/health-secretary-illness-children-died-18161543 via @GoogleNews"
UK Govt: Provide PPE to ALL frontline NHS to keep them safe #coronavirus - Sign the Petition! http://chng.it/LMRx7Rhw via @UKChange
#coronavirus #COVIDー19 NOT just the face masks but other items like gloves and aprons and eye protectors and AMAZON AND EBAY are the some of the worst inflating the prices ...for them to come from China wait for 5-6 weeks for delivery and they don’t even meet uk safety standards
Nah I'm hearing York has a rumour of coronavirus? I'm actually just staying in my room from now on cba
I would not trust this goverment to deal with #Coronavirus if they want to place them in a safe area. How about starting with Downing Street. #bbcqt
the . could probably kill the coronavirus with a shot. 
This shows the stupidity of #ClimateChange today you are marching on something that may or may not happen in the future where today the #CoVid19 virus is killing people. Yet you choose a march in #Bristol when social gatherings are being cancelled across the world. Idiots!
"Its propaganda, assuring us to carry on as normal. experts & authorities know #covid19 is coming &amp; journalists should not be calming markets for the establishment. Meanwhile in the UK #julianassange has his liberty and human rights removed for telling the truth #Assange"
Isn’t it time you banned flights from china to prevent the spread of Corona virus. I was in Salisbury cathedral this afternoon and Chinese tourists who were probably in China a day ago were right here possibly risking our health by spreading disease. #BanChinaFlightspic.twitter.com/lyEJdqAx1Y
Coronavirus Outbreak Is Linked to Eating Animal Flesh http://petaau.vg/12u 
How Did MEAT Cause The CORONAVIRUS? | LIVEKINDLY https://youtu.be/sM3iDIhJMDA  via @YouTube
What are English people gonna do when all football leagues get suspended due to Coronavirus they literally can't control it without complete lockdowns
"RT @HarlowCouncil: 🛍 Your Town Centre has changed 🚧

Measures are in place to help stop the spread of #coronavirus and support the reopenin…"
Boris dumb about the science.
"#COVID19 #Covid_19 #coronavirus 

You was lied to!!!!

#riots2020 are a distraction #wakeup your life is over due t… https://t.co/tcW5Fi31oG"
"RT @Latvian_MFA: Acting on an initiative inspired by 🇱🇻Latvia, 130 countries of the🇺🇳@UN have delivered a cross-regional statement on count…"
"RT @SkyNews: BREAKING: A smiling Queen looks on at a scaled back military parade at Windsor Castle, in her first outdoor event since the st…"
"RT @redsonya241: Should the @Conservatives government be held to account for the avoidable death toll of #COVID19? 

Is it genocide when th…"
"RT @KhadijaDrogba: May Allah Talah grant #shahidafridi speedy recovery and good health Ameen 
Get well soon #lala #HopeNotOut https://t.co/…"
RT @ThatTimWalker: Damniing: Johnson disbanded the Cabinet pandemic team six months before #COVID19 hit the UK (to focus on Brexit). https:…
"RT @mohnotgaurav18: Yesterday - Delhi, Mumbai &amp; Chennai - accounted for over 43% of India’s new #COVID19 cases. 43%! 

4% of India’s popula…"
"RT @BelTel: Coronavirus Northern Ireland updates: Crowd gathers at Belfast City Hall to 'protect war memorials' #coronavirus #COVID19
https…"
"RT @Leicnut: We’re all getting use to having this virus around. 

Doesn’t mean it can’t still kill you. 

Be careful. Act sensibly. Think o…"
"RT @natalieben: Have asked govt what assessment made of how wildlife crime, including the illegal killing of raptors &amp; illegal use of traps…"
"Coronavirus hits ill and disabled people hardest, so why is society writing us off? | Frances Ryan https://www.theguardian.com/commentisfree/2020/mar/11/coronavirus-ill-disabled-people?CMP=share_btn_tw …"
apparently having corona virus makes you loose weight ?? i will literally get an old person to cough on me PLEASE
We have limited intensive care beds majority are already in use  #Coronavirus in a rural area wood be deadly #StayHomeStaySafe listen to what the government advice
This #coronavirus pandemic should never have happened. Sign our pledge today. https://www.idausa.org/campaign/farmed-animal/latest-news/take-the-pledge-stop-the-animal-cruelty-that-caused-covid-19/ …
Fresh US sanctions on #Iran even after they offered to help #Tehran deal with #coronavirus https://twitter.com/Reuters/status/1240274254991462400 …
"i just watched one of my concert videos and i wanna cry, coronavirus has messed up EVERYTHING good this year :("
Boris Johnson: Call to the Government to support UK's hospitality industry through the Coronavirus crisis - Sign the Petition! http://chng.it/Ngx4BfMW  via @UKChange
This #coronavirus pandemic should never have happened. Sign our pledge today. https://www.idausa.org/campaign/farmed-animal/latest-news/take-the-pledge-stop-the-animal-cruelty-that-caused-covid-19/ …
Fresh US sanctions on #Iran even after they offered to help #Tehran deal with #coronavirus https://twitter.com/Reuters/status/1240274254991462400 …
Boris Johnson: Call to the Government to support UK's hospitality industry through the Coronavirus crisis - Sign the Petition! http://chng.it/Ngx4BfMW  via @UKChange
We have limited intensive care beds majority are already in use  #Coronavirus in a rural area wood be deadly #StayHomeStaySafe listen to what the government advice
"i just watched one of my concert videos and i wanna cry, coronavirus has messed up EVERYTHING good this year :("
