Provincial lab rules out coronavirus in Ottawa case https://ottawacitizen.com/news/local-news/provincial-lab-rules-out-coronavirus-in-ottawa-case?utm_term=Autofeed&amp;utm_medium=Social&amp;utm_source=Twitter#Echobox=1580428601
"Chinese-Canadians facing hate, racism for coronavirus outbreak — much like the SARS outbreak in 2003 https://ottawacitizen.com/news/chinese-canadians-facing-hate-racism-for-coronavirus-outbreak-much-like-the-sars-outbreak-in-2003/wcm/912b6202-7ee6-4810-9537-b50febce71f1?utm_term=Autofeed&amp;utm_medium=Social&amp;utm_source=Twitter#Echobox=1580424302"
"The coronavirus has nothing to do with Corona beer, despite what many people around the world seem to think https://ottawacitizen.com/life/food/the-coronavirus-has-nothing-to-do-with-corona-beer-despite-what-many-people-around-the-world-seem-to-think/wcm/a278563e-d8e1-4bd8-9c07-2fea0ff28c43?utm_medium=Social&amp;utm_source=Twitter#Echobox=1580380087"
Canadian scientist remains cautious of new coronavirus: 'It is very reminiscent of SARS' https://ottawacitizen.com/news/local-news/canadian-scientist-remains-cautious-of-new-coronavirus-it-is-very-reminiscent-of-sars?utm_medium=Social&utm_source=Twitter#Echobox=1579085908 …pic.twitter.com/00McnBFR5V
Canadian scientist remains cautious of new coronavirus: 'It is very reminiscent of SARS' https://ottawacitizen.com/news/local-news/canadian-scientist-remains-cautious-of-new-coronavirus-it-is-very-reminiscent-of-sars?utm_medium=Social&utm_source=Twitter#Echobox=1579058141 …pic.twitter.com/Sc8XNyboHb
Provincial lab rules out coronavirus in Ottawa case https://ottawacitizen.com/news/local-news/provincial-lab-rules-out-coronavirus-in-ottawa-case?utm_term=Autofeed&utm_medium=Social&utm_source=Twitter#Echobox=1580428601 …pic.twitter.com/e3llLx3utv
"'Infect me daddy,' Queen's University student trustee resigns after attending coronavirus party https://ottawacitizen.com/news/canada/infect-me-daddy-queens-university-student-trustee-resigns-after-attending-coronavirus-party/wcm/90ada588-b1f5-449f-9ee4-c2e5f5fd3c13?utm_term=Autofeed&utm_medium=Social&utm_source=Twitter#Echobox=1581026241 …pic.twitter.com/OdwCOxf0PL"
Ontario confirms seventh coronavirus case; man had travelled to Iran https://ottawacitizen.com/pmn/news-pmn/canada-news-pmn/ontario-confirms-seventh-coronavirus-case-man-had-travelled-to-iran/wcm/ec61ca47-1c77-4c7b-8cb5-35b6e9e6fcce?utm_medium=Social&utm_source=Twitter#Echobox=1582920889 …pic.twitter.com/m7CgNfz3Xi
"'Reasonable precautions, then get on with our work:' PS response to coronavirus continues to evolve https://ottawacitizen.com/news/local-news/reasonable-precautions-then-get-on-with-our-work-ps-response-to-coronavirus-continues-to-evolve?utm_term=Autofeed&utm_medium=Social&utm_source=Twitter#Echobox=1583883108 …pic.twitter.com/ISR1im7JuF"
Here's how to apply for government help during the coronavirus pandemic https://ottawacitizen.com/news/politics/heres-how-to-apply-for-government-help-during-the-coronavirus-pandemic/wcm/6af4cfa2-5762-4e7b-8fd7-888e915ff5b2?utm_medium=Social&utm_source=Twitter#Echobox=1584729730 …pic.twitter.com/SSW82KFGbT
"At least 40 per cent of Americans will become infected by coronavirus, and then the grim choices begin https://ottawacitizen.com/news/world/at-least-40-of-americans-will-become-infected-by-coronavirus-and-then-the-grim-choices-begin/wcm/22c70606-8988-44a4-bf45-770f99061646?utm_medium=Social&utm_source=Twitter#Echobox=1584392285 …pic.twitter.com/Fh82M5cA1L"
Here's how to apply for government help during the coronavirus pandemic https://ottawacitizen.com/news/politics/heres-how-to-apply-for-government-help-during-the-coronavirus-pandemic/wcm/6af4cfa2-5762-4e7b-8fd7-888e915ff5b2?utm_medium=Social&utm_source=Twitter#Echobox=1584729730 …pic.twitter.com/SSW82KFGbT
"At least 40 per cent of Americans will become infected by coronavirus, and then the grim choices begin https://ottawacitizen.com/news/world/at-least-40-of-americans-will-become-infected-by-coronavirus-and-then-the-grim-choices-begin/wcm/22c70606-8988-44a4-bf45-770f99061646?utm_medium=Social&utm_source=Twitter#Echobox=1584392285 …pic.twitter.com/Fh82M5cA1L"
