"We need better education systems if this is actually a problem ! No, Corona beer is not linked to China’s coronavirus outbreak "
"Some say that they're not concerned about the coronavirus because they are not part of an at-risk group (pre-existing condition, age, etc.) Please remember that taking care of yourself isn't just for you, it also protects the vulnerable #COVID19"
"We need better education systems if this is actually a problem !

No, Corona beer is not linked to China’s coronavirus outbreak  https://www.fox29.com/news/no-corona-beer-is-not-linked-to-chinas-coronavirus-outbreak …"
"This Chinese doctor tried to save lives, but was silenced. Now he has coronavirus https://www.cnn.com/2020/02/03/asia/coronavirus-doctor-whistle-blower-intl-hnk/index.html …"
He will pray the coronavirus away lol
Trump ordered Mike Pence not to compliment the governor of Washington during coronavirus outbreak  https://www.rawstory.com/2020/03/trump-ordered-mike-pence-not-to-compliment-the-governor-of-washington-during-coronavirus-outbreak/ …
"the director of the National Institute of Allergy and Infectious Diseases, made it clear that the US is still at least 12 to 18 months from developing a vaccine for the novel coronavirus."
#Coronavirus vaccine at least 12 to 18 months away: top US virus expert #Covid_19https://apple.news/AmpUrGbjJRkSRMswfc9ri0g …
