,Tweets,Date
103,China coronavirus: Hong Kong scraps major Lunar New Year events https://www.scmp.com/news/hong-kong/health-environment/article/3047310/china-coronavirus-hong-kong-widens-criteria …,2020-01-23 23:16:52
104,First coronavirus death reported outside Hubei; eight cities now on lockdown https://www.scmp.com/news/china/society/article/3047453/china-coronavirus-first-fatality-reported-outside-epicentre …,2020-01-23 23:16:16
105,"#China says new #coronavirus  cases have increased by 840 to almost 5,500. #WuhanVirus cases have now surpassed the number of SARS infections. Deaths on the mainland have increased to 131.",2020-01-28 23:59:48
106,China coronavirus: death toll reaches 131 as number of cases surpasses that of Sars https://www.scmp.com/news/china/society/article/3047979/china-coronavirus-death-toll-reaches-131-number-cases-surpasses …,2020-01-28 23:53:36
107,Americans evacuated by plane from Wuhan amid coronavirus outbreak https://www.scmp.com/news/world/united-states-canada/article/3047978/china-coronavirus-americans-evacuated-plane-wuhan?utm_content=article&utm_medium=Social&utm_source=Twitter#Echobox=1580255315 …,2020-01-28 23:48:36
108,China fights ‘devil’ coronavirus as country isolated by rest of world | News | The Times https://www.thetimes.co.uk/article/china-fights-devil-coronavirus-as-country-isolated-by-rest-of-world-hvqsdwmt0 …,2020-01-28 23:42:19
109,Breaking: China coronavirus death toll reaches 131 as number of cases surpasses that of SARS https://www.scmp.com/news/china/society/article/3047979/china-coronavirus-death-toll-reaches-131-number-cases-surpasses …,2020-01-28 23:39:54
110,HK government officials in masks but in wrong way. #WARS #coronavirus #freehkpic.twitter.com/vovGNbiidQ,2020-01-28 23:39:31
111,Hong Kong homebuyers’ tours of Greater Bay Area property projects expected to decline amid Wuhan coronavirus outbreak https://www.scmp.com/property/hong-kong-china/article/3047930/hong-kong-homebuyers-tours-greater-bay-area-property?utm_term=Autofeed&utm_medium=Social&utm_content=article&utm_source=Twitter#Echobox=1580252838 …,2020-01-28 23:35:42
112,"Beijing confirms use of anti-HIV drugs to treat #coronavirus patients at some hospitals
The number of infections in mainland China exceeds 1,700 and the death toll at 55
https://www.scmp.com/news/china/society/article/3047667/china-coronavirus-beijing-confirms-use-anti-hiv-drugs-some …pic.twitter.com/GxpTMKYA6j",2020-01-25 23:59:55
113,"Hong Kong universities suspend classes until March as China coronavirus fears grow, while education chiefs discuss extending closure of city’s schools | South China Morning Post https://www.scmp.com/news/hong-kong/education/article/3048305/hong-kong-universities-suspend-classes-until-march-china …",2020-01-30 23:59:15
114,"@sambad_odisha Hi Sambad,Your figures for Corona Virus is misleading. Here are the correct information. You published affected people as dead in HongKong, Maccau. Please follow http://SCMP.com  thankspic.twitter.com/ggPhipDBzo",2020-01-30 23:58:28
115,"That time was days ago.

#kowtow #China #inaction #CoronavirusOutbreak #coronavirus https://twitter.com/DrTedros/status/1222982871444598789 …",2020-01-30 23:57:09
116,#China #coronavirus: deadly day in Hubei as a record high 42 patients die #WuhanCoronavirushttps://www.scmp.com/news/china/society/article/3048320/china-coronavirus-deadly-day-hubei-record-high-42-patients-die …,2020-01-30 23:36:13
117,Overnight: 100% increase in reported coronavirus cases in Hong Kong... #virus #hongkong #mutating #countistwo #health #SARS #epidemic,2020-01-22 23:54:06
118,"Unfortunately nothing has improved compared with 2003, except the mobility of people (now you may call the secondary source of coronavirus).

I am sure there is a significantly time lag in the available data for the infected.",2020-01-22 23:49:22
119,China coronavirus: Europe boosts flight checks as killer virus spreads https://www.scmp.com/news/world/europe/article/3047262/china-coronavirus-europe-boosts-flight-checks-killer-virus?utm_term=Autofeed&utm_medium=Social&utm_content=article&utm_source=Twitter#Echobox=1579721517 …,2020-01-22 23:42:49
120,How dangerous is China’s new coronavirus to the world? https://www.newstatesman.com/world/asia/2020/01/how-dangerous-china-s-new-coronavirus-world …,2020-01-22 23:24:30
121,"The largest migration of people on the planet is about to begin for the Chinese New Year - about 400 million people will be circulating en masse across China.

The timing couldn't be worse if you're trying to contain the spread of a disease.

#coronavirus pic.twitter.com/5jjKz47p7P",2020-01-22 23:21:13
122,I would not disagree that Wuhan pneumonia/coronavirus or other types of virus with origin from wildlife is the revenge of Mother Gaia. 2/2,2020-01-22 23:15:49
123,"American health authorities on Tuesday confirmed the first case of a traveler in the U.S infected with a new coronavirus from China, after Chinese officials reported that more than 300 people have been diagnosed so far. By ⁦@NAR⁩ #WuhanPneumoniahttps://asia.nikkei.com/Spotlight/Virus-outbreak/US-confirms-China-virus-case-and-widens-airport-screening …",2020-01-21 23:47:58
124,"China coronavirus: Hong Kong schools take extra precautions against outbreak including masks, temperature checks and sanitising hands https://www.scmp.com/news/hong-kong/health-environment/article/3047080/china-coronavirus-hong-kong-schools-take-extra?utm_term=Autofeed&utm_medium=Social&utm_source=Twitter#Echobox=1579650419 …",2020-01-21 23:47:00
125,First Wuhan coronavirus case confirmed in United States as authorities say threat to public from deadly pneumonia still ‘low’ https://www.scmp.com/news/china/science/article/3047085/first-wuhan-coronavirus-confirmed-united-states-reports-say …,2020-01-21 23:39:22
126,"On today's Money Talk; Global stocks tumbled after China confirmed the new coronavirus originating in Wuhan is spreading via person-to-person transmission. US stocks fell after the first outbreak in the #US of the virus that has killed 6 people in #China and infected >300.
1/16",2020-01-21 22:27:20
127,"On today's Money Talk;  Global stocks tumbled after China confirmed the new coronavirus originating in Wuhan is spreading via person-to-person transmission. US stocks fell after the first outbreak in the #US of the virus that has killed 6 people in #China and infected >300.
1/16",2020-01-21 22:22:02
128,"“Stop talking,” said one of many critics in China of the government's response to the coronavirus outbreak. “All we want to know is when you will resign.” https://nyti.ms/2O1RlNu ",2020-01-27 23:30:07
129,"Run or not run, it goes to same destination. China is a hell, either with or without coronavirus. It’s PresidentXi who is responsible for all this.",2020-01-24 23:57:43
130,#Hongkong: outright fear due to #Coronavirus in midst of #CNY: 2019 ended in recession: how can 2020 be any different given importance of visitors in key sectors like #retail and #hospitality? Two years of recession will also severely affect #investment&foreign companies' plans..,2020-01-24 23:45:34
131,"#China #coronavirus : Death toll rises to 41; over 1,000 cases of infection reported nationwide https://www.scmp.com/news/china/society/article/3047631/china-coronavirus-death-toll-rises-41-over-1000-cases-infection …",2020-01-24 23:44:11
132,"Wuhan Coronavirus: Toll from coronavirus rises to 41 deaths, with more than 1,000 *confirmed* cases in China. #Coronavirus

The #Wuhan #Coronavirus has so far spread to:
- Vietnam
- Thailand
- Japan
- Singapore
- South Korea
- Taiwan
- Hong Kong
- US",2020-01-24 23:30:27
133,Chinese Min of Human Resources on impact of corona virus on labor contracts https://mp.weixin.qq.com/s/lBLVD0YePspHo91Zy68bIg …,2020-01-24 23:20:46
134,"Please be careful too P'Jack
There are so many unknown of coronavirus still.
Btw over 7000+ suspected cases now...",2020-01-29 23:58:57
135,Chinese mall landlords offer rent-free periods to merchants as footfall decreases amid Wuhan coronavirus outbreak https://www.scmp.com/business/companies/article/3048118/chinese-mall-landlords-offer-rent-free-periods-merchants?utm_content=article&utm_medium=Social&utm_source=Twitter#Echobox=1580342042 …,2020-01-29 23:54:02
136,"""So far, the Wuhan coronavirus is not much more frightening than the outbreaks of other recent coronaviruses like SARS in 2003 or MERS in 2012, each of which killed fewer than a thousand people around the world,"" @fmanjoo writeshttps://nyti.ms/2O6K8LR ",2020-01-29 23:51:23
137,China bans wildlife trade as killer Wuhan coronavirus spreads https://www.scmp.com/news/china/society/article/3047716/china-bans-wildlife-trade-killer-wuhan-coronavirus-spreads?utm_term=Autofeed&utm_medium=Social&utm_content=article&utm_source=Twitter#Echobox=1580080879 …,2020-01-26 23:37:16
138,This is by far the most stupid joke in relation to the corona virus epidemic. Get away with it? A shame!,2020-01-26 23:34:36
139,Hiding your coronavirus history can give you bad social credit https://www.scmp.com/tech/article/3049568/hiding-your-coronavirus-history-can-give-you-bad-social-credit?utm_content=article&utm_medium=Social&utm_source=Twitter#Echobox=1581099541 …,2020-02-07 23:41:38
140,"[Recap] Coronavirus: Resign, strike or endure? The dilemma of Hong Kong’s ‘dirty team’ doctors

https://www.hongkongfp.com/2020/02/07/coronavirus-resign-strike-endure-dilemma-hong-kongs-dirty-team-doctors … @krislc #hongkong #wuhan #hongkong #wuhanvirus #WuhanCoronaviruspic.twitter.com/sXPxoCKJFd",2020-02-07 23:29:48
141,Standing for face masks in a line where they handed us number cards to wait. What a sad reality. #hongkong #coronavirus #wuhancoronavirus,2020-02-08 23:41:54
142,Fears thick 'death' smog over Wuhan confirms China is burning coronavirus bodies - Daily Star https://www.dailystar.co.uk/news/latest-news/fears-thick-death-smog-over-21426098 …,2020-02-08 23:37:14
143,"One thing that should come out in all of this is that mainland #Chinese are incredibly selfish and irresponsible...
#WuhanCoronavirusOutbreak
#WuhanOutbreak
#coronavirus
https://www.smh.com.au/world/asia/from-happiest-ship-on-the-seas-to-total-lockdown-life-on-coronavirus-hit-ship-20200205-p53y4z.html …",2020-02-05 23:53:44
144,"#Coronavirus : deaths in Hubei province rise by 70 with 2,987 newly confirmed cases https://www.scmp.com/news/china/society/article/3049253/coronavirus-deaths-hubei-province-rise-70-2987-newly-confirmed …",2020-02-05 23:49:16
145,United Airlines suspends all flights to Hong Kong amid coronavirus outbreak | Fox News https://www.foxnews.com/travel/united-airlines-suspends-hong-kong-flights-coronavirus …,2020-02-05 23:42:29
146,"Coronavirus: China unlikely to defend falling yuan, despite US trade deal pressure, analysts say, reports ⁦@klky99⁩ #china #China #yuan #ChinaVirus #ChinaPneumonia #WuhanCoronavius #WuhanPneumonia #WuhanSARS #coronavirus #coronaviruschinahttps://www.scmp.com/economy/china-economy/article/3049209/coronavirus-china-unlikely-defend-falling-yuan-despite-us …",2020-02-05 23:42:05
147,An epidemic's silver lining: Very few children seem to be falling ill with the new coronavirus.  https://nyti.ms/2GZJFqW ,2020-02-05 23:37:12
148,"China’s National Health Commission said Monday the number of confirmed cases of the coronavirus hit 40,171 by the end of February 9 and the death toll had risen to 908.",2020-02-09 23:54:37
149,"Finally got around to watching this: @hasanminhaj on #leanwashing and How America Is Causing Global #Obesity https://youtu.be/kmo6lZcdkO0  : Brutally accurate, hysterically funny, and devastatingly scary. Must-watch.

... back to worrying about more tractable things like #coronavirus",2020-02-09 23:49:46
150,China’s health officials say priority is to stop mild coronavirus cases from getting worse https://www.scmp.com/news/china/society/article/3048993/chinese-officials-say-priority-stop-mild-coronavirus-cases …,2020-02-04 23:59:24
151,"“Diseases don’t discriminate along racial lines—but too often people do.”

⁦@reappropriate⁩ writes about the racialization of the #coronavirus, how we’re bracing for anti-Asian #racism reminiscent of what happened during the 2003 #SARS outbreak.https://www.washingtonpost.com/outlook/2020/02/04/2003-sars-outbreak-fueled-anti-asian-racism-this-pandemic-doesnt-have/ …",2020-02-04 23:57:39
152,"The coronavirus outbreak could lead to an uptick in China bond defaults in 2020. Credit spreads are creeping up.

https://www.bloomberg.com/news/articles/2020-02-04/china-s-epidemic-threatens-a-broader-wave-of-defaults-in-2020 … by @RChoongWilkinspic.twitter.com/0i3ouGacfx",2020-02-04 23:55:16
153,"I joined Al Jazeera's ""The Listening Post"" to discuss China's coverage and censorship of the coronavirus outbreak. Also on the programme were @roseluqiu (who covered the 2003 SARS outbreak), @HuilingDing, & @Katmyu.https://twitter.com/AJENews/status/1223711463304585216 …",2020-02-01 23:53:07
154,"#China’s National Health Commission #coronavirus official update on Sunday am - 13,801 confirmed Mainland cases & 304 deaths. 1,921 newly confirmed cases in #Hubei. The epidemic has spread to at least 26 other countries or territories, with 171 cases reported.
#WuhanVirus",2020-02-01 23:49:42
155,"Carrie Lam uses thousands of excuses to delay the closure of border to block influx of people of any nationality (possible #coronavirus infeced cases) from #China. Yet from medics to businesses we all know it’s a sensible way. If gov don’t act, we need to save ourselves.",2020-02-02 23:51:21
156,PBoC will pump 1.2 trillion yuan (US$174 billion) into financial markets on 3 Feb 2020 as part of an effort by regulators to mitigate volatility when trading opens against the backdrop of a new coronavirus outbreak. Login Finance Mandarin to study. https://lnkd.in/fH9Zh_3 ,2020-02-02 23:50:18
157,"Coronavirus news and live updates: First death confirmed outside mainland China - CNN
https://cnn.it/2OlyIEl .      Countries are now sending planes to evacuate their citizens from the infection  EXCEPT HK GOVT",2020-02-02 23:49:51
158,"Oil prices slump as coronavirus outbreak hits demand - New Zealand Herald
https://www.nzherald.co.nz/business/news/article.cfm?c_id=3&objectid=12305452 …",2020-02-02 23:26:02
159,BBC News - Coronavirus: British Chinese people reveal prejudice amid outbreak https://www.bbc.com/news/uk-51348593 …,2020-02-06 23:56:47
160,"Coronavirus could provide silver lining for Australian daigou retailers looking to tap China market, reports ⁦@SuLin_Tan⁩ #Australia #china #China #WuhanVirus #wuhanconoravirus #ChinaVirus #ChinaWuHan #CoronaOutbreak #virus #wuhan #Wuhanhttps://www.scmp.com/economy/article/3049332/coronavirus-could-provide-silver-lining-australian-daigou-retailers-looking …",2020-02-06 23:49:51
161,"A complex from CN nationalists to justify excluding #taiwan from combating #coronavirus cause TW is ""too weak"". 

You got a virus from China and she blames you for being ""too weak"" to get any info abt it from a supposedly international org. Ridiculously disgusting. pic.twitter.com/rmPrPW35et",2020-02-06 23:41:43
162,Empty promises & empty words won’t kill #coronavirus. And also false hope to those in need there...,2020-02-03 23:56:27
163,It could have been contained. Wuhan virus: Beijing's old habits kept world in dark as an epidemic grew #coronavirus https://www.straitstimes.com/asia/east-asia/wuhan-virus-beijings-old-habits-kept-world-in-dark-as-an-epidemic-grew?xtor=CS3-18&utm_source=STiPhone&utm_medium=share&utm_term=2020-02-04%207%3A02%3A42 …,2020-02-03 23:49:51
164,Coronavirus death toll in China hits 425 as cases jump by thousands https://www.scmp.com/news/china/society/article/3048815/coronavirus-china-death-toll-hits-425-new-cases-hubei-jump?utm_content=article&utm_medium=Social&utm_source=Twitter#Echobox=1580773046 … #coronavirus,2020-02-03 23:37:26
165,"Coronavirus: Landlords who evict tenants on home quarantine, leave of absence or based on nationality may be barred from renting out flats  https://www.straitstimes.com/singapore/coronavirus-landlords-who-evict-tenants-on-home-quarantine-leave-of-absence-or-based-on?xtor=CS3-18&utm_source=STiPhone&utm_medium=share&utm_term=2020-02-04%207%3A02%3A46 …",2020-02-03 23:37:08
166,#Coronavirus death toll rises to 425 with 64 new fatalities in China's Hubei province  https://www.straitstimes.com/asia/east-asia/coronavirus-chinas-hubei-province-reports-64-new-deaths-more-than-2300-new-infections?xtor=CS3-18&utm_source=STiPhone&utm_medium=share&utm_term=2020-02-04%207%3A02%3A05 …,2020-02-03 23:35:27
167,Very few infants seem to be getting sick with the new coronavirus | Science News https://www.sciencenews.org/article/new-coronavirus-china-infections-very-few-infants-getting-sick/ … via @ScienceNews,2020-02-15 23:56:52
168,We discovered a coronavirus similar to the covid-19 virus 7 years ago | via ⁦⁦@newscientist⁩https://www.newscientist.com/article/mg24532693-700-we-discovered-a-coronavirus-similar-to-the-covid-19-virus-7-years-ago/ …,2020-02-15 23:53:09
169,"China’s Hubei province reports 139 new coronavirus deaths and 1,843 newly confirmed cases https://www.scmp.com/news/world/article/3050824/chinas-hubei-province-reports-139-new-coronavirus-deaths-and-1843-newly?utm_term=Autofeed&utm_medium=Social&utm_content=article&utm_source=Twitter#Echobox=1581810396 …",2020-02-15 23:48:31
170,"#Coronavirus: the cons of a non-cooperative world, and in particular strategic competition between #China and the #US are many but I never thought they would go all the way to sanitary concerns and even pandemics https://twitter.com/TangAnZhu/status/1228818771915132929 …",2020-02-15 23:43:21
171,"President Xi Jinping began fighting the coronavirus epidemic earlier than previously known, a newly published speech indicates, underscoring that he was concerned about the virus even while officials at its epicenter were downplaying its dangers https://nyti.ms/2vAWo0S ",2020-02-15 23:30:04
172,We pray for everyone at risk for coronavirus #PrayForChinapic.twitter.com/FyXkl1YwW0,2020-02-11 23:54:51
173,Coronavirus: Hong Kong restaurants install physical barriers between diners to allay contagion fears https://www.scmp.com/news/hong-kong/hong-kong-economy/article/3050085/coronavirus-hong-kong-restaurants-install-physical?utm_term=Autofeed&utm_medium=Social&utm_content=article&utm_source=Twitter#Echobox=1581463755 …,2020-02-11 23:45:27
174,Coronavirus: Hong Kong restaurants install physical barriers between diners to allay contagion fears https://www.scmp.com/news/hong-kong/hong-kong-economy/article/3050085/coronavirus-hong-kong-restaurants-install-physical?utm_term=Autofeed&utm_medium=Social&utm_source=Twitter#Echobox=1581463793 …,2020-02-11 23:29:53
175,"Concentration camps, coronavirus and then his arrival. Never expect someone will change and their dark sides will be shown when bad things come
https://twitter.com/FinancialTimes/status/1229873272738779136?s=19 …",2020-02-19 23:54:11
176,Coronavirus: massive HK$30 billion relief package revealed as Hong Kong government plans to bail out struggling industries and fund the fight against deadly bug - another waste of the Hong Kong taxpayers money by an incompetent government. https://www.scmp.com/news/hong-kong/politics/article/3051475/coronavirus-massive-hk30-billion-relief-package-revealed …,2020-02-19 23:48:05
177,"Coronavirus: Iranian state news agency says virus has killed 2 citizens, schools and universities closed for investigations https://www.scmp.com/news/world/middle-east/article/3051486/coronavirus-iranian-state-news-agency-says-virus-has-killed?utm_term=Autofeed&utm_medium=Social&utm_content=article&utm_source=Twitter#Echobox=1582149857 …",2020-02-19 23:43:40
178,"#Coronavirus: massive HK$30 billion relief package revealed as #HongKong government plans to bail out struggling industries and fund the fight against deadly bug
https://www.scmp.com/news/hong-kong/politics/article/3051475/coronavirus-massive-hk30-billion-relief-package-revealed …pic.twitter.com/QJEhXkuUPm",2020-02-19 23:31:40
179,"Coronavirus is testing the limits of China’s, and Hong Kong’s, preparedness https://www.scmp.com/comment/opinion/article/3048928/coronavirus-testing-limits-chinas-and-hong-kongs-preparedness … via @scmpnews @RSPeckham #coronavirus",2020-02-19 23:30:41
180,"I will be on #RTHKnews  in 8 minutes talking about #Hongkong and the impact of the #coronavirus. We had a new stimulus package announced of HDK25 billion, not even 1% of GDP at the worst of all times and still Finance Secretary Paul Chan warning us of a worrying deficit (1/2)",2020-02-16 23:55:36
181,"Coronavirus death toll rises to 1,770 as China reports 100 new fatalities https://www.scmp.com/news/china/society/article/3050893/coronavirus-death-toll-rises-1770-china-reports-100-new?utm_content=article&utm_medium=Social&utm_source=Twitter#Echobox=1581897066 …",2020-02-16 23:51:06
182,"Over the weekend, the propaganda machine changed the direction.  ""Go back to work"" is now the main message.  It's the economy, stupid.  I am afraid #coronavirus didn't get the message.  #COVID19",2020-02-16 23:47:25
183,"XJP knew about the #coronavirus in early Jan. 

“China is responsible for the failure on early control. There is nothing they can spin to change that fact....China failed to prevent it...To point fingers at others for being critical cannot change that.”  https://www.scmp.com/news/china/diplomacy/article/3050870/chinas-top-diplomats-ramp-defence-beijing-amid-coronavirus …",2020-02-16 23:47:07
184,Coronavirus chaos lays bare the price of uncertainty in a connected global economy https://www.scmp.com/comment/opinion/article/3050728/coronavirus-chaos-lays-bare-price-uncertainty-connected-global?utm_term=Autofeed&utm_medium=Social&utm_content=article&utm_source=Twitter#Echobox=1581875091 …,2020-02-16 23:41:12
185,"The 3 day decline in new #coronavirus cases in #China has come to an end after #Hubei province reported 1,933 new cases, slightly higher than a day earlier & 100 additional deaths taking the total fatalities to at least 1,765. Globally, the number of cases is approaching 70,000.",2020-02-16 23:35:09
186,"Wow. Hubei province is reporting 14,840 new coronavirus cases, and 242 new deaths. Stock index futures dumping in Asian trading.",2020-02-12 23:58:37
187,The world’s biggest phone show #MWC2020 has been canceled due to #coronavirus concerns  https://www.theverge.com/2020/2/12/21127754/mwc-2020-canceled-coronavirus-trade-show-phone-mobile-world-congress-gsma-statement … via @Verge,2020-02-12 23:58:15
188,"World’s biggest mobile trade show cancelled over coronavirus crisis

https://www.scmp.com/tech/big-tech/article/3050343/mwc-barcelona-worlds-biggest-mobile-trade-show-cancelled-firms …",2020-02-12 23:50:45
189,"How Much Will Coronavirus Hurt China's Economy?

 http://bit.ly/2SaRwZq pic.twitter.com/k2ogaopj6c",2020-02-12 23:46:40
190,"S&P says coronavirus outbreak will cut 0.5% from Australia's real GDP growth in 2020 - ForexLive
https://www.forexlive.com/news/!/sp-says-coronavirus-outbreak-will-cut-05-from-australias-real-gdp-growth-in2020-20200212 …",2020-02-12 23:36:03
191,"Beyond the Coronavirus Crisis: Prepare Now

 http://bit.ly/2OK1bnp pic.twitter.com/NfHXGMPoqV",2020-02-12 23:30:52
192,Coronavirus denier. Or false positive. Or just asymptomatic. https://twitter.com/standardnews/status/1229673847126941697 …,2020-02-18 23:53:18
193,8mos on & we’re still requesting #5DemandsNot1Less! #Coronavirus may halt street protests but Hong Kong’s institutional problem won’t just vanish without proper political solutions. Please continue to #StandwithHongKong!pic.twitter.com/MyjMFqbaBF,2020-02-18 23:53:06
194,"Coronavirus cases on Diamond Princess soar past 500, site of most infections outside China https://www.usatoday.com/story/travel/cruises/2020/02/18/coronavirus-jose-andres-provides-meals-diamond-princess-passengers/4788804002/ … via @usatoday",2020-02-18 23:47:41
195,Coronavirus: Xi Jinping calls for overhaul of China’s health crisis response system https://www.scmp.com/news/china/society/article/3050754/xi-jinping-calls-overhaul-chinas-health-crisis-response-system …,2020-02-14 23:40:40
196,Coronavirus: Restaurant group temporarily closes hotpot chains as Hongkongers grow wary of communal dining experience https://www.scmp.com/news/hong-kong/hong-kong-economy/article/3050551/coronavirus-restaurant-group-temporarily-closes?utm_term=Autofeed&utm_medium=Social&utm_content=article&utm_source=Twitter#Echobox=1581636596 …,2020-02-13 23:39:48
197,Coronavirus: Restaurant group temporarily closes hotpot chains as Hongkongers grow wary of communal dining experience https://www.scmp.com/news/hong-kong/hong-kong-economy/article/3050551/coronavirus-restaurant-group-temporarily-closes?utm_term=Autofeed&utm_medium=Social&utm_source=Twitter#Echobox=1581636646 …,2020-02-13 23:30:46
198,"HAND SANITIZER 400ML BOTTLE | LIMITED STOCK

 With the #coronavirus continue to be a concern, hand sanitizers have constantly been difficult to buy. Muslim Council of Hong Kong has managed to buy 12 bottles and are at the centre ready to be distributed to those in need. pic.twitter.com/e9ocj6iqpd",2020-02-17 23:59:07
199,"So #Xi has kept his people in the dark for a critical two weeks, and WHO Director praised #China for transparency in handling #coronavirus? No way! They’re both responsible for the epidemic! pic.twitter.com/n3r10tBJcF",2020-02-17 23:42:38
200,"China stifles foreign internet to control coronavirus coverage, @FT reportshttps://buff.ly/2wrwptl ",2020-02-17 23:40:00
