,Tweets,Date
0,"""The two people we lost to the coronavirus were most likely exposed to the virus at work before the factory shut down,"" writes Carmen Dominguez ",2020-04-29 23:53:12+00:00
1,Coronavirus: ‘China is not the enemy of the United States' - BBC News ,2020-04-29 23:21:24+00:00
2,"Adding to evidence that the novel coronavirus can spread through the air, Chinese scientists reported detection of the virus in Wuhan hospitals. hospitals ",2020-04-29 23:16:03+00:00
3,Coronavirus: Warning as major study claims most elderly victims 'would not have died otherwise' | UK News | Sky News ,2020-04-29 22:57:44+00:00
4,"Countries must think globally when the world faces an infectious disease. An outbreak anywhere is a risk everywhere. We need to act now to ensure that everyone who needs the coronavirus vaccine when it becomes available gets it, writes Seth Berkley. ",2020-04-29 22:57:06+00:00
5,"With many things to remember, take a moment and recall that those suffering coronavirus symptoms are especially careful with making sure your fridge is clean. Find out more at .@CDCgov",2020-04-29 22:48:25+00:00
6,The Philippine peso hasn't weakened in the face of the coronavirus — and that's posing a risk to the country's economy https://www.bloomberg.com/news/articles/2020-04-29/philippine-peso-remains-resilient-when-economy-needs-it-weak?sref=aXnEdUEz via @markets,2020-04-29 22:45:22+00:00
7,"""The coronavirus is not unlike the Y2K bug—a real but invisible risk ... I cannot read about the losses that never occurred, because they were averted."" ",2020-04-29 22:37:02+00:00
8,".@NickKristof visited the Navajo Nation, which has had more people infected by the coronavirus per capita than any state. 40% of homes don't have running water, making it difficult to wash hands. https://nyti.ms/2TTld1o",2020-05-30 23:12:08+00:00
9,"https://youtu.be/WHsGO8a8WOE This is disgusting. They go everywhere, blaming ppl of racism whenever they don’t get what they want. Even “Wuhan Coronavirus” can “hurt their feelings” and need to be changed to “COVID-19. &amp; see how they treat black ppl. #DNSL #China #Racism #CCPVirus",2020-05-30 22:56:51+00:00
10,"Officials in Latin America began the year worried about an ongoing and deadly dengue epidemic that had put incredible stress on public health systems. And then along came the coronavirus, making matters even worse. ",2020-05-30 22:07:17+00:00
11,"The coronavirus has slammed into Yemen, a country already staggering from war, a health care system in ruins, widespread hunger and outbreaks of cholera and other infectious diseases. ",2020-05-30 21:00:15+00:00
12,"Hong Kong universities suspend classes until March as China coronavirus fears grow, while education chiefs discuss extending closure of city’s schools | South China Morning Post ",2020-01-30 23:59:15+00:00
13,"@sambad_odisha Hi Sambad,Your figures for Corona Virus is misleading. Here are the correct information. You published affected people as dead in HongKong, Maccau. Please follow http://SCMP.com thanks",2020-01-30 23:58:28+00:00
14,That time was days ago. #kowtow #China #inaction #CoronavirusOutbreak #coronavirus ,2020-01-30 23:57:09+00:00
15,#China #coronavirus: deadly day in Hubei as a record high 42 patients die #WuhanCoronavirus,2020-01-30 23:36:13+00:00
16,"#China #coronavirus : Global health emergency declared by #WorldHealthOrganisation, reversing earlier decision on #outbreak",2020-01-30 23:35:25+00:00
17,BBC News - #Coronavirus declared global health emergency by WHO https://www.bbc.com/news/world-51318246,2020-01-30 23:30:44+00:00
18,BBC News - #Coronavirus declared global health emergency by WHO ,2020-01-30 23:29:41+00:00
19,Corona virus has been around a lot longer than you guys think,2020-01-30 23:18:11+00:00
20,China coronavirus: deadly day in Hubei as a record-high 42 patients die ,2020-01-30 23:15:03+00:00
21,"I had a group of mindless teenagers shout ""coronavirus"" at me on the bus. If you don't think that's racist, you are part of the problem #IamNotAVirus",2020-01-30 23:07:50+00:00
22,Thousands of passengers on an Italian cruise ship were being blocked from disembarking over fears that a passenger might have contracted the new coronavirus ,2020-01-30 22:44:03+00:00
23,"After weeks of delay, @WHO today declared #coronavirus outbreak a “public health emergency of Int’l concern.” But it was quick to warn world governments against imposing travel restrictions on China and praise China’s handling of the outbreak as “impressive.” Beijing’s long arm? ",2020-01-30 22:33:25+00:00
24,"One week into a lockdown in the center of the coronavirus outbreak in China, a shortage of hospital beds, medical supplies and doctors boiled over into physical confrontations and desperate pleas for help ",2020-01-30 21:46:03+00:00
25,Surgical Masks Sold Out Across UK Amidst Coronavirus Fears – Summit News ,2020-01-30 21:32:29+00:00
26,"Yes, #HumanTrafficking is a crime, even when it's your own government trafficking you. #forcedlabor #Uyghurs #CoronavirusOutbreak #COVID19 #Covid_19 #Zhejiang #Jiangsu #SaveUyghurs #UyghurGenocide #Uyghur @Olympics #Xinjiang #trafficking #StopBeijing2022",2020-02-28 20:43:23+00:00
27,"WHO has raised the risk assessment of #Covid19 from ""high"" to “very high” across the world. Belarus, Azerbaijan, San Marino, Nigeria, New Zealand are among the latest countries to report first cases. Virus has spread to 61 countries from 50 yesterday #武汉肺炎 #coronavirus https://twitter.com/JackKSoh/status/1233368671575138304",2020-02-28 17:26:46+00:00
28,"After 2,337 #coronavirus cases &amp; 16 death, 58 countries restrict entry from South Korea, of which 27 have entry bans on South Koreans and foreigners who have visited SK. The costs of Prez Moon's mistake continue to rise #covid19 #武汉肺炎",2020-02-28 16:25:37+00:00
29,Chinese government reprimanded Dr. Li Wenliang for prematurely talking about corona virus = EVIL OPPRESSION US government bans doctors from talking freely about #COVID19 = EFFECTIVE MANAGEMENT #UShypocrisy #DoubleStandards,2020-02-28 15:39:37+00:00
30,Indonesian Health Ministry says the Japanese tourist who got infected with #COVID19 only stayed at his hotel in Bali so they will observe the hotel &amp; the staff – but the government won't shut down the hotel. No mention about quarantine measures ,2020-02-28 15:33:36+00:00
31,We’re all fighting a virus not people . The western press should not be too critical and negative of China at the moment. This is fuelling a lot of resentment and racism towards chinese people...... doesnt help when the common enemy is COVID19.,2020-02-28 15:02:52+00:00
32,.#Coronavirus: A new cluster &amp; 2 new cases confirmed in Singapore. 98 in total. Infections still continue despite aggressive control measures. Curious how so many large provinces in China can have zero new cases for so many days now.. #covid19 #武汉肺炎 https://str.sg/JNWm,2020-02-28 12:29:40+00:00
33,Coronavirus: Hong Kong gov’t publishes list of buildings detailing self-quarantine occupants following online leak https://www.hongkongfp.com/2020/02/28/coronavirus-hong-kong-govt-publishes-list-buildings-detailing-self-quarantine-occupants-following-online-leak #HongKong #China #coronavirus #ChinaCoronaVirus #CoronavirusOutbreak #Covid19@chingrachelwong,2020-02-28 12:20:32+00:00
34,Seriously it’s not about discrimination ! Don’t have to divert in that way ! It’s about #WuhanVirus and world health issue ! #COVID19 #CoronavirusOutbreak #ChinaCoronaVirus,2020-02-28 12:08:22+00:00
35,"[Recap] Virus game Plague Inc. app pulled in China over ‘illegal’ content, developer says https://www.hongkongfp.com/2020/02/28/virus-game-plague-inc-app-pulled-china-illegal-content-developer-says #China #coronavirus #ChinaCoronaVirus #CoronavirusOutbreak #Covid19 ",2020-02-28 12:00:48+00:00
36,[Recap] Beijing ramps up crowd control measures over coronavirus fears https://www.hongkongfp.com/2020/02/28/beijing-ramps-crowd-control-measures-coronavirus-fears #beijing #China #coronavirus #ChinaCoronaVirus #CoronavirusOutbreak #Covid19 ,2020-02-28 11:50:16+00:00
37,"""I should warn the rest of the world that you guys should take care"" Dr Xie Jiang has been fighting the coronavirus in #Hubei province, China where the outbreak began #coronavirus #COVID2019 #COVID19 http://bbc.in/32E3z4P",2020-02-28 11:09:45+00:00
38,How powerful can a simple contagion can be when it is overlaid on a network built for complex (and also secretive) contagion. #COVID19 2019 coronavirus: The #Korean clusters,2020-02-28 10:36:48+00:00
39,Beijing ramps up crowd control measures over coronavirus fears https://www.hongkongfp.com/2020/02/28/beijing-ramps-crowd-control-measures-coronavirus-fears #beijing #China #coronavirus #ChinaCoronaVirus #CoronavirusOutbreak #Covid19,2020-02-28 10:36:42+00:00
40,"5th Jan Wuhan official report

1. 59 cases, 7 of them are severe, no ones are killed by the pneumonia.

2. SARS and MERS are now ruled out, not yet for novel #coronavirus.

3. No obvious #h2h evidence.pic.twitter.com/ZNGf8LICSh",2020-01-05 12:58:55
41,"The latest pneumonia outbreak in #Wuhan might be caused by a new type of coronavirus which can be transferred from animal to human and is not exactly the same as SARS.

#HKGov will announce strengthened prevention measure later today.

Source: Apple Dailyhttps://hk.news.appledaily.com/local/realtime/article/20200103/60448286 …",2020-01-03 16:27:49
42,"Sen Seidman, the authority has confirmed that the infection is caused by a new breed of coronavirus related to SARS. The Chinese government, along with its puppet regime in #HongKong, doesn't acknowledge the seriousness. Everyone should stay alert.https://edition.cnn.com/2020/01/08/health/china-wuhan-pneumonia-virus-intl-hnk/index.html …",2020-01-09 20:48:58
43,"How do I interpret figures from the Chinese Communist Party?
Good news: Divide the numbers by 10
Bad news: Multiply the numbers by 10

The situation is indeed worrying, esp when the authority has confirmed that it is a new breed of coronavirus...",2020-01-09 19:27:57
44,"#China’s Wuhan pneumonia outbreak: Mystery illness 'caused by coronavirus'. #WHO representative to China said, further investigations are needed, to determine source & mode of transmission. 
 https://www.bbc.co.uk/news/world-asia-china-51047576 …",2020-01-09 15:51:38
45,Wuhan pneumonia outbreak may be linked to new coronavirus: WHO https://ift.tt/2QVDQzs  #EJI,2020-01-09 08:03:03
46,Are we still talking about a mask ban now that there's a new coronavirus outbreak? https://twitter.com/rthk_enews/status/1215164743696015360 …,2020-01-09 07:04:37
47,"""The virus is part of the family strain of the severe acute respiratory syndrome, or SARS, coronavirus that killed hundreds in Asia and elsewhere in 2003,"" writes CK Tan of @NAR #China #Wuhan #WuhanSARS #SARShttps://s.nikkei.com/37MT3cN ",2020-01-09 06:46:19
48,New strain of coronavirus from the same family as Sars identified as the cause of #Wuhan #pnuemonia. The seafood market linked to the disease also sold game meat.https://www.scmp.com/news/china/society/article/3045288/china-confirms-new-coronavirus-it-investigates-mystery-wuhan …,2020-01-09 06:42:44
49,"Still remember the SARS epidemic in 2003? Experts in China determine the #Wuhan #pneumonia is caused by a new type of coronavirus.

Hong Kong health chief didn’t advise citizens to wear mask as a precaution. The govt is seeking to revive the mask ban instead.

#ChinesePneumonia",2020-01-09 04:34:33
50,Chinese state-run media CCTV said that a laboratory has confirmed the mysterious #ChinesePneumonia found in #Wuhan is a new type of coronavirus. https://twitter.com/DrKwanEC/status/1215075031329325056 …,2020-01-09 04:07:46
51,China confirms new coronavirus as it investigates mystery Wuhan illness https://sc.mp/cyjnu ,2020-01-09 03:29:14
52,Mainland media say preliminary lab results show the Wuhan pneumonia outbreak is being caused by a new type of coronavirus. #HongKonghttps://news.rthk.hk/rthk/en/component/k2/1501807-20200109.htm …,2020-01-09 02:54:18
53,China confirms new coronavirus as it investigates mystery Wuhan illness https://www.scmp.com/news/china/society/article/3045288/china-confirms-new-coronavirus-it-investigates-mystery-wuhan?utm_content=article&utm_medium=Social&utm_source=Twitter#Echobox=1578538388 …,2020-01-09 02:53:08
54,"An alarming pneumonia outbreak in central China may be due to a previously unidentified coronavirus, according to the WHO https://www.bloomberg.com/news/articles/2020-01-08/china-s-mystery-pneumonia-illness-may-be-linked-to-new-virus … via @business",2020-01-09 01:48:10
55,"“@Baric_Lab , a coronavirus expert at the University of North Caroline. “Otherwise you’re just doing screening for fever — in the middle of respiratory disease season? Financial nightmare.”

#hongkong taxpayers’ feeling...https://twitter.com/HelenBranswell/status/1215024509205569536 …",2020-01-09 01:20:56
56,"Wuhan report 12/1

No new cases up to 11/1.
no new death case.

41 cases
Severe case:7
Discharged:6
Dead case:1
Stable for the remaining.

717 close contact under monitoring and no cases so far

#wuhanpneumonia #coronavirus pic.twitter.com/6q93yEOnlX",2020-01-12 13:29:30
57,"First fatality due to new strain of pneumonia reported. Unofficial expert analysis in Mainland China revealed a Sars-like coronavirus, with 80% similarity to 2003 global epidemic.#HK officials confirmed that all people tested for infection locally so far do not carry the virus.pic.twitter.com/n3u6LctCFE",2020-01-12 08:10:42
58,"wake up again at 8ish on sunday...okay, less hectic so far. it’s just too crazy for that tsunami of news yesterday #2019-nCoV #coronavirus #WuhanPneumoniahttps://twitter.com/hayesluk/status/1215792271611830273 …",2020-01-12 01:44:53
59,"Limited human-to-human transmission of the novel coronavirus in #Wuhan cannot be ruled out, Under Secretary for Food & Health Dr Chui Tak-yi says http://www.news.gov.hk/eng/2020/01/20200115/20200115_154354_605.html …pic.twitter.com/chaeZ2V8Qr",2020-01-15 14:02:09
60,#HK health officials say it’a ‘possible’ a new #coronavirus causing a #pneumonia outbreak in #Wuhan can be transmitted between humans - although there’s no “definite evidence” showing so. They’re speaking after meeting national health officials in Wuhan over the issue.pic.twitter.com/lbgR7d6nhn,2020-01-15 07:29:39
61,China says human transmission not ruled out in Wuhan coronavirus outbreak https://www.scmp.com/news/china/society/article/3046173/china-says-human-transmission-not-ruled-out-wuhan-coronavirus?utm_term=Autofeed&utm_medium=Social&utm_content=article&utm_source=Twitter#Echobox=1579072452 …,2020-01-15 07:14:13
62,"//GENEVA (Reuters) - There may have been limited human-to-human transmission of a new coronavirus in China within families, and it is possible there could be a wider outbreak, the World Health Organization (WHO) said on Tuesday.// 
Stay alert everyone! https://www.facebook.com/715081028611249/posts/2676356252483707/?d=n …",2020-01-14 16:57:47
63,"@WHO has confirmed the newly identified SARS-like Wuhan coronavirus is attributed to
 ‘LIMITED ’ human-to-human transmission.

Breaking the chain of infection could prevent us from being infected.
However, some of the components are still remain unknown. 

#WuhanPneumonia
pic.twitter.com/zKmSA3UPpE",2020-01-14 11:44:04
64,"New China virus: GENEVA, Jan 14 (Reuters) – There has been “limited”human-to-human transmission of a new coronavirus that has struck in China, mainly small clusters in families, but there is potential for wider spread, said World Health Org.",2020-01-14 10:37:09
65,A female tourist from the central Chinese city of Wuhan has been confirmed as the first person in Thailand infected with new strain of virus from same family as SARS and MERS according to China State Media #coronavirus,2020-01-14 06:00:06
66,Professor Yuen Kwok-yung from #HKU says the genetic makeup of the novel coronavirus was “80 per cent similar” to severe acute respiratory syndrome (Sars) that created ahavoc in #HongKong in 2003https://news.rthk.hk/rthk/en/component/k2/1502243-20200111.htm …,2020-01-11 07:45:49
67,"According to Professor Yuen Kwok-Yung, who contributed greatly to tackling SARS in 2003, the new coronavirus causing deadly pneumonia in #Wuhan has a similar viral sequence to SARS. We must maintain personal hygiene, and govts should learn from 2003.https://twitter.com/DrKwanEC/status/1215883289669427200?s=19 …",2020-01-11 07:40:15
68,"Death Toll: 1
The Wuhan Pneumonia 
First case of death due to this new Coronavirus!
Masks on people, your life is more important than the stupid anti-mask law! 
#WuhanPneumonia #deathtoll #antimasklaw #infection @SolomonYue @ptsdawarenesshk #cdc #HKPoliceTerrorismpic.twitter.com/6QGxgkZVb4",2020-01-11 03:53:07
69,"It’s actually the latest statement from #Wuhan officials so the cases are in Wuhan. 

‘Nucleic acid detection has been done towards the current patient. Based on clinical symptom, epidemiological history and laboratory data, 41 #coronavirus associated cases have been deduced.",2020-01-11 00:58:55
70,"#BREAKING: The new mystery coronavirus in the #WuhanPneumonia outbreak has already resulted in the first recorded death, say @now_News as well as other Hong Kong media outlets.pic.twitter.com/n8QlHWVCvw",2020-01-11 00:17:02
71,"Breaking!

1. One associated death case is reported.

2. 41 patient were associated with the #coronavirus
@appledaily_hk @CCTVhttps://hk.news.appledaily.com/china/realtime/article/20200111/60472907?utm_campaign=hkad_social_hk.nextmedia&utm_medium=social&utm_source=facebook&utm_content=link_post …",2020-01-11 00:07:16
72,"Padma, yes. Coronavirus outbreak in China. Both Thailand and Japan has 1 confirmed case.",2020-01-16 23:27:11
73,"Japan reported its first case of a new coronavirus that has sickened 41 people in China, adding to concerns about the spread of the virus outside Chinese borders ahead of a major holiday https://nyti.ms/2NySN9L ",2020-01-16 21:28:06
74,"Two Chinese visitors from Wuhan city have been put in isolation by Vietnam’s Ministry of Health and are under observation for the new coronavirus after landing at Danang International Airport on today, according to Hongkong yahoo news.
Keeping busy!
https://hk.mobi.yahoo.com/home/%E8%B6%8A%E5%8D%97%E5%B3%B4%E6%B8%AF%E6%9C%89-2-%E5%AE%97%E6%AD%A6%E6%BC%A2%E8%82%BA%E7%82%8E%E7%96%91%E4%BC%BC%E5%80%8B%E6%A1%88-%E6%82%A3%E8%80%85%E4%BE%86%E8%87%AA%E6%AD%A6%E6%BC%A2-052813123.html …",2020-01-16 20:39:23
75,second dead case. #coronavirus #WuhanPneumonia #ncovhttps://twitter.com/globaltimesnews/status/1217842925658243073 …,2020-01-16 16:20:18
76,"Japan reported its first case of a new coronavirus that has sickened dozens of people in China, intensifying concerns about the spread of the virus beyond China's borders ahead of a major holiday https://nyti.ms/36ZppBj ",2020-01-16 13:36:03
77,@WHO Reuters first reported there's possibility of limited human to human transmission which WHO then denied. The following day China said there is such a possibility. The other day Thailand confirmed its first Wuhan pneumonia-causing novel coronavirus and now Japan. what gives?,2020-01-16 10:02:46
78,"Japan reported its first case of a new coronavirus found in China on Thursday, intensifying concerns about the spread of the virus ahead of a major Chinese holiday. https://nyti.ms/2NwxTrU ",2020-01-16 07:47:54
79,"It's impossible there is no other cases outside Wuhan province in China, is it? #wuhanpneumonia #coronavirus #infectiousdiseases #hygienehttps://twitter.com/WBYeats1865/status/1217639519488339968 …",2020-01-16 05:26:17
80,"Japan reported its first case of a new coronavirus found in China on Thursday, intensifying concerns about the spread of the virus ahead of a major Chinese holiday. https://nyti.ms/2TsTcOX ",2020-01-16 04:15:04
81,"NHK: Japan confirms 1st case of new coronavirus. 
Ministry officials say the man in his 30s, who lives in Kanagawa Prefecture, near Tokyo, developed a fever in Wuhan on January 3.",2020-01-16 03:33:39
82,Wuhan pneumonia: Japan confirms first case of new China coronavirus infection | South China Morning Post https://www.scmp.com/news/asia/east-asia/article/3046301/wuhan-pneumonia-japan-confirms-first-case-new-china-coronavirus …,2020-01-16 02:02:53
83,Wuhan pneumonia: Japan confirms first case of new China coronavirus infection https://www.scmp.com/news/asia/east-asia/article/3046301/wuhan-pneumonia-japan-confirms-first-case-new-china-coronavirus?utm_content=article&utm_medium=Social&utm_source=Twitter#Echobox=1579139462 …,2020-01-16 01:51:02
84,"Confirmed case of wuhan atypical pneumonia caused by coronavirus in Thailand and Japan. I don’t believe that there is no outbreak in China, and I don’t believed that it is currently limited to wuhan. What we can do is personal hygiene ",2020-01-16 01:50:45
85,"one confirmed case in #shenzhen

66yo M

3rd Jan fever
18th confirmed eventually...

#coronavirus #nCoV2019pic.twitter.com/bGXdEoYdl4",2020-01-19 19:24:28
86,"59 new cases on 18th
77 new cases on 19th
1 new dead case

66 male 70 female

25 yo to 89 yo

onset before 18th jan

total case :198
thats a #h2h community outbreak i guess
 #coronavirus pic.twitter.com/wKrYx6HeBJ",2020-01-19 18:58:31
87,"China coronavirus: Beijing breaks its silence, but only to ‘deny rumours’ https://www.scmp.com/news/china/society/article/3046732/china-coronavirus-beijing-breaks-its-silence-only-deny-rumours?utm_content=article&utm_medium=Social&utm_source=Twitter#Echobox=1579428236 …",2020-01-19 10:03:56
88,"@MRC_Outbreak estimates ""a total of 1,723 cases of 2019-nCoV in Wuhan had onset of symptoms by 12/01/2020 [...]It is likely that the novel coronavirus has caused substantially more cases of moderate or severe respiratory illness than currently reported"" https://www.imperial.ac.uk/mrc-global-infectious-disease-analysis/news--wuhan-coronavirus/ …",2020-01-19 05:46:50
89,"In Hong Kong, #coronavirus cases are popping up every day, while the first case has been reported in a country as far as Japan. #China is obviously covering up the severity of the infection. The world must be aware of its lies, SARS was covered-up in 2003 and it took 300 HK lives",2020-01-19 03:43:55
90,"China is reporting 17 new cases infected with the novel coronavirus, including 3 in serious conditions. An optimized test has been used to identify the cases. #WuhanPneumoniapic.twitter.com/CSsPqDuV0T",2020-01-18 18:33:30
91,CHP provides latest information on pneumonia cases of novel coronavirus infection in Wuhan http://zpr.io/th8Kr ,2020-01-18 11:34:19
92,"China coronavirus: four new cases confirmed in Wuhan, but study says 1,723 people may have symptoms https://www.scmp.com/news/china/society/article/3046665/china-coronavirus-four-new-cases-confirmed-wuhan-study-says-1723?utm_term=Autofeed&utm_medium=Social&utm_content=article&utm_source=Twitter#Echobox=1579330048 …",2020-01-18 11:16:59
93,"7 more patients admitted into public hospitals for novel coronavirus infection, 11 still under isolation http://zpr.io/th8Mp ",2020-01-18 11:12:04
94,"Seems that cover up is likely... Shenzhen & Shanghai appear to have it, but govt is refusing to comment. China coronavirus: at least three suspected cases in Shenzhen, Shanghai

https://www.scmp.com/news/china/society/article/3046681/china-coronavirus-least-three-suspected-cases-found-shenzhen …",2020-01-18 10:35:01
95,Scientists in Britain said on Friday that the number of people infected by the new coronavirus – which has similarities with the disease that sparked a global outbreak of severe acute respiratory syndrome (Sars) in 2002 – was likely hundreds more than o... https://www.scmp.com/week-asia/health-environment/article/3046660/wuhan-virus-thailand-hold-lunar-new-year-parties?utm_content=article&utm_medium=Social&utm_source=Twitter#Echobox=1579324904 …,2020-01-18 05:21:44
96,"Research team from Imperial College London estimates a total of 1,723 cases had the onset symptoms of Coronavirus  in Wuhan http://zpr.io/thbhV ",2020-01-18 03:04:31
97,"My take: China should have more stringent fever screening checks at all their airports and ports,esp out out of Wuhan.
Public Health Screening to Begin at 3 U.S. Airports for 2019 Novel Coronavirus (“2019-nCoV”) | CDC Online Newsroom | CDC https://www.cdc.gov/media/releases/2020/p0117-coronavirus-screening.html … via @CDCgov",2020-01-17 23:54:56
98,Three U.S. Airports to Check Passengers for a Deadly Chinese Coronavirus - The New York Times https://www.nytimes.com/2020/01/17/health/china-coronavirus-airport-screening.html …,2020-01-17 23:51:07
99,"Would anyone believe that only Wuhan &HK have outbreaks of the Coronavirus in China ?
Japan and Thailand Confirm New Outbreaks of the Coronavirus https://nyti.ms/388fWrq  @nytimes @AP @washingtonpost @Reuters @washingtonpost",2020-01-17 09:39:03
100,"2nd death in #China. The #SARS like coronavirus outbreak has killed 2 in Wuhan. 

It has spread to Thailand, Japan, #HongKong in just weeks. 

With the Chinese New Year coming up, the no. of cases would rise further.https://www.theguardian.com/world/2020/jan/17/corona-second-death-in-china-after-sars-like-outbreak?CMP=Share_iOSApp_Other …",2020-01-17 05:39:41
101,China reports second death from Wuhan coronavirus https://www.scmp.com/news/china/society/article/3046501/china-reports-second-death-wuhan-coronavirus?utm_content=article&utm_medium=Social&utm_source=Twitter#Echobox=1579236682 …,2020-01-17 04:51:22
102,"An editorial on the Wuhan novel coronavirus outbreak by David Hui @CUHKMedicine and expert panel on (re)-emerging pathogens. #WuhanPneumonia
https://www.sciencedirect.com/science/article/pii/S1201971220300114 …pic.twitter.com/CJKjxXzRMO",2020-01-17 01:13:13
