,Tweets,Date
0,Microsoft sales rise as remote working lifts cloud services during coronavirus crisis https://thedevtalk.com/article/id/63d4010a705d3e14df7d6a510875b118,2020-04-29 23:56:15+00:00
1,Dr. Fauci Backed Controversial Wuhan Lab with Millions of U.S. Dollars for Risky Coronavirus Research ,2020-04-29 23:56:15+00:00
2,Okay I’ll start. What has the corona virus epidemic taught me. 1. That no one is invincible. 2. You have to know how to survive. #vettegreen #thisiscrazy #itstime,2020-04-29 23:28:51+00:00
3,"hey i was just wondering if you c TERROR IN THIS SOUTH FLORDIA COMMUNITY AS CORONAVIRUS SWEEPS THROUGH and i needed this report upd OF THE MORE THAN 30,000 RESIDENTS WHO CALL THIS RETIREMENT COMMUNITY HOME i was having trouble logging into the site and IS A LOCAL WOMAN WHO LOST H",2020-04-29 23:23:13+00:00
4,"NYPD to Step Up Coronavirus Enforcement After Funeral Flouts Rules New York City police will no longer issue warnings to people who violate social-distancing rules designed to fight the coronavirus after a funeral drew a large crowd in Brooklyn Tuesday, officials said",2020-04-29 23:16:14+00:00
5,Dairy farmers in upstate New York who faced the wrenching task of dumping their milk earlier this month as the novel coronavirus spread are now confronting a grim future: months of low prices that could squeeze them out of business.,2020-04-29 23:15:44+00:00
6,"Tensions are escalating at food plants between essential workers who feel pressure to continue working through the coronavirus pandemic and their employers, who are striving to maintain the country’s food supply chain without interruption",2020-04-29 23:15:21+00:00
7,"I can sit up straight without the room spinning. If it is, in fact #coronavirus that I am suffering from...this is a really weird virus...",2020-04-29 23:14:35+00:00
8,"U.S. Coronavirus Deaths Top 60,000 as New Data Show Economic Toll Governments and companies took new measure of economic damage from the coronavirus pandemic, and some predicted bigger losses in the months ahead even as restrictions on movement are rolled back",2020-04-29 23:13:55+00:00
9,"Amid the coronavirus pandemic, almost everyone is waiting anxiously for something. For those seeking live organ transplants, it's an especially heavy burden. ",2020-04-29 23:05:38+00:00
10,"It’s sad how racist/dumb people are,,, this is happening rn with xenophobia towards Chinese because of the corona virus :/",2020-04-29 23:04:31+00:00
11,"Mass layoffs begin in cities and states amid coronavirus fallout, threatening education, sanitation, health and ",2020-04-29 22:47:34+00:00
12,This testimony will be used as evidence in the future inquiry into the negligence of vulnerable asylum seekers @LeoVaradkar @SimonHarrisTD @CharlieFlanagan Direct Provision https://www.rte.ie/radio/utils/share/radio1/21760062 #coronavirus #EndDP #EndDirectProvision,2020-04-29 22:44:24+00:00
13,"It’s coming. Milk is being poured down drains, pigs are being euthanized, chickens killed. Demand has shrunk and processing plants closed@due to workers with Coronavirus. Sleep through it if you choose. Democrats and the media want it to happen. ",2020-04-29 22:43:01+00:00
14,The Cook County medical examiner’s office confirmed another 119 COVID-19 death from the coronavirus outbreak. ,2020-04-29 22:41:34+00:00
15,"There are stats from NYC showing something like 6 times higher deaths than normal. More than the reported coronavirus death toll, as it happens. This with fewer car accidents because people aren't traveling.",2020-04-29 22:38:57+00:00
16,"Just another scumbag Trump acolyte grifter, fucking people over & stealing money @warp speed. #KushnerIsAnIdiot #KushnerApocalypse #Kushner #Corruption #COVIDー19 #coronavirus #CoronaVillains #TaskForce #COVIDIOTS #Genocide #CorruptToTheCore #CorruptAndComplicitGOP #COVIDー19.",2020-04-29 22:29:06+00:00
17,"OMG I WAS RIGHT!!!!! Remember all my tweets that their death rates were impossible?! I saved screen shots of daily rates, that I’ll add, b/c they were not possible. Florida medical examiners were releasing coronavirus death data. The state made them stop http://www.tampabay.com/news/health/2020/04/29/florida-medical-examiners-were-releasing-coronavirus-death-data-the-state-made-them-stop/",2020-04-29 22:28:35+00:00
18,"Halt destruction of nature or suffer even worse pandemics, say world’s top scientists | Coronavirus outbreak | The Guardian ",2020-04-29 22:24:23+00:00
19,"bill be blasio in a few weeks when a hasidic jew is attacked by a person for spreading coronavirus: damn rip this is so sad we never saw this coming. say no to antisemitism, we are all brothers let’s fight this together. Make love not war!",2020-04-29 22:19:37+00:00
20,Coronavirus just fell 2nd to the greatest pandemic in world history - Racism. ,2020-05-30 23:44:23+00:00
21,Haven't stats already shown that the jogger community had higher rates of coronavirus deaths? Could be messy.,2020-05-30 23:07:35+00:00
22,"Our death toll is on the lower end of expert prediction. 'The White House coronavirus response coordinator said Monday that she is ""worried about every city in the United States"" and projects 100,000 to 200,000 American deaths as a best case scenario.""' ",2020-05-30 22:54:09+00:00
23,"It's not all his fault anyways. He wanted to close down borders pretty early on but he got called a racist for that. Now that quarantine is in place many idiots are protesting and saying coronavirus is ""fake"". I doubt any other president would have handled this better",2020-05-30 22:50:53+00:00
24,Vietnam: How this country of 95 million kept its coronavirus death toll at zero ,2020-05-30 23:54:49+00:00
25,"The coronavirus outbreak is going to deal a huge blow to thousands of school district budgets across the country, with teachers cut, fewer days in classrooms and fewer resources.​ ",2020-05-30 21:45:00+00:00
26,"""They"" are killing off ""certain people"" with Coronavirus by staging these protests so ""They"" can't vote in November. #Q",2020-05-30 21:01:44+00:00
27,"Last week: If you go to church or try to get a haircut, we’ll arrest you and the media will say you’re a fascist. Coronavirus! This week: If you steal 70-inch flat screens from Target and burn down police stations, the media will call you a hero. No masks required! ",2020-05-30 21:00:39+00:00
28,"Perspective | No, the coronavirus pandemic wasn’t an ‘unforeseen problem’ | The coronavirus pandemic isn’t a ‘black swan.’ It’s a gray rhino. https://ecs.page.link/fYXtq",2020-05-30 21:00:01+00:00
29,"it has been on US soil since at least Oct '19, you can easily do some research into this bcz there was plenty of nursing home residents dying of a mystery lung infection last fall (it was coronavirus, no doubt about it)",2020-05-30 20:52:23+00:00
30,"There is a virus loose in the land. I’m not talking about coronavirus. It is the virus of hate, division, bigotry, racism, cruelty perpetrated on people of color aided &amp; abetted by a faux leader who only wants to go to war and win the election!!!",2020-05-30 20:47:23+00:00
31,"Armed with a coding manual, one group of students is logging all the lies, conspiracy theories, and misleading political attacks that have seemingly spread as fast as the coronavirus itself. http://bit.ly/3gjyyd1",2020-05-30 20:05:00+00:00
32,"Coronavirus updates: Officials report another 60 COVID-19 deaths in Illinois, bringing the statewide death toll to 5,330 ",2020-05-30 19:53:37+00:00
33,"Police brutality and coronavirus at the same time , it’s so sad and tragic ",2020-05-30 19:35:27+00:00
34,"The Henry and Stark County Health Department today, Saturday, May 30th announce a cumulative total of 73 confirmed cases of Coronavirus Disease (COVID-19) in Henry County and 3 confirmed cases in Stark County. ",2020-05-30 19:33:42+00:00
35,"October- 2 seizures. November- a dog with a nasty eye infection. December- 1 seizure. January- WW3, Corona Virus and other dog with a torn ACL and likely Cushings disease. Let’s hope we make it through February team",2020-01-30 23:56:12+00:00
36, World Health Organization declares coronavirus outbreak a global emergency ,2020-01-30 23:45:26+00:00
37,You dirty ass mfs need to worry about all your stds before worriying about that coronavirus,2020-01-30 23:36:37+00:00
38,"Coronavirus Geometric Progression Suggests 100,000 Infections In A Week | Zero Hedge ",2020-01-30 23:32:26+00:00
39,"Children With ""Stealth"" Coronavirus Infections Raise Fears Of 'Community Outbreaks' | Zero Hedge ",2020-01-30 23:30:01+00:00
40,Is the coronavirus outbreak as bad as SARS or the 2009 influenza pandemic? A biologist explains the clues https://theconversation.com/is-the-coronavirus-outbreak-as-bad-as-sars-or-the-2009-influenza-pandemic-a-biologist-explains-the-clues-130766?utm_source=twitter&amp;utm_medium=footertwitterbutton via @ConversationUS,2020-01-30 23:27:46+00:00
41,"The #WorldHealthOrganization has declared the #coronavirus outbreak a global emergency. On Thurs., China raised the death toll to 170.",2020-01-30 23:27:17+00:00
42,You damn right I will 409 the whole gah damn world before I let a damn #coronavirus get at me #slyflymccartney,2020-01-30 23:19:03+00:00
43,The World Health Organisation has declared the coronavirus outbreak a global emergency. ,2020-01-30 23:12:52+00:00
44,"IN CASE YOU WERE CONFUSED Corona beer has NOTHING to do with the coronavirus. There has been a significant spike in web searches for “corona beer virus,” “beer virus” and “beer coronavirus” in the past two weeks, according to Google Trends. ",2020-01-30 23:10:52+00:00
45,“We are on the verge of a global transformation. All we need is the right major crisis and the nations will accept the New World Order.” ~ David Rockefeller - Crisis: Corona Virus,2020-01-30 22:34:42+00:00
46,"to ppl participating in racist & xenophobic comments/acts against Chinese/Asian ppl, spreading misinformation abt the coronavirus for clout &amp; contributing to the fear mongering, or using this virus for whatever political agenda, hope y'all get gravely sick from the flu instead.",2020-01-30 22:32:20+00:00
47,Four days later. Will we start to get the flu dirt on February 15th? “The dirt” on what really happened regarding the origins of the Corona Virus? ,2020-01-30 21:55:06+00:00
48,The World Health Organization has officially declared the Coronavirus outbreak a Global Public Health Emergency as the first person-to-person transmission of the virus was reported in Chicago. #CoronavirusOutbreak,2020-01-30 21:54:06+00:00
49,Dow falls 350 points Friday to cap the worst week for Wall Street since the financial crisis https://www.cnbc.com/2020/02/27/dow-futures-fall-100-points-after-another-massive-rout-amid-coronavirus-fears.html?__source=sharebar|twitter&amp;par=sharebar #Dow #Stocks #StockMarket #COVID19 #Coronavirus,2020-02-28 21:43:27+00:00
50,I fear the day when the same virus affects both humans and machines. #coronavirus #COVID19,2020-02-28 21:11:17+00:00
51,Liar you told everyone it’s not a big deal and will go away in April. #Liar #TrumpVirus #coronavirus #COVID19,2020-02-28 20:09:58+00:00
52,"#CNBC after 94,98,01,08 I have been thru drawdowns. Media sensationalizes everything and makes things worse,then everyday folks freak out.Stay calm.Focus on quality, have a pro!Covid19 virus,is horrible,maybe ST issues in US but parents still need to spend $, n kids out of home!",2020-02-28 20:04:56+00:00
53,"Majors (CNN, Fox, and MSNBC) the most pessimistic over a health scare on record of data set (back to 2010). Surprisingly, financial networks see pessimism mildly temper after erupting to start Feb 2020. Currently, CNN and Fox the most bearish over #COVID19 (2/2) ",2020-02-28 18:35:39+00:00
54,"The #coronavirus outbreak has yet to dent South Korea's Moon Jae-in in the polls, writes the Council's @KarlFriedhoff. #COVID19 Read more here: https://bit.ly/2vggP3D",2020-02-28 15:50:14+00:00
55,"While I appreciate the lack of #COVID19 fearmongering in this post, I fear that’s a SERIOUS tactical error when Bloomberg is already featuring it in all his ads. Hit harder Senator",2020-02-28 15:31:11+00:00
56,"As of now, #COVID19 seems to be a threat to only the immino-compromised and the elderly, with most cases being mild. It's seems the #Virus will do the most damage to a global #economy that was already showing signs of faltering after a decade of growth.",2020-02-28 14:57:26+00:00
57,"This confirms the ""rumor"" circulating and showing the wording ""#coronavirus"". The question is how contagious it is between humans. And pray it's not as contagious as SARS, which was a coronavirus. https://twitter.com/onlyyoontv/status/1215101019685715969 …",2020-01-09 03:39:26
58,"The # of people already infected by the mystery #coronavirus emerging in #China is far greater than official figures suggest, scientists have told the BBC. 

There have been 45 laboratory-confirmed cases but experts estimate figure is closer to 1,700.https://www-bbc-com.cdn.ampproject.org/v/s/www.bbc.com/news/amp/health-51148303?usqp=mq331AQCKAE%3D&amp_js_v=0.1#referrer=https%3A%2F%2Fwww.google.com&amp_tf=From%20%251%24s&ampshare=https%3A%2F%2Fwww.bbc.com%2Fnews%2Fhealth-51148303 …",2020-01-18 07:07:24
59,Watch out for the #china virus spread! Just like #Chinazi ideology spreading!  WHO issues warning after 'mysterious' Chinese coronavirus spreads to Japan  https://twitter.com/i/events/1217928133917044736 …,2020-01-17 03:10:43
60,Mfs out here having unprotected sex worried about coronavirus y’all worried about the wrong virus,2020-01-23 23:55:33
61,"The Coronavirus is serious business, but my goblin brain is watching the news and saying “This is the worst game of Plague, Inc ever”",2020-01-23 23:34:51
62,Are you stock piling for the corona virus outbreak,2020-01-28 23:53:58
63,Reading the coronavirus news and it’s just heartbreaking and terrifying. I’m seeing people make jokes about it? Nothing about people suffering or dying is funny. Please stop.,2020-01-28 23:34:03
64,"Canada now!
President Xi Warns Coronavirus Outbreak Is ""Accelerating"" As Canada Confirms First Case | Zero Hedge https://www.zerohedge.com/political/56-million-chinese-lockdown-virus-spreads-australia-malaysia?utm_source=feedburner&utm_medium=feed&utm_campaign=Feed%3A+zerohedge%2Ffeed+%28zero+hedge+-+on+a+long+enough+timeline%2C+the+survival+rate+for+everyone+drops+to+zero%29 …",2020-01-25 23:49:07
65, World Health Organization declares coronavirus outbreak a global emergency https://www.chicagotribune.com/nation-world/ct-nw-china-coronavirus-spread-20200130-3krnuevwvzhspmnrjl345orld4-story.html …,2020-01-30 23:45:26
66,The Test a Deadly Coronavirus Outbreak Poses to China’s Leadership http://dlvr.it/RNVF16 pic.twitter.com/4kTFyZBn5W,2020-01-21 23:44:33
67,Stock market falls amid fear of Chinese virus outbreak #coronavirus #cdc #outbreak #health #investing #businessnewshttps://www.wsj.com/articles/global-stocks-drop-amid-outbreak-of-deadly-virus-in-china-11579601534 …,2020-01-21 22:59:32
68,"Coronavirus Live Updates: As Death Toll Rises, Markets Tumble http://dlvr.it/RNshRS pic.twitter.com/Qkp3xMRyit",2020-01-27 23:44:32
69,"@realDonaldTrump 

(1).  As USA is being distracted by Impeachment, we have a potential crisis unfolding with Coronavirus started in Wuhan, China. 
We MUST take step to forbid travel/planes to come to USA from China temporarily.",2020-01-27 23:35:12
70,@cathaypacific I have a flight that goes thru Hong Kong. A 6 month old baby is travelling along. Can you please help in cancelling the ticket? I don't want an infant to be caught up with this epidemic corona virus.,2020-01-27 23:35:11
71,IMPEACH THE CORONA VIRUS,2020-01-24 23:32:55
72,"BREAKING: 15 more people have died from a coronavirus outbreak in Wuhan, China, pushing the death toll to 41. #Illinois #coronoavirus",2020-01-24 23:24:12
73,China's coronavirus is the lethal cousin of the common cold https://mol.im/a/7920939  via @MailOnline,2020-01-24 23:21:35
74,Okay so I have a cough that started light and just got worse and I’m having really bad anxiety bc of this coronavirus shit omfg I know I say I wanna die a lot but I’m not tryna die rn,2020-01-29 23:52:36
75,"#Coronavirus

40 Million People Quarantined

Three  New Emergency  Hospitals Being Built in Wuhan 

Virus Has Spread to 15 Countries",2020-01-26 23:55:48
76,"#ES #CoronaOutbreak #China #GlobalStocks #NYSE
CORONAVIRUS

- 80 people dead

- Around 400 people in serious condition

- Over 2300 people infected",2020-01-26 23:29:26
77,#Coronavirus death toll in #China rises to 563https://www.jpost.com/Breaking-News/Coronavirus-death-toll-in-Chinas-Hubei-province-rises-to-549-616670 …,2020-02-05 23:50:42
78,this idiot really joked about having the Corona virus and they turned the plane around what the fuck pic.twitter.com/8kni7wts4c,2020-02-05 23:36:32
79,#China #coronavirus Feb 9 40171 confirmed cases Death toll risen to 908...mortality hovering at .02% range #outbreakpic.twitter.com/7IF0WnELAN,2020-02-09 23:56:01
80,"The Chinese government suppressed material information about the virus, a heinous fraud on the Chinese public and global medical community. Yet WHO claims the CCP handled this well. #nCoV2019 #coronavirus
https://www.cnn.com/2020/02/03/asia/coronavirus-doctor-whistle-blower-intl-hnk/index.html …",2020-02-09 23:55:16
81,"So are we ever going to get solid info on the apparent predisposition of coronavirus to target certain populations? What are the ethnicities of the infected outside of China? You'd think that if only certain groups are vulnerable we'd know already, to forestall panic, but idk",2020-02-09 23:40:13
82,Coronavirus Live Updates: Vietnam and Australia Curb Access to China as Death Toll Passes 250 http://dlvr.it/RPCNXR pic.twitter.com/3qADatNDOu,2020-02-01 23:45:05
83,Cities being locked down and people exposed to the virus being sent to military bases. Is eerily similar to a zombie virus outbreak movie? #coronavirus,2020-02-06 23:54:46
84,"Locked-down Wuhan and why we always overplay the threat of the new | Kenan Malik https://www.theguardian.com/commentisfree/2020/feb/02/coronavirus-wuhan-lockdown-breeding-ground-fear-stigma?CMP=share_btn_tw …
#coronavirus #racism",2020-02-03 23:55:33
85,"The rate at which scientists can analyze a new threat has also increased dramatically. In a matter of weeks, researchers recognized a new respiratory virus, identified it as a coronavirus, isolated it, sequenced its genome, and worked out how it sticks to human cells.... https://twitter.com/edyong209/status/1224325022724038658 …",2020-02-03 23:48:44
86,"Everyone I know has gotten sick in the last couple of months. Bring it on, @corona virus.",2020-02-03 23:44:47
87,Coronavirus Live Updates: China Death Toll Is Greater Than in SARS Outbreak http://dlvr.it/RPKVqZ pic.twitter.com/TdHcmrRZLi,2020-02-03 23:44:33
88,I don’t care if I get the coronavirus or not. Being held hostage on a cruise ship is literally my worst nightmare.,2020-02-15 23:34:10
89,"The two Chicago-area residents who contracted the coronavirus were released from home isolation late Friday night and are cured from the illness, health officials announced.

https://wbbm780.radio.com/articles/chicago-coronavirus-patients-released-from-home-isolation-cured …",2020-02-15 23:11:50
90,I have to say that the Corona virus story is very interesting.  If all the sadness in the case.,2020-02-11 23:57:28
91,Vick’s vapor rub will kill the corona virus,2020-02-16 23:33:53
92,"More than burst dams or poor weather, the Coronavirus epidemic has the potential to impact #metal prices significantly in 2020. #ironore #steelhttp://ow.ly/c1sT30qgDCg ",2020-02-12 23:45:05
93,"With nearly 40% of all apparel and footwear imports to the United States coming from China. American apparel manufacturers are concerned over the ripple effects of the #coronavirus outbreak, RSM's @PCadi writes. https://dy.si/9HBuD pic.twitter.com/L0qRSw6Z2L",2020-02-18 23:51:23
94,Chinese government backs Fruit Ninja-style game about killing viruses amid coronavirus outbreak https://www.scmp.com/tech/apps-social/article/3051176/chinese-government-backs-fruit-ninja-style-game-about-killing …,2020-02-18 23:33:58
95,"Coronavirus death toll in mainland China hits 2,000 with 132 more fatalities in Hubei https://www.scmp.com/news/china/society/article/3051250/coronavirus-mainland-death-toll-hits-2000-132-more-fatalities …",2020-02-18 23:32:01
96,"The continued hysteria in media reports of the Coronavirus is irresponsible. CNN blasts this “alert” out to millions of phones all over the world. The numbers seem bug, I guess, until you realize these are worldwide. 75,000 people infected vs global pop. of 7.5 billion. pic.twitter.com/4huuBQOSHK",2020-02-18 23:28:07
97,"Given the alarming headlines about the #coronavirus outbreak and the consumption of wildlife, the tradition of so-called wet markets now faces harsh scrutiny. But eating wildlife is not the only way diseases can spread from animals to people. http://bit.ly/2UOVzw0 pic.twitter.com/C3egUWanP6",2020-02-14 23:57:00
98,"The number of new deaths in China's central Hubei province from the coronavirus outbreak rose by 139 as of Friday. 

https://www.jpost.com/Breaking-News/China-139-new-coronavirus-deaths-in-Hubei-Province-617631 …",2020-02-14 23:47:30
99,"And if @BarackObama was still president, those fake christians would be blaming @POTUS44 for the Corona virus...

#ImpeachedForever45 #Resist #VoteBlueToEndThisNightmare
http://www.nestorgomezstoryteller.com/immigration-stories.html …",2020-02-14 23:38:18
100,"Me at the seafood counter “Hello ma’am, what can I get you?”

Old lady points at scallops “Do these have the Corona virus in them?

Me “I’m sorry?”

Her “Are these from China?”

Me “No, the United States.”

Her “I’ll take a pound.”


#coronavirusus",2020-02-13 23:48:25
101,A medical emergency severe enough to majorly impact service 4 hours later? Was there a coronavirus outbreak at Rosemont? https://twitter.com/cta/status/1228096337012494337 …,2020-02-13 23:41:31
102,"Half the Population of China, 760 Million, Now Locked Down

Also, Sudden Spike in Japan Coronavirus Cases
Apple Issues Revenue Warning

https://moneymaven.io/mishtalk/economics/half-the-population-of-china-760-million-now-locked-down-E0JtonkZYkKDKd-xGBl4QA …",2020-02-17 23:48:18
103,"So if 70% of the population is going to get corona virus within the next year that would mean we'd need 15 mill infections per day every day to reach 5.4B starting now (70% of 8B). But sure, not panicky at all.",2020-02-24 23:54:10
104,ABC Nightly News Anchor David Muir spent just over 15 Minutes continuing to try and spread fear and panic about the Corona virus yet the flu has killed some 13000 this season in the USA alone was never mentioned,2020-02-28 23:53:11
105,"The Chinese government has expelled three Wall Street Journal reporters. It's just another piece of evidence that the coronavirus crisis has exposed a deep weakness: The Chinese regime fears information, writes Bret Stephens of the New York Times. https://trib.al/3usOvl6 ",2020-02-21 23:38:35
106,"Scientists debunk coronavirus conspiracy, say it 'threatens to undermine' global efforts to stop it https://www.yahoo.com/lifestyle/scientists-debunk-coronavirus-conspiracy-say-it-threatens-to-undermine-global-efforts-to-stop-it-220044983.html …",2020-02-22 23:55:25
107,"Breaking: Italy to put cities with coronavirus outbreaks on lockdown, meaning people will be charged with a criminal offense if they enter or leave the lockdown areas. Around 50,000 people will be affected by the lockdown in 11 different towns.",2020-02-22 23:54:48
108,A Lebanese woman suspected of carrying the #coronavirus from #Iran to #Lebanon claims that she's only suffering from a cold and vows that her brother will take revenge on her behalf from the Lebanese government for lying about the case.https://www.jpost.com/Middle-East/Lebanese-woman-suspected-of-carrying-coronavirus-vows-revenge-for-lies-618441 …,2020-02-22 23:41:06
109,"Oh look, one gun has taken more lives than Coronavirus has in the United States ,over 15,000 deaths last year alone, not including self inflicted deaths .We have a gun virus....",2020-02-26 23:59:15
110,"For those who don't think undocumented folks should have access to healthcare one word: coronavirus. 

A responsible public health strategy acknowledges that viruses, diseases and other illness that can be spread require all folks in the country to have access to healthcare",2020-02-26 23:58:48
111,"He will find a way to blame it on the gays. Let me guess, bakers can refuse cakes to people with the Coronavirus.",2020-02-26 23:55:10
112,"Got an email that the health conference I'm going to in 2 weeks is currently still happening but is a ""handshake free"" zone. Sadly, I'm sure it will not be a ""bad Corona virus joke free"" zone",2020-02-27 23:57:49
113,Never let any Crisis go to waste! This is what the Democrats are doing with the Coronavirus! pic.twitter.com/iXz7wesiwA,2020-02-27 23:56:12
114,".@NYGovCuomo reacted to the bomb threats sent to @JCCAssociation in Albany and said that ""no State is doing more to combat #antisemitism than this State."" He also compared the spread of hate to the spread of #coronavirus. 
https://www.jpost.com/Diaspora/Antisemitism/New-York-Jewish-community-center-receives-bomb-threat-618549 …",2020-02-23 23:39:09
115,"RT @GrandmaSaidNo: Never forget that the US federal government is responsible for the high COVID-19 death toll on our Nation. 

The magnitu…",Sat Jun 13 09:57:32 +0000 2020
116,"RT @AlOtroLado_Org: BREAKING: This morning we, along with @UChicagoLaw Edwin Mendel Legal Clinic filed a lawsuit against DHS for failing to…",Sat Jun 13 12:19:50 +0000 2020
