,Tweets,Date
117,RT @ANI: Loss of smell (anosmia) or loss of taste (ageusia) added to the list of #COVID19 symptoms by the Health Ministry. https://t.co/PM6…,Sat Jun 13 10:39:58 +0000 2020
118,Special #COVID19 Article from the May-June issue of SAEM Pulse:  Heavy Lies the Mask of the Hero. Read it in its en… https://t.co/MTJabItz8Z,Sat Jun 13 13:02:54 +0000 2020
119,RT @allieyoung13: The death toll on #NavajoNation has reached 298 due to #COVID19. That’s 298 Navajo lives including 5 Medicine People gone…,Sat Jun 13 09:55:00 +0000 2020
120,RT @VirusesImmunity: Men are at higher risk of developing severe #COVID19 disease. We investigated whether this difference might be due to…,Sat Jun 13 09:54:11 +0000 2020
121,"RT @arimoin: Just a reminder as we open up society- We all may be tired of the virus, but it's definitely not tired of us. Wear a mask, pra…",Sat Jun 13 09:56:12 +0000 2020
122,So it’s mainly older ppl that already have health issues that are dying from the corona virus,2020-03-02 23:53:29
123,"So my @AmericanAir flight from #LosAngeles just stopped over for a medical emergency in #Albuquerque and we’re stuck here for an indeterminate amount of time. Woman on the flight was transferred off to the ER@and nobody has told us anything else 
#coronavirus?",2020-03-01 23:54:24
124,While y’all are worrying about corona virus messing up your travel plans there are people like me who worry about it affecting our jobs. Please sit down and shut up.,2020-03-06 23:59:15
125,"Hopkins may be concerned about coronavirus, but they don’t fear virus or that someone will become sick, they fear the inevitable law suit that will follow",2020-03-06 23:57:26
126,http://Oh.my .gosh. looking at all of these remote and distance learning offers in case schools close due to the Corona virus is like watching weather forecasters preaching the doom of the impending snowmageddon.  And we all know how all that ends up. #WashYourHands,2020-03-06 23:53:20
127,It is fucking amazing to me how irresponsible the media is. The way they are covering the coronavirus is going to kill more people via hear attacks than the virus itself. #getagrip #relax,2020-03-04 23:50:57
128,it makes me so sad seeing other asians become victims of racism because of the coronavirus outbreak. people who believe every asian has corona and decides to avoid or be racist towards asians are too ignorant to actually learn about the virus.,2020-03-03 23:59:52
129,"Will coronavirus risk keep #Cubs, Cards out of London? MLB ‘monitoring’ multiple areas of concern https://chicago.suntimes.com/cubs/2020/3/3/21163858/will-coronavirus-risk-keep-cubs-cards-out-of-london-mlb-monitoring-multiple-areas-of-concern … via @SunTimes",2020-03-03 23:59:03
130,BREAKING: the @GOP stopping a corona virus bill because it doesn’t allow all of their big pharma pals to charge whatever they want for a lifesaving vaccine that hasn’t even been developed yet.  Stop lying douchbag.,2020-03-03 23:57:05
131,Watching the scary documentary about corona virus called The Ring. Did you know it makes you see ghosts?,2020-03-03 23:50:45
132,Embattled Twitter chief Dorsey reconsiders Africa move amid coronavirus concerns http://twib.in/l/eGAzyaKj88na  #technologypic.twitter.com/jgwF2YPfXV,2020-03-05 23:53:07
133,A California man who self-quarantined after returning home from China amid the coronavirus outbreak said he is '100x more concerned' for his health in the US than he was in China https://news.yahoo.com/california-man-self-quarantined-returning-173042979.html?soc_src=hl-viewer&soc_trk=tw …,2020-03-05 23:53:07
134,I think I have the corona virus no joke,2020-03-08 23:57:45
135,"We are reasonably distracted by the corona virus crisis.  Your followers must also be careful and aware the virus is small enough to penetrate masks, but does prevent the wearer spreading it.  Yet, one crisis doesn't bump another just as urgent, it only teaches a better response.",2020-03-08 23:53:36
136,How an authoritarian government helped spur on the coronavirus outbreak https://nationalinterest.org/feature/made-china-coronavirus-chaos-could-have-been-avoided-130422 …,2020-03-09 23:59:46
137,"Gov. J.B. Pritzker issues disaster proclamation as four new cases of coronavirus in Illinois bring state’s total to 11
https://www.chicagotribune.com/coronavirus/ct-coronavirus-illinois-20200309-5c3tfldhpnahvonvtttfjwgrdq-story.html …",2020-03-09 23:59:21
138,Major North American sports leagues agree to restrict locker room access amid coronavirus fears  https://twitter.com/i/events/1237154972073988097 …,2020-03-09 23:58:09
139,"#ES Not supried by this at ALL!

 According to Bloomberg 500 of the world's richest people lost a combined $203 billion in the first 96 minutes of trading after yesterday's open. And just now, the State of New Jersey declared a ‘state of emergency’ due to the coronavirus.",2020-03-09 23:55:51
140,"The average person is over 100 times more likely to die in a car crash driving to the store to get hand sanitizer, then they are from the Corona virus.",2020-03-09 23:55:07
141,".@abc7newsbayarea #7onyourside reporter @MFinney interviews Check Point Security Engineering Manager, Matt Lourens, on the surge of malicious #coronavirus websites. Find out how to prevent #COVID-19 #scams: https://abc7ne.ws/38ykKGl pic.twitter.com/9ERJ6RaUGt",2020-03-09 23:54:27
142,we're tipping drag queens via venmo this corona virus season,2020-03-11 23:57:30
143,"BREAKING: U of I, Northwestern and Illinois State have all announced, in short succession of one another, that classes are moving online due to health concerns about the coronavirus. 
 https://www.chicagotribune.com/coronavirus/ct-illinois-coronavirus-colleges-online-classes-20200311-4cnop5jqpjewdac7ppods5awmu-story.html …",2020-03-11 23:57:07
144,"PS5 & Xbox Series X Coronavirus Delay Rumors, https://implurnt.com/ps5-xbox-series-x-coronavirus-delay-rumors/ …",2020-03-11 23:56:52
145,"#Coronavirus is officially named a pandemic  so many people are panicked and afraid of what could happen. So, I decided to lighten the mood by sharing a portion of this video I made for an application. Wait for IT!… https://www.instagram.com/p/B9nMnkonId5/?igshid=sa9csvt21z7z …",2020-03-11 23:56:36
146,2 week spring break plus classes online after?? Ok can’t complain  thx coronavirus,2020-03-10 23:56:42
147,I swear I need this corona virus to start wiping all the idiots out here.,2020-03-13 23:56:48
148,If you're panicked over Corona Virus you've officially failed vibe-check.,2020-03-12 23:59:33
149,"Liz Peek: Democrats attacking Trump coronavirus response hurt economy – they shouldn’t politicize crisis
Vile and Nasty people. https://flip.it/R.z1Zh ",2020-03-12 23:59:29
150,"Government declares they’ve allocated $100m to help fight Corona Virus.. Barely 24hrs later, 2 cases have been detected.. As dirty and petty as our country’s politics are, I’m actually having thoughts it could all be a conspiracy. Lmao I wouldn’t put it past them.",2020-03-12 23:58:46
151,Sadly the IL READS #book Festival #canceled. No surprise. I'd just zipped my bag when the notice came. Sorry for the #coordinators/#volunteers who devoted their time & for missed #opportunity for #authors/#illustrators to share #stories & #poems w #kids. #Covid_19 #coronavirus pic.twitter.com/K9JeJlvOCo,2020-03-12 23:58:28
152,"Illinois has awarded a high school basketball state championship every year since 1908. 

That streak comes to an end this year to due to concerns over the coronavirus.

We are all a little rattled in my corner of the world

Story updated w/IHSA comments 

https://chicago.suntimes.com/2020/3/12/21177113/coronavirus-high-school-basketball-state-playoffs-ihsa …",2020-03-12 23:57:57
153,Sadly the IL READS  #book estival is #canceled. No surprise. I'd just zipped my bag when the notice came. Sorry for the #coordinators/#volunteers who devoted their time & for missed #opportunity for #authors/#illustrators to share #stories & #poems w #kids. #Covid_19 #coronavirus pic.twitter.com/cE1QKrdbKu,2020-03-12 23:57:43
154,"Re-read his comment ""doofus."" Where did he ever say the virus was fake? He implied the hysteria is manufactured and the coronavirus is no more harmful than influenza. B4 this nonsense, medical journals and encyclopedias equated it to the common cold. Comprehend much?",2020-03-12 23:57:42
155,"Disturbing Pic of the Day: Setting a good example, but it says a lot about the coronavirus crisis that two presidential candidates can’t shake hands and speak from podiums 6 feet apart. pic.twitter.com/hA8fhOp0cw",2020-03-15 23:59:48
156,#Republicans #Democrats I’m amazed someone this stupid was allowed on TV to spew this dangerous a line. I really hope this clown gets a severe version of the Trump Corona virus and winds up on a respirator. That’s what he wants for all those kids whose events were cancelled.,2020-03-19 23:59:56
157,#Coronavirus conspiracy theorists make me feel bloated and farty. #CoronavirusPandemic #StaySafeStayHome #QuaratineLife,2020-03-21 23:59:51
158,"Why is it that even @nygovcuomo and @cagovernor can praise @realdonaldtrump’s coronavirus efforts, but our failed @govpritzker never misses an opportunity to get in front of a camera and bash our president to deflect from his own failures?https://twitter.com/GovPritzker/status/1241469671448236040 …",2020-03-21 23:56:35
159,The coronavirus is bad but think of all these poor people wiping their ass with paper towels,2020-03-20 23:58:41
160,"Unsurprising that Ron Johnson would invoke the moronic highway death comparison. HIGHWAYS HAVE SOCIAL VALUE, BEING INFECTED WITH CORONAVIRUS DOES NOT. https://twitter.com/tripgabriel/status/1240368940951506949 …",2020-03-18 23:58:42
161,"My body picked the worst time ever to have a cold...everyone thinks it's the corona virus, it's not ",2020-03-18 23:58:35
162,Aht corona virus won’t embarrass me ,2020-03-18 23:57:29
163,Created a naturally occurring Coronavirus strain? How dumb are you?,2020-03-17 23:57:53
164,"What if  you go back in time to 1914 and tell the man who murdered Prince Ferdinand that, this butterfly effect will cause the mutation of the corona virus in 2020 & will probably kill more people than the two first WW?Never limit yourself to the one-sided claims of the media! ",2020-03-17 23:57:42
165,Is what Bernie did back then more important than the fact that @TulsiGabbard was the first to speak up weeks ago when there was some time to prepare for this crisis that the gov needs to act on the coronavirus threat Every time Team Bernie ignores Tulsi you commit a moral crime,2020-03-17 23:57:20
166,Tracking the Coronavirus: How Crowded Asian Cities Tackled an Epidemic https://nyti.ms/39XDUqR ,2020-03-17 23:56:52
167,I understand we can limit the exposure to Coronavirus by the measures in place today - i still don’t understand why it’s worse than the swine flu or regular flu? I see MSM have convinced the markets it’s a problem.  I don’t understand the panic ... it’s here so we deal with it  https://twitter.com/GregRubini/status/1239654876122099712 …,2020-03-16 23:59:35
168,"coronavirus can't kill me, only i can kill me.",2020-03-16 23:59:11
169,#Illinois governor @GovPritzker is telling people to isolate and warning of #coronavirus dangers but still expects #voting to be safe??? Unacceptable! We need to cancel #IllinoisPrimary NOW! #COVID19 #Primaries #chicago @DNC,2020-03-16 23:58:40
