,Tweets,Date
0,"#niet_in_journaal #US #military #COVID_19 The complete list of military coronavirus cases by base, as second Navy ship faces a major outbreak ",2020-04-29 23:54:18+00:00
1,Michigan doctor charged with fraud after allegedly touting vitamin C infusions as coronavirus treatment http://www.myheadlinez.com/40506340/Michigan-doctor-charged-with-fraud-after-allegedly-touting-vitamin-C-infusions-as-coronavirus-treatment/,2020-04-29 23:48:23+00:00
2,"FOLKS! After you give your heart to Jesus, you're supposed to keep using your brain! ‘A phantom plague’: Evangelicals who defied social distancing guidelines are dying of coronavirus in frightening numbers – Raw Story ",2020-04-29 23:24:47+00:00
3,I used Duckduckgo to search for 'Coronavirus: how dangerous is it?' and your Youtube video came up seventh. In Google: nothing.,2020-04-29 23:10:37+00:00
4,"#Lebanon : for the 4th night in a row riots are taking place in the city of #Tripoli. The combination of economic collapse, government repression, corruption and #coronavirus lockdowns have made life unbearable for many Lebanese. #لبنان_يتنفض",2020-04-29 23:07:58+00:00
5,If they have time to play they need to go home. Doesn't look as if their services are needed. That is not in anyway funny. People have died and went through hell with the coronavirus and their mocking them. Very unprofessional,2020-04-29 22:42:22+00:00
6,"OMG! Thunberg said in a statement that “like the climate crisis, the coronavirus pandemic is a child-rights crisis”",2020-04-29 22:30:01+00:00
7,"#COVID1984 #coronavirus From 9/11 we have learned there are 3 branches profiteering and working together, always hiding behind each others backs: 1. politics (propaganda) 2. commercial (marketing) 3. religion (belief). Think about it. How does that relate to #Covid1984?",2020-04-29 22:23:43+00:00
8,"Most of them are Americans with legitimate grievances and concerns...not that Trump cares about them, or black Americans being murdered by police or the 105,000 dead from the coronavirus or anyone but himself...he's too busy putting the dick in dictator.",2020-05-30 23:05:14+00:00
9,"COVID-19 patients who undergo surgery are at increased risk of postoperative death: Patients undergoing surgery after contracting coronavirus are at greatly increased risk of postoperative death, a new global study reveals. Researchers found that amongst… ",2020-05-30 22:48:32+00:00
10,"Romanian Prime Minister Ludovic Orban paid a 3,000 lei fine ($690) on Saturday for breaking his own coronavirus restrictions ",2020-05-30 22:37:39+00:00
11,Coronavirus reveals the truth about Denmark’s costly carbon tax. Raising it is not considered now because of the economic uncertainty. ,2020-05-30 21:36:37+00:00
12,‘America in 2020 has stunned itself with a collapse that’s larger and deeper than one miserable leader’ The Coronavirus Revealed America’s Failures - The Atlantic ,2020-05-30 21:03:51+00:00
13,"We've ""never"" had a FLU Vaccination Ms. Dawkins & , &amp; we'll never take a vaccine for the #coronavirus either! #Guaranteed PS: Its been over 10 YR's since we've had any cold &amp;/or flu like symptoms, &amp; we owe it to the 65 Vitamins, Supplements &amp; Herbs we take ""every day"" @POTUS",2020-05-30 20:44:19+00:00
14,Coronavirus: Restrictions return in South Korea after new spike in COVID-19 cases ,2020-05-30 20:43:41+00:00
15,What CORONA VIRUS? What SOCIAL DISTANCING? ,2020-05-30 20:39:08+00:00
16,"Sweden is showing the world the effects of the wrong strategy. Please change strategy, Sweden! And the Netherlands please don’t follow this bad example! #COVID19 #COVID19NL #Netherlands #Sweden #coronavirus #schools #schoolreopening #christiandrosten",2020-05-30 20:14:10+00:00
17,"Inevitable, given the current state of politics. It acts as cover for ongoing coronavirus deaths &amp; racial injustice, &amp; we should all recognise that. That’s why I’m loath to give it any support beyond the simple &amp; crucial matter of two astros being delivered safely to space.",2020-05-30 20:09:32+00:00
18,"Saw 'Coronavirus Outbreak' trending. Went to look and saw this notice. I like it. It should be done on all social media platforms, if it isn't already, given there's so much fake news fearmongering being peddled by conservative politicians, their propaganda rags and their fans. ",2020-01-30 23:52:28+00:00
19,WHO declares global coronavirus emergency as death toll surges in China ,2020-01-30 23:36:39+00:00
20,The @WHO DG has declared the current outbreak of novel #coronavirus 2019 (2019-nCoV)— a Public Health Emergency of International Concern (PHEIC)— in accordance with the International Health Regulations (IHR) (2005); the international legal framework that governs such situations.,2020-01-30 22:54:23+00:00
21,WHO declares coronavirus outbreak an international emergency https://www.cbc.ca/news/world/who-reconvenes-assess-latest-coronavirus-1.5445775,2020-01-30 22:47:24+00:00
22,There are several cases of confirmed coronavirus infections outside China where the persons didn’t go to China recently. So I am suspecting if there are other ways that virus is spreading other than human to human. #coronavirus #virusoutbreak,2020-01-30 22:46:26+00:00
23,"All those things that are made or assembled in China, is there a danger/possibility of them being contaminated with virus? If yes, then everybody is screwed. Books, computers, phones, toys, kitchenwares, ikea knockoffs, cloths.... are mostly printed/made in China. #coronavirus",2020-01-30 22:46:25+00:00
24,All Atletico Madrid players diagnosed with Corona Virus next 2 weeks ,2020-01-30 22:41:47+00:00
25,World Health Organization has declared corona virus a global emergency.,2020-01-30 22:33:08+00:00
26,"Three people in NL tested for coronavirus, all results negative ",2020-01-30 22:31:32+00:00
27,WHO declares Wuhan #coronavirus a public health emergency of international concern ,2020-01-30 22:30:37+00:00
28,"[Pandemic Breaking News: Pandemic expert Dr Steven Hatfill, WHO unreliable; this is already bigger than SARS, never had so large a quarantine attempt; need a travel ban; now have the 1st human-to-human transmission of coronavirus need ground verification] https://www.facebook.com/groups/621599241269755/permalink/2647268572036135/?sfnsn=mo",2020-01-30 22:22:45+00:00
29,-Mao -Tienanmen -Hong Kong -Concentration camps of Muslims -Mass censorship And probably tons more that I don't even know about. I've heard that Coronavirus was created by the CCP as a bioweapon to kill Taiwan and Hong Kong.,2020-01-30 22:10:29+00:00
30,"@NetflixNL tip ivm #CoronaVirus ""Pandemic: How to Prevent an Outbreak"" (over o.a. SARS) ",2020-01-30 21:55:35+00:00
31,I’m far more afraid of Duh Creature in the WH than I am of the coronavirus. Yet this dangerous is clearly *not* the leader needed if an epidemic begins.,2020-01-30 21:32:51+00:00
32,"Establishment Admits: We Are ""Unable to Stop"" The Spread of the #Coronavirus https://buff.ly/3164hY1",2020-01-30 21:30:06+00:00
33,"BBC News - #Coronavirus declared global health emergency by WHO: ""declaration not a vote of no confidence in China's handling of the outbreak, but reflection of the damage the virus could do if it spread to countries with a weaker health infrastructure."" ",2020-01-30 21:28:28+00:00
34,"As Japan now also confirms the first case of a patient who gets sick from the same #COVID19 virus for the second time, shows people likely don’t cure. As with the Malaria parasite the virus stays dormant in the body and can make you sick any time #CoronaVirusUpdates #Coronavid19",2020-02-28 21:42:01+00:00
35,"Before Turks, you’ll die with Corona! Hope all racist like you terminated by Covid19.",2020-02-28 21:14:02+00:00
36,Bill Gates: Coronavirus may be ‘once-in-a-century pathogen we’ve been worried about’ https://www.cnbc.com/2020/02/28/bill-gates-says-coronavirus-may-be-once-in-a-century-pathogen.html?__source=sharebar|twitter&amp;par=sharebar #covid19 #coronavirus,2020-02-28 20:54:44+00:00
37,"Vietnam, #coronavirus: All 16 infected people in the country so far have recovered and been discharged. https://flutrackers.com/forum/forum/-2019-ncov-new-coronavirus/vietnam-2019-ncov/824060-vietnam-2019-n-cov-cases-15?p=832251#post832251 #SARSCoV2 #COVID19",2020-02-28 20:52:05+00:00
38,"Be really careful what you read & believe. We all need facts, not fear mongering, about #COVID19. ",2020-02-28 20:10:10+00:00
39,Just reported $BVTK to #sec for making fraudulent #COVID19 statements. Hope they will shut this scam down #scamlist,2020-02-28 20:05:06+00:00
40,Google employee tested positive. To all: Update your browsers' virus scanner. #GoogleAlerts #covid19 #COVID2019 #coronavirus #Corona #Coronavid19 #google #Zurich,2020-02-28 19:44:26+00:00
41, STATEMENT Players alert FIFPRO to Coronavirus fears #COVID19 Read here: https://fifpro.org/en/health/players-alert-fifpro-to-coronavirus-fears,2020-02-28 15:48:03+00:00
42,"Aanrader, als je geïnteresseerd bent in de feiten tot nu toe rondom COVID19 #coronavirus Highly recommended, if you are interested in COVID19 #coronavirus The WHO-China Joint Mission Report on Coronavirus Disease 2019 https://www.who.int/docs/default-source/coronaviruse/who-china-joint-mission-on-covid-19-final-report.pdf",2020-02-28 15:28:16+00:00
43,The Four Coronavirus Scenarios: The Bad; The Worse; The Ugly; And The Unthinkable. FACTS COVID19 #coronavirus #Epidemic #CoronaOutbreak #Quarantine #ChinaVirus #2019nCoV #pandemic #COVID19 #COVIDー19 #Holland,2020-02-28 14:41:18+00:00
44,#Secondary attack #rate and superspreading events for SARS-CoV-2 - The Lancet #coronavirus #COVID19 #COVIDー19,2020-02-28 13:27:38+00:00
45,Breaking: BFMTV: In Hong Kong a dog has tested positive for infection with the Coronavirus. The dog has been placed in quarantaine. Experts say that there is no risk that dogs can transmit the virus to humans. #Coronavirus #COVID19 #Breaking,2020-02-28 11:08:35+00:00
46,Also a mortality rate of 0.1 - 0.15% for the flu vs. 2 - 3% in COVID19. That's 10 - 20 times more deadly.,2020-02-28 10:36:48+00:00
47,"So the first people with #COVID19 have been diagnosed in the Netherlands. Everyone ""Oh no! Corona!"" Also everyone: - *makes racist jokes* - *doesn't cover their mouth when coughing* - *doesn't wash hands* - *doesn't get vaccinated for yearly flu with similar death toll*",2020-02-28 10:33:58+00:00
48,"Many were vaccinated to control it. There is no vaccine for Covid19, hence why it is more dangerous than flu.",2020-02-28 09:16:50+00:00
49,"True statement: 
""There are many potential causes of viral pneumonia, many of which are more common than severe acute respiratory syndrome coronavirus”.   IF common viral ethology, by the time people have pneumonia, depending on test used the primary ethology may not be detected",2020-01-01 15:15:37
50,(Avian) influenza virus seems to be ruled out. Coronavirus still a possibility. Hopefully this will be solved soon #NGS #metagenomicshttps://www.bbc.com/news/world-asia-china-50984025 …,2020-01-03 17:02:02
51,"""I think they really should share the sequence data, so that we can all make sure we can test for this virus if we get travelers from this region,"" @MarionKoopmans says about the newly discovered coronavirus in China. http://bit.ly/2FxRVOg ",2020-01-09 21:57:53
52,Wuhan pneumonia outbreak: Mystery illness 'caused by variant of coronavirus' https://www.bbc.co.uk/news/world-asia-china-51047576 …,2020-01-09 13:44:58
53,"Xinhua News Agency, quoting Chinese expert Xu Jianguo: “Outbreak of mystery viral pneumonia in Wuhan is believed to be down to a new type of coronavirus that has emerged.... in analysing pathogen test results, conclusion [is] that the virus is new, & different from SARS or MERS.” https://twitter.com/rthk_enews/status/1215104482117181440 …",2020-01-09 05:22:43
54,"Warpspeed publishing: analysis of travel data combined with a disease vulnerability index, applied to the risk of cases of new coronavirus outside of Wuhan
https://academic.oup.com/jtm/advance-article/doi/10.1093/jtm/taaa008/5704418 …",2020-01-14 22:07:37
55,"Health authorities in the central Chinese city of Wuhan on Saturday reported the country's first death from a new type of coronavirus.

https://valleycentral.com/news/nation-world/china-reports-1st-death-from-new-type-of-coronavirus …pic.twitter.com/PALB47xe6X",2020-01-11 16:44:41
56,"Dromedary auction at King Abdulaziz Camel Festival, Saudi Arabia. Unconsciously, I wonder whether the dromedaries are infected with #MERS #coronavirus, and what the risk of infection is for the crowd of men. @marionkoopmans @bart_haagmans @ReinaSikkemahttps://www.nrc.nl/nieuws/2020/01/11/de-bulls-eye-a3986493 …",2020-01-11 10:59:11
57,Lethal SARS-linked coronavirus claims first life as China’s pneumonia outbreak infects dozens https://www.rt.com/news/477992-china-coronavirus-first-death/ …,2020-01-11 08:29:28
58,"Number of infections presumably largely underestimated
#Wuhan #coronavirus #outbreakhttps://www.bbc.com/news/health-51148303 …",2020-01-19 09:38:23
59,No screening for new #Sars-like #virus at #UK #airports – yet. #Coronavirus https://www.theguardian.com/world/2020/jan/18/no-airport-screening-for-new-sars-like-virus-yet-china?CMP=share_btn_tw …,2020-01-18 21:16:55
60,BBC News - New Chinese virus 'will have infected hundreds' https://www.bbc.com/news/health-51148303 … #coronavirus,2020-01-18 08:14:19
61,"*#Wuhan #China #Coronavirus*

A new virus has been found in China, Thailand and Japan that has crossed the Animal / Human Infection ability and it is a different form of Coronavirus. Be careful 
https://www.bbc.com/news/health-51148303 …",2020-01-18 07:13:16
62,"Why do I have to read half the article before you skip scare tactics and start talking about the virus?

Say it's a coronavirus earlier. Bring up MERS earlier. https://twitter.com/NBCNews/status/1218391336606412801 …",2020-01-18 04:37:13
63,"Eurosurveillance | Real-time tentative assessment of the epidemiological characteristics of novel coronavirus infections in Wuhan, China, as at 22 January 2020. Some observations: case definition initially used quite selective; hospital fatality rate 14% https://www.eurosurveillance.org/content/10.2807/1560-7917.ES.2020.25.3.2000044 …",2020-01-23 23:19:37
64,"Inside the horrific, inhumane animal markets behind pandemics like coronavirus https://nypost.com/2020/01/25/inside-the-horrific-inhumane-animal-markets-behind-pandemics-like-coronavirus/?utm_source=twitter_sitebuttons&utm_medium=site%20buttons&utm_campaign=site%20buttons … via @nypost",2020-01-25 23:41:22
65,"#Coronavirus spread accelerating in #China, says Xi Jinping. #virus #verspreidinghttps://www.theguardian.com/science/2020/jan/25/coronavirus-puts-50m-people-in-china-under-lunar-new-year-lockdown?CMP=share_btn_tw …",2020-01-25 23:38:15
66,"Saw 'Coronavirus Outbreak' trending. Went to look and saw this notice.

I like it. It should be done on all social media platforms, if it isn't already, given there's so much fake news fearmongering being peddled by conservative politicians, their propaganda rags and their fans. pic.twitter.com/bKrN3teQPh",2020-01-30 23:52:28
67,WHO declares global coronavirus emergency as death toll surges in China https://www.rawstory.com/2020/01/who-declares-global-coronavirus-emergency-as-death-toll-surges-in-china/ …,2020-01-30 23:36:39
68,"I am fully convinced that this #CoronaVirus is already a lot worse than people know. Then again, I’m letting twitter convince me.",2020-01-24 23:46:20
69,"This #CoronaVirus map kind of reminds me of Agent USA on the C64.
https://gisanddata.maps.arcgis.com/apps/opsdashboard/index.html#/bda7594740fd40299423467b48e9ecf6 …
#AgentUSA #C64 #scary",2020-01-24 23:44:43
70,"The Dow Fell 170 Points Because the Coronavirus Is Greeting the Year of the Rat - Barron's. Dow is not done rising yet!  At least another 5k.  Maybe 10k!  Then it will crash!

BIG!  LIKE BLACK TUESDAY IN 1929!

It may crash b4 or after Nov. 2!

 https://apple.news/AssQZllwkT8eyDdnOqwmvyg …",2020-01-24 23:19:31
71,"People are connecting Kobe's unexpected death with coronavirus. Jeez ppl! 

Get a hold of yourself. Apparently, Kobe's death is to cover up coronavirus news!!! 

I don't want smoke what you are smoking.",2020-01-29 23:40:40
72,"If you're retweeting unsourced ""information"" from an anonymous #CoronaVirus account, fucking stop it.

Disinformation harms people. This isn't hard.",2020-02-08 23:43:50
73,"#2019nCoV #China #WHO Leader of Expert Team to Leave for China on Monday, Tuesday Amid Coronavirus Crisis - WHO: https://sputniknews.com/asia/202002081078263707-leader-of-expert-team-to-leave-for-china-on-monday-tuesday-amid-coronavirus-crisis---who/ … via @SputnikInt",2020-02-08 23:43:00
74,"#coronavirus under #chinazi becomes even a larger problem than it otherwise is.
#ChinaVirus #WuhanFlu #Chinacoverup #ChinaLieshttps://twitter.com/steve_hanke/status/1225145249669926912 …",2020-02-05 23:47:43
75,Double corona virus,2020-02-05 23:38:22
76,"#GoVegan and die both mentally and physically underdeveloped, or what? Need we remind you of the cucumber bacteria outbreak a few years ago? https://www.newscientist.com/article/dn20526-death-toll-rising-in-cucumber-bacteria-outbreak/ … Shame on you for trying to exploit the #coronavirus crisis!",2020-02-09 23:43:31
77,Coronavirus – gruesome pics show hundreds of barbecued dogs and raccoons as China raids illegal wildlife markets – The Sun https://www.thesun.co.uk/news/10887030/coronavirus-gruesome-animal-carcuses-china-crackdown-illegal-wildlife-markets/ …,2020-02-04 23:33:44
78,"#coronavirus #warning -- pets are not exotic animals. Corona is known to bats, crocodiles ( yes, Chinese eat crocodiles!) and other let me say unusual meat at #Chinese markets.",2020-02-02 23:58:50
79,"#coronavirus #WARNING: Antibiotics does not help against the virus. They are meant to treat bacteria infections. A virus is not an bacteria. Then, herbal treatment does also not work because there is no herb that curbs the virus.",2020-02-02 23:54:57
80,"When H1N1 virus broke out in the US, nobody called it American virus. How about you worry about your own country’s influenza B, which hold way more higher death rate than corona virus. Human race shall be united to fight the virus, yet you draw people’s attention to racism,shame!",2020-02-06 23:52:54
81,What a pity that the coronavirus didn't hit you,2020-02-03 23:55:37
82,"'Wholly inappropriate' quarantine practices may have helped spread coronavirus on the Diamond Princess cruise ship, experts say https://www.businessinsider.com/quarantine-may-have-helped-spread-cruise-ship-coronavirus-experts-say-2020-2 …",2020-02-15 23:50:10
83,"Scientists worry coronavirus could evolve into something worse than flu, says quarantined expert https://cnb.cx/3bq2dyE ",2020-02-11 23:54:06
84,Letters | Why coronavirus outbreak has made Hong Kong even more angry http://dlvr.it/RPrrD7 ,2020-02-11 23:46:33
85,"I’m not going anymore to UK due to this #Coronavirus, fucking hell find a vaccine asap, i need to follow @WWEUK everywhere!",2020-02-11 23:37:33
86,"Letters | Coronavirus crisis calls for compassion, not bigotry http://dlvr.it/RQMzfF  #Coronavirusoutbreak #EqualOpportunitiesCommissionEOCpic.twitter.com/V17ngftNJr",2020-02-19 23:56:36
87,Coronavirus deaths taper in Hubei province with 108 confirmed http://dlvr.it/RQMzdw  #Coronavirusoutbreak #CoronavirusoutbreakAllstoriespic.twitter.com/1mDtObE4Qa,2020-02-19 23:56:34
88,"#coronavirus in Iran: Videos in social media show Iranian Police Special Units in the entrance of Qom, the city that reported two death because of COVID-19 https://twitter.com/RadioZamaneh/status/1230268677376921600 …",2020-02-19 23:38:12
89,Hoping the situation of #Iran is a wake up call for #EuropeanUnion 2shut down all travels & schools immidiately to isolate state countries before its too late. #Covid19 #Coronavirus #TheNetherlands #Germany #France #Spain #Italy #Austria #Norway #Denmark #Portugal #Holland,2020-02-19 23:37:40
90,"Yeah, because Boston is groundzero of the coronavirus. Give me a break.",2020-02-19 23:21:20
91,China accused of under-reporting coronavirus outbreak - https://on.ft.com/2UO36LI  via @FT,2020-02-12 23:32:52
92,Damn coronavirus becoming a real problem in japan,2020-02-18 23:30:31
93,"#Coronavirus infection may be spread by people without symptoms, mounting evidence suggests https://www.inquirer.com/health/coronavirus-transmission-asymptommatic-nejm-german-report-20200218.html?__vfz=medium%3Dsharebar … via @phillyinquirer",2020-02-18 23:25:54
94,More than 3 million #Uyghurs and other Turkic people in #China’s concentration camps now face the risk of dying by starvation and #coronavirus.,2020-02-14 23:55:00
95,Coronavirus: #HongKong tourist arrival numbers go into free fall amid cross-border restrictions to tackle deadly outbreakhttps://www.scmp.com/news/hong-kong/hong-kong-economy/article/3050674/coronavirus-hong-kong-tourist-arrival-numbers-go …,2020-02-14 23:41:33
96,CORONA UNMASKED: Chinese Intelligence Officer Reveals True Magnitude of China’s Fake “Coronavirus” Crisis | The UFO Spotlight On… https://ufospotlight.wordpress.com/2020/02/13/chinese-intelligence-officer-reveals-true-magnitude-of-chinas-coronavirus-crisis/ …,2020-02-14 23:33:04
97,"Letters | As Hong Kong fumbles, Europe shows the way on coronavirus crisis http://dlvr.it/RQ0HlB ",2020-02-13 23:49:34
98,Restaurant group shutters hotpot chains amid coronavirus fears http://dlvr.it/RQ0Hl7 ,2020-02-13 23:49:33
99,Apple will miss quarterly earnings estimates due to coronavirus https://www.axios.com/apple-will-miss-quarterly-earnings-estimates-due-to-coronavirus-558c2871-eea6-47b6-9ab8-c0b1cd3f96ce.html …,2020-02-17 23:57:30
100,Coronavirus clouds Apple's timeline for new iPhones http://dlvr.it/RQlPGP pic.twitter.com/sextTiWIu6,2020-02-25 23:59:03
101,"Coronavirus crimping alumina supply but smelting impact unclear, Alcoa says http://dlvr.it/RQlNv9 ",2020-02-25 23:53:32
102,"The demented dems are wishing to use the Corona virus against our President Trump. 
They need reported. pic.twitter.com/q3sMsOyFgV",2020-02-28 23:56:12
103,Over 5000 Pigs Buried & burnt alive due to the Spread of #Coronavirus #B... https://youtu.be/8sqbNWDGVyA  via @YouTube,2020-02-21 23:58:09
104,10 Italian towns in lockdown over COVID-19 coronavirus fears https://www.rawstory.com/2020/02/10-italian-towns-in-lockdown-over-covid-19-coronavirus-fears/ …,2020-02-21 23:33:33
105,"Epidemics grow in ignorance!Trumpland is full of ignorance! You suppose if Corona virus attacks poor third world stars like ""red states"",it will carry on and eliminate many voters, naturally?Like instead of war to limit population,a nice pandemic is less damage to infrastructure! https://twitter.com/RawStory/status/1231360713161105409 …",2020-02-22 23:46:43
106,Iran’s hardliners ahead in election marred by coronavirus threat http://dlvr.it/RQYs9h  #Coronavirusoutbreak #CoronavirusoutbreakAllstoriespic.twitter.com/daQBsoeB1Q,2020-02-22 23:33:32
107,"Worldwide, more than 81,000 people have been infected with the #coronavirus and more than 2,700 have died pic.twitter.com/pRcQUylHWJ",2020-02-26 23:58:00
108,"#Coronavirus threat to YOUR holiday: Millions of trips are at risk as BA cancels flights and fresh cases are reported across Europe from Norway to Greece and on every continent except Antarctica

https://www.dailymail.co.uk/news/article-8048853/Coronavirus-threat-holiday-Millions-trips-risk-BA-cancels-flights.html …pic.twitter.com/5AavZIt45C",2020-02-26 23:56:32
109,"The incompetent manner in which Trump is handling the “CORONAVIRUS” is DANGEROUS
I will not advice anyone to attend his Rallies… 
HE IS DANGEROUS
https://twitter.com/gtconway3d/status/1232868990898376705?s=20 …",2020-02-27 23:59:51
110,And in one month he will fired Mike Pence for not controll the Corona virus.,2020-02-27 23:58:43
111,"@RealJamesWoods Honestly, I believe the coronavirus is China's way of dealing with those that were protesting for democracy back in November. Now, they can kill a lot of people and blame it in the virus. Something similar will happen in the U. S.",2020-02-27 23:58:37
112,"@POTUS loves us one and all and is not afraid of a little flu. It’s not the Coronavirus that’s killing people.7.7 billion people in world 83,00 have the flu 2,800 dead. What’s killing theworld is Anarchist who are spreading lies and chaos keeping essential workers and people home https://twitter.com/thehill/status/1233085637231665153 …",2020-02-27 23:58:19
113,Markets are ‘getting ready for something worse’ amid coronavirus chaos: Expert https://www.rawstory.com/2020/02/markets-are-getting-ready-for-something-worse-amid-coronavirus-chaos-expert/ …,2020-02-27 23:55:30
114,RT @AdamJKucharski: Useful summary of evidence that the observed declines in COVID-19 epidemics across Europe were the result of difference…,Sat Jun 13 07:52:18 +0000 2020
115,"RT @francediplo_EN: #COVID19 
Travel restrictions to France from European countries will be lifted from 15 June, except:
By ✈️from 🇪🇸: rest…",Sat Jun 13 09:53:42 +0000 2020
116,"RT @Maryam_Rajavi: Ali Younesi has contracted the #COVID19 disease in Evin Prison, a flagrant crime against humanity despite previous warni…",Sat Jun 13 10:03:49 +0000 2020
117,Policymakers in Europe should use the disruptions caused by #COVID19  to reflect and reset the discussions on the C… https://t.co/YIjTEbnzAF,Sat Jun 13 10:37:01 +0000 2020
118,RT @SAfridiOfficial: I’ve been feeling unwell since Thursday; my body had been aching badly. I’ve been tested and unfortunately I’m covid p…,Sat Jun 13 09:52:26 +0000 2020
