,Tweets,Date
0,"#Trump, challenged by a reporter over his claim #coronavirus deaths will fall to zero, responds 'well, they eventually will'. Of course they will tend in that direction when all the vulnerable are dead.",2020-04-29 23:52:18+00:00
1,"U.S. coronavirus outbreak soon to be deadlier than any flu since 1967 as deaths top 60,000 https://bit.ly/3bL2H26 #usa #coronavirus #covid19",2020-04-29 23:42:45+00:00
2,"After aggressive mass testing, Vietnam says it contains coronavirus outbreak ",2020-04-29 23:46:53+00:00
3,Coronavirus death toll surpasses U.S. casualties from Vietnam War ,2020-04-29 23:19:34+00:00
4,"Australia and New Zealand Banking Group Ltd deferred a decision on its interim dividend and posted a 60% fall in first-half cash profit on Thursday, as bad loan charges rose due to economic challenges triggered by the coronavirus pandemic. ",2020-04-29 23:09:09+00:00
5,"Pakistan begins colossal tree planting campaign - a staggering 10 billion trees will be planted starting now in order to combat climate change using 60,000 workers who have lost their jobs because of the coronavirus - ",2020-04-29 22:50:31+00:00
6,Fuel consumption in 2020 tanks under Covid-19 impact - https://bit.ly/2XgIH2q #thailand #coronavirus #covid19,2020-05-30 23:43:24+00:00
7,BBC News - Coronavirus declared global health emergency by WHO .He also said that there is no reason to limit international trade or travel to China. #CORONAVIRUS #ไวรัสโคโรน่าสายพันธุ์ใหม่,2020-01-30 23:56:34+00:00
8,"WUHAN CORONAVIRUS (2019-NCOV) — WHAT THE MSM IS FAILING TO REPORT, AND HOW THE OFFICIAL NUMBERS SIMPLY DON’T ADD-UP ",2020-01-30 23:52:22+00:00
9,Thousands of doctors and nurses are saying goodbye to their families as they're deployed to Wuhan to fight the #coronavirus outbreak. It has been described as a “coronavirus suicide mission”. #ServiceForHumanity #China,2020-01-30 23:38:45+00:00
10,The new coronavirus has been declared a global emergency by the World Health Organization,2020-01-30 23:33:56+00:00
11,"Is coronavirus worse than SARS in China? Our data analysis, updated https://news.cgtn.com/news/2020-01-30/Is-coronavirus-worse-than-SARS-in-China-Our-data-analysis-updated-NFsuzoahH2/index.html via @cgtnofficial",2020-01-30 23:30:54+00:00
12,@WHO declares #2019nCoV #coronavirus a public health emergency of international concern. ,2020-01-30 23:21:16+00:00
13,Watch live: NZ's response on coronavirus outbreak ,2020-01-30 22:53:55+00:00
14,Global Emergency! #CoronaVirus #WuhanVirus https://www.facebook.com/93889432933/posts/10157079611602934/?d=n,2020-01-30 22:53:52+00:00
15,#IRAN #Coronavirus Infected : 388 Deaths: 34 Official report. #coronavirus #China #Italy #covid19 #Wuhanoutbreak #chinanews #virus #Corona #news #japan #chinavorona #korea #Iran #News #Irancorona #koreacorona #Koreavirus,2020-02-28 12:11:11+00:00
16,"Thailand’s MoPH recommends that persons returning to Thailand from #COVID19 affected countries, and who do not have fever and symptoms, to place themselves in self-observation, at home for 14 days, avoiding public areas during this period. https://www.who.int/docs/default-source/searo/thailand/20200228-tha-sitrep-10-covid-19-final.pdf?sfvrsn=553c5e34_0",2020-02-28 11:02:16+00:00
17,"Here Are The 425 Billion Reasons Why WHO Refuses To Call The Covid-19 Outbreak A ""#Pandemic"" | Zero Hedge #Cahoots #coronavirus #COVID19 ",2020-02-28 10:32:40+00:00
18,"BREAKING NEWS! China Issues Statement That New Strain Of Coronavirus Is Behind Mysterious Viral Pneumonia Outbreaks...more..https://lnkd.in/fRVNCBu 
#China #Pneumonia #Coronavirus #NewStrain #ViralPneumonia #SARS #epidemic #health #breakingnews #news #chinesenewyearpic.twitter.com/VYL9mO3cZ2",2020-01-09 09:55:16
19,"A Chinese tourist has been quarantined in #Thailand with a mystery strain of coronavirus, the first time it has been detected outside China, the Thai Health Ministry have confirmed.
A https://bangkokjack.com/2020/01/13/chinese-woman-mystery-virus/ …pic.twitter.com/Hb3J6jhdQC",2020-01-13 12:26:39
20,The Min of Health will enforce strict health checks (of incoming tourists) during this Chinese New Year holiday period after reporting the first confirmed case of a new stain of the corona virus https://twitter.com/PPTVHD36/status/1216681723523551232 …,2020-01-13 11:34:56
21,"Thailand detects first Corona virus infected patient 
https://en.vietnamplus.vn/thailand-detects-first-corona-virus-infected-patient/167251.vnp …",2020-01-13 11:21:42
22,"Thailand confirms a Chinese tourist, having infected with the new coronavirus from China’s Wuhan. Her illness was detected at Suvarnabhumi Airport on Jan 8 and she is now receiving treatment at Bamrasnaradura Infectious Diseases Institute in Nonthaburi. @TNAMCOTpic.twitter.com/V4zeAkfuFo",2020-01-13 07:05:31
23,New post (Confirmed: China Visitor to Thailand Infected with New Coronavirus Strain) has been published on Phuket Travel Tips And Advise - https://www.hoteldealsphuket.com/phukettraveltips/confirmed-china-visitor-to-thailand-infected-with-new-coronavirus-strain/ …,2020-01-15 17:00:47
24,"China Issues Statement Indicating That the New Virus Causing Pneumonia Could Spread Between Humans...more...https://www.thailandmedical.news/news/china-issues-statement-indicating-that-the-new-virus-causing-pneumonia-could-spread-between-humans …
#China #Pneumonia #coronavirus #SARS #virus #health #respiratory #epidemic #news #transmissionspic.twitter.com/LwQLcMOStE",2020-01-15 13:17:35
25,"If anyone close to you has just returned from #China, #Wuhan city in particular, and begins to show symptoms of a fever, cough, sore throat, shortness of breath, difficulty breathing, they should see a doctor as early as possible to receive proper treatment. #coronavirus https://twitter.com/WHO/status/1217151178884222976 …",2020-01-15 09:05:33
26,"61 year old Chinese tourist being treated for new coronavirus in Thailand - more at https://thethaiger.com/news/national/61-year-old-chinese-tourist-being-treated-for-new-coronavirus-in-thailand … #Thailand
A 61 year old Chinese tourist, found to be infected with the new strain of coronavirus dubbed ""Wuhan or Chinese pneumonia"" when she arrived in Thailand last w... pic.twitter.com/7scnqyxaYV",2020-01-14 09:09:23
27,Chinese visitor to Thailand has new Coronavirus strain https://www.tvnz.co.nz/one-news/world/chinese-visitor-thailand-has-new-coronavirus-strain … via @1NewsNZ,2020-01-14 08:26:34
28,"61yo Chinese woman who arrived at January 8, the first person in Thailand with a confirmed case of ‘New Coronavirus Pneumonia’ aka “mystery Wuhan pneumonia.” The mystery virus was identified by Chinese scientists,",2020-01-14 04:43:23
29,"Bangkok Post headlines on Tuesday: 
PM says rallies 'waste of time' https://www.bangkokpost.com/thailand/politics/1834939/pm-says-rallies-waste-of-time …
Tourist hit by coronavirus https://www.bangkokpost.com/thailand/general/1834934/tourist-hit-by-coronavirus …
Speed limit hike 'to cut crashes' https://www.bangkokpost.com/thailand/general/1835089/speed-limit-hike-to-cut-crashes … #Thailandpic.twitter.com/Pgq2yLTU44",2020-01-14 00:37:14
30,"BREAKING NEWS!

China Health Authorities Report First Death From Mysterious Viral Pneumonia Outbreak...more..https://www.thailandmedical.news/news/china-health-authorities-report-first-death-from-mysterious-viral-pneumonia-outbreak …
#China #pneumonia #breakingnews #death #epidemic #health #Warning #viral #SARS #Coronavirus pic.twitter.com/sRJIWsQ8l3",2020-01-11 10:43:00
31,Japan confirms first case of infection with new China coronavirus | Article [AMP] | Reuters https://uk.reuters.com/article/us-china-health-pneumonia-japan-idUKKBN1ZF02Z …,2020-01-16 08:43:21
32,"New Pneumonia Virus From China Spreads To Japan...more..https://www.thailandmedical.news/news/new-pneumonia-virus-from-china-spreads-to-japan …
#China #Japan #virus #pneumonia #coronavirus #health #news #BreakingNews #SARS #warning #epidemicpic.twitter.com/KwrfuDOnSI",2020-01-16 08:33:40
33,RT @KhaosodEnglish: Japan Confirms 1st Case of Coronavirus Infection From China (Kyodo) https://buff.ly/2Tr82Fp ,2020-01-16 06:30:01
34,Japan Confirms 1st Case of Coronavirus Infection From China (Kyodo)  http://www.khaosodenglish.com/news/international/2020/01/16/japan-confirms-1st-case-of-coronavirus-infection-from-china …,2020-01-16 05:46:13
35,TOKYO: Japan confirmed the first case of infection from the new China coronavirus that has killed one person and prompted a travel alert from the US State Department. #BangkokPost #World https://www.bangkokpost.com/world/1837034/japan-confirms-first-case-of-infection-with-new-china-coronavirus …,2020-01-16 03:41:24
36,"More coronavirus cases detected in China, global alert for Chinese New Year - more at https://thethaiger.com/news/world/more-coronavirus-cases-detected-in-china-global-alert-for-chinese-new-year … #China #Coronavirus #Spread #Screening #US #Thailand
Chinese medical officials have now reported four more cases of the viral pneumonia strain caused by a new coronav...pic.twitter.com/QcqijAuuVQ",2020-01-19 07:19:25
37,"#Thailand's second case of a Chinese national infected with Novel #Coronavirus 2019 was confirmed on Thursday night while lab results for a Thai suspected of being infected are pending.
China reports 17 new cases of mystery virus. https://www.bangkokpost.com/thailand/general/1839049/china-reports-17-new-cases-of-mystery-virus …",2020-01-19 06:24:40
38,The Wuhan novel coronavirus no human-to-human transmission narrative is unraveling. Expect to hear a lot more about this virus in the days and weeks ahead. https://twitter.com/Fla_Medic/status/1218751450244964353 …,2020-01-19 04:54:04
39,Coronavirus: what airport measures are in place to detect sick passengers? https://www.theguardian.com/world/2020/jan/18/coronavirus-what-airport-measures-are-in-place-to-detect-for-sick-passengers?CMP=share_btn_tw …,2020-01-18 22:04:29
40,"BREAKING NEWS! Study From London Research Centre Says almost Two Thousand People Infected With Mysterious Virus In China..more..https://www.thailandmedical.news/news/study-from-london-research-centre-says-almost-two-thousand-people-infected-with-mysterious-virus-in-china …
#pandemic #virus #China #pneumonia #coronavirus #deaths #epidemic #health #breakingnews #newspic.twitter.com/7ZTYxNVBop",2020-01-18 14:34:29
41,"#Coronavirus #Outbreak #Pneumonia 
""We estimate that a total of 1,723 cases of 2019-nCoV in Wuhan City (95% CI: 427 – 4,471) had onset of symptoms by 12th January 2020 (the last reported onset date of any case).""https://twitter.com/MRC_Outbreak/status/1218175738337284096 …",2020-01-18 08:14:23
42,Coronavirus: more cases and second death reported in China #epidemichttps://www.theguardian.com/world/2020/jan/17/corona-second-death-in-china-after-sars-like-outbreak?CMP=Share_iOSApp_Other …,2020-01-18 08:11:03
43,"America Begins Airport Screenings As SARS-Linked Virus Kills 2 In China...more..https://www.thailandmedical.news/news/america-begins-airport-screenings-as-sars-linked-virus-kills-2-in-china …
#China #SARS #Coronavirus #epidemic #deaths #pneumonia #virus #airports #Screenings #news #breakingnews #America #US #Chinesepic.twitter.com/hGW8M0a5b3",2020-01-18 02:41:01
44,"Japan and Thailand have confirmed new cases of the coronavirus, sparking fears that the virus will spread further outside of China’s borders.

IDSA Global Health Committee Member Daniel Lucey, MD, FIDSA, provides updates on the outbreak on Science... https://bit.ly/2FXVOwj ",2020-01-17 17:14:23
45,"#Coronavirus : second death in #China after Sars-like outbreak https://www.theguardian.com/world/2020/jan/17/corona-second-death-in-china-after-sars-like-outbreak?CMP=share_btn_tw …
@guardiannews",2020-01-17 15:36:28
46,Second Chinese tourist found infected with coronavirus https://wp.me/p1onxg-gMS  #Chinese #CoronaVirus #Outbreak,2020-01-17 08:33:41
47,"Thailand finds second case of new Chinese virus, says no outbreak #epidemic #coronavirus https://reut.rs/36558Zz ",2020-01-17 07:53:08
48,A second case of infection with a new Chinese coronavirus has been found in Thailand as health authorities ramp up checks on Chinese visitors arriving for the Lunar New Year holiday. #BangkokPost #Thailandhttps://www.bangkokpost.com/thailand/general/1838009/second-chinese-tourist-found-infected-with-coronavirus …,2020-01-17 07:42:34
49,Scary stuff #coronavirus https://twitter.com/ABC/status/1217986675273609217 …,2020-01-17 06:16:53
50,"Officials in China’s Wuhan city revealed that another man had died after being infected by the coronavirus.
#China #corona_virus #TheNationThailandhttps://www.nationthailand.com/news/30380691 ",2020-01-17 05:48:36
51,China confirms second death from coronavirus infection #ศาสตร์เกษตรดินปุ๋ย https://sootinclaimon.wordpress.com/2020/01/17/china-confirms-second-death-from-coronavirus-infection-%e0%b8%a8%e0%b8%b2%e0%b8%aa%e0%b8%95%e0%b8%a3%e0%b9%8c%e0%b9%80%e0%b8%81%e0%b8%a9%e0%b8%95%e0%b8%a3%e0%b8%94%e0%b8%b4%e0%b8%99%e0%b8%9b%e0%b8%b8/ …pic.twitter.com/rOzMM9zeDO,2020-01-17 05:07:27
52,China confirms second death from coronavirus infection #ศาสตร์เกษตรดินปุ๋ย https://sootinclaimon.wordpress.com/2020/01/17/china-confirms-second-death-from-coronavirus-infection-%e0%b8%a8%e0%b8%b2%e0%b8%aa%e0%b8%95%e0%b8%a3%e0%b9%8c%e0%b9%80%e0%b8%81%e0%b8%a9%e0%b8%95%e0%b8%a3%e0%b8%94%e0%b8%b4%e0%b8%99%e0%b8%9b%e0%b8%b8/ …pic.twitter.com/SsjYmjVg4Z,2020-01-17 05:07:26
53,Japanese man who visited Wuhan infected with coronavirus #ศาสตร์เกษตรดินปุ๋ย https://sootinclaimon.wordpress.com/2020/01/17/japanese-man-who-visited-wuhan-infected-with-coronavirus-%e0%b8%a8%e0%b8%b2%e0%b8%aa%e0%b8%95%e0%b8%a3%e0%b9%8c%e0%b9%80%e0%b8%81%e0%b8%a9%e0%b8%95%e0%b8%a3%e0%b8%94%e0%b8%b4%e0%b8%99%e0%b8%9b/ …pic.twitter.com/Uypo2r0OIK,2020-01-17 04:51:29
54,Japanese man who visited Wuhan infected with coronavirus #ศาสตร์เกษตรดินปุ๋ย https://sootinclaimon.wordpress.com/2020/01/17/japanese-man-who-visited-wuhan-infected-with-coronavirus-%e0%b8%a8%e0%b8%b2%e0%b8%aa%e0%b8%95%e0%b8%a3%e0%b9%8c%e0%b9%80%e0%b8%81%e0%b8%a9%e0%b8%95%e0%b8%a3%e0%b8%94%e0%b8%b4%e0%b8%99%e0%b8%9b/ …pic.twitter.com/DwR6MUWDFC,2020-01-17 04:51:28
55,"The #coronavirus outbreak, if prolonged until March, could cost the #Thai tourism industry between Bt80 billion to Bt100 billion or between 0.5 percentage point and 0.7 https://bangkokjack.com/2020/01/29/coronavirus-thailand-100-billion-baht/ …pic.twitter.com/hSN1PK80fg",2020-01-28 23:58:08
56,"The 20 officers inspecting the navy's submarine construction in China's city of Wuhan -- the epicentre of the new coronavirus outbreak -- have not been affected by the disease, according to the navy. #BangkokPost #Thailandhttps://www.bangkokpost.com/thailand/general/1843569/officials-watching-over-sub-in-wuhan-safe-from-virus …",2020-01-25 23:54:37
57,"Public health and airport authorities are doubling down on efforts to prevent an outbreak by screening travellers from cities near China's Wuhan, as they step up a probe into a suspected new coronavirus case in Hua Hin. #BangkokPost #Thailandhttps://www.bangkokpost.com/thailand/general/1843564/thermal-screening-for-all-china-arrivals …",2020-01-25 23:54:37
58,Japan braces for Chinese New Year tourist influx as concerns over coronavirus grow | The Japan Times https://www.japantimes.co.jp/news/2020/01/25/national/japan-second-case-coronavirus/#.XizSgIsmmzA.twitter …,2020-01-25 23:42:58
59,"In #China, authorities have expanded the number of cities on lockdown to 10, affecting some 33 million people, as medical workers struggle to slow the spread of a novel strain of #coronavirus.
At https://bangkokjack.com/2020/01/26/quarantined-china-coronavirus/ …pic.twitter.com/KhQPd60PVO",2020-01-25 23:42:43
60,BBC News - Coronavirus declared global health emergency by WHO .He also said that there is no reason to limit international trade or travel to China. #CORONAVIRUS #ไวรัสโคโรน่าสายพันธุ์ใหม่https://www.bbc.com/news/world-51318246 …,2020-01-30 23:56:34
61,Thousands of doctors and nurses are saying goodbye to their families as they're deployed to Wuhan to fight the #coronavirus outbreak. It has been described as a “coronavirus suicide mission”. #ServiceForHumanity #Chinapic.twitter.com/Om4LLRQi93,2020-01-30 23:38:45
62,"Dow falls more than 100 points amid first US case of coronavirus, big decline in Boeing - https://www.cnbc.com/2020/01/21/us-futures-point-sharply-lower.html …",2020-01-21 23:36:14
63,"The fate of Thai students in Wuhan hangs in the balance after authorities locked down the city in central China to control the outbreak of the deadly coronavirus, preventing Thailand from evacuating 64 of its nationals. #BangkokPost #Thailandhttps://www.bangkokpost.com/thailand/general/1844944/thais-in-wuhan-living-under-shadow-of-deadly-virus …",2020-01-27 23:56:09
64,"The Department of National Parks, Wildlife and Plant Conservation plans to screen cave bats amid health concerns after the creatures might be linked to the outbreak of the deadly Wuhan coronavirus in China. #BangkokPost #Thailandhttps://www.bangkokpost.com/thailand/general/1846454/bats-face-checks-over-virus-fears …",2020-01-29 23:33:02
65,"Bangkok Post headlines on Monday: 
Wuhan evacuation plan eyed https://www.bangkokpost.com/thailand/general/1844174/wuhan-evacuation-plan-eyed …
Crisis deals B50bn hit to tourism https://www.bangkokpost.com/thailand/general/1844209/crisis-deals-b50bn-hit-to-tourism … #Thailand #ไวรัสโคโรน่า #coronavirus pic.twitter.com/LTK0nfE0Bv",2020-01-26 23:55:19
66,WHO Chief Traveling to Beijing to Discuss Coronavirus Outbreak With Chinese Officials: https://sputniknews.com/asia/202001261078144025-who-chief-traveling-to-beijing-to-discuss-coronavirus-outbreak/ … via @SputnikInt,2020-01-26 23:48:49
67,"In January, the Thai equity market was buffeted by several negative factors. The spread of the coronavirus drove the SET index sharply lower to finish the month at 1.514.14 points. #BangkokPost #Businesshttps://www.bangkokpost.com/business/1853089/three-investment-themes-for-february …",2020-02-07 23:58:41
68,"As coronavirus travel restrictions keep Chinese tourists at home, a world that has grown dependent on them feels their absence https://www.washingtonpost.com/world/europe/coronavirus-as-chinese-tourists-stay-home-a-world-that-has-grown-dependent-on-them-feels-their-absence/2020/02/07/0ff7a37e-46a4-11ea-91ab-ce439aa5c7c1_story.html …",2020-02-07 23:51:25
69,Coronavirus Outbreak Is Affecting Nintendo Switch Supply in Japan via @Entrepreneur @jonfingashttp://entm.ag/6va1 ,2020-02-07 23:37:25
70,Will you come to Asia? Please come after Corona virus has been cleared.,2020-02-04 23:33:38
71,"Bangkok Post headlines on Sunday:
Thais to be flown home from Wuhan https://www.bangkokpost.com/thailand/general/1848569/thais-to-be-flown-home-from-wuhan …
Coronavirus deals severe blow to tourism industry https://www.bangkokpost.com/thailand/special-reports/1848579/coronavirus-deals-severe-blow-to-tourism-industry … #ไวรัสโคโรน่า #coronavirus #Thailandpic.twitter.com/9wAKGQuctS",2020-02-01 23:46:28
72,"17 Surat Thani students fly back from Hubei, test negative for coronavirus - https://thai.vi/36QgiSD pic.twitter.com/228eullT9x",2020-02-01 23:41:20
73,"The novel coronavirus outbreak in China and other parts of the world has struck fear among the masses, with a global health emergency declared by the World Health Organization (WHO). #BangkokPost #Businesshttps://www.bangkokpost.com/business/1849349/a-study-in-panic …",2020-02-02 23:38:44
74,The World Health Organization warns the evacuation of nationals from China to their home countries carries the risk of spreading the deadly coronavirus. https://www.voacambodia.com/a/5263837.html ,2020-02-02 23:29:22
75,Deputy Prime Minister Somkid Jatusripitak has asked the public not to panic about the coronavirus outbreak or economic problems by giving assurances that Thailand will be steered through difficult times. #BangkokPost #Businesshttps://www.bangkokpost.com/business/1852059/somkid-tells-public-not-to-panic …,2020-02-06 23:59:50
76,"[Thu, 06 Feb 2020 23:54:30 +0000] [Espeednews] Chinese Crypto Mine Stop or Stall Operations Due to Coronavirus Outbreak - https://espeednews.com/2020/02/06/chinese-crypto-mine-stop-or-stall-operations-due-to-coronavirus-outbreak/ …",2020-02-06 23:54:57
77,Chinese doctor who raised early alarm over coronavirus dies https://thai.vi/385tHY9  #WorldNewspic.twitter.com/jTQKurzjFf,2020-02-06 23:47:59
78,Deputy Prime Minister Somkid Jatusripitak has asked the public not to panic about the coronavirus outbreak or economic problems by giving assurances that Thailand will be steered through difficult times. #BangkokPost #Thailandhttps://www.bangkokpost.com/thailand/general/1852059/somkid-tells-public-not-to-panic …,2020-02-06 23:38:34
79,"News • Re: China Coronavirus: Here we have a young, healthy 34 year old. Coronavirus kills Chinese whistleblower doctor https://www.bbc.com/news/world-asia-china-51403795 … A Chinese doctor who tried to issue the first warnings about the deadly coronavirus outbreak has died, the… http://dlvr.it/RPXfvh ",2020-02-06 23:37:02
80,"#Thailand is estimating the tourism loss due to coronavirus will be about 1.6 billion US Dollars.
Last year 340 Chinese speaking tour guides in Thailand took care of groups of 60-70 Chinese visitors. https://bangkokjack.com/2020/02/04/billion-dollar-tourism-loss/ …pic.twitter.com/GaOniFnzug",2020-02-03 23:55:11
81,Prime Minister Prayut Chan-o-cha on Monday threatened swift legal action against people who politicise the government's handling of the coronavirus outbreak and the ultra-fine dust pollution to stoke public fears. #BangkokPost #Thailandhttps://www.bangkokpost.com/thailand/politics/1849794/dont-politicise-outbreak-pm …,2020-02-03 23:52:15
82,"Frightened Asian tourists cancel flights, stay home
The South Korean government’s advisory to its citizens to delay trips to countries and territories where the Covid-19 coronavirus has been found has resulted in numerous flight cancellations to… https://news-guru-magazine.blogspot.com/2020/02/frightened-asian-tourists-cancel.html …pic.twitter.com/Z9yymRlcol",2020-02-15 23:49:41
83,Asia-Pacific currencies (incl the THB) tumble under the weight of the coronavirus https://on.ft.com/39jPmfE ,2020-02-11 23:46:07
84,"With stricken cruise ship, Japan draws criticism over coronavirus response https://bit.ly/328U8KB  #WorldNewspic.twitter.com/MTvWE85YZG",2020-02-19 23:32:20
85,"""Coronavirus poses risks to fragile recovery in global economy - IMF""

https://uk.investing.com/news/economy/coronavirus-poses-risks-to-fragile-recovery-in-global-economy--imf-2055025 …",2020-02-19 23:31:54
86,Coronavirus deaths taper in Hubei province with 108 confirmed https://www.scmp.com/news/china/society/article/3051492/coronavirus-deaths-taper-hubei-108-confirmed-thursday … via @scmpnews,2020-02-19 23:29:09
87,"Coronavirus 'bioweapon theory' is bogus, say 27 experts in Lancet https://news.cgtn.com/news/2020-02-19/Lancet-releases-statement-supporting-Chinese-scientists--Od24bUkvOE/index.html … via @cgtnofficial",2020-02-19 23:17:04
88,"Airport suffers worst January in five years amid protests, coronavirus https://www.scmp.com/news/hong-kong/transport/article/3050858/coronavirus-hong-kong-airport-suffers-worst-january-five … via @scmpnews",2020-02-16 23:27:48
89,"Coronavirus is not here yet, but the Chinese panic order and shopping army must be here already. And they must be big buyers from the factories.",2020-02-18 23:50:43
90,Treasury yields fall after surge in reported coronavirus cases - https://www.cnbc.com/2020/02/13/us-bonds-treasury-yields-in-focus-after-surge-in-coronavirus-cases.html …,2020-02-13 23:58:02
91,"China reports big rise in coronavirus deaths, WHO sees no 'tip of iceberg' https://bit.ly/3bE5WZo  #WorldNewspic.twitter.com/CmAaelcW1M",2020-02-13 23:56:53
92,A Thai working in the United Kingdom was physically assaulted in what he claimed was a racist attack linked to the current global coronavirus outbreak. #BangkokPost #Thailandhttps://www.bangkokpost.com/thailand/general/1859664/racist-london-attack-on-thai …,2020-02-17 23:41:24
93,"Kind of insane that the frontline #Chinese medical personnel have to buy their own masks & protective equipment while fighting #coronavirus. No excuse for this, powers that be in #Beijing #China. #WuFlu #WuhanFluhttps://www.nytimes.com/2020/02/14/world/asia/china-coronavirus-doctors.html?smid=tw-nytimes&smtyp=cur …",2020-02-17 23:37:30
94,"A Bloodbath in Wall Street, Dow Plunges over 1,000pts as Fears over Coronavirus Rise - https://www.kaohoon.com/content/343727 pic.twitter.com/WWro2fhknc",2020-02-24 23:58:10
95,Coronavirus: Store Shelves Empty as Panic Buying Hits Italy https://www.infowars.com/coronavirus-store-shelves-empty-as-panic-buying-hits-italy/ …,2020-02-24 23:51:51
96,Maybe we need a coronavirus outbreak so we get quarantined. That should help the air quality!,2020-02-24 23:51:15
97,"NZ Coronavirus: patient who travelled from Iran not subject to health checks upon arrival and now they want other travellers from Iran to 'self-isolate' after the fact - this is a failure, reflecting a weak governance and the unrealistic PC world of NZ 
 https://www.stuff.co.nz/national/health/119913458/coronavirus-new-zealand-patient-not-subject-to-health-checks-upon-landing-at-auckland-airport …",2020-02-28 23:59:39
