,Tweets,Date
0,A timeline of Trump's 100 days of deadly coronavirus denial - Mother Jones https://nzzl.us/ymoXaX8 via @nuzzel thanks @russchoma,2020-04-29 23:48:01+00:00
1,"After aggressive mass testing, Vietnam says it contains coronavirus outbreak ",2020-04-29 23:46:53+00:00
2,"China continues to pose a threat to the world by hiding information about the origin of the coronavirus, U.S. Secretary of State Mike Pompeo says. https://www.bloomberg.com/news/articles/2020-04-29/pompeo-says-china-responsible-for-outbreak-must-detail-origin via @bpolitics",2020-04-29 23:20:18+00:00
3,"COVID-19 caused strokes in young people who had mild coronavirus symptoms, NYC doctors say https://www.usatoday.com/story/news/health/2020/04/29/coronavirus-covid-19-caused-strokes-young-patients-nyc-doctors/3046447001/ via @usatoday",2020-04-29 23:25:14+00:00
4,Opinion: Coronavirus panic shows how little China has learned since SARs #WuhanCoronavirus #publichealth,2020-01-30 23:11:48+00:00
5,#coronavirus emergency ,2020-01-30 23:06:04+00:00
6,"What it means for coronavirus outbreak to be at the WHO's ""highest level of alert"" https://edition.cnn.com/asia/live-news/coronavirus-outbreak-02-28-20-intl-hnk/h_27a7eeed180e54e7ff3f59f4db825053 #coronavirus #2019nCoV #virus #chinavirus #wuhan #sos #COVID19",2020-02-28 20:08:47+00:00
7,There are now 821 coronavirus cases in Italy https://edition.cnn.com/asia/live-news/coronavirus-outbreak-02-28-20-intl-hnk/h_92bf7cd7acc4ed0b8cdd53b6043bb00f #coronavirus #2019nCoV #virus #chinavirus #wuhan #sos #COVID19,2020-02-28 20:07:54+00:00
8,European stocks fall another 4.2% and sink further into correction territory as coronavirus grips markets https://www.cnbc.com/2020/02/28/europe-markets-coronavirus-hammers-global-stocks.html?__source=sharebar|twitter&amp;par=sharebar #coronavirus #2019nCoV #virus #chinavirus #wuhan #sos #COVID19,2020-02-28 11:09:41+00:00
9,"Coronavirus live updates: New Zealand, Nigeria report first cases, China’s death toll over 2,700 https://www.cnbc.com/2020/02/28/coronavirus-latest-updates-china-hubei-south-korea.html?__source=sharebar|twitter&amp;par=sharebar #coronavirus #2019nCoV #virus #chinavirus #wuhan #sos #COVID19",2020-02-28 11:09:07+00:00
10,Global stocks head for worst week since the financial crisis amid fears of a possible pandemic https://www.cnbc.com/2020/02/28/global-stocks-head-for-worst-week-since-financial-crisis-on-coronavirus-fears.html?__source=sharebar|twitter&amp;par=sharebar #coronavirus #2019nCoV #virus #chinavirus #wuhan #sos #COVID19,2020-02-28 11:01:48+00:00
11,US removes Vietnam from list of areas vulnerable to community spread of #SARSCOV19 https://vietnamnews.vn/society/652860/us-removes-viet-nam-from-list-of-areas-vulnerable-to-community-spread-of-sars-cov-19.html #coronavirus #Vietnam #US #COVID19 ,2020-02-28 09:13:47+00:00
12,"First death from China mystery illness outbreak

Man dies in outbreak that has infected 41 people as early tests point to new type of the coronavirus responsible for Sars epidemic
 https://amp.theguardian.com/world/2020/jan/11/china-mystery-illness-outbreak-causes-first-death?CMP=share_btn_tw&__twitter_impression=true …",2020-01-12 07:30:14
13,"#coronavirus

Local authorities in central China's city of Wuhan said Thursday that a 69-year-old man died the previous day of pneumonia caused by a new coronavirus, bringing the total number of deaths linked to the virus to two.

https://english.kyodonews.net/news/2020/01/88c29e019e03-update1-china-announces-2nd-death-from-new-coronavirus.html …",2020-01-16 21:42:34
14,"#coronavirus #vietnam
Two feverish Chinese nationals coming from Wuhan City were quarantined after landing in Da Nang airport Tuesday.https://e.vnexpress.net/news/news/two-chinese-quarantined-in-da-nang-amid-pneumonia-fears-4042708.html …",2020-01-16 01:00:07
15,"#coronavirus: #China reports 17 new cases of #Sars-like mystery virus

Three of the new cases are severe, with experts worried about the disease’s spread ahead of #lunar new year.

https://amp.theguardian.com/world/2020/jan/19/coronavirus-china-reports-17-new-cases-of-sars-like-mystery-virus …",2020-01-19 08:04:32
16,Coronavirus outbreaks in Asia pic.twitter.com/nvAMyBEepz,2020-01-18 11:00:19
17,"""China’s Coronavirus Has Revived Global Economic Fears"" by Peter S. Goodman via NYT https://ift.tt/30WdEtc ",2020-01-27 23:46:03
18,"The downside of Xi Jinping's top-down control system is that no one takes action until they are approved by the highest authorities, and then overreact to satisfy the request for top management. on. This is evident in the outbreak of the corona virus disease in Wuhan.",2020-02-08 23:33:37
19,"Coronavirus Update: 9 cases in US,  Shubei province reports 56 new coronavirus deaths https://ift.tt/36Q9Vi0 ",2020-02-02 23:42:20
20,"Coronavirus Update: 9 cases in US, Hubei province reports 56 new coronavirus deaths https://ift.tt/37Sqknp ",2020-02-02 23:31:22
21,"Coronavirus Update: 9 cases in US, Hubei province reports 56 new coronavirus deaths https://ift.tt/2uWYJmu ",2020-02-02 23:29:11
22,"""Coronavirus Live Updates: Wuhan to Round Up the Infected for Mass Quarantine Camps"" by Unknown Author via NYT https://ift.tt/38e6aER ",2020-02-06 23:39:19
23,"Coronavirus updates: Death toll rises to 1,770 as China reports 100 new fatalities in Hubei https://vietnaminsider.vn/coronavirus-updates-death-toll-rises-to-1770-as-china-reports-100-new-fatalities-in-hubei/ …pic.twitter.com/MNqEMgSCbT",2020-02-16 23:58:38
24,"China's Hubei province confirms another 1,933 new cases of coronavirus / 100 new deaths http://fxrank.net/forex-analysis-63075.html …",2020-02-16 23:55:24
25,"China's Hubei province confirms another 1,933 new cases of coronavirus / 100 new deaths http://fxvnpro.com/forex-news-62947.html …",2020-02-16 23:38:08
26,"China's Hubei province confirms another 1,933 new cases of coronavirus / 100 new deaths http://reviewbrokers.net/technical/forex-news-id-62294.html …",2020-02-16 23:35:26
27,"Coronavirus updates: Global death toll passes 2,000, Vietnam discharges two more infected patients https://vietnaminsider.vn/global-death-toll-passes-2000-vietnam-discharges-two-more-patients/ …pic.twitter.com/5svfvT5qBy",2020-02-18 23:41:30
28,"Coronavirus updates: Death toll rises to 1,868, Hundreds of Americans flown home from Diamond Princess cruise ship https://vietnaminsider.vn/death-toll-rises-to-1868-hundreds-of-americans-flown-home/ …pic.twitter.com/u87AElgSZr",2020-02-17 23:42:07
29,U.S. prepares for possible coronavirus outbreak https://vietnaminsider.vn/u-s-prepares-for-possible-coronavirus-outbreak/ …pic.twitter.com/dCJbbEMkZk,2020-02-21 23:48:10
30,China’s “Extremely Vile” Response to Novel Coronavirus https://youtu.be/P32yPkr1eGM  via @YouTube,2020-02-21 23:23:11
31,acute respiratory distress symptoms?  ARDS?  #covid19 #SARSCoV2 #coronavirus #2019nCoV,2020-02-22 23:57:38
32,USD/JPY extends losses below 111.50 as coronavirus spreads outside China http://reviewbrokers.net/technical/forex-news-id-62785.html …,2020-02-23 23:41:21
33,VPM Vu Duc Dam just cleared my worried thing: the bill for oppression of the #Covid19 in #Vietnam. He said it's a v… https://t.co/1VrvNaS3Zo,Sat Jun 13 10:52:40 +0000 2020
34,"One more case of COVID-19 infection, Vietnam has a total of 334 cases. After 58 days, Vietnam has absolutely no cas… https://t.co/T0ERulSN1S",Sat Jun 13 11:14:40 +0000 2020
35,"RT @BrunoRguezP: #US government disregards opinions of leaders, Congress members, international organizations and agencies.

It ignores cal…",Sat Jun 13 10:08:12 +0000 2020
36,Airlines suspend flights due to coronavirus outbreak https://vietnaminsider.vn/airlines-suspend-flights-due-to-coronavirus-outbreak/ …pic.twitter.com/wPzVRn1vJu,2020-03-09 23:58:48
37,World Health Organization describes coronavirus outbreak as pandemic https://reut.rs/2TZXhsf ,2020-03-11 23:57:46
38,"- President Donald Trump declared a U.S. national emergency for a rapidly spreading coronavirus on Friday, opening up the opportunity for more government aid to combat the pathogen that infected more than 138,000 people. worldwide, and left more than 5,000 dead.",2020-03-13 23:57:31
