"So this morning, I walked past the youngest, doodling. “Whatcha drawing?”, I asked. “Expectation vs Reality for Coronavirus”, she replied. Ummm... okay... sure! Dunno what I expected, but it wasn’t this...… https://www.instagram.com/p/B_lYe0bnRKd/?igshid=92c7fm2q6dw8"
So... I guess they’re going back to downplaying the #coronavirus 02 #FBR
"Not surprised that @benshapiro, the inspiration for white supremacist terrorists in multiple countries, has this perspective on elderly people's agonizing, suffocating, lonely death. #coronavirus "
I’m loving the hustling that’s coming from Coronavirus man this shit got a silver lining if you a hustler..
this should be criminal Tampa Bay Times: Florida officials asked state's medical examiners to withhold coronavirus death figures 
6 African Americans Die From Coronavirus After Attending South Carolina Funeral https://www.blackenterprise.com/6-african-americans-die-from-coronavirus-after-attending-south-carolina-funeral/ #SmartNews
"IN THIS NEW BOOK: ""Guide to Survival of the #Coronavirus in America."" See page 92 ""HVAC Systems &amp; Airborne Diseases"" It explains what hospitals already knew. That HVAC systems help spread diseases &amp; the risks of planes &amp; ships. https://VIPPUSA.ORG/free-book 14"
USING A SWAT TEAM TO COMBAT THE #CORONAVIRUS IS NOVEL FOR SURE. 02 #WednsdayWisdom
"Why every time i open up Twitter it’s some crazy shit , men rape , female rape , corona virus , niggas becoming rappers like shit ."
This Soo ghetto I woulda Knocked My Bitch Head loose Cause No This Ain’t Acceptable in public . #followhim #instacool #photo #photooftheday #tweegram #l4l #followshoutoutlikecomment #following #followforfollow #followall #likebackalways #followers #comment #coronavirus 
"Chris Hayes described Fox News' coverage of the pandemic as ""coronavirus trutherism."" https://www.huffpost.com/entry/chris-hayes-tucker-carlson-fox-news-coronavirus_n_5ea92ca5c5b6106b8ecf9031?ncid=engmodushpmg00000004 #via @HuffPostPol"
What is a reason to eat out in public? #coronavirus
"Now, this is the guy who takes no responsibility and recommended disinfectant injections and light therapy be used to kill the CoronaVirus. What fucking advice could this ass-clown possibly have? "
Dr. Dean Kindler joined @Wgxa and @VictoriaWGXA to discuss the impact of #coronavirus. View it here! 
"Jared Kushner Mocked For Calling Coronavirus Response ‘A Great Success Story.’ One Twitter user remarked, ""I wonder what he would consider to be a failure?"" - https://www.huffpost.com/entry/jared-kushner-mocked-great-success-story_n_5ea9b26ac5b61c645b83bcd5?ncid=engmodushpmg00000004 #via @HuffPostPol"
"""That money belongs to somebody else, somebody who needs it, you know,"" says Barbara Tarnow. ""It says he's deceased on the check."" #fox5atl #COVID19 #coronavirus #StimulusChecks"
"My last #coronavirus diaries is about how Americans aren't healthy, and it's making the effects of the disease worse. "
"""That money belongs to somebody else, somebody who needs it, you know,"" says Barbara Tarnow. ""It says he's deceased on the check."" #fox5atl #COVID19 #coronavirus #StimulusChecks"
INFECTIOUS DISEASE EXPERT & EPIDEMIOLOGIST-IN-CHIEF SAYS WE CAN USE THE FLU VACCINE TO FIGHT THE #CORONAVIRUS Medical experts at the WH have to patiently explain to him that his idea of using the flu vaccine to address the coronavirus will not work. #FBR
"Evening update: Number of Georgia coronavirus deaths rises to nearly 1,100, cases surpass 25.6K "
Jean Ralphio fakes the symptoms of coronavirus in order to attempt to sue the person who “infected” him.
"ALSO OF NOTE: Congress as a whole could be more susceptible to dangerous symptoms of the coronavirus. Sixty-six senators are over the age of 60 — fully two-thirds of the body, with more than a quarter over age 70. The average age of House members is 57.6 years per CRS via kasie"
Andy believes he is immune to the coronavirus because he was bitten by a bat years ago. April thinks that the symptoms of coronavirus would be cool to have but helps Leslie put her plan into action.
Model Projects 23K GA Deaths If Coronavirus Limits End In 4 Weeks http://dlvr.it/RVjq9Z
Model Projects 23K GA Deaths If Coronavirus Limits End In 4 Weeks http://dlvr.it/RVjq9K
Model Projects 23K GA Deaths If Coronavirus Limits End In 4 Weeks http://dlvr.it/RVjq83
Model Projects 23K GA Deaths If Coronavirus Limits End In 4 Weeks http://dlvr.it/RVjq8B
"But Burr’s no Lone Ranger. Sen. Kelly Loeffler Dumped $Millions in Stock After Her Jan. 24 #Coronavirus Briefing And helped downplay the COVID threat (while praising Trump/blaming Dems) as the virus spread, nationwide. | Daily Beast https://thedailybeast.com/sen-kelly-loeffler-dumped-millions-in-stock-after-coronavirus-briefing #InsiderTrading"
How This Local Real Estate Tycoon is Giving Frontline Workers Much Needed Piece of Mind for Their Families - Mark Spain https://www.myasbn.com/small-business-shows/atlanta-small-business-show/how-this-local-real-estate-tycoon-is-giving-frontline-workers-much-needed-piece-of-mind-for-their-families-mark-spain/ via @MyASBN @MarkSpainTeam #Atlanta #YMCA #Coronavirus #COVID-19
Know Your Employment Rights During the Coronavirus Pandemic | #employeefraud | #recruitment | #corporatesecurity | #ceo | #business | #security https://nationalcybersecuritynews.today/know-your-employment-rights-during-the-coronavirus-pandemic-employeefraud-recruitment-corporatesecurity-ceo-business-security/
Potentially dangerous coronavirus ‘vaccines’ being sold on the dark web | The Canberra Times | #deepweb | #darkweb | #hacker https://nationalcybersecuritynews.today/potentially-dangerous-coronavirus-vaccines-being-sold-on-the-dark-web-the-canberra-times-deepweb-darkweb-hacker/
Leslie holds a town wide public forum on zoom after Pawnee comes down with the coronavirus. She is incredibly prepared as always and uses a Covid-19 binder she made years ago in preparation of a global pandemic.
WHERE THERE'S SMOKE... Watch Cardi B blast Trump's lack of leadership skills during the coronavirus pandemic 01 #ThursdayThoughts
BREAKING: UGA anticipates return to in-person instruction for fall 2020 | Coronavirus | http://redandblack.com
"White House asks agencies to find out if China, WHO hid coronavirus intel https://nypost.com/2020/04/29/white-house-wants-to-know-if-china-who-hid-coronavirus-intel/?utm_source=twitter_sitebuttons&amp;utm_medium=site%20buttons&amp;utm_campaign=site%20buttons via @nypost"
"As of Wednesday evening, Cobb County has had 1,568 confirmed cases of the coronavirus and 87 deaths, per the state’s latest Department of Public Health report. "
Coronavirus kills nearly 70 veterans at Massachusetts elder care facility https://nypost.com/2020/04/29/coronavirus-kills-nearly-70-veterans-at-elder-care-facility/?utm_source=twitter_sitebuttons&amp;utm_medium=site%20buttons&amp;utm_campaign=site%20buttons via @nypost
"SO, ARE TRUMP AND THE KUSHNERS TRYING TO PROFIT OFF THE #CORONAVIRUS? This German firm is rushing to develop a vaccine for COVID-19 — and the German government accused Trump of trying to poach the company #FBR"
What is the Best Telemedicine Software Options for Doctors and healthcare organizations? Check it out! https://ecs.page.link/8xYwc #COVID19 #Telemedicine #telemedicine #MedEd #telehealth #Telehealth #Coronavirus
"""Americans are down on stocks after coronavirus sell-off, say real estate is the best investment: Gallup"" "
Model Projects 23K GA Deaths If Coronavirus Limits End In 4 Weeks https://trib.al/4yEoh2P
"CobbLinc staff say they are worried about their health while operating public buses during the coronavirus pandemic, especially since a safety supervisor reportedly died after contracting COVID-19. "
Baseball Hall of Fame induction is off for 2020 because of coronavirus. 
Model Projects 23K GA Deaths If Coronavirus Limits End In 4 Weeks http://dlvr.it/RVjnX4
Model Projects 23K GA Deaths If Coronavirus Limits End In 4 Weeks http://dlvr.it/RVjnWY
Model Projects 23K GA Deaths If Coronavirus Limits End In 4 Weeks http://dlvr.it/RVjnWW
Model Projects 23K GA Deaths If Coronavirus Limits End In 4 Weeks http://dlvr.it/RVjnWR
Model Projects 23K GA Deaths If Coronavirus Limits End In 4 Weeks http://dlvr.it/RVjnW8
Model Projects 23K GA Deaths If Coronavirus Limits End In 4 Weeks http://dlvr.it/RVjnWJ
Model Projects 23K GA Deaths If Coronavirus Limits End In 4 Weeks http://dlvr.it/RVjnSW
Model Projects 23K GA Deaths If Coronavirus Limits End In 4 Weeks http://dlvr.it/RVjnQw
Model Projects 23K GA Deaths If Coronavirus Limits End In 4 Weeks http://dlvr.it/RVjnS9
Model Projects 23K GA Deaths If Coronavirus Limits End In 4 Weeks http://dlvr.it/RVjnS6
Model Projects 23K GA Deaths If Coronavirus Limits End In 4 Weeks http://dlvr.it/RVjnST
Model Projects 23K GA Deaths If Coronavirus Limits End In 4 Weeks http://dlvr.it/RVjnRf
Model Projects 23K GA Deaths If Coronavirus Limits End In 4 Weeks http://dlvr.it/RVjnRF
Model Projects 23K GA Deaths If Coronavirus Limits End In 4 Weeks http://dlvr.it/RVjnQn
Local injury law firm petitions New York to shut down and ban all live animal wet markets #Coronavirus #WetMarkets
"Shocking proof coronavirus closures are causing a big drop in air pollution here in Georgia. But by how much? Only on @cbs46 at 9 on @peachtreetv and @cbs46 news at 11pm, why it’s a good news bad news situation."
That’s why I usually don’t even do 9-5 but because I’m making very good money I decided to keep working during the corona virus but no amount of money going to make me ok with being harassed and disrespected so ima hit the pockets POINT BLANK
Candidates Sought for Positions on ACCGov/Winterville Joint Development Authority by May 5. This is about coronavirus relief and distributing loans to small businesses. It sounds boring but it's important. https://www.accgov.com/civicalerts.aspx?AID=3895
A couple spent 73 years together. They both died from coronavirus 6 hours apart 
"As of Wednesday at 6:30 p.m., the number of cases had risen to 25,623, while the number of coronavirus-related deaths is now at 1,096. #fox5atl #COVID19 #coronavirus https://www.fox5atlanta.com/news/as-georgia-continues-to-reopen-covid-19-cases-are-over-25000-with-more-than-1000-deaths"
"As of Wednesday at 6:30 p.m., the number of cases had risen to 25,623, while the number of coronavirus-related deaths is now at 1,096. #fox5atl #COVID19 #coronavirus https://www.fox5atlanta.com/news/as-georgia-continues-to-reopen-covid-19-cases-are-over-25000-with-more-than-1000-deaths"
"Fang Bin, who exposed the truth of #coronavirus, got arrested again on Feb 10. Here is one of his last clips,"" Starting today, I call for all people to stand against the tyranny of CCP. I ask all Chinese people, domestic or abroad, band together..."" https://twitter.com/TruthWi60348276/status/1228481614495137792/video/1 03"
"""Monroe resident and co-owner of My Pet Chicken said she has seen a spike in chicken raising interest during the coronavirus pandemic."" #startupcost https://www.theridgefieldpress.com/arts-leisure/article/Monroe-resident-offers-tips-and-tricks-for-15223936.php"
"""You want your coronavirus scattered, smothered, or covered?"""
Black light photos show importance of washing hands properly amid coronavirus outbreak 
Poop may tell us when the coronavirus lockdown will end https://www.chron.com/news/article/Poop-may-tell-us-when-the-coronavirus-lockdown-15234871.php?utm_campaign=socialflow&amp;utm_source=twitter.com&amp;utm_medium=referral&amp;utm_campaign=CMS%20Sharing%20Tools%20(Desktop)&amp;utm_source=t.co&amp;utm_medium=referral via @houstonchron
"“He voted for you. He believed you when you said this virus was no worse than the flu. He believed every lie you muttered and sputtered,"" wrote Combs, 46. ""You're a disgrace to the human race."" #Resist #coronavirus #COVID19 #TrumpVirus #TrumpIsALoser"
"#BREAKING: Georgia’s coronavirus death toll rises to nearly 1,100, cases surpass 25.6K "
i wonder where the first person who had spread the coronavirus outta china is
Gilead Sciences reports positive drug results for remdesivir as coronavirus treatment 
"THE 2nd #CORONAVIRUS BOMBSHELL IN MY BOOK HAS JUST BEEN PROVEN TRUE: Gov't officials ""warned policymakers that a pandemic “will last 18 months or longer” and could include “multiple waves,” https://nyti.ms/2Qla7As See page 208 Get your copy now: https://VIPPUSA.ORG/free-book 15"
What will coronavirus aka CO-VID 19 do to housing? Plus which will fair better; Commercial or Residential investment?#propertytips #realestate @propertytalks https://buff.ly/2QlCcaO
#DYK SCORE Mentors has created a Coronavirus Small Business Resource Hub? Lots of great info including FREE webinars. Learn more: 
Yikes. Why Georgia Is Reopening Amid the Coronavirus Pandemic - The Atlantic 
"And now comes the coronavirus, right on cue."
US Housing Market Reverses Course in March with Coronavirus Shutdowns 
An Illinois infant less than one-year-old has died from coronavirus. The unidentified child is believed to be the youngest to die from #COVID-19 in Illinois and possibly the country. https://trib.al/Ah3W5tj #FBR
"Beloved Brooklyn teacher, 30, dies of coronavirus after she was twice denied a COVID-19 test - ABC News Why do they hate us so much? https://abcnews.go.com/Health/beloved-brooklyn-teacher-30-dies-coronavirus-denied-covid/story?id=70376445"
So the coronavirus got a expiration date?
"Dude, I need a haircut like everyone else but I’m damn sure not going to risk the health of young lady who cuts my hair. I don’t have Coronavirus; neither does she but you know all who comes in - thanks to jackass @GovKemp - have never been tested. Make America Respectful Again."
"“[his] three companies made $2.2 billion in revenue in 2019. But in March, when U.S. businesses started to feel the fallout from the coronavirus pandemic, the companies laid off 95 percent of their employees.”"
Coronavirus Pandemic Update 63: Is COVID-19 a Disease of the Endothelium... https://youtu.be/Aj2vB_VITXQ via @YouTube
They are doing a priority on the funeral African dancers. If I had to guess I would say they are trying to say coronavirus is dying and they are carrying out the door
How Coronavirus Created The Perfect Conditions For Conspiracy Theories 
"A string of Georgia-based companies on Wednesday reported just how bad of a financial beating they’ve taken during the coronavirus pandemic. The takeaway: It’s getting worse. In late April and early May, many publicly traded... "
White House selling commemorative coronavirus coins for $100 
Teachers use multiple tools to help ELL students during coronavirus crisis 
"""I don't know why, I don't know how, but I was spared,"" Papola said. #fox5atl #COVID19 #coronavirus "
"""I don't know why, I don't know how, but I was spared,"" Papola said. #fox5atl #COVID19 #coronavirus https://www.fox5atlanta.com/news/dekalb-county-man-donates-plasma-to-help-covid-19-patients"
"true, but it seems to be more focused on coronavirus's impact on the entertainment company, so it felt random."
WHERE THERE'S SMOKE... Watch Cardi B blast Trump's lack of leadership skills during the coronavirus pandemic 02 #WednsdayWisdom
"President Trump signed a bill into law Friday with $484 billion in funding for small business aid, hospital grants and coronavirus testing. "
I’m just so tired of hearing about the coronavirus like gahhhh damn. It’s so fucking draining.
Why do the news channels in #Georgia do not post daily #coronavirus deaths? Since @GovKemp opened state deaths are INCREASING every day! @wsbtv @FOX5Atlanta @NBCNightlyNews #COVID19 #Atlanta @NewsHour @cbs46 @staceyabrams #POTUS @ChrisCuomo #COVID19 #ShelterInPlace #StayHome
Will Southern states soon follow??? U.S. Virgin Islands Governor Revises Marijuana Legalization Bill To Boost Tax Revenue Amid Coronavirus - #CannabisNews #CannabisIndustry #CannabisCommunity #covid19
Coronavirus got people passing out from smelling they own breath 
"'Clear-cut' evidence coronavirus drug remdesivir works, Fauci says "
Watch All Trump's false promises regarding the tests for COVID-19. JOIN OUR #CORONAVIRUS FACEBOOK GROUP: https://www.facebook.com/groups/Cvirus19/ 01 #WednsdayWisdom
Two dozen people deported to Colombia on U.S. flight found to have coronavirus: ( why is the virus spreading so much.... answer: ) 
Well done @CynthiaGreenlee Documenting Disparity: The Challenges of Collecting Racial Data on Coronavirus https://www.colorlines.com/articles/documenting-disparity-challenges-collecting-racial-data-coronavirus via @Colorlines
"Hey Amanda, take a look at the graph of new Coronavirus cases in Georgia, as per the Georgia Department of Health, as of April 29. It shows a sharp DECREASE/ And contrary to your thinking, no one is being ""forced"" to go back to work "
"Anytime I hear some1 say, “50k deaths is a small % relative to the US population,” I scream “2753,” at them, the #of people killed in 9/11. The #of deaths doesn’t change how something can profoundly affect this country. Stop downplaying #COVID19 . #coronavirus #COVIDー19 #COVID"
Los Angeles-based CORE Response and the Arthur M. Blank Family Foundation on Thursday plan to open a coronavirus testing site at Mercedes-Benz Stadium. 
Organizer of North Carolina group protesting quarantine rules sidelined with coronavirus https://nypost.com/2020/04/28/leader-of-north-carolina-anti-lockdown-protest-gets-covid-19/?utm_source=twitter_sitebuttons&amp;utm_medium=site%20buttons&amp;utm_campaign=site%20buttons via @nypost
"With the coronavirus pandemic exacerbating food insecurity in the city, the @ATLHistCenter is working with @cjungle to get food to those in need."
"""It may be easier to believe that the coronavirus was deliberately unleashed than to accept the harsher truth that we built a world that was prone to it, but not ready for it."" Truth "
"Liberty County Manna House to host free lunch, drive-thru coronavirus testing event Friday "
Blood of recovered coronavirus patients for sale on dark web – AM | #deepweb | #darkweb | #hacker https://nationalcybersecuritynews.today/blood-of-recovered-coronavirus-patients-for-sale-on-dark-web-am-deepweb-darkweb-hacker/
I’m ready for my kids to go back to school and it’s not even summer break yet! #coronavirus #ronatime #ShelterInPlace #school2020 #homeschooling #whenthisisover
"People who want to vote, yet show signs of COVID-19 will not be turned away. We go in depth tonight at 11 and WSB TONIGHT Coronavirus in Georgia. Join me and @JovitaMoore on Channel 2. @wsbtv"
"#LockHerUp FOR REAL: Sen. Kelly Loeffler sold between $1.2M and $3.1M worth of stock in the three weeks beginning on Jan 24—the day of a closed-door, all-Senator briefing on the coronavirus https://thedailybeast.com/sen-kelly-loeffler-dumped-millions-in-stock-after-coronavirus-briefing?ref=wrap 07 #WednsdayWisdom"
"Early Addition: Jared Kushner Declares Federal Coronavirus Response ""A Great Success Story"" - Gothamist "
‘The American people deserve transparency’ — Bernie Sanders called out the Trump administration for stifling the truth amid the #coronavirus crisis 02 #FBR
This corona virus is all population control.
"WHILE RIFFING ABOUT THE #CORONAVIRUS TRUMP ACCIDENTALLY ADMITS THAT HE'S PRESIDENT. MAYBE HE WILL STOP BLAMING THIS CRISIS ON PRESIDENT OBAMA NOW, AND DO HIS DAMN JOB. Trump says Democrats are weaponizing the virus against his administration. 06 #COVID19"
THIS IS US SOON: ‘Testing wasn’t enough. It wasn't enough to stop this virus.’ — This political consultant’s #coronavirus experience in Italy should be a warning for Americans 01 #VoteBlueNoMatterWho
"After 14 boring days, when you can't go outside to play around, What'll you do when getting a chance to throw out garbage? FREE URSELF! Of course! #coronavirus sucks. via JasonHsuFWC #SaturdayMorning"
"Cobb County has now had over 3,000 confirmed cases of the new coronavirus as of Saturday evening, per the latest report from the Georgia Department of Public Health. "
State opened over a month and ago and y’all are still screaming “it’s just back testing” no sir. People went out when we opened and got sick. We average about 600 new cases of Coronavirus A DAY! The denial of this virus should be considered a mental illness 
Coronavirus and Unemployment. #FBR
Remember that whole coronavirus thing? Crazy times... crazy times.
"In this clip he 1. Denies WHO's coronavirus death rate based on “hunch"" 2. Calls #coronavirus ""corona flu"" 3. Suggests it's fine for people w/ Covid-19 to go to work 4. Compares coronavirus to ""the regular flu"" indicating he doesn't get the difference 05"
Yes Waffle House gives me 24/7 coronavirus vibes 
Businesses way more scared of niggas than they were of coronavirus smh smh
SEEING IS BELIEVING... OR NOT. I’ve seen some creative and great Coronavirus makeshift-masks out there — but y’all...Face with tears of joyRolling on the floor laughingLoudly crying faceSkullSkull via RexChapman #SaturdayMorning
#COVIDIDIOTS Guest At Packed Memorial Day Weekend Pool Party Tests Positive For Coronavirus 
Stop playing He is part of the reason why 43% of all coronavirus deaths occurs in nursing homes
Dr. Bright says Trump’s obsession with hydroxychloroquine ‘was extremely distracting to dozens of federal scientists who were focused on the coronavirus’ 01 #FBR
"As a nurse on the front lines of Mexico's coronavirus battle, Gisela Hernandez has stayed away from her children for nearly two months, sleeping in a hotel and even her car to avoid infecting them because she feels inadequately protected at work."
it’s like corona virus coverage has just ceased
DON'T DECLARE WAR ON THE STATES: Trump enacting a quarantine in Coronavirus hotspots would be a “Federal declaration of war on states.” “I don’t think Trump is looking to start a lot of wars with a lot of states just about now for a lot of reasons” https://twitter.com/alx/status/1244031966833520642/video/1 06
Coronavirus seems so yesterday's news.
Coronavirus is officially over 
"Coronavirus exposes vulnerabilities of world’s migrant workers, Middle East News &amp; Top Stories | #exploits | #vulnverabilities"
THIS WILL MAKE YOU SMILE: The #GhenCoVyChallenge dance craze is reminding people of the best ways to stay healthy during the coronavirus outbreak 05 #FBR
YOU THINK? #Coronavirus may have much longer incubation period--which would mean quarantines have been too short https://thehill.com/changing-america/well-being/prevention-cures/482978-chinese-researchers-suggest-coronavirus #SaturdayMorning
"As of Saturday afternoon, there are over 2,000 #coronavirus deaths and 46,286 confirmed cases in the state of Georgia. "
"Protect yourselves, black people. And if you’re out protesting and/or rioting, still wear a damn mask. Coronavirus didn’t go anywhere. The white people are still quarantined and y’all wanna be out getting shot and/or sick. Mkay "
"The assault on black people is a pandemic that must be eradicated, as surely as the coronavirus needs to be eradicated."
"And just like that, the Coronavirus hoax was over. Like the Russian Collusion hoax, And Hillary's pee tape hoax, And the framing of General Flynn And the phony Impeachment before it...."
Over 100K Americans dead from coronavirus and cities burning. Unemployment is higher than it was during the depression. Who thought this was a good time to spend money with Elon to send people to space.
I bet money none of these protesters finna catch corona virus. they’ll most likely push out fake statistics to keep the fear levels high
"TO MILLENNIALS: ACCORDING TO EXPERTS, THERE WILL BE BETWEEN 200,000 & 2 MILLION DEATHS FROM THE 1ST WAVE OF THIS CORONAVIRUS THERE WILL BE NO FUNERALS, NO WAKES, NO SHIVAS, ONLY CREMATIONS OR MASS GRAVES. NO GOODBYES TO LOVED ONES. SO, PLEASE STOP SPREADING IT #STAYHOME #FBR"
COVIDIOT VOICEOVER #griffindoor88 #griffindoor #voiceover #voiceovers #voicetag #voicetags #covid #griffinsofinstagram #covidー19 #covid19 #covid2019 #covid_19 #coronavirus #noun #covidiot #covidiots #protocol… https://www.instagram.com/p/CA1EE8aHc37/?igshid=1mwxxn7abd19c
"This man reportedly spewed racist, coronavirus-fueled comments at two Asian women on a Vancouver bus — now police are searching for him 03 #FBR"
#KeishaLanceBottoms seems to love a curfew for anything she can’t control. Don’t like how people are using Rideshare scooters? Curfew! Coronavirus? Curfew!! Civil unrest? CURFEW!!! You can’t enforce ‘obedience’ with police pressure. That’s what got us where we are.
"Atlanta protests could slow economic recovery, after already hurt by coronavirus, though probably not a fatal blow. "
DON'T DECLARE WAR ON THE STATES: Trump enacting a quarantine in Coronavirus hotspots would be a “Federal declaration of war on states.” “I don’t think Trump is looking to start a lot of wars with a lot of states just about now for a lot of reasons” https://twitter.com/alx/status/1244031966833520642/video/1 02
" Trump doesn't wnt to do anotha rd of 1,200.he would rather agree on 450 bns. only.if we go bk to wrk. I WOULD RATHER AGREE ON VACCI B4.other than that.he can't wait to SACRIFICE us..$1,200 Checks? $450 Bonuses? The Latest on the Next Coronavirus Lifeline "
"I'm CONFUSED. IF THE VIRUS IS TRANSMITTED HUMAN TO HUMAN BUT THERE ARE NO HUMANS ON THE STREETS BECAUSE OF THE 60M PPL QUARANTINE, THEN WHY ARE THEY SPRAYING THE STREETS? Another video of chemical disinfection in the streets of Wuhan #coronavirus 02 #FBR"
@CNN @cnnbrk Did coronavirus go away?
@CNN @cnnbrk Can we please get a little coronavirus count box on the screen?
Italians held a nationwide round of applause for the doctors and nurses who are helping fight the coronavirus outbreak #FBR
