"And let's do something about #UniversalBasicIncome/ #UBI , before me and 6 other (mostly ""at risk"") people become homeless in less than a month and join the #protests /#riots2020 ? I'd already be out there if not for #coronavirus , and without a home I'll have no choice."
"MAINE CORONAVIRUS DATA: Also The Numbers don”t sound right Deaths: 89 Total cases: 2,282 Confirmed Cases: 2,025 Probable Cases: 257 Patients Recovered: 1,505 Patients on Ventilators: 11 Patients in ICU: 18"
"So, what exactly happened in Italy. Why did so many people die? My thoughts (Hindi) #coronavirus "
Wealthy Fliers Worried About Coronavirus Turn to Private Jet Service http://dlvr.it/RXgp1t
@Trevornoah talk about Corona virus being the start of all these chaos we're witnessing and I couldn't agree more. People have lost jobs and livelihoods they don't have anything to more lose...it's a pity
"Obviously very inconsequential, but even if the coronavirus didn’t exist, you have to wonder how if baseball would be played in Chicago this weekend as the Cubs were supposed to be home."
"One in 8 museums around the world may never reopen due to the coronavirus pandemic, UNESCO reports "
RT @wef:Coronavirus: here’s what you need to know about face masks https://bit.ly/2ypZZRb #coronavirus #PPE
"The coronavirus could give bioterrorists ideas, security group warns "
Would have been at the actual #Glasgow gig if it wasn't for #coronavirus and #lockdown. 
"@fox8news @ABC @NBCNews All this violence has got to stop people. What happen to George Floyd is inexcusable and should have never happened. Our country is already going through a tough time with this coronavirus, people dying from it and people out of work. Destroying people’s"
"At this rate, I wouldn’t be surprised if they would do a test on #GeorgeFlyod and then say he died of #coronavirus so that’s why he had breathing issues"
Frecce Tricolori thanks #Italy #freccetricolori #support for emergency #COVIDー19 #Coronavirus 
https://jamanetwork.com/journals/jamaneurology/fullarticle/2766765?resultClick=1 Magnetic Resonance Imaging Alteration of the Brain in a Patient With Coronavirus Disease 2019 (COVID-19) and Anosmia
Kidneys And Covid-19: Renal Manifestations Of The Novel Coronavirus 
Kidneys And Covid-19: Renal Manifestations Of The Novel Coronavirus 
Im not but you for sure if you count the numbers of previous corona viruses that affected people with others corona virus already exist adding more herd immunity
"COLUMBIA, S.C. — The South Carolina Department of Health and Environmental Control (DHEC) today announced 266 new cases of the novel coronavirus COVID-19 and 4 additional deaths. "
NO VIOLATION ALL THE GUIDELINES REGARDING CORONA VIRUS ARE FOLLOWED.... IT IS NOT BAD TO CELEBRATE YOUR BIRTHDAY.. HAPPY BIRTHDAY SIR. GOD BLESS YOU... HE IS A GOOD LEADER A GOOD EXAMPLE TOO.
Neuropathogenesis and Neurologic Manifestations of the Coronaviruses in the Age of Coronavirus Disease 2019: A Review | Global Health | JAMA Neurology | JAMA Network 
"Big fluctuations in food prices began in March, when the coronavirus pandemic began to sink in for U.S. consumers. "
"'Apocalyptic virus from chicken farms could dwarf #coronavirus and kill half world’s population' https://www.thesun.co.uk/news/11742195/virus-chickens-coronavirus/?utm_medium=Social&amp;utm_campaign=sunmaintwitter&amp;utm_source=Twitter#Echobox=1590847292 The doctor details that ""as long as there is poultry, there will be pandemics"", adding: ""In the end, it may be us or them""."
"After each epidemic and disaster, our social norms and behaviors change. As researchers begin to study coronavirus’s impacts, history offers clues. "
Day 100 situation #coronavirus italy 232.664 cases (+416 since yesterday) 33.340 deaths (+111) 155.663 healed (+2.819) #CoronavirusOutbreak #CoronaVirusUpdates #COVID19 #Covid_19 #COVIDー19 #covid2019 #COVID19
The coronavirus has thrust human limitations into the spotlight. Will it mark the rise of automation? https://theconversation.com/the-coronavirus-has-thrust-human-limitations-into-the-spotlight-will-it-mark-the-rise-of-automation-139198 #automation
"A man wearing a face mask as a precaution against the #COVID_19 #coronavirus is sitting on the bank of Regi Lagni canal in #CastelVolturno, southern #Italy, on May 30, 2020"
2 meters away #coronavirus #covid19 #weightlifting
