"‘coronavirus, like Brexit, has the ability to cause erratic variations in the opinion polls.’ The Tories must unite behind an agenda to return the British economy to pre-Covid normalcy. That will give the party some fresh momentum. "
‘Coronavirus: Tory MPs call for change in 2m social distancing rule’ | &lt; 1.5m ? 
"Coronavirus death toll rises again in Sheffield, as 146 more die in England - The Star http://dlvr.it/RXgXYw"
"Further evidence that #TrumpIsA_DANGER_ToAmerica He flames the fire of unrest &amp; distress. Why wld he invite MAGA supporters to the WH this moment in time? 45 isNOT abt #JusticeForGeorgeFloyd or any POC. Remember, still #KidsInCages during #coronavirus #TrumpIsANationalDisgrace"
bottles in and i can confirm you can't catch Coronavirus from Corona. It's actually fairly nice and £7 for a 12 pack in Tesco so had to be done 
BBC News - Coronavirus: 'Dangerous moment' as UK lockdown eases 
"Be careful , everyone!!!! Don’t lose the one you loved again #coronavirus #UKlockdown #stayhomestaysafe #StaySafeStayHealthy"
Turkey: Domestic Flights to Resume From June 1 https://istanbulpostusa.com/2020/05/turkey-domestic-flights-to-resume-from-june-1/ #Coronavirus #COVID19 #DomesticFlights #Pandemic #Turkey
"Wait, there was a space launch? Oh yeah. #GeorgeFloyd #coronavirus #PoliceBrutalityPandemic"
The coronavirus pandemic is soo yesterday 
"The South African government maintained a ban on all contact sports competitions on Saturday because of the coronavirus, meaning the country's professional rugby teams and its world champion Springboks will remain out of action. "
Coronavirus: How they deliberately terrified us https://youtu.be/kvlhVD5TunY via @YouTube
Someone Who Attended That Crowded Lake Of The Ozarks Pool Party Has The Coronavirus https://www.buzzfeednews.com/article/davidmack/coronavirus-lake-ozarks-pool-party-case-covid-19 via @davidmackau
The South West has the highest coronavirus R-rate in the UK 
#coronavirus #StayHomeSaveLives #StayAlert #SocialDistancing You bunch of selfish w*****s
‘Many of us still struggle with insomnia and then there’s the toll on our our mental health; just like everyone else in lockdown we struggle to turn off when away from work.’ #coronavirus 
Coronavirus: Tory MPs call for change in 2m social distancing rule 
No new coronavirus deaths recorded at Hampshire Hospitals 
"This afternoon, during the daily Coronavirus briefing, in response to a question from The Observer, Professor Jonathan Van Tam said ""The rules are clear and they have always been clear"". I suggest that Professor Van Tam's response may have been misleading. /2"
Dont settle into divided world Motto for all dont get blurred by religions environment material demonic nightmare wrathes Coronavirus penances tribes nature God created Law following healthy only amongst few others as Jesus Prophers said Saved will be LoveLife Reality living Joys 
"That which you call ""our civilisation"" I call ""Human Infestation of my planet"", and unfortunately Coronavirus will not cure that infestation. The resulting #TriDemic will do far more damage than coronavirus, but not enough to make Gaia well again."
"I wish the government would stop telling lies and making us think this is over. We're not stupid (well, excluding those at #DurdleDoor ) #coronavirus #lockdownextension #KeepTheLockdown"
The electorate coming up to speed. #coronavirus 
Coronavirus: Daily update as scientists warn over lockdown easing Government are not listening. The public are behaving like this is over due to #Cummings effect.
You've made this decision in spite of what the science says. When the next wave comes you need to have your bags packed. #Coronavirus
"We just got one of these cards in the mail and almost tossed it. Don't! They're legit, believe it or not... ""Why millions of Americans are getting coronavirus stimulus payments on scammy-looking debit cards"" https://www.vox.com/recode/2020/5/29/21274397/coronavirus-stimulus-payments-debit-cards-checks-visa?utm_campaign=vox&amp;utm_content=entry&amp;utm_medium=social&amp;utm_source=twitter via @voxdotcom"
"With all the Corona virus, hunger n violence in the USA. What a waste of money sending people to space. Shame on you."
MTA workers clean a subway car in New York City. #Covid19 #coronavirus #pandemic #NewYorkCity #NYCsubway #footage #HDfootage #archives #archival #broll #stockfootage
Why would the Government want to record higher death figures than necessary from coronavirus? It’s not like they’re on commission. This is a common theory but it’s rarely attached to a rationale. So if you have one it would be interesting to hear it.
4 years with control of parliament. Corona virus crisis is ending. Key is recovery of the economy and jobs.
#Coronavirus: Competitive sport to return behind closed doors from Monday http://news.sky.com/story/coronavirus-competitive-sport-to-return-behind-closed-doors-from-monday-11997590
cw coronavirus Lockdown rules are being lifted too soon. People aren't keeping their distance from others. As for schools they should remain closed until September in my opinion. The UK Government are irresponsible and a disgrace.
"“Doctors will find coronavirus vaccine, but Black people will continue to wait, despite futility of hope, for cure for racism. The rest of the world yearns to get back to normal, but normal is the very thing from which Black people yearn to be free.” "
"Gov. Andrew Cuomo speaks out about ""inequality in healthcare"" and announces 10 new testing sites across coronavirus hotspots in New York. "
Someone Who Attended That Crowded Lake Of The Ozarks Pool Party Has The Coronavirus 
"‘coronavirus, like Brexit, has the ability to cause erratic variations in the opinion polls.’ The Tories must unite behind an agenda to return the British economy to pre-Covid normalcy. That will give the party some fresh momentum. "
After being out today you can already see that we are going to be the country that fecks it and has to go back into lockdown!! Everyone thinks it's over but we still had 10x more deaths than any other country in Europe!! #lockdown #SocialDistancing #Coronavirus #UKlockdown
"Neither. One can take coronavirus seriously without grossly exaggerating the risks. One can be outraged by the despicable conduct of a police officer yet question bad actors. On the other hand, one cannot be pro-lockdown and pro-protest because the two are mutually exclusive."
"The UK is preparing a stimulus package to tackle the jump in unemployment due to the coronavirus, the Financial Times reports "
Cummings is a despicable liar who should have been sacked for persistently lying to everyone. He doesn’t know right from wrong. @BorisJohnson⁩ is useless and must resign. #Coronavirus: Van-Tam says lockdown rules 'apply to everybody' after Cummings row http://news.sky.com/story/coronavirus-jonathan-van-tam-says-lockdown-rules-apply-to-everybody-after-dominic-cummings-row-11997662
"To date, upwards of 365,000 have died from the coronavirus, with 5.95 million total cases and almost 2 million in the United States alone. Worldometer reports 125,000 new cases worldwide just on the date of May 29th."
Coronavirus and lock down has been brutal but if it doesn't make you appreciate your family more and not seeing them then I give up. #familyiseverything
Expression of the Century!Where did it originate? The public needs to know!!Coronavirus: 'Don't tear the pants out of it' warns scientist on lockdown easing 
"UK coronavirus death toll rises by 324 to 38,161 https://youtu.be/_Pv6-b7XATo via @YouTube ‘Past the peak’? Debatable"
"Brexit? What’s the relevance? This thread has been about coronavirus &amp; you drop Brexit into things?? Anyway.. I’m on here to widen my horizons, see different media sources, learn &amp; discover new things, not to get embroiled in debates with the narrow minded &amp; bigoted. Goodbye."
PPP2020 | 26th SEPT | BOOK TODAY https://ift.tt/2vK8V2c Supreme Court Rejects Challenge to Coronavirus Limits on Church Services 
I wonder what science this gov is actually following. #coronavirus #UK #BorisHasFailedUK
For those wishing for an explanation for all I recommend this. What is a coronavirus? (Elizabeth Cox | TED-Ed) https://www.ted.com/talks/elizabeth_cox_what_is_a_coronavirus?utm_source=twitter.com&amp;utm_medium=social&amp;utm_campaign=tedspread via @TEDTalks
After a major incident this afternoon the Mail Online have used three more of my pics from Durdle Door in Dorset today including two of my pics of a lad jumping from the rock - Pics via Bournemouth News and Picture Service - #Dorset #Lulworth #DurdleDoor #coronavirus #COVIDIOTS
if in 2 weeks no protestors have coronavirus im done with the world
You can guarantee there were people on this beach with coronavirus. Covid-19 is a killer. This scene at Durdle Door is a slap in the face for those of us in isolation. 
"Riots in the US, riots in Hong Kong and mass sunbathing in Scotland. What happened to the coronavirus? Did it get furloughed?"
"‘coronavirus, like Brexit, has the ability to cause erratic variations in the opinion polls.’ The Tories must unite behind an agenda to return the British economy to pre-Covid normalcy. That will give the party some fresh momentum. "
"Media has power to influence entrenched unjust and murderous power dynamics here, and globally. This piece I wrote for @dailykos / @ourprisms discusses ⁦⁦@tejucole⁩ , how other countries are managing coronavirus, and changing media bias. "
Saw Cher trending and thought SHE DIED OF CORONAVIRUS or maybe THE MURDER HORNETS GOT HER!
"Madness mate. We've certainly not heard the last of Coronavirus by a long chalk. They'll be plenty more deaths, that could have been avoided in the coming months, sadly."
BREAKING: Coronavirus testing has taken place at 4 LG2 clubs (believed to be those in the play-offs) and 7 positive tests were found from 135 players and staff. Had it confirmed that Walsall have not been taking part in these tests. #saddlers
I think the term for this is ... “No shit Sherlock” ..... BBC News - Coronavirus: Cheltenham Festival 'may have accelerated' spread 
"Hey @StandComedyClub, what's the difference between @marknelsoncomic and Coronavirus? We'll miss Mark featuring on our screens every week. Thanks so much for brightening our Saturdays &lt;3."
BBC News - Coronavirus: 'Dangerous moment' as UK lockdown eases https://www.bbc.co.uk/news/uk-52863446
"VA Reports Over 1,000 New Coronavirus Cases; 12 New Deaths https://trib.al/k8wrqF9"
yep i agree risking your life to go to a beach is stupid you can still get the coronavirus
“phylodynamic analysis indicates that between 5-9% of infections are responsible for 80% of secondary infections”. Coronavirus: A few infected people account for larger virus spread - The Hindu 
Coronavirus is just messing with everybody 
A positive coronavirus test for the Boro 
"The public-facing Southend Council page on COVID-19 (coronavirus) is regularly updated, and can be found at https://www.southend.gov.uk/coronavirus"
" DAILY COVID-19 BRIEFING The Public Health team at Southend Council are providing daily briefings to councillors on the situation regarding the COVID-19 (Coronavirus) pandemic. In the interests of transparency with residents, I will endeavour to share them here. "
"Quite a varied picture from latest coronavirus testing. Zero in Prem but Championship up to 10 and 7 in League Two from only 135 tests. A reminder these figures can change quite dramatically, in both directions. "
Wonderful to have a BBC headline that isn’t about #coronavirus LIFT OFF into space. No problem there with physical distancing. #space
Wonder if bob and Doug were tested for coronavirus before they launched #SpaceX #LaunchAmerica #NASA
"For Millions of Americans, Water Issues Heighten the Threat of Coronavirus https://www.usnews.com/news/healthiest-communities/articles/2020-05-21/poor-water-access-heightens-coronavirus-threat-for-many-americans #covid19"
Only Positive mentions of #Avigan comes from Russian investment fund &amp; Indian Generic Pharma-both with a large $stake- to its credit Japan Delayed Approval &amp; #Fujifilm remains silent. “Russia coronavirus treatment favipiravir showing 'promising' results” 
No wonder @campbellclaret is bad tempered. It’s a good job I wasn’t interviewed! This whole #coronavirus debacle at the hands of #borisjohnsonfailed makes me angry beyond words . Please (if there is one) God help us
"WaPo and Yale researchers - Coronavirus deaths likely significantly higher than currently reported https://www.dailykos.com/story/2020/5/30/1948838/-WaPo-and-Yale-researchers-Coronavirus-deaths-likely-significantly-higher-than-currently-reported 130-150,000 deaths is likely where we are at the start of June."
"Coronavirus May Be a Blood Vessel Disease, Which Explains Everything by @SmithDanaG in @elemental"
Bryce Cotton returns to Perth Wildcats weeks after quitting over coronavirus NBL salary cuts 
"The governor also called for an end to ""inequality in healthcare,"" with new testing sites in minority communities hit hard by coronavirus. https://trib.al/7ppFDig"
"On a level thought, what's the rate of Coronavirus in the US? Cus... "
"You’re a cheeky bastard, my best friends mum died because she didn’t receive her chemo. Because of corona virus."
#cummings effect Police in Brighton tonight: “No one cares about social distancing anymore...” Officers and Paramedics having to help people off the beach with sunstroke and drinking too much... #lockdown #coronavirus ( @MissJoEdwards)
This confuses me. Cheltenham Festival went ahead at a pivotal time in the country’s battle against Coronavirus and people suffered as a result. Why is this one of the first things that needs to come back? Who even watches horse racing? Oh... 
Have the libdems been killed off by the coronavirus? Have seen or heard one for months
Plus the amount of the corona virus victims will sky rocket
Supreme Court allows restrictions on attendance at church services amid coronavirus 
SARS-CoV-2 superspreading and suggest that as little as 10% of cases could account for 80% of all transmission Coronavirus: A few infected people account for larger virus spread - The Hindu 
"Amwell, the Boston-based telemedicine company founded in 2006, has raised a whopping $194 million in Series C funding as telehealth experiences a national surge amid the coronavirus pandemic. "
Actor hit by car/ Restaurant owner makes creative proposal/ Troconis speaks out/ Grocery store worker dies of coronavirus: Month In Review https://trib.al/fzlnhkh
Coronavirus: Relaxing lockdown 'risky' and a 'political decision' 
Coronavirus: A few infected people account for larger virus spread - The Hindu 
"The U.S. reached a difficult milestone in the coronavirus pandemic this week with 100,000 deaths. Here were the most important developments in the global outbreak https://trib.al/qefNUBj"
Actor hit by car/ Restaurant owner makes creative proposal/ Troconis speaks out/ Grocery store worker dies of coronavirus: Month In Review https://trib.al/Y0oXK8Q
Breaking: Cardiff City confirm one member of staff has tested positive for coronavirus after the third round of testing #CCFC #Bluebirds
Coronavirus Showed How Globalization Broke the World https://www.nytimes.com/2020/05/30/opinion/sunday/coronavirus-globalization.html?utm_source=dlvr.it&amp;utm_medium=twitter
"What are you talking about? deliberately obtuse & disingenuous. You know full well that wasn’t the law. Would you like me to advise you what reg 6 of the The Health Protection (Coronavirus, Restrictions) (England) Regulations 2020 says? I won’t even charge you my usual rate."
"Sick of hearing people say that the danger presented by CoronaVirus is exaggerated. Even with lockdown we have 60,000+ deaths. What would it be without? Look at the rising Covid19 death toll over recent months compared to existing diseases. "
"Only laying the blame on you @realDonaldTrump, laying the blame of 100K dead Americans from Coronavirus and the destruction of our inner cities from the white supremacy that you embrace...you, you are responsible and a disgusting human being"
Pretty sure those Astronauts are a lot closer together than 2 metres #SpaceX #coronavirus #pandemic #nasa #SocialDistancing
"When do we get the specific test for Covid-19, instead of the discredited RT-PCR, which picks up the whole Corona Virus family. 4M dodgy tests is nothing to brag about. We need a test to confirm the deaths, and change them from suspected to Covid-19 or NOT Covid-19."
"Following the completion of the third round of testing for COVID-19 this week at the club’s Vale training base, a member of staff has tested positive for Coronavirus. COVID-19 | Testing update https://bit.ly/36MCi24"
Swear some people think Coronavirus doesn't exist anymore
Congrats @piersmorgan &amp; All MSM who kept the Cummings issue going for days... knowing their repeated suggestion “Monkey see... Monkey do” reaction of thick people would encourage it. Disgraceful! #NHSheroes #keyworkers #COVID19 #coronavirus #SocialDistancing #StayHomeSaveLives
"Protest anywhere you want but not in NYC or Long Island or westchester county. We won’t make it out of Coronavirus season if people start protesting here in large groups. We lost 25,000 people, they are all DEAD. We must defeat COVID in NYC THEN protest."
"""The most common injury is Acute Tubular Necrosis or ATN."" My latest @Forbes story on how #COVID19 causes kidney damage: https://tinyurl.com/ybdewm4w Grateful to Drs. @nephro_sparks Herbert Lin &amp; David Goldfarb #KidneyDisease #coronavirus #kidney #renal #urine #health"
"""Don't tear the pants out of it,"" His best movie was Universal Soldier. Coronavirus: 'Dangerous moment' as UK lockdown eases - BBC News "
Coronavirus: Prince Charles encourages jobless and students to pick fruit on farms https://www.thenational.ae/world/europe/coronavirus-prince-charles-encourages-jobless-and-students-to-pick-fruit-on-farms-1.1021843 via @TheNationalUAE
"#LookingBack March 18th 2020; “As many as 2.2M American lives could be lost to #coronavirus unless social distancing adhered to”, says new report.. #ShakeHandsBoris"
Coronavirus: Source of Skye outbreak 'not known' - BBC News I’ve got a fair idea 
Leeds parent Sarah Allison today spoke about the wider re-opening of schools on June 1st and why the government need to urgently reconsider their position on this. @NEUnion #school #education #coronavirus #COVID19 #NEU5tests
"Tell me why I just heard on the radio a “corona virus update” they really just said all beaches out East like the Hamptons, Quoge, MtK etc.. said they are closed for NON-Residents???"
Captain’s Log: Day 80 No No No problems I will report back daily #coronavirus 
"Cobblers physiotherapist, Ignacio Herrando, tests positive for Coronavirus, we wish him all the best in seeing him back at work soon "
"Clean power stocks have weathered the coronavirus crisis better than their peers in oil and gas, new research has shown, ref. Financial Times article. https://amp-ft-com.cdn.ampproject.org/c/s/amp.ft.com/content/08675019-1386-49ac-a718-031d6ab85051"
"My 13 year old just said, “they get to go somewhere without coronavirus” #SpaceX"
"Cut air pollution to help avoid second coronavirus peak, MPs urge "
"I agree Jarlath, but I think Ajer & Edouard will be off due to the Coronavirus shitstorm. Let’s face it this virus’s had a horrendous effect on our daily lives and I think the worst has yet to come. I hope I’m wrong but prepare for the onslaught coming down the pike"
John’s UK Coronavirus Diary – Number 15 – in which I suddenly get taken into a local hospital - The latest #johnflemingblog - #Covid19UK #coronavirusuk
Things people do to avoid Corona virus
Coronavirus Clusters At New Hampshire Hospitals Under Investigation 
"#Coronavirus some scientists, whereas presumably the others are advising that it's ok"
Jenny mused on future history exam questions: Was the second spike in coronavirus caused by (a) the desire for economic recovery (b) an argument over education (c) Premier League football (d) covering the back of the #PM’s best mate #Cummimgs #covid19 https://sfcoviddiaries.blogspot.com/2020/05/learning-point-jenny-8.html
Coronavirus: nurse blasts groups of 'selfish' people meeting in West Berkshire parks 
