"It’s no surprise that Donald Trump has caused outrage again with his latest suggestion for a coronavirus cure, leaving everyonewondering how is Donald Trump still President? Donald Trump's latest controversy left the medical community and, well, https://smtdaily.com/?p=583"
Bill Gates has an idea for how to get billionaires to donate more for coronavirus 
Coronavirus death toll rises without a national remembrance — or a consoler-in-chief in the White House 
Stay updated with the latest stories on Coronavirus. #coronavirus #pandemic #CoronavirusStories #COVID19
"Students on lockdown create a global guide to coronavirus conspiracy theories and other whopping lies. students on lockdown create a global guide to coronavirus conspiracy theories, fake cures, and other whopping lies - Bulletin of the Atomic Scientists "
Coronavirus Antibody Testing Shows Lower Fatality Rate For Infection : Shots - Health News : NPR You don’t say.... 
Canada’s Opioid Overdoses Have Surged Since Beginning Of Coronavirus Pandemic 
New figures show which parts of the UK have highest coronavirus infection rate 
Why the men? Seems like men will need to see the doctors more. #longevity #pandemic #coronavirus #COVID19
"cw coronavirus This is disgusting. If the government cared about people's lives they wouldn't be allowing large events like this so soon. Also, horse racing is barbaric and should be banned forever. "
" In this episode of the #DoingAWorldOfGood Podcast, Craig Kennedy of @Merck discusses the ways in which Merck has solidified their crisis management structure to respond to the coronavirus pandemic. Listen to the episode: "
Which wrestler invented the Corona virus? Psycho Vid 
Police Scotland have stated that they cannot cope with the number of complaints that they have received from members of the public about breaching of the new coronavirus guidelines.
This guy is a legend & I’d liked him before this virus #honest #straight Coronavirus: Jonathan Van-Tam says lockdown rules 'apply to everybody' after Dominic Cummings row | UK News | Sky News 
"The state's coronavirus-related death toll has risen to 6,768 over the course of approximately three months, most of which has been spent under stay-at-home orders. "
Contact tracing poses new challenge in coronavirus outbreak https://yhoo.it/2M7Y0UI by @AnjKhem
The government said 6 people not 10 or 12 and you still have to social distance. Why are people not listening to the government?Selfish b*st*rds. When there’s a next wave of this coronavirus shit blame yourselves KMT!
"Be careful, England.... Coronavirus: 'Dangerous moment' as UK lockdown eases "
"The state's coronavirus-related death toll has risen to 6,768 over the course of approximately three months, most of which has been spent under stay-at-home orders. "
"Thank you Matt, you make me smile! Magic people indeed! It upsets me to see such gatherings. We had to say goodbye to my lovely dad who lost his battle with covid19 in April. The coronavirus funerals 'ringing with applause' "
"The state's coronavirus-related death toll has risen to 6,768 over the course of approximately three months, most of which has been spent under stay-at-home orders. "
"The state's coronavirus-related death toll has risen to 6,768 over the course of approximately three months, most of which has been spent under stay-at-home orders. "
"The state's coronavirus-related death toll has risen to 6,768 over the course of approximately three months, most of which has been spent under stay-at-home orders. "
EFL confirms 17 positive coronavirus tests after latest round of testing. 10 people from 8 clubs in Championship. 7 people from 3 clubs in League 2 test positive. There is no programme of testing for League 1 clubs at the moment.
"There’s a lot of talk about institutional racism in regards to Coronavirus Covid-19. This is ridiculous, this virus doesn’t discriminate. "
Another sizeable drop in hospitalizations in Massachusetts and ICU cases. #WBZ #coronavirus 
Did you miss our ᴡᴀᴛᴄʜ ᴘᴀʀᴛʏ? Don't worry — you can still watch it here: https://www.facebook.com/LiveMightyWell/videos/278504946666357/ Join in to help: Clear the stress and fear of Coronavirus Cultivate calm thoughts Use affirmations to help balance fear with hope &amp; positive possibilities!
(2) coronavirus fiasco (blame China for it); the economy (China's fault); our loss of influence in the world (China's Belt and Road initiative); need for an enemy to juice up its MAGA doofus base for the election (China replaces Russia because Putin has the Pee Tape).
Can aliens catch Corona Virus?? #SpaceX
"The bug version of a ""One Hit Wonder"" #murderhornets #coronavirus #bolognavirus https://www.instagram.com/p/CA04HSIDk06/?igshid=11cj8wra6nmbq"
"I am also defending and speaking for all the Asians that have been targeted, harassed and bullied all over the western world due to the Corona virus."
"Dead ass I'm seeing so many people make instagram posts being on the beach, without any masks on, you're going to be the reason why we have a second wave of Coronavirus. Stop being selfish assholes and tan at your home."
"“the end of April I watched the prime minister declare our coronavirus strategy a “success”, I felt physically sick. We had “avoided the tragedy that engulfed other parts of the world”...”because at no stage has our NHS been overwhelmed”. How very cheap” "
"Coronavirus furlough scheme to finish at end of October, says chancellor "
Mapped: 18 councils are yet to see coronavirus deaths peak - is yours on the list? 
"Averages of the positive rate and hospitalizations continue to trend in the right direction, but the average of deaths ticked up slightly. #WBZ #coronavirus "
Revealed: Test and trace was abandoned because system 'could only cope with five coronavirus cases a week' 
Coronavirus: South Korea closes schools again after biggest spike in weeks 
Our #RoadToResilience podcast uses first-person accounts to shed light on just how much nurses give of themselves every single day in the fight against the #coronavirus: https://cbsloc.al/2LF7LJR #COVID19
Didn't realise people were doing that about that Dom bloke. Just find it strange that this big news is barely being reported. All the Brexit claims of Nissan being under threat etc surely make this very very newsworthy even amongst the Coronavirus stuff.
"43,000 Ppl travel to US after your so-called 'ban'. You were not slow to respond you suppressed, and downplayed COVID-19 hence 100,000+ dead Americans, hundreds of thousands coronavirus infected. Ask if you made 'America Great Again'? Ask if Ppl better off today? Start packing."
"$1,200 checks? $450 bonuses? The latest on the next coronavirus lifeline "
43 lives saved on Hull coronavirus ward thanks to new treatment 
An updating overview of coronavirus in Massachusetts https://trib.al/uRpx7PO
Could someone develop an augmented reality app so if they've got the virus and you look at them through your camera they've got a big spikey red head? Ta. #coronavirus
Coronavirus: Backlash after Trump signals US exit from WHO. ⁦@realDonaldTrump⁩ is simply insane. Ignore him .@FoxNews ⁦@foxandfriends⁩ ⁦@SenateGOP⁩ ⁦@HouseGOP⁩ ⁦@PressSec⁩
"This ^ they are going to claim to do the right thing and then do very little. They said they would pay you 100% if you caught the coronavirus, but they only paid 75%. They are just saying this for good PR. I know that those team members will struggle :("
I'll say it again: Sir Clive Sinclair is behind the coronavirus epidemic 
Fox news never covered news about coronavirus. They have followed the same path as other media outlets in covering the demonstrations.
Coronavirus: 'Rules are for the benefit of all and apply to all' .⁦@MattHancock⁩ ⁦@BorisJohnson⁩ ⁦@piersmorgan⁩ ⁦@afneil⁩ ⁦@maitlis⁩ ⁦@michaelgove⁩ ⁦@DominicRaab⁩ They apply to all. Cummings must go. MUST GO.
"The state's coronavirus-related death toll has risen to 6,768 over the course of approximately three months, most of which has been spent under stay-at-home orders. "
"UK-based Irish YouTuber Seán McLoughlin donation campaign in support of #BlackLivesMatter #JusticeForGeorge #SocialJustice #PrivilegeForChange . He and his 20 mil.+ following raised over $600,000 for #COVID19 #Coronavirus relief "
"Newmarket ,yes I love the racing, Cheltenham too a magic place, But not this year for obvious reasons, Coronavirus there to face. Cheltenham should have been abandoned, @BorisJohnson again to blame, And people dying by the dozen, Means racing resuming is wrong the same!"
cw coronavirus The uk government are experimenting with people's lives. Our government is dangerous and only care about themselves 
" HIGHLIGHTS | Pope Francis prayed the rosary in the Vatican Gardens’ Lourdes grotto as Catholic shrines from around the world joined via video streaming, asking for the Blessed Virgin Mary’s help and solace during the coronavirus pandemic. #PrayTogether"
"Hey @MSNBC where THE HELL is the counter of the Americans that have died of Coronavirus can you not walk and chew gum at the same time. Jesus isn't 103,000 dead big enough for you to cover it. Yeah these protests are important but people are dying ALONE! @deborahturness @JoeNBC"
How is the Corona virus working?
"just a reminder that coronavirus is still a thing, some of you seem to have fucking forgotten xx"
[Southampton FC] Premier League announce zero positive coronavirus test results https://bit.ly/2Ua8h7F
Premier League announce zero positive coronavirus test results http://dlvr.it/RXgdN7 (DailyEcho)#saintsfc
Bournemouth goalkeeper Aaron Ramsdale says he has recovered from coronavirus after self-isolating for 14 days. Full story https://bbc.in/2MffizG #bbcfootball #afcb
"Brits may be given coronavirus risk scores as UK lockdown eases, scientist says http://dlvr.it/RXgdFf #science"
What a Trunt #Trunt this idiot just gets worse by the day. Coronavirus: Backlash after Trump signals US exit from WHO 
Coronavirus could drag rates down for years: Report 
Coronavirus: Police 'break up birthday party' at Tory MP Rob Roberts's house | Politics News | Sky News 
"With Washington Libraries Closed Due to Coronavirus, Little Free Libraries in Seattle Have Gained New Life (via @seattletimes) http://ow.ly/t1xb50zUCfw"
"U.S. CDC reports total of 1,737,950 coronavirus cases, 102,785 deaths https://uk.reuters.com/article/us-health-coronavirus-usa-cdc/u-s-cdc-reports-total-of-1737950-coronavirus-cases-102785-deaths-idUKKBN2360QQ?feedType=RSS&amp;feedName=healthNews"
Crazy times during the #coronavirus 
Lockdown rules change slightly on MONDAY yet it seems every man and his dog are acting as if the government have just said coronavirus doesn’t exist
Reputation – How coronavirus Britain looks from abroad 
"I think the cruise ship idea was a great one. Since corona virus clearly isn't an issue for the GOP, why not?"
@BBCPolitics @BethRigby given labour closing gaps in opinion polls as UK goes through #coronavirus crisis in 2024. Would you expect to see Labour Party use Government response to this crisis in a campaign and political gain
A Sudden Coronavirus Surge Brought Out Singapore’s Dark Side 
"#COVIDIOTS at #DurdleDoor showing why beaches in #Wales are closed still. There’s still a Pandemic, “it ain’t over yet, despite what #BorisJohnson &amp; the #Govt say” #Covid19UK Coronavirus exposure on that beach will cause a spike. #ViralLoad still applies. Maybe explain VL again"
"BBC News - Coronavirus: 'Dangerous moment' as UK lockdown eases https://www.bbc.co.uk/news/uk-52863446 - the public AREN'T sensible, as I found on my brief trip to a small Co-op today. A lot of people are, in fact, recklessly stupid."
Links for tweet @AngusMacNeilSNP @HannahLind9 @MhairiBlack @Ianblackford_MP @NicolaSturgeon @theSNP @AlexSalmond #indyref #indyref2 #ScotlandsRightToChoose #DissolveTheUnion #exBrit #IamEuropean #scottishindependence #FBPE #CummingsMustGo #ToriesOut #coronavirus #MedalsForHeroes
"#DominicCummings claims to be a super predictor, yet none of his #coronavirus guesses have worked. Oh, except he predicted it in an article he wrote during April of this year. Us lesser mortals have to learn from hindsight. He rewrites history to show his amazing foresight. "
43083 formed 1/2 of my final train journey prior to Coronavirus taking over https://twitter.com/HiPa_IC125_/status/1266829698727895040
New development: Russia approved a flu drug for use in fighting coronavirus after officials said preliminary testing showed hospitalized patients who took the pills recovered more quickly 
@BBC @ITV @SkyNews Coronavirus is a big deal. A lot of people are flouting the rules just to see their mates and get drunk. This is a serious problem. The chances of catching the virus are huge and the longer we continue to break rules the longer the virus will stay.
"Chief Justice John Roberts ""went out of his way to scold Kavanaugh’s dishonest vilification"" in this case of churches seeking to bend rules during the deadly #COVID19 pandemic https://slate.com/news-and-politics/2020/05/supreme-court-coronavirus-california-churches.html @mjs_DC @Slate #coronavirus"
"A man who only gave his first name, Carl, argues with Dr Nesli Basgoz (R), an infectious disease doctor at Massachusetts General Hospital, that masks are not necessary to fight the spread of coronavirus during a protest in Boston. Photo by ⁦@Brian_photog⁩"
"They will have been banging pots and pans for the NHS all lockdown. Meanwhile, the coronavirus death toll in the UK has risen by 215. #SecondWave"
"Coronavirus: Renters struggle most with pandemic costs, report says "
John Roberts once again shows his true colors. Supreme Court sides with California on coronavirus worship service rules. Unreal. 
Mass. reports 789 new coronavirus cases and 50 new deaths 
The government are still pursuing #herdimmunity -adapting to #coronavirus - not building resilience through TTI.
"What a fantastic news. Now, I Like the coronavirus."
Study estimates 24 states still have uncontrolled coronavirus spread - The Washington Post 
"'Denier in Chief we fighting to save our country don't care what you say dangerous moron 100,000+ dead, hundreds of thousands coronavirus infected on your watch as if COVID-19 is not painful enough now more chaos you invited police to abuse minorities George Floyd lost his life."
Whoopi Goldberg believes she had 'some form' of coronavirus in 2019 https://www.independent.co.uk/arts-entertainment/tv/news/whoopi-goldberg-coronavirus-covid-19-pneumonia-sepsis-a9540061.html
If you're going to public protests please dear god wear a mask. America needs her bamfs to stay healthy right now. #protests #columbusprotest #GeorgeFloydProtests #coronavirus #WearAMask
This is fab #SnowWhite #sevendwarfs #lockdown #uklockdown #lockdownuk #coronavirus #corona #Covid19UK #COVID19 #Boris #BorisJohnson #BorisHasFailedUK
Two positive coronavirus tests at Exeter City have been confirmed by Argyle's Devon rivals tonight 
@BorisJohnson @MattHancock great live sport is coming back. How will you stop mass gatherings at homes to watch football especially when there are important end of season games? #pandemic #COVID19 #coronavirus @piersmorgan Thoughts?
Showing two fingers to ‘the science’? BoJo gives green light to lockdown lifting despite NO CHANGE in coronavirus threat level 
"‘Mark Teixeira’s flip play! Now ex-Yankee sides with the players in battle with MLB over coronavirus restart plan’ by @ByKristieAckert for @NYDNSports: Teixeira, an ESPN analyst, said the owners should open their accounting books… https://buff.ly/36J2ris #Yankees"
"Amid protests, New York continues to battle coronavirus https://www.pix11.com/news/coronavirus/amid-protests-new-york-continues-to-battle-coronavirus"
Letters: Dominic Cummings’ actions damage public trust | Coronavirus outbreak | The Guardian 
Do they hear themselves honestly?UK government is actually trash at the way they’ve handled this Corona virus. 
"“I don’t know the date yet, there’s this coronavirus thing going on making it hard to plan medium to long term events. When’s she getting married?”"
Exeter City Football Club confirms two positive coronavirus tests 
If that Coronavirus bill makes it Trumps desk then he is signing it lol
"This country is in a fix that it hasn't been in since the Depression and some Trumpsters are still saying that this guy is the best president. Right now Trump's only hope is finding a vaccine for the curse of the coronavirus. If a vaccine isn't found soon, then Lord, have mercy!!"
"Where Coronavirus Is More Likely To Be Airborne, 5 Places To Avoid https://www.forbes.com/sites/brucelee/2020/05/30/where-coronavirus-is-more-likely-to-be-airborne-5-places-to-avoid/ via @forbes"
Column: Trump’s coronavirus response has been brilliant. Here’s what you don’t understand. 
"And if the Coronavirus protestors armed with assault rifles were black, they would've been killed..."
Coronavirus: How they deliberately terrified us https://youtu.be/kvlhVD5TunY via @YouTube
"I want to see how many get Covid after last night riots! #coronavirus #AntifaTerrorists #COVID19 ,#CoronavirusOutbreak , #riots2020"
"WELCOME TO NEW EMPTY CITY — a once-proud epicenter that is now an eerie empty world because Mass Mainstream Media has brainwashed the Nation (for monetary & political reasons) — yes, Coronavirus COVID-19 is a… https://www.instagram.com/p/CA019wche4_/?igshid=171687wgdaarf"
Social care minister reveals just how offensive Tory coronavirus propaganda really is on BBCQT @OsoSabioUK
"Hundreds of schools in South Korea reopened, only to close again as the country sought to avoid a spike in coronavirus cases "
BBC News - Coronavirus: What are the rules on weddings? https://www.bbc.com/news/explainers-52811509 @YorkVenues
This is the consequence of Tory MPs being appeasers for #Cummings. Chamberlain was a Conservative MP and Leader and we all found out to our cost where the policy of APPEASEMENT will lead.#coronavirus second spike on its way. 
Thank you @EamonnHolmes @RuthieeL will make such a difference to the lives of those with dementia at this difficult time! @alzheimerssoc #saturday #donate #coronavirus 
"“Coronavirus can feel like a mathematical abstraction, an intellectual exercise played out in curves and peaks and troughs and modelling. But here in the hospital, the pandemic is a matter of flesh and blood.” Worth reading and remembering. Heartbreaking. "
Coronavirus: Cases where you live in the UK. Cumbria still has over 2000 cases. If you’re out enjoying the weather stay alert and stay well away from me. https://goo.gl/maps/jmgfFQWikF7QdchD6
"Opinion | Coronavirus, Racism and Injustice: No One Is Coming to Save Us - The New York Times "
so #coronavirus #TRACKandTRACE CAN BE DONE. BUT PENCE AND TRUMP IGNORING TO DO IT
How to take a coronavirus self-test swab https://youtu.be/8lo6g-TYZ-c via @YouTube Fun times 
"Latinos have been hit particularly hard by coronavirus As the pandemic continues to grip the nation, voters of all types, all across the country are looking for leadership on this issue. "
Yes and in doing that you've given the green light for a #SecondWave which will approach in a tsunami form in the next 2 weeks.... #coronavirus #StayAlert there's a tsunami second wave coming...
"For the roughly 56,000 homeless New Yorkers who stay in shelters each night, the coronavirus has left them with little sanctuary. "
South Korea!!!! Coronavirus: South Korea closes schools again after biggest spike in weeks 
EFL confirms 17 positive coronavirus tests after latest round of testing 
BREAKING: #Cyprus - Coronavirus Update (30/05 19:10 UTC) #Health https://www.riskmap.com/incidents/992513/?utm_campaign=riskmap_
"I've lost count of the times @BBCNews have labelled China, Italy or the US as the epicenter of the coronavirus pandemic. I've not once heard them list the worlds highest death rate per capita or 2nd highest death rate UK as the epicenter, wonder why?"
"Tbf to the Coates family they've always been Labour supporters and do very much act that way for their city. For instance, they were one of (if not the first) football owners to pay every full and part time member of staff their full wages during coronavirus and are still doingso"
"‘My God, this thing is really contagious.’ Charlie Baker reflects on the coronavirus crisis "
"More care homes in Northampton affected by coronavirus, according to latest figures "
"BBC News - George Floyd death: Minnesota governor decries violent protests 4 contagions, 2020: The contagion of inequalities The contagion of coronavirus The contagion of racism The contagion of anger Violence not condoned. @BWDDPH @MichaelMarmot"
"""Eventually, doctors will find a coronavirus vaccine, but black people will continue to wait, despite the futility of hope, for a cure for racism....The rest of the world yearns to get back to normal. For black people, normal is the very thing from which we yearn to be free""@rgay"
After what I’ve witnessed today it’s safe to say that the 2nd wave is 100% coming #coronavirus
We're lucky to have such a supportive community in Waternish. How lovely would it be if we came out of all this with a wider society that's just a tiny bit kinder? #StaySafe #StayAtHome #KindnessMatters #SocialDistancing #COVID #coronavirus #spreadkindess
"how many waves before flu season, or should we just count every weekend as a potential wave depending on the weather? PSA: Exposing yourself to the sun or to temperatures higher than 25C degrees DOES NOT prevent the coronavirus disease (#COVID19)"
One member of staff has tested positive for coronavirus at Cardiff City #CCFC #Bluebirds
"Coronavirus Update (Live): 6,111,360 Cases and 369,382 Deaths from COVID-19 Virus Pandemic - Worldometer https://www.worldometers.info/coronavirus/#countries"
 One will never know why CORONA VIRUS has spread amongst communities. 
"All the people on insta right now having parties and drinking with their friends literally right next to each other, I really hope you didnt clap for the NHS every week... hypocrites! Coronavirus hasnt just disappeared because the sun has come out."
"Coronavirus: 'Dangerous moment' as UK lockdown eases “rules are clear, for the benefit of all and apply to all” leadership by deputy cmo on this public health issue... "
Such a beautiful day in Central Park but what's going on with our country? . . . #centralpark #centralparknyc #reflection #agameoftones #heatercentral #coronavirus #corona #virus #isolation #COVID19 #emptystreets… https://www.instagram.com/p/CA01UvKDT_u/?igshid=5q997rqbsa5g
"the coronavirus has numerous names. calling it the “chinese virus” is completely unnecessary and moreover, racist. if you think it’s not, then you should probably think about it. yes, it started in china but calling it by that name is just wrong. there’s many more you could use."
The Cure for Coronavirus is faith in God #MAGA @realDonaldTrump @DonaldJTrumpJr @4theMKP @Brucewayne927 @talktober @KO92792 @SecretaryCarson
"@erasureinfo @AndyBell_info your fab song 'Stop!' Seems quite apt at the moment what with this #coronavirus spreading around keeping us in #lockdown. Get it out there guys!! ""We'll be together again. "
A #SecondWave will always happen with the summer here &amp; people enjoying being aloud to meet friends &amp; family. What we need is a vaccine to be available NOW not next year. #coronavirus 
A new study in the medical journal @TheLancetRheum adds to the evidence that this inflammation-fighting drug (#anakinra) may be worth a try in certain #coronavirus patients: 
"i hope all the selfish pricks that have been meeting in large groups, realise that they have just slapped all the nhs workers and everybody that has died for your families safety in the face. it’s disgusting and shameful smh. #SecondWave #coronavirus "
"The governor also called for an end to ""inequality in healthcare,"" with new testing sites in minority communities hit hard by coronavirus. https://trib.al/2WVTuXG"
"Absolutely awful, as if our hardworking NHS Paramedics and Police Officers haven’t got enough on their plate trying their best in this #Coronavirus pandemic "
"Coronavirus Update, more King Crimson vinyl reissues, Lonely Robot (+ signed card), Morse/Portnoy/George, Joni Mitchell, Steven Wilson (Red vinyl), John Wetton, Gandalf's Fist, Steve Howe, Peter Kearns, Tiny Clocks, Samuel Hällkvist, Jordan Blum +++ https://burningshed.com/newsletters/newsletter_28_05_2020.html"
University of Pennsylvania law professor Eric Feldman says the novel coronavirus has revealed both the failures of international public health policy and the civil rights trade-offs of containing a pandemic in the U.S. and internationally. https://www.law360.com/articles/1266392
A class action lawsuit against Brandeis University seeks tuition refunds after coronavirus forced the college to move classes online 
"With #businesslending in flux due to the coronavirus and loan schemes changing daily due to the coronavirus #emergencybusinessloans, what are the future potential impacts on business lending? https://pin.it/4G2cNjt via @Pinterest"
Non i think now they realise that more will die as a result of the economic catastrophe that is about to engulf us than Corona virus. Shield the sick and the vulnerable and follow the health advice.
How willing will the Fed be just to switch off all the stimulus it rolled out to safeguard markets from the coronavirus? 
Police vs protester vs Coronavirus..2020 is really a wild west standoff
Coronavirus Was Already Spreading in U.S. in January: Study - http://Drugs.com MedNews
