"It’s true, I’m a doctor and I hate Jared Kushner: Kushner Announces Doctors HATE Him After He Discovered One Weird Trick To CURE Coronavirus "
"Seattle sees biggest unemployment jump in U.S. from coronavirus, study finds "
"#FYI: @KING5Seattle @JoshuaFreed @KOMONews @SeattlePI @TacomaHerald @KIRO7Seattle @ToddEHerman @HannaKIROFM @AK4WA - this will be a telephonic-appearance, since the Court is closed for in-person business due to #covid19 #coronavirus"
"Not sure who's running this account but pretty sure you deserve cookies for this alliteration, hit me up when coronavirus is over "
Breaking News! Coronavirus food shortage: Jared Kushner says the national food stockpile is only used for public health emergencies it’s not for states! @holachola @therealwombat1 @wolflayla420 @cm_merlin @karenamyatt @AriadneBoudicca @HillBeverlyhill @Cruellaisdevine
Why did Fauci fund this virus research? Why did Bill Gates use the Corona virus for his Event 201 in October?
 on YouTube: DR ANDREW KAUFMAN - UNMASKING THE LIES AROUND COVID-19: FACTS VS FICTION OF THE CORONAVIRUS PANDEMIC https://www.youtube.com/watch?v=6C_26ZIUlrQ
"My god, most of these people are idiots. Coronavirus Lockdown Protest https://youtu.be/8kkBseVTUow via @YouTube"
the only good thing about this whole coronavirus pandemic is that everything online is on sale. &amp; shopping online is probably the only thing i’m good at 
"""Rosenbach noted the impact of the coronavirus outbreak on the economy as a likely factor in election results."" "
Seattle schools seeks credit waivers for some high school seniors during coronavirus closures https://www.seattletimes.com/seattle-news/education/seattle-schools-seeks-credit-waivers-for-some-high-school-seniors-during-coronavirus-closures/?utm_source=twitter&amp;utm_medium=social&amp;utm_campaign=article_inset_1.1 via @seattletimes
White House coronavirus guidelines to expire as testing challenges continue 
Men are more likely to get sicker and die from coronavirus than women. 
The Angel of the Winds Casino Resort near Arlington will be going 100% smoke-free when it reopens after the coronavirus shutdown. 
“the coronavirus pandemic is a child-rights crisis” More like a human rights crisis. 
"Sad news for physical media fans everywhere: “No one knows what the landscape for #music lovers will look like in the post-#COVID19 era, but one longtime #Seattle landmark is … going away.” #vinyl #vinylcollection #news #pandemic #coronavirus "
"Today's coronavirus numbers: • WA: 14,070 cases. 801 deaths. • Snohomish County: 2,417 cases, 107 deaths. • Island County: 172 cases, 9 deaths. • King County: 6,182 cases, 436 deaths. Details: "
"I wonder if those anti-lockdown protesters are coming down with #coronavirus. Not gloating, just curious. It's been over a week."
#COVID19Coins I see the enemy in all of these pics. Smh. Despicable. #coronavirus 
"NOT THE FUCKING TOES!!!!! """"Frostbite"" toes and rashes may be signs of a coronavirus infection"" "
Still is his coronavirus. I call it COVID45
"Yes, the corona virus has had a large impact on the economy. You might talk to China about that, not the President. He is only trying to keep us safe without destroying the country. As to hats, you swallowed the kool aid, "
Trump threatens no coronavirus aid in states with sanctuary cities - Business Insider 
Link to the full slideshow of coronavirus metrics the governor used today. For anyone who hasn't gotten enough charts and graphs: https://www.governor.wa.gov/sites/default/files/4_29_DataVisualizations.pdf
Hmmm... maybe we should put those back. The world isn't ready for #Covid19 and mummy/plague curse right now. #JustSaying #KOMONews #Covid20 #Coronavirus 
My ass is really sobbing right. The corona virus can’t ruin everything for me 
Big commercial labs given priority for coronavirus testing equipment by feds 
"Here are the six new coronavirus symptoms, according to the CDC - The Washington Post "
"""Based on the data and science, the current order will remain in effect,"" - @GovInslee extends #StayHomeStayHealthy order past May 4th deadline -- gives no new date -- but says he will make another announcement on Friday. https://bit.ly/2SjvVxu #KOMONews #Coronavirus #Covid19"
"EVERYTHING is a fuckin symptom of coronavirus lmao. A headach, a cough, a fever , a rash , a tooth ache, a itchy scalp , a broken finger nail , a smelly breath , dandruff , a scratch on your elbow , a runny nose, upset stomach , diarrhea, Having no symptom is a symptom . https://twitter.com/washingtonpost/status/1255499765934104581"
India’s #CleanEnergy Revolution on ‘Pause’ During Coronavirus Crisis https://www.greentechmedia.com/articles/read/india-renewable-energy-outlook-coronavirus via @JMPyper @greentechmedia #India
"BEFORE This...Trump-Fowled Up Pandemic...Most Working Americans .COMPLAINED.That They NEVER Had ""Enough Time"" Their Lives Were Too Hurried.TOO Busy Now,,All We seem to HAVE IS (Time) Seemingly .LimitLess Time So People ENJOY Cherish These ''Times of the CoronaVirus""But B Safe"
"The deadly coronavirus claimed more lives in Washington state overnight, pushing the statewide death toll on Wednesday to at least 802, according to reports from individual counties. "
Not a good idea florida NBC News: Florida governor announces plan to slowly reopen Sunshine State on Monday after coronavirus shutdown. https://www.nbcnews.com/news/us-news/florida-governor-announces-plan-reopen-sunshine-state-monday-after-coronavirus-n1195271?cid=googlenews-usnews via @GoogleNews
Coronavirus: Germany's rate of COVID-19 infections grows after lockdown eased 
President Trump meets with CEOs of major businesses on jump-starting America's economy weakened by coronavirus -- Fox News
"Cyberscammers are targeting unsuspecting people online, threatening to infect their families with the coronavirus unless they pay money -- Yahoo News"
You already know that more Governors want to do the same fucking thing that @GovKemp racist ass is doing in Georgia. They're going to see how it goes and react. #coronavirus
Coronavirus: Revenge of the Pangolins? 
Governors outflank Trump amid the coronavirus crisis as the president struggles with the basics of federalism 
"Why, no test was done today? #coronavirus #Covid_19Ghana #CoronaVirusUpdates #coronavirusghana"
Oh massa lemme think Coronavirus de trend if you don't know
"poll/ 85% of Americans said it was a bad idea to have students return to schools without adequate testing, a vaccine or medications to treat coronavirus "
"While health care providers & communities struggle to weather coronavirus, @senatemajldr's first priority when the Senate is back is to jam through more judges who want to limit access to health care. I joined @AFJustice to talk about how this is the last thing we need right now."
poll/ 50% of Americans say they or someone in their household has either lost hours or a job due to the coronavirus 
poll/ 47% of adults in the U.S. said they were “very” or “somewhat” likely to follow recommendations from Trump when it comes to the coronavirus 
5/ Trump ordered U.S. intelligence agencies to find out whether China and the World Health Organization initially hid what they knew about the coronavirus pandemic as it emerged. 
"4/ Trump – providing no evidence – promised that the U.S. will be able to carry out more than five million coronavirus tests per day “very soon."" He later claimed that he never said that, blaming it on a “media trap.” "
"The government has eased the country's coronavirus lockdown restrictions and will allow professional teams to resume training on May 11, provided they comply with social distancing restrictions.Recreational https://aziboat.com/swiss-league-set-to-resume-june-8-behind-closed-doors/"
3/ The FDA plans to announce emergency authorization for remdesivir after a federal trial showed the experimental antiviral drug could speed recovery in patients infected with the coronavirus. 
State-by-state coronavirus news updates 
Sen. Lindsey Graham (R-SC) vowed that unemployment benefits won’t be extended by the Republican Senate majority no matter the status of the coronavirus pandemic. 
2/ Dr. Anthony Fauci warned that a second round of the coronavirus is “inevitable.” 
"Half of the Americans confused at coronavirus watch @CNN and your mainstream Democrat media. Everyone else is good. We like the fantastic job @realDonaldTrump is doing, and we adults are confident with the good information from the President."
It’s caused deaths in tests. It has to be closely supervised. It’s a bust for Covid. Sorry. (I have articles frm 3 other countries). FDA warns against using hydroxychloroquine for coronavirus outside of hospitals https://www.nbcnews.com/health/health-news/fda-cautions-against-hydroxychloroquine-outside-hospital-setting-n1191266 via @nbcnews
"1/ Jared Kushner called the coronavirus crisis “a great success story” as the U.S. death toll crossed 60,000, with more than one million COVID-19 cases confirmed. "
Researchers released some good news about a possible treatment for coronavirus Wednesday -- evidence that the experimental drug remdesivir might help patients recover more quickly from the infection. 
"During #Coronavirus, the USPS has kept me connected to vital supplies. Join me in taking action to #SaveThePostOffice"
CHINA Stole Remdesivir from Gilead then Tried to Patent the Drug in January -- Knowing Months Ago It Would Treat Coronavirus and Trying to Make Money off the Pandemic 
I often worry that I personally manifested the Coronavirus pandemic because I wanted more time to relax
"He would have been lifted and then dropped 6 ft in the air and then the ground had it been my Daughter, relative, whoever. These fists aren't a hoax. #coronavirus "
Men are more likely to get sicker and die from #coronavirus than women. 
"The volunteers then reach out to that group of close contacts and make sure they get tested if they are experiencing any coronavirus symptoms. If they don’t have any COVID-19 symptoms or are asymptomatic, the volunteers will still ask the person to quarantine for 14 days."
"Over here, I'd be in a dead heat with completion of the coronavirus vaccine."
"Corona Virus Symptoms Basically Are The Same Feelings You Get When Your Wife Is Checking Your Phone...and you know u are cheating -Difficulty In Breathing -Sweating Profusely -Weakness -Headache -Stomach Ache And when she asks who is Mavis, the dry cough starts.."
"Just stop. ""No matter which side."" Show me where our ""side"" is walking the streets armed over the #coronavirus blocking healthcare workers, ambulances, etc. GTFOH with that bullshit. "
Antibody Tests For Coronavirus: Not As Reassuring As We Need http://www.myhealthbeijing.com/illness/coronavirus-covid-19/antibody-tests-for-coronavirus-not-as-reassuring-as-we-need/
WHAT SERIOUSLY A cohort of largely Democrat politicians is calling on the United States Food &amp; Drug Administration (FDA) to DELIBERATELY INFECT AMERICANS with the Wuhan coronavirus (COVID-19) in order to fast-track the development of a new vaccine. 
Someone asked today on twitter what our favorite word was. Schadenfreude ‘A phantom plague’: Evangelicals (Trump's base) who defied social distancing guidelines are dying of coronavirus in frightening numbers - 
Its also calling every death regardless of true cause of death covid...and calling regular coronavirus cold/flu positive for covid...wake up brother before you get left behind...maybe you want your rights taken over a flu virus...not us...
2 guards at ICE jail die after contracting coronavirus in Louisiana 
Seattle schools seeks credit waivers for some high school seniors during coronavirus closures 
#CcHUB collaborates with #LASRIC to ward off #coronavirus 
"''Don the Con"" Trump..Keeps Calling..This Coronavirus ..''The Invisible Enemy"" ??...Most Of US Know....''The Visible Enemy ""---The RepubliCANT Party ! &amp; The ORANGE Pinocchio .. "
It's been so long since I've done #standupcomedy I'm actually starting to miss drunk people after shows telling me racist jokes... And then letting me know I can use that in my act if I want #comedy #COVID19 #COVIDー19 #CoronaVirusUpdate #coronavirus
Costco Requires Face Coverings For Shoppers During Coronavirus http://dlvr.it/RVjjJp
"Do you know what the 58,000+ dead in Vietnam Nam have in common with the 58,000+ dead tallied this week from coronavirus? Donald Trump refused to fight for either one of them. #25thAmendment Mick Mcloud Porter"
"What happens when the reopening of economies is not uniform? What happens when Washington has reduced the infection rate of coronavirus to manageable levels, but Texas or Georgia has not? "
" Roma are planning to sell Edin Dzeko when the transfer market reopens, as they look to reduce their wage bill amid the coronavirus crisis."
"Seattle sees biggest unemployment jump in U.S. from coronavirus, study finds: https://bit.ly/3bNB1tq #KOMONews"
How Coronavirus Affects Custody Arrangements 
"'What a Threat!': In Latest Effort to Exploit Pandemic, Trump Indicates He May Condition State Coronavirus Aid on Sanctuary City Policies - https://go.shr.lc/2Slos0J via @commondreams"
What is Corona Virus about?
Sheer volume of misinformation risks diverting focus from fighting coronavirus 
Lockdown at US military base in Djibouti as coronavirus spreads 
Coronavirus: How Covid-19 is affecting remittances to Africa http://dlvr.it/RVjhKg
Finally Remdesivir can cure that Corona virus. FDA should approve and produce worldwide. We’re tired tbh 
S.I. coronavirus diary: This fifth-grader is missing sports in more ways than one 
China says US politicians are lying as Trump calls for coronavirus damages https://www.scmp.com/news/china/diplomacy/article/3081951/us-politicians-are-telling-barefaced-lies-china-says-after via @scmpnews
They were hospitalized AND getting care. Regardless of race. Outside of race baiting I don’t see any other reason for this tweet. @CNN #CNN #BREAKING #coronavirus
"My guess is its because income inequality is so high here. KOMO News: Seattle sees biggest unemployment jump in U.S. from coronavirus, study finds. "
"According to @ckchumley, the response to the novel #coronavirus is a “political hoax”, “carried largely on the lips of medical professionals who have no business running a national economy.” Silly medical professionals, pandemics are for economists! https://www.washingtontimes.com/news/2020/apr/28/coronavirus-hype-biggest-political-hoax-in-history/"
Seattle’s First Walk-Up Coronavirus Testing Site to Open in Rainier Beach https://southseattleemerald.com/2020/04/21/seattles-first-walk-up-coronavirus-testing-site-to-open-in-rainier-beach/ via @SoSeaEmerald
"Watching @GovInslee's press conference. I love that he's showing us allllll the graphs, charts and data points regarding coronavirus. Staying home is working!"
Remdesivir: Drug has ‘clear cut’ power to fight coronavirus #3NewsGH Click https://3news.com/remdesivir-drug-has-clear-cut-power-to-fight-coronavirus/
The U.S. economy shrank at a 4.8% annual rate last quarter as the coronavirus pandemic shut down much of the country and began triggering a recession that will end the longest expansion on record. 
Google bans face mask ads globally due to misleading coronavirus claims http://dlvr.it/RVjg4w
"The problem with the Trump #coronavirus response is that coverup is his default response, so he feels like if we can just not test anyone then everything will be alrigur."
Ghana Becomes The Sixth Country With High Coronavirus Cases In Africa https://www.browngh.com/ghana-becomes-the-sixth-country-with-high-coronavirus-cases-in-africa/
Cesc Fabregas confirms his great-grandmother has overcome coronavirus at 95 years of age 
Trump suggests coronavirus funding for states could be tied to sanctuary city policies https://www.reddit.com/r/SeattleWA/comments/gaj11e/trump_suggests_coronavirus_funding_for_states/?utm_source=dlvr.it&amp;utm_medium=twitter #seattle
"I said something similar about the coronavirus shutdowns and international affairs, and I think that the same thing can be said about domestic affairs. Chaos as cover or as a ladder and whatnot. "
The coronavirus disappears.
I don't think I'm ever going to be able to forgive the people who forced me to waste the first time in my life where I knew where my next meal was coming from on anxiety over the fascist president and the coronavirus and the police departments declaring war on the populace.
pretty good bit to throw in that little “oh and yeah don’t wanna spread the coronavirus!!!” there at the end of that press release
Glad we can finally admit that coronavirus was fake then
"...During a state-wide stay-at-home order for death from coronavirus. Oh, 5 pm curfew. ""Peaceful protesters"" are now looting Nordstrom and torching vehicles. But 5 PM curfew works I guess. "
"#EWU Music Professor Jody Graves joined @SpokesmanReview's Northwest Passages bookclub on Friday, May 22, to discuss the importance of music to help us all get through this pandemic: https://buff.ly/3cgmVjz #coronavirus "
The American president wants war with China over Corona virus (of he hasn't started already) Ecclesiastes 3:8 But i guess you won't read because it's not in the Quran 
"One more death has been recorded whilst 119 Coronavirus patients have recovered in the last 24 hours, bringing the total number of... "
Coronavirus over ?
"Coronavirus Slams Broken, Embattled Yemen "
Wait what happened to the coronavirus?
"We don't know for coronavirus. If there is any fading due to hot weather, it means more resurgence in fall, so not necessarily good news."
It’s crazy how the riots got the media forgetting about the corona virus 
Article Wan - Corona Virus (Prod. By Bigboy Darling) ~ via #BlissGh
"Washington state is supposed to be in a stay-at-home coronavirus order. Besides the protesters, why are all these people doing driving on the freeways? I am the only one actually staying at home aren't I? "
And just like that...the left forgot about the coronavirus plandemic..right on que for the next thing to blame on @realDonaldTrump
When the CDC tries to do its homework over breakfast on the day it's due: Congress Asked The CDC For Data On How The Coronavirus Is Affecting Communities Of Color. The CDC Sent Back Links To Its Public Website. 
"Let's see NO WITNESSES, NO DOCUMENTS, FIRING INSPECTOR GENERALS, REFUSING TO ANSWER SUBPOENAS, RUSSIAN HOAX, UKRAINE HOAX, IMPEACHMENT HOAX, CORONAVIRUS HOAX, Press Enemy of the People, calling Joe a murderers, aggravating a highly charged situation with irresponsible Tweets! "
Trump must be happy that the news cycle is all on the protests and not on the coronavirus deaths and the thousands out of work.
N.Y. lawmakers call for cannabis reform to boost post-pandemic economy (via @420intel): https://420intel.com/articles/2020/05/27/ny-lawmakers-call-cannabis-reform-boost-post-pandemic-economy #cannabisindustry #cannabis #coronavirus
#Facebook releases features to aid businesses amid the #coronavirus #pandemic
#CaptainAmerica seems to have been advertising the #coronavirus future in 2011: https://gematriaeffect.news/captain-america-2011-film-appears-to-show-coronavirus-predictive-programming/
"278 new coronavirus cases have been confirmed in Washington, bringing total cases to 21,349, including 1,118 deaths, the state Department of Health says. "
Coronavirus: India to loosen lockdown despite record cases http://dlvr.it/RXgqZx
"Today's coronavirus numbers: • WA: 21,349 cases, 1,118 deaths. • Snohomish County: 3,339 cases, 148 deaths. • Island County: 178 cases, 11 deaths. • King County: 7,993 cases, 567 deaths. Details: "
In 5 years were gonna look back at the corona virus and think about how it was one of the most overblown political ploys in modern American history
New York City preparing to reopen after coronavirus lockdown 
A-Nigerian-couple-has-told-BBC-OS-that-the-coronavirus-restrictions-have-been-wonderful-for-their-marriage 
These protests in the midst of the Coronavirus pandemic. God help us all..
Guess they are no longer worried about the coronavirus
"All drugs and pharmaceuticals deemed to have potential to slow or mitigate damage should be tested under accountable scientific methods, with experiment, when shown amenable. In case of #coronavirus, lung cell apoptosis by TNF-α inflammation should be mitigated with inhibitors. "
One more person has died from coronavirus in Ghana bringing the country’s death toll to 35. According to the update provided by... https://is.gd/C9KMPz
This kind of looks like a disaster for coronavirus transmission mitigation. 
Coronavirus: Backlash after Trump signals US exit from WHO | More here: https://bit.ly/trumpcovidwho #CitiNewsroom
Coronavirus: Backlash after Trump signals US exit from WHO | More: https://bit.ly/trumpcovidwho #CitiNewsroom
"Your reply was racist in itself. China did not give us a virus. We, Americans brought it in from both China and Europe. But keep believing Drumpf's bullshit. This is not a Chinese Virus. It is called Coronavirus. Practice saying it."
About 75% of Trump’s proposed coronavirus capital gains tax cut would go to the top 1% of earners https://www.salon.com/2020/05/30/about-75-of-trumps-proposed-coronavirus-capital-gains-tax-cut-would-go-to-the-top-1-of-earners/ #SmartNews
Guest At Packed Memorial Day Weekend Pool Party Tests Positive For Coronavirus 
You encourage people to get infected with Coronavirus putting them and innocents at risk. Let that sink it. It won't because you are such a phony outraged sneering condescending narcissistic bitter cold greedy lying something that is not human.
"If these protests lead sudden spikes in coronavirus, the right wing will suddenly become virus experts and start scolding the left. Although isn’t clear that the stay at home protests ever led to any spikes. That’s already long forgotten though."
"“With restaurant closures due to #coronavirus, the seafood industry has been hit hard. The drop in demand has forced fishers to get creative in their methods. A new tool through the @uw has compiled info about where to find seafood in the form of a map.”"
"My sister/My brother, in this day and age, why are you not using a phone case? We know how the Coronavirus pandemic is taking a toll on the wallets of individuals and we have decided to slash prices off the… https://www.instagram.com/p/CA062prnSbT/?igshid=1ckls6eprvh2r"
Trump reportedly 'furious' that Germany's Angela Merkel turned down his G7 Summit invitation over coronavirus concerns https://www.businessinsider.com/angela-merkel-rebuffs-trumps-g7-summit-invitation-due-to-coronavirus-2020-5?utmSource=twitter&amp;utmContent=referral&amp;utmTerm=topbar&amp;referrer=twitter via @businessinsider
Coronavirus death to cases ratio 
"GOOD DOGS AS PUPPIES: Asia & Mia when they were puppies. #gooddog #lockdown #coronavirus #seattledogs #pnwdogs #stayhome #puppy #goodpuppy @Seattle, Washington https://www.instagram.com/p/CA0u-OFKbmp/?igshid=1k1dqjh8w94zx"
"As Washington considers reopening schools, emerging research hints that closures helped contain the coronavirus "
"@andrewrsorkin @CNBC @realDonaldTrump is this person, Andrew Sorkin, really blaming trump for the 100k deaths from the corona virus? Did he really scream at Joe and blame Trump for the deaths?? REALLY. CNBC needs to unemploy mr sorkin."
Fellow Ghanaians may i remind u that corona virus will end by June.!
"Lest you forget with everything else that is going on we are still in the middle of a pandemic. Companies are still exploiting their workers & not protecting them from infection. https://crooksandliars.com/2020/05/every-single-worker-one-tennessee-farm-has #coronavirus #trumpdeathtoll105K 105,000 dead under the GOP &amp; trump."
Democrat governors across the country are getting their orders from the top (communist) down to release prisoners with the excuse that it's because of the coronavirus. That's BS! Don't forget that the coronavirus is the onset of reducing the world's population. Bill Gates' plan.. 
10 questions about the coronavirus that urgently need answers 
About 75% of Trump’s proposed coronavirus capital gains tax cut would go to the top 1% of earners #SmartNews
"The number of people reported to have died of the coronavirus in the U.S. surpassed 100,000 this week, but an analysis of overall deaths during the pandemic shows that the nation probably reached a similar terrible milestone three weeks ago. "
Are you or a loved one at high risk for serious illness from the novel coronavirus? Avoid close contact with others. Visit https://bit.ly/3ckqkOx
"Americans: We rioting, to hell with social distancing Corona virus: "
"~1% of kids who visited a #Seattle hospital in April had been infected with novel coronavirus, according to first large-scale survey for antibodies in children. The study found most of the youngsters developed a robust immune response, an encouraging sign for a future vaccine."
"Hillary didn’t work, impeachment didn’t work, coronavirus didn’t work... Which party would try and use a race war to remove Trump from office? Racism won’t work."
Treating Mild Cases of Coronavirus Could Save Lives | http://Newsmax.com https://www.newsmax.com/health/health-news/virus-treatment/2020/05/22/id/968589/?ns_mail_uid=f0491925-d0cf-492a-a607-a7e8bca88d1c&amp;ns_mail_job=DM112438_05302020&amp;s=acs&amp;dkt_nbr=0101029qp43d via @Newsmax
These protests are going to usher in the second wave of coronavirus.
Finally a vaccine for Covid19 is out . No more corona virus . . . . . #usa #covid19 #covid_19 #virus #vaccine #free #freedom #happy #likeforlikes #share #follow #instadaily https://www.instagram.com/p/CA04X8_JtVY/?igshid=70cdjwvtycsu
