Large-scale survey of Seattle-area kids shows 1% had antibodies to the coronavirus https://www.seattletimes.com/seattle-news/health/in-big-survey-of-seattle-area-kids-1-had-antibodies-to-the-coronavirus/?utm_source=twitter&amp;utm_medium=social&amp;utm_campaign=article_inset_1.1 via @seattletimes
"A teen's guide to managing your parents, relationships and coronavirus. "
"You've likely noticed the little boxes before, almost looking like a birdhouse for books. They're Little Free Libraries, and amid the coronavirus pandemic, they've been a more vital resource than ever for bolstering community reading. "
Nigerias-Coronavirus-Cases-Exceed-9000 http://dlvr.it/RXgdkZ
"Ghana's Coronavirus Cases now 7,768. Will President @NAkufoAddo lift the restrictions on public gatherings tomorrow? @konkrumah @MBawumia @askattuh @GabbyDarko @NditsiD @JohnTerryTresh @DrSelOcansey @JDMahama @SBawumia @RAkufoAddo @KSM_Kwaku_Misa @nanakwame_ @QuinSenaya @agbana"
Coronavirus preventing Arsenal transfer talks with Thomas Partey Read:https://ghanasportsonline.com/2020/05/coronavirus-preventing-arsenal-transfer-talks-with-thomas-partey/
104k. What are doing about the coronavirus. Get your house in order.
"Nigeria’s Coronavirus Cases Exceed 9,000 .... "
"Will he do the same for the gun-toting coronavirus deniers protesting the stay at home orders, too?"
"100% true - the #Coronavirus is 0.15 microns and most of these cloth masks don't even filter at 5.0 microns. Plus, the hot/moist surfaces of the cloth around the nose and mouth provide for a petri dish effect (incubation platform) for the virus particles."
"Ghana’s Coronavirus cases have risen to 7,768 as of Saturday, May 30, 2020. The number of recoveries has also shot up to... "
Coronavirus: South Korea closes schools again after biggest spike in weeks 
Coronavirus: Tema Cops Shooting Inside Story 
Coronavirus Impact: Opportunities For Businesses To Thrive And Explore New Territories 
How is *your* coronavirus quarantine hair coming? Post your best shot or video and tag me. #coronavirushair #quarantinecuts https://www.instagram.com/p/CA00jKYAvkU/?igshid=1qvg7ukwyik5r
Be transparent about MPs coronavirus infections – Mahama to Parliament 
The #coronavirus has you on lockdown. Dont make this something its not.
Coronavirus: How they deliberately terrified us https://youtu.be/kvlhVD5TunY via @YouTube
"Let's fight Corona virus together by using CHOICE CONCENTRATED DISINFECTANT for floors, surfaces, car door handles and spraying of environment to kill all germs whiles we use CHOICE HAND SANITIZER GEL on our hands.… https://www.instagram.com/p/CA0zaXSnCmc/?igshid=8srohe2rznxh"
Islamic Fundraising Group Claimed Coronavirus is Divine Justice From Allah https://gellerreport.com/2020/05/islamic-fundraising-group-claimed-coronavirus-is-divine-justice-from-allah.html/ via @pamelageller
CDC to resume coronavirus briefings after being sidelined by White House - CNNPolitics 
Meteorologists are predicting a 2% chance of a tornado in Eastern #Washington today so be sure to shelter in place... Because that's three times the odds of you getting #Coronavirus. #CoronaVirusUpdate #CoronavirusPandemic #COVID
"How do you get an 89% favorability rating from a base of what, 3? Oh I am soooo sick of the Orange disease. I’m so tired of Coronavirus and piss poor spellcheck, and sitting at home, and doctors appointments, and cannulas, and, and, and, and..."
"Regular old flu is a virus that killed 80,000 Americans in 2017-18. Regular old flu is a virus, that mutates. Common cold is coronaVIRUS. It is part of annual viral load. They are learning about CVD19 by studying its family of viruses. What's next, you're a science denier?"
"#Coronavirus: South Korea closes schools again amid coronavirus biggest spike, days after reopening #Thrillernewsgh"
Corona Virus clap for your self 
My 6yo: Are they going to cure the coronavirus? 
South Korea closed hundreds of schools that had reopened days earlier — and postponed the opening of many others —after a spike in cases of the coronavirus. 
You numb the senses with your stupidity. The #coronavirus aka #TrumpVirus response was fucked up because you disbanded the response team merely bc it was created by Obama. Big fail. @GOP @WhiteHouse
Supreme Court Rejects Challenge to Coronavirus Limits on Church Services http://dlvr.it/RXgXJl
"Did I say that? No. What it is is coronavirus (unique.) Do you know that 7-15% of the viral load every flu season is coronavirus. Geez, read, please????"
Akufo-Addo deserves 80% for ‘marvellous’ coronavirus fight – Maurice Ampaw https://xplonlinegh.com/2020/05/30/akufo-addo-deserves-80-for-marvellous-coronavirus-fight-maurice-ampaw/
Akufo-Addo deserves 80% for ‘marvellous’ coronavirus fight – Maurice Ampaw https://xplonlinegh.com/2020/05/30/akufo-addo-deserves-80-for-marvellous-coronavirus-fight-maurice-ampaw/
Akufo-Addo deserves 80% for ‘marvellous’ coronavirus fight – Maurice Ampaw https://xplonlinegh.com/2020/05/30/akufo-addo-deserves-80-for-marvellous-coronavirus-fight-maurice-ampaw/
Akufo-Addo deserves 80% for ‘marvellous’ coronavirus fight – Maurice Ampaw https://xplonlinegh.com/2020/05/30/akufo-addo-deserves-80-for-marvellous-coronavirus-fight-maurice-ampaw/
Akufo-Addo deserves 80% for ‘marvellous’ coronavirus fight – Maurice Ampaw https://xplonlinegh.com/2020/05/30/akufo-addo-deserves-80-for-marvellous-coronavirus-fight-maurice-ampaw/
"There have been no new cases among Premier League players and staff in the latest round of coronavirus testing, it has been confirmed. Details here: "
We are suffering from a Coronavirus pandemic exacerbated by an epidemic of intolerance inflamed by an infection occupying the White House. The absence of integrity in the GOP means the only hope for improvement is an election followed by self-inspection for signs of hate.
He believes 5G was the reason for the coronavirus
"Forget Mr Drew And His Music Heist. Fellow Ghanaians , Pls Tell Kennedy Agyapong That Some Pastor Here Also Say Them Cure Coronavirus For His Church o #riots2020 #protests #Tife #georgesfloyd #mineapolis"
Ghana behind only Germany in efficient management of Coronavirus – MP 
"CON DON and his RUSSIAN HOAX, UKRAINE HOAX, IMPEACHMENT HOAX, CORONAVIRUS HOAX, TRUMP GOLF HOAX (shot 92 turned in a 72). How many hoaxes does it take for you to ask how is this chaotic deceitful administration calls eveything a HOAX! 20 women accuse him and you believe him! "
"About 1% of kids who visited a hospital in April had been infected with the coronavirus, according to the first large-scale survey for antibodies in children. The study also found most developed a robust immune response, a good sign for a future vaccine. "
Coronavirus MAPPED: Countries affected as WHO declares global emergency 
An important read: #coronavirus #virus RT What is a #superspreader? An infectious disease expert explains https://theconversation.com/what-is-a-super-spreader-an-infectious-disease-expert-explains-130756?utm_source=twitter&amp;utm_medium=footertwitterbutton via @ConversationUS
Corona virus for free
"Mine too, sheesh the stress and triggering is awful. Now we learn the “Corona” virus is going to give us all a very good ending."
"On a positive note, coronavirus concerns caused my building manager to clean/sanitize the public spaces."
World Health Organization Declares Spread of Coronavirus a Global Health Emergency 
i’m sick rn... y’all think i got the coronavirus...? 
"I guess, but that tweet didn't give the full context. he said: “Well, first of all, every American’s heart has to go out to the victims of the coronavirus. So I don’t want to talk about a victory lap over a very unfortunate, very malignant disease. 1/2"
I think he thinks the Corona virus is caused by drinking beer
"This is horrible and I'm sure manifesting everywhere. Please, please, please it's on EVERYONE to put a stop to whatever misguided racist words and actions might bubble up in your circles and communities #Coronavirus "
Ghana is very much ready should there be any reports of coronavirus.. I hope soo 
"The new coronavirus has been declared a global emergency by the World Health Organization, as the outbreak continues to spread outside China... || @BBCWorld #coronavirus #bbc"
Washington public health leaders say they are still watching a handful of people who may be infected with the new coronavirus. But no one has tested positive since the first case — a man from Snohomish County — was diagnosed. More from @WStoneReports.
Wuhan coronavirus leads to more premature scapegoating of #bats https://www.merlintuttle.org/2020/01/30/wuhan-coronavirus-leads-to-more-premature-scapegoating-of-bats/?fbclid=IwAR0COMnaPKDHCnkMLF5DKxhp5ZRnwUEnF59PV0XDH3btsSw8ydzUdyu7qxc
"CW: racism, sinophobia Using corona virus for clout is the worst. Don’t be this guy "
REALLY ?! Now it’s ok for you to interfere?! After is spreading all over the world?! Why not going to China 3 or 5 weeks ago? World Health Organization declares coronavirus outbreak a public health emergency 
Japan confirms 11th case of coronavirus infection | NHK WORLD-JAPAN News https://www3.nhk.or.jp/nhkworld/en/news/20200130_29/
WHO declares emergency over coronavirus outbreak | NHK WORLD-JAPAN News https://www3.nhk.or.jp/nhkworld/en/news/20200131_06/
"NOT REPORTED: Metro proposes new China quarantined at Swedish Appears to find out of the time for Coronavirus, Boeing's Falcon Problem"
Face mask shortage hits Europe and US as coronavirus spreads https://www.ft.com/content/ea0b15e2-436f-11ea-a43a-c4b328d9061c via @financialtimes
You must be relieved! Thanks to the Corona Virus.
I no dey barb...There's a disease going viral so contagious and kills.. CORONAVIRUS....started in China..spread through Europe..and now has found it heads in cote'd voier...killing millions ..and we are here talking about #sexypoloo....Masa we need preventive measure oo..
"is linked to Beijing''s covert biological weapons programme."" Bats, snakes, animals sold for food in Wuhan markets may be the original source of Coronavirus. Research animals peddled for food? A little side deal that got out of hand? "
WHO Declares Coronavirus Outbreak A Global Health Emergency 
Coronavirus got Asians feeling like Africans when Ebola was the new hot disease to kill mankind...shits so weird in this world lol
"""The (technically) DEADLY coronavirus!"" I somehow doubt that NPR would report that my neighbors are sick with the ""deadly"" influenza. As far as headlines go, I've seen worse, but news orgs could be doing much better."
Can anyone find and point to a misinformation/fake post about the coronavirus? #spring20_34214
@LuiCalibre thank you for hanging out with my for 10 minutes at #TwitchCon ...since we did that we should play games together. #FriendshipGoals #coronavirus
U.S. pilots sue to cancel #China passenger flights @AmericanAir @FoxNews #coronavirus #WuhanVirus #virus
Coronavirus check in: There are a few new people getting tested as of today in Washington St. -still 1 case in Washington -9 people getting tested -8 already tested and are negative for virus https://www.doh.wa.gov/Emergencies/Coronavirus @KUOW
"Coronavirus, declared a global health emergency. W.H.O."
World Health Organization declares coronavirus outbreak a public health emergency 
In case you missed it: Old? Stay Home. #coronavirus RT #WHO declares #China virus an international emergency
Supply chains plan for coronavirus disruption https://www.supplychaindive.com/news/supply-chains-coronavirus-disruption/571312/ via @SupplyChainDive
"Reaching plague level? http://dailyheadlines.net/china-threatens-social-media-users-with-seven-years-in-prison-for-reporting-pandemic-news-that-doesnt-parrot-official-stories/?utm_source=Newsletter&amp;utm_medium=DH&amp;utm_campaign=email China Threatens Social Media Users with Seven Years in Prison for Reporting Pandemic News that Doesn’t Parrot “Official” Stories With coronavirus infections having leapt nearly 30% in one day in mainland China, U.S. health Pg. 2"
TOMORROW: on the @SaulSpadyShow : Independent Reporter @ACLHaynes calls in to give an update on Hong Kong and the coronavirus. LISTEN to his latest call here: https://bit.ly/38SuMma
What we know about the coronavirus evacuations to Christmas Island https://www.abc.net.au/news/2020-01-31/christmas-island-wuhan-coronavirus-evacuation-logistics/11911508 via @ABCNews
"Hi Rachel, according to the Center for Disease Control, the current risk to the U.S. public from this novel coronavirus is currently low, but you are not alone in your concern. More about it on our site here: https://bddy.me/36GdxD9 - RJ"
Carrasco running from coronavirus like Suiiiiiii!! 
"China completes 1,000-bed coronavirus hospital in just 48 hours "
The name sef be racism. Listen to “Ebola” and “corona virus” lol
4 Simple Precautions That Will Help You Avoid the Coronavirus 
"he new corona-virus has been declared a global emergency by the World Health Organization, as the outbreak continues to spread outside China."
Tasty food for a bigger cause. @zhengcafe in Seattle that serves treats from the Wuhan province has seen a drop in business since #coronavirus outbreak. But as they struggle to stay open they are also collecting donations to send back to China. #KOMONews
"Or their lack luster job on handling the coronavirus, and their censorship making it harder to spread useful info"
my classes are over for the week might read a 50 page article on coronavirus for fun
Coronavirus? Don’t worry we have our best people on it 
All three UW students tested for the coronavirus have now tested negative for the disease as expected 
WHO declares Coronavirus global public health emergency https://hypercitigh.com/top-story/who-declares-coronavirus-global-public-health-emergency/
"""Thousands held on cruise ship over suspected coronavirus case"" "
"Coronavirus has been declared a global emergency by the World Health Organization, as the outbreak continues to spread outside China. "
Eastside #FilAm family mistaken for Chinese denied service Historical Asian immigrant fear mirror trope of foreigners Public Health threats #Masks apparent with #coronavirus 1 case verified in WA #filipinoamerican #hapa #AAPI #koreanamerican #asianamerican https://www.insider.com/wuhan-coronavirus-kid-turned-away-food-samples-at-costco-2020-1
"The coronavirus has been in existence since the late 90's n 2000's. It used to be on animals then the first human infection was recorded in the early 2000's but it wasn't serious, now de3 is declared global threat."
Coronavirus explained: What is a global public health emergency? What happens now? 
"Here is an AWESOME update on the Coronavirus. If you have any questions, or just want to stay educated, please read through this post. Stay safe! https://www.reddit.com/r/worldnews/comments/ewb1jk/coronavirus_is_declared_global_emergency_by_world/fg0x22x?utm_source=share&amp;utm_medium=web2x #CoronaOutbreak #coronarvirus"
A red dot puts Washington’s only known coronavirus case far from where it actually is located. 
Chinese Regime Grossly Underreporting Scale of Novel Coronavirus Outbreak https://www.theepochtimes.com/chinese-regime-grossly-underreporting-scale-of-novel-coronavirus-outbreak_3221854.html via @epochtimes
You're welcome. I warned you for weeks that Big Shortsellers + #NotUncertain Investors were placing bets to protect their investments and profit from #CoronaVirus #COVID19 pandemic. #BuckleYourSeatbelts #TrayInUprightPosition #BraceForImpact
#Agile investing: only way to protect + grow any investment. How? 24x7 gathering all information + then acting on it. Just like Big Shortsellers + #NotUncertain Crowd placing bets early Feb on #CoronaVirus #COVID19 to protect &amp; profit from the #pandemic.
"#BREAKING US State Dept issues ""Level 3: Reconsider Travel"" travel advisory for #Italy re: #COVID19. There are 4 advisory levels; ""Level 4: Do Not Travel"" is the strictest. #SouthKorea &amp; #Mongolia have Level 3 #coronavirus-related advisories. #HongKong &amp; #Japan are at ""Level 2."""
I watched this and I’m truly worried about the US healthcare systems ability to treat patients that have #COVID19 complications. It is incredibly worrying #COVID19US #Coronavirustruth
THIS is why @VP Pence put Mnuchin &amp; Kudlow on the #COVID19 taskforce. It's not about preventing or preparing for a pandemic. It's about protecting their money. 
"Sorry to read #CoronaVirus stock plunge hit #CalPERS. I am, however, quite certain that #agile investing @CalPERS will be the rule under 5-yr plan. Since late Jan, early Feb I've posted how Big Shortsellers + #NotUncertain Investors made bets to profit &amp; protect from #COVID19. "
"To all those wanting respirators, you can purchase them if you want them, just don't share them. You can purchase them at #HomeDepot, #Lowes, #AceHardware, #SherwinWilliams, http://Amazon.com and http://Uline.com are great choices. #BSafe #COVID19 "
"Wells Fargo Investment Institute discusses the coronavirus, uncertainties about U.S. presidential elections, and market volatility. Here’s what you need to know: #COVID19 #investors http://voices.cf.socialware.com/zyavc19"
"Prior to joining the Allen Institute for #Immunology, bioinformatics analyst Richard Green worked in infectious diseases and published a preprint on #Covid19. Read paper: https://www.biorxiv.org/content/10.1101/2020.02.19.957118v1.full.pdf Learn more about our work: https://alleninstitute.org/what-we-do/immunology/"
"#COVID19 Is nothing 2 play around with. With a weakened immune system chances R challenging at best. B aware of those sneezing N coughing. Cough into ur sleeve, not ur hands, wash hands immediately. Don't use peoples keyboards, clean phones as well. Minimize sharing office equip. "
Extreme measures... #Coronavirus #COVID19 
Please watch Dr. Paul’s video update regarding the latest news from the quarantine at @NAVCENTRE. #coronavirus #2019nCoV #COVID19 @CityofCornwall http://ow.ly/J0h950yz2hQ
#coronavirusus #COVID19 Myths 
@RampCapitalLLC @freezerohedge @realDonaldTrump Perfect. We need tax cuts! More consumption and lower taxes will cure #coronavirusus #COVID19 #MAGA. #trillionardeficitsdonotmatter @GOP
Agree. I worry this translates to “CT scan all patients with viral syndrome to find #COVID19 cases”. Wrong message!
We're sharing this message from @WADeptHealth. The best way to protect yourself against viruses like #COVID19 is to wash your hands! Visit https://www.doh.wa.gov/Emergencies/Coronavirus to learn more about our WA’s response to the #NovelCoronavirus
H&N Group Pulls Out From Seafood Expo North America https://www.linkedin.com/pulse/hn-group-pulls-out-from-seafood-expo-north-america-todd-wendt/?published=t #SENA20 #COVID19 #Coronavirus #SeafoodHeadlines
"RT @BogochIsaac: Hard to keep up with #COVID19 news, but to my knowledge, countries reporting their first case today include: -Netherlands -Lithuania -Belarus -Iceland -Azerbaijan -New Zealand -Mexico -Nigeria (&gt;45 countries reporting cases)"
H&N Group Pulls Out From Seafood Expo North America https://www.linkedin.com/pulse/hn-group-pulls-out-from-seafood-expo-north-america-todd-wendt/?published=t #SENA20 #COVID19 #Coronavirus #SeafoodHeadlines
This should be fun... We will spend the next week debating different estimates on the % of presumptive that will become confirmed. The level of trust for local PHAs vs. CDC will be tested at all levels and from all angles. #COVID19 
Follow @infodemicblog for easy ways to combat #coronavirus disinformation from WSU's Mike Caulfield. Here's a good one. #covid19 #COVID19US
Hey anyone else notice how #Russia has reported only 2 (two) #covid19 infections? A huge nation with the economy less than Texas... What's up with that? #CoronaVirusUpdates #coronavirusus #COVIDー19
"SCOOP (#COVID19) via @washingtonpost's @JStein_WaPo &amp; @AshleyRParker: ""#Trump administration officials are holding preliminary conversations about economic responses to the #coronavirus."""
Bill Gates: #Coronavirus may be 'once-in-a-century pathogen we've been worried about' #covid19 #sarscov2 #coronavirususa
"No wonder #H1B Predator Bob Iger took chairman escape pod. Not one word on #materialimpact of #CoronaVirus #COVID19 on #BoxOffice or parks from Disney $DIS, Warner Bros #WarnerMedia $TWX, Universal Pictures #NBCUniversal $CMCSA, Sony Columbia $SNE, and #Paramount #Viacom $VIA."
It’s official #ITB #ITB20 cancelled. Jaw. Drop. #COVID19 
"I just read the article, and it looks like the headline might be a bit disconnected from the article. The article gives good solid advice on how to avoid transmission of diseases, general, not specific COVID19."
Should pet owner be concerned about #covid19? @CDCGlobal has all the answers:
me: A life without you will be so exciting #covid19: Seriously?? May the Lord protect us
"#BREAKING #JeromePowell, #FederalReserve chair, issues stmt re: #COVID19 and the United States's #economy: ""The fundamentals of the U.S. economy remain strong. However, the #coronavirus poses evolving risks to economic activity."""
Read DGH Chair Judy Wasserheit's quotes in this @nytimes story on people having coronavrius without showing symptoms. #COVID19 STORY: https://nyti.ms/2T719Zi
"Simple ways to prevent the spread of #COVID19 in your workplace: Promote regular thorough hand-washing Put sanitizing hand rub dispensers in prominent places around the workplace &amp; provide access to places where staff, contractors &amp; customers can wash their hands with &amp; "
"COVID-19 could be a once-in-a-century pandemic, but the good news is that there are steps we can take now to slow its impact and help us respond more effectively when the next epidemic arrives. #COVID19 "
"Do NOT fall for Trump’s propaganda!! “Together, we are powerful. Our greatest enemy right now is not the #coronavirus itself. It’s fear, rumours and stigma. And our greatest assets are facts, reason and solidarity.” #COVID19 https://twitter.com/DrTedros/status/1233445856428331009"
This is a good summary for #coronavirus #COVID19 as well as #flu or any #epidemic
The @GatesFoundation is committed to supporting the global response for #COVID19. We are investing in helping Africa &amp; South Asia respond as they work to save lives &amp; slow the spread. Let us all come together to accelerate vaccines &amp; treatment! 
Did anyone make a gif yet of Mike Pence rubbing his nose then shaking hands after the Covid19 WH Presser yet?
"Amazing startup in Singapore, Mirxes -doing their part to help the world to combat #COVID19 ! Love that @iadriantan and @wework Singapore team supports this great startup."
Good summary from @NIAIDNews and @CDCgov leadership about where we’re at and where we need to go in the fight against #COVID19 
"This is like the Iranian press conference where the Deputy Health Minister kept looking like he was about to pass out, kept sweating profusely and needed to continually remove his glasses and wipe the sweat that was dripping down into his eyes. Next day - he has #COVID19."
"A lesson from #COVID19 *is* that better, universal access to prevention, screening, and treatment help everybody! But this is just too far-reaching a statement. People will be unequally impacted AND we should strive to provide healthcare to everyone. "
1/ Walking by the fence at night just outside the International School of Prague... #COVID19. Here is what they posted by all of the entrances to the school. 
"This is the way you should always wash your hands, but now carries a bit more weight because of covid19 "
"So proud of @oxfara, featured in @TIME about covid19 in Indonesia! "
"#Coronavirus: Japanese woman tests positive for second time ""She first tested positive on 29 January and was discharged from hospital after recovering on 1 February, before testing negative on 6 February."" #COVID19 #Sars2 https://www.theguardian.com/world/2020/feb/27/japanese-woman-tests-positive-for-coronavirus-for-second-time via @guardian"
"Here, how about this: Trudeau is a moron, right? So is WA State gov Inslee. Trudeau hasn’t stopped travel from countries w outbreaks. Like Iran. A whole bunch of people in Vancouver w COVID19. The Seattle/Vancouver border is quite busy. It’s already here. FDA delayed tests."
"#Coronavirus: Japanese woman tests positive for second time ""She first tested positive on 29 January and was discharged from hospital after recovering on 1 February, before testing negative on 6 February."" #COVID19 #Sars2"
via @NYTOpinion: Trump on #COVID19: It’s actually good for America; it’s a hoax perpetrated by the media and Dems; it’s no big deal; people should buy stocks; we’ll get it all under control under a man who doesn’t believe in science. 
"#Coronavirus: Japanese woman tests positive for second time ""She first tested positive on 29 January and was discharged from hospital after recovering on 1 February, before testing negative on 6 February."" #COVID19 #Sars2"
"Just wait until it turns out that Mar a Lago, with all those Chinese nationals and spies hobnobbing with Trump & Co, with its members who visit Asian “massage parlors,” IS A #COVID19 HOTSPOT. The odds are HIGH. Oh man."
"Except... ""Dr. Anthony S. Fauci, one of the country’s leading experts on viruses and the director of the National Institute of Allergy and Infections Diseases, told associates that the White House had instructed him not to say anything else without clearance."" #covid19"
The Circumspectator is out! https://paper.li/MissCircumspect/1365889577?edition_id=af4cd5c0-5a3b-11ea-99c6-002590a5ba2d Stories via @OkayAfrica #covid19
The role of the environment is one missing puzzle in the fight against #coronavirus #COVID19 @AspenNewVoices
