"#niet_in_journaal #US #military #COVID_19 The complete list of military coronavirus cases by base, as second Navy ship faces a major outbreak "
Will you go back to shows and big events as soon as the lockdown ends? Do you still hope to use your unrefunded concert tickets? https://bit.ly/2y3WiAG #coronavirus #COVID19Pandemic #poll #Reuters
Wall Street rallies on promising coronavirus drug http://www.myheadlinez.com/40506350/Wall-Street-rallies-on-promising-coronavirus-drug/
Michigan doctor charged with fraud after allegedly touting vitamin C infusions as coronavirus treatment http://www.myheadlinez.com/40506340/Michigan-doctor-charged-with-fraud-after-allegedly-touting-vitamin-C-infusions-as-coronavirus-treatment/
"the mayor said in one post. “When I heard, I went there myself to ensure the crowd was dispersed. And what I saw WILL NOT be tolerated so long as we are fighting the Coronavirus.”"
"FOLKS! After you give your heart to Jesus, you're supposed to keep using your brain! ‘A phantom plague’: Evangelicals who defied social distancing guidelines are dying of coronavirus in frightening numbers – Raw Story "
That’s why Bergen County have the most ppl with coronavirus 
I used Duckduckgo to search for 'Coronavirus: how dangerous is it?' and your Youtube video came up seventh. In Google: nothing.
"#Lebanon : for the 4th night in a row riots are taking place in the city of #Tripoli. The combination of economic collapse, government repression, corruption and #coronavirus lockdowns have made life unbearable for many Lebanese. #لبنان_يتنفض"
"Coronavirus lives for hours in air particles and days on surfaces, new US study shows "
Wtf. See Olympic 2012 opening with dancing nurses. Coronavirus 
If they have time to play they need to go home. Doesn't look as if their services are needed. That is not in anyway funny. People have died and went through hell with the coronavirus and their mocking them. Very unprofessional
Coronavirus live news: Brazil sees record increase in cases 
This video about coronavirus charts is very clarifying: 
"OMG! Thunberg said in a statement that “like the climate crisis, the coronavirus pandemic is a child-rights crisis”"
GOP decries ‘impeachment 2.0’ as Pelosi names top Trump critics to coronavirus oversight panel #impeachment #coronavirus 
”A roaring lion kills no game”. Sitting around and talking about something gains nothing. The saying also implies that you should work towards your goals quietly rather than bragging about your achievements prematurely. #coronavirus #COVIDー19 #leadership
"#COVID1984 #coronavirus From 9/11 we have learned there are 3 branches profiteering and working together, always hiding behind each others backs: 1. politics (propaganda) 2. commercial (marketing) 3. religion (belief). Think about it. How does that relate to #Covid1984?"
Interesting how #icantbreathe references both #GeorgeFloydMurder and #coronavirus
"I stay about 7 miles away from Nike European HQ in Hilversum, their office was shut for a deep clean as some of their staff had Coronavirus. This was around the same time. Nike representatives probably brought it with them."
"Most of them are Americans with legitimate grievances and concerns...not that Trump cares about them, or black Americans being murdered by police or the 105,000 dead from the coronavirus or anyone but himself...he's too busy putting the dick in dictator."
"COVID-19 patients who undergo surgery are at increased risk of postoperative death: Patients undergoing surgery after contracting coronavirus are at greatly increased risk of postoperative death, a new global study reveals. Researchers found that amongst… "
"Romanian Prime Minister Ludovic Orban paid a 3,000 lei fine ($690) on Saturday for breaking his own coronavirus restrictions "
It's like the fact that we're only apparently 17 to 15% of the population meanwhile 40% of us so far have contracted the Coronavirus the last time I checked. Personally I blame the fact that not a lot of us have access to decent health care but that's neither here nor there.
"Check out video Bill Ryan excerpt (2010-1 min 22 sec), an engineered flu like virus to be released into the Chinese population and spreading to the West on http://youtu.be/0EO2jy6iskQ #coronavirus ......."
Coronavirus reveals the truth about Denmark’s costly carbon tax. Raising it is not considered now because of the economic uncertainty. 
Using inbound marketing to boost recruiting efforts post-coronavirus http://upflow.co/l/B2CX
11 Savvy Things I Was Already Doing When Coronavirus Hit That Brought Me Unexpected Peace https://livelifehomeschool.com/11-savvy-things-when-coronavirus-hit-unexpected-peace/ via @LLHomeschool
"Our weather this spring has been more LA than NL. It’s like coronavirus brought sunshine and warmth with it to Northern Europe, which has made the whole lockdown a bizarrely pleasant experience at times."
"Coronavirus May Be a Blood Vessel Disease, Which Explains Everything by @SmithDanaG in @elemental"
‘America in 2020 has stunned itself with a collapse that’s larger and deeper than one miserable leader’ The Coronavirus Revealed America’s Failures - The Atlantic 
Of course there are several reasons for the success of #NewZealand's handling of the #corona virus so far. But #leadership is definitely one of them:
"How New Zealand beat coronavirus: testing, tracing, trust in advice - @businessinsider"
"We've ""never"" had a FLU Vaccination Ms. Dawkins & , &amp; we'll never take a vaccine for the #coronavirus either! #Guaranteed PS: Its been over 10 YR's since we've had any cold &amp;/or flu like symptoms, &amp; we owe it to the 65 Vitamins, Supplements &amp; Herbs we take ""every day"" @POTUS"
Coronavirus: Restrictions return in South Korea after new spike in COVID-19 cases 
What CORONA VIRUS? What SOCIAL DISTANCING? 
#COVID19 #pandemic gets finally #mature #MinneapolisUprising #MinneapolisRiot #Minnesota #Plunder &amp; #arson DISASTER-DECADE 2017-2027 DISASTERS - #bushfires DISEASES - #coronavirus DEMOLITION- #Minneapolis AMAS; The Last Western #Prophet
I'm not talkin about little nut sacks in particular I'm just saying celebrities in general. If I remember correctly Megan the stallion and Beyonce donated to the coronavirus effort and so did Taylor Swift I believe (kind of iffy on that last one)
Eeeexactly You can't necessarily throw your money everywhere because you still need it at the end of the day but donating to a very important cause towards coronavirus or making your own type of cause or even hosting some type of live stream for charity that would be nice.
Coronavirus latest: Trump faces backlash over WHO exit
The Agenda Behind The Coronavirus Lockdown https://www.facebook.com/LondonReal/videos/577571826191161/ via @FacebookWatch
"Sweden is showing the world the effects of the wrong strategy. Please change strategy, Sweden! And the Netherlands please don’t follow this bad example! #COVID19 #COVID19NL #Netherlands #Sweden #coronavirus #schools #schoolreopening #christiandrosten"
"Inevitable, given the current state of politics. It acts as cover for ongoing coronavirus deaths &amp; racial injustice, &amp; we should all recognise that. That’s why I’m loath to give it any support beyond the simple &amp; crucial matter of two astros being delivered safely to space."
Horowitz: The CDC confirms remarkably low coronavirus death rate. Where is the media? https://www.conservativereview.com/news/horowitz-cdc-confirms-remarkably-low-coronavirus-death-rate-media/ via @RMConservative
Yeah I can get really frustrating when important shit is happening in the world and celebrities decline to comment on a fucking thing. Then again in cases like Vanessa Hudgens and the coronavirus it's just best to shut the fuck up so it depends.
"Remember, No One Is Coming to Save Us. Eventually doctors will find a coronavirus vaccine, but black people will continue to wait for a cure for racism. @rgay in @nytimes"
"Saw 'Coronavirus Outbreak' trending. Went to look and saw this notice. I like it. It should be done on all social media platforms, if it isn't already, given there's so much fake news fearmongering being peddled by conservative politicians, their propaganda rags and their fans. "
WHO declares global coronavirus emergency as death toll surges in China 
#coronavirus some #opinions
"Another 42 Coronavirus Deaths Reported In Hubei; More Than 9,000 Cases Worldwide | Zero Hedge "
WHO declares international health emergency over coronavirus outbreak — RT World News 
Bands ah make her dance #coronavirus https://store.playstation.com/#!/en-us/tid=CUSA08724_00
"The government of China states the number of cases of patients with pneumonia, not just the number of (newly) infected people with the corona virus. Different things.."
"The corona virus has now hit Finland, may my Finnish #stezaanators be safe"
Here's the investment strategy Bridgewater's Ray Dalio is using to deal with coronavirus http://dlvr.it/RP4r8j
"More than 300 of the world’s top 500 companies have a presence in Wuhan, #coronavirus. Now you know why #Who has to respond the way they did. Protecting WH by protecting world economy? #Automotive #electronics"
Now with the coronavirus I would guess 600k this year is max.
The @WHO DG has declared the current outbreak of novel #coronavirus 2019 (2019-nCoV)— a Public Health Emergency of International Concern (PHEIC)— in accordance with the International Health Regulations (IHR) (2005); the international legal framework that governs such situations.
WHO declares coronavirus outbreak an international emergency https://www.cbc.ca/news/world/who-reconvenes-assess-latest-coronavirus-1.5445775
There are several cases of confirmed coronavirus infections outside China where the persons didn’t go to China recently. So I am suspecting if there are other ways that virus is spreading other than human to human. #coronavirus #virusoutbreak
"All those things that are made or assembled in China, is there a danger/possibility of them being contaminated with virus? If yes, then everybody is screwed. Books, computers, phones, toys, kitchenwares, ikea knockoffs, cloths.... are mostly printed/made in China. #coronavirus"
All Atletico Madrid players diagnosed with Corona Virus next 2 weeks 
World Health Organization has declared corona virus a global emergency.
Germany confirms the 5th case of the #coronavirus in the south of the country. The patient is from the Traustein district in Munich. Details will be released to the media Friday 31 January
"Three people in NL tested for coronavirus, all results negative "
Coronavirus news just obliterated impeachment trial broadcast on Time livestreaming.
WHO declares Wuhan #coronavirus a public health emergency of international concern 
It’ll be coronavirus or World War III.
"[Pandemic Breaking News: Pandemic expert Dr Steven Hatfill, WHO unreliable; this is already bigger than SARS, never had so large a quarantine attempt; need a travel ban; now have the 1st human-to-human transmission of coronavirus need ground verification] https://www.facebook.com/groups/621599241269755/permalink/2647268572036135/?sfnsn=mo"
-Mao -Tienanmen -Hong Kong -Concentration camps of Muslims -Mass censorship And probably tons more that I don't even know about. I've heard that Coronavirus was created by the CCP as a bioweapon to kill Taiwan and Hong Kong.
"Number of patients infected with #coronavirus in Germany rises to 5. The 5th patient is a colleague of the 4 other German patients, said to be infected by a Chinese colleague who led a training on 21Jan and became unwell on flight back to Shanghai 23Jan. "
"@NetflixNL tip ivm #CoronaVirus ""Pandemic: How to Prevent an Outbreak"" (over o.a. SARS) "
"wish the corona virus could just instantly move to people who use the word ""stan"" like please die"
I’m far more afraid of Duh Creature in the WH than I am of the coronavirus. Yet this dangerous is clearly *not* the leader needed if an epidemic begins.
"Establishment Admits: We Are ""Unable to Stop"" The Spread of the #Coronavirus https://buff.ly/3164hY1"
"BBC News - #Coronavirus declared global health emergency by WHO: ""declaration not a vote of no confidence in China's handling of the outbreak, but reflection of the damage the virus could do if it spread to countries with a weaker health infrastructure."" "
With #coronavirus another pestilence in back #Mao #COVIDー19 #CreepyThingsThatShouldntExist #Covid19 #CoronaVirusUpdates #CoronavirusOutbreak
#Coronavius #COVID19 #COVIDー19 resources and info via @ACPinternists @AcpCaribbean
Three graphs on the daily new cases outside China for #COVID19 
"Status update on #covid19 / #sarscov2 for 28-Feb-2020, 22:00 UTC"
Can we trust private hospitals in Nigeria to be up and ready for the fight against the COVID19 Will this people not start prescribing paracetamol to patients with the virus?? #COVID19Nigeria
"""Propensity Probability"", #COVID19 have Large Data ,could #AI statistic base change variable find how its moves around the globe?"
"#coronavirus face mask fetish.... wear a mask, no matter what - is the folk wisdom of the moment. #COVID19 #StockMarketCrash2020 #COVID2019 #CoronaVirusUpdates #CoronavirusOutbreak"
Don't use the google search engine anymore to keep yourself safe from a viral infection! #COVID19 #coronavirus
"As Japan now also confirms the first case of a patient who gets sick from the same #COVID19 virus for the second time, shows people likely don’t cure. As with the Malaria parasite the virus stays dormant in the body and can make you sick any time #CoronaVirusUpdates #Coronavid19"
"Before Turks, you’ll die with Corona! Hope all racist like you terminated by Covid19."
@CellPressNews #CoronavirusResourceHub We are trying to fast track information share that can help us better understand the biology of the SARS-CoV-2 coronavirus #COVID19 for potential #vaccines https://www.cell.com/2019-nCOV. Relevant findings are shared immediately with the @WHO
The only responsible reaction to the #COVID2019 #COVID19 Crisis! Well done! Respect! Responsible tourism starts @ITB_Berlin 
Bill Gates: Coronavirus may be ‘once-in-a-century pathogen we’ve been worried about’ https://www.cnbc.com/2020/02/28/bill-gates-says-coronavirus-may-be-once-in-a-century-pathogen.html?__source=sharebar|twitter&amp;par=sharebar #covid19 #coronavirus
"Vietnam, #coronavirus: All 16 infected people in the country so far have recovered and been discharged. https://flutrackers.com/forum/forum/-2019-ncov-new-coronavirus/vietnam-2019-ncov/824060-vietnam-2019-n-cov-cases-15?p=832251#post832251 #SARSCoV2 #COVID19"
"A new experimental antibody test helped disease detectives at Singapore’s health ministry link two clusters of #COVID19 cases, each centered on a church in the city state. http://bit.ly/3adquGJ by @dnormile"
"Be really careful what you read & believe. We all need facts, not fear mongering, about #COVID19. "
Just reported $BVTK to #sec for making fraudulent #COVID19 statements. Hope they will shut this scam down #scamlist
#China against #COVID19 should be #humanity against #COVID2019 too!
"Here’s @realDonaldTrump on #COVID19 “It’s going to disappear. One day it’s like a miracle, it will disappear.” I just flew in/out of New York, Sun&amp;Tues this week There was NOTHING about Coronavirus. No checks no advice no anti bacteria soap, nothin’... good luck with the miracle!"
Google employee tested positive. To all: Update your browsers' virus scanner. #GoogleAlerts #covid19 #COVID2019 #coronavirus #Corona #Coronavid19 #google #Zurich
"Bravo, EU! Doing the right thing Unlike #LiarJohnson &amp; his proto-fascist Brexit govt He can't even be arsed to call a Cobra meeting during #Covid19 crisis before 'his' weekend. He &amp; his brownlicker cabinet aren't fit for office #UKEU #RejoinEU #FBPE "
4 more people have tested positive for the #coronavirus in #Sweden bringing the total to 11. #COVIDー19 #CoronavirusOutbreak #Covid19 
No positive #COVID19 case detected yet.
Seems legit. #COVID19 #antivirus
"@lookner Possible third case in the Netherlands. Child of woman in Amsterdan (2nd case) is reported sick. Investigation on going if the child is also infected. If so, the child's day care will close. #COVID2019 #COVID19"
Thank you very much @DrTedros So we can all relax? Take it easy? #COVID2019 #Coronavius #Corona #COVID19 No need to panic people!
 STATEMENT Players alert FIFPRO to Coronavirus fears #COVID19 Read here: https://fifpro.org/en/health/players-alert-fifpro-to-coronavirus-fears
"Bi-phasic?? Woman confirmed as coronavirus case for 2nd time, weeks after initial recovery #COVID19 https://japantoday.com/category/national/japanese-woman-confirmed-as-coronavirus-case-for-2nd-time-weeks-after-initial-recovery#.Xlk0FpckMGA.twitter"
"Aanrader, als je geïnteresseerd bent in de feiten tot nu toe rondom COVID19 #coronavirus Highly recommended, if you are interested in COVID19 #coronavirus The WHO-China Joint Mission Report on Coronavirus Disease 2019 https://www.who.int/docs/default-source/coronaviruse/who-china-joint-mission-on-covid-19-final-report.pdf"
"#Trump on spread of #COVID19 'I don’t think it’s inevitable. It probably will. It possibly will. It could be at a very small level or it could be at a larger level. Whatever happens, we’re totally prepared. We have the best people in the world.' https://presswatchers.org/2020/02/big-media-is-covering-up-trumps-terrifying-incoherence-in-a-time-of-emergency/ @froomkin"
The Four Coronavirus Scenarios: The Bad; The Worse; The Ugly; And The Unthinkable. FACTS COVID19 #coronavirus #Epidemic #CoronaOutbreak #Quarantine #ChinaVirus #2019nCoV #pandemic #COVID19 #COVIDー19 #Holland
We explore what #investors should know about the recent developments and market impacts of the #Coronavirus outbreak. #Finance #Investment #covid19 http://bit.ly/2Ta9WKi
1+ x + x² + x³ + ... = x³² En dan is het over.. #coronavirus #covid19
#Secondary attack #rate and superspreading events for SARS-CoV-2 - The Lancet #coronavirus #COVID19 #COVIDー19
One more person has tested positive for the #coronavirus in the Netherlands. The woman had traveled to Italy and is the second coronavirus patient in the Netherlands. #COVIDー19 #CoronavirusOutbreak #Covid19
Second Dutch person in NL (unconnected to first) confirmed to have contracted #COVIDー19 #COVID19 after visiting Lombardy #coronavirus
Breaking: BFMTV: In Hong Kong a dog has tested positive for infection with the Coronavirus. The dog has been placed in quarantaine. Experts say that there is no risk that dogs can transmit the virus to humans. #Coronavirus #COVID19 #Breaking
"first they ignore you, then they laugh at you, then they fight you, then you win #coronavirus #коронавирус #COVID19 #SARSCoV2"
@Worldometers 2nd case in Netherlands of #covid19
"If I catch Covid19, I'm going to a hospital and cough in every doctor's face until I get some help. =)"
"In regards of #COVID19, make sure you eat spicy food once a day. Eating your daily dish with aprox 20k - 50k Scoville units decreases the chance of infection with 48% "
"2nd case of Dutch #covid19 #Coronavid19 in the #netherlands confirmed. Well, this country is so small, we're all infected by the time I finished writing this tweet."
Also a mortality rate of 0.1 - 0.15% for the flu vs. 2 - 3% in COVID19. That's 10 - 20 times more deadly.
"So the first people with #COVID19 have been diagnosed in the Netherlands. Everyone ""Oh no! Corona!"" Also everyone: - *makes racist jokes* - *doesn't cover their mouth when coughing* - *doesn't wash hands* - *doesn't get vaccinated for yearly flu with similar death toll*"
New research proves #Coronavirus is lab edited and didnot evolve naturally: https://www.sciencedirect.com/science/article/pii/S0166354220300528 / https://www.naturalnews.com/2020-02-19-covid-19-coronavirus-found-to-contain-gain-of-function-for-efficient-spreading-human-population.html #covid19 #Amsterdam
"#Dutch officials especially the #Rivm didnot take #Coronavirus serious at all. Carnavals went on, Flights to/From #China went on. while so many citizens complained about the attitude of #Rivm #Covid19 #Amsterdam"
"Many were vaccinated to control it. There is no vaccine for Covid19, hence why it is more dangerous than flu."
RT @WimvanderPoel1: SARSCoV2 in farmed mink in the Netherlands. How it started
RT @AdamJKucharski: Useful summary of evidence that the observed declines in COVID-19 epidemics across Europe were the result of difference…
"RT @MaryJoe38642126: .@CDCgov .@CDCDirector .@CDCemergency .@CDCGlobal 
.@USDA .@USDAFoodSafety .@realDonaldTrump .@WhiteHouse 

#MeatIsNot…"
"First locally transmitted cases found in weeks. 
This should be watched closely. 

In the meantime, the US and Braz… https://t.co/eIcQGtWI1z"
"RT @DarrenEuronews: Top 5 countries 🌍 with highest number of #coronavirus cases

1. 🇺🇸 USA (Trump)
2. 🇧🇷 Brazil (Bolsonaro)
3. 🇷🇺 Russia (P…"
Research consortia from the rapid  EU Corona call that was launched as soon as WHO declared a PHEIC . Writing grant… https://t.co/t0IMZ6NJ7d
"RT @brexit_sham: Astounding footage of @BorisJohnson 'cramming covid' on his return from a two week Kent jolly with Carrie Symonds. 

Crimi…"
RT @MarionKoopmans: Research consortia from the rapid  EU Corona call that was launched as soon as WHO declared a PHEIC . Writing grant app…
RT @WimvanderPoel1: SARSCoV2 in farmed mink in the Netherlands. How it started
RT @AntibioticDoc: Spoiler: herd immunity is a long way away (vaccine please!!) but the alternative - quick natural herd immunity - many ma…
"RT @OECD: What measures have countries around the 🌍 taken to address the #coronavirus pandemic?

Our #COVID19 Country Policy Tracker allows…"
Interesting alternative #investment: Price cuts have been widely deemed necessary for the success of this year’s de… https://t.co/UKcd6B8i9p
RT @QuickTake: Beijing shut down its largest wholesale vegetable market after detecting new #coronavirus cases among a few business owners.…
"#DonaldTrump says, while the #coronavirus has killed 115K people now, that we are doing great and the economy is bo… https://t.co/vxKLuObvL4"
"RT @drive_mpower: How to rebuild local economies after #COVID19 in a fair, inclusive and secure way? @CLESthinkdo has developed a framework…"
"@Reuters the numbers don't add up, did you see? Did you investigate?
Netherlands
#COVID19 https://t.co/2rcc2zVMPh"
"RT @francediplo_EN: #COVID19 
Travel restrictions to France from European countries will be lifted from 15 June, except:
By ✈️from 🇪🇸: rest…"
RT @FHmediastuff: There were real heroics at the start of #covid19 in Ireland. The IMJ has the full details. Take a bow @eamofaller and @dr…
RT @UNMaltaMission: #Malta 🇲🇹 is proud to be among 132 signatories supporting SG @antonioguterres 🇺🇳 @UN Communications Response Initiative…
"RT @DDNewslive: 17th Passing Out Parade held at Officers' Training Academy, Gaya while adhering to guidelines amid the #Covid19 pandemic ht…"
#COVID19 risks dismantling recent progress towards #SDGs in #Africa and casting millions of people back into… https://t.co/lxIutVTnML
#digitalization helps #fishery sector to adapt to #COVID circumstances in #Oman and other countries in the region. https://t.co/vAnWhA9lHx
"RT @Maryam_Rajavi: Ali Younesi has contracted the #COVID19 disease in Evin Prison, a flagrant crime against humanity despite previous warni…"
"RT @FairFashionTT: Garment workers are predominantly women, facing a challenging work environment. The #Covid19 crisis hits them even harde…"
Visiting my mother. #COVID19 https://t.co/EK8IUlfSsA
"Bill &amp; Melinda Gates Foundation - Animation

Bill Gates finally tells the truth. #BillGatesIsEvil @leondewinter… https://t.co/R3568ENDaz"
"RT @snappysna: ALTER EGO 
Oil on canvas 
#art #modernart #kunst #twitart #artwit #Denhaag #cultuur #ArtistOnTwitter #artforsale #frankvande…"
“... the early introduction of face masks in Jena has resulted in a reduction of almost 25% in the cumulative numbe… https://t.co/rJWUsL6mEV
"RT @TheDailyEdge: A Whirlpool plant in Tulsa, Oklahoma has temporarily closed due to a coronavirus outbreak one week before Trump holds a r…"
Policymakers in Europe should use the disruptions caused by #COVID19  to reflect and reset the discussions on the C… https://t.co/YIjTEbnzAF
RT @AlistairsWorld: Seems like there is a huge number of Indian Twitter accounts devoted solely to trolling Chinese and making racist comme…
"RT @priyadamini24: #Thread 🧵 

As India’s #COVID19 tally inches towards the 3 lakh mark, here is a thread of IMPORTANT CRUCIAL THINGS THE G…"
The latest The Peter Wouda Daily! https://t.co/ijfd7Yb4zJ #leadonclimate #covid19
"RT @sanchezcastejon: Spain is coleader in initiatives such as the ACT-Accelerator to achieve equitable access to vaccines, treatments and d…"
"RT @peijin_zhang: #Beijing 's largest wholesale food market shutdown after the spike in #COVID19 cases. The city's Fengtai district is in ""…"
"RT @sanchezcastejon: Spain is coleader in initiatives such as the ACT-Accelerator to achieve equitable access to vaccines, treatments and d…"
"RT @sanchezcastejon: Spain is coleader in initiatives such as the ACT-Accelerator to achieve equitable access to vaccines, treatments and d…"
"""As the world begins to consider how we come back from the pandemic, we have a responsibility as individuals, commu… https://t.co/y1CFkPsKRB"
RT @UNDP: +90% of global trade is transported on the high seas.  What can we do to green the #BlueEconomy after #COVID19? @AndrewGHudson ou…
"RT @youngmedwia: 70%of healthcare and social workers are women. This #pandemic hit them double: in work and privat life, when in vulnerable…"
