,Positive,Neutral,Negative
100,,RT @zchamu: This is why we get circles: it’s ok for more people to get sick right now.,"RT @KSAmissionEU: As the world moves forward, the #G20SaudiArabia Presidency holds a virtual workshop on the implications of #COVID19 on gl…"
101,,Have you thought on how you would paint the pandemic of #COVID19?,"I'm sorry but am I the only one who doesn't see a big problem here?

One photo is taken from an angle that would al… https://t.co/kVTQfwixDg"
102,,RT @WIIS_NL: .@WIIS_global member Roxana Allen published a piece on correcting #genderinequality with #AI amid #COVID19. Interested? Read i…,"RT @dabeard: She said Florida fired her for wanting to tell the truth about the number of residents infected with #COVID19.

Now she's got…"
103,,"RT @SkyNews: The Queen is celebrating her birthday with a scaled back military parade at Windsor Castle, because of the #COVID19 pandemic h…","Explore cultural dimensions that impact how we understand and respond to collective traumas such as #COVID19.

💻 We… https://t.co/x76XMgzIp7"
104,,Come join us to Share Your Research and Ideas at #Healthcare #HospitalManagement #Nursing #ClinicalPharmacy… https://t.co/pWbwZEiuws,"RT @UNDP: Home to an estimated 270 mil people, Africa's borderlands, often lawless &amp; weak in healthcare, are most vulnerable to the spread…"
105,,"In the wake of #COVID19, adaptation and preparedness will make all the difference between surviving and ‘game over’… https://t.co/NJ6iyFkhCe","Honduras | With #coronavirus cases rising, our teams are providing medical treatment to people with severe symptoms… https://t.co/uRemax57Vu"
106,,Three More Coronavirus Cases Confirmed in Israel https://sputniknews.com/middleeast/202003011078446103-three-more-coronavirus-cases-confirmed-in-israel/?utm_source=dlvr.it&utm_medium=twitter …pic.twitter.com/YIzPGflh4c,"Yes, it is worse than the flu: busting the coronavirus myths https://www.theguardian.com/world/2020/mar/01/yes-it-is-worse-than-the-flu-busting-the-coronavirus-myths?CMP=share_btn_tw …"
107,,"Some scientists believe , Coronavirus is spreading fastest through #socialmedia #WhatsApp #Facebook #Tweets #Coronvirus #CoronaAlert","""Italy unveils €3.6bn stimulus to mitigate the impact of the largest outbreak of coronavirus in Europe"". https://www.ft.com/content/a6f59348-5bae-11ea-b0ab-339c2307bcd4 … via @financialtimes"
108,,"The Jazz gave out hand sanitizer. The Knicks had their team doctor talk to players. Some have stopped shaking hands. Others are fatalistic about it. 
How NBA players are taking precautions with the coronavirus; if they are.
https://theathletic.com/1660734/2020/03/07/how-nba-players-are-changing-their-lives-as-coronavirus-spreads-around-the-world/ …",'This is surreal': Italian towns struggle under #coronavirus lockdown #covid19https://www.theguardian.com/world/2020/mar/06/this-is-surreal-italian-towns-struggle-under-coronavirus-lockdown?CMP=share_btn_tw …
109,,End the day  by ending #coronavirus   https://www.endcoronavirus.org/ ,Can we please stop w this #coronavirus and have some #perspective. It’s #fakenews media sensationalism provoking panic in an undereducated society. It’s rarely deadly (2% fatality rate). Snakes are more dangerous ffs https://twitter.com/miggalooch/status/1235348233490223104 …pic.twitter.com/lqPHCOwTi0
110,,End the day  by ending #coronavirus   https://www.endcoronavirus.org/ ,No Time To Release A Film: Latest James Bond Delayed On Coronavirus Fears https://www.ndtv.com/world-news/latest-james-bond-movie-no-time-to-die-delayed-on-coronavirus-fears-2190068?utm_source=dlvr.it&utm_medium=twitter …pic.twitter.com/ypGZ1mYsyT
111,,EU leaders try to retake control of coronavirus response https://www.politico.eu/article/eu-leaders-try-to-retake-control-of-coronavirus-response/ …,"Well, Boris can always use corona virus as an excuse when things go wrong in 2021."
112,,"Ah yes, very true. I'll just tell my landlord that I'll pay him next year as the impacts of the coronavirus will be over by then. No big deal.",Italy Locks Down 15 Million After Massive Surge In Coronavirus Deaths https://www.ndtv.com/world-news/italy-locks-down-15-million-after-massive-surge-in-coronavirus-deaths-2192038?utm_source=dlvr.it&utm_medium=twitter …pic.twitter.com/T01GiaM2BX
113,,Will the coronavirus keep students away from the Ezra Avenue St. Patrick's Day party? Our @SetoRecord finds out.https://twitter.com/SetoRecord/status/1237484239534329856 …,The coronavirus was actually created in order to attempt to stop St. Patrick's day on Ezra Avenue. A conspiracy theory.
114,,"If you need me for the next three weeks, I'll be ""working from home"" with a pair of first-graders in the house. #covid19 #coronavirus https://twitter.com/Communitech/status/1238610580170211331 …",#Reuters El Salvador shuts classes in all schools on coronavirus fears https://ift.tt/3cQLZ2s  #ElSalvador
115,,Greatest commercial for coronavirus ever https://twitter.com/benphillips76/status/1237691678720512002 …,"He tested positive, then negative for coronavirus. Now this American is stuck in Egypt. https://www.washingtonpost.com/world/2020/03/11/egypt-matt-swider-coronavirus/?utm_source=dlvr.it&utm_medium=twitter&utm_campaign=wp_world …pic.twitter.com/VYENEySVdv"
116,,New post on Lead Stories: Fact Check: Massachusetts State Police DO Warn Of Possible Scam Related To Coronavirus https://ift.tt/3bi83Bq pic.twitter.com/rII3s34Lj7,"You people cry racism just because people aren't visiting Chinatown anymore lmao. Precaution is key in times of pandemic; a month after this video and Italy is suffering the worst outbreak of the Wuhan coronavirus outside of China.
https://www.youtube.com/watch?v=mNMdg4morQs …"
117,,Anywhere but Westminster: we need your help covering the coronavirus https://www.theguardian.com/world/2020/mar/19/anywhere-but-westminster-we-need-your-help-covering-the-coronavirus?CMP=share_btn_tw …,Belgium activates emergency measures to contain coronavirus outbreak – http://EURACTIV.com  #StayHomeBelgium #coronavirus #Healthhttps://www.euractiv.com/section/coronavirus/news/belgium-activates-emergency-measures-to-contain-coronavirus-outbreak/ …
118,,"#nowplaying Coronavirus Type Beat by 2K Beats feat. Cardi B,iMarkkeyz via @audiomack https://audiomack.com/song/2kbeats1/coronavirus-type-beat …","""I just..Gave.. Dr. Fauci .. Corona Virus on Live TV... so... Nasty question.. next.."" https://twitter.com/Politidope/status/1238566967474184192 …"
119,,"Bcuz China was 1st country 2 deal w/ coronavirus,it is now ahead of most of world in terms of containmnt & recovry.Chinese workrs return to factories,while US & European econs are shutting down.We don’t hv plan for today-BJ has plan for tomorow.@joshroginhttps://www.washingtonpost.com/opinions/2020/03/16/how-china-is-planning-use-coronavirus-crisis-its-advantage/ …","Coronavirus brings new travel restrictions, lockdowns and closures around the world https://www.japantimes.co.jp/news/2020/03/16/world/global-coronavirus-travel-restrictions/?utm_source=dlvr.it&utm_medium=twitter …pic.twitter.com/ylRsAT6Y0c"
120,,"Coronavirus: Dubai suspends sea cruises, safaris, and floating restaurants http://english.alarabiya.net/en/News/gulf/2020/03/17/Coronavirus-Dubai-suspends-sea-cruises-safaris-and-floating-restaurants.html?utm_source=dlvr.it&utm_medium=twitter …pic.twitter.com/ZqI0OybByP","The #coronavirus will be used by governments to become complete totalitarian states.

There will be more surveillance and less freedom.

""Never let a good crisis go to waste"" - Winston Churchill. https://twitter.com/CNBC/status/1240711838398021632 …"
121,,Anywhere but Westminster: we need your help covering the coronavirus https://www.theguardian.com/world/2020/mar/19/anywhere-but-westminster-we-need-your-help-covering-the-coronavirus?CMP=share_btn_tw …,"Cobalt President Kara Vedder applied her Health Sciences degree to developing our strict cleaning regimen, which includes disinfecting equipment and high-touch surfaces with our house-made Kara Care green cleaning products. #cobaltstages #karavedder #greencleaning #coronavirus pic.twitter.com/3HsQgUoPiJ"
122,,"Bcuz China was 1st country 2 deal w/ coronavirus,it is now ahead of most of world in terms of containmnt & recovry.Chinese workrs return to factories,while US & European econs are shutting down.We don’t hv plan for today-BJ has plan for tomorow.@joshroginhttps://www.washingtonpost.com/opinions/2020/03/16/how-china-is-planning-use-coronavirus-crisis-its-advantage/ …",Coronavirus questions answered: 'Should you go to an urgent care facility if sick?' https://www.foxnews.com/media/coronavirus-questions-answered-should-you-to-urgent-care?utm_source=dlvr.it&utm_medium=twitter …pic.twitter.com/tyqwThFaG7
123,,"Coronavirus: Dubai suspends sea cruises, safaris, and floating restaurants http://english.alarabiya.net/en/News/gulf/2020/03/17/Coronavirus-Dubai-suspends-sea-cruises-safaris-and-floating-restaurants.html?utm_source=dlvr.it&utm_medium=twitter …pic.twitter.com/ZqI0OybByP","People with blood type A might be more susceptible to coronavirus, study finds.

https://fxn.ws/2WlzJRs  #FoxNews"
124,,New post on Lead Stories: Fact Check: Massachusetts State Police DO Warn Of Possible Scam Related To Coronavirus https://ift.tt/3bi83Bq pic.twitter.com/rII3s34Lj7,"British Study Predicts 2.2 Million Coronavirus Deaths In US, 50,000 In UK https://www.ndtv.com/world-news/coronavirus-news-british-study-predicts-2-2-million-covid-19-deaths-in-us-50-000-in-uk-2196477?utm_source=dlvr.it&utm_medium=twitter …pic.twitter.com/FeSyqkNV68"
125,,"#nowplaying Coronavirus Type Beat by 2K Beats feat. Cardi B,iMarkkeyz via @audiomack https://audiomack.com/song/2kbeats1/coronavirus-type-beat …","In the Battle Against Coronavirus, Humanity Lacks Leadership https://ti.me/2U0Is8Q?utm_source=twitter.com&utm_medium=social&utm_campaign=social-share-article …"
