,Positive,Neutral,Negative
0,217,New Zealand Beat the Coronavirus – and Has Three Lessons for Brazil https://riotimesonline.com/brazil-news/brazil/politics-brazil/new-zealand-beat-the-coronavirus-and-has-three-lessons-for-brazil/?utm_source=dlvr.it&amp;utm_medium=twitter,243
1,Coronavirus: How does contact tracing work and is my data safe? https://www.bbc.co.uk/news/explainers-52442754?utm_source=dlvr.it&amp;utm_medium=twitter,Coronavirus is telling us to be a citizen of our country – and our world https://www.scmp.com/week-asia/opinion/article/3082210/coronavirus-telling-us-be-citizen-our-country-and-our-world?utm_source=dlvr.it&amp;utm_medium=twitter,Bolsonaro’s ‘so what’ response to coronavirus deaths is the latest in his spiraling political crisis https://www.pri.org/stories/2020-04-29/bolsonaro-s-so-what-response-coronavirus-deaths-latest-his-spiraling-political?utm_source=dlvr.it&amp;utm_medium=twitter
2,We do have unlimited money for war. We have unlimited funding for the Coronavirus. We don't have money to make sure everyone that is legal to vote can vote?,Coronavirus is hitting Iowa harder than many of its bordering states: https://www.desmoinesregister.com/story/news/health/2020/04/29/coronavirus-hitting-iowa-harder-than-illinois-minnesota-missouri-nebraska-south-dakota-wisconsin/3042881001/ via @DMRegister,Palestinians working in Israel face coronavirus dilemma - BBC News https://news.google.com/__i/rss/rd/articles/CBMiM2h0dHBzOi8vd3d3LmJiYy5jb20vbmV3cy93b3JsZC1taWRkbGUtZWFzdC01MjQ3MDcxONIBN2h0dHBzOi8vd3d3LmJiYy5jb20vbmV3cy9hbXAvd29ybGQtbWlkZGxlLWVhc3QtNTI0NzA3MTg?oc=5&amp;utm_source=dlvr.it&amp;utm_medium=twitter
3,Exclusive: Chinese scientists '99% confident' their coronavirus vaccine will work - Sky News ,"WHO: Sweden, which avoided mass coronavirus lockdowns, should be 'model' for the world https://www.foxnews.com/world/who-sweden-which-avoided-mass-coronavirus-lockdowns-should-be-model-for-the-world?utm_source=dlvr.it&amp;utm_medium=twitter",Coronavirus: Searching for truth behind Spain's care home tragedy https://www.bbc.co.uk/news/world-europe-52188820?utm_source=dlvr.it&amp;utm_medium=twitter
4,Patient who tested positive for coronavirus stable: Kerala Health Minister https://www.aninews.in/news/national/general-news/patient-who-tested-positive-for-coronavirus-stable-kerala-health-minister20200131043650/?utm_source=dlvr.it&amp;utm_medium=twitter,Navy opens full investigation into coronavirus-stricken USS Theodore Roosevelt https://www.foxnews.com/us/navy-opens-full-investigation-coronavirus-stricken-uss-theodore-roosevelt?utm_source=dlvr.it&amp;utm_medium=twitter,An unlikely coronavirus hotspot in forgotten US corner https://www.bbc.co.uk/news/world-us-canada-52460408?utm_source=dlvr.it&amp;utm_medium=twitter
5,Very sensible advise from Singapore #COVID19 * it's all about transmission * stay home when symptomatic (droplets) * wash hands and don't touch face (surface transmission) * where mask _only_ when going out ill (to protect others),Coronavirus: Madrid's balcony cinema screens films for people in lockdown https://www.bbc.co.uk/news/world-europe-52443601?utm_source=dlvr.it&amp;utm_medium=twitter,How Southern Politics are Failing One Town’s #CoronaVirus Response. (Politico) #COVIDー19 #COVID19 #CoronaVirusOutbreak #CoronaVirusPandemic https://buff.ly/3a2bKKk
6,"A place of innovation, creating unique experiences for tourists around the world and jobs for the ones working in the tourist industry. At #ITBBerlin I learned blogging, got many amazing memories are attached to it. It's so sad #COVID19 prohibits it but I am glad for lives saved. ",Facebook shares soar 10% despite impact of coronavirus on ad sales https://fortune.com/2020/04/29/facebook-q1-earnings-coronavirus-ads-slowdown/?utm_source=dlvr.it&amp;utm_medium=twitter,How #SmartCities Are Protecting Against #CoronaVirus But Threatening #Privacy. (Forbes) https://buff.ly/2V6yDrY
7,"This is how a country of perfection South Korea handles #coronavirus #COVID19 Using all technology, means and equipment to the maximum to keep their citizens safe and lookout for new patients before they even realise they are ill, so treatment can start imminent. Congrats!! ","Gilead's coronavirus treatment remdesivir just succeeded in a crucial study, raising hopes for a first COVID-19 drug https://www.businessinsider.com/coronavirus-treatment-gilead-says-positive-data-remdesivir-from-niaid-study-2020-4?utmSource=twitter&amp;utmContent=referral&amp;utmTerm=topbar&amp;referrer=twitter via @businessinsider",Are #coronavirus #ContactTracingApp able to slow the spread of #COVID19 ? Several groups are creating protocols struggling with pitfalls and lack of efficacy - here is an update by @MarkZastrow #pandemic #lockdown
8,CORONAVIRUS: Members have contacted us seeking guidance on #coronavirus #COVID19. We advise to follow all guidance from @WHO and the national health authority in each country. Info: http://epoa.eu/coronavirus/,Houston Astros block World Series* ring being auctioned off for coronavirus charity http://hill.cm/sAvu3zq,"Pope Calls For Action To ""End Pandemic Of Poverty"" After Coronavirus https://www.ndtv.com/world-news/coronavirus-pope-francis-calls-for-action-to-end-pandemic-of-poverty-after-coronavirus-2238027?utm_source=dlvr.it&amp;utm_medium=twitter"
9,"To all the

#MAGA supporters
#BernieBros
#Qanon followers
#SocialJusticeWarriors
#Libtards
#CorporateDems
#Snowflakes
#russians
#Republicans
#leftists
#AltRight
#BandsIHate
#Prager U folks
#Evangelicals

I Say..sincerely.. 

WASH YOUR HANDS.

STAY HEALTHY

DONT GET #CORONAVIRUS",The whole world saw an idiot Trump suggests 'injection' of disinfectant to beat coronavirus and 'clean' the lungs https://www.nbcnews.com/politics/donald-trump/trump-suggests-injection-disinfectant-beat-coronavirus-clean-lungs-n1191216 via @nbcnews,Vietnam: How this country of 95 million kept its coronavirus death toll at zero 
10,"That's nice and all but I was pretty sure is was already called the #CoronaVirus. Or the #WuhanCoronavius. I'm sure it serves a purpose but I can't help but feel like time would be better spent elsewhere. 
#CoronaCompassionhttps://twitter.com/MackayIM/status/1225058831517941760 …","Britons welcome in EU this summer if coronavirus restrictions lifted, European Commission says ",Why is coronavirus killing BAME Britons? https://www.aljazeera.com/programmes/thestream/2020/05/coronavirus-killing-bame-britons-200527202930344.html?utm_source=dlvr.it&amp;utm_medium=twitter
11,"Sensation title though very informative and well substantiated article about #COVID19 #nCoV2019 #coronavirus possible spread, modelling, parameters & what may be real numbers in China? 
https://www.statnews.com/2020/02/14/disease-modelers-see-future-of-covid-19/ …",The World Is Still Far From Herd Immunity for Coronavirus ,American Airlines pilots sue to halt US-China flights amid coronavirus epidemic https://www.reddit.com/r/worldnews/comments/ewcrq4/american_airlines_pilots_sue_to_halt_uschina/?utm_source=dlvr.it&amp;utm_medium=twitter
12,"RT @NicholasChrimes: Oxygen via Hudson mask can be placed OVER a surgical mask in #COVID19 patients without compromising FiO2. 

🔐 Free in…",#Twitter to label disputed #CoronaVirus tweets. (USA Today) #SocialMedia #COVIDー19 #COVID19 #CoronaVirusOutbreak #CoronaVirusPandemic https://buff.ly/2WBzaCZ,WHO declares coronavirus global emergency as death toll rises https://www.aljazeera.com/news/2020/01/declares-coronavirus-global-emergency-death-toll-rises-200130231243350.html?utm_source=dlvr.it&amp;utm_medium=twitter
13,RT @ViolaRoberto: The #DESIeu published today shows important progress of 🇪🇺 #EU Member States in #digital areas like connectivity &amp; #eGov.…,"Sooo is #coronavirus like not a thing anymore?? Lotta people at the protests, not much social distancing or masks",China's Coronavirus Epidemic Will Impact The Global Economy http://warnewsupdates.blogspot.com/2020/01/chinas-coronavirus-epidemic-will-impact.html?utm_source=dlvr.it&amp;utm_medium=twitter
14,RT @UNESCO: Modern technology like #AI can be key when navigating through the #COVID19 crisis. But it's crucial to understand the trade-off…,Coronavirus: Pret a Manger plans rent talks in bid to avoid closures https://www.bbc.co.uk/news/business-52862678?utm_source=dlvr.it&amp;utm_medium=twitter,"Wuhan is running low on food, hospitals are overflowing, and foreigners are being evacuated as panic sets in after a week under coronavirus lockdown https://www.reddit.com/r/worldnews/comments/ewdpdz/wuhan_is_running_low_on_food_hospitals_are/?utm_source=dlvr.it&amp;utm_medium=twitter"
15,"RT @vdwnico: #covid19 spreading fast in Africa. Data from Johns Hopkins. No model is perfect, be careful with numbers. https://t.co/zmesZyf…",How the coronavirus could be prevented from invading a host cell ,'Art Basel Hong Kong 2020 Needs to Be Put Out of Its Misery': Exhibitors Demand Answers as Coronavirus Fears Mount. Pressure is mounting on organizers to decide the fate of the fair—fast. By @KinsellaEK
16,"RT @hermannkelly: It's been widely accepted for years &amp; well attested in scientific studies that having sufficient vitamins A, C, D and zin…","Romania's Orban breaches own coronavirus rules, pays fine https://www.channelnewsasia.com/news/world/romania-s-orban-breaches-own-coronavirus-rules--pays-fine-12787978?utm_source=dlvr.it&amp;utm_medium=twitter",Holiday spots in southern Thailand face hard times after coronavirus outbreak https://www.channelnewsasia.com/news/asia/holiday-spots-southern-thailand-hard-times-coronavirus-outbreak-12371946?utm_source=dlvr.it&amp;utm_medium=twitter
17,"RT @GabrielMariya: Nobel Prize winner Sir Peter Ratcliffe shares his insights on #COVID19 @wef.
The #EU funded his vital #research with an…",Rick McDaniel: Coronavirus church reopening – Services start Sunday. Here's the key question https://www.foxnews.com/opinion/coronavirus-church-reopening-sunday-key-question-rick-mcdaniel?utm_source=dlvr.it&amp;utm_medium=twitter,U.S. Response To The Coronavirus Outbreak http://warnewsupdates.blogspot.com/2020/01/us-response-to-coronavirus-outbreak.html?utm_source=dlvr.it&amp;utm_medium=twitter
18,Great idea for diplomatic dialogue in #COVID times from @marisagerards @oeysteinboe! #NATO is a political-military… https://t.co/2IuOppG2RC,"WHO reports single-day increase in coronavirus cases by over 116,000 https://tass.com/society/1162215?utm_source=dlvr.it&amp;utm_medium=twitter",World Health Organization declares coronavirus a global health emergency https://nypost.com/2020/01/30/world-health-organization-declares-coronavirus-a-global-health-emergency/?utm_source=twitter_sitebuttons&amp;utm_medium=site%20buttons&amp;utm_campaign=site%20buttons via @nypost
19,"RT @LapointeShaw: Here is my take on what the goal should be:

1. Continuously dropping daily case count
2. Steady low % positive (&lt;2%)
3.…","That's like saying 1,000,000 have not died from #coronavirus they died from the underlying condition of being old and having a week immune system???? #protests #mineapolis #goergefloyd #JusticeForGeorgeFloyd",WHO declares global emergency over new coronavirus outbreak https://newsinfo.inquirer.net/1222114/who-declares-global-emergency-over-new-coronavirus-outbreak?utm_source=dlvr.it&amp;utm_medium=twitter
20,"RT @europe_creative: Cultural professional affected by #Covid19? 
Take part in this survey &amp; help shape recommendations to boost 🇪🇺cultural…","Coronavirus? Pandemic? For many in Sweden, life goes on..... But Sweden's coronavirus approach is not a model to copy.",Coronavirus declared global health emergency by WHO l ABC News - ABC News 
21,RT @ZMnatsakanyan: Very good conversation w/ @FP_Champagne. Deep respect &amp; friendship btw 🇦🇲🇨🇦 ppls and leaders are strong foundation to en…,"As China's coronavirus shutdowns end, levels of air pollutants rise to traditional levels again https://www.foxnews.com/science/chinas-covid-19-shutdowns-end-levels-of-air-pollutants-rise-to-traditional-levels-once-more?utm_source=dlvr.it&amp;utm_medium=twitter",WHO Declares Public Health Emergency for Novel Coronavirus http://www.medscape.com/viewarticle/924596?src=rss&amp;utm_source=dlvr.it&amp;utm_medium=twitter
22,It is always a good reminder of the importance of the work we are doing to help #FeedWR when we are able to sit dow… https://t.co/OXXXXE9f6z,Coronavirus live news: deaths surge in Brazil and Russia as Trump says US is quitting WHO ,WHO declares public health emergency over coronavirus http://www.beijingbulletin.com/news/263876875/who-declares-public-health-emergency-over-coronavirus?utm_source=dlvr.it&amp;utm_medium=twitter
23,"A positive tale of  #Coronavirus European local solidarity, with neighbouring countries (, & also )helping treat  patients from Southern Alsace where a ‘hotspot’ developed.
Close to my heart as I come from there, and know a family who is affected... @bueti @JeremyCliffehttps://twitter.com/JeremyCliffe/status/1241267539809914880 …",My 2020 mantra manifestation Protected connected; safer apart #coronavirus #StayHome #Quarantine,WHO Declares Coronavirus a Global Health Emergency http://www.beijingbulletin.com/news/263876866/who-declares-coronavirus-a-global-health-emergency?utm_source=dlvr.it&amp;utm_medium=twitter
24,Any reason to not respect human rights is valid we suppose... https://tinyurl.com/uxy5btz  #Coronavirus #Coronabelgie #BelgiumLockdown #Belgium,#BellyMujinga was a transport worker who died after being spat at by someone with coronavirus symptoms. Sign this petition to help her family get justice in her name ,Israel suspends flights to China due to coronavirus outbreak http://www.beijingbulletin.com/news/263876848/israel-suspends-flights-to-china-due-to-coronavirus-outbreak?utm_source=dlvr.it&amp;utm_medium=twitter
25,Hopes rise in coronavirus battle as US scientists hail drug trial https://www.channelnewsasia.com/news/world/hopes-rise-covid-19-coronavirus-scientists-hail-drug-trial-12689692?utm_source=dlvr.it&amp;utm_medium=twitter,Watchdog says they are no confirmed cases of new coronavirus in Moscow ,"Cruise ship passengers quarantined in Italy over coronavirus fears do not have the illness, tests show - The Washington Post "
26,Taiwan's Coronavirus Moment — And Delicate Balancing Act - NPR https://news.google.com/__i/rss/rd/articles/CBMiXmh0dHBzOi8vd3d3Lm5wci5vcmcvMjAyMC8wNC8yOS84NDczMDg0MzMvdGFpd2Fucy1jb3JvbmF2aXJ1cy1tb21lbnQtYW5kLWRlbGljYXRlLWJhbGFuY2luZy1hY3TSAQA?oc=5&amp;utm_source=dlvr.it&amp;utm_medium=twitter,New coronavirus first confirmed in Italy — media https://tass.com/world/1114903?utm_source=dlvr.it&amp;utm_medium=twitter,Coronavirus outbreak in U.S. may depend on this: 'We just don't know yet' says infectious disease doc https://www.foxnews.com/media/coronavirus-u-s-outbreak-contain-emergency?utm_source=dlvr.it&amp;utm_medium=twitter
27,Larry Brilliant: How to end the COVID-19 pandemic https://www.gzeromedia.com/how-to-end-the-covid-19-pandemic #COVID19 #CoronaVirus #Corona,'Good' news: Passenger on board Costa Smeralda suffers common flu http://bit.ly/2GC9cpZ #CostaSmeralda #coronavirus #travel,I’m so unbelievably repulsed by the amount of racism I’m seeing towards Asian people just because of the Coronavirus. Disgusting to say the least.
28,New ‘The Bachelor’ Series Set for Summer Following ‘Bachelorette’ Coronavirus Shutdown (EXCLUSIVE) https://variety.com/2020/tv/news/the-bachelor-new-summer-series-bachelorette-coronavirus-shutdown-1234591220/ via @variety,Coronavirus: China confident it can fight outbreak https://www.jpost.com/Breaking-News/Coronavirus-China-confident-it-can-fight-outbreak-616038?utm_source=dlvr.it&amp;utm_medium=twitter,"Levi's shuts half its China stores on coronavirus outbreak, expects financial hit https://www.channelnewsasia.com/news/business/levi-s-shuts-half-its-china-stores-on-coronavirus-outbreak--expects-financial-hit-12372496?utm_source=dlvr.it&amp;utm_medium=twitter"
29,"From @farwell_WR: Extraordinary times call for extraordinary measures, and we have seen such measures from all levels of government during the coronavirus crisis. ",Russia closes border with China to prevent spread of the coronavirus - CNBC https://news.google.com/__i/rss/rd/articles/CBMiYmh0dHBzOi8vd3d3LmNuYmMuY29tLzIwMjAvMDEvMzAvY29yb25hdmlydXMtcnVzc2lhLWNsb3Nlcy1ib3JkZXItd2l0aC1jaGluYS10by1wcmV2ZW50LXNwcmVhZC5odG1s0gFmaHR0cHM6Ly93d3cuY25iYy5jb20vYW1wLzIwMjAvMDEvMzAvY29yb25hdmlydXMtcnVzc2lhLWNsb3Nlcy1ib3JkZXItd2l0aC1jaGluYS10by1wcmV2ZW50LXNwcmVhZC5odG1s?oc=5&amp;utm_source=dlvr.it&amp;utm_medium=twitter,World Health Organization declares coronavirus an international public health emergency https://www.france24.com/en/20200130-world-health-organization-declares-coronavirus-an-international-public-health-emergency?utm_source=dlvr.it&amp;utm_medium=twitter
30,Coronavirus: Belgian Prince Joachim tests positive after lockdown party—in Spain. ,WHO Declares Global Coronavirus Health Alert But No Travel Ban http://www.beijingbulletin.com/news/263876846/who-declares-global-coronavirus-health-alert-but-no-travel-ban?utm_source=dlvr.it&amp;utm_medium=twitter,Coronavirus spread now a global emergency declares World Health Organization https://news.un.org/feed/view/en/story/2020/01/1056372?utm_source=dlvr.it&amp;utm_medium=twitter
31,Coronavirus: Belgian Prince Joachim tests positive after lockdown party - BBC News https://news.google.com/__i/rss/rd/articles/CBMiLmh0dHBzOi8vd3d3LmJiYy5jb20vbmV3cy93b3JsZC1ldXJvcGUtNTI4NjQwNzLSATJodHRwczovL3d3dy5iYmMuY29tL25ld3MvYW1wL3dvcmxkLWV1cm9wZS01Mjg2NDA3Mg?oc=5&amp;utm_source=dlvr.it&amp;utm_medium=twitter,US confirms first case of person-to-person spread of coronavirus ,#Coronavirus declared global health emergency by WHO https://www.bbc.co.uk/news/world-51318246
32,Belgium Prince tests positive for the Coronavirus after attending a lockdown party https://www.reddit.com/r/worldnews/comments/gtllaq/belgium_prince_tests_positive_for_the_coronavirus/?utm_source=dlvr.it&amp;utm_medium=twitter,OWL cancels China matches due to coronavirus ,A single coronavirus case exposes a bigger problem: The scope of undetected U.S. spread is unknown #coronavirus #covid19 
33,Kelly Ripa’s Best Coronavirus Clap Back Revealed https://celebrityinsider.org/kelly-ripas-best-coronavirus-clap-back-revealed-401715/?utm_source=dlvr.it&amp;utm_medium=twitter,Coronavirus: China says all countries should behave in responsible manner https://www.jpost.com/Breaking-News/Coronavirus-China-says-all-countries-should-behave-in-responsible-manner-616036?utm_source=dlvr.it&amp;utm_medium=twitter,"Possible outcome (not sure) : there could actually be _less_ people dying from winter illness this winter. People will get very careful because of #COVID19 , by that will reduce transmission ratio and transmit _less_ Flu"
34,Coronavirus: Belgian Prince Joachim tests positive after lockdown party https://www.bbc.co.uk/news/world-europe-52864072?utm_source=dlvr.it&amp;utm_medium=twitter,First case of new coronavirus in Moscow not confirmed — authorities ,South Korea is handling this public health crisis just divine: no panic but broad screening every possible contact to identifiy cases in an early stage and prevent worse. What a contrast with the European Union: we should watch and learn! #covid19 #coronavirus
35,Ten positive coronavirus tests in English Championship https://www.channelnewsasia.com/news/sport/ten-positive-coronavirus-tests-in-english-championship-12787992?utm_source=dlvr.it&amp;utm_medium=twitter,What Is Life Like For Those Who Are Living At Ground Zero Of The Coronavirus Outbreak http://warnewsupdates.blogspot.com/2020/01/what-is-life-like-for-those-who-are.html?utm_source=dlvr.it&amp;utm_medium=twitter,DO NOT GO THE DOCTOR IF YOU ARE SICK! Just give him a phone call! In the - unlikely case - that you have #COVID19 you really do not want to infect the doctor! Please act responsible (as you clearly want to do).
36,Delhi-Moscow Air India flight returns midway after pilot found positive for coronavirus ,Explainer: Rapid spread of China coronavirus fuels global alarm https://www.channelnewsasia.com/news/world/explainer--rapid-spread-of-china-coronavirus-fuels-global-alarm-12372506?utm_source=dlvr.it&amp;utm_medium=twitter,"Watching the @WHO #COVID19 live daily briefing. The toxicity level of the live comments on the broadcast scare me more than the actual virus itself. Ignorance, rumour spreading and blatant racism, to name but a few... "
37,Coronavirus: Trump faces backlash after US quits WHO - BBC News https://news.google.com/__i/rss/rd/articles/CBMiMWh0dHBzOi8vd3d3LmJiYy5jb20vbmV3cy93b3JsZC11cy1jYW5hZGEtNTI4NjI1ODjSATVodHRwczovL3d3dy5iYmMuY29tL25ld3MvYW1wL3dvcmxkLXVzLWNhbmFkYS01Mjg2MjU4OA?oc=5&amp;utm_source=dlvr.it&amp;utm_medium=twitter,MSC Cruises takes precautionary public health measures on all ships http://bit.ly/2GET8no #coronavirus #travel #MSCCruises,#Artificialntelligent is being used to study the outbreak’s spread and is powering the search for #COVID19 treatments #DigitalTransformation
38,Women's rights around the world in times of the coronavirus pandemic: Joint Statement by the High Representative/Vice-President Josep Borrell and Commissioners Jutta Urpilainen and Janez Lenarčič - World - ReliefWeb https://reliefweb.int/report/world/women-s-rights-around-world-times-coronavirus-pandemic-joint-statement-high?utm_source=dlvr.it&amp;utm_medium=twitter,Coronavirus: Satellite images show construction of Wuhan hospitals https://www.foxnews.com/science/coronavirus-satellite-images-wuhan-hospitals-construction?utm_source=dlvr.it&amp;utm_medium=twitter,Pet owners concerned about #coronavirusus &amp; their pets? Vets can get info on #COVID19 via @FecavaVets @FVEurope
39,"we ain't forget sis said coronavirus was made up tho, then was tested positive ",#Coronavirus #malware infects thousands of devices worldwide. Cybercriminals are taking advantage of global fears surrounding the deadly coronvavirus by sending out malware-laden emails supposedly offering guidance.,"“Resilience is about education, #COVID19 will not be the last emergency faced by Europe,” said Latvian Deputy Prime Minister and Defence Minister @Pabriks in a conversation with @BrianMaguireEU. Watch the full interview here: https://eurac.tv/9Rpg"
40,Belgian prince tests positive for coronavirus after attending gathering in Spain https://www.reddit.com/r/worldnews/comments/gthwxr/belgian_prince_tests_positive_for_coronavirus/?utm_source=dlvr.it&amp;utm_medium=twitter,"Had a NGGI been set up, this would have been much easier to manage. This was hampered thanks to the UN and EU Systems. THEY are responsible for the mismanagement of the coronavirus outbreak!",Thank you for this. On a sidenote: the rhinoviruses - the group most involved in common cold - are actually more active spring and fall than winter. The coronaviruses are as a group mostly wintery viruses. Says nothing abt #COVID19 of course. source: https://emedicine.medscape.com/article/227820-overview#a0101
41,What will be the impact of the #coronavirus on China’s economy and on the #ClimateEmergency ? Anyone has seen any good articles?,I've seen a paper published in the @NEJM call it the Novel Coronavirus (#2019_nCov)-Induced Pneumonia (NCIP),"""The initial cases were linked to workers at a market that sold live fish, animals and birds."" Stop selling #animals in these terrible conditions maybe #China ? #virus #coronavirus https://www.nytimes.com/2020/01/08/health/china-pneumonia-outbreak-virus.html …"
42,WHO calls for science and solidarity over coronavirus https://www.aljazeera.com/news/2020/01/calls-science-solidarity-coronavirus-200130200603490.html?utm_source=dlvr.it&amp;utm_medium=twitter,Chinese movie studio upturned its business model due to coronavirus – Western companies take note #covid19 #IMD #bytedance https://lnkd.in/dhmjYCW,The genome sequence of the newest Coronavirus causing outbreaks of #WuhanPneumonia has been released.http://virological.org/t/initial-genome-release-of-novel-coronavirus/319 …
43,"If legit, seems like another clue that this has some serious troubles spreading in warmer climates. #covid19 ",#COVID19 A growing list of new vaccines and therapies in development. ,A glance at the new coronavirus outbreak in China | The Japan Times https://www.japantimes.co.jp/news/2020/01/19/asia-pacific/science-health-asia-pacific/new-coronavirus-outbreak-china/ …
44,The best piece I have seen yet on #covid19 from @BillGates,"Hmm, and what has the EU done to prepare EU MS for #coronavirus #covid19? ",Latest #ECDC risk assessment on the cluster of #pneumonia cases caused by a novel coronavirus - #nCoV2019https://lnkd.in/d53PFfG 
45,"- @WHO DG warns that the world is at a ""decisive point"" to tackle the #coronavirus outbreak. - The number of newly confirmed #COVID19 cases in Hubei except for Wuhan has dropped to single-digit for the first time. Read out latest update https://bit.ly/3cgZQ1s","https://m.youtube.com/watch?v=JuiHJ1V-MnY if you know that 95% of Hongkongers wear a mask these days, you can't help asking why arent the expats in town wearing one #COVID19 #Hongkong #awareness","4 new cases of Coronavirus confirmed in Wuhan, 2 suspected cases in Shenzhen, 1 Shanghai #china #health #epidemic https://www.hozint.com/?utm_source=twitter__hozint&utm_content=1380643 …pic.twitter.com/iUfpJUYFvt"
