,Positive,Negative
0,41,9
1,The life is bad now. CORONAVIRUS new album of the big artist JAIR JEAN PIERRE AVAILABLE on Google play music SPOTIFY KKBOX ,"Sonora, Mexico, has had strict stay-at-home orders in place for more than six weeks now. But as some residents grow restless, leaders are pushing for continued compliance as the number of confirmed coronavirus cases continues to rise. "
2,Coronavirus sucks. Forget about it for at least a little while and travel back to Scotland with me for some #Geocaching! https://www.youtube.com/watch?v=ZTe0FGxsuXQ&amp;t=554s,Jared Kushner’s “princely arrogance” set back the coronavirus response by weeks: report 
3,JAIR JEAN PIERRE RETURN WITH THE CORONAVIRUS ALBUM AVAILABLE ON SPOTIFY GOOGLE PLAY MUSIC SPOTIFY SOUNDCLOUD,"Opinion | Coronavirus, Racism and Injustice: No One Is Coming to Save Us - The New York Times "
4,"Communism, Chlamydiae or Corona Virus. Pick one.",Wow. The corona virus is making SARS and the Swine flu look mild in comparison.. 
5,Work looks different in the coronavirus world. It might look different — and better — forever. https://www.huffpost.com/entry/coronavirus-reveals-american-work-wrongs_n_5ea2f57bc5b6d376358e5f0a?ncid=engmodushpmg00000004 via @HuffPostImpact,Bet there's a ton of anti-vax facebook mom's feeling a little panic with Corona Virus reaching our shores
6,Cities are responding to the coronavirus crisis by prioritizing pedestrians and cyclists over cars — one bright spot in an otherwise grinding news cycle. https://www.huffpost.com/entry/coronavirus-remake-cities-cars-pollution-walking-cycling_n_5e9eb1e5c5b63c5b587419a3?ncid=engmodushpmg00000004 via @HuffPostImpact,"The World Health Organisation has declared corona virus that has taken 171 lives as world health emergency How many innocent lives have been lost to Boko Haram since 2015 alone, that instead of a security emergency, we are debating the true meaning of executive bafflement?"
7,"'Great success story’: Jared Kushner takes victory lap as coronavirus toll nears 60,000 ","So, yeah, peeps will go to work w/ #COVID19 bc of the disincentives to take off but also bc a.) many will not know they have the virus if they have less severe symptoms &amp; think it's cold/flu &amp; b.) the current diminished capacity for doctors to test and/or confirm otherwise."
8,Exactly! #Minnesota #COVID19 #coronavirus ,"""Real crisis scenarios require cooperation and, crucially, 'flattening the curve' of the crisis exactly so the more vulnerable can fare better, so that our infrastructure will be less stressed at any one time."" #covid19 #coronavirus"
9,Trump: Coronavirus will have ‘a very good ending for us’ https://politi.co/2Uehtsf via @politico,wouldn't that make #DonaldJDrumpf infected with #COVID19? 
10,"China has a history of repression, censorship, internet control & propaganda, & we can't trust the info their gov't is providing on the coronavirus. Read my letter calling for a temporary ban on commercial travel to China here. We must keep Americans safe! https://byrne.house.gov/sites/byrne.house.gov/files/Coronavirus.pdf",China: 'Novel coronavirus' preliminarily identified in pneumonia outbreak - Outbreak News Today http://outbreaknewstoday.com/china-novel-coronavirus-preliminarily-identified-in-pneumonia-outbreak-47448/ …
11,U.S. to screen passengers for new China coronavirus at three airports https://www.emergencyemail.org/newsemergency/anmviewer.asp?a=20413&z=58 …,Why is China the origin of all deadly strains of coronavirus?
12,Trump: Coronavirus will have ‘a very good ending for us’ https://politi.co/2Uehtsf  via @politico,Sh8te just hit the fan in the US with one confirmed case #coronavirus #corona #novel #virus #disease #control #SARSvirus #earlydayshttps://twitter.com/amadain1/status/1219477425228328960 …
13,"This week on #SciFriday, we will discuss the novel coronavirus that has emerged in China and is now affecting other countries.",First Three Suspected Coronavirus Cases In Michigan Test Negative http://dlvr.it/RNshq8 
14,"1st confirmed case of new coronavirus reported in US: CDC
https://www.yahoo.com/gma/1st-confirmed-case-coronavirus-reported-washington-state-cdc-190926099.html …","Also on another note , will these antivaxxers be spreading the new Corona  virus? I don't know about you but when a safe vaccine comes out I'll be lining up this stuff is really scary."
15,"The fact that the Bernie-world narrative is basically that as long as nazis want “free” healthcare and weed, they’re okay with them.. CORONAVIRUS 2020!","#Coronavirus has gone everywhere but not in Africa, and @Trevornoah is hurt. Trust me boy ! You are #funny as much as  we are happy to keep this sneaky bug away from our #Borders.https://twitter.com/TheDailyShow/status/1224467852696215554 …"
16,"Translation for dummies:

""How to get #coronavirus: buy & use fresh water in pills and feel safe, you'll die anyway but pure and natural""

Follow Science, don't trust #homeopathy: it's your life that is at risk.","This Corona virus is scary as hell, but an estimated 80,000 Americans died of flu and its complications last winter — the disease's highest death toll in at least four decades! Just saying...…. https://twitter.com/TomthunkitsMind/status/1228819333268361216 …"
17,"yeah, if you want a side of coronavirus",sigh... yup been silently freaking out while surfing the corona virus hashtag all last week.
18,Coronavirus and Super-Spreaders: What You Should Know | The Healthy #SmartNewshttps://www.thehealthy.com/infectious-disease/coronavirus-super-spreaders-cdc/ …,"RT @Nwankpa_A: If you have a fever and you are losing your sense of taste and/or smell: While screening for malaria &amp; typhoid, you might al…"
19,"Steve's Thursday morning KDSK show.  

President Trump is weighing the idea of banning all flights to China as the coronavirus continues to spread. Under Trump’s plan, the only people allowed to go there are Adam Schiff and Nancy Pelosi.","RT @QuintFit: ""Loss of smell (anosmia) or loss of taste (ageusia) preceding the onset of respiratory symptoms has also been reported,"" said…"
20,"Steve's Thursday morning KDSK show 

President Trump is weighing the idea of banning all flights to China as the coronavirus continues to spread. Under Trump’s plan, the only people allowed to go there are Adam Schiff and Nancy Pelosi.","RT @epochchanger: In England and Wales
over 95% of #COVID19 deaths
had serious comorbidities as per NHS statistics.

No reason why that's n…"
21,New York tests coronavirus case as eighth person in US is diagnosed #SmartNewshttps://www.dailymail.co.uk/news/article-7956097/Eighth-confirmed-coronavirus-case-US.html …,RT @ScottGottliebMD: This is a critical milestone. Two therapeutic antibodies are now in the clinic with more on the way. These drugs can b…
22,Two new cases of #coronavirus in #Australia. The number of confirmed cases of coronavirus in Australia has risen to 12 after a couple was tested in South Australia. https://www.smh.com.au/national/two-new-cases-of-coronavirus-in-australia-20200202-p53www.html …,"San Antonio Mayor Declares Health Emergency Over Coronavirus, Mall Closes as Precaution https://www.theepochtimes.com/san-antonio-mayor-declares-health-emergency-over-coronavirus-mall-closes-as-precaution_3257811.html …"
23,My first illustration published with Northwestern accompanied this piece on #coronavirus. Check it out  https://twitter.com/NorthwesternU/status/1225197664641437696 …,"As Wuhan Remains Under Lockdown, One Steel Factory Has Continually Operated Since Coronavirus Outbreak Began https://www.theepochtimes.com/as-wuhan-remains-under-lockdown-one-steel-factory-has-continually-operated-since-coronavirus-outbreak-began_3258254.html …"
24,"Yeah cause Canadians can't get coronavirus. Tim, the mask is slipping.","That's nothing drive around the greyhound bus station on main/gray street you be shaking your head what you see there every single day, it's near metro police station too, that whole area is full of Corona virus that it smells like shit, pee pee and downtown too"
25,Coronavirus: Italy orders mass closures after COVID-19 cases quadruple | DW  https://www.dw.com/en/coronavirus-italy-orders-mass-closures-after-covid-19-cases-quadruple/a-52467865 …,Only one way to fight through this pandemic lads .. the return of Bike Mania #coronavirus #Covid_19pic.twitter.com/HPsSsR42Zm
26,"Coronavirus Transmission Clues: The Nose Knows | Medpage Today - Viral load higher in the nose versus throat, researchers report https://www.medpagetoday.com/infectiousdisease/publichealth/84988 …",
27,New Chinese study indicates novel coronavirus did not originate in Huanan seafood market - Global Times https://www.globaltimes.cn/content/1180429.shtml …,
28,"RT @AfricaCDC: #COVID19: update in Africa (As of 13 June 2020, 9 am East Africa Time)
More information at https://t.co/vEZ4eupedf
#COVID19…",
29,"In #COVID19 crisis, #Michigan's #publichealth pros leverage #socialmedia for good: https://t.co/DBalU16OsW",
30,@thehill 300K possible exposures to #Covid19 https://t.co/NlhnYTm2ch,
31,RT @CatalystInc: Catalyst's Negin Sattari discusses what impacts men’s decisions to #InterruptSexism at work—and how that plays out during…,
32,"To keep yourself and your community safe from #COVID19, you can use a homemade reusable face cover when stepping ou… https://t.co/gMvZV4eavV",
33,"RT @OoasWaho: #COVID19 accelerating in Africa - #WAHO DG @sokolo12  on eNCA TV of South Africa to share @ecowas_cedeao response. 
@Ecowas_c…",
34,"RT @TheDestroyer72: PLEASE RETWEET TO #EXPOSEBILLGATES
Time to let EVERYONE know the truth about #BillGates, his ""friends"" and their missio…",
35,Top US General Says Military Preparing for Potential Coronavirus ‘Pandemic’ https://www.theepochtimes.com/top-us-general-says-military-preparing-for-potential-coronavirus-pandemic_3257479.html …,
36,"Bring back biotech research and manufacturing jobs to the US!

Coronavirus Could Be The End Of China As A Global Manufacturing Hub https://www.forbes.com/sites/kenrapoza/2020/03/01/coronavirus-could-be-the-end-of-china-as-global-manufacturing-hub/ …",
37,Studiate! #coronavirus https://twitter.com/Brasviz1/status/1234263164449173506 …,
38,"Dennis Miller:
 
I'm working on a screenplay a'la ""War of the Worlds"" where after all else fails the thing that finally saves mankind from Coronavirus is Global Warming",
39,Coronavirus Outbreak Shows Importance of ‘Bringing Manufacturing Back to America’: Trump https://www.theepochtimes.com/coronavirus-outbreak-shows-importance-of-bringing-manufacturing-back-to-america-trump_3258385.html …,
40,"Local US health authorities are likely to report new cases faster as they use commercial diagnostic kits that have received quick approval, CDC official says 

Coronavirus: Reports of new US infections expected to rise amid boost in testing capacity https://www.scmp.com/news/world/united-states-canada/article/3064854/coronavirus-reports-new-us-infections-expected-rise …",
41,Wuhan doctor who worked with whistle-blower Li Wenliang dies after contracting coronavirus on front line | South China Morning Post https://www.scmp.com/news/china/society/article/3064830/wuhan-doctor-who-worked-whistle-blower-li-wenliang-dies-after …,
42,Coronavirus in Texas: more cruise ship passengers quarantined in San Antonio | The Texas Tribune #SmartNewshttps://www.texastribune.org/2020/03/08/coronavirus-texas-more-cruise-ship-passengers-quarantined-san-antonio/ …,
43,"Join us for an informational webinar about the coronavirus, get the latest updates on the virus and learn how we can protect ourselves! Select a time and register below to attend: pic.twitter.com/9VWtaHn2Xz",
44,"Only the best @realDonaldTrump also, you called #coronavirus  a #hoax. And #MattGaetzIsAToolhttps://twitter.com/willsommer/status/1237455320584269825 …",
45,""" the state public health lab can perform just 80 tests per day "" Coronavirus in Oregon: 3 new cases raise state tally to 24, health officials say https://www.oregonlive.com/coronavirus/2020/03/3-new-oregon-coronavirus-cases-raises-state-tally-to-24.html …",
46,"the LIFT act isn’t intended for people with no income, Kamala has separate plans for unemployment/disability and she’s working on a bill with senate dems for the coronavirus.",
47,Not even coronavirus can get people to buy turkey bacon. Stay safe people. pic.twitter.com/bIC4DYqbjb,
