,Positive,Neutral,Negative
0,647,"""Navajo Nation Continues Weekend Lockdown Due to Coronavirus"" by The Associated Press via NYT https://www.nytimes.com/aponline/2020/04/29/us/ap-us-virus-outbreak-navajo-nation.html?partner=IFTTT",1435
1,Mitch McConnell is calling Senators back to Washington on a personal agenda. Not to work on behalf of the American people fighting the coronavirus pandemic. He is calling them back to vote on federal judges appointments. His agenda/ his legacy. ,"Trump's penchant for lying angers me CNBC: Coronavirus testing chief says 'no way on Earth' US can test 5 million a day, despite what Trump says. https://www.cnbc.com/2020/04/29/coronavirus-testing-chief-says-no-way-on-earth-us-can-test-5-million-a-day.html via @GoogleNews",REAL PEOPLE ARE GETTING SICK AND DYING OF CORONAVIRUS #TheResistance #Resist #impeachMF #edinburgh #WeThePeopleMarch #NotMyPresident #RemoveTrump #AllRoadsLeadToPutin #TakeItBack #SchoolStrike4Climate #ClimateStrike #ExtinctionRebellion #RebelForLife #ppenow #TrumpResign
2,Whose coronavirus strategy worked best? Scientists hunt most effective policies https://www.nature.com/articles/d41586-020-01248-1 via @nature cc @quinteroposada,Coronavirus: Medical cannabis access eased amid lockdown #MedicalMarijuana #CannabisCommunity #UnitedKingdom,"""55% of respondents said their mental health is suffering because of the coronavirus outbreak"": "
3,"However, as someone about to give birth, I know I won't feel comfortable going still for some time now. I just wonder when the threat of coronavirus will fade to a level when the bishops say - ok, y'all must go back now.",Gov. Jared Polis on Wednesday outlined how Colorado will ramp up its coronavirus testing as the state transitions away from a rigid stay-at-home order ,Germany avoids the worst of coronavirus crisis — but how? 
4,Approval for Trump's handling of coronavirus drops 10 points: poll https://thehill.com/homenews/administration/495177-approval-rating-of-trumps-handling-of-coronavirus-drops-10-points #msnbc #inners,Keep track of the Coronavirus numbers - ,"Federal Judge Smacks Down Mnuchin, Rules Coronavirus Funding Is for Tribal Governments and Not Corporations https://lawandcrime.com/covid-19-pandemic/federal-judge-smacks-down-mnuchin-rules-coronavirus-funding-is-for-tribal-governments-and-not-corporations/ via @lawcrimenews"
5,Us Truckers are enjoying the open roads ! #TruckDrivers #StayAtHomeAndStaySafe #Lockdown #CoronaVirus #COVID19,"#MassMurderer #realDonaldTrump's Coronavirus FAILURE is deadlier than any flu since 1967 as American Deaths top 60,000 @SenCoryGardner and @RepDLamborn say The #GOP State will never provide Affordable Healthcare For Americans or a Universal Basic Income",Florida medical examiners were releasing coronavirus death data. The state made them stop. 
6,Keep the #hustle going y'all. Not a bad idea for this warm weather. Support your #LocalBusinessOwners every chance you get. Happy #HumpDay my peeps. #ShelterInPlace #ItIsWhatItIs #quarantine #CoronaVirus #covid19… https://www.instagram.com/p/B_lRiDGgWZG/?igshid=16zr8m2cp57ol,"Trump Forces Media To Watch Their Own Coronavirus Failures, Video Broadcast to Nation ","That’s whataboutism Jack. Abortion has nothing to do with 60,495 Americans dying of coronavirus. The fake pro-life MAGATS keep bringing up abortion while saying it’s ok for older people to die. And trump claims to be pro-life simply to get your votes."
7,"So, in other words and perspective, 0.003% of voters/workers tested positive for the coronavirus. Sounds like the vote by mail leftists' fanatics were wrong once again! via @ABC",Big commercial labs given priority for coronavirus testing equipment by feds https://www.cnn.com/2020/04/28/politics/testing-coronavirus-hospitals-commercial-labs-invs/index.html,"The coronavirus pandemic is steeped in uncertainty, confusion, shifting information, and muddled messages. Here’s a guide to cutting through it all, from @edyong209:"
8,"Women academics seem to be submitting fewer papers during coronavirus. ‘Never seen anything like it,’ says one editor. ","I can’t believe this needs to be said, but when you’re in public, the mask goes OVER your mouth AND nose. When you’re in the car or in private, do as you like. #coronavirus","Tragedy is non-essential reality show TV star who became president One who DID NOT read his Intel briefing book in Jan or Feb and start preparation defense against Coronavirus now 61,000+ souls are dead His idolaters have blood on their hands too Pity them on judgement day"
9,If Trump wasn't president and not rich....people would think he was the raging old coot on the nursing home wing. and if he were in the nursing home wing.. what would be his odds in view of Coronavirus?,"COVID-19: Massachusetts Governor Extends Non-Essential Business Closures to May 18, 2020 http://ow.ly/joER30qBRsa @PierceAtwoodLLP #Coronavirus #PublicHealth","ESPECIALLY a non-essential reality show TV star who became president One who DID NOT read his Intel briefing book in Jan or Feb and start preparation defense against Coronavirus now 61,000+ souls are dead His idolaters have blood on their hands too Pity them on judgement day"
10,"Trump declares meat packing workers are immune from Coronavirus, and shall be forced to work - ok, not really, but what else could he have been thinking?? ",How four Colorado companies answered the call to make coronavirus supplies for health care workers https://coloradosun.com/2020/04/29/the-coronavirus-crisis-drained-supplies-of-masks-and-shields-how-4-colorado-companies-an,Denver has cited 23 businesses for breaking stay-at-home orders during the coronavirus #colorado #denver #market #today #denvercolorado
11,Trump Encouraged Sean Hannity to Go After the New York Times-Trump thought it was a good idea for Hannity to explore legal action against the news outlet for its critical coverage of how Fox News handled the coronavirus crisis. https://www.thedailybeast.com/donald-trump-encouraged-sean-hannity-to-go-after-the-new-york-times-for-its-coronavirus-coverage?source=twitter&amp;via=desktop via @thedailybeast,As many as two in five Americans report concerns about experiencing increased anxiety in the wake of coronavirus. 68% of people feel like everything is out of their control. 38% of Americans report feeling optimistic about the country's recovery. https://bit.ly/2zwrQ2e,Hey here’s another outrage continuing as we speak buried by coronavirus news. There are things continuing to happen that have nothing to do with the pandemic. 
12,"Vitae Industries is a @GANConnect Ventures Portfolio Company out of Providence, RI, USA, that is using 3D printing to boost ventilator capacity during this challenging time. https://buff.ly/2SgHV2Q #3dprinting #innovation #coronavirus #covid19 #startup #Ventilator","#Coronavirus cases climb in #Fresno, amid debate over whether to reopen more businesses","NEW: Colorado has confirmed 14,758 cases of the novel coronavirus in the state and 766 deaths, according to data released Wednesday "
13,Interesting GDP graphic. Reminds me of a meme...Coronavirus: US economy shrinks at fastest rate since 2008 https://www.bbc.co.uk/news/business-52466864,#coronavirus situation has exposed our hearts. Complaining is a natural response. Listen to today’s podcast ,If you wear the same mask everyday you deserve to get coronavirus your just putting the nasty germs from wherever you go closer to your mouth/face every time. Natural selection at its finest.
14,"The American government passed the Families First Coronavirus Response Act (FCCRA), a collection of acts that provides certain protections and relief for employees. Here’s what every employer with 500 or fewer employees needs to know: https://hubs.ly/H0p_Cpp0","Five days ago the US reached 50,000 coronavirus deaths. Today, we’re over 60,500. That’s 10,000+ deaths in 5 days *with* stay-at-home measures. Now imagine what those numbers would be if we re-open without a cure, vaccine, PPE or testing. I’ll spare you the math — it’s millions.",New theory: @theblackcrowes reuniting caused a disturbance in the universe and that caused the Coronavirus
15,"#1 Venezuela is asking the Bank of England to sell part of the South American nation’s gold reserves held in its coffers and send the proceeds to the United Nations to help with the country’s coronavirus-fighting efforts, according to two sources with knowledge of the situation.",Commissioner Roger Goodell has reduced his salary to $0 and other NFL employees will be taking pay cuts or furloughs due to the coronavirus pandemic. ,The computer algorithm that was among the first to detect the #coronavirus outbreak https://www.cbsnews.com/news/coronavirus-outbreak-computer-algorithm-artificial-intelligence/ #AI #BigData
16,They stop airing Maury for this Coronavirus coverage and I’m not happy about it!!! @KTLA,Preparing for the New Workplace Paradigm Series: A Roadmap for Employers in the Time of COVID-19 http://ow.ly/164q30qBRkB @Mintz_Law #EmpLaw #Coronavirus #WorkerSafety,Florida medical examiners were releasing coronavirus death data. The state made them stop 
17,Every country in the world now has CoronaVirus...but China had it right of the bat,A post- Coronavirus design landscape might have us reevaluating the way our homes are designed. See how here: https://buff.ly/2W9844O,"Coronavirus Disrupts Illegal Wildlife Trafficking, for Now "
18,Heitkamp: Trump coronavirus response 'failed' ,Newport Folk And Jazz Festivals Canceled Due To Coronavirus ,My guess his first rally will be must watch tv. He has been sitting on his hands for weeks without the results he expected from Coronavirus. This virus really let him down. Sad! 
19,.@ASlavitt do these new masks I am seeing with copper in between 2 layers of cloth actually work better keeping coronavirus out of out nose/mouth or nah? $30 seems like a lot for a mask,"During coronavirus, El Busesito is doing home preschool deliveries in Colorado's Roaring Fork Valley. #edcolo #ece https://co.chalkbeat.org/2020/4/29/21239069/photo-gallery-how-a-colorado-mobile-preschool-program-shifted-gears-when-coronavirus-hit via @ChalkbeatCO",#JaredKushner is delusional! Kushner calls US coronavirus response a 'success story' as cases hit 1 million - CNNPolitics 
20,"The words ""#coronavirus” and “benefits” really don’t belong in the same sentence. There is no upside here. But, once this is finally behind us things will change. And some of those changes will be for the better. https://wearelayup.com/what-covid-19-will-change-and-what-it-wont/ #covid19 #innovation #contentmarketing",@jenniferatntd Virologist that discovered HIV says that coronavirus was human made. ,"#2 The effort signals that Maduro is desperately seeking financial resources around the world as the country’s economy struggles under low oil prices, crippling U.S. sanctions and a paralyzing coronavirus quarantine."
21,Excellent article. Trump and the coronavirus have exposed America as a declining empire: Time to face the facts ,"Yah, @mako and @aaronshaw clued me in a while back so I crawl the redirect graph to get all the page views. Interestingly, pageviews are still logged for uncreated pages. The “coronavirus disease 2019” article wasn’t created until February 5 but had hundreds of views in Jan.","Cuomo says he stands with Minneapolis protesters, links higher rates of coronavirus to racial inequality "
22,But he was a lifelong Coronavirus supporter dontcha know.,Herbal Medicine for the Treatment of Coronavirus Disease 2019 (COVID-19): A Systematic Review and Meta-Analysis of Randomized Controlled Trials. https://plus.mcmaster.ca/COVID-19/Article/Details/32456123?s=Twitter,They are already tear gasing in #Denver. Curfew doesn't start for 2 hours. I don't know what to do. #SocialDistance or join in the protest for my people. We will never recover from #coronavirus this way. I feel broken and torn.
23,About 75% of Trump’s proposed coronavirus capital gains tax cut would go to the top 1% of earners ,"We may be #AloneTogether, but here is an overview of what's still happening at @ColoradoStateU during this #Pandemic! #MIP is proud to be involved with many #CSU #COVID19 projects. #Coronavirus #SARSCoV2 #CSUResearch #InfectiousDiseases #PublicHealth","@POTUS THE BLOOD OF ALL AMERICANS DEAD FROM THE VIRUS IS ON YOUR HEAD AND HANDS. Coronavirus (COVID-19) pandemic United States cases Updated May 30 at 5:25 PM local Confirmed 1,803,509 +24,305 Deaths 105,097 +1,090 Recovered 389,429 +7,406"
24,Let's go full tinfoil hat - making the case using available information from reputable sources that #nCoV2019 #coronavirus came from the Wuhan BSL-4 Lab. (1/9) #CoronavirusOutbreak #WuhanCoronavirusOutbreak #tinfoilhat @EricRWeinstein,Supreme Court Rejects Church's Challenge To California's Coronavirus Rules http://dlvr.it/RXgjM7,"Coronavirus (COVID-19) pandemic United States cases Updated May 30 at 5:25 PM local Confirmed 1,803,509 +24,305 Deaths 105,097 +1,090 Recovered 389,429 +7,406"
25,This happened faster than I thought. #CoronaVirus #InternationalEmergency,First the coronavirus shut them down. Then protestors looted and pillaged their stores These Denver businesses were hit with a double whammy. ,"Avoid #scams &amp; #frauds during health crisis During the coronavirus crisis please beware of robocalls, texts and emails promising COVID cures or fast stimulus payments http://ow.ly/QDAJ50zUzXB @AARP @AARP #OlderAmericansMonth"
26,What is he thinking? The Coronavirus is not good for anyone. , doona-baes: coronavirus preparedness starter pack ,"So when coronavirus hits CO, businesses open back up in a month... but as soon as people start hittin the streets to protest, there’s a curfew implemented. Tell me how this makes since when everyone wasn’t social distancing before May 15th?"
27,CORONAVIRUS PROTECTION MEASURES! Protect yourself &amp; others from getting sick! 1. MASKS ARE 1/2 PROTECTION!! 2. WEAR GLOVES! 3. DON'T TOUCH FACE! 4. WASH OFTEN! (Click BLUE LINE for info!) https://who.int/emergencies/diseases/novel-coronavirus-2019/advice-for-public (who .int World Health Organization),"“Eventually, doctors will find a coronavirus vaccine, but black people will continue to wait, despite the futility of hope, for a cure for racism.” - @rgay @nytimes #BlackLivesMatter","We've updated our map of coronavirus case (26,098) and the number of people with infections who have died (1,443) in Colorado: "
28,"$SPX +0.3% Coronavirus volatility in stocks Virus spreads but WHO remains calm Markets recover from -0.75% morning Big earnings day: $TSLA $MSFT gain, $DD $UPS $FB lose. Q4 GDP +2.1% Fed Funds move to 2 cuts in 2020 as economic uncertainty increases.",TFW> You're an essential worker. #MEMES #Meme #OriginalContent #COVID19 #CoronaVirus ,"I hope he IS livid. And I hope all other leaders follow suit. He's a fraud, and they know it. @realdonaldtrump do you really think that they are going to come to America, where the chance of being infected with coronavirus, and also infested with bedbugs, is so likely?"
29,"The Trump administration apparently has barred Dr. Anthony Fauci, the director of the National Institute of Allergy and Infectious Diseases NIAID, from speaking publicly about #COVID19 without prior approval from ""King"" @realDonaldTrump.",Denmark and Finland have re-opened schools with no increase in Coronavirus cases - American Thinker https://www.americanthinker.com/blog/2020/05/denmark_and_finland_have_reopened_schools_with_no_increase_in_coronavirus_cases.html,"These 24 States Have Uncontrolled Coronavirus Outbreaks, Study Says "
30,"In the face of #COVID19 big and bold policy responses are required and required fast. Unfortunately, @realDonaldTrump's @GOP administration and the @VP, they don't inspire any confidence that it’s up to this enormous task.",So what happened to coronavirus?? #OneThronePolls,"Coronavirus in Louisiana: 775 new confirmed cases, 19 new deaths statewide; see local numbers https://www.nola.com/news/coronavirus/article_90ae9292-a28a-11ea-91b1-478c3d010395.html?utm_medium=social&amp;utm_source=twitter&amp;utm_campaign=user-share via @nolanews"
31,The @BBCNewsGraphics did a good job with these #dataviz resources on #COVID19: https://bbc.in/30XScE3,We have switched our efforts to help flatten the curve. Check out our face masks and order yours today! http://gunterco.etsy.com . . . . . #StaySafe #StayStrong #StayHome #StayHealthy #Covid #Covid19 #Coronavirus #Mask #PositiveVibes #FlattenTheCurve,"Our suffering during the #coronavirus crisis will be in vain if we fail to build “a more just, more equitable, more Christian society,” #PopeFrancis has said"
32,"Officials in Solano County have traced ‘dozens’ of people the Vacaville, CA resident who tested positive for #coronavirus #COVID19US #COVID19 may have come into contact with—Vacaville is about 10 miles/16 kms from Travis AFB—a site visited by one of the HHS teams. ",8pm curfew? yeah okay. there was also the same ‘curfew’ when coronavirus started &amp; hardly anyone even listened. ,Nigerians before of such talks. Don't wait till you get infected before u believe the figures. Coronavirus is on Nigerian soil. Ncdc figures are not even the exact figures. People are still hiding 
33,"After HHS team visit to Solano County—a Vacaville, CA resident tested positive for #coronavirus #COVID19US #COVID19 after being moved from NorthBay VacaValley Hospital to UC-Davis Medical Center—w/officials now trying to trace her direct contacts. ",Aspen arts nonprofits — including Anderson Ranch Arts Center and Aspen Music Festival and School— taking fundraising galas online for coronavirus-impacted summer https://bit.ly/3eysNGF,WHO THINKS THE CORONAVIRUS WAS DIVERSION FOR ANTIFA'S UPCOMING VIOLENT EVENTS THE NEW WORLD MONARCHY PAID DEMS TO PASS UNCONSTITUTIONAL LAWS FOR? 
34,Concerns about 28-31 Jan HHS team visits to repatriated US citizens stationed in Wuhan—may have sparked addt’l spread of #coronavirus #COVID19 #武汉肺炎 b/c HHS teams who interacted w/them “[appear] to have done so w/out appropriate personal protective equipment (PPE) &amp; training.,Coronavirus: 3 pilares sustentan plan postCovid trasplantes #ONT #DonaVida,Lol at the fact rhat I thought coronavirus was rock bottom for 2020. Very nervous for what is still to come 
35,"Don't be stupid, people. Corona beer was named long before the COVID19 came along. Drink up. Stay happy and smart. ","Where Coronavirus Is More Likely To Be Airborne, 5 Places To Avoid http://dlvr.it/RXgVj5","“How come these viruses don’t wipe out entire colonies? These bats are snuggled up, breeding, urinating, and drooling on one another. There’s something weird about bats in terms of immunity.” https://magazine.source.colostate.edu/inside-the-bat-cave/ #coronavirus #bats #InfectiousDisease"
36,Nice two-part thread by @TheMenacheryLab on prelim genetic characterization of novel Chinese #coronavirus making headlines this week. https://twitter.com/TheMenacheryLab/status/1215826855086952448 …,my mom bought a ticket to come back to the US from china tonight before there’s a ban put down and y’all if i get coronavirus within the next two weeks—-,So is corona virus over. I’ve not heard a single word about it in the past few days
37,"Did you say lysol, or lime salt? Coronavirus sounds delicious on a golf course on a long hot summer day....",rip in peace Michael. Died of the coronavirus.,"‘House Party' Podcast: Can Your Swimming Pool Kill Coronavirus? Plus, How We Really Feel About Netflix's ‘Selling Sunset': With Netflix releasing Season 2 of ""Selling Sunset,"" we decided to sit down and give the real estate reality series a shot. Here' ... https://bit.ly/3eB5pZd"
38,Hope we learned enough from SARS to not cover up another coronavirus.. https://twitter.com/NathanGrubaugh/status/1218614499453874178 …,"Accom's Razor - the simplest answer is correct. In this case, there is ample evidence for Accom's Razor in either scenario - A. Normal exposure in a mkt to bats and other animals or B. Accidental release from the Wuhan lab. (9/9) #coronavirus #CoronavirusOutbreak #WuhanVirus",At least there’s that. Another rhetorical question—will the new coronavirus outbreaks (as a result of the riots) be covered?
39,"""We should exercise some extra vigilance because we are responsible also for the greater good of the majority."" #Coronavirus #Philippineshttps://www.catholicnewsagency.com/news/filipino-bishops-urge-caution-amid-coronavirus-report-63001 …",The flu is much deadlier than the Chinese coronavirus ,I believe that the coronavirus could have been strategically release by the @XHNews govt to this the herd and the lost control of it and it went Pandemic @who @cdc @realDonaldTrump
40,"If getting the coronavirus is the price to pay for enjoying my delicious boxed wines, so be jt",Maybe it's bio warfare #CoronaVirus,Apple closes 3 China stores over coronavirus worries http://dlvr.it/RP4vmQ
41,This Coronavirus is a very big threat to the world and the world is leaving all the responsibility to China to contain it. It is vitally important that all countries collaborate with sufficient resources to China so that it can handle this virus more effectively.,"Colorado is Brewing Things. RT @kanthMD: CBS Denver: Coronavirus Has Nothing To Do With Corona Beer, But Some People In Colorado Think It Does.… https://twitter.com/i/web/status/1223014584451305475",How does coronavirus spread? How can you protect yourself? The Wuhan coronavirus outbreak is a new illness and scientists are still assessing how it spreads from person to person. *Hand-washing is a first line of defense. (Click blue line for info!) https://www.theguardian.com/world/2020/jan/30/how-does-coronavirus-spread-and-how-can-you-protect-yourself *
42,@NBCNews This Coronavirus is a very big threat to the world and the world is leaving all the responsibility to China to contain it.  It is vitally important that all countries collaborate with sufficient resources to China so that it can handle this virus more effectively.,Please God stop this #coronavirus #worldhealthorganization,"UCCS doesn't have any students currently in China, but CU Boulder is taking precautions in response to the coronavirus outbreak. "
43,"@nytimes This Coronavirus is a very big threat to the world 
 and the world is leaving all the responsibility to China to contain it. It is vitally important that all countries collaborate with sufficient resources to China so that it can handle this virus more effectively.","Y’all the #coronavirus is officially in SoCal. If you live in Carson, check this out. ","Coronavirus shutdown in China shouldn’t sicken the U.S. economy, UMB Bank forecasts "
44,@TheEconomist This Coronavirus is a very big threat to the world and the world is leaving all the responsibility to China to contain it. It is vitally important that all countries collaborate with sufficient resources to China so that it can handle this virus more effectively.,I’m going on leave if the novel coronavirus hits my city ,"The Coronavirus Quarantines, From Bizarre to Heartbreaking a "
45,@XHespanol This Coronavirus is a very big threat to the world and the world is leaving all the responsibility to China to contain it. It is vitally important that all countries collaborate with sufficient resources to China so that it can handle this virus more effectively.,"According to USA Today, the World Health Organization has declared coronavirus a global public health emergency. https://bit.ly/2GBhK0z #coronarvirus", I suspect even the Coronavirus wouldn't go near him.
46,"Coronavirus Spread Self-Sustaining, Won't Stop With Warmer Weather: CFR https://youtu.be/ZO_XC3jI2c4  vía @YouTube","The Chinese likely lost control of a biological experiment, which has led to the coronavirus crisis. I believe SARS had a similar beginning.","The Colombian government is again embarrassing all of us: there are only 14 Colombian citizens in Wuhan, but only 7 can be evacuated by the COL gov't, so a draw is planned. #coronavirus #2019nCoV #2019新型冠狀病毒 #2019新型コロナウイルス #緊急事態宣言 #武漢肺炎"
47,okay so this might sound bad but like...everyone is trying to get their citizens out of wuhan because of coronavirus but like won’t that just bring coronavirus back to their countries? is this really a good idea? am i just stupid?,No. But they *are* blaming him for #COVID19 Go figure.,"China coronavirus: A visual guide (BBC News World, UK) (Click bright blue line for info &amp; FULL SCREEN) https://bbc.com/news/world-51235105 How do you quarantine a city? How worried should we be? Can wearing masks stop the spread of viruses? (+Info on Basic Respiratory Control Measures!)"
48,.@ColoradoStateU researchers are re-creating live-animal markets in the lab to see how pathogens like coronavirus jump species https://bit.ly/389SlXQ  via @ConversationUS,"No one expects the Trump administration to cure #COVID19 overnight. But they’re not even taking it seriously as a public health crisis, just a public relations problem and investment opportunity.",CORONAVIRUS INFO: 01/30/2020 World Health Organization (WHO) Declares coronavirus public health emergency Press Conference: WHO's Director-General Dr Tedros declared the coronavirus public health emergency of international concern. (Click blue line!) 
