,Positive,Neutral,Negative
100,"#Democrats luck...

They want: Trump and Republicans to contract the #Coronavirus 

Instead: The Virus spreads to Democrat voters who decided to cast their Primary votes for Bernie, which actually were counted for Joe... 

Welcome to the Left...where nothing can go Right. #MAGA","Check out my podcast, Conversations with Phil and Pete , on @anchor! https://anchor.fm/phil-pete  #podcast #SuperBowl #PrayForRush #coronavirus","Forget coronavirus, I have XFL Fever!"
101,"Si no me mata el coronavirus me mata I don't know what to say about this one but I think it is a good idea to have a good time with you and your family.

JAJAJAAJ QUÉ PUTAS https://twitter.com/_onerolita/status/1234999382090514432 …","Egypt 

 has reported their 1st case of #coronavirus. The patient is a foreigner with no symptoms. This is the first case in Africa....NO Symptoms Troy ~~Open borders~~",Markets soar on unconfirmed reports of coronavirus treatment http://dlvr.it/RPSxMh pic.twitter.com/umG9FcXilc
102,"Denver Democrat faces backlash after tweeting ‘solidarity’ for spreading coronavirus at Trump rallies

https://www.foxnews.com/politics/denver-democrat-faces-backlash-after-tweeting-solidarity-for-spreading-coronavirus-at-trump-rallies …",Anyone else want to use coronavirus as an opportunity to suggest we go back to laity only receive the Eucharist under one species?,"""This is not to say that we shouldn’t be concerned about people getting sick...We just shouldn’t treat this as something catastrophic.""
@UofDenver @josefkorbel professor Sandy Johnson is optimistic about stopping #Coronavirus. #DUResearch #DUNewsroomhttps://twitter.com/UofDenver/status/1225119777149972481 …"
103,"The Chamber continues to monitor the #coronavirus and in addition to the resources below, we have compiled a list that may be helpful to member businesses:

https://fortcollinschamber.com/resources-for-members-legislative-tracking-coronavirus/ …https://twitter.com/ACCEHQ/status/1234927773145292804 …",Coronavirus scaring China  Investors pulling out of stock investments and buying bitcoin it’s immune to the coronavirus ,"Coronavirus: how dangerous is it? https://youtu.be/jEPi1KYanh4 

V I R A L I T Y"
104,"Wow Google canceling I/O 2 months early over coronavirus
https://www.cnn.com/2020/03/03/tech/google-i-o-canceled-coronavirus/index.html …

via @GoogleNews",Russian media outlets are blaming the coronavirus on the United States https://www.motherjones.com/politics/2020/02/russian-disinformation-coronavirus/ … via @MotherJones,"Chinese policymakers are readying measures to support an economy jolted by a coronavirus outbreak that is expected to have a devastating impact on first-quarter growth, policy sources said. #tesla https://finance.yahoo.com/news/us-stocks-rise-china-stimulus-073311849.html …pic.twitter.com/QlV14j4a7U"
105,"Times like these I’m glad I have/had no money to invest in the stock market....

Perks to being a only parent Geriatrician with loans and nothing to  invest.

The #coronavirus #StockMarket  crash has really not impacted me in any way whatsoever",Coronavirus fight: Hundreds of trucks were dispatched to spray disinfect... https://youtu.be/wYbTkcZCRq8  vía @YouTube,https://youtu.be/ZQz3xaF1-bA  See the Coronavirus through the eyes of Wuhan citizens.#2019ncov #coronavirus #wuhan #wuhanchina #ncov #outbreak #pandemic #cdc #zombievirus #2020coronavirus #outbreak #chinaoutbreak #nottheflu #flu #wuhanchina #quarantinezone #osmosis #coronavirusnews
106,It was nice knowing you. No amount of astrology will save from the coronavirus.,"Most coronavirus cases are mild, complicating the response https://www.washingtonpost.com/health/most-coronavirus-cases-are-mild-complicating-efforts-to-respond/2020/02/12/213603a4-4dc2-11ea-bf44-f5043eb3918a_story.html …",It's probably hiv so.... Black blue bonnet rage 1 quit plague? Canada won't follow U.S. and declare national emergency over coronavirus: health minister - https://www.cbc.ca/news/politics/champagne-coronavirus-airlift-china-1.5447130 …
107,"#coronavirus is the greatest potential threat to humanity 
1. $$ into testing kits now
2. $$ into research now
3. New regiments to protect military & all first responders
4. Close schools
5. New protocols for nursing homes
6. Cancel large gatherings now
7. Protect supply chains",Pangolins Are Suspected as a Potential Coronavirus Host - The New York Times https://www.nytimes.com/2020/02/10/science/pangolin-coronavirus.html …,"Purports to show a Wuhan citizen saying infected people are basically ""left for dead"" by the hospitals, which are in total chaos, among other things

#coronavirus https://twitter.com/the_bad_raccoon/status/1221405485611585536 …"
108,"Preparing for a Pandemic: Review Business Continuity Plans Amid Coronavirus Outbreak. 
Bob Sibik from @RIMSorg reports on supply chain, employee travel and event cancellations:http://ow.ly/iSOg30qnqcE ",Cancelando el Mobile World Congress de Barcelona por el coronavirus https://guapacho.com/cancelando-el-mobile-world-congress-de-barcelona-por-el-coronavirus/ …,"Early non-peer-reviewed research suggests R0 of 4.08 & fatality rate of 6.5%

Infected people may be spreading the virus for a surprisingly long period of time before showing symptoms, and after disappearance of symptoms

Very early stuff but from mainstream source

#coronavirus https://twitter.com/DrEricDing/status/1223664578703319041 …"
109,Spock's Vulcan salute should replace handshakes in coronavirus era https://cnet.co/2VZuRSb  via @CNET,CSU will host a special forum focused on the science of coronavirus tomorrow at 5 p.m. in LSC Ballroom D. Hear our distinguished researchers address the relevant questions about this illness and its impact on global public health. CSU is committed to educating our community.,"@realDonaldTrump offered China help with the Coronavirus but haven't taken him up on it yet? Hum, I wonder why? Maybe b/c he would eventually force them into telling the world that the virus is running rampant in Democrats in November? GOOD JOB GOP! YOU OWN THIS!"
110,Colorado has its first presumptive case of coronavirus; patient was visiting Summit County – The Colorado Sun. ⁦@lookner⁩https://coloradosun.com/2020/03/05/colorado-first-coronavirus-case-confirmed/ …,Imagine the panic if cigarettes killed exponentially more people than coronavirus. Oh...well...this is awkward. https://twitter.com/cnnbrk/status/1229909687987994625 …,"Via @Reuters
https://reut.rs/2GObGSw 
@zerohedge has been banned by @Twitter 
on violating #Twitter’s rules after exposing personal data ofchinese scientist
As u know there're gossips on#coronavirus outbreak and #Wuhan Institute of Virology(military #biowarfare program?)pic.twitter.com/Rwv71WKLkZ"
111,First Positive Coronavirus Case In Colorado Identified Is An Out-Of-State Visitor To Summit County https://www.cpr.org/2020/03/05/colorado-coronavirus-case-is-states-first-positive-health-officials-say/ …,"Bishop Joseph Zhu Baoyu, Bishop Emeritus of Nanyang, has recovered from coronavirus. At age 98, he is among the oldest infected patients to have recovered. http://bit.ly/2P57UIF ","I sent out a YouTube video about event201, the simulation before the release of the Coronavirus back in October. It's a genetically engineered virus, but they're telling you it came from a bat like they said HIV came from a monkey! Foolishness!"
112,It will be interesting to see how Coronavirus and how people/company/government response changes this prospectively. Less flu/illness? More openness to remote employees? ,"@realDonaldTrump Thought you said you had this under control?  @ny_red1. 
44 Americans On The Diamond Princess Cruise Ship Diagnosed With Coronavirus https://www.npr.org/2020/02/16/806470340/americans-evacuate-diamond-princess-cruise-ship-amid-spread-of-infection?sc=18&f=1001 …","This is the most horrifying thing I’ve seen in quite awhile. This poor boy dying alone, unable to help himself. Coronavirus: Disabled boy dies in China after father quarantined - BBC News https://www.bbc.com/news/world-asia-china-51362772 …"
113,"I wonder if @realDonaldTrump realizes that the elderly are a big chunk of his base and his coronavirus response will kill a lot of them? Like he knows that they can't vote once they're dead, right? https://twitter.com/maddow/status/1237064582717472768 …","Wonder if my work, who makes us drive in during a severe blizzard or use PTO, will force us to come into the office during the #coronavirus outbreak instead of working remotely",Agree with it all but also agreed with what Epidemiologist Dr W. Ian Lipkin said that the reason Coronavirus is such a big worry is because its a brand new strand that we know nothing about and it could mutate before we learn anything.
114,Tips for staying healthy while flying in the age of coronavirus http://ow.ly/G0vP30qo0r0 ,DHS deputy chief won’t rule out theory that coronavirus was created in a Chinese lab https://www.bizpacreview.com/2020/02/25/dhs-deputy-chief-wont-rule-out-theory-that-coronavirus-was-created-in-a-chinese-lab-890979 … via @BIZPACReview,Coronavirus Outbreak: Royal Caribbean Cancels 18 Sailings - https://wp.me/p6WPz2-7Q2 pic.twitter.com/Cm2xxLozRH
115,Round trip flight to Chicago $77. Thank you Coronavirus.,Someone tell Trump the Corona Virus is coming from Mexico and he will shut that shit down. Everyone at the CDC will be drinking Budweiser,"I think that for now they will not go to Europe, because the coronavirus is very danger, I think you need to wait one year."
116,"As part of the CSU community, CIRA will be supporting all actions related to CSU's efforts regarding coronavirus.  

Updates continually online at: https://safety.colostate.edu/coronavirus https://twitter.com/ColoradoStateU/status/1237886453201268737 …",Moderna delivers first coronavirus vaccine for human testing https://youtu.be/Y76m1KRj-UU  via @YouTube,@save_the_tweet #save Coronavirus scares Chinese investors. They sell all stock positions causing another global recession. Bitcoin is immune to the coronavirus just saying.
117,"One day we are all going to wake up and no one will be talking about the coronavirus. No one will know when it stopped but it will, right after the government gets what they want out of this overally dramatized virus. And for that my friends, I can't wait.",I guarantee you Trump only put a gag-order on doctors that visited the White House over the coronavirus has nothing to do with public fear or outcry but everything to do with The DOW,WHO Concerned Over New Coronavirus Cases Outside China https://learningenglish.voanews.com/a/world-health-organization-concerned-over-new-coronavirus-cases-outside-china/5282010.html …
118,i went to public school AND worked in retail so coronavirus can get its ass kicked by my fuckn immune system lmaoooo,Stocking up for the Coronavirus?,"Time to stock up on meds. Even if #coronavirus doesn’t outbreak in the US, it will still have an impact on our most essential items. https://twitter.com/Laurie_Garrett/status/1230270375893884931 …"
119,"You know you’re in a college town affected by #coronavirus when you see half of the people bulk buying dried goods and the other half bulk buying beer at the grocery store. 

In other news, $3 can buy you a lot of beans","Mike Pence's policies led to an HIV outbreak in Indiana, now he's overseeing the Coronavirus! https://www.huffpost.com/entry/mike-pence-indiana-hiv_n_57f53b9be4b002a7312022ef/amp?guccounter=1&guce_referrer=aHR0cHM6Ly93d3cuZ29vZ2xlLmNvbS8&guce_referrer_sig=AQAAAMQpmy7emJo_5OSfBCRPkXTTxSLGcOE6AFF5HP3suuZuiiKV9wIV0Wf6iPeEpuLjrsfwNGiXSpvn36AJvg241QnoIYdEVahwpGvW-iGuMAQ8g2kDceaCYRDXizMhyOk7fbQIHbR1ylsXFmrxPZZI1eqE9QK6FnYEoSTV8CwF5qU_&__twitter_impression=true …",Worried about #Coronavirus? Tell Trump to reverse cuts to critical US agencies | The Hill https://thehill.com/blogs/congress-blog/healthcare/483320-worried-about-coronavirus-tell-trump-to-reverse-cuts-to …
120,Denver International Airport employee tests positive for coronavirus https://www.denverpost.com/2020/03/11/denver-airport-coronavirus/ … via @denverpost,"""Coronavirus, Joe Biden, Carnival: Your Wednesday Evening Briefing"" by Remy Tumin and Marcus Payadue via NYT https://www.nytimes.com/2020/02/26/briefing/coronavirus-joe-biden-carnival.html?partner=IFTTT …",#coronavirus  this is some scary stuff coming out of China. This regime ... https://youtu.be/5fIQGkdCFR4  vía @YouTube
121,Thank god I snatched a boyfriend before coronavirus got crazy. Dating right now must be insane. It’s just “love in the time of cholera” all over again ,His one-point resolution is to pray the coronavirus away,"Mobile World Congress, the biggest smartphone tech show of the year, was canceled on Wednesday because of concerns about the coronavirus << This probably means #5G won't arrive for a few more years now. #MWC20"
122,"The Colorado Sun is doing great reporting on coronavirus  in Colorado. One thought for everyone: We know with certainty there are more cases. Why don't we start calling these ""newly diagnosed cases""? https://twitter.com/JesseAPaul/status/1237527547925037057 …","Letters to the Editor: Mike Pence, Trump’s coronavirus czar, has a terrible public health record https://flip.it/0n2hCW  via @flipboard",Netflix Smashes 52-Week High Even as Coronavirus Fears Ravage Stock Market https://www.ccn.com/netflix-smashes-52-week-high-even-as-coronavirus-fears-ravage-stock-market/ … vía @ccnmarkets
123,Thank God so far the coronavirus has not gotten to Colorado too much.  I pray it doesn't and I'm praying for all of you,Newsletter: Last call for this evening's LIVE session with Tony Robbins and Dean Graziosi + Coronavirus update + Your Immune System: https://mailchi.mp/fc59fa105f35/live-at-5-pst-tonight-coronavirus-and-your-immune-system … - Register here for the live event:https://dgachieve.com/join?source=register&a=7601 …,"That’s great! Please break in & rescue our pets. 

Animal Rescuers Are Breaking Down Doors Of Private Apartments To Rescue Animals Left Behind Due To Coronavirus Outbreak #SmartNewshttps://www.boredpanda.com/rescue-pets-left-behind-wuhan-coronavirus/ …"
124,"Frankly if any of them two does contract the coronavirus, chances are pretty big they will die. That usually comes with choosing over two 78 year olds",If I didn't live in a studio apartment I'd stock the fuck up on coronavirus supplies,Hah! Unfortunately I'm caught in #coronavirus limbo with an indeterminate delay before I get the 100 prototypes from my CM...  Orders were placed before the epidemic started so now I'm stuck with wait and see what happens. 
125,Do y’all know what would help with people not being able to work due to coronavirus? UBI. Like Yang said a couple months ago. #Yang,"Y'all think it's gone. Ole Rona's just chillin at that table in the corner with a cigar &amp; whiskey.
""Oh, they don't… https://t.co/LCV8j0BBFG","This is not third world, that's almost impossible. There is more chance to die in a fire shot in USA that getting coronavirus in Spain."
126,"The Diocese of Little Rock cancelled public Easter Triduum services in response to #coronavirus, but says it is looking for creative ways to spread the Gospel http://bit.ly/2IJvGGH ","RT @MicrobesInfect: Mutation in #SARSCoV2 variant circulating in Europe &amp; US increases its ability to infect cells in vitro.

The D614G mut…","Coronavirus (COVID-19) will burn itself out in 6 months w/out any vaccine

https://news-yahoo-com.cdn.ampproject.org/v/s/news.yahoo.com/amphtml/coronavirus-expert-says-knows-virus-204850255.html?amp_js_v=a2&amp_gsa=1&usqp=mq331AQCKAE%3D#aoh=15814719226532&referrer=https%3A%2F%2Fwww.google.com&amp_tf=From%20%251%24s&ampshare=https%3A%2F%2Fnews.yahoo.com%2Fcoronavirus-expert-says-knows-virus-204850255.html …"
127,"I will NOT be getting one of these... Fast tracking so fast we are requiring ZERO safety tests, oh yeah and the makers have ZERO LIABILITY. #Merica
#coronavirus #bigpHARMa #dangerous #humanexperiments @AristeaBrady
@FOX31 @denverpost @9NEWS https://www.livescience.com/amp/coronavirus-vaccine-trial-no-animal-testing.html?__twitter_impression=true …",RT @USDANutrition: .@Livermoreschool child nutrition services staff in California serve #CACFP supper during #COVID19. @USDA is granting st…,Agreed! Hong Kongers have to save yourself especially now with the coronavirus which is giving them more of an excuse to imprison more Hong Kongers.
128,I'LL TAKE SOME SWEET N SOUR CORONAVIRUS,"@MileyCyrus @sanchezcastejon Spain is a solidarity country, but its president is not, he lies more than he speaks,… https://t.co/hr9ByMK93A","Viruses are far smaller than the particles filtered by the Tesla HEPA filter, and Coronavirus is spread through contact, not air. https://www.ucsf.edu/news/2020/02/416671/how-new-coronavirus-spreads-and-progresses-and-why-one-test-may-not-be-enough …"
129,Bro great Wolf lodge is closed for like 3 weeks because of the Coronavirus. I’m still getting paid. This is amazing,Tune in live &amp; Request Songs 24/7 @ https://t.co/5jaafhWz2q Jadakiss ft. Anthony Hamilton - Why  #covid19 #GeorgeFloyd #blacklivesmatter,"It's sounds like our government is down playing how serious this is!!!Coronavirus disruption to ‘everyday’ life in US ‘may be severe,’ CDC official says

https://www.foxnews.com/health/coronavirus-disruption-in-us-might-be-severe-cdc-official-says …"
130,Me trying to protect myself from the #Coronavirus pic.twitter.com/RJi5uGEoSi,COLLAB PLS COLLAB !!!!!!!,CC: @Breaking57 - DO NOT PANIC... yet. #coronavirus https://twitter.com/630khow/status/1232444886407757824 …
131,THIS! We JUST wrote about the same thing- social distancing and #SelfQuarantine are the only ways we as individuals can control #coronavirus. Thanks for the update & thank you for doing a self-quarantine. https://www.starternoise.com/how-to-control-coronavirus-social-distancing/ …,please collab,Really? The Corona virus can only be brought here by illegal immigrants? Your stupidity is incredible.
132,.@premierleague will meet Friday to discuss whether to proceed with matches after Mikel Arteta's positive #coronavirus test,Shippeo,"Coronavirus disease (COVID-19) advice for the public: Myth busters from @WHO: https://www.who.int/emergencies/diseases/novel-coronavirus-2019/advice-for-public/myth-busters …

CDC: https://www.cdc.gov/coronavirus/2019-ncov/summary.html …

Please go to trusted sources, not internet graphics and memes.https://twitter.com/nytimes/status/1232358387142287362 …"
133,"Even before all the coronavirus talk, I’ve seen people just walk away and not clean ",going🏃🏻‍♂️🏃🏻‍♂️🏃🏻‍♂️🏃🏻‍♂️🏃🏻‍♂️a la boda https://t.co/32sZ4fUsXH,"Over the next few weeks; we’re going to see billions of dollars invested from governments, companies, and billionaires to fight the #CoronaVirus. 

This virus will erase years of economic growth, and have a disastrous effect on the world."
134,@UNALOficial  has suspended classes nationwide and has moved virtual. Best decision ever #coronavirus https://twitter.com/UNALOficial/status/1239304621144838146 …,i cant xd,"Rush is right! Coronavirus being weaponized by China, respiratory infection yes, 98% survival. Goal to scare investors, take down the stock market. MSM aiding to scare people. NOT a pandemic. NOT close. @realDonaldTrump What is clear is that we should manufacture medicines in US."
135,"@realDonaldTrump I am an avid supporter. 1 question. What is the ""victory criteria"" concerning the coronavirus? What criteria do we meet to go back to normal?",Stan miley and pedrito,Market melts down over coronavirus fears https://youtu.be/mBCc5t-bF-o  via @YouTube
136,"The best thing everyday Americans can do to fight coronavirus? #StayHome, save lives #COVID19https://www.usatoday.com/story/opinion/2020/03/15/coronavirus-stay-home-hel-america-save-lives-column/5054241002/ …",omg collab,"@rushlimbaugh @foxandfriends @seanhannity @realDonaldTrump @WhiteHouse @VP @Varneyco @foxandfriends Rush is right! Coronavirus is a respiratory infection, like a common cold BUT is weaponized by China; spreading fear by MSM to scare investors, tank stock market, why? Hurt TRUMP!"
137,Coronavirus got me trying foods I didn't know existed like sweet potato rice and organic dried cherries.,El cross over,"CNN's coronavirus coverage criticized: ‘Trump Derangement Syndrome strikes again’

https://www.foxnews.com/media/cnn-coronavirus-trump …"
138,"I don’t care if it’s not the Coronavirus, get the fuck out of the grocery store with your constant coughing and sneezing. Unreal.","HE DID IT, WE CAN'T BEAT THIS GUY","CORONAVIRUS PERINATAL NEONATAL
Chinese expert consensus on the perinatal and neonatal management for the prevention and control of the 2019 novel coronavirus infection (First edition)
Ann Transl Med 2020;8(3):47 | http://dx.doi.org/10.21037/atm.2020.02.20 …"
139,"Spammers calling me taking advantage of the current #coronavirus crisis. How do these exploiters sleep at night?

Hope folks don’t get duped by them. pic.twitter.com/FhUFkzYP0V",collab !!,"White Supremacist #realDonaldTrump goes full racist to cover up his coronavirus lies and incompetence

@SenCoryGardner and @RepDLamborn endorse The #GOP Lifestylehttps://www.rawstory.com/2020/02/trump-goes-full-racist-to-cover-up-his-coronavirus-lies-and-incompetence/#.XlmndMCkTqc.twitter …"
140,"Haha yes sir bro. Out here collecting all this Coronavirus mayne! Our drivers and shopworkers handle this shit daily. All good tho, that's money baby!! ",COLLAB COMING https://t.co/z8dyoOHVNJ,He doesn't care that Americans may lose their lives. He is doing nothing to help stop the spread of the virus. He's only worried about its effect on his reelection...  'Trump Is Worried The Coronavirus Will Cost Him The Election' https://www.politicususa.com/2020/02/21/trump-is-worried-the-coronavirus-will-cost-him-the-election.html … via @politicususa
141,Ain't no coronavirus coming up in here. My house smells like Fabuloso. That shit clean third world dirt. Keep it purple ya'all,GOALS😍😍😍😍😍,"Coronavirus headlines worry employers and workers, but health experts seek to dispel fears: https://hubs.ly/H0mT9D_0  by @RH_restaurantpic.twitter.com/qeD53hOWxO"
142,"@Microsoft sent my fiancé @art_by_night who works for them, this package! 
Talk about a company who shows care for their employees, thank you!  
We plan on donating the extras, but have needed this desperately #coronavirus #COVID19US #MSFTAdvocate #CoronaCrisispic.twitter.com/Pdfh3bMJvV",PLEASE COLLAB,"#coronavirus #covid19 ""10 Italian Towns In Lockdown Over Coronavirus Fears"" Over 50,000 people have been asked to stay at home in the areas concerned, while all public activities (...) have been banned for up to a week.
https://www.ibtimes.com/10-italian-towns-lockdown-over-coronavirus-fears-2926762 …"
143,"Pandemics affect men and women differently, and the coronavirus is going to set back women's rights, @helenlewis reports:https://www.theatlantic.com/international/archive/2020/03/feminism-womens-rights-coronavirus-covid19/608302/?utm_source=twitter&utm_medium=social&utm_campaign=share …",Pedriley is real,"Public confidence is not the main concern. By withholding/manipulating data, China is allowing a false sense of hope & eliminating the world's ability to take precautions & implement aggressive countermeasures. Could cost thousands or millions of lives. #coronavirus #COVID19"
144,My wife.  Second day in her new job and the person assigned to train her in the skilled nursing facility is having her first day back to work after testing positive for coronavirus.  Some orientation.  #AboveAndBeyond #RN #coronavirus https://twitter.com/budweiserusa/status/1240752563995258882 …pic.twitter.com/XmovVT2o2R,shippeo,Trump furious Americans infected with coronavirus flew back to US without his permission: report https://fxn.ws/2Ta9ESt  #FoxNews
145,"Fun fact: One of the fathers of #EPIDEMIOLOGY is named John Snow #coronavirus
https://en.wikipedia.org/wiki/John_Snow ",SHIPPEOOOO,Coronavirus Outbreak: Italy has reported its second death | WION News | ... https://youtu.be/EZtvFKyh5xA  via @YouTube
146,"I had plans to go to Vegas for my 23rd bday this weekend. That shit ain’t happening no more.

I was actually excited to celebrate my bday this year and hoe ass coronavirus was like “Nah fam” ",The simulation,"Mike Pence. If you have elderly or sick relatives you care about, it is probably a good idea to get in contact with them. The odds of them surviving the impending coronavirus outbreak just dropped significantly. Fuck."
147,Lockdown releases geniuses @danajaybein and her Coronavirus Rhapsody  #Covid_19 https://threadreaderapp.com/thread/1240307541491494912.html …,shippeo,Is a Coronavirus joke considered black or yellow humor? Does it have a bigger chance to become a viral joke?
148,"The Senate vote was 90 to 8 Just minutes after the SCDHEC announced the Palmetto State had 60 presumed positive #coronavirus cases @LindseyGrahamSC  voted in favor of the bill, but @SenatorTimScott  voted against it. 
https://www.newsobserver.com/news/state/south-carolina/article241231881.html#storylink=cpyhttps://www.newsobserver.com/news/state/south-carolina/article241231881.html …https://twitter.com/NBCNews/status/1240371284959256580 …","RT @XHNews: Russia recorded 8,706 #COVID19 cases in the past 24 hours, taking its total to 520,129 https://t.co/08g0Aon1E5 https://t.co/l0n…","""Covering your cough, staying home when you're sick, and washing your hands"" can prevent spread of coronavirus (and other diseases). This advice from the CDC seems so obvious but practically every day I see people ignoring the advice."
