,Positive,Neutral,Negative
49,Very important practical approach:”...use CT scans to make a clinical diagnosis of suspected coronavirus infections. The testing kits would then be used to confirm the coronavirus infection.” CT findings: bilateral ground glass opacities. via @NYTimeshttps://www.nytimes.com/2020/02/09/world/asia/china-coronavirus-tests.html?referringSource=articleShare …,The first session of the day on Wednesday will feature Gebeyehu Ayele from @livingwater presenting on lessons learned in Liberia on CLTS and Infectious Disease Prevention - what can the #WASH response to #Ebola teach us about #COVID19?,How the Corona virus from China get here before my fake Louis Vuitton wallet?
50,"Yeah, but that coronavirus has killed like 8 people in the US... /sarcasm",I made this #CoronaVirus stinger animation for today's @dailyblastlive show. #WashYourHands #covid19 #JeffJag Feb 2020 . . #C4D #Redshift #Cinema4D #render #cgarts #3dart #3dgraphics #Abstract3D #3dDesign… https://www.instagram.com/p/B9H2aPyJsJp/?igshid=1rujq5qy4aiqi,"I believe it was Osaka virus on the show. Also, coronavirus isn’t a new thing... just has a new strain :)"
51,"Going a cruise? Worried about the Corona Virus? Well check out this article for reassurance that you will be fine to travel!
#cruising #coronavirus #travel #dontworryhttps://newmavmedia.wordpress.com/2020/02/13/cruising-with-the-corona-virus/ …",It is BS Follow the world health organization WHO They are doing daily media briefing on #COVID19,"Coronavirus just don’t sound like something real niggas die from, so I have no worries."
52,"For the love of all that is holy, please, talk to an expert in #phethx and/or #phlaw (who have often spent YEARS thinking about these kinds of problems).

Cruise ship passengers riled over order for added 2-week coronavirus quarantine in U.S. https://www.washingtonpost.com/world/us-to-evacuate-americans-from-cruise-ship-and-put-them-in-14-days-quarantine/2020/02/15/8b05eadc-4fc1-11ea-a4ab-9f389ce8ad30_story.html …",Is it wrong to wonder how COVID19 affect those with inhumanly orange skin?,In Costa Rica when the WHO declares the coronavirus a global outbreak and it hasn’t come here yet so... does this count as a valid extended medical leave request rationale?
53,"Well, I don't drink Mexican beer and don't hang out in bars.  So, there is really no way for me to get the Coronavirus. https://twitter.com/EvanAKilgore/status/1227336440838868992 …",#Lituania #Lithuania 1 caso confirmado #coronavirus #COVID2019 #COVID19 #epitwitter,@nehaorg is monitoring the novel #coronavirus outbreak and has compiled resources to help you stay informed. Visit our website for the latest developments as they occur. http://ow.ly/aoaN50y9y09
54,Sony is the first to say they are skipping out on PAX East because of coronavirus concerns. I can happily voice my many reasons I'm glad I'm not going now.,#Mexico 1 caso confirmado #COVID2019 #coronavirus #COVID19 #epitwitter,"The #coronavirus outbreak is now a global health emergency, @WHO saysWith more than 8,000 cases in nearly 20 countries, the agency called for a coordinated international response."
55,"700 is an arbitrary number. What were they doing? Someone (not Trump) thought they were not important to the CDC's mission.

Would hiring back the 700 plus 700 more save the US from Coronavirus? Maybe. But also maybe not. https://twitter.com/DrEricDing/status/1227692585109610497 …",#COVID19US In the lead up to World War 2 FDR spent 2 years working with industry to get the tanks planes etc we needed. We need that kind of leadership now to get healthcare workers the supplies we need to prep for COVID19.,"Viruses don’t know the difference between a white kid and a Chinese kid. As always, people are just people. Cover your mouth when you cough, wash your hands, and act sensibly. #coronavirus "
56,"Pretty huge news, Mobile World Congress just got canceled due to Coronavirus fears.  Probably a good call given the circumstances. https://lnkd.in/eceFSNM ","MFA’s Op-Ed that ‘we’ should “Thank China” is exceedingly crass—given Li Wenliang #李文亮 died as a result of CCP censorship &amp; int’l aid refusal, China conts to intimidate reporters like Li Zehua #李泽华 &amp; blames others for #coronavirus #COVID19 #武汉肺炎.","This column isn't about the #coronavirus, but it is about attempting to stop the spread of the flu. #Vaccination #Editorial Not getting vaccinated is harmful in more ways than one"
57,"Super Lab created vaccine in 3 hours using sequencing from China

San Diego lab discovers COVID-19 / coronavirus va…: https://youtu.be/GWI5oLTETdU ",#NewZealand 1 caso confirmado #coronavirus #COVIDー19 #covid19 #epitwitter,stop using the coronavirus as an excuse to be racist.
58,"I wondered what might be the trigger to finally turn this thing around, and AAPL adjusted guidance downward, only 19-days after earnings release, due to the effects of Coronavirus...
.
.
There's support for the… https://www.instagram.com/p/B8r-pdGA1FD/?igshid=1rkj3i9415olc …",Cryo-EM analysis of a feline coronavirus spike protein reveals a unique structure and camouflaging glycans https://www.pnas.org/content/early/2020/01/02/1908898117.abstract …pic.twitter.com/ZfkEZDtHoS,“China is actually setting a new standard for #coronavirus #无哈肺炎 #2019nCoV outbreak response.”—WHO Director General @DrTedros diplomatically praising China for its efforts (despite its ‘mistakes &amp; periodically reluctant data-sharing) #WinnietheFlu
59,How many surfaces did this guy touch in the last week? How many people did he have contact with? He’s a mini patient zero. #coronavirus,I swore off Corona back in high school.  Always had the coronavirus shits for like 2 days after drinking them nasty ass beers ,Oreo Maker Mondelez says coronavirus could hurt sales in first quarter 
60,Iran's deputy health minister tests positive for coronavirus after appearing ill in presser https://www.bizpacreview.com/2020/02/25/irans-deputy-health-minister-tests-positive-for-coronavirus-after-downplaying-outbreak-appearing-ill-in-presser-890993 … via @BIZPACReview,"“Japan confirms its
first case of the SARS-like coronavirus” by @QuickTakehttps://twitter.com/i/events/1217743831027728385 …","""@realDonaldTrump's efforts to muzzle health officials+ downplay #COVID19 mirror the tactics of an authoritarian regime. His right-wing media also attacks those critical of the gov, a tactic routinely used by state media outlets in authoritarian regimes. "
61,TEA Press Release: Novel Coronavirus (COVID-19)... Good Information  pic.twitter.com/fbxEzTQZr6,Japan Confirms First Case of New Chinese Coronavirus http://dlvr.it/RN9Ms9 pic.twitter.com/2xFK3ZVpi2,"A second case of community acquired Coronavirus #Covid19 infection has been confirmed in Cali, while the first is clinging to her life on a respirator. ""Just another flu that will disappear"" doesn't cut it @POTUS.Neither does appointing @VP w/zero medical knowledge to fight SARS."
62,The Diamond Princess is offering free porn to its passengers in quarantine. #Coronavirus @ Bogotá D.C https://www.instagram.com/p/B82Rpv0Jeu9/?igshid=1ov3uh12fiuui …,"Feds conducting health screenings at LAX, San Francisco Intl. and JFK in New York of travelers arriving from Wuhan, China, aiming to prevent transmission of a new infectious coronavirus, spreading in Asia that has sickened at least 40 people and killed 2 in China.","This is a stupid thing to do. Mass of people together? Of course COVID19 is going to spread, and this is one way. Just can't overlook your own self gratification for your country, huh?"
63,It was a matter of time before global shipping was hit by coronavirus. We need to revaluate our goods being concentrated in one country because this is what happens when countries are not prepared.,#coronavirus oupss #sunsetpic.twitter.com/nZN1nfUUlk,"Go and shake a few more hands, meet a few more thousand people in an enclosed space. Especially the kind you attract, they listen to you and Fox as if it is their bible: practice poor hygiene because handwashing is for the ""wuss"". Toughen up! Get used to COVID19; it's just a flu."
64,Trump has the creepiest eyes as he scans the room. #Coronavirus #TheBeat,"Listen to the most recent episode of my podcast: Episode #37 Kobe, Coronavirus, Guns, and SB predictions  https://anchor.fm/blake-anderson8/episodes/Episode-37-Kobe--Coronavirus--Guns--and-SB-predictions-eaghni ….  #KobeandGianna #KobeFarewell #kobe #guns #WuhanVirus #SuperBowlLIV #coronoavirus #NFL","He’s certainly careless about getting his daughter sick, but should we be concerned that he has COVID19? Is the test inaccurate?"
65,@POTUS @realDonaldTrump thank you for speaking on the CoronaVirus..I'm afraid for my family..my mother who is up in age as well as everyone else and their families..thank you for putting my mind at ease..,A Colorado native who has lived in China for nearly a decade says he and his family are stranded as Chinese authorities respond to the coronavirus outbreak. https://dpo.st/2U2t4dP ,"Given the US political climate, some (eg. Trump ACoS Mulvaney) are characterizing the HHS whistleblower complaint as a new attempt to hurt Trump’s re-election chances vice genuine professionals concerned about addt’l #coronavirus #COVID19 spread in the US. https://twitter.com/atrupar/status/1233396432838840321?s=20"
66,"Well gunnery might be cancelled bc of the Coronavirus, never been so happy about a pandemic before ",The nCoV2019 API for Wahun outbreak monitoring is now available!https://rpst.page.link/qhcZ  #publichealth #hospitals #infectiousdiseases #healthcare #pandemic #coronavirus #ChinaCoronaVirus #coronaviruesue #nvoc2019 #2019ncov #Wuhan #WHO #WuhanCoronavirus #digitalhealth #apipic.twitter.com/XCE1fwzl6I,". #Legit What worries me is plane travel. As a consultant that flies everywhere, the number of people being absolutely disgusting was really, really gross. I saw snot flying everywhere in front of me, a whole lot of coughing with no mouth covering. It was gross. #COVID19"
67,HHS whistleblower claims US workers received coronavirus evacuees without proper precautions https://flip.it/QErLpE  via @flipboard,Xi Jinping: Accelerating Spread of Coronavirus ‘Grave Situation’ — Suspends Tourist Travel Abroad http://bit.ly/2TWDMTm  via @BreitbartNews,"“While the #coronavirus #COVID19 #武汉肺炎 epidemic 1st appeared in China, the epidemic did not necessarily originate in China.”—Zhong Nanshan #钟南山, Chinese epidemiologist, pulmonologist &amp; leading advisor in managing the crisis"
68,"RT @MileyCyrus: Spain, you united in solidarity with Black Lives Matter in the US. We must keep standing together to tackle #COVID19 and it…","Cuando el #coronavirus llegue a chapinero:

- its ok, I’m on PrEP.","Calling it now, once the US begins testing for Covid19 next week, cases will spike to hundreds or thousands, and the panic will begin."
69,RT @MileyCyrus: All across Ireland 🇮🇪 citizens joined in solidarity with Black Lives Matter in the US. We must stay united with the world t…,I think this is how the Coronavirus started...,"@ccodag was interviewed in Italy on the relationship between science and public policy, due to recent #CoViD19 crisis and he talks about our book #scienzainvendita"
70,"RT @sanchezcastejon: Spain is coleader in initiatives such as the ACT-Accelerator to achieve equitable access to vaccines, treatments and d…","UCCS doesn't have any students currently in China, but CU Boulder is taking precautions in response to the coronavirus outbreak. https://krdo.com/news/2020/01/30/cu-boulder-suspends-study-abroad-programs-in-china-due-to-coronavirus-concerns/ …","WHO issues warning 
after 'mysterious' Chinese coronavirus spreads to Japan https://twitter.com/i/events/1217928133917044736 …"
71,"RT @SSnakeFHL: ""Ours is a strong commitment, Miley.""
Han tenido rollo fijo.","Coronavirus, es tiempo.
???
  https://www.facebook.com/story.php?story_fbid=10158159193583746&id=627698745 …","Coronavirus, zombie apocalypse call it what you want it's a fact of over population and poverty in one area that has been ignored for too long it's all the same shit in the end dead bodies that the rich dont care about until it hits them"
72,"RT @FranciscoMarty_: Like most things at the #NEJM, the most interesting stuff is in the appendix!

Great work by my colleague Issac Solomo…",OMG!!  que heavyyy #coronavirus #CoronavirusChinohttps://twitter.com/DoctorAkicol/status/1220108052323610626 …,"BREAKING: @CDCgov and @CBP will implement enhanced health screenings to detect ill travelers traveling to US on direct or connecting flights from Wuhan, China at SFO, JFK & LAX airports in response to coronavirus outbreak."
73,RT @AmHeartAdvocacy: A5: More kids will be eligible for free meals in the fall due to #COVID19. Programs like CEP and universal free meals…,"If we can take anything positive from the coronavirus outbreak, it's that microscopically small things can make global impacts.

Remember that with every word you speak, every smile you give or don't, and every second you worry instead of trying.",Coronavirus killing people is sad and all but I’m different
74,"RT @rebecasrz: Miley I get you girl, our president is hot, but he is in a serious relationship with our VP The Ponytails, so please, back o…",Oh no!  First confirmed coronavirus case identified in the US https://twitter.com/i/events/1219687502237167616 …,"My Virus, called Coronavirus, just wiped out the world in 408 days! #PlagueIncpic.twitter.com/SC1xbqMOTM"
75,"RT @JohnsHopkinsSPH: ""Even if we can’t stop all transmission, it’s still a really important effort to keep [#COVID19] case counts low,"" sai…",1st Case Of New Coronavirus Detected In U.S. http://www.tinyurl.com/yx5gannw ,"EVACUATION: The US government is arranging a charter flight to evacuate American diplomats and citizens from the Chinese city that has become ground zero for a new deadly strain of coronavirus.
https://kdvr.com/2020/01/25/us-arranging-charter-flight-to-evacuate-american-diplomats-and-citizens-out-of-china-amid-coronavirus-outbreak-official-says/ …"
76,"RT @UNICEF: ✋ ""Tadaaaaaa!"" 🤚

Two-year-old Natalie shows us how fun handwashing can be at her home in South Sudan as she protects herself f…",1st confirmed case of new coronavirus reported in Washington state: CDC https://abcn.ws/36eGHJl ,"I believe that the coronavirus could have been strategically release by the @XHNews govt to this the herd and the  lost control of it and it went Pandemic 

@who
@cdc
@realDonaldTrump"
77,Nice when an asshole does the work for you!  Karma is just getting staring on this jackass!,I’m sick in bed reading up on this new coronavirus infecting China that now just was found in someone in DC. Lmaoo great,"How does coronavirus spread?
How can you protect yourself?

The Wuhan coronavirus outbreak is a new illness and scientists are still assessing how it spreads from person to person.

*Hand-washing is a first line of defense.

(Click blue line for info!)
https://www.theguardian.com/world/2020/jan/30/how-does-coronavirus-spread-and-how-can-you-protect-yourself …
*"
78,"RT @IFMBE_HTAD: #COVID19  #Innovation #Competition and #Design #Bootcamp 2020. Sign in!
https://t.co/8YyPRkeglE
#MedicalDevices @uborabiome…",CDC confirms first U.S. case of China coronavirus #SmartNews   ⁦@realDonaldTrump⁩ ⁦@greggutfeld⁩ ⁦@JesseBWatters⁩ ⁦@TheFive⁩  @danaPerinohttps://www.reuters.com/article/us-china-health-usa-idUSKBN1ZK2FF …,If the government wanted to kill a bunch of Chinese people they could’ve just pulled down the “don’t feed the buffalo” signs at Yellowstone instead of using the corona virus
79,RT @UNESCO: Modern technology like #AI can be key when navigating through the #COVID19 crisis. But it's crucial to understand the trade-off…,"Two possible outcomes (both good):

(1) Having Coronavirus in DC will inspire the politicians to take it seriously.

or

(2) It will ravage and destroy DC, turning it into a post-apocalyptic ghost town.","Yup...""Authorities limit the travel of 11 million residents, shut down transportation in Wuhan amid Coronavirus outbreak""  https://twitter.com/i/events/1220065224117481472 …"
80,"RT @Thicklilbae1: OMG SHE REALLY DID IT ON A PUBLIC BUS? 😱💦 @kathalina7777

FULL VIDEO FOR FREE 👇🏻

https://t.co/lx3y5DbLqY

#voyeur #squir…",Wuhan China Coronavirus is spreading EVERYWHERE! People are collapsing a... https://youtu.be/03k7F3ygNAQ  vía @YouTube,The #coronavirus is in the US now? Damn 2020 really ain’t our year.
81,"State Reopenings: A Picture’s Worth a Thousand Words, or Is It? https://t.co/4nUAx4lcwZ #USEconomy #COVID19 #COVIDSpike #EconomicREcovery",The Coronavirus w/parsley https://twitter.com/jim_cooks/status/1221930940127236096 …,.@WHO LIVE: Press conference on the Emergency Committee meeting on new #coronavirus (2019-nCoV) https://www.pscp.tv/WHO/1vAxRqQZyMrJl?t=17s …
82,RT @XHNews: Beijing's major wholesale market has been suspended after personnel working there tested positive for #COVID19 https://t.co/056…,#us state department has raised the travel advisory to level 3 meaning citizens should reconsider travel to all of China due to the #coronavirus,"1) recently-confirmed cases have no history of exposure to Seafood Market; 2) human-to-human transmission occurred 3) HCWs have been infected by the coronavirus. 

Measures to reduce transmission should be implemented -school closures, cancellation of gatherings, exit screenings."
83,"From the foods you eat to the way you take care of your teeth, you can improve your immune system by taking better… https://t.co/J9KXm0e5Px",@UN This Coronavirus is a very big threat to the world and the world is leaving all the responsibility to China to contain it. It is of vital importance that the other countries collaborate with enough resources to this country so that it can handle this virus more effectively.,$SPX Movers: Coronavirus fears lead to a big sell off in Leisure/Travel related stocks. Energy and Basic Material stocks also hit as global growth fears get shaken. $XLY $XLB $XLEpic.twitter.com/xUyXcoveWv
84,"How nerds stay sane during COVID-19
by Colleen Bement
https://t.co/8fPwV7pF7K #covid19 #nerds",$SPX Movers: Coronavirus infects the down movers today as Casino/Cruiseship/Airline stocks hit. Tech and Energy join the down moves as China pressures global growth outlook. $XLY $XLE $XLKpic.twitter.com/vJ4PRWkmbx,"$SPX -0.3%
Coronavirus takes markets lower
US/France kick tariff can to yr end
NatGas < $2 bad for US energy cos
McDermott files for Ch 11
$BA -4% on new 737 Max delays
Risk-Off Day…
Best: Bonds, REITs, Utes, Staples
Worst: EM, Energy, Materials, Industrials"
85,"RT @Minuteman04: When you look at places like Florida, Arizona and Texas with huge #COVID19 spikes, the question ""Did we reopen too soon?""…",This coronavirus shit is crazzzyyyyyyyyyy.,"Listen to the most recent episode of my podcast: Episode #36 Charity, Coronavirus, Cancer cure, and NFL https://anchor.fm/blake-anderson8/episodes/Episode-36-Charity--Coronavirus--Cancer-cure--and-NFL-eab6s4 … #pimpinjoy #Cancer #cureforcancer #NFLPlayoffs #CharityTuesday #stjude #coronavirus"
86,"RT @kikebotwin: “Ours is a strong commitment, Miley.”
🥰😍🥰😍
Me desmayo. https://t.co/hebwgid8EF","Weekly Chart Check-Up ... ""The Coronavirus and where it comes from and what it does.""

http://ow.ly/TEx650y4zzi ","WHUT? Is @hughhewitt  suggesting we hope for a coronavirus outbreak to reduce attention on the impeachment trial, which is at least supposed to be one of the most solemn assignments the Senate can undertake. I certainly hope not. And, hey, you misspelled theater. It's ""a coverup"" https://twitter.com/hughhewitt/status/1219731374200041473 …"
87,"RT @VANurse1212: ➡️ Covid Poll 

🔄 Please RT After Voting For a Better Illustration

➡️ Did Anyone You Personally Know Test Positive For #C…",2nd U.S. Case Of Wuhan Coronavirus Confirmed http://www.tinyurl.com/sb4p89p ,coronavirus and chill?
88,"RT @PoliticsReid: Wow, 37 states reporting more than 10,000 #COVID19 cases. H/t @V2019N",i think i have coronavirus,CORONAVIRUS : Chinese Tell You IT IS WORSE ! https://youtu.be/MuDW6ocvH44  via @YouTube
89,Climbing gives kids the confidence to conquer life's everyday challenges. Sign up to volunteer at:… https://t.co/4RhLUe78w5,No joke.. the Corona virus is actually getting pretty bad. It’s growing exponentially faster and killing more people than any modern day outbreak. We’re far overdue for a pandemic. This might be the one that thins the population. The vaccine is a year out and over 100 have died.,"Me: *walking down the street*
A little kid talking to his friend: ""Did you know that if you drink too many Corona's you will get a virus?""
Me: 

I wish I could make this up  but in all seriousness I am sending my blessings to all those affected by the  #coronavirus"
90,"Por favor, retweet. #COVID19 #FernandoSimon https://t.co/KTXAw3b2jk","I’m calling it now. Trump will blame Mexico for the Coronavirus. 

","if you get the corona virus, just drink modelo "
91,"RT @IEA: In light of the extraordinary impact of the #Covid19 pandemic &amp; resulting lockdown measures on the energy system, we're publishing…",Increase to 564 the number of fatalities from the coronavirus - RT https://actualidad.rt.com/actualidad/342211-epicentro-coronavirus-china-muertes-casos-nuevos …,Wuhan Coronavirus Infections Could Be 30 Times Higher Than Official Tota... https://youtu.be/LZeKzqphlzM  vía @YouTube
92,Great way to spread Coronavirus!,"Coronavirus Map:

https://bit.ly/39aDPyW 

I've shortened the URL.  The below is an example of the data received.pic.twitter.com/ShH62gtXWR","Human to Human confirmation.

Time for a elevation to ""GLOBAL CRISIS"" folks.  Cant avoid it now WHO.

#nCoV2019
#coronavirus https://twitter.com/L0gg0l/status/1220858374096551936 …"
93,5 Presumptive Positive Coronavirus Cases Confirmed In Colorado https://trib.al/FOXnOLU ,Scientist And Mom-Of-Two Sleeps Just Two Hours A Night To Invent A Vaccine For Coronavirus http://dlvr.it/RPPCLQ pic.twitter.com/MoGD4aAHPq,"$NNVC #coronavirus play just insane action last 4 days.  Pressing 11.2s here in after hours.

75min to go. I expect action in $NVAX $LAKE $APT $INO .. 

Im shocked at how uninformed the financial media is .. almost just saying we've seen this before.  Uh, no we havent.  Not this."
94,"Two Denver residents and an El Paso County resident have tested 'presumptive positive' for the new coronavirus, health officials said. https://trib.al/JeKf1aj ",Guy Who Stood Up On A Flight And Told An Entire Plane Full Of People He Had Coronavirus Really Deserves To Be Punched #SmartNewshttps://brobible.com/culture/article/coronavirus-airplane-toronto-flight/ …,"BREAKING: St. Anthony Hospital is contacting the CDC to see if a patient with a potential respiratory illness should be evaluated for coronavirus.
https://kdvr.com/2020/01/24/st-anthony-hospital-contacting-cdc-to-see-if-patient-should-be-evaluated-for-coronavirus/ …"
95,"21 people on Grand Princess cruise ship off California test positive for coronavirus, Pence says

https://www.foxnews.com/politics/pence-coronavirus-white-house-efforts …","Dow surges a second day as manufacturing data, strong earnings offset coronavirus fears http://dlvr.it/RPPBBk pic.twitter.com/UIttZRNFj2",Oil prices likely to ‘stay down’ for months: Energy analysts fear impact of fast-spreading coronavirus http://bit.ly/2U3cYAD pic.twitter.com/WtSheaQm4b
96,men are a disease. coronavirus would never tell me i would look better if i smiled more,Because SARS IS a type of Coronavirus.,Don't search #coronavirus + fake news on Twitter. You'll find all the weirdos and conspiracy theorists having a party. pic.twitter.com/vn7Pt4bAht
97,Colorado health officials: eight people so far have tested positive for coronavirus in the state.," Adapt, improvise, overcome!
.
.
.
@nurselifern
#coronavirus #ncov
#nurselife #nurseproblems #scrublife #nursesbelike #nurseonduty #nursesunite #nurseprobs #instanurse #nursingstudent
#nursehumor #furnishedfinder #travelnursehousing #nursememe #nursememespic.twitter.com/Yzrcd1HUBE",Burberry warns coronavirus outbreak is hitting sales in China and it has shut more than a third of its stores
98,"#UPDATE We've just learned of another presumptive positive #coronavirus test in Eagle County, a woman in her 50s. This brings the total to 8 in Colorado. At least five of the patients traveled internationally. @CDPHE is coordinating with @CDCgov on flights affected.","BBC News - Coronavirus:10 days of hospital building in 60 seconds
https://www.bbc.co.uk/news/world-asia-china-51348297 …",Japan carmakers brace for supply and demand nightmares due to coronavirus...
99,"Two Denver residents and an El Paso County resident have tested 'presumptive positive' for the new coronavirus, health officials said. https://trib.al/wWpIVZT ","It’s the second novel coronavirus case announced in Santa Clara County in the past three days but the two cases are not related, officials say. https://dpo.st/2UkeD5e ","A U.S. citizen diagnosed with the coronavirus has died in Wuhan, the Chinese city at the center of the outbreak, marking the first known American death from the disease https://www.wsj.com/articles/an-american-citizen-diagnosed-with-coronavirus-has-died-in-china-11581141185 …"
