,Positive,Negative
0,365,46
1,"I’m in the middle—until I go to the store & can’t find stuff on my list. Then I start grabbing All. The. Things. Via @evelyndnutritionist on Instagram ""This infographic has been popping in my feed and stories lately and it’s important. #covi̇d19 #coronavirus #nextlevelhuman""",Florida’s count of coronavirus deaths is missing some cases 
2,"I wish it were. It should be. But #NovemberIsComing and Pelosi knows that we’ll clean out the WH then. Right now, she’s focused on coronavirus and helping Americans. You should try it.",Coronavirus hype biggest political hoax in history - Washington Times 
3,"Kano records 24, Gombe 18 and Kaduna 17 New Cases of Coronavirus http://insidearewa.com.ng/kano-records-24-gombe-18-and-kaduna-17-new-cases-of-coronavirus/",Florida medical examiners were releasing coronavirus death data. The state made them stop. 
4,"During any other presidential election year, late April headlines would be dominated by campaign news. This year, coronavirus is changing the race. @JoshRobin explains how #COVID19 is forcing fundraising &amp; maybe even parts of the conventions to go virtual. http://specne.ws/B1MTEF","Showdown brewing between Whitmer, Michigan Republicans over coronavirus state of emergency ⁦@MIGOP⁩ what will you do Republicans? Stick us in the back again?"
5,Do asymptotic people get a coronavirus test to confirm they have it?,“Sweden is tackling the coronavirus by learning to live with it.” By dying.
6,China is the reason for the CoronaVirus-19,"@GavinNewsom What the hell's wrong with you people? Releasing SEX OFFENDERS and Violent Felons because of #COVID19 #coronavirus ? That's INSANE..Nobody voted for this and it has NOTHING to do with a public health emergency Unless one of them breaks in to my house,he'll have one"
7,Absolutely shocked that I just heard that more people have died from the coronavirus than died during the Vietnam War.,"Half(!) of Americans say it's hard to separate coronavirus facts from fiction If half of Americans would stop watchin Fox or reading news on Facebook, they would find this all much less confusing. "
8,Making #koobideh is one of the hardest in Persian cuisine. Thanks to #coronavirus which taught me how to become a partial cook https://www.instagram.com/p/B_lPWyzp4ms/?igshid=820nydqw2k8k,White House asks spy agencies to investigate whether China and WHO covered up coronavirus outbreak origins 
9,"Nobody has died of anything other than the coronavirus, since March.",Covid-19 coronavirus: US CDC adds six new virus symptoms to guidelines. Look out for 1or a combination of: - cough - shortness of breath - fever - chills - repeated shaking with chills - muscle pain - headache - sore throat - loss of taste or smell. 
10,"Gov. Gretchen Whitmer is taking steps to make child care more affordable and accessible for families during the coronavirus crisis. Today she announced the Child Care Relief Fund, which will provide direct, non-competitive grants to child care providers. ",Bills blow 16 point lead to the Texans. Sabres miss Playoffs despite NHL expanding to 24 teams. The Coronavirus The Riots Can this year get any worse?
11,Exclusive: Venezuela asks Bank of England to sell its gold to U.N. for coronavirus relief - sources ,"“With the world consumed by the coronavirus pandemic, China has acted forcefully to defend its territorial claims, including in the Himalayas. In recent weeks, the Chinese have sunk a Vietnamese fishing boat in the South China Sea;…https://lnkd.in/e_WmshV"
12,Tucker Carlson: Big Tech Using Coronavirus To Increase Their Power Over Americans ,The Coronavirus (COVID-19) has business owners understandably concerned about the health and safety of their employees. #weclean
13,"Talking points provided daily by the deranged sociopath & chief Donald ""the douchebag"" Trump with a kiss as commentary by the head of the Coronavirus Task Farce, Mike ""blank stare"" Pence.","Just making note of California’s coronavirus numbers in light of the current riots. As of May 29th total cases stand at 106,744 and total deaths at 4,137."
14,"#Day54 TESTED! COVID-19 SWAB (also, ow!) ANTIBODY TEST And a Chest X-Ray (that came out normal.) Now I wait. #Covid19 #Coronavirus ",The media has its agenda. Did you hear one (1) who attended Lake of the Ozarks party has Coronavirus? see below. But did media tell you at the same time 500% more people under a lock down in Missouri have the virus? 
15,"JFC, can someone make these people SHUT UP? Kushner calls U.S. coronavirus response a ""success story"" as cases hit 1 million.",Coronavirus FAQs: Is It Safer To Fly Or Drive? Is Air Conditioning A Threat? 
16,Dear Protestors: I support you. I believe in the cause. But there’s just one thing.....coronavirus!,"How the coronavirus could be prevented from invading a host cell? https://medicalxpress.com/news/2020-05-coronavirus-invading-host-cell.html With two food energy-dependent amino acid substitutions. See: ""A two-amino acid change in the hemagglutinin of the 1918 influenza virus abolishes transmission."
17,"UPDATE: State health officials report almost 5,000 more people have recovered from the coronavirus. ","BREAKING: #Coronavirus has been declared a Global Public Health Emergency It has now spread to 19 countries. 170 dead so far. NOW is the time to prepare your 72-hour kit, not later. #cdnpoli"
18,The inside story of how coronavirus spread in Massachusetts - The Boston Globe ,The Ministry of Health says travellers who were under quarantine as a precaution have tested negative for coronavirus and have been cleared.
19,Having failed miserably to manage the #coronavirus in the US now #trump fails to lead during the #goergefloyd demonstrations. Instead calling for his own supporters to hit the streets. #insiders #ICantBreathe,WHO Declares Coronavirus Outbreak A Global Health Emergency : Goats and Soda 
20,"Kogi coronavirus case authentic, I know a patient from Kabba – Dino ","#NZ offers seats on chartered #AirNewZealand plane for Pacific Islanders stranded in #Wuhan, the epicentre of the corona virus outbreak. Most Pacific Islanders in Wuhan are students studying at various universities in the province. NZ, truly a friend of the #Pacific@burebasgal"
21,"So on top of running the 'new coronavirus task force' this man also is chairman of the new Space Council Commission! He put together a team2make today happen. DidUknow that? A humble man, Pence, works diligently2further America's exploration in space+safety on earth. Wow! ",Corona virus cases - live update. https://gisanddata.maps.arcgis.com/apps/opsdashboard/index.html#/bda7594740fd40299423467b48e9ecf6
22,The World Is Still Far From Herd Immunity for Coronavirus ,"Your Trump hatred at CNN is a real cancer to our body politic. This means absolutely nothing in terms of being able to stop a deadly virus. I'm pretty sure the #coronavirus doesn't care that this room isn't ""diverse"""
23,"Important op-ed from @SteveBradford: In recovering from the coronavirus, California must achieve a more equitable economy ",Coronavirus map tracks spread of virus around the world https://www.abc.net.au/news/2020-01-31/coronavirus-map-tracks-spread-throughout-world/11912828 via @ABCNews
24,"Russia closes 2,700-mile border with China to stop coronavirus https://metro.co.uk/2020/01/30/russia-closes-2700-mile-border-china-stop-coronavirus-12151466/#share-item-0-181 via @MetroUK",Nemani Delaibatiki: Politicians Like @SLRabuka Should Not Politicise Health Issues Like A Virus Threat Without Knowing The Full Facts #coronavirus #FijiPol @Nadokoulu https://fijisun.com.fj/?p=496712
25,"Russia closes 2,700-mile border with China to stop coronavirus https://metro.co.uk/2020/01/30/russia-closes-2700-mile-border-china-stop-coronavirus-12151466/#share-item-0-928 via @MetroUK",Fck corona virus 
26,Chinese nationals travelling out of China for holidays are scared of contracting the coronavirus. #TimesNews #FijiNews #2019nCoV,#Teamfiji petty af. Just catching up Drawinggate guys coronavirus gonna kill us all...y'all really want your tweets about a non-issue to be what the aliens see when they land on this dead Earth? 
27,"See this is what we need to see. We got the coronavirus to scare us, trump impeachment, Iran... We humans focus on the BAD. Spread the positive bro. Positivity heals ",Confirmed by another outlet: “The discovery of what is possibly a second case in Northern California whose source of infection can’t yet be traced raises the specter that the virus may be spreading stealthily there.” #COVID19 
28,Coronavirus Has Now Spread To All Regions Of Mainland China : Goats and Soda ,CDC Has been dispatched to CA. Let the investigation begin... #COVID19. How deep will the rabbit hole of unknown community cases be is the question... 
29,'Leper colony' or a positive contribution: Coronavirus quarantine splits Christmas Island https://www.abc.net.au/news/2020-01-29/christmas-island-locals-on-quarantine-for-coronavirus/11910326 via @ABCNews,Did I get this right... On #MTPDaily the doctor said that 30% of the population is expected to get #COVID19 with a 2% death rate??? That's 99 Million Americans with Coronavirus &amp; 2 Million deaths!
30,'I work in the shadows': The doctor who sleeps four hours a night to diagnose coronavirus patients https://www.abc.net.au/news/2020-01-31/coronavirus-doctor-warns-more-severe-cases-are-likely/11913934 via @ABCNews,"""It's just a market correction"" Buckle up, bitches. #cdnpoli #economy #blockades #covid19 #covid19Canada #TrudeauMustGo #TrudeauNotFitForOffice"
31,This is just the sixth time WHO has declared a global emergency. Here's what that means. #Coronavirus https://www.abc.net.au/news/2020-01-30/coronavirus-global-emergency-declared-by-who-what-does-that-mean/11912630 via @ABCNews,Oh this is bad bad bad for Iran if true. Likely explains all the #COVID19 infections in neighboring countries of travelers from Iran too. How does this affect/compare with your model @BogochIsaac?
32,"Two coronavirus patients discharged from NSW hospital, no longer infectious https://www.abc.net.au/news/2020-01-31/nsw-coronavirus-patients-released-from-hospital-infection-free/11915834 via @ABCNews","Another “recovered” case with multiple negative tests then tests positive after release. Doubt it’s reinfection, probably infection never fully cleared / imperfect test. This greatly complicates containment. #COVID19 "
33,The coronavirus has officially killed more people than the Clintons. ,"We're watching the battle between month-end and COVID19, with Krudlow's pincer movement failing badly."
34,"They’ll find a vaccine/treatment for #Coronavirus, the fact that Aussie scientists were able to recreate #nCoV is promise of that. But when this crisis is over, dealt with like Ebola, SARS, measles, etc one thing remains and that’s the way we treat each other. #BeKIND #Understand","“Dr. Tom Frieden, director of CDC 2009 to 2017, said the move ""would significantly increase the chance an epidemic will spread without our knowledge and endanger lives in our country and around the world."" He said this in 2018. And here we are. #COVID19 "
35,Everything Toned Down Says Fijian Student In Wuhan https://fijisun.com.fj/?p=496711 #WuhanVirus #coronavirus ,"Prepping is good, not paranoia. “Preparing for the almost inevitable global spread of this virus, now dubbed COVID-19, is one of the most pro-social, altruistic things you can do in response to potential disruptions of this kind.” #COVID19 "
36,"I think we are in for a nightmare with this #coronavirus. We can't trust China to do the right thing and be honest. Andwith worldwide travel, it is just spreading too far too fast. I hope I am wrong.","2) Clarifying SAR: After collating #COVID19 transmission events involving gatherings of close contacts... Across 10 events, the estimated primary cases infected 35% of their contacts on average. That is what SAR means."
37,"I don’t think the USA is prepared to deal w/ COVID19, but a month ago, none of the media nor Dems were talking about it when it was all over social media and young ppl in China were screaming 4 help. All they could talk about was impeachment disappointment &amp; getting rid of Trump.","Good thread about the “reinfection” question. It’s likely not reinfection, rather likely a false negative earlier #COVID19 test. This is of course still troublesome. Read thread below. https://www.japantimes.co.jp/news/2020/02/28/national/coronavirus-reinfection/"
38,"I'm on my 2nd bog roll & my nose is raw. Got ringing in my ears and a head like cotton wool. The constant coughing made my voice sound like Elton John's. If it is COVID19, think I'll just stay in. No way are they whisking me away to an isolation pod and feeding me hospital food.",I ain't MAGA and I know it. Why do they display the real electron microscopy image of COVID19 and tell people it's all fake? When they hear some guy making the rounds in their neighborhoods they'll turn off the TV. 
39,"Coronavirus: Experts: We need testing kits and unvetted, truthful information. Trump: Hoax of the day. Anyone want some tax cuts?! Trump supporters: No fucking way I'm drinking corona beer. When was America ever this great? #COVID19",Thailand is the 1st country outside China to report novel coronavirus - Outbreak News Today http://outbreaknewstoday.com/thailand-is-the-1st-country-outside-china-to-report-novel-coronavirus-60384/ …
40,Thread: #COVID19 ,"https://apnews.com/5307c95572c3266e78842338d332a0d6 … Thai health officials confirmed that a Chinese visitor has been “infected with a new strain of coronavirus that has been linked to a pneumonia outbreak in central China.” 

SARCASM ALERT: Vaccines may or may not prevent ""Contagion"" https://www.imdb.com/title/tt1598778/ …"
41,"The trump administration can’t even handle #COVID19 in the United States! Why the hell should Iran believe ANYTHING you say, Lyin’ Mike?? #TrumpDropsTheBallAGAIN","https://link.springer.com/article/10.1007%2Fs00705-019-04470-z … 
Food energy-dependent miRNA biogenesis biophysically constrains viral latency across kingdoms, but theorists still debate whether a specific microRNA antagonist could be used as a potential anti-viral therapy against PHEV and other #coronavirus infections"
42,"Coronavirus “starting to behave like the ""once-in-a-century pathogen we've been worried about."" Gates also pointed out #COVID19's current predicted fatality rate is higher than that of the 1957 influenza pandemic, which killed an ~66,000 people in U.S.“ ",Watching pseudoscientists fail to link what is known to all serious scientists about viral predation in #Wuhan causes more #coronavirus fear than most intelligent people ever considered. They thought Democrats and other hate-mongers were paying attention.  https://www.ncbi.nlm.nih.gov/pubmed/?term=microRNA+coronavirus …
43,"So far, other countries should follow USA lead from January 2020. While papers criticized the brilliant anti-infection risk move by President Trump, it appears the early initial travel ban related to Virus 19 helped the USA. #Coronavirus #Covid19 Covid-19",The virus-driven degradation of mRNA has been the biggest threat to national security since before the time that it was reported for comic relief in this interview from  6/1/2007. http://www.cc.com/video-clips/sz2odd/the-daily-show-with-jon-stewart-greg-bear … Watch what happens with the new #coronavirus from #Wuhan.https://twitter.com/AngrierWHStaff/status/1218664091037962240 …
44,"Awesome STUDY from @NewsBusters colleague Bill D'Agostino --&gt; On Thursday, more than 60% of @CNN's #coronavirus #covid19 related questions for guests were about Donald Trump. ","Not the Holocaust, it's the rape/vaccine-induced viral apocalypse via the coronavirus from #Wuhan. See: https://en.wikipedia.org/wiki/Contagion_(2011_film) …"
45,"Norway: Infected Ullevål hospital worker may have had contact with more than 100 patients, hospital confirms #covid19 #coronavirus",Corona virus outbreak in China https://twitter.com/WHOWPRO/status/1218741289048403970 …
46,A good no BS non hyped assement of COVID19 from a medical professional. Wash your hands and don’t touch your face. ,"World #Health Org/#WHO issues warning after 'mysterious' #Chinese #coronavirus spreads=>#Japan
1st Case of #infection after man tested positive for new #pneumonia-like #virus
Concerns about spread as #tourists #travel #ChineseNewYear
#China 1 Dead/41 Sickhttps://twitter.com/i/events/1217928133917044736 …"
47,"Northern California Veteran patients and visitors, for the latest on #VANorCal precautions and other information surrounding the #Covid19 #coronavirus disease, please visit https://www.northerncalifornia.va.gov/newsroom/covid_19.asp.","Fiji's first barrier to the coronavirus is the strict public health protocols put in place by countries such as China and Australia, says Health Minister Dr Ifereimi Waqainabete. #TimesNews #FijiNews #Coronavirus #FijiHealthMinistryhttps://www.fijitimes.com/strict-health-protocols-first-barrier/ …"
48,First confirmed case of #coronavirus In Iceland #covid19 ,"@JackPosobiec - Do you still have intel connections? This needs to be viewed by them imo.
Wuhan Citizen Risks His Life To Tell The Truth About The #Coronavirus Si... https://youtu.be/PuLB8moUcn8  via @YouTube"
49,- Iceland 1 (first #covid19 case confirmed in Iceland),Medical simulation shows shocking number of people could die of coronavirus in just 18 months https://www.theblaze.com/news/medical-simulation-shows-shocking-number-of-people-could-die-of-coronavirus-in-just-18-months …
50,New #coronavirus #covid19 cases confirmed in the Nordics on Friday (so far) - Denmark 1 - Finland 1 - Sweden 4,"""Basic biology"" biophysically constrains energy-dependent  viral latency.  Theorists turned the facts into the nightmare manifested as the #coronavirus pandemic from #Wuhan, which could be stopped with supplements of vitamin C and D. See also: https://en.wikipedia.org/wiki/The_Stand "
51,"Uppsala #coronavirus patient is in home isolation and is 'relatively well', according to hospital. #covid19 - Expressen","The real question is, 
The release of the coronavirus was,
A security failure at the biolab.
Or
A deliberate poiltical assignment.
The chinese mentality is never what it appears."
52,"UPDATE -- Another new #coronavirus case in Sweden, this time in Jonköping. That's fourth new case confirmed in Sweden on Friday. So far. #covid19 ","BREAKING: #Coronavirus has been declared a Global Public Health Emergency

It has now spread to 19 countries. 170 dead so far.

NOW is the time to prepare your 72-hour kit, not later. #cdnpolihttps://www.westernstandardonline.com/2020/01/forbes-be-prepared-for-the-next-big-disaster/ …"
53,This is second #coronavirus case in Helsinki and Uusimaa hospital region. #COVID19,"WHO Declares Coronavirus Outbreak A Global Health Emergency : Goats and Soda 

https://www.npr.org/sections/goatsandsoda/2020/01/30/798894428/who-declares-coronavirus-outbreak-a-global-health-emergency …"
54,Third confirmed #coronavirus case in Finland: Woman of working age has tested positive for #COVID19 in Helsinki region after trip to northern Italy. ,Border  monitoring at international ports and airports have been heightened after reports of nine deaths in China to the deadly coronavirus and about 450 confirmed cases in China and five other countries. #TimesNews #FijiNews #FijiHealthMinistryhttps://www.fijitimes.com/virus-alert-heightened/ …
55,"More than 20 vaccines underway, earliest results in coming weeks. That’s hopeful. #COVID19 ",Chinese city goes into lockdown as coronavirus death toll doubles https://www.abc.net.au/news/2020-01-23/wuhan-coronavirus-overwhelms-hospitals-fears-it-will-spread/11888588 … via @ABCNews
56,We need to ramp up testing. Hopefully 90 labs by next week. But we need also more than a paltry volume of 100/day per lab too. #TESTVIRUSNOW #COVID19 ,"Live: NSW Now: Flight from coronavirus city to land in Sydney, man charged over alleged kangaroo attack https://www.abc.net.au/news/2020-01-23/sydney-morning-briefing-january-23/11891534 … via @ABCNews"
57,Does this sound safe? One of the last direct Delta flights arrived in Minneapolis from South Korea Thursday night. Most people at MSP Airport were not wearing masks. #coronavirus #COVID19 #Minneapolis #msp,"WHO postpones decision on whether to declare emergency over coronavirus
https://www.cbc.ca/news/health/coronavirus-china-who-pheic-meeting-1.5436276 …"
58,If everybody intending on going to Cheltenham went into prophylactic self isolation until 10th March it would be safe right? There's an idea. #COVID19, Wall Street Pulls Back from Record Highs After Worry Over First US Coronavirus Case https://sputniknews.com/business/202001221078098086-wall-street-pulls-back-from-record-highs-after-worry-over-first-us-coronavirus-case/ …
59,First Coronavirus 2019 patient found in Thailand https://www.nationthailand.com/news/30380478  via @nationnews,"Live: NSW Now: Sydney Airport on high alert for coronavirus, authorities issue funnel-web warning #AusPol https://www.abc.net.au/news/2020-01-22/sydney-morning-briefing-wednesday-january-22/11887610 … via @ABCNews"
60,"Coronavirus-infected Chinese tourist being treated in Thailand

https://www.bangkokpost.com/thailand/general/1834789/coronavirus-infected-chinese-tourist-being-treated-in-thailand …","We've got to keep infected people OUT. @POTUS

U.S. officials confirm first U.S. case of China coronavirus: https://aol.it/36fLTfW "
61,Fiji Boxing Team Warned Of 'Mystery Disease' Ahead Of Olympic Qualifiers In China https://fijisun.com.fj/?p=495557  #coronavirus #boxing #olympicqualifierspic.twitter.com/60wMNgOBDt,First case of potentially deadly coronavirus from China lands in Seattle https://trib.al/4dGQHRP 
62,"Western press use hyperbole for any disease about China and omission for the good news

New virus from China that killed two may be more widespread – reportImperial College London says it thinks cases of a new type of coronavirus, which started in.. https://news.sky.com/story/china-virus-which-killed-four-may-be-more-widespread-report-11911340?dcmp=snt-sf-twitter …","Samoa’s Ministry of Health has confirmed that two Samoan sailors are in quarantine for 14 days at the Faleolo District Hospital amid fears they might be carrying China’s #coronavirus.
#FBCNews #FijiNews #Fiji  
More: https://www.fbcnews.com.fj/world/pacific-islands/two-men-in-quarantine-in-samoa-over-coronavirus-fears/ …pic.twitter.com/6GeLPqn0m5"
63,"Update and Interim Guidance on Outbreak of 2019 Novel Coronavirus (2019-nCoV) in Wuhan, China - Health Alert Network (HAN) No. 426 https://emergency.cdc.gov/han/han00426.asp …","y’all keep talking about coronavirus but get blackout drunk every friday night, y’all are worried about the wrong corona"
64,Novel Coronavirus – Thailand (ex-China) https://www.who.int/csr/don/14-january-2020-novel-coronavirus-thailand/en/#.XiJorU2h1XI.twitter …,CDC confirms second US case of coronavirus and is monitoring 63 other possible infections https://cnb.cx/2RP5yOD 
65,Fiji Airways says it is taking steps to ensure its crew members operate in a safe environment by updating them with the required information in regards to the deadly #coronavirus. #TimesNews #FijiNews #FijiHealthMinistryhttps://www.fijitimes.com/airline-crew-on-high-alert/ …,How Coronavirus Kills: Acute Respiratory Distress Syndrome (ARDS) & Trea... https://youtu.be/okg7uq_HrhQ  via @YouTube #coronavirus
66,Australian researchers race to develop coronavirus vaccines http://disq.us/t/3loibk3 ,"Hong Kong researchers develop vaccine for deadly coronavirus, it could take time before it's used on humans (via @fijivillage) 

#WorldNewshttps://fijivillage.com/news/Hong-Kong-researchers-develop-vaccine-for-deadly-coronavirus-it-could-take-time-before-its-used-on-humans-ks92r5/ …"
67,"*The U.S. spreads coronavirus to San Francisco
 https://www.latimes.com/california/story/2020-01-26/coronavirus-spreading-evacuation-san-francisco-wuhan-china?_amp=true&__twitter_impression=true …","Just got off the phone with a friend who happens to be a virologist (not making this up).

He suggests that we not worry too much about the Wuhan coronavirus.

We should know if he's right within a week or so.

If he's wrong, feel free to panic."
68,googling can coronavirus be spread thru ass to ass contact..,Pangolins may have spread coronavirus to humans: What to know about the Wuhan virus https://www.usatoday.com/story/news/health/2020/02/07/coronavirus-pangolin-virus-host-who-virus-update-friday/4688785002/ … via @usatoday
69,I’ve been reading the coronavirus tweets for days now and honestly so far the reactions to it are more interesting than the virus.,"There are no confirmed cases of Novel Coronavirus in Fiji
 
The Fijian Ministry of Health and Medical Services advises that the results of the two Fijian nationals who were isolated in Nadi Hospital have returned negative and they will soon be on their way home.
 
#fijinews"
70,"Russia closes 2,700-mile border with China to stop coronavirus https://metro.co.uk/2020/01/30/russia-closes-2700-mile-border-china-stop-coronavirus-12151466/#share-item-0-181 … via @MetroUK","In China, government officials willing to risk rebuke from the Communist Party to speak out about the coronavirus and the death of Dr Li. In the US, GOP lawmakers cower in fear of Trump tweets. #shameonGOP"
