,Positive,Neutral,Negative
0,1059,The Illinois High School Association has officially canceled the state tournaments for all spring sports and activities because of the coronavirus. Danville High school will not compete in any spring sports or activities during the spring of 2020. ,1227
1,"There is a coronavirus outbreak at the Tyson plant in Joslin, Nita Ludwig, Rock Island County Health Department, administrator confirmed Wednesday at the daily health briefing by the Scott and Rock Island County health departments. ",Viral video shows large Chicago house party amid coronavirus pandemic https://chicagopixels.net/uncategorized/viral-video-shows-large-chicago-house-party-amid-coronavirus-pandemic/?utm_source=ReviveOldPost&amp;utm_medium=social&amp;utm_campaign=ReviveOldPost,Microsoft sales rise as remote working lifts cloud services during coronavirus crisis https://thedevtalk.com/article/id/63d4010a705d3e14df7d6a510875b118
2,The new cure for #Coronavirus. https://twitter.com/brian_lendino/status/1255619439460040704,"Coronavirus: Rahul Gandhi To Discuss Economy With Raghuram Rajan, Experts Today https://www.retargetingnews.com/coronavirus-rahul-gandhi-to-talk-about-financial-system-with-raghuram-rajan-professionals-as-of-late/",Dr. Fauci Backed Controversial Wuhan Lab with Millions of U.S. Dollars for Risky Coronavirus Research 
3,Since when? Since he's a millionaire and theres a coronavirus about. The guy is literally sitting on his arse doing nothing and expecting full pay. Why dont you try that at your work tomorrow.,"ArcelorMittal reportedly lays off nearly 1,000 Northwest Indiana employees due to coronavirus ",Okay I’ll start. What has the corona virus epidemic taught me. 1. That no one is invincible. 2. You have to know how to survive. #vettegreen #thisiscrazy #itstime
4,Chicago News Pritzker Details How Illinois Plans to Deal With Coronavirus Outbreaks at Nursing Homes http://dlvr.it/RVjqqD,The Coronavirus Pandemic Has Created A Major Opportunity For US Rice http://dlvr.it/RVjqJd,"hey i was just wondering if you c TERROR IN THIS SOUTH FLORDIA COMMUNITY AS CORONAVIRUS SWEEPS THROUGH and i needed this report upd OF THE MORE THAN 30,000 RESIDENTS WHO CALL THIS RETIREMENT COMMUNITY HOME i was having trouble logging into the site and IS A LOCAL WOMAN WHO LOST H"
5,Demand that Trump create a special enrollment window for the Affordable Care Act during coronavirus! ,The coronavirus situation is even more serious for Thai migrant workers in Israel ,"NYPD to Step Up Coronavirus Enforcement After Funeral Flouts Rules New York City police will no longer issue warnings to people who violate social-distancing rules designed to fight the coronavirus after a funeral drew a large crowd in Brooklyn Tuesday, officials said"
6,"One public health epidemic does not cure another. As we work to stop the spread of #coronavirus, we must double down on violence reduction strategies. The same marginalized, disinvested communities are hit the hardest by both crises. Let’s spread knowledge, hope and opportunity. ",Nobel Prize-Winning Scientist Who Discovered HIV Says Coronavirus Was Created In Laboratory – Dr. Rath Health Foundation ,Dairy farmers in upstate New York who faced the wrenching task of dumping their milk earlier this month as the novel coronavirus spread are now confronting a grim future: months of low prices that could squeeze them out of business.
7,"The stock market is around 4,000 points down from where it was before coronavirus... but media doesn’t report it near as much People only dwell on the negative ","Online Extra: Schiff talks federal coronavirus response, draws parallels to impeachment http://dlvr.it/RVjnn5","Tensions are escalating at food plants between essential workers who feel pressure to continue working through the coronavirus pandemic and their employers, who are striving to maintain the country’s food supply chain without interruption"
8,I'm starting to get calls about antibodies. Here are my speaking points! #Love ConsumersReports Antibody Test for the Coronavirus Could Reveal Who Is Immune ,"New York City Subway Cars Must Be Cleaned Daily During Pandemic, Cuomo Says New York Gov. Andrew Cuomo said subway cars in New York City should be cleaned every day for essential workers who are still commuting amid the coronavirus pandemic.","I can sit up straight without the room spinning. If it is, in fact #coronavirus that I am suffering from...this is a really weird virus..."
9,Why It’s Difficult to Get a Coronavirus Test in the U.S. https://camrojud.com/why-its-difficult-to-get-a-coronavirus-test-in-the-u-s/," Reminder that starting May 1st, anyone above the age of 2 is required to wear a face mask or covering! The Stay-At-Home order is also extended through May! #coverup #covid_19 #coronavirus #chicago #illinois #stayathome","U.S. Coronavirus Deaths Top 60,000 as New Data Show Economic Toll Governments and companies took new measure of economic damage from the coronavirus pandemic, and some predicted bigger losses in the months ahead even as restrictions on movement are rolled back"
10,If Trump truly mourned everyone lost he would be doing actual work toward solving the Trump Corona Virus issue. Instead he keeps minimizing and shifting blame for his failings (which are innumerable).,Coronavirus In Lake County: Memorial Day Parade Cancellations http://dlvr.it/RVjmMX,"Amid the coronavirus pandemic, almost everyone is waiting anxiously for something. For those seeking live organ transplants, it's an especially heavy burden. "
11,"FLORIDA, THE NEW RED CHINA. Florida is not reporting cause of death due to Trumps Corona Virus. This is a communist tactic to hide reality. It gives people a false sense of security and is basically a tactic to get business open regardless of how many people are killed.",Crazy how people can go so passionate about the coronavirus to giving all their energy to a Beyoncé and Meg thee horse song ,"It’s sad how racist/dumb people are,,, this is happening rn with xenophobia towards Chinese because of the corona virus :/"
12,Like to see u coronavirus tested on twitter! How about it Schumer?,Tonight's #COVID19 #Coronavirus update in #Illinois #coronavirus cc: @willpublicmedia,"Mass layoffs begin in cities and states amid coronavirus fallout, threatening education, sanitation, health and "
13,the white house gift shop is selling commerative covid coins. you can’t make this shit up. #coronavirus #trump #TrumpPressConference #resist,Dr. Anthony Fauci says Gilead’s remdesivir will set a new ‘standard of care’ for coronavirus treatment #SmartNews,This testimony will be used as evidence in the future inquiry into the negligence of vulnerable asylum seekers @LeoVaradkar @SimonHarrisTD @CharlieFlanagan Direct Provision https://www.rte.ie/radio/utils/share/radio1/21760062 #coronavirus #EndDP #EndDirectProvision
14,"CORONAVIRUS TRUMP Wed, 29 Apr 2020 18:00:00 CDT",When you drive a @BMW and @MercedesBenz and you line up in a food pantry!? C’mon now...give the people more in need a chance to get food! #COVID19 #coronavirus #covidiots,"It’s coming. Milk is being poured down drains, pigs are being euthanized, chickens killed. Demand has shrunk and processing plants closed@due to workers with Coronavirus. Sleep through it if you choose. Democrats and the media want it to happen. "
15,Microsoft posted higher third-quarter earnings propelled by strength in its cloud-computing business with some of its operations getting an extra boost from the coronavirus pandemic.,Yes I know I’m just saying because of these few groups of people doesn’t mean you should be racist towards blacks it’s like white people blaming coronavirus on Chinese people and being xenophobic towards them,The Cook County medical examiner’s office confirmed another 119 COVID-19 death from the coronavirus outbreak. 
16,"March 19, 2020, Dr David Ho mentioned Remdesivir (EBOLA drug) as a promising drug to treat Covid-19 Dr. David Ho is Leading Four Research Teams to Find a Coronavirus Treatm... https://youtu.be/2B-rYVWmqoI via @YouTube",What are the precautions to take in ophthalmology clinics during the #coronavirus pandemic? Let this @JAMAOphth CME article guide you.,"There are stats from NYC showing something like 6 times higher deaths than normal. More than the reported coronavirus death toll, as it happens. This with fewer car accidents because people aren't traveling."
17,Trump Administration Remains Hopeful on China Trade Pact Despite Coronavirus Senior U.S. trade official expressed confidence that Beijing will meet obligations under deal with Washington ,‘People Will Raise Me Up on Pitchforks’: Lukashenko Explains Why He’s Resisted Coronavirus Lockdown - Sputnik International ,"Just another scumbag Trump acolyte grifter, fucking people over & stealing money @warp speed. #KushnerIsAnIdiot #KushnerApocalypse #Kushner #Corruption #COVIDー19 #coronavirus #CoronaVillains #TaskForce #COVIDIOTS #Genocide #CorruptToTheCore #CorruptAndComplicitGOP #COVIDー19."
18,"U.S. Buys 100,000 More Body Bags, Preparing for Coronavirus Worst More than 58,000 Americans have died from Covid-19",Except he was already responding to the Chinese Wuhan Coronavirus by then. But thanks for playing.,"OMG I WAS RIGHT!!!!! Remember all my tweets that their death rates were impossible?! I saved screen shots of daily rates, that I’ll add, b/c they were not possible. Florida medical examiners were releasing coronavirus death data. The state made them stop http://www.tampabay.com/news/health/2020/04/29/florida-medical-examiners-were-releasing-coronavirus-death-data-the-state-made-them-stop/"
19,"The Trump administration has no immediate plans to reopen the country’s borders after imposing a ban on foreign travelers from the European Union and the U.K. last month to slow the spread of the coronavirus, Secretary of State Mike Pompeo said.",Hannibal Mayor James Hark released a statement Wednesday evening on how the city will proceed in the upcoming weeks regarding the coronavirus pandemic. ,"Halt destruction of nature or suffer even worse pandemics, say world’s top scientists | Coronavirus outbreak | The Guardian "
20,"Again why does @CillizzaCNN still have a Job at CNN with this both sides Bull Shit all the Time. If you listen to that LIAR Donald Trump Coronavirus is a Hoax if you listen to the regular News over 60,000 Americans have died from the disease.","Prepared for the Coronavirus: 9 Simulations, Drills &amp; Laws Planned for It https://thefreedomarticles.com/9-simulations-drills-laws-prepared-for-the-coronavirus/","bill be blasio in a few weeks when a hasidic jew is attacked by a person for spreading coronavirus: damn rip this is so sad we never saw this coming. say no to antisemitism, we are all brothers let’s fight this together. Make love not war!"
21,"Some States Lifted Coronavirus Restrictions, but Did People Go Out? Data from Georgia, Oklahoma and South Carolina show people came out in trickles rather than droves, but travel, clothes and entertainment topped the list",H1-Bs have to go back ...How the Coronavirus Will Kick Legal Immigrants Out of Line — and Out of the Country @NiskanenCenter,Coronavirus just fell 2nd to the greatest pandemic in world history - Racism. 
22,"NIH's trial of Remdesivir found the drug shortened #COVID19 patients' recovery by an avg. of 4 days. Dr. @AmeshAA Adalja told me he's ""very optimistic"" about the results. I asked him what more we need to learn, how it impacts other trials &amp; what's next? #coronavirus @Newsy",Small Business Coronavirus Resource Get the small business information you need to survive and thrive during these uncertain times. #smallbusinessdevelopment #smallbusinessgrowth #smallbusinesssupport #covid19,Haven't stats already shown that the jogger community had higher rates of coronavirus deaths? Could be messy.
23,"With 24 straight hours of rain, my #family needed some comfort food, so today's #COVIDcuisine is Shepherd's Pie Stew! It was delicious!! #cookinginquarantine #cookinginacrisis #cookingathome #cooking #COVID19 #coronavirus ",Coronavirus: AIDS researcher David Ho discusses Covid-19 treatments ,"Our death toll is on the lower end of expert prediction. 'The White House coronavirus response coordinator said Monday that she is ""worried about every city in the United States"" and projects 100,000 to 200,000 American deaths as a best case scenario.""' "
24,"Tyson is doubling bonuses and increasing health benefits for frontline workers. At least 8 have died of coronavirus and over 1,180 have been infected. https://www.businessinsider.com/tyson-doubling-bonuses-increasing-health-benefits-for-workers-2020-4?utmSource=twitter&amp;utmContent=referral&amp;utmTerm=topbar&amp;referrer=twitter via @businessinsider",Elon Musk Rips Coronavirus Lockdowns: ‘FREE AMERICA NOW’ https://camrojud.com/elon-musk-rips-coronavirus-lockdowns-free-america-now/,"It's not all his fault anyways. He wanted to close down borders pretty early on but he got called a racist for that. Now that quarantine is in place many idiots are protesting and saying coronavirus is ""fake"". I doubt any other president would have handled this better"
25,Pritzker Details How Illinois Plans to Deal With Coronavirus Outbreaks at Nursing Homes http://nbcchi.com/lFpCq4X,"Public Health Officials Announce 2,253 New Cases of Coronavirus Disease https://shar.es/aHAUUk",Vietnam: How this country of 95 million kept its coronavirus death toll at zero 
26,President @realDonaldTrump said today the federal government will not be extending its coronavirus social distancing guidelines once they expire Thursday. ,Fauci: Gilead’s remdesivir can block coronavirus | ,"The coronavirus outbreak is going to deal a huge blow to thousands of school district budgets across the country, with teachers cut, fewer days in classrooms and fewer resources.​ "
27,"The coronavirus might spell the end for the connecting flight, says @tylercowen, and travelers will be better off because of it https://www.bloomberg.com/opinion/articles/2020-04-29/tourism-after-the-coronavirus-shorter-trips-to-safer-places?sref=NXPZRAal via @bopinion",ICE Moved Dozens Of Detainees Across The Country During The Coronavirus Pandemic. Now Many Have COVID-19. ,"""They"" are killing off ""certain people"" with Coronavirus by staging these protests so ""They"" can't vote in November. #Q"
28,Why Trump Can't Stop His Coronavirus Briefings - The Atlantic ,parks and rec is coming back for a coronavirus episode omg ,"Last week: If you go to church or try to get a haircut, we’ll arrest you and the media will say you’re a fascist. Coronavirus! This week: If you steal 70-inch flat screens from Target and burn down police stations, the media will call you a hero. No masks required! "
29,Florida ordered coroners to stop releasing coronavirus death data: report | TheHill #SmartNews,"Dana, the coronavirus isn’t forever, but TikTok is. Stop playin.","Perspective | No, the coronavirus pandemic wasn’t an ‘unforeseen problem’ | The coronavirus pandemic isn’t a ‘black swan.’ It’s a gray rhino. https://ecs.page.link/fYXtq"
30,Saw Kendall Jenner trending and I thought she was trying to cure coronavirus with a Pepsi.,"Charts: How the coronavirus pandemic has remade every link in the supply chain, from farms to manufacturers to shippers to stores. https://www.wsj.com/articles/two-months-that-tore-apart-the-food-chain-11588174236 via @WSJ","it has been on US soil since at least Oct '19, you can easily do some research into this bcz there was plenty of nursing home residents dying of a mystery lung infection last fall (it was coronavirus, no doubt about it)"
31,"@seanhannity Breaking News: Homeless-Forgotten/Non-Essential?! CoronaVirus Infection/Death Rates Of Homeless? Out of sight, out of mind? Why are Illegal Immigrants more important? Big Business? Taxes? Voting Block? What happens if you become homeless? Kim-Team Duckey.","Colleges, Universities in Illinois, Indiana Extend Decision Deadline Amid Coronavirus Pandemic http://nbcchi.com/qUKCfAR","There is a virus loose in the land. I’m not talking about coronavirus. It is the virus of hate, division, bigotry, racism, cruelty perpetrated on people of color aided &amp; abetted by a faux leader who only wants to go to war and win the election!!!"
32,A special thank you to all healthcare providers and first responders for helping to keep us safe during the coronavirus pandemic. ,Local kindergarteners’ video lifts the spirits of those on the front lines of coronavirus ,"Armed with a coding manual, one group of students is logging all the lies, conspiracy theories, and misleading political attacks that have seemingly spread as fast as the coronavirus itself. http://bit.ly/3gjyyd1"
33,I just got word that the president has invoked the Defense Production Act to draft me into the Dinner Force. We'll be liberating the Olive Garden. My country needs me to fight the coronavirus by scarfing delicious breadsticks in order to preserve our way of life.,Amazon just purchased surveillance equipment from a US government blacklisted company! #amazon #privacy #coronavirus #covid19,"Coronavirus updates: Officials report another 60 COVID-19 deaths in Illinois, bringing the statewide death toll to 5,330 "
34,"@Acosta: Trump “took a gamble” that warmer weather would cause Coronavirus to dissipate, siding with aides pushing back on dire warnings coming from doctors. ""He took a gamble and got it wrong,” the adviser said. NO. MORE. GAMBLING. #DidntHaveToHappen",Daily podcast audio: Amazon just purchased surveillance equipment from a US government blacklisted company! #amazon #privacy #coronavirus #covid19 #podcast,"Police brutality and coronavirus at the same time , it’s so sad and tragic "
35,"""Thread: Let’s count the ways Trump has made the coronavirus worse: 1. In 2018, Trump disbanded Obama’s [...]"" - @blakesmustache on #Threader", stop playing with me.,"The Henry and Stark County Health Department today, Saturday, May 30th announce a cumulative total of 73 confirmed cases of Coronavirus Disease (COVID-19) in Henry County and 3 confirmed cases in Stark County. "
36,Oh FFS. I really can’t w/this dotard shitbag anymore. #BlameGame #COVID19 #COVIDIOT #coronavirus #covidresponse #TrumpGenocide #TrumpVirus #TrumpOwnsEveryDeath #TrumpLiesPeopleDie #TrumpFailedAmerica #TrumpIsAnIdiot #TrumpCoronavirusTestFailure #Corruption #CorruptToTheCore.,"Are we going to hold the government accountable for not doing community #testing (the supplies for which have been in #Israel for over a month) now that there are signs of a possible second wave, or will we wait for a third wave of #coronavirus before any action is taken?","October- 2 seizures. November- a dog with a nasty eye infection. December- 1 seizure. January- WW3, Corona Virus and other dog with a torn ACL and likely Cushings disease. Let’s hope we make it through February team"
37,Nearly half of St. Clair County’s coronavirus deaths were long-term care residents ,"Coronavirus May Be a Blood Vessel Disease, Which Explains Everything by @SmithDanaG in @elemental", World Health Organization declares coronavirus outbreak a global emergency 
38,The National Baseball Hall of Fame induction ceremony has been pushed back to 2021 because of coronavirus. This year's inductees were to include Yankees shortstop Derek Jeter and White Sox announcer Ken “Hawk” Harrelson. ,"CORONAVIRUS GEORGE Sat, 30 May 2020 18:00:00 CDT",You dirty ass mfs need to worry about all your stds before worriying about that coronavirus
39,Here’s How We Can Keep This Crisis From Digging Even Wider Educational Divides ~ Dr. Jawan Brown-Alexander #COVID19 #Coronavirus #Equity #StudentSupport,Coronavirus racism wasn't quite disparate enough,"Coronavirus Geometric Progression Suggests 100,000 Infections In A Week | Zero Hedge "
40,"Beloved Brooklyn teacher, 30, dies of coronavirus after she was twice denied a COVID-19 test - ABC News - https://abcn.ws/2zFIJrv via @ABC",Will this diet and NAC help prevent the Coronavirus?,"Children With ""Stealth"" Coronavirus Infections Raise Fears Of 'Community Outbreaks' | Zero Hedge "
41,Trump-favored anti-coronavirus drug receives doctors' support ,No one talking about Coronavirus now... just race and riots is the only thing on the news.,Is the coronavirus outbreak as bad as SARS or the 2009 influenza pandemic? A biologist explains the clues https://theconversation.com/is-the-coronavirus-outbreak-as-bad-as-sars-or-the-2009-influenza-pandemic-a-biologist-explains-the-clues-130766?utm_source=twitter&amp;utm_medium=footertwitterbutton via @ConversationUS
42,"“There’s a lot of bartenders, there’s a lot of barbers, beauticians, et cetera, in Riverton, and we knew they’d be, you know, forced out of work for a while, so our deal was to make sure all their families were fed through the duration of the coronavirus” ","Jerusalem middle/high schools are trying to figure out whether kids should come to class tomorrow, given the uptick in coronavirus cases in some schools. Govt is letting the schools decide.","The #WorldHealthOrganization has declared the #coronavirus outbreak a global emergency. On Thurs., China raised the death toll to 170."
43,We’re featuring Northwestern Mutual clients whose businesses have been affected by the coronavirus. You can support them by sharing their stories and helping them get the word out. #openforbusiness #supportsmallbusiness #planprepareproduce,CDC suggests coronavirus started spreading in the U.S. in January ,You damn right I will 409 the whole gah damn world before I let a damn #coronavirus get at me #slyflymccartney
44,"Boeing, Airbus and their engine supplier General Electric outlined survival plans as their airline customers reel from the coronavirus pandemic. https://www.wsj.com/articles/boeing-and-airbus-brace-for-prolonged-downturn-triggered-by-coronavirus-11588199021 via @WSJ",Coronavirus: Shielders in England allowed outdoors again from Monday This article https://www.bbc.co.uk/news/health-52862440 appeared first on https://bypurify.com,The World Health Organisation has declared the coronavirus outbreak a global emergency. 
45,"CORONAVIRUS TRUMP Wed, 29 Apr 2020 17:00:00 CDT","Italy can’t expect European help to counter the deep economic slump induced by the coronavirus lockdown to come “free of charge,” Bank of Italy Governor Ignazio Visco warns https://www.bloomberg.com/news/articles/2020-05-29/italy-shouldn-t-expect-free-help-from-europe-visco-says?sref=NXPZRAal via @markets","IN CASE YOU WERE CONFUSED Corona beer has NOTHING to do with the coronavirus. There has been a significant spike in web searches for “corona beer virus,” “beer virus” and “beer coronavirus” in the past two weeks, according to Google Trends. "
46,"An Illinois Democrat, Republican Weigh in on Coronavirus Response, Relief and Pence’s Mask-less Photo http://nbcchi.com/XqilFHf","Coronavirus: Britain faces 'very dangerous moment' as lockdown eased, says top government adviser #SmartNews",“We are on the verge of a global transformation. All we need is the right major crisis and the nations will accept the New World Order.” ~ David Rockefeller - Crisis: Corona Virus
47,"If you don't report coronavirus deaths, they will do at zero by no time...",Mf’s worried about the second wave of coronavirus when I’m pretty sure we haven’t gotten past the first...,"to ppl participating in racist & xenophobic comments/acts against Chinese/Asian ppl, spreading misinformation abt the coronavirus for clout &amp; contributing to the fear mongering, or using this virus for whatever political agenda, hope y'all get gravely sick from the flu instead."
48,"Special Coronavirus Update - Paycheck Protection Program now open, access the new coronavirus web app at http://chicago.gov/covidcoach, protecting victims of domestic violence, and more - https://mailchi.mp/50thwardchicago/special-coronavirus-update-1601364","Coronavirus Briefing: Zoom, hydroxychloroquine and tap dancing bellhops ",Four days later. Will we start to get the flu dirt on February 15th? “The dirt” on what really happened regarding the origins of the Corona Virus? 
49,"Join IRRPP & SJI for ""Imagining and Demanding Economic Justice in the time of Coronavirus"" May 7th at 9am. How can the solidarity economy help address immediate needs and create an alternative economic future. More info at https://covid_racial_justice.eventbrite.com #CovidRacialJustice @sji_uic",not the coronavirus cases spiking ,The World Health Organization has officially declared the Coronavirus outbreak a Global Public Health Emergency as the first person-to-person transmission of the virus was reported in Chicago. #CoronavirusOutbreak
50,Need tips for reinventing your career during the coronavirus crisis? @HarvardBiz #Career #CareerPlanning #Coronavirus ,"Coronavirus Live Updates: Major U.S. Cities Ease Restrictions, as Global Caseload Nears 6 Million ",Dow falls 350 points Friday to cap the worst week for Wall Street since the financial crisis https://www.cnbc.com/2020/02/27/dow-futures-fall-100-points-after-another-massive-rout-amid-coronavirus-fears.html?__source=sharebar|twitter&amp;par=sharebar #Dow #Stocks #StockMarket #COVID19 #Coronavirus
51,Racism Against Asian Americans Isn't New During Coronavirus | HelloGiggles ,"Fr. Jenkins should understand that the effects of coronavirus are being felt disproportionately by people of color and the working class, and he should abstain from making any plans to re-open campus until everyone’s safety, not just ND students and faculty, can be guaranteed.",I fear the day when the same virus affects both humans and machines. #coronavirus #COVID19
