,Positive,Neutral,Negative
307,"Right now, the candidate @BernieSanders who proposed #Medicare4All to cover all Americans, and the candidate @ewarren who has a plan for that, look like very wise choices for President. 
#CDC #Coronavirus #CoronavirusOutbreak #DemDebates #DemDebate2020",A new #NorthwesternMedicine clinic is providing specialized care to the one-third of people who have neurological c… https://t.co/VK7RIqEpvW,
308,Dow Jones in three weeks. RIP #CoronavirusOutbreak #coronavirus #COVID19https://twitter.com/KollegeKidd/status/1232453648048746496 …,".@samgharrington, a third-year resident at @MGHImaging, shares the lessons she has learned being redeployed to a… https://t.co/5qwclGBOyP",
309,Is the wall stopping the Corona virus ?,Robin Shah and Andrew Karp of @SkaddenArps explore the ways in which COVID-19 is uniquely affecting all phases of o… https://t.co/5NwrkzCp8F,
310,"(Now its real in America)
SF Mayor London Breed declares state of emergency over coronavirus https://www.sfchronicle.com/bayarea/article/SF-mayor-London-Breed-declares-state-of-emergency-15083811.php?utm_campaign=CMS%20Sharing%20Tools%20(Premium)&utm_source=t.co&utm_medium=referral …","RT @arimoin: Thousands of people packed into an indoor arena, likely with very few wearing masks, in a city that just had its highest case…",
311,"Nope, you're not my favorite. 
You know if the Coronavirus spreads in the US, it will be your fault. In fact, it's your fault that some here have it now. 
https://twitter.com/realDonaldTrump/status/525472979443273728?s=20 …",Have you fired #laurenbalsamo yet?,
312,Coronavirus fears pull U.S. chip index into a correction http://twib.in/l/AL5MzzxEoRg5  #technologypic.twitter.com/2NqsytsAsZ,RT @rarebird88: #GoodNews everyone!! Researchers at @OhioState have developed a breathalyzer that’s able to detect #COVID19 within seconds…,
313,"Bad news! #coronavirus 

DPHSS: Arrival of Coronavirus testing kits delayed; CDC says they need to be ‘re-manufactured’ https://pncguam.com/dphss-coronavirus-testing-kits-delayed-cdc-says-they-need-to-be-re-manufactured/ …","RT @JacquesLoveall: Court denies @AFLCIO request to require #COVID19 rule from @OSHA.

#UFCW8 #1u 

https://t.co/Gglrdzc172",
314,How soon before they bring out a good guy with a coronavirus?,"thanks #COVID19 for taking away Convocation. 

that's 0 for 2 in attending graduation ceremonies if you're keeping track at home",
315,A rising number of coronavirus cases outside of China are pushing global equity markets sharply lower. #Coronavirus http://bit.ly/2TgDoge ,"RT @DEPLORABLEREEG1: There were over 300,000 abortions done by Planned Parenthood in 2019.

They not only BRAGGED about it, but were govern…",
316,Does it come with a side of corona virus ?,My neighborhood closed down the streets to cars so restaurants could expand into them and serve with #COVID19 socia… https://t.co/T3UsBqzphK,
317,"Pay attention to this story and what it would mean for the #EU #economy, especially on top of general global trade #decoupling and the impact of the  #coronavirus. 

Turkey, Pressing E.U. for Help in Syria, Threatens to Open Borders to Refugees https://nyti.ms/2vnQTCU ",RT @DoctorJesseMD: Wear a mask. Stay safe. #COVID19. @AmerMedicalAssn #MaskUp https://t.co/TguKsBN3K0,
318,I just read that a DOG tested positive for CORONAVIRUS. Take us but leave the innocent pups out of it ,RT @GovRonDeSantis: This week I directed @EducationFL to provide high school seniors impacted by #COVID19 with pathways to meet eligibility…,
319,Trump bashes media criticism over his handling of coronavirus pandemic https://youtu.be/2eS3wM67R_M  via @YouTube,"RT @meganranney: ""The new Trump administration rule allows health care providers to deny care to anyone they perceive as trans or gay....""…",
320,"Maybe #trump thinks if there is a virus scare and ppl are sick,
They won’t vote and he will win

#es_f $spx $spy #coronavirus #conspiracyhttps://twitter.com/thedoggeneral1/status/1233235764076515328 …",*NEXT* SYMPOSIUM III: Open Panel Discussion of Educational Impacts from #COVID19 in the Coming Academic Year… https://t.co/bbdUDfhmSq,
321,"Coronavirus has slowed down elective surgeries in China, hurting device makers https://www.marketwatch.com/story/coronavirus-has-slowed-down-elective-surgeries-in-china-hurting-device-makers-2020-02-20 …","How long can #Coronavirus live on surfaces? Up to 9 days but much shorter on certain materials/temps according to 
#COVID19 #COVID #COVID2019 #Covid19usa #COVIDー19 #covidonsurfaces #coronavirusonsurfaceshttps://www.usnews.com/news/world/articles/2020-02-28/explainer-how-long-can-coronavirus-survive-on-surfaces …",
322,10 Italian towns in lockdown over coronavirus fears https://news.yahoo.com/10-italian-towns-lockdown-over-coronavirus-fears-220635548.html …,"How long can #Coronavirus live on surfaces? Up to 9 days but much shorter on certain materials/temps according to 
#COVID19 #COVID #COVID2019 #Covid19usa #COVIDー19 #covidonsurfaces #coronavirusonsurfaceshttps://www.usnews.com/news/world/articles/2020-02-28/explainer-how-long-can-coronavirus-survive-on-surfaces …",
323,DuPont Ramps Up Safety Suit Production As Coronavirus Causes Shortages in China http://nbcchi.com/xQf5tjU pic.twitter.com/nJENBsMcMB,I love being wiped out by the corona virus  https://twitter.com/Official_Alex16/status/1234462067052204032 …,
324,Big tech cos pull out of San Francisco conferences on coronavirus concerns http://twib.in/l/BKg6nMxRroKo  #technologypic.twitter.com/2qjsHHi2YJ,"This week’s advocacy recap covers the U.S. taking steps to combat the coronavirus outbreak, the U.S. EPA not pursuing a financial assurance mandate for chemical facilities, and more: http://bit.ly/cmm_daily4030220 … #CMMDaily #Regulatory",
325,Italy orders mass closures to stem coronavirus outbreak https://www.dw.com/en/coronavirus-italy-orders-mass-closures-after-covid-19-cases-quadruple/a-52467865 …,I think I rather take my chances with the Coronavirus. https://twitter.com/DeputyHunt/status/1234603277389619207 …,
326,With the Coronavirus locking teammates down. Could we have a @MicrosoftTeams channel where we could post little videos and personal stuff to stay connected but use @MSPowerAutomate to clear anything older than say 24 hrs? Like stories. #PowerAutomate,"9 days! Although that looks like worst case scenario, much shorter on certain objects/temps. Answering my own question #coronavirus #COVID19 #COVID #COVID2019 #Covid19usa #covidonsurfaces #coronavirusonsurfaces
https://www.usnews.com/news/world/articles/2020-02-28/explainer-how-long-can-coronavirus-survive-on-surfaces …https://twitter.com/DavidDePillo/status/1234625226580860930 …",
327,"I find it not right and exenophobic to treat Napoli Club Coronavirus,by Brescia,,fans","IT'S TRUMPS FAULT, markets rising in record time.

Which stocks are up during coronavirus market drop? |  https://video.foxbusiness.com/v/6137157577001/ …",
328,"#China's central Hubei province had 630 new confirmed cases of #coronavirus infections on Saturday, up from 366 new cases the previous day.
https://www.jpost.com/Breaking-News/Chinas-Hubei-province-reports-630-new-coronavirus-cases-on-Feb-22-618443 …",Coronavirus in Illinois: What We Know So Far  https://www.nbcchicago.com/news/local/coronavirus-in-illinois-what-we-know-so-far/2229446/ …,
329,6mos to a year and a half for a corona virus treatment.,Pleased to report that the % of men washing their hands after using the airport bathroom has skyrocketed. Like we have sink lines now #coronavirus,
330,i’m confused as to why the great orange one needed to appoint mama’s boy to oversee the coronavirus efforts when he’s already said it’s not a problem in the US can anyone clarify,COVID-19 Preparedness http://ow.ly/hSmj30qmmjz  #EmpLaw #Coronavirus #HR,
331,Look @realDonaldTrump said we're protected from CaronaVirus. So we are. But I wonder about that CoronaVirus thing.,The pre markets are tanking again as you offer no confidence calling the coronavirus a hoax offering the public no confidence. This is your Katrina moment as you are tweeting about candidates vs doing your fricken job. pic.twitter.com/3KbhgNZzjS,
332,"Department of Public Health officials said the risk of coronavirus in Illinois is low, but they are still taking steps to prepare for it #WCIA
STORY: https://www.wcia.com/news/public-health-officials-prepare-for-coronavirus/ …pic.twitter.com/0fCbCmWZGq","The #orangemoronstablegenius doesn't understand how the corona virus got into China. 

They have a GREAT wall. pic.twitter.com/panbamCIbL",
333,"(Fun Read)
McKinsey Publishes Handy 'How To Survive The Coronavirus' Guide For Corporations & Governments | Zero Hedge https://www.zerohedge.com/geopolitical/mckinsey-publishes-handy-how-survive-coronavirus-guide-corporations-governments?utm_source=feedburner&utm_medium=feed&utm_campaign=Feed%3A+zerohedge%2Ffeed+%28zero+hedge+-+on+a+long+enough+timeline%2C+the+survival+rate+for+everyone+drops+to+zero%29 …",I knew this germaphobic President didn’t want to visit the CDC. They had to assure him that no one was infected with Coronavirus. Always thinking of himself first. Not knowing they would have made sure he was safe. He’s just an asshole. https://twitter.com/MarkJacob16/status/1236070466252689408 …,
334,"Trump just put Pence in charge of the Coronavirus response saying he has a “special talent for this..”

The special talent: https://www.huffpost.com/entry/mike-pence-indiana-hiv_n_57f53b9be4b002a7312022ef …","What the coronavirus can teach you about omni-channel, sequential messaging.",
335,Can’t be so. POTUS trump told us yesterday that the US is very well prepared to deal with the coronavirus. Did he somehow exaggerate our preparedness?,#ReadThis SXSW Cancelled Due to the Coronavirus https://ift.tt/2PVPhaF  #nofilmschool #indieFilmmakers,
336,"If you're worried your meth might be contaminated with the coronavirus, don't worry. One police station is here to help you out: https://www.fox32chicago.com/news/johnson-city-police-offers-coronavirus-testing-for-meth-in-facebook-post …",You dont realize how easily feared the population is until the media makes constant stories about the coronavirus. All i gotta say is.... wake up,
337,Trump reportedly put Pence in charge of coronavirus because the VP didn't 'have anything else to do' https://news.yahoo.com/trump-reportedly-put-pence-charge-214911364.html?soc_src=hl-viewer&soc_trk=tw … via @YahooNews,if you know what this is chances are you’ve built an immunity to the coronavirus pic.twitter.com/J09BSTnHY5,
338,#coronavirus is an illusion https://twitter.com/Marxian_Theory/status/1231718369239289856 …,A novel trial design launched by the WHO reduces redundancies to get Covid-19 drugs to patients faster. #coronavirus http://bit.ly/2IjaQxF ,
339,"#Russia reported 8,706 new #coronavirus cases, bringing its cumulative infection tally to 520,129.

https://t.co/EFQrVvYq0E",A Shakespearean handwashing PSA where everyone gets coronavirus except Lady Macbeth.,
340,RT @AFP: #UPDATES Eleven residential estates in south Beijing are locked down due to a fresh cluster of #coronavirus cases linked to the ne…,"Also honestly, I hope to God you didn't get Coronavirus.",
341,"RT @sivaetb: A video that will make you smile. 

Yes, #Covid_19 can be beaten, like 97-year-old Krishna Murti did. 

And the doctor who tre…",Superheros vs. the #coronavirus https://twitter.com/Variety/status/1235352964287651841 …,
342,RT @CDCgov: #Employers: Antibody tests for #COVID19 should not be used to determine if someone can return to work. There is not enough info…,"Dude at my local church I just found out we can't even shake hands with other people during the Mass. We now make the Peace Sign like hippies. ( Btw, I haven't burst into flames yet either.) Pastor told me it was due to the coronavirus outbreak and an edict from the Bishop.",
343,"So sad to hear this. He’s been all over the place with his charity works. God willing, he’ll recover in true boom b… https://t.co/s1O3hz2sV2",South Korean e-commerce firm Coupang stretched by order surge as coronavirus cases jump http://twib.in/l/p65oAnjknjX5  #technologypic.twitter.com/4HfyXXTowm,
344,"RT @DrMonicaCox: All school districts can’t afford the amount of PPE needed to keep people safe when K-12 schools begin. 

Prepare for the…","Breaking: The Village of Glencoe announced Wednesday afternoon that an employee of its Public Works Department was exposed to someone who has a confirmed case of the coronavirus, as reported by our sister paper The @GlencoeAnchor. 

https://www.northbrooktower.com/f/regional/glencoe-village-employee-self-monitoring-under-voluntary-quarantine-after-exposure …pic.twitter.com/KUOBtgRBmH",
345,"RT @_junaidahmad_: Inshallah Get well soon !! ❤
@SAfridiOfficial 
#shahidafridi 
#COVID19 https://t.co/svVl1ggDPu",Interesting website for tracking The corona virus https://coronavirus.app/  #COVID2019,
346,RT @ViolaRoberto: The #DESIeu published today shows important progress of 🇪🇺 #EU Member States in #digital areas like connectivity &amp; #eGov.…,If coronavirus was an actual person,
347,"Masha allah Covid played well today.
Be Positive.",How Many Americans Really Have the Coronavirus? - The Atlantic https://www.theatlantic.com/technology/archive/2020/03/how-many-americans-really-have-coronavirus/607348/ …,
348,"RT @conradjwilson: Women at the Coffee Creek prison in Wilsonville, Ore. say they are being held beyond their scheduled release dates durin…",Does he know about $2700 coronavirus bills or does he still get Canadian single payer?,
349,"RT @MileyCyrus: Spain, you united in solidarity with Black Lives Matter in the US. We must keep standing together to tackle #COVID19 and it…",How Many Americans Really Have the Coronavirus? - The Atlantic ⁦@Ireland0828⁩ ⁦@milesjreed⁩ ⁦@MR_PRIME69⁩ ⁦@_Carja⁩ ⁦@cherokeesher2⁩ ⁦@jkf3500⁩ ⁦@Kris_Sacrebleu⁩ ⁦@yorksterbad⁩ ⁦@JimKilbane⁩https://www.theatlantic.com/technology/archive/2020/03/how-many-americans-really-have-coronavirus/607348/ …,
350,"RT @priyadamini24: #Thread 🧵 

As India’s #COVID19 tally inches towards the 3 lakh mark, here is a thread of IMPORTANT CRUCIAL THINGS THE G…","== Doing Business In Israel ==

http://www.facebook.com/groups/30188572696/ …
#Israel #TelAviv #Haifa #Jerusalem #Business #BusinessInIsrael #DoingBusinessIsrael #Tourism #HiTech
#Jewish #BioTech #Computers #HealthCare #CoronaVirus #CoronavirusOutbreak #Startups #Investment #VC #VentureCapitalpic.twitter.com/xpUuc7kD7f",
351,"Give employees a sense of #belonging as they work virtually or onsite. Here's how to make them feel welcomed, value… https://t.co/K9zPQvJ4Zy","Got a coronavirus question? Ask the expert, Dr. Irfan Hafiz https://www.nwherald.com/2020/03/03/got-a-coronavirus-question-ask-the-expert-dr-irfan-hafiz/adpzqh0/?utm_term=Autofeed&utm_medium=NWHTwitter&utm_source=Twitter#Echobox=1583277825 …pic.twitter.com/bT1mxHWBy9",
352,"Join us in praying for Israel and the world. You can get VFI News wherever you are, through our free VFI News app o… https://t.co/ZecYgwV8YD","As concern about coronavirus (COVID-19) grows, Wilmette community partners are working together to prepare, educate and protect the community. Learn more about the coordinated prevention and planning efforts here: http://bit.ly/32UcwXP pic.twitter.com/YVViIjwy9I",
353,"RT @ilpoliski: 1/6. @GovPritzker has no excuse to extend his shutdown of Illinois. His own data says reopen. Via @Wirepoints 

https://t.co…",Tune in for this discussion now @CBSMiami #coronavirus https://twitter.com/geraldposner/status/1235689936956928002 …,
354,"RT @HundrEDorg: When designing plans for #onlinelearning, districts must focus on:
1. Equitable infrastructure
2. Active learning content
3…","Daily Market Summary - March 5, 2020

 #stocks #finance #coronavirus

Audio highlight here on #soundBYTEapp:https://www.soundbyteapp.com/5dce9bc6-5f35-11ea-87ed-125c0c9de664 …",
355,"RT @IMPACT4HC: Is it safe to go back to the doctor?
IMPACT’s cofounder and Chief Development Officer Dr. Eve Bloomgarden does a Q &amp; A with…","This is very important: Containment of #COVIDー19 is a worldwide effort & it relies on facts, science, & action in all countries & in all 50 #American states. The seriousness of #coronavirus & the effort to keeping #ThePeople safe is being confused by #Trump. Listen to the #WHO.https://twitter.com/DrTedros/status/1235632125006635008 …",
356,"RT @HelenBranswell: 1. The good news: @CDCgov held a full scale #Covid19 briefing today, the first in 3 months &amp; 3 days.
The not-great news…","That'll do it. haha. I consulted ID three times today. Once for coronavirus, but not THAT coronavirus. haha.",
357,"RT @CDCgov: The latest CDC #COVIDView report shows that, after declining for several weeks, the percentage of people testing positive natio…",Let’s harness the power of #artificialintelligence & inter-institutional cooperation to help radiologists characterize #COVIDー19. Imaging correlation w known cases would refine our disease “atlas” & permit identification of evolving trends sooner #coronavirus #ai @AuntMinniehttps://twitter.com/Vilavaite/status/1235660259722579968 …,
358,"So it just kind of looks like a lot was going on and there was nothing that they could really do about it , ya know… https://t.co/54mcNnKyYj",@CDCgov won’t authorize a coronavirus test for a nurse who contracted it from a patient she was treating - WHY won’t they test her?! Why would they deny science? https://twitter.com/chrislhayes/status/1235704384719327232 …,
359,RT @AJOG_thegray: #Maternal Death Due to #COVID19 Disease https://t.co/ydYjgpd4ma #pregnancy #obgyn https://t.co/NasCBXG9OC,Ok but if the olympics get cancelled cause of the coronavirus that is where I draw the line,
360,RT @StaraneShepherd: As we race to find a cure for #covid19 let us remember lessons from our history. #OpEd #theopedproject @RushMedical @r…,"It's a DNA sequence - Coronavirus, maybe?",
361,"RT @AmerMedicalAssn: Immediate-past president of the AMA, @PatriceHarrisMD, sat down with @Forbes, offering advice for patients and physici…","Trump is going to immediately appoint him to the Corona Virus Task Force.  He can hang out with his old buddy Kudlow, another member of the ""wrong so consistently you can set your watch by it"" club.",
362,"Community college chancellor endorses going online-only this fall

#highered #covid19

https://t.co/hLNqAb9odp","""The coronavirus presents an enormous challenge for individuals who are seeking employment. "" https://lnkd.in/eYuc9JN  #TeamAssurant",
363,"RT @WaywardWinifred: Still can't believe how Andrew Cuomo can say with a straight face that he crushed the curve when Hong Kong, with a pop…","The govt's handling of this #coronavirus is abysmal. We have 330 million people and we've tested less than 5000 people.  The govt had the WHO guidelines since Jan and we still do not have test kits.

The #Trump administration is going to kill us.",
364,One of the now withdrawn articles . The data of the “8910”patients was made up . It’s important to realize that not… https://t.co/qAdERVnWob,But @VP has it under control! #coronavirus  https://twitter.com/julialindau/status/1235714275752267776 …,
365,RT @DisMentors: You don't want to miss this Tuesday's @JobsBender Disability Matters show with Dr. Sharelle Barber @HealthEquityDoc  #COVID…,drinkin matcha and editing a new vid!  (in my defense i brought my personal cup and they said they don’t take them rn bc of the coronavirus ) pic.twitter.com/NzWxY24f2X,
366,Anything that gives 100% results is often problematic,"Hope they get coronavirus ""Go Blue""",
367,Antsy for travel but concerned about #COVID19? Plan a mini-road trip to a nearby rest area/unused grassy park. Pack… https://t.co/889wrKwQ9l,"So at my job they were sending people home if they even coughed once because of the Coronavirus, so about half our department faked coughs and left leaving work busy as hell",
368,"RT @RasuShrestha: Technology whose time has come. 

Proud to be the first health system to adopt broadly. Size, ease of use and cost point…",Viral Marketing? Marketing health tourism and the new coronavirus http://upflow.co/l/uvD4 pic.twitter.com/AlTbdzl1C7,
369,I love this app and I love that they are supporting healthcare workers! Thanks @Headspace,"The White House overruled health officials who wanted to recommend that elderly and physically fragile Americans be advised not to fly on commercial airlines because of the new coronavirus, a federal official said. https://www.huffpost.com/entry/white-house-coronavirus-elderly-cdc_n_5e64df61c5b6055728065f86?ncid=engmodushpmg00000004 … via @HuffPostPol",
370,"RT @zen4ever2us: Coronavirus 2nd Wave? Nope, The U.S. Is Still Stuck In The 1st One.

We only plateaued for a short period. Now those numbe…","If you’ve ever ate pacha, you’re immune to Coronavirus",
371,RT @chiefsforchange: CFC member @DCPSChancellor is working to ensure @dcpublicschools remains a stabilizing force amid civil unrest and #CO…,And he was saying this morning that he thought reporters wanted to get Coronavirus so they could give it to him on Air Force One.,
372,RT @Sanath07: My prayers and well wishes to you brother Afridi. Get well soon and continue your good work,People are saying you got the Coronavirus from Matt Gaetz. This is Yuge!,
373,"@CNN Three months too late, and only after the CDC had been attacked and muzzled to protect the hydroxychloroquine… https://t.co/Ox8V7g7Ibd","What is my school doing to combat the corona virus? Well they put a sign outside my dorm saying to wash our hands! Thanks for that piece of information, I never thought of doing that!",
374,RT @TheLancetOncol: New research online: #COVID19 in patients with thoracic malignancies - first results the TERAVOLT registry study #lcsm…,"Payroll taxes go into #Medicare and #SocialSecurity. I have a hard time believing that at the same time that he’s trying to cut these programs he’s also cutting what funds them isn’t connected. 

Trump to propose payroll tax cut over coronavirus | TheHill https://thehill.com/homenews/administration/486706-trump-calls-for-payroll-tax-cut-to-combat-coronavirus …",
375,"The swift increase in #COVID19 knowledge has helped doctors discard treatments that aren't working, and use existin… https://t.co/qworVtoJq9","To address the international COVID-19 outbreak, GBAC®, a division of ISSA, will host a special 2-part webinar series “How to Clean and Disinfect for the Novel Coronavirus SARS-CoV-2” on Wednesday, March 11, and Friday, March 13: http://bit.ly/cmm_daily4030920 … #CMMDaily #HealthAndSafety",
376,Two global pandemics: #covid19 and #racism,Coronavirus is the beginning of the end for universities. First wall to fall is  in-person lectures. Next is paper credentials with no tangible skills.,
377,"RT @Laurie_Garrett: Last night on @maddow I had the chance to lay out where this #COVID19 crisis was back in February, where the #pandemic…","NEW: Officials failed to contact a student at Vaughn Occupational High School, where a special ed aide tested positive for the coronavirus last week. Since then, the student has developed a fever and cough. And she still hasn't been tested. W/ @TomSchubahttps://chicago.suntimes.com/coronavirus/2020/3/11/21175517/cps-coronavirus-illinois-student-vaughn-high-school …",
378,"RT @ASBOUSA: .@ASBOIntl &amp; @AASAHQ in the news: NPR summarizes Senate HELP discussion on safely reopening #schools, refers to our cost-analy…","Faculty @Heartland_CC please contact me to put your F2F content online. I have the resources to help you migrate content quickly. Let me show you our template and some quick tips to get you started. Email or call my cell, let's get prepared.#coronavirus #COVID19 #heartlandonline",
379,Latin America and its global partners toil to procure medical supplies as #COVID19 pushes the region to its limit… https://t.co/9sbrZNO2uA,Bro really just compared the Coronavirus to the Spanish flu lmaoooo goodbye https://twitter.com/AnthonyMKreis/status/1237175285646274562 …,
380,"Visit AAOMS #COVID19 coding and billing guidance to access quick links for testing, payer coverage and reimbursemen… https://t.co/hPQFaYFYNU","Well, so much for the Jazz game in April. Thanks Corona Virus.",
381,.⁦@CNN⁩ has a headline saying Fauci says 2nd #COVID19 wave is “not inevitable” but FAILS to mention the rest of the… https://t.co/xXFadPcICB,"Coronavirus US: How canceled classes and events and self-quarantines save lives, in one chart https://www.vox.com/2020/3/10/21171481/coronavirus-us-cases-quarantine-cancellation …",
382,"RT @dabeard: She said Florida fired her for wanting to tell the truth about the number of residents infected with #COVID19.

Now she's got…","#IMANAWebinar on Coronavirus is LIVE. Join in, please use this link to sign in: https://www.gotomeeting.com/en-ca/webinar/join-webinar … and Webinar ID is 416-055-243

#coronavirus #COVID19 #COVID2019 #COVIDー19pic.twitter.com/JRaNch4tA5",
383,The @AmerAcadPeds has new guidance on summer camps during the #COVID19 pandemic: https://t.co/NO2SGyvYHx https://t.co/3QIW63zgXu,Coronavirus is cancelling shit faster than outrage twitter,
384,"This Crazy, We need help Now! I say it again it Needed Now! @ClaytonMorris @realMeetKevin @cartwright007… https://t.co/QgUd7anKbb","Flattening the curve of the pandemic.

Coronavirus US: How canceled classes and events and self-quarantines save lives, in one chart https://www.vox.com/2020/3/10/21171481/coronavirus-us-cases-quarantine-cancellation …",
