,Positive,Negative
229,,"HOE-VID 19 

ACHOOWhat was thatUh-oh  looks like you just got  corona virus  

Don’t you know Coronavirus   is CUMMING  to America  The world  HOE Organization  is calling HOE-VID19  a POTENTIAL PANTIE-DEMIC "
230,,"Watch @KMPHFOX26's broadcast: Governor Gavin Newsom provides a coronavirus update.

https://www.pscp.tv/w/cUAKBDc3NzEwOXwxUGxLUW16WlJOREtFt5eTd5MBFS1kTs7kKHrFnDaRFQCz6YyLf5M1YgHXKoI= …"
231,,"Spanish football coach Francisco Garcia dies of coronavirus, aged 21 https://www.independent.co.uk/sport/football/european/francisco-garcia-death-coronavirus-malaga-spain-football-coach-leukaemia-a9404566.html …"
232,,Coronavirus prep kit -- 2 months of on-campus apartment isolation here we goooooooo pic.twitter.com/QVSfS8Kujw
233,,"Citing coronavirus, MPCA cancels Line 3 oil pipeline meetings – Twin Cities https://www.twincities.com/2020/03/14/citing-coronavirus-mpca-cancels-line-3-oil-pipeline-meetings/ …"
234,,"Unconscionable.

Especially when they release a daily coronavirus count, as if it has an basis in reality. https://twitter.com/b_stahl/status/1240035671328395265 …"
235,,Penguin videos during the coronavirus are an unexpected bright spot!!  https://twitter.com/SortaBad/status/1240010579432968192 …
236,,"Walz announces closure of Minn. restaurants, bars amid coronavirus concerns https://www.keyc.com/2020/03/16/gov-tim-walz-announce-closure-minn-restaurants-bars-during-press-conference/ …  Be Aware.  Do not fear.  Panic is unnecessary. We are smarter than that! Share it!"
237,,"“.... millennials will be the key to stopping #CoronaVirus because they're the ones who are most likely to be out and about, while also being the least symptomatic”. SERIOUSLY?! Old people are the ones refusing to miss bingo night, hitting up restaurants and traveling."
238,,"That would be the kushner family.

Barr Issues Directive Ordering DOJ To Investigate Coronavirus Scammers. https://flip.it/3-kZ9Z "
239,,Coronavirus is exposing all of the weaknesses in the US health system https://buff.ly/2TVA7Vg  via @voxdotcom
240,,Coronavirus has left some gun ammunition scarce https://trib.al/BuutXFs pic.twitter.com/VeBramSgUj
