,Positive,Neutral,Negative
181,RT @SurendarValasai: #Sindh is fighting against #COVID19 very responsibly putting all its resources and wisdom against the enemy virus. #PT…,Please all pray for my lala😣,RT @Saboor1970: Almost one in ten of all children worldwide are engaged in child labour. #COVID19 pandemic put these vulnerable children at…
182,Get Well Soon Lala ♥️,Imagine the venom that has been fed to the Indian people that they are happy about a sportsman contracting Covid an… https://t.co/cfeYNKrk5R,RT @AFC_489: Take test and recover soon. You've gone above and beyond to help the vulnerable during this pandemic. Unfortunately social wor…
183,RT @FazeelAsgharDMG: Please! It is very important.,"RT @IMFNews: Until #COVID19, #Bangladesh’s economy had been experiencing robust growth. But the crisis has dealt an economic blow. New IMF…",RT @CGTNOfficial: Four regions in #Beijing have upgraded their coronavirus risk level to medium after Beijing confirmed a total of seven lo…
184,I wish you a speedy recovery. Pray for LALA. 😭😭,"RT @_Doctor_KF: Rt plzzzzzzzz
#COVID19 https://t.co/qgKVHt7mFF","RT @Acha__Waqt_: This man was not staying at home. 
He went out, seek for the people who need his help. 
He helped the needy people during…"
185,@SAfridiOfficial Get well soon hero😍😍👍👍May God give you speedy recovery.,"RT @sanafmahmood: Truly thought provoking session by @AliHMokdad and @AnitaEDD w/@AdilHaiderMD on #COVID19 in PK:
-Major challenge:equitabl…","Gautam Gambhir ""Nobody should be infected with this virus. I have political differences with Shahid Afridi but I wa… https://t.co/gFTtt7cIFM"
186,RT @RealHa55an: Get well soon @SAfridiOfficial bhai lots of dua with you 🤲🏻 https://t.co/OkiN1OWX9I,RT @falamb3: Joined by 2 other exceptional citizens of Pakistan @faysalquraishi &amp; @iqrarulhassan on @ARYNEWSOFFICIAL about the excessive bi…,Just had a call with a friend of mine who contracted #covid19 he told me that his doctor was more concerned about t… https://t.co/k3eeqm098Q
187,"RT @MalikAreeb3: May Allah bless you with health 
Ameen 💖🇵🇰.
#shahidafridi",Indian Hindus are happy just because of Afridi's stance on Kashmir. Shame on Banyas.,"RT @Syedhussain72_: #Humanity_matters

We are alarmed at the desperate situation inYemen.The healthcare system is on the brink of collapse:…"
188,"#ShahidAfridi tested positive for Corona Virus. We wish him a speedy recovery.

#afridi #lala #covid19 #coronavirus… https://t.co/MfQsPasdrc",RT @wef: Chart of the day: These countries normally have the highest international tourist numbers https://t.co/JvUVlXxIjS #Tourism #COVID1…,Indians in comments🤢🤢. Literally have never seen more disgusting nation than this nation .
189,Terrible news. Get well soon Lala. Prayers for a speedy recovery in sha Allah🤲,World Bank published its Global Economic Prospects report with glimpse of expected economic fallout of the #COVID19… https://t.co/wixOIHcX9q,"RT @safarnxma: the comments under this post, its shameful that people even after knowing that he’s suffering from corona are writing ‘rip’.…"
190,"she urgently need this but management is not available. Not getting it.
So govt is doing its job still patient and… https://t.co/eUX6z6aWdO","Astounded at dimwitted comparison of Pakistan to #China &amp; #NewZealand, appreciation for them degrading… https://t.co/P3EPDbzgCn",The comments of Indian people under his tweet are downright disturbing and inhumane! IK is willing to lend help to… https://t.co/1I6Tee5U9v
191,RT @cholyaniGALI: #Sindh is fighting against #COVID19 very responsibly putting all its resources and wisdom against the enemy virus. #PTI r…,"RT @indusdotnews: Indus News Headlines | 10:00 UTC | 13 June 2020

Watch #IndusNews Live: https://t.co/TFtz7ERW2o

#IndusNews #NewsHeadline…","#Pakistan’s 1st dedicated,toll-free #cyber #harassment #helpline by @DigitalRightsPK is now providing 24/7… https://t.co/QsnSTkJo75"
192,RT @gmjakhrani: #Sindh is fighting against #COVID19 very responsibly putting all its resources and wisdom against the enemy virus. #PTI reg…,RT @falamb3: Joined by 2 other exceptional citizens of Pakistan @faysalquraishi &amp; @iqrarulhassan on @ARYNEWSOFFICIAL about the excessive bi…,"RT @HerNameIs_Bea: This is so sad news! 

All of #Kashmir is in distress for you #ShahidAfridi and prayers and hope for your speedy recover…"
193,Allah Bless You healthy life,"RT @mirzaiqbal80: May Allah give you health soon Shahid, Aameen https://t.co/5UKYDSLzmv","RT @aisha_mukhtar: #Pakistan’s 1st dedicated,toll-free #cyber #harassment #helpline by @DigitalRightsPK is now providing 24/7 #counselling/…"
194,"Get well soon Lala!
A lot of prayers for your speedy recovery.",Former Prime Minister and Pakistan Peoples Party (PPP) leader Yousaf Raza Gilani is the latest high-profile victim… https://t.co/meyju3CAvM,"Disgusted to read the comments down here :(((((

Sharam choro thori si toh insaaaniyat rakho :("
195,#ShahidAfridi has been tested positive for #COVID19. We wish him speedy recovery . https://t.co/uEC1csT0aB,RT @ameerabbas84: The private hospitals are butchering the people &amp; milking the patients so ruthlessly and not only the present but the suc…,"Gautam Gambhir ""Nobody should be infected with this virus. I have political differences with Shahid Afridi but I wa… https://t.co/HOcTJ3NhnU"
196,Prayers for your speedy recovery Ameen! @SAfridiOfficial,"Get well soon #LaLa 
You were doing hard to support poors in lockdown which is very appreciable. You will defeat… https://t.co/0TPI5JoJVY","RT @globaltimesnews: Beijing has entered a special period, as the capital reported confirmed #COVID19 infections and virus positive cases,…"
197,"We all knew the relief work being done posed a risk for you as a family, but the duas gained from others is pricele… https://t.co/5rlKYlaVJ8",RT @waseem_solangii: Pakistan has lowest life expectancy among those countries in Asia however we are still allocating 80%of the budget for…,RT @HFI1995: Distribution of food packs for #refugee families in #Athens struggling through the impact of #COVID19 in #Greece https://t.co/…
198,RT @betterpakistan: Prayers for your speedy recovery Ameen! @SAfridiOfficial https://t.co/hnPfNagMsU,"— #IshtyaquesCartoons/facebook

 #AmitShah #VirtualRally #Modi #ModiShah #India #Economy #Covid19 #BJP #Performance https://t.co/cwFeJJ6ZAR",Where are the activist judges of Pakistan who would suo-moto on prices of samosas but ignore 1) over pricing of… https://t.co/FtYbHEBHKD
199,Get well soon inshallah,RT @Salman_ARY: Take care of your self brother! Take a lot of vitamins,"I can’t believe people can stoop so low, the replies under this tweet are sick."
200,He is a Great Human With Great Heart  our Prayers are with you Get Well Soon Lala Insha Allah ❤️,RT @queeenamna: this guy literally didn’t care for himself and was going out to help everyone who was affected by the plane crash. he has b…,@betterpakistan If #IK say make lockdown then we will die because we already lost job's and now we doing work every… https://t.co/gniykhrQgM
201,The Punjab government has decided to send recommendations to the federal government for tightening lockdown measure… https://t.co/CvS3LmPX3P,"Insta Follow Done🖤
Follow back plz🖤",RT @globaltimesnews: #Beijing shuts down supermarkets selling salmon over fears of #COVID19 spread. https://t.co/UbPqdExngC https://t.co/0j…
202,Get well soon Lala💕,"We need 
1. Data of wagers affected from Pandemic.
2. Change Business model to cope with changing world.
3. Introdu… https://t.co/iXmSMiPByl","RT @SKMCH: HEALTH WATCH SERIES: CORONAVIRUS 🦠
Can shoes spread the COVID-19 virus?

#Coronavirus #COVID19 #CoronaVirusUpdates #SKMCH https:…"
203,I wish you  a speedy recovery and robust health @SAfridiOfficial,"@EverestToday I'm from this place, Skardu. Our Pakistani PM has ordered to open the tourist sites under SOPs. #COVID19","Unfortunately, earlier this week, I've been tested Positive for #COVID19.
I've taken isolation at home for more tha… https://t.co/2MoA9HpJe7"
204,A Beautiful painting was done in honor of all the dead grandparents of #COVID19 who couldn't say goodbye to their g… https://t.co/IgK9sU27kH,What a tragedy..,"RT @Saudi_Gazette: #BREAKING: #SaudiArabia announces 3366 new #coronavirus cases, bringing the total number of cases in the kingdom to 123,…"
205,Get well soon Lala.,"The man who provided the needy with foods in each &amp; every corner of Pakistan throughout this tough time,tests posit… https://t.co/xzEQyCnnsj","RT @RahimNasari: #India is all set to achieve #15TrillionDollarGDP this year, but Pakistan is facing the worst economic deterioration at al…"
206,"Prayers are with u LaLa❤️🤲
Get well soon InShaAllah
#LoveYou
#Covid19 https://t.co/ps3kQs4ez7",My son Usman’s painting on #Covid19. Globe wearing mask to avoid virus. https://t.co/zQ90BwN8EG,"RT @MahmoodK69: Sad to watch @ImranKhanPTI telling people of Lahore, that they are not following #COVID19 SOPs.

Only the people can save t…"
207,"RT @KB_BUT: I hope you find fast healing with each and every day my brother 
Feel better soon",RT @SaeedGhani1: My son Usman’s painting on #Covid19. Globe wearing mask to avoid virus. https://t.co/zQ90BwN8EG,"RT @steve_hanke: In #Modi's #India, #COVID19 victims are treated worse than livestock. Bodies are being tossed into the garbage. #Hospitals…"
208,RT @DanishKaneria61: Get well soon!,RT @SaeedGhani1: My son Usman’s painting on #Covid19. Globe wearing mask to avoid virus. https://t.co/zQ90BwN8EG,"#shahidafridi
#ShahidKhanAfridi
I’ve been feeling unwell since Thursday; my body had been aching badly. I’ve been t… https://t.co/wFv5MCWyVS"
209,its very good step,RT @waseem_solangii: Pakistan has lowest life expectancy among those countries in Asia however we are still allocating 80%of the budget for…,"https://t.co/01BMRmQZZP
As at least 22 U.S. states experience #Covid19 infection spikes, both Dr. Anthony Fauci and… https://t.co/bXLv9xosAx"
210,Get well soon Lala.. you will inshAllah fight this one out too exactly the way you fought and succeeded against all… https://t.co/PrHWSplDee,RT @SaeedGhani1: My son Usman’s painting on #Covid19. Globe wearing mask to avoid virus. https://t.co/zQ90BwN8EG,"you are the well-wisher as a human, don't worry Lala,"
211,Get Well Soon...,RT @falamb3: Joined by 2 other exceptional citizens of Pakistan @faysalquraishi &amp; @iqrarulhassan on @ARYNEWSOFFICIAL about the excessive bi…,"RT @HarvardChanSPH: Adults with non-allergic asthma are at higher risk of developing severe illness if infected with #COVID19, according ne…"
212,"Wish for your speedy recovery❤
Get well soon🌸",@iqrarulhassan Violating basic #SOP for #Covid19 of #socialdistancing by handshake and pat on the back by apparentl… https://t.co/wfYCHsdqs8,"RT @UN: #COVID19 mobility restrictions have left women &amp; girls facing increased risks of domestic violence.

Around the world, the UN is wo…"
213,May Allah make you healthy and give you long life lala❤,"RT @WahOyeAdil: Le Imran khan in the start of every khitab :
#COVID19 
#ImranKhan 
#coronavirus https://t.co/tbjJt0Wjz9",#Cyber #harassment is on the rise since #COVID19 outbreak. We are working with @DigitalRightsPK to provide… https://t.co/btbhpGNpcN
214,All prayers for you... We wish you speedy recovery...❤,RT @SaeedGhani1: My son Usman’s painting on #Covid19. Globe wearing mask to avoid virus. https://t.co/zQ90BwN8EG,Lala @SAfridiOfficial you worked really hard to help the needy people during this pandemic. You are a true fighter… https://t.co/iaZAKp5147
215,RT @bbctms: From everyone here @bbctms we wish you a speedy recovery Shahid.,RT @Salman_ARY: Take care of your self brother! Take a lot of vitamins,RT @realimrannazir4: Lala @SAfridiOfficial you worked really hard to help the needy people during this pandemic. You are a true fighter ⭐️…
216,Get well soon Sir,"No soap? No running water? 
Handwashing is still possible! 

#COVID19 https://t.co/5QNwVpaOGg","Brazil virus death toll now world’s second-highest

#ARYNews #COVID19 #CoronavirusUpdates"
217,RT @AdilabbasiAry: I wish you  a speedy recovery and robust health @SAfridiOfficial,RT @SaeedGhani1: My son Usman’s painting on #Covid19. Globe wearing mask to avoid virus. https://t.co/zQ90BwN8EG,"RT @ARYNEWSOFFICIAL: Brazil virus death toll now world’s second-highest

#ARYNews #COVID19 #CoronavirusUpdates"
218,RT @MalikAliMukhtar: A Beautiful painting was done in honor of all the dead grandparents of #COVID19 who couldn't say goodbye to their gran…,RT @SaeedGhani1: My son Usman’s painting on #Covid19. Globe wearing mask to avoid virus. https://t.co/zQ90BwN8EG,RT @Ali_Abbas_Zaidi: Where are the activist judges of Pakistan who would suo-moto on prices of samosas but ignore 1) over pricing of #COVID…
219,"Get well soon lala..
May Allah bless you with good health
Ameen..",Sir Sindh govt need lockdown plz it's a request 🙏,Thread: HRCP is deeply concerned by news from the Middle East where hundreds of thousands of Pakistani #labourers -… https://t.co/z8hGKFniG2
220,Health is bigger than photoshoots n politics. Take care of yourself.  Get well soon 🤲,RT @PakPMO: Prime Minister @ImranKhanPTI urged the nation to follow SOPs. He said that the impact of #COVID19 can be reduced if we  follow…,"RT @TheFedz889: People are charging money to donate plasma?? 

We've become morally bankrupt. Bas koi na koi jugaad lag jai bhench*d. Kisi…"
221,May Allah grant you a speedy recovery. Ameen.,RT @SaeedGhani1: My son Usman’s painting on #Covid19. Globe wearing mask to avoid virus. https://t.co/zQ90BwN8EG,RT @HRCP87: Thread: HRCP is deeply concerned by news from the Middle East where hundreds of thousands of Pakistani #labourers - now jobless…
222,Get well soon Lala!!! We need you 🤗🤗 #shahidafridi @SAfridiOfficial #Lala,RT @falamb3: Joined by 2 other exceptional citizens of Pakistan @faysalquraishi &amp; @iqrarulhassan on @ARYNEWSOFFICIAL about the excessive bi…,"Misbah-ul-Haq — ""It was not Haris Sohail but his family who had concerns on tour to England due to #covid19 and we'… https://t.co/Jdr8ZIRYOg"
223,RT @betterpakistan: Prayers for your speedy recovery Ameen! @SAfridiOfficial,"RT @DdaengLifeUnite: 🥳💜#ForeverWith7💜🥳
BTS 7th Anniversary  

Fundraiser for Hope Bridge Korea Disaster Relief Association, (@relief_sos) h…",RT @SF360Digital: -@GautamGambhir &amp; @SAfridiOfficial have been involved in many grapples but here Gambhir has a special message for #shahid…
224,RT @betterpakistan: Prayers for speedy recovery of former PM Gillani. Ameen! A PM who who was most regular in assembly sessions. @KasimGill…,"A doc, who heads a govt run hospital in Pindi, told me not only more ppl are reporting with #Covid19, there has bee… https://t.co/XXVvFKaNNN","PM Khan rejects the proposal for complete lockdown in Punjab

https://t.co/yvF41ZYpM2

#BaaghiTV #Covid19 #Health… https://t.co/1plCQ1L9m0"
225,Get well soon lala. ❤️,"RT @HolaItsAk47: ""God helps those who help others""
Lala you have been helping the poor. so don't worry you are under Allah's protection. In…","So so sad news on the internet for today.
Allah sehat-o-tandrusti dyy aap koo. Ameen."
226,"Lala tested Positive for COVID 19 let's pray for Lala. ❤
The man who helped peoples in Rural areas instead of sitti… https://t.co/xHMvqmNDkq","May Allah grant u Health as soon as possible...
#Covid_19",Even Gambhir talking sanity 2020 really be wild
227,RT @iamaquid: Get Well Soon Lala ♥️,Please pray for him. And for everyone who is having hard time in this pandemic. Love you @SAfridiOfficial,"#HopeNotOut #shahidafridi 
#Lala 
May Allah give you health and strength to get back and help the needy people. Aam… https://t.co/pRWGDcfuXD"
228,"RT @Sepideh_Z: #Ali_Younesi, a 20 yr old gold-medal winner of the International Olympiad on Astronomy and Astrophysics, has contracted #COV…",RT @Salman_ARY: Take care of your self brother! Take a lot of vitamins,"""In a world that has commodified everything-- from life saving drugs to critical healthcare to education and even c… https://t.co/VMEMx5vIr5"
229,"RT @PeshawarZalmi: Zalmi Family wishes you a speedy recovery! ⚡
Our prayers are with you✨

#StayHome #HopeNotOut #COVID__19",I m very sad to hear the U R suffering from CoViD_19.I hope inshallah you recover as well as soon.May Allah accept… https://t.co/AlaBY6hezP,"i was having pain in my body and lost the sense of smell. unfortunately, i got tested , i am covid-19 positve and i… https://t.co/x1spFUjVbY"
230,God bless u my champion insha Allah u will be better soon ya Allah please help lala to get rid of this Pandemic 🙏🙏,"Afrid risked his life for the people of pakistan, hope recovers soon.","RT @HerNameIs_Bea: Sweden does not only have the worst #Covid19 strategy &amp; a deeply flawed foreign policy (nothing ""neutral"" about us). We…"
231,"Whole Nations Prayers are with You Lala.
Get well soon Legend.
#COVID19 #pandemic #staysafe #stayhome","RT @ANI: #WATCH We appointed a team of scientists after #COVID19 outbreak. Firstly, simulation was done&amp;compounds were identified which can…",Coronavirus Symptoms and treatment : Consult your doctor & family physicians as soon as possible if you are concerned about your indications or have a travel history to a country where critical coronaviruses are known to happen. https://pin.it/WWPOJ6Y6BE36HX  via @pinterest
232,"Former PM Yousuf Raza Gilani tests positive for coronavirus
https://t.co/zWG3GpyUJ9
@MediaCellPPP #COVID19… https://t.co/t2kGFPZVw7","RT @USEFP: UPDATE: #USEFP test centers will remain closed until June 30, 2020.

#COVID19 https://t.co/TTqOT3yPQ0",Arundhati Roy on Delhi violence: ‘This is our version of the coronavirus. We are sick’ https://scroll.in/article/954805/arundhati-roy-on-delhi-violence-this-is-our-version-of-the-coronavirus-we-are-sick …
233,"RT @iMehakShahid: Pakistan cricket team's former captain Shahid Afridi tested positive for #COVID19 and Let's wish him speedy recovery. 
Ge…","Our #SAF team tirelessly continues #DonateKaroNa Ration Drive with the assistance of @IDRFcanada in Shikarpur, Sind… https://t.co/B2m1XWDF2n",Sindh government closes school for fear of coronavirus – Pakistan https://instant.com.pk/2020/03/sindh-government-closes-school-for-fear-of-coronavirus-pakistan/ …pic.twitter.com/YWLYQnuw50
234,Get well soon ♥️,"RT @qureshik74: A big FUCK YOU to all the people who are taking money for their plasma!! 

#COVID19",Senators stress that they will be fine during a coronavirus outbreak and will not need to stop Congress https://instant.com.pk/2020/03/senators-stress-that-they-will-be-fine-during-a-coronavirus-outbreak-and-will-not-need-to-stop-congress/ …
235,"RT @PeshawarZalmi: Zalmi Family wishes you a speedy recovery! ⚡
Our prayers are with you✨

#StayHome #HopeNotOut #COVID__19 https://t.co/99…",RT @Salman_ARY: Take care of your self brother! Take a lot of vitamins,"Done with dinosaurs with opinions that deny people their fundamental rights.

The only bright side is the Corona virus will kill them all."
236,May Allah Almighty bless you lala with speedy recovery😭♥️,RT @SaeedGhani1: My son Usman’s painting on #Covid19. Globe wearing mask to avoid virus. https://t.co/zQ90BwN8EG,The embryonic coronavirus epidemic in the United States leads to buying hysteria beforehand !! https://instant.com.pk/2020/03/the-embryonic-coronavirus-epidemic-in-the-united-states-leads-to-buying-hysteria-beforehand/ …pic.twitter.com/1smXpp3xzM
237,Get well soon Cheete 💚💚,RT @PunjabEnergy: My opinion article on #COVID19 and the resilience of our nation to come out of the pandemic ultimately. #StayHomeStaySafe…,"MAKKAH is the place where dying soul gets life and by closing it we are making it worst #coronavirus is the sign that if there will be 100 kids in 1 family 99 kids will die and 1 will live thats whats happening around the word we humans forgot 
#Makkah #SaudiArabia #Arab #Islam"
238,"Health is the first &amp; greatest of all blessings! 
 
Good health presents us with numerous opportunities to work, cr… https://t.co/Ao9gMhK4WL",RT @SaeedGhani1: My son Usman’s painting on #Covid19. Globe wearing mask to avoid virus. https://t.co/zQ90BwN8EG,"WTF 
What kind of virus it is ? 
This is not a presentation of Corona Virus 
Collapsing is a very LATE Sign - Terminal 
That could relate to any disease"
239,May Allah Almighty bless you with speedy recovery &amp; good health .. Aameen 🤲🏻 🤲🏼,RT @ameerabbas84: The private hospitals are butchering the people &amp; milking the patients so ruthlessly and not only the present but the suc…,"Within span of weeks, locust attacks, treat of disease (#coronavirus or leishminasis) and now floods ravaging south K-P! For some, it may already be the #endofdays"
240,Get well soon 💚😢,"Last 3 hours Left! Pls Vote &amp; Retweet✍️
Pls take COVID-19 Seriously🙄
Daily 100+Deaths in #Pakistan only from… https://t.co/BnCCqTU3Z0",Coronavirus symptoms and signs   BBCURDU https://youtu.be/y_x0hIMn2QA  via @YouTube
241,Pray for your speedy recovery.,RT @SaeedGhani1: My son Usman’s painting on #Covid19. Globe wearing mask to avoid virus. https://t.co/zQ90BwN8EG,"At the start of 2020, The United States of America was busy killing #Soleimani when it should've been taking precautions against Corona Virus. #CoronavirusPandemic #COVID19outbreak #COVIDー19 #Covid_19"
242,May you get well Soon,"GET WELL SOON my Jaan...Stay blessed . bounce back LALA...see Corona as Ashwin and hit,punish Corona out of the bou… https://t.co/cpAUptxBAt","OBVIOUSLY Chinese Americans are not to blame for the CHINESE CoronaVirus.

It's the CHINESE government that is responsible for LYING to the international community about the pandemic at the early stages.

Fake News needs to STOP pretending this is about race, report the truth!"
243,Get well soon Lala ✨,RT @falamb3: Joined by 2 other exceptional citizens of Pakistan @faysalquraishi &amp; @iqrarulhassan on @ARYNEWSOFFICIAL about the excessive bi…,One dead from coronavirus every 10 minutes in Iran as shortages forces medics to treat sick without masks https://www.independent.co.uk/news/world/middle-east/coronavirus-iran-update-death-toll-medical-shortages-facemasks-a9411416.html …
244,"#PakistanFightsCorona 
#COVID19Pakistan 
#cricketnews 
@ObnoxiousBrat
 Get well soon @SAfridiOfficial",GWS next pm,"There should be lockdown in Pakistan with exceptions of groceries & pharmacies.
Fix a time and go on a mandatory lockdown every day.
Difficult steps need to be taken.
#StayHome #Corona #CoronaVirusPakistan @PTIofficial @ImranKhanPTI @SMQureshiPTI @UsmanAKBuzdar
#coronavirus"
245,"RT @mushiafridi10: We all knew the relief work being done posed a risk for you as a family, but the duas gained from others is priceless. D…",RT @SaeedGhani1: My son Usman’s painting on #Covid19. Globe wearing mask to avoid virus. https://t.co/zQ90BwN8EG,"Theory According to #coronavirus 

Divided We Stand,
United We Fall!

#CoronaInPakistan #CoronaVirusUpdate #COVID2019 #CoronavirusOutbreak #PakistanFightsCorona #Covid_19 #CoronaVirusChallenge #COVID"
246,Get well soon Boom Boom,RT @ameerabbas84: The private hospitals are butchering the people &amp; milking the patients so ruthlessly and not only the present but the suc…,"IMPORTANT: If you have symptoms of the new coronavirus, DO NOT visit a doctor's office or hospital. Call Rescue

This will help prevent spreading the virus to other patients.#coronavirusinpakistan #HighRiskCovid19"
247,Fast Recovery Lala,RT @falamb3: Joined by 2 other exceptional citizens of Pakistan @faysalquraishi &amp; @iqrarulhassan on @ARYNEWSOFFICIAL about the excessive bi…,Health secretary Hajam Zafar Mirza should be arrested for his actions he dangerous than coronavirus arrest him nowwwwwwwwwww
248,"our prayers are with you legends , get well soon , how u work in this pandemic for poor , we are sure allah will ac… https://t.co/AgoSnSFDc5","RT @UNYouthEnvoy: Joined @DrTedros for @WHO press briefing on #COVID19 today!

My msgs:
1⃣Recovery plans should account for adolescents &amp; y…",
249,"Get well soon lala @SAfridiOfficial  
@HNOofficial pray for speedy recovery of lala",RT @SaeedGhani1: My son Usman’s painting on #Covid19. Globe wearing mask to avoid virus. https://t.co/zQ90BwN8EG,
250,Get well soon LALA 😢❤️,"Im dying inside.😭😭😭😭💔  Im worry about yuh.
You're very special to us. 
May Allah give you speedy recovery FROM Covi… https://t.co/TAc17SWgFW",
251,RT @Sanath07: My prayers and well wishes to you brother Afridi. Get well soon and continue your good work https://t.co/H2VM4XKvGi,RT @ameerabbas84: The private hospitals are butchering the people &amp; milking the patients so ruthlessly and not only the present but the suc…,
252,RT @Sanath07: My prayers and well wishes to you brother Afridi. Get well soon and continue your good work,RT @falamb3: Joined by 2 other exceptional citizens of Pakistan @faysalquraishi &amp; @iqrarulhassan on @ARYNEWSOFFICIAL about the excessive bi…,
253,"Get well soon lala. You have countless prayers with you... 
#LaLa",Loads of prayers for lala,
254,May ALLAH bless u with speedy recovery AMEEN🤲🏻,Lots of prayers for u lalaa,
255,Get Well Soon My Champ 👍🏻,RT @ameerabbas84: The private hospitals are butchering the people &amp; milking the patients so ruthlessly and not only the present but the suc…,
256,"Get well Soon LALA
#shahidafridi","RT @HolaItsAk47: ""God helps those who help others""
Lala you have been helping the poor. so don't worry you are under Allah's protection. In…",
257,Get well soon Lala 🤲🏻,"RT @qureshik74: A big FUCK YOU to all the people who are taking money for their plasma!! 

#COVID19",
