,Positive,Negative
87,God bless America! 💸💸💸🤦🏻‍♂️#seattle #coronavirus #COVID19 https://t.co/ETQMSYoH9t,"Chinese scientists identify new coronavirus as cause of Wuhan pneumonia. Awaiting more information regarding epidemiology, sequence and relationship to other know coronaviruses. https://www.wsj.com/articles/new-virus-discovered-by-chinese-scientists-investigating-pneumonia-outbreak-11578485668 …"
88,The best 2020 collab,"Apparently there is a new strain of coronavirus, different from SARS, involved in the Wuhan outbreak in China https://twitter.com/arambaut/status/1215009946401726464 …"
89,"Civil War is the most ambitious crossover of all time.
Pedro Sánchez: Hold my beer","WSJ Report Links Novel Coronavirus To Wuhan #Pneumonia Cluster. This virus seems to be quite similar to some previously described bat-borne Coronavirus. No oficial information was released yet. 
https://afludiary.blogspot.com/2020/01/wsj-report-links-novel-coronavirus-to.html?m=1 …pic.twitter.com/FdJC5kfsOW"
90,"RT @nigewillson: Robots Help Employees Stay Safe During COVID-19 https://t.co/pFTN8gKzsN
#ai #ArtificialIntelligence #MachineLearning #Deep…","The culprit behind the pneumonia cases in China could be a new strain of coronavirus, according to latest news. https://www.wsj.com/articles/new-virus-discovered-by-chinese-scientists-investigating-pneumonia-outbreak-11578485668 … via @WSJ"
91,Our handsome president acting up,More details emerge on new coronavirus in Wuhan cluster | CIDRAP http://www.cidrap.umn.edu/news-perspective/2020/01/more-details-emerge-new-coronavirus-wuhan-cluster …
92,Hanna Montana sliding into your DM's like :,New #Coronavirus Discovered by Chinese Scientists Investigating Wuhan #Pneumonia Outbreakhttps://www.wsj.com/articles/new-virus-discovered-by-chinese-scientists-investigating-pneumonia-outbreak-11578485668?redirect=amp#click=https://t.co/pu2y2wUdBz …
93,RT @CDCgov: #Employers: Antibody tests for #COVID19 should not be used to determine if someone can return to work. There is not enough info…,"China releases genetic data on new coronavirus, now deadly | CIDRAP http://www.cidrap.umn.edu/news-perspective/2020/01/china-releases-genetic-data-new-coronavirus-now-deadly …"
94,May Allah protect him... 🤲🏻,"Wuhan health committee update concerning novel coronavirus outbreak

http://wjw.wuhan.gov.cn/front/web/list2nd/no/710 …"
95,RT @TheLancetOncol: New research online: #COVID19 in patients with thoracic malignancies - first results the TERAVOLT registry study #lcsm…,"RT @UN: .@WHO working with officials in Thailand & China following confirmed case novel coronavirus.

Latest updates, including tips on how to stay healthy.: -  http://bit.ly/2Ri9g33 pic.twitter.com/eqW78hCJ7D"
96,RT @ASPENWEB: Now available in Spanish! ASPEN Report on Nutrition Support Practice Processes with #COVID19: The First Response. https://t.c…,China says human transmission not ruled out in Wuhan coronavirus outbreak https://www.scmp.com/news/china/society/article/3046173/china-says-human-transmission-not-ruled-out-wuhan-coronavirus … vía @scmpnews
97,"RT @MsPhelps: A number of publishers (incl. ACS, Elsevier, SpringerNature, Wiley) reserve the right to have #COVID19-related papers removed…","WHO statement on novel #coronavirus in #Thailand  ""It is essential that investigations continue in #China to identify the source of this outbreak and any animal reservoirs or intermediate hosts""

 http://ow.ly/F7Jk50xVPf3 pic.twitter.com/Di7dLuyoVV"
98,best crossover,WHO Rolls Out Global Measures to Limit Transmission of New Coronavirus http://www.laht.com/article.asp?ArticleId=2487710&CategoryId=13936#.Xh5nW3Xq7JY.twitter …
99,this is the best of both worlds,Thailand reports case of coronavirus from China #coronavirus #china #thailandhttps://apnews.com/5307c95572c3266e78842338d332a0d6 …
100,"RT @helenbevan: A graphic drawn by one of the best psychologists on Twitter, @Haypsych on the benefits of psychological safety. Hayley has…","It Is “Essential” for China to Continue Investigating the Source of a Previously Unknown Strain of coronavirus, as Thailand Case Emerges – World Health Organization http://human-wrongs-watch.net/2020/01/14/it-is-essential-for-china-to-continue-investigating-the-source-of-a-previously-unknown-strain-of-coronavirus-as-thailand-case-emerges-world-health-organization/ …pic.twitter.com/s1JgCmcW4K"
101,"RT @David_rp90: 4 behaviors that will help you lead your team during a crisis. 

 #WorkHappy #COVID19 #employerbranding #talent #leadership…",""" The Shanghai Public Health Clinical Center & School of Public Health is releasing a #coronavirus genome from a case of #WuhanPneumoniaie outbreak. The sequence has also been deposited on GenBank (accession MN908947) and will be released as soon as possible."" https://twitter.com/JeremyFarrar/status/1215911599191490560 …"
102,RT @RoySocChem: Join us on June 18 for the second webinar in the 'Building a better chemistry culture' series to explore the challenges and…,Viral pneumonia outbreak in China has been linked to a novel coronavirus (MERS and SARS are both coronaviruses). http://virological.org/t/initial-genome-release-of-novel-coronavirus/319 …
103,"ALL RIGHT, Miley Cyrus!!!",Pressure builds on China to share info on new coronavirus http://www.cidrap.umn.edu/news-perspective/2020/01/pressure-builds-china-share-info-new-coronavirus …
104,Ours is a strong commitment miley,"A new virus has arrived on the scene, leaving patients with #pneumonia.  But is this a brief here-today-gone-tomorrow outbreak or the first sign of something far more dangerous?

 http://ow.ly/WUGX30q8ksT  via @BBC
#China #Coronavirus #GlobalHealth"
105,I've found a vaccine for #Covid19.  A metal stick and a posh accent. https://t.co/3QtsLsastI,wonder if this has been done on purpose to stop the Hong Kong protests people will be wary of mass meetings spreading the corona virus
106,RT @abelplanelles: The best of both worlds,Patient in Japan #infected with new #coronavirus from #China. German scientists develop test to diagnose so-called novel coronavirus 'in a very short period of time.' http://bit.ly/38cdQ9X 
107,"RT @VamosHazard: 🗞 MARCA: HAZARD IS READY TO SHINE 

• The Belgian is surprising his own teammates with his high level in training after th…","A novel coronavirus is causing Pneumonia in China, and cases in Japan and Thailand from travelers have already emerged.

Reminds me a bit of the H1N1 pandemia.

https://www.who.int/csr/don/14-january-2020-novel-coronavirus-thailand-ex-china/en/ …"
108,".@MileyCirus, you mighn't know that Spain still owns an UNIVERSAL and strong public health care system. 

In the US… https://t.co/WlRjGc0Adw",China: Possible that new virus could spread between humans #coronavirus https://apnews.com/89facb95962d7d20d1377ae0c2ac0eed …
109,Mr. Handsome in the house 😍,Coronavirus: China reports 17 new cases of Sars-like mystery virus https://www.theguardian.com/world/2020/jan/19/coronavirus-china-reports-17-new-cases-of-sars-like-mystery-virus?CMP=share_btn_tw …
110,Sanchez is cert excited he might get to meet Hannah Montana,Coronavirus: China reports 17 new cases of Sars-like mystery virus | China - The Guardian https://www.theguardian.com/world/2020/jan/19/coronavirus-china-reports-17-new-cases-of-sars-like-mystery-virus …
111,Oh wow,"Coronavirus, a Large Family of Viruses that Has Not Been Previously Identified in Humans – World Health Organization  http://human-wrongs-watch.net/2020/01/19/coronavirus-a-large-family-of-viruses-that-has-not-been-previously-identified-in-humans-world-health-organization/ …"
112,"“Ours is a strong commitment, Miley”. El 2020 acaba de tocar techo. 😂","New Coronavirus Outbreak Kills 2 in China, Spreads to Japan and Thailand https://www.thedailybeast.com/new-coronavirus-outbreak-kills-2-in-china-spreads-to-japan-and-thailand …"
113,Like a Sir. LOL.,"Estimating the potential total number of novel Coronavirus cases in Wuhan City, China
@imperialcollegehttps://www.imperial.ac.uk/mrc-global-infectious-disease-analysis/news--wuhan-coronavirus/ …"
114,Hannah Montana feat Mr Handsome,"Wuhan Health Commission Adds 17 New Coronavirus Cases (ttl=62).

Of these 17 cases did not have apparent contact with the Wuhan Seafood Market, and were tested because they were hospitalized with unidentified pneumonia at other facilities in Wuhan.

https://afludiary.blogspot.com/2020/01/wuhan-health-commission-adds-17-new.html …"
115,RT @MileyCyrus: All across Ireland 🇮🇪 citizens joined in solidarity with Black Lives Matter in the US. We must stay united with the world t…,New #coronavirus could hurt Chinese GDP at a bad time — and #Japan's if it spreads. http://bit.ly/2v1Rda6  #healthcare #economy #China
116,RT @ss_suryawanshi: Big relief those what to take the #COVID19 swab test. Maharashtra government reduced the #COVID19 swab testing cost in…,Three U.S. Airports to Check Passengers for a Deadly Chinese Coronavirus http://dlvr.it/RNHWY7  via @TravelOnSkillpic.twitter.com/EW3DCO3vUx
117,"RT @telesurenglish: #Cuba | ""We knew how to do it, we did it well which was what was needed and we saved lives.""

#Italy #COVID19 #CubaSalv…",China Confirms 2nd Death from New Coronavirus http://www.laht.com/article.asp?ArticleId=2487816&CategoryId=13936#.XiJf-wxQ9lU.twitter …
118,"RT @savanamedica: 📈🦠The first BigCOVIData results have been published!

The study, led by the researchers Dr Izquierdo, Dr Soriano &amp; Dr Anc…",China Confirms 2nd Death from New Coronavirus: China has confirmed a second death due to a… https://goo.gl/fb/qt6198 
119,"&gt;ACT-Accelerator

@AngPunished was right.","http://NPR.org  : CDC To Screen For New Strain Of Coronavirus At 3 U.S. Airports. The origin?: a seafood and live animal market for human consumption. #foraveganworld
https://text.npr.org/s.php?sId=795343026 …"
120,RT @captainmisbahpk: May Allah give you speedy recovery @SAfridiOfficial,"#Japan #Chinesevirus #concerning #Asianews #China #virus #deadly #UKnews #EUnews #USnews #news #worldnews
Japan has confirmed its first case of infection from a newly-identified coronavirus that has killed one person and infected at least 40 more in... https://reut.rs/3ae2hkt "
121,"RT @janedoeolympia: ""Ours is a strong commitment, MILEY."" https://t.co/KYZk8QW5kl",Japan Confirms 1st Case of New Coronavirus Infection: The first case of a pneumonia-like… https://goo.gl/fb/m4SHPE 
122,"RT @BrexitBin: Get your priorities right, UK!

While fights are erupting about tearing down statues, this government is busy tearing down t…",Japan Confirms 1st Case of New Coronavirus Infection http://www.laht.com/article.asp?ArticleId=2487775&CategoryId=13936#.XiEYAgH-6GU.twitter …
123,RT @Ivaaaaaaaaik: Mr handsome ft Miley Cyrus?,"Latest on coronavirus: Wuhan medical staff being infected at faster pace, Japan marked second case https://s68mv.app.goo.gl/D5QvG  #China #Politics #RiskAppetite #NewsTrading"
124,Pdr is coming like a wrecking ball.,"#Gold: Steady above $1,560 amid fears of China’s coronavirus outbreak http://ow.ly/PsFh50y3zWd "
125,RT @simcim: In this candid @ILO #COOP Interview on the occasion of #ILOCOOP100 @LegacoopN President @mauro_lusetti speaks of his work with…,"Eurosurveillance | Real-time tentative assessment of the epidemiological characteristics of novel coronavirus infections in Wuhan, China, as at 22 January 2020 https://www.eurosurveillance.org/content/10.2807/1560-7917.ES.2020.25.3.2000044 …"
126,"RT @Austinpublisher: If You Do Any of These 3 Things, Your Leadership Skills Are Better Than Those of Most Managers. Sound leadership princ…","Yep reckon you’re right,Wombats,between the smoke and coronavirus I’d say they’d be difficult to find but not impossible,honestly reckon Bunnings or Mitre 10Ian"
127,Top 5 anime crossover,The nCoV2019 API for Wahun outbreak monitoring is now available!https://rpst.page.link/qhcZ  #publichealth #hospitals #infectiousdiseases #healthcare #pandemic #coronavirus #ChinaCoronaVirus #coronaviruesue #nvoc2019 #2019ncov #Wuhan #WHO #WuhanCoronavirus #digitalhealth #apipic.twitter.com/4naxvVpLVC
128,RT @arabnews: #WATCH: Popcorn at the ready! @Mouna_ElHaimoud in #Madrid for Arab News as the city's cinemas reopen in #Spain's second phase…,"Bro I'm not saying eating cows, chickens, pigs, etc is better BUT y'all really surprised if the origen of the coronavirus is a bat or a FREAKING RAT soup.
Anyway move along, nothing to hate here."
129,"RT @pocusmeded: Nice review of common #covid19 lung #pocus findings from China. 

https://t.co/YfWEkX9I7S
#FOAMed #echofirst","As China’s epidemic continues to spread, things may seem scary. Here are ten simple precautions that can protect you from contracting the coronavirus. https://foreignpolicy.com/2020/01/25/wuhan-coronavirus-safety-china …"
130,"NZD/USD registers four-day winning streak, coronavirus news in focus https://s68mv.app.goo.gl/v5M5m  #NZDUSD #Coronavirus #Macroeconomics #RiskAppetite #Markets",My flu is so hardcore Corona virus is scared of it
131,Are you telling me you have to pay 3k dollars in USA in order to check if you have coronavirus when It is totally free in Spain?  https://twitter.com/AlanBarrosoA/status/1234801142892199940 …,"#CoronaVirus (The Virus) Infection Update 

USA  #56 (+2) 

UK  #13 (+4) 

China  #1 (+900)

Spain  #57 debut (+1) https://twitter.com/el_pais/status/1221174723775815680 …"
132,"? AIDS medications are effective against coronavirus, do you still think it's just the flu?",Wilbur Ross Says Coronavirus Could Bring Jobs Back to the U.S. http://dlvr.it/RP4tkS pic.twitter.com/PMVppgVill
133,Coronavirus: Apple CEO Tim Cook tells employees to work from home - Business Insider https://www.businessinsider.com/coronavirus-apple-tim-cook-tells-office-workers-work-from-home-2020-3 …,Coronavirus: Wuhan shutting down outbound travel as coronavirus spreads. Ok they should have not let these people in Sydney. They should consider closing flights in and out of China https://www.9news.com.au/world/coronavirus-passengers-arriving-in-sydney-scanned-for-deadly-outbreak/e31ecfeb-e90d-4103-be67-539180a544e5 …
134,"@JoeBiden Come on man, this is malarkey, if anyone should ""shut up"" it should be you: Biden on Trump's coronavirus response: 'I wish he would just be quiet'",Coronavirus: Wuhan to shut public transport over outbreak - BBC News https://www.bbc.com/news/world-asia-china-51215348 …
135,"In Spain, Coronavirus COVID-19 confirmed cases has been exceeded Japan already. The penetration ratio is 0.0023%, it’s 5.6 times bigger than Japan (0.00041%). But the media is not so serious and people are living normal life. Optimistic Spanish mind  #COVID2019 #Spain #Japanpic.twitter.com/C2vsdq5DJi","China records 9 coronavirus deaths, 440 confirmed cases, by @javi_trianahttps://www.untvweb.com/news/china-records-9-coronavirus-deaths-440-confirmed-cases/ …"
136,"@JoeBiden Uncle Joe, you ARE NOT POTUS, you are a 2 time loser, you have NOT even won the nomination yet with your THIRD try, I am thinking, the POTUS is wishing you would just SHUT UP: Biden on Trump's coronavirus response: 'I wish he would just be quiet'",U.S. Treasury yields struggled for direction on Wednesday as investors attempted to shake off fears the China's coronavirus may spread to other countries and affect global economic growth  https://eresearch.fidelity.com/eresearch/markets_sectors/news/story.jhtml?storyid=202001221559MRKTWTCHNEWS_SVC000482&provider=MRKTWTCH&product=NEWS_SVC&category=fixedIncome …
137,"you really are a sweetheart,,, and I also like to do things for my friends so now that I have nothing to work on for conventions (cancelled bc coronavirus huh) I can sketch stuff for u!","#nCoV2019 Situation report @WHO. 
Waiting for tomorrow Emergency Committee on the novel #coronavirus #PHEIC. Today USA reported its first case of 2019-nCoV in a traveller recently returned from #Wuhan.

@CoREIMC #WuhanPneumonia #WuhanCoronavirus
 http://bit.ly/3ayAJpZ pic.twitter.com/yf2X0B2FhZ"
138,"It’s not the flu. It has much greater long term effects than the flu. And it spreads incredibly easy. 

In order to understand the prevention of the spread of the coronavirus you must understand herd immunity, which it seems you don’t.","China coronavirus 
——
I promised, something big and game changer will come from #China this period. China's Jupiter in 22° of capricon was activated completely by saturn pluto conjuction exactly at this degree on Jan 12th... https://flote.app/post/80f6f87d-f11a-4d90-b4b8-13fea9e70121 …"
139,Google employee in Bangalore tests positive for coronavirus http://dlvr.it/RRn6x6 pic.twitter.com/GdTTg6NEBq,"I promised, something big and game changer will come from #China this period. China's Jupiter in 22° of capricon was activated completely by saturn pluto conjuction exactly at this degree on Jan 12th .#coronavirus seems to be another manifestation of china's jupiter 12th house"
140,All European games need to be cancelled as well as the Euros and postpone the EPL for a minimum of a month #coronavirus,This Website Lets You Track The Global Spread of Wuhan Coronavirus in Real Time http://www.sciencealert.com/this-online-dashboard-tracks-the-global-spread-of-the-wuhan-coronavirus-in-real-time …
141,"Well at least New York will be safe, the rest of us 49 are STILL ON OUR OWN. Willowbrook Illinois nursing home here has nearly 50 +CORONAVIRUS patients AND staff. Christian Siriano  #Chicago #CoronaChicago","Ah fuck, you got the Corona virus too?"
142,"Preliminary investigations conducted by the Chinese authorities have found no clear evidence of human-to-human transmission of the novel #coronavirus (2019-nCoV) identified in #Wuhan, #China.pic.twitter.com/kj154WG5yq",Coronavirus has entered Germany  hey GOD
143,Social distancing: What it is and why it's the best tool we have to fight the coronavirus https://theconversation.com/social-distancing-what-it-is-and-why-its-the-best-tool-we-have-to-fight-the-coronavirus-133581?utm_source=twitter&utm_medium=bylinetwitterbutton … vía @ConversationUS,I bet OPEC didn't expect that the coronavirus was going to hit oil so hard
144,"World Health Organization (WHO) (@WHO)
WHO calls on industry and governments to increase manufacturing of personal protective equipment by 40% to meet rising global demand due to #COVID19
 http://bit.ly/2PH5TTC 
#coronavirus pic.twitter.com/9P0ljpR6Pi https://twitter.com/WHO/status/1234936431463849988?s=20 …",NZD/USD nears multi-week low of 0.6540 as fears of coronavirus outbreak grow https://s68mv.app.goo.gl/kmznV  #NZDUSD #China #RiskAppetite #Macroeconomics #Currencies
145,"As coronavirus spreads, can US health care system protect its citizens? https://www.scmp.com/comment/opinion/article/3075544/why-coronavirus-ticking-time-bomb-us-costly-and-inefficient-health … vía @scmpnews",The first case of the new coronavirus has been confirmed in Germany By @ross_burland https://s68mv.app.goo.gl/SWwy9  #Germany #Politics #USDJPY #YieldCurve
146,,Ya hay casos de coronavirus en Francia hahaha end of the World?
147,,"This is the Monkey Flue virus, I think the Chinese government are covering it up like the Soviets did at Chernobyl. I think it is a lot worse then they're making it out to be. #coronavirus"
148,,"
Coronavirus claims 15 more lives in China; first two cases reported in Europe; 2 cases confirmed in … https://www.washingtonpost.com/world/coronavirus-china-live-updates/2020/01/24/4e678f9c-3e03-11ea-afe2-090eb37b60b1_story.html …"
149,,"Sorry, let me insist, the study is done on 99 patients with pneumonia, not just infected by coronavirus.
Mortality caused by flu in patients admited to hospital is also 10%."
150,,#oil WTI: Bears pile in on Coronavirus and ME threats http://ow.ly/YBKN50y5iKQ 
151,,WTI: Bears pile in on Coronavirus and ME threats By @ross_burland https://s68mv.app.goo.gl/WHDhv  #Oil #WTI #Commodities
152,,"Rule No.1: Keep Calm. Unit 201 in control.
#China #coronavirus #CoronaOutbreak #CoronavirusOutbreak #coronaviruseshttps://www.bitchute.com/video/a5KFsPhHyrWQ/ …"
153,,"Please watch and spread this video. The world needs to know how the Communist Party of China treats its people. #WuhanVirus 

Daily updates on Wuhan coronavirus outbreak 01(01/26/2020) https://youtu.be/3K61AF-g3kY  via @YouTube"
154,,How the Coronavirus Has Tested China’s System of Information Control https://www.newyorker.com/news/news-desk/how-the-coronavirus-has-tested-chinas-system-of-information-control?utm_source=twitter&utm_medium=social&utm_campaign=onsite-share&utm_brand=the-new-yorker&utm_social-type=earned … via @NewYorker
155,,How are the homeless people in Wuhan being affected by coronavirus? Are they receiving the same treatment as others? #HomelessEntrepreneur
156,,Photographer Immortalizes Shanghai’s Empty Streets During the Coronavirus http://dlvr.it/RPcGSv pic.twitter.com/bC5svmfdoa
157,,"In order to know what’s really going on in #China somebody ought to ask what is China’s avg. #death-toll per day in Jan, Feb, In 2018-19 and compare it to 2020. Forget about the ‘confirmed’ #nCoV #coronavirus diagnosis numbers. Then we will know #Coronavirustruth"
158,,Coronavirus closes Chinese takeaway in Scots town after staff quarantined https://www.dailyrecord.co.uk/news/scottish-news/coronavirus-closes-scottish-chinese-takeaway-21458953 …
159,,Study claiming new #coronavirus http://www.tiradecontacto.net/665219224/lasavispas.html … can be transmitted by people without symptoms http://www.tiradecontacto.net/665219224/?p=5049 … was flawed Sciencehttps://nzzl.us/7QluqHt 
160,,"""Coronavirus: Death toll surpasses the number of fatalities from 2003 SARS outbreak""  https://twitter.com/i/events/1219057585707315201 …"
161,,If China valued free speech http://www.tiradecontacto.net/palmera.html  there would be no #coronavirus 2019-nCoV Wuhan https://photocontact.blogspot.com/2020/01/galdos.html … crisis | outbreak Guardian https://nzzl.us/Bznkiru  via @nuzzel
162,,The Mysterious Origin Of The Wuhan Coronavirus | Zero Hedge https://www.zerohedge.com/geopolitical/mysterious-origin-wuhan-coronavirus …
163,,Coronavirus to turn Aussie GDP negative in Q1 2020 – ANZ https://s68mv.app.goo.gl/HesM6  #Australia #China #RBA #Banks #GDP
164,,Chinese markets bounce back despite coronavirus threats - Global Times By @ross_burland https://s68mv.app.goo.gl/PKVGE  #China #USDCNY #Politics
165,,#Coronavirus outbreak may take weeks to shows signs of stabilizing: scientists. http://bit.ly/2SgUnPb 
166,,"After China Censored This Wuhan Doctor, He Caught the Coronavirus https://futurism.com/neoscope/china-censored-wuhan-doctor-caught-the-coronavirus …"
167,,Break/Update/coronavirus/10 people positive/cruise liner.https://mol.im/a/7967391  via @MailOnline
168,,I don’t think coronavirus is going to be as bad as H1N1 pandemic. The swine flu was the worst we had since spanish flu.
169,,Opinion | Coronavirus http://photocontact.blogspot.com/2014/01/memeacratas-pa-ls-censores.html … & Panic Epidemic http://www.tiradecontacto.net/posibilismo.html … New York Timeshttps://nzzl.us/Ts6IW0D 
170,,"China vs Nature
#coronavirus #virus #coronavirusmemespic.twitter.com/5qHA4vhr1y"
171,,Goldstein: 10 reasons not to panic about the #Wuhan #coronavirus. http://bit.ly/2OzoUa3 
172,,"Coronavirus Contains “HIV Insertions”, Stoking Fears Over Artificially Created Bioweapon https://www.infowars.com/coronavirus-contains-hiv-insertions-stoking-fears-over-artificially-created-bioweapon/ …"
173,,"Israel suspends all flights from China, isolates arrivals over coronavirus outbreak - Israel News - http://Haaretz.com https://www.haaretz.com/israel-news/.premium-israel-suspends-all-flights-from-china-isolates-arrivals-over-coronavirus-outbreak-1.8472297 …"
174,,China Slams Israeli Claim That Coronavirus Came From Bioweapon Lab https://www.insideover.com/society/china-slams-israeli-claim-that-coronavirus-came-from-bioweapon-lab.html …
175,,The Outer Worlds para Nintendo Switch se retrasa debido al coronavirus https://www.elotrolado.net/noticias/juegos/the-outer-world-retraso-switch-coronavirus …
176,,"China’s rulers see every crisis as a chance to tighten their grip. A coronavirus outbreak is no exception — Communist Party is turning virus-control into a mass political campaign, party members manning checkpoints, propaganda loudspeakers on street poles https://www.economist.com/china/2020/02/08/chinas-rulers-see-every-crisis-as-a-chance-to-tighten-their-grip …"
177,,"Please dont spread fake news, Coronaviruses are an extend type of  viruses with a positive-sense single-stranded RNA genome and with a nucleocapsid of helical symmetry, viruses like common cold are a type of coronavirus."
178,,Coronavirus May Delay Hard-Fought U.S. Trade Wins in China http://dlvr.it/RPKWWx pic.twitter.com/iAadVuYpfo
179,,SARS Stung the Global Economy. The Coronavirus Is a Greater Menace. http://dlvr.it/RPKWTl pic.twitter.com/YzGs4kwm3Y
180,,"'It’s a Moral Imperative:' Archivists Made a Directory of 5,000 Coronavirus Studies to Bypass Paywalls. The potentially illegal archive is a 'moral imperative,' said one organizer. via /r/technology https://ift.tt/2GT4mVI "
181,,"China escalates response after suffering deadliest day of coronavirus epidemic. Reminds of playing Resident Evil PS1, PS2 Racoon City, an Umbrella corporation. Getting out of hand. https://www.9news.com.au/world/coronavirus-death-toll-overtakes-sars-after-75-die-in-24-hours-china-world-news/8d488234-4e93-42c1-934a-93e3bce19f14 …"
182,,Must-read thread on #coronavirus  https://twitter.com/paulmozur/status/1228751784111271936 …
