,Positive,Neutral,Negative
50,"#DalaiLama , the leader of #Tibetan #Buddhism sees reasons for optimism even in the midst of the #coronavirus pande… https://t.co/fL6VGMSPSa","Wuhan Health Commission Adds 17 New Coronavirus Cases (ttl=62).

Of these 17 cases did not have apparent contact with the Wuhan Seafood Market, and were tested because they were hospitalized with unidentified pneumonia at other facilities in Wuhan.

https://afludiary.blogspot.com/2020/01/wuhan-health-commission-adds-17-new.html …","China releases genetic data on new coronavirus, now deadly | CIDRAP http://www.cidrap.umn.edu/news-perspective/2020/01/china-releases-genetic-data-new-coronavirus-now-deadly …"
51,"RT @MileyCyrus: Spain, you united in solidarity with Black Lives Matter in the US. We must keep standing together to tackle #COVID19 and it…","Latest on coronavirus: Wuhan medical staff being infected at faster pace, Japan marked second case https://s68mv.app.goo.gl/D5QvG  #China #Politics #RiskAppetite #NewsTrading","Wuhan health committee update concerning novel coronavirus outbreak

http://wjw.wuhan.gov.cn/front/web/list2nd/no/710 …"
52,RT @TheRealPCB: Get well soon. Praying for your swift recovery!,"#Gold: Steady above $1,560 amid fears of China’s coronavirus outbreak http://ow.ly/PsFh50y3zWd ",China says human transmission not ruled out in Wuhan coronavirus outbreak https://www.scmp.com/news/china/society/article/3046173/china-says-human-transmission-not-ruled-out-wuhan-coronavirus … vía @scmpnews
53,"According to industry experts the survival of small #foodtech #startups amid #Covid19 depends on two things:
abilit… https://t.co/7NO6a83pGs",The nCoV2019 API for Wahun outbreak monitoring is now available!https://rpst.page.link/qhcZ  #publichealth #hospitals #infectiousdiseases #healthcare #pandemic #coronavirus #ChinaCoronaVirus #coronaviruesue #nvoc2019 #2019ncov #Wuhan #WHO #WuhanCoronavirus #digitalhealth #apipic.twitter.com/4naxvVpLVC,"WHO statement on novel #coronavirus in #Thailand  ""It is essential that investigations continue in #China to identify the source of this outbreak and any animal reservoirs or intermediate hosts""

 http://ow.ly/F7Jk50xVPf3 pic.twitter.com/Di7dLuyoVV"
54,"RT @GlblCtznImpact: Thank you 💙 @mileycyrus 💙 for calling on world leaders to unite &amp; commit billions of dollars to make testing, treatment…","As China’s epidemic continues to spread, things may seem scary. Here are ten simple precautions that can protect you from contracting the coronavirus. https://foreignpolicy.com/2020/01/25/wuhan-coronavirus-safety-china …",WHO Rolls Out Global Measures to Limit Transmission of New Coronavirus http://www.laht.com/article.asp?ArticleId=2487710&CategoryId=13936#.Xh5nW3Xq7JY.twitter …
55,"RT @sanchezcastejon: Spain is coleader in initiatives such as the ACT-Accelerator to achieve equitable access to vaccines, treatments and d…",Wilbur Ross Says Coronavirus Could Bring Jobs Back to the U.S. http://dlvr.it/RP4tkS pic.twitter.com/PMVppgVill,"It Is “Essential” for China to Continue Investigating the Source of a Previously Unknown Strain of coronavirus, as Thailand Case Emerges – World Health Organization http://human-wrongs-watch.net/2020/01/14/it-is-essential-for-china-to-continue-investigating-the-source-of-a-previously-unknown-strain-of-coronavirus-as-thailand-case-emerges-world-health-organization/ …pic.twitter.com/s1JgCmcW4K"
56,Leggends supports leggends,Coronavirus: Wuhan shutting down outbound travel as coronavirus spreads. Ok they should have not let these people in Sydney. They should consider closing flights in and out of China https://www.9news.com.au/world/coronavirus-passengers-arriving-in-sydney-scanned-for-deadly-outbreak/e31ecfeb-e90d-4103-be67-539180a544e5 …,Viral pneumonia outbreak in China has been linked to a novel coronavirus (MERS and SARS are both coronaviruses). http://virological.org/t/initial-genome-release-of-novel-coronavirus/319 …
57,Gaga &amp; Ariana who? best collab of 2020 is coming!,"China coronavirus 
——
I promised, something big and game changer will come from #China this period. China's Jupiter in 22° of capricon was activated completely by saturn pluto conjuction exactly at this degree on Jan 12th... https://flote.app/post/80f6f87d-f11a-4d90-b4b8-13fea9e70121 …","A new virus has arrived on the scene, leaving patients with #pneumonia.  But is this a brief here-today-gone-tomorrow outbreak or the first sign of something far more dangerous?

 http://ow.ly/WUGX30q8ksT  via @BBC
#China #Coronavirus #GlobalHealth"
58,RT @sergioyellow: Gaga &amp; Ariana who? best collab of 2020 is coming!,"I promised, something big and game changer will come from #China this period. China's Jupiter in 22° of capricon was activated completely by saturn pluto conjuction exactly at this degree on Jan 12th .#coronavirus seems to be another manifestation of china's jupiter 12th house",wonder if this has been done on purpose to stop the Hong Kong protests people will be wary of mass meetings spreading the corona virus
59,diiiiselo Mr Handsome las tienes a toas lokitass,This Website Lets You Track The Global Spread of Wuhan Coronavirus in Real Time http://www.sciencealert.com/this-online-dashboard-tracks-the-global-spread-of-the-wuhan-coronavirus-in-real-time …,China: Possible that new virus could spread between humans #coronavirus https://apnews.com/89facb95962d7d20d1377ae0c2ac0eed …
60,"""Ours is a strong commitment, Miley."" 

Now I'm jealous.",Coronavirus has entered Germany  hey GOD,Coronavirus: China reports 17 new cases of Sars-like mystery virus https://www.theguardian.com/world/2020/jan/19/coronavirus-china-reports-17-new-cases-of-sars-like-mystery-virus?CMP=share_btn_tw …
61,"RT @rebecasrz: Miley I get you girl, our president is hot, but he is in a serious relationship with our VP The Ponytails, so please, back o…",The first case of the new coronavirus has been confirmed in Germany By @ross_burland https://s68mv.app.goo.gl/SWwy9  #Germany #Politics #USDJPY #YieldCurve,Coronavirus: China reports 17 new cases of Sars-like mystery virus | China - The Guardian https://www.theguardian.com/world/2020/jan/19/coronavirus-china-reports-17-new-cases-of-sars-like-mystery-virus …
62,The only good things England’s still got is the queen ❤️,Ya hay casos de coronavirus en Francia hahaha end of the World?,"Coronavirus, a Large Family of Viruses that Has Not Been Previously Identified in Humans – World Health Organization  http://human-wrongs-watch.net/2020/01/19/coronavirus-a-large-family-of-viruses-that-has-not-been-previously-identified-in-humans-world-health-organization/ …"
63,"RT @SKyriakidesEU: The EU leads with a united front in the global effort to get to a vaccine, for our European citizens and 
for the world.…","
Coronavirus claims 15 more lives in China; first two cases reported in Europe; 2 cases confirmed in … https://www.washingtonpost.com/world/coronavirus-china-live-updates/2020/01/24/4e678f9c-3e03-11ea-afe2-090eb37b60b1_story.html …","New Coronavirus Outbreak Kills 2 in China, Spreads to Japan and Thailand https://www.thedailybeast.com/new-coronavirus-outbreak-kills-2-in-china-spreads-to-japan-and-thailand …"
64,"""ours is a strong commitment, Miley"" help","Sorry, let me insist, the study is done on 99 patients with pneumonia, not just infected by coronavirus.
Mortality caused by flu in patients admited to hospital is also 10%.",New #coronavirus could hurt Chinese GDP at a bad time — and #Japan's if it spreads. http://bit.ly/2v1Rda6  #healthcare #economy #China
65,omg mr handsome,"Rule No.1: Keep Calm. Unit 201 in control.
#China #coronavirus #CoronaOutbreak #CoronavirusOutbreak #coronaviruseshttps://www.bitchute.com/video/a5KFsPhHyrWQ/ …",Three U.S. Airports to Check Passengers for a Deadly Chinese Coronavirus http://dlvr.it/RNHWY7  via @TravelOnSkillpic.twitter.com/EW3DCO3vUx
66,RT @iamfalconwaseem: Terrible news. Get well soon Lala. Prayers for a speedy recovery in sha Allah🤲,How the Coronavirus Has Tested China’s System of Information Control https://www.newyorker.com/news/news-desk/how-the-coronavirus-has-tested-chinas-system-of-information-control?utm_source=twitter&utm_medium=social&utm_campaign=onsite-share&utm_brand=the-new-yorker&utm_social-type=earned … via @NewYorker,China Confirms 2nd Death from New Coronavirus http://www.laht.com/article.asp?ArticleId=2487816&CategoryId=13936#.XiJf-wxQ9lU.twitter …
67,"Ours is a strong commitment, Hannah",How are the homeless people in Wuhan being affected by coronavirus? Are they receiving the same treatment as others? #HomelessEntrepreneur,China Confirms 2nd Death from New Coronavirus: China has confirmed a second death due to a… https://goo.gl/fb/qt6198 
68,"Me meo. Que Pdr le ha contestado a Miley! 2020, what a wonderful year!",Photographer Immortalizes Shanghai’s Empty Streets During the Coronavirus http://dlvr.it/RPcGSv pic.twitter.com/bC5svmfdoa,"http://NPR.org  : CDC To Screen For New Strain Of Coronavirus At 3 U.S. Airports. The origin?: a seafood and live animal market for human consumption. #foraveganworld
https://text.npr.org/s.php?sId=795343026 …"
69,Best of both worlds 💕,"In order to know what’s really going on in #China somebody ought to ask what is China’s avg. #death-toll per day in Jan, Feb, In 2018-19 and compare it to 2020. Forget about the ‘confirmed’ #nCoV #coronavirus diagnosis numbers. Then we will know #Coronavirustruth","#Japan #Chinesevirus #concerning #Asianews #China #virus #deadly #UKnews #EUnews #USnews #news #worldnews
Japan has confirmed its first case of infection from a newly-identified coronavirus that has killed one person and infected at least 40 more in... https://reut.rs/3ae2hkt "
70,The Climb - Miley Cyrus ft. Mr. Handsome,Coronavirus closes Chinese takeaway in Scots town after staff quarantined https://www.dailyrecord.co.uk/news/scottish-news/coronavirus-closes-scottish-chinese-takeaway-21458953 …,Japan Confirms 1st Case of New Coronavirus Infection: The first case of a pneumonia-like… https://goo.gl/fb/m4SHPE 
71,"""Ours is a strong commitment, Miley.""
Han tenido rollo fijo.","After China Censored This Wuhan Doctor, He Caught the Coronavirus https://futurism.com/neoscope/china-censored-wuhan-doctor-caught-the-coronavirus …",Japan Confirms 1st Case of New Coronavirus Infection http://www.laht.com/article.asp?ArticleId=2487775&CategoryId=13936#.XiEYAgH-6GU.twitter …
72,collab porfa hannah montana ft mr handsome,Break/Update/coronavirus/10 people positive/cruise liner.https://mol.im/a/7967391  via @MailOnline,"Eurosurveillance | Real-time tentative assessment of the epidemiological characteristics of novel coronavirus infections in Wuhan, China, as at 22 January 2020 https://www.eurosurveillance.org/content/10.2807/1560-7917.ES.2020.25.3.2000044 …"
73,"RT @timesofindia: HC directs Centre, Delhi govt to increase beds, ventilators for #Covid19 patients in the national capital. HC says it exp…",China Slams Israeli Claim That Coronavirus Came From Bioweapon Lab https://www.insideover.com/society/china-slams-israeli-claim-that-coronavirus-came-from-bioweapon-lab.html …,"Yep reckon you’re right,Wombats,between the smoke and coronavirus I’d say they’d be difficult to find but not impossible,honestly reckon Bunnings or Mitre 10Ian"
74,"RT @GabrielMariya: Nobel Prize winner Sir Peter Ratcliffe shares his insights on #COVID19 @wef.
The #EU funded his vital #research with an…",The Outer Worlds para Nintendo Switch se retrasa debido al coronavirus https://www.elotrolado.net/noticias/juegos/the-outer-world-retraso-switch-coronavirus …,"Bro I'm not saying eating cows, chickens, pigs, etc is better BUT y'all really surprised if the origen of the coronavirus is a bat or a FREAKING RAT soup.
Anyway move along, nothing to hate here."
75,I CAME IN LIKE A,Coronavirus May Delay Hard-Fought U.S. Trade Wins in China http://dlvr.it/RPKWWx pic.twitter.com/iAadVuYpfo,My flu is so hardcore Corona virus is scared of it
76,RT @miyawakidinades: We stan Mr. Handsome https://t.co/h0iEHihpSF,SARS Stung the Global Economy. The Coronavirus Is a Greater Menace. http://dlvr.it/RPKWTl pic.twitter.com/YzGs4kwm3Y,"#CoronaVirus (The Virus) Infection Update 

USA  #56 (+2) 

UK  #13 (+4) 

China  #1 (+900)

Spain  #57 debut (+1) https://twitter.com/el_pais/status/1221174723775815680 …"
77,"RT @ITFglobalunion: Global organisations need to work together to support workers through #COVID19. Together with the @UN, we call on all c…",Must-read thread on #coronavirus  https://twitter.com/paulmozur/status/1228751784111271936 …,Coronavirus: Wuhan to shut public transport over outbreak - BBC News https://www.bbc.com/news/world-asia-china-51215348 …
78,Love u from spain,Nightingale vs Coronavirus #FGO https://redd.it/f2fznk pic.twitter.com/WytYwcFYKQ,"China records 9 coronavirus deaths, 440 confirmed cases, by @javi_trianahttps://www.untvweb.com/news/china-records-9-coronavirus-deaths-440-confirmed-cases/ …"
79,The best of both worlds,Coronavirus fight: Robots employed to prevent cross-infection https://youtu.be/rYY1QQ_Xb4w  vía @YouTube,U.S. Treasury yields struggled for direction on Wednesday as investors attempted to shake off fears the China's coronavirus may spread to other countries and affect global economic growth  https://eresearch.fidelity.com/eresearch/markets_sectors/news/story.jhtml?storyid=202001221559MRKTWTCHNEWS_SVC000482&provider=MRKTWTCH&product=NEWS_SVC&category=fixedIncome …
80,"Marvel: Avengers Infinity War is the most ambitious crossover in history.
Pedro Sánchez: hold my beer.","#Coronavirus #COVID19 ""Smoking Gun"" UpDate...https://twitter.com/AlohaEvery1/status/1230275811594231808 …","#nCoV2019 Situation report @WHO. 
Waiting for tomorrow Emergency Committee on the novel #coronavirus #PHEIC. Today USA reported its first case of 2019-nCoV in a traveller recently returned from #Wuhan.

@CoREIMC #WuhanPneumonia #WuhanCoronavirus
 http://bit.ly/3ayAJpZ pic.twitter.com/yf2X0B2FhZ"
81,"The Best of  Both Worlds (Remix)~ Hanna Montada feat Pedro Sánchez
is coming","And another thing,the Coronavirus it's a Trojan horse probably release from the US military I the occasion of the Military Games in the Wuhang city two week before the first case of #coronavirus. Casually? https://twitter.com/Hurricane081/status/1229186303037714434 …","Ah fuck, you got the Corona virus too?"
82,RT @eurocontrolDG: Our Aviation Intelligence Unit @eurocontrol has been tracking market share since the early days of the #COVID19 crisis.…,The senator Tom Cotton is not informed correctly. The #Coronavirus originated in the laboratory BSL of Canada and ship to laboratory to Wuhang.,I bet OPEC didn't expect that the coronavirus was going to hit oil so hard
83,"RT @WorldBank: The @WorldBank is looking at #COVID19 and its effect on public-private partnerships, right now and post-crisis. #InfraFinanc…",China Hopeful after Decline in Coronavirus Cases: China began on Wednesday to see the… https://goo.gl/fb/J5x5e4 ,NZD/USD nears multi-week low of 0.6540 as fears of coronavirus outbreak grow https://s68mv.app.goo.gl/kmznV  #NZDUSD #China #RiskAppetite #Macroeconomics #Currencies
84,Only Mr. Handsome could responderle a Miley Cyrus,Coronavirus: the new disease Covid-19 explained @SCMPgraphics http://bit.ly/2RgB7Ce  #Dataviz #infographic,"This is the Monkey Flue virus, I think the Chinese government are covering it up like the Soviets did at Chernobyl. I think it is a lot worse then they're making it out to be. #coronavirus"
85,"@MileyCyrus @sanchezcastejon US, maybe you could join us in the solidarity fight against #COVID19 and its dispropor… https://t.co/FOuga8vpVr",#Coronavirus Thread https://twitter.com/DrEricDing/status/1221990534643929089 …,#oil WTI: Bears pile in on Coronavirus and ME threats http://ow.ly/YBKN50y5iKQ 
86,You feel bored by your #covid19 easing lockdown bubble:-,"China’s Hubei province reports 4,823 new cases of coronavirus By @ross_burland https://s68mv.app.goo.gl/N4ZHA  #China #AUDUSD #Politics",WTI: Bears pile in on Coronavirus and ME threats By @ross_burland https://s68mv.app.goo.gl/WHDhv  #Oil #WTI #Commodities
87,God bless America! 💸💸💸🤦🏻‍♂️#seattle #coronavirus #COVID19 https://t.co/ETQMSYoH9t,¿Y Como lo saben? Chinese government releases public app to gauge potential coronavirus exposures  https://www.mobihealthnews.com/news/chinese-government-releases-public-app-gauge-potential-coronavirus-exposures …,"Please watch and spread this video. The world needs to know how the Communist Party of China treats its people. #WuhanVirus 

Daily updates on Wuhan coronavirus outbreak 01(01/26/2020) https://youtu.be/3K61AF-g3kY  via @YouTube"
88,The best 2020 collab,"A cruise ship is in lock down in Sydney Harbour,  passenger now being tested for possible coronavirus – The Australian By @ross_burland https://s68mv.app.goo.gl/wjsfK  #Australia #AUDUSD #RBA",Study claiming new #coronavirus http://www.tiradecontacto.net/665219224/lasavispas.html … can be transmitted by people without symptoms http://www.tiradecontacto.net/665219224/?p=5049 … was flawed Sciencehttps://nzzl.us/7QluqHt 
89,"Civil War is the most ambitious crossover of all time.
Pedro Sánchez: Hold my beer","WTI: Under pressure below $52 amid political, coronavirus headlines https://s68mv.app.goo.gl/VPWVJ  #WTI #China #RiskAppetite #OPEC #Commodities","""Coronavirus: Death toll surpasses the number of fatalities from 2003 SARS outbreak""  https://twitter.com/i/events/1219057585707315201 …"
90,"RT @nigewillson: Robots Help Employees Stay Safe During COVID-19 https://t.co/pFTN8gKzsN
#ai #ArtificialIntelligence #MachineLearning #Deep…",China Quarantines Cash http://tiradecontacto.net/sistemadezonas.htm … to Sanitize Old Bank Notes https://photocontact.blogspot.com/2012/12/camina-o-revienta.html … From #coronaVirus #covid19 Bloomberghttps://nzzl.us/wSsIu0a ,If China valued free speech http://www.tiradecontacto.net/palmera.html  there would be no #coronavirus 2019-nCoV Wuhan https://photocontact.blogspot.com/2020/01/galdos.html … crisis | outbreak Guardian https://nzzl.us/Bznkiru  via @nuzzel
91,Our handsome president acting up,Traveling in a world with #coronavirus  pic.twitter.com/MxcfbaF7ag,The Mysterious Origin Of The Wuhan Coronavirus | Zero Hedge https://www.zerohedge.com/geopolitical/mysterious-origin-wuhan-coronavirus …
92,Hanna Montana sliding into your DM's like :,Coronavirus Empties European Cities of Chinese Tourists - The New York Times https://www.nytimes.com/2020/02/17/world/europe/coronavirus-tourism-europe.html …,Coronavirus to turn Aussie GDP negative in Q1 2020 – ANZ https://s68mv.app.goo.gl/HesM6  #Australia #China #RBA #Banks #GDP
93,RT @CDCgov: #Employers: Antibody tests for #COVID19 should not be used to determine if someone can return to work. There is not enough info…,"CDC official: It’s not a question of if #coronavirus will spread to America, but when. http://bit.ly/380KtXQ  #US",Chinese markets bounce back despite coronavirus threats - Global Times By @ross_burland https://s68mv.app.goo.gl/PKVGE  #China #USDCNY #Politics
94,May Allah protect him... 🤲🏻,No evidence of coronavirus in Galicia so far ,#Coronavirus outbreak may take weeks to shows signs of stabilizing: scientists. http://bit.ly/2SgUnPb 
95,RT @TheLancetOncol: New research online: #COVID19 in patients with thoracic malignancies - first results the TERAVOLT registry study #lcsm…,Another coronavirus case in Spain https://twitter.com/RTultimahora/status/1232081589384994816 …,I don’t think coronavirus is going to be as bad as H1N1 pandemic. The swine flu was the worst we had since spanish flu.
96,RT @ASPENWEB: Now available in Spanish! ASPEN Report on Nutrition Support Practice Processes with #COVID19: The First Response. https://t.c…,"What experience do you have Mike? 

Let me stop you before you say “9/11” 

What experience do you have in stopping a “pandemic”? 

What experience do you have in controlling the #CoronaVirus? 

Thought so, SIT DOWN! #Trump2020https://twitter.com/MikeBloomberg/status/1233538006805512194 …",Opinion | Coronavirus http://photocontact.blogspot.com/2014/01/memeacratas-pa-ls-censores.html … & Panic Epidemic http://www.tiradecontacto.net/posibilismo.html … New York Timeshttps://nzzl.us/Ts6IW0D 
97,"RT @MsPhelps: A number of publishers (incl. ACS, Elsevier, SpringerNature, Wiley) reserve the right to have #COVID19-related papers removed…","""The time lag allowed public health agencies to devise and distribute a diagnostic test that hospitals can use to identify patients ill with the novel coronavirus""
#Covid19
https://www.statnews.com/2020/02/21/coronavirus-wuhan-quarantine-bought-world-time-to-prepare/ … vía @statnews","China vs Nature
#coronavirus #virus #coronavirusmemespic.twitter.com/5qHA4vhr1y"
98,best crossover,Australian #coronavirus #vaccine goes into test productionhttps://www.smh.com.au/national/australian-coronavirus-vaccine-goes-into-test-production-20200221-p5436l.html …,Goldstein: 10 reasons not to panic about the #Wuhan #coronavirus. http://bit.ly/2OzoUa3 
99,this is the best of both worlds,Saudi Arabia suspends entry for pilgrims over #coronavirus https://news.yahoo.com/saudi-arabia-suspends-entry-pilgrims-over-coronavirus-010910478.html?soc_src=community&soc_trk=tw … via @Yahoo #COVID19 #ksa #Covid_19,"Coronavirus Contains “HIV Insertions”, Stoking Fears Over Artificially Created Bioweapon https://www.infowars.com/coronavirus-contains-hiv-insertions-stoking-fears-over-artificially-created-bioweapon/ …"
100,"RT @helenbevan: A graphic drawn by one of the best psychologists on Twitter, @Haypsych on the benefits of psychological safety. Hayley has…","Steve Bannon: Pandemic! Coronavirus Is Out of Control In China 
https://youtu.be/QlF0LcQO9Tg ","Israel suspends all flights from China, isolates arrivals over coronavirus outbreak - Israel News - http://Haaretz.com https://www.haaretz.com/israel-news/.premium-israel-suspends-all-flights-from-china-isolates-arrivals-over-coronavirus-outbreak-1.8472297 …"
101,"RT @David_rp90: 4 behaviors that will help you lead your team during a crisis. 

 #WorkHappy #COVID19 #employerbranding #talent #leadership…",How BC #influencers are creating during #coronavirus. https://t.co/4F8HuPof37,"China’s rulers see every crisis as a chance to tighten their grip. A coronavirus outbreak is no exception — Communist Party is turning virus-control into a mass political campaign, party members manning checkpoints, propaganda loudspeakers on street poles https://www.economist.com/china/2020/02/08/chinas-rulers-see-every-crisis-as-a-chance-to-tighten-their-grip …"
102,RT @RoySocChem: Join us on June 18 for the second webinar in the 'Building a better chemistry culture' series to explore the challenges and…,RT @wef: 6 charts that show what employers and employees really think about remote working https://t.co/xZzterMTiF #coronavirus #RemoteWork…,"Please dont spread fake news, Coronaviruses are an extend type of  viruses with a positive-sense single-stranded RNA genome and with a nucleocapsid of helical symmetry, viruses like common cold are a type of coronavirus."
103,"ALL RIGHT, Miley Cyrus!!!",The @BioparcF in #Fuengirola is the first leisure park on the #CostadelSol to reopen after the #coronavirus lockdow… https://t.co/AX2PmWVsbx,"'It’s a Moral Imperative:' Archivists Made a Directory of 5,000 Coronavirus Studies to Bypass Paywalls. The potentially illegal archive is a 'moral imperative,' said one organizer. via /r/technology https://ift.tt/2GT4mVI "
104,Ours is a strong commitment miley,Even without #coronavirus the Govt know what #NoDeal ...&amp; LOW standards &amp; LOW animal welfare will do to… https://t.co/kU35nTdRBt,"China escalates response after suffering deadliest day of coronavirus epidemic. Reminds of playing Resident Evil PS1, PS2 Racoon City, an Umbrella corporation. Getting out of hand. https://www.9news.com.au/world/coronavirus-death-toll-overtakes-sars-after-75-die-in-24-hours-china-world-news/8d488234-4e93-42c1-934a-93e3bce19f14 …"
105,I've found a vaccine for #Covid19.  A metal stick and a posh accent. https://t.co/3QtsLsastI,RT @Jerusalem_Post: #Australia's largest state of New South Wales on Saturday reported its first locally transmitted #coronavirus case sinc…,What you need to know now about the #coronavirus: International investigation begins this weekend. WHO stresses importance of keeping politics out of discussions about the outbreak. http://bit.ly/39BJbDJ 
106,RT @abelplanelles: The best of both worlds,"RT @MicrobesInfect: Mutation in #SARSCoV2 variant circulating in Europe &amp; US increases its ability to infect cells in vitro.

The D614G mut…",We went from corona virus to stripper falling down to standing brooms like yo wtf!??
107,"RT @VamosHazard: 🗞 MARCA: HAZARD IS READY TO SHINE 

• The Belgian is surprising his own teammates with his high level in training after th…",RT @Cartoon4sale: Peter Brookes on #BorisJohnson #BritishEconomy #COVID-19 #EndingLockdown #£ #Coronavirus - political cartoon gallery in L…,The drawing un the second image is very powefull... Sorry for my ignorance but the images are about coronavirus?
108,".@MileyCirus, you mighn't know that Spain still owns an UNIVERSAL and strong public health care system. 

In the US… https://t.co/WlRjGc0Adw",Mood 😍😍🇪🇦🇪🇦 https://t.co/B5vOGUA30X,Global Rise of K-Pop Impacted by Coronavirus Outbreak: K-pop has exploded into the… https://goo.gl/fb/qv4J5M 
