,Positive,Negative
0,4588,4267
1,S&P 500 Futures keep the bulls hopeful near 8-week high https://s68mv.app.goo.gl/V4BiQ #Equities #Markets #RiskAppetite #Coronavirus #Macroeconomics,Poop may tell us when the #coronavirus #lockdown will end.
2,"""Coronavirus: US top infectious disease doctor says drug trial shows 'quite good news'"" #Coronavirus ",Coronavirus: Outcry as Spanish beach sprayed with bleach 
3,Whose coronavirus strategy worked best? Scientists hunt most effective policies https://www.nature.com/articles/d41586-020-01248-1,UK PM to tell nation not to expect lockdown changes – Telegraph By @ross_burland https://s68mv.app.goo.gl/thM4J #UnitedKingdom #GBPUSD #Coronavirus
4,"Coronavirus: basic rules from the experts in Spain. _ Masks are only necessary indoors overall where can't be kept the safety distance. _It's better to keep your hands clean than wear gloves. _Keep your 1,5-2m distance.","A recent classwork, I wanted to upload it to raise awareness. The english meaning is: ""Do you want to be the next?"" #coronavirus #QuedateEnCasa #COVID__19 #cartel #classroom #GraphicDesign"
5,"NYT | Remember, No One Is Coming to Save Us. Eventually doctors will find a coronavirus vaccine, but black people will continue to wait for a #cure for #racism. https://nyti.ms/2Mbff7O #US","Coronavirus Might Attack the Brain, Too by @RobertRoyBritt in @elemental"
6,The Premier League had a welcome boost as it prepares to return to play on 17 June with no players testing positive for coronavirus... ,The most important measure is coronavirus deaths per influence. It's not the same whether Pedro de Nada died of the virus or Bill Gates. Some democracies are more democratic than others you know :)))
7,Coronavirus: everyone wins when patents are pooled ,"I've just bought this, my second BTS blu-ray from a Spanish store. Since Coronavirus is affecting deliveries here, can't buy from Asian stores at the moment #bts #BTSARMY"
8,Another #coronavirus #vaccine candidate might be ready sooner than expected.,How 9 people in a restaurant got the coronavirus thanks to the placement of an air conditioning unit https://www.businessinsider.com/how-restaurant-air-conditioning-gave-nine-people-covid-china-2020-4
9,"""As the International Organization for Public-Private Cooperation, the World Economic Forum is mobilizing all stakeholders to protect lives and livelihoods."" https://www.weforum.org/covid-action-platform #COVID19 #coronavirus",(what a cold-blooded arsehole!) 'So what?': Bolsonaro shrugs off Brazil's rising coronavirus death toll 
10,"Interesting perspective: ""Coronavirus May Be a Blood Vessel Disease"" ",The coronavirus cruise: on board the Diamond Princess 
11,"Jim Bridenstine,@NASA Administrator: ""Times are tough now, we got the coronavirus pandemic and other challenges as a country. This moment in time is an opportunity for everybody to reflect humanity, what we can do when we work together."" #LaunchAmerica (1/2)",Vaccine skeptics are already casting doubt on one for the coronavirus. But it doesn't exist yet. - CBS News 
12,"#America’s #Race Problem Erupts Anew, Layered With #Coronavirus #Tensions. Rioting in the aftermath of another police-inflicted death—this time in one of the most prosperous #US cities—reveals how little progress has been made.","Well, well. More deaths from coronavirus now in the UK than here in Spain. Did Boris Johnson REALLY not see this coming? In theory, here in Spain, we were hit far worse by the 2008 financial crisis and the austerity deployed to mitigate it. "
13,BBC News - Coronavirus: Backlash after Trump signals US exit from WHO ,"Abbott rules to reopen movie-theaters in Texas, as @TexasTribune puts them, are pure Dada poetry, especially knowing that coronavirus droplets are spreaded by the air conditioner. People have already been infected and hospitalized sitting even more away https://www.texastribune.org/2020/04/28/texas-reopening-restaurants-greg-abbott/"
14,"May I remind ‘you’ that you are speaking from a position of privilege. Perhaps, think about those people who cannot afford to buy masks, who cannot easily buy alcohol and who still have to go to work in places that are highly at risk. #coronavirus",#COVID19 The race for coronavirus vaccines: a graphical guide https://www.nature.com/articles/d41586-020-01221-y
15,"Me enjoying life, Coronavirus sneaking in ",BBC News - Coronavirus: Outcry as Spanish beach sprayed with bleach 
16,"Yes, it is worse than the flu: busting the #coronavirus myths. The truth about the protective value of face masks and how easy it is to catch #Covid19. http://bit.ly/3ag2mmK","First pestilence, then war? A new, more aggressive China takes on the world in a pandemic — Since coronavirus disrupted Beijing’s plans for economic strength and global prestige, it has increasingly turned to military force and devastating diplomacy "
17,"The contact tracing by European failed to provide a useful denominator? Can’t you just ask France, UK, and Spain @salvadorilla for their tracking reports? That’s the transparent way to do #covid19 science &amp; governance, no? What am I missing?","Man, the coronavirus spikes after all these protests are gonna be insane."
18,And what about someone say onions can cure #CoVid19,"AN apocalyptic virus from chicken farms could dwarf the coronavirus pandemic and kill half of the world's population, a scientist has said in an extreme warning. "
19,The WHO report has some #covid19 recommendations: https://www.who.int/docs/default-source/coronaviruse/who-china-joint-mission-on-covid-19-final-report.pdf,77 Nobel Laureates Denounce Trump Officials For Pulling Coronavirus Research Grant 
20,"Just keep calm. Clean your hands before touching your nose, eyes or mouth. Cover your mouth with your elbow when sneezing. This is a new virus and it is spreading fast, but is not lethal. Here you have some data bout lethality of COVID19: ",Coronavirus: hold my beer. 
21,"As @MariaRgez reports, #Nigerian authorities had an outstanding response to the #ebola outbrake. Here the story of the Nigerian doctor praised for stopping it. Unfortunately she died. https://www.bbc.com/news/world-africa-29696011 Let's hope they manage to contain #Covid19 as well. ",Coronavirus Race Riots Americans trying to survive without income Rocket Launches Obamagate And @SpeakerPelosi and the Democrats refuse to come to work. We are still paying them though.
22,"This model looks nice, but, it doesn't consider the people that don't cover their mouth when they sneeze or cough in public spaces, abundant in #tarragona. #covid19 #coronavirus #prevention #culture #soonsick","Rosie Duffield resigned @UKLabour whip, cos you can't be telling folk how to behave if you don't stick to the rules. Like with #DominicCummnings, I get why she did it, though she shouldn't have. But unlike DC, she deserves credit for not clinging on without dignity. #coronavirus "
23,So you think you're about to be in a pandemic? https://virologydownunder.com/so-you-think-youve-about-to-be-in-a-pandemic/ #COVID19 The facts and how to protect youself and your family,Do they live on another planet to the rest in Britain???? Coronavirus......will be around and will get worse!!!!
24,Dog tests positive for #Covid19 in #HongKong. #Dog tests positive for #coronavirus after catching disease from infected owner.,#Jokes The amount of bad coronavirus jokes is starting to reach worrying numbers. Some scientists claim it might be a pundemic. https://buff.ly/2ZG2I43 #Jokes pun = juego de palabras pʌn
25,"RT WHO: NEW: WHO interim guidance on a range of topics to help countries manage the new #coronavirus
 http://bit.ly/2TaaWOH  pic.twitter.com/jFSHJNp6XX via sanoysalvoblog","#Pangolins May Have Incubated Infectious #Coronavirus #Disease: Study. According to a study conducted by researchers, it has been found that novel coronavirus first infected both the #bats and pangolins and them jumped to humans."
26,"Great timeline of #WuhanPneumonia outbreak.  By @MackayIM
@GepiSeimc @CoReSEIMC #coronavirus https://twitter.com/MackayIM/status/1216659283678384128 …",Check up the date of my recommendation. #LaReunionSecreta #LosPapelesdelaVergüenzaIV #COVID19 #coronavirus 
27,"""environmental samples from the South China seafood market, including the ground, table tops, and gloves, were positive for the new coronavirus,""

https://flutrackers.com/forum/forum/the-pandemic-discussion-forum/822041-discussion-thread-viral-pneumonia-outbreak-in-wuhan-china/page2 …","The Spanish flu had a deadly #SecondWave. Could it happen with #COVID19? Now that Canada and countries around the world are starting to lift coronavirus restrictions, a new debate is on the table: could we be seeing a deadly second wave of infections? "
28,"Coronavirus, if they're lucky.","Coronavirus, 'Plandemic' and the seven traits of conspiratorial thinking "
29,"WHO interim guidance on a range of topics to help countries manage the new #coronavirus
https://www.who.int/health-topics/coronavirus …pic.twitter.com/KxzvJGqVjd","Two million people shielding at home from coronavirus can go outdoors, government confirms "
30,"Gold: Steady above $1,560 amid fears of China’s coronavirus outbreak https://s68mv.app.goo.gl/WvRcV  #Gold #RiskAppetite #China #TradeWar #Commodities",Neuropathogenesis and Neurologic Manifestations of the Coronaviruses in the Age of Coronavirus Disease 2019: A Review | Global Health | JAMA Neurology | JAMA Network 
31,What It’s Like to Try to Get Treatment for the Coronavirus in China https://www.newyorker.com/news/daily-comment/what-its-like-to-try-to-get-treatment-for-the-coronavirus-in-china?utm_source=twitter&utm_medium=social&utm_campaign=onsite-share&utm_brand=the-new-yorker&utm_social-type=earned … via @NewYorker,"MAY HEM #Mayhem Older Italians Warily Eye Young Crowds, Fearing 2nd Coronavirus Wave "
32,"Gold: Modestly flat around $1575, trade/coronavirus in the spotlight https://s68mv.app.goo.gl/6dSV7  #Gold #China #TradeWar #RiskAppetite #Commodities",Rwandan medical workers deploy #robots to minimise #coronavirus #risk.
33,The best time is now! Were still free from Coronavirus.,"A boy enjoys the sunny weather, as some Spanish provinces are allowed to ease lockdown restrictions during phase two, amid the coronavirus disease (COVID-19) outbreak, in Salou, near Tarragona, Spain May 30, 2020. "
34,"SLAST best match: NC_006213.1_Human_coronavirus_OC43_strain_ATCC_VR-759__complete_genome

Mainly because that's the only coronavirus in the database ",Second Swiss pandemic wave ‘could be more deadly’. https://bit.ly/2yNpdt3 #Coronavirus #Covid19 #SecondWave
35,Coronavirus prompts cancellation of Lunar New Year celebration in Queens | https://www.timeout.com/newyork/news/coronavirus-prompts-cancellation-of-lunar-new-year-celebration-in-queens-012920 …,"#Egypt reports biggest daily #COVID19 #infections, increases hospitals for #coronavirus treatment. https://on.china.cn/2zKONiM"
36,Some good news on #coronavirus https://www.bloomberg.com/news/articles/2020-02-02/thailand-sees-good-result-from-using-drug-mixture-on-coronavirus …,Coronavirus: 'Dangerous moment' as UK lockdown eases 
37,"Novel Coronavirus... also known as “Wuhan Pneumonia”. It’s like regular pneumonia, but with a “Made in Wuhan” label. 

Exagerated is a better word to describe it.",Be human for once. Put your BrexitTory mentality to one side. Listen to this man too Coronavirus: 'Dangerous moment' as UK lockdown eases https://www.bbc.co.uk/news/uk-52863446
38,"It's ""steady as she goes"" for prices this week, but icebergs could be ahead, for #ausdairy commodities. The #coronavirus knocked the $A to a 10yr-low,adding 20c to the commodity value of milk which is now $A7.23kgMS http://ow.ly/5OYb50ycyOB pic.twitter.com/tUAYWMqLqT","Will there be a #secondwave of #COVID19? Here's what we know about coronavirus cases. Even before an expected second wave in the fall, the WHO warns of a smaller second ""peak"" that could come ""at any time."" "
39,"Gold: On the back foot below $1,570 as coronavirus fears recede https://s68mv.app.goo.gl/SwgKs  #Gold #China #RiskAppetite #Commodities #CentralBanks",Coronavirus Showed How Globalization Broke the World 
40,Why The Coronavirus Is A Great Opportunity To Really Put Remote Working To The Test via @forbeshttps://www.forbes.com/sites/enriquedans/2020/02/19/why-the-coronavirus-is-a-great-opportunity-to-really-put-remote-working-to-thetest/ …,Warm #weather may help #Europe avoid #secondwave of #coronavirus - for now. Fears remain that a second deadly wave could hit as temperatures fall in the autumn. 
41,"Honestly, even though I scored tickets for the #4FYN startup event, am glad the #MobileWorldCongress2020 is cancelled. Ain’t nothing worth infecting Barcelona with coronavirus.",Mayor @ClaudiaLopez this is her way to govern the city. #Colombia #coronavirus #Bogota #Shame #racism #DuqueMiserable #claudialopezesunahijueputa
42,"China ‘fully expected’ to meet trade deal terms despite coronavirus, top US officials say, reports – SCMP By @ross_burland https://s68mv.app.goo.gl/4cSdA  #China #AUDUSD #Politics #TradeWar",Cities fear #protests may fuel new wave of virus outbreaks. https://bit.ly/2zMeGyz #Coronavirus #Covid19 #SecondWave
43,"James , most famous tonight than coronavirus.","""Under a deal brokered by the German Chamber of Commerce in China, staff from hundreds of German companies with units there can return without undergoing two weeks’ quarantine if they can show a certified negative coronavirus test."" "
44,@realDonaldTrump You put this guy in charge of something as important as the Coronavirus fight?... pic.twitter.com/F74OcICux4,Trump with the help of the coronavirus are accelerating America’s decline.
45,Great infography about #Coronavirus : the new disease #Covid_19 explainedhttps://multimedia.scmp.com/infographics/news/china/article/3047038/wuhan-virus/index.html …,Wilbur Ross Says Coronavirus Could Bring Jobs Back to the U.S. http://dlvr.it/RP4tkS
46,Is coronavirus like the chicken pox like if I catch it can I catch it again,Will Wuhan virus http://www.tiradecontacto.net/periododeprueba.html become a pandemic ? #coronavirus http://tiradecontacto.blogspot.com/2014/08/mariposa-verano.html Economist
47,"#Gold pulls back from fresh seven-year high to sub-$1670 area, coronavirus in focus http://ow.ly/Degw50ytKV7 ",Talking about dark humor... I wonder if anybody already had the creepy idea to start selling a beer-based #CoronaVirus cocktail .... 
48,"Remember the OFFER lasts until the 30th of JUNE!!!
✅ Are you staying at home?
✅ Do you want to improve your english… https://t.co/bXcah1e87B",I think he has been infected with the coronavirus
49,"RT @JamesMelville: Denmark’s gold standard response to #coronavirus:

🇩🇰Immediate lockdown
🇩🇰Mass testing and tracing
🇩🇰The first country t…",Sami What's wrong? Have you been infected with the coronavirus virus? 
50,"#DalaiLama , the leader of #Tibetan #Buddhism sees reasons for optimism even in the midst of the #coronavirus pande… https://t.co/fL6VGMSPSa",Coronavirus latest: WHO declares global emergency https://www.nature.com/articles/d41586-020-00154-w?utm_source=twt_nnc&amp;utm_medium=social&amp;utm_campaign=naturenews
51,"RT @MileyCyrus: Spain, you united in solidarity with Black Lives Matter in the US. We must keep standing together to tackle #COVID19 and it…","Clarity, Please, on the Coronavirus Statistics https://issues.org/clarity-please-on-the-coronavirus-statistics/#.XjNQJ8bw8NI.twitter. #ISCIII #WuhanCoronovirus #publichealth #epidemic #WuhanCoronovirus #nCoV2019"
52,RT @TheRealPCB: Get well soon. Praying for your swift recovery!,#Coronavirus UK warns http://www.tiradecontacto.net/coplasmanrique.html against travel http://tiradecontacto.blogspot.com/2013/03/guerra-entre-los-gatos-pipas-palomitas.html to China BBC News
53,"According to industry experts the survival of small #foodtech #startups amid #Covid19 depends on two things:
abilit… https://t.co/7NO6a83pGs",Ja hi som W.H.O. Declares Global Emergency as Wuhan Coronavirus Spreads 
54,"RT @GlblCtznImpact: Thank you 💙 @mileycyrus 💙 for calling on world leaders to unite &amp; commit billions of dollars to make testing, treatment…","Dutton is the only virus I worry about, with the Corona virus we have medical professionals helping and caring for you, Dutton doesn't give a s***, for him it's an opportunity to make money and to make himself look good."
55,"RT @sanchezcastejon: Spain is coleader in initiatives such as the ACT-Accelerator to achieve equitable access to vaccines, treatments and d…",#Coronavirus Infections—More Than Just the Common Cold 
56,Leggends supports leggends,"Covid19...dr.Li Wenliang died...but Silence about the intensive care nurses. Had they become infected just like the doctor? Infected persons in ICU, doctor becomes infected, was not yet a protected clothing protocol, i have questions about the first moments... "
57,Gaga &amp; Ariana who? best collab of 2020 is coming!,Covid19 has a name: “Lucy” - I am everywhere
58,RT @sergioyellow: Gaga &amp; Ariana who? best collab of 2020 is coming!,If the coronavirus infects Xi Jinping and Kim Jong Un and kills them #COVID2019 #COVID19 #CoronavirusOutbreak #coronavirus #fucktheccp #fuckXi #fuckkimjongun
59,diiiiselo Mr Handsome las tienes a toas lokitass,"FACT....The growing covid19 virus crisis is reducing the use of brains, that is a fact. The next step is the release of primordial instincts for survival. "
60,"""Ours is a strong commitment, Miley."" 

Now I'm jealous.",COVID19 VIRUS OVERVIEW.....TODAY THE LATEST UPDATE WORLDWIDE...... GROWING AND GROWING ... WHO GENTLY OPEN THE EYES ... OR BUT AN EYE? 
61,"RT @rebecasrz: Miley I get you girl, our president is hot, but he is in a serious relationship with our VP The Ponytails, so please, back o…",OMG! Did anyone think this was possible? A pet dog gets #COVID19 from its owner. Species-jumping like this surely takes the threat to a whole new level. #Coronavirus
62,The only good things England’s still got is the queen ❤️,"How is the #CoronavirusOutbreak evolving? Read our special report ""The New #Coronavirus: Some Answers and Many Questions"" and learn more by clicking the recommended sources of information https://www.isglobal.org/en/coronavirus #COVID19 #COVID19isglobal #GlobalHealth"
63,"RT @SKyriakidesEU: The EU leads with a united front in the global effort to get to a vaccine, for our European citizens and 
for the world.…",What are the odds of getting #covid19Health4All into @potus #COVID19 funding request? About a fifth of Americans w/o pandemic coverage. Mitigation = covering this cohort.
64,"""ours is a strong commitment, Miley"" help","Official ⁦@TheEBMT⁩ communication: “EBMT duly recognizes a public concern regarding the outbreak of #COVID19. Based on the current information, the EBMT Annual Meeting will be held as scheduled 22-25 March 2020 in Madrid, Spain ”. http://newsletters.ebmt.org/view.php?J=kqh6dQ8StP6gMN9D3tmucQ&amp;C=0kpNLweBPVsxGyW7X05drg"
65,omg mr handsome,"#COVID19 JAMA: ""Current estimates of the incubation period range from 1 to 14 days with a median of 5 to 6 days"" "
66,RT @iamfalconwaseem: Terrible news. Get well soon Lala. Prayers for a speedy recovery in sha Allah🤲,"Thanks , so I understand that the diff between these 2 will be that hospitals run the test for all resp.viruses and if they dont find a d(x), then they test for COVID19 (the issue of the 10% co-infection still there though) (provided they have the in-house capacity )"
67,"Ours is a strong commitment, Hannah","""This suggests that the overall clinical consequences of Covid-19 may ultimately be more akin to those of a severe seasonal influenza”. #COVID19 "
68,"Me meo. Que Pdr le ha contestado a Miley! 2020, what a wonderful year!","There’s a hashtag for that: #COVID19Health4All to advocate for funding for these vulnerable workers in the $8 billion #COVID19 appropriation — but we got to push hard, fast! "
69,Best of both worlds 💕,Yesterday we talked to some of our visitors in #Tenerife and this is what they told us... #Coronavirus #Covid19 
70,The Climb - Miley Cyrus ft. Mr. Handsome,"""Our results reveal important commonalities between SARS-CoV-2 and SARS-CoV infection and identify a potential target for antiviral intervention."" @salutcat @SaludISCIII @SaludPublicaEs #ISCIII #COVID19 https://marlin-prod.literatumonline.com/pb-assets/journals/research/cell/CELL_S0092-8674%2820%2930229-4.pdf"
71,"""Ours is a strong commitment, Miley.""
Han tenido rollo fijo.","Scientists are racing to identify the source of the new #coronavirus so they can prevent new outbreaks. Although pangolins are a prime suspect, a slew of genetic analyses has yet to find conclusive proof http://ow.ly/cnDC30qlpT2 via @nature #COVID19 #CoronavirusOutbreak"
72,collab porfa hannah montana ft mr handsome,#COVID2019 #COVID19 #Coronavirus Do not try this at home 
73,"RT @timesofindia: HC directs Centre, Delhi govt to increase beds, ventilators for #Covid19 patients in the national capital. HC says it exp…","""We collated #COVID19 transmission events involving gatherings of close contacts. Across 10 events, we estimated primary cases infected 35% of their contacts on average. This suggests much of #COVID19 spread occurs during such interactions”"
74,"RT @GabrielMariya: Nobel Prize winner Sir Peter Ratcliffe shares his insights on #COVID19 @wef.
The #EU funded his vital #research with an…","From #WHO report: “Fundamental to these measures is extremely proactive surveillance to immediately detect cases, very rapid diagnosis and immediate case isolation, rigorous tracking and quarantine of close contacts...”. #covid19 https://www.who.int/docs/default-source/coronaviruse/who-china-joint-mission-on-covid-19-final-report.pdf"
75,I CAME IN LIKE A,"Long ago again there was a song. The ""Fallout down"" Radioactive fallout after an atomic bomb that cost thousands more lives. Now you don't notice anything and suddenly you die of covid19. "
76,RT @miyawakidinades: We stan Mr. Handsome https://t.co/h0iEHihpSF,"""As of 20 February 2020, there were 2,055 #COVID19 laboratory-confirmed cases reported among HCW from 476 hospitals across China. The majority of HCW cases (88%) were reported from Hubei."" @salutcat @SaludPublicaEs @SaludISCIII #isciii https://www.who.int/docs/default-source/coronaviruse/who-china-joint-mission-on-covid-19-final-report.pdf"
77,"RT @ITFglobalunion: Global organisations need to work together to support workers through #COVID19. Together with the @UN, we call on all c…",-- Between 1% and 5% of contacts were subsequently laboratory confirmed cases of #COVID19 @SaludPublicaEs @SaludISCIII @salvadorilla @salutcat #isciii https://www.who.int/docs/default-source/coronaviruse/who-china-joint-mission-on-covid-19-final-report.pdf
78,Love u from spain,Report of the WHO-China Joint Mission #COVID19 @salutcat -- estimate the secondary attack rate in households ranges from 3-10%. --COVID-19 is transmitted via droplets and fomites during close unprotected contact between an infector and infectee. https://www.who.int/docs/default-source/coronaviruse/who-china-joint-mission-on-covid-19-final-report.pdf
79,The best of both worlds,Report of the WHO-China Joint Mission on Coronavirus Disease 2019 (COVID-19) @salutcat @SaludISCIII @SaludPublicaEs @lozanoirene @salvadorilla #isciii #covid19 https://www.who.int/docs/default-source/coronaviruse/who-china-joint-mission-on-covid-19-final-report.pdf
80,"Marvel: Avengers Infinity War is the most ambitious crossover in history.
Pedro Sánchez: hold my beer.","Panic, not the #COVID19 #coronavirus itself, may wreck tech in 2020. http://bit.ly/2T4xwrJ"
81,"The Best of  Both Worlds (Remix)~ Hanna Montada feat Pedro Sánchez
is coming","Tip for colleagues doing #COVID19 studies No. of active peers != contagion threshold To reduce error, nodes with small threshold intervals can be used to estimate a threshold model, which can then be applied to all nodes @george_berry et al. (2018) https://arxiv.org/pdf/1702.02700"
82,RT @eurocontrolDG: Our Aviation Intelligence Unit @eurocontrol has been tracking market share since the early days of the #COVID19 crisis.…,2/3 of imported cases missed! @salutcat #isciii #covid19 
83,"RT @WorldBank: The @WorldBank is looking at #COVID19 and its effect on public-private partnerships, right now and post-crisis. #InfraFinanc…","«We collated #COVID19 transmission events involving gatherings of close contacts. Across 10 events, we estimated primary cases infected 35% of their contacts. This suggests much of #COVID19 spread occurs during such interactions.» https://secure.jbs.elsevierhealth.com/action/getSharedSiteSession?rc=1&amp;redirect=https%3A%2F%2Fwww.thelancet.com%2Fjournals%2Flancet%2Farticle%2FPIIS0140-6736%2820%2930462-1%2Ffulltext #isciii @lozanoirene"
84,Only Mr. Handsome could responderle a Miley Cyrus,"Spanish #LaLiga reportedly considering suspension or a closed-doors game for this Sunday's #RealMadrid-#Barça #ElClasico, one the biggest sportive events in #Spain and the #World #Covid19 #Coronavirus"
85,"@MileyCyrus @sanchezcastejon US, maybe you could join us in the solidarity fight against #COVID19 and its dispropor… https://t.co/FOuga8vpVr","«Therefore, it is possible that the really infected patients have been missed by using nucleic acid detection only. “ ⁦@salutcat⁩ #isciii #covid19 ⁦@SaludISCIII⁩"
86,You feel bored by your #covid19 easing lockdown bubble:-," Chinese scientists have discovered a new strain of coronavirus, a development that will test the country’s upgraded capabilities for dealing with unfamiliar infectious diseases

 http://ow.ly/AmWO30q7Obk  via @WSJ
#GlobalHealth #Virology #China"
