"Coronavirus latest: Pandemic not a time for protests, says NYC mayor"
Coronavirus denial and climate denial have one thing in common: greed | Opinion
Brazil now ranks fourth in the world in coronavirus death
Coronavirus: Biden and Trump face off over China
"Two million people shielding at home from coronavirus can go outdoors, government confirms"
"Groups representing infectious disease doctors, pediatricians and general physicians all protested President Trump's decision to withdraw from the World Health Organization on Friday, saying it will make it harder to fight the coronavirus pandemic"
Facts First: Breaking down President Trump's 654 false claims during the coronavirus pandemic
