Learn More — When Will A COVID-19 Vaccine Be Ready? A vaccine might be our best chance of stopping the virus — find out why and when one could be available. #COVID19 #coronavirus #Vaccine https://www.globalcitizen.org/en/action/quiz-when-will-a-vaccine-for-covid19-be-available/?utm_source=Iterable&amp;utm_medium=email&amp;utm_campaign=US_Apr_23_2020_COVID19_ActionDigest
"The Trump administration's response to the coronavirus pandemic has been horrible beyond words. Nearly 60,000 dead and over 1 million infected. No cohesive federal program. Abysmal per capita testing. This needs to be investigated so that this NEVER happens again."
Oops! #covid-19 #covid #corona #virus #open CNN Will Want This Video Shut Down QUICK!! Better Copy!! https://youtu.be/9QV8ekh2F18 via @YouTube
Ok people keep saying it! Yet still this #Johnson government keeps saying it's doing a great job... #coronavirus 
What a Fing sham this is. Everyone should read the article on http://Foxnews.com about how the The hospitals are getting paid extra to mark all the deaths as a corona virus death even if they died from something else. This Virus is all lies. to start a NWO
Yeah wore a mask the whole time pq corona virus (cardi b voice). Beautiful views though fr
I don’t remember how to talk and socialize because of the Coronavirus
'You can't ask people to die': Coronavirus woes deepen Argentina's crisis 
Coronavirus: Bill Gates ‘microchip’ conspiracy theory and other vaccine claims fact-checked 
Coronavirus: Belgian zoo comes back to life from lockdown 
Coronavirus: Trump terminates US relationship with WHO 
Coronavirus: India to loosen lockdown despite record cases 
