"US surpasses 60,000 deaths due to coronavirus "
Been out of work for two months going to three due to Coronavirus!!! I’ma need the support I can get for a car since I Don’t have one 
Bay Area-Based Gilead Sees Potential Legal Conflict With China Over Its Coronavirus Drug Interesting 
"""Frostbite"" toes and rashes may be signs of a coronavirus infection "
Stanford provides coronavirus testing to hospitals in Bay Area and beyond 
Desantis has stopped releasing ages of dead from coronavirus. And he won’t release the data until 9 days later. No idea why Desantis thinks that is smart except he does what @jaredkushner says to do. Hence we open on Monday.
Test for antibodies against novel coronavirus developed at Stanford Medicine 
Majority of Americans now say Donald Trump is NOT doing a good job handling coronavirus - and 80 per cent say re-opening schools like he urged is a bad idea via https://dailym.ai/ios
JIHAD WATCH reports: Chicago: Islamic preacher blames Jews for coronavirus and warns Muslims to arm themselves against 
“Chloroquine is a potent inhibitor of SARS coronavirus infection and spread. Virology Journal. (2005) 2: 69” 3.0 HCQ Lit-PD-HGS77X2-DC79 https://docs.google.com/document/u/0/d/1545C_dJWMIAgqeLEsfo2U8Kq5WprDuARXrJl6N1aDjY/mobilebasic
Evangelical church sues Newsom over coronavirus restrictions https://www.latimes.com/california/story/2020-04-28/evangelical-church-sues-newsom-over-coronavirus-restrictions #california
Is anyone else's #savings hurting right now? https://buff.ly/35hnqZ0 #personalfinance #savemoney #financialplanning #COVID19 #coronavirus 
Russia’s coronavirus outbreak is getting bad. Putin says the worst is yet to come. 
"Assuming we’re in for round two of a coronavirus outbreak, what must the Trump administration do better? E V E R Y T H I N G But they won’t. Chaos is the point. "
"My very first Boxee charm. Super excited when I received it yesterday. The box look a little beat up only because my husband took his Time to sanitize the box from outside and inside ha ha thanks to coronavirus, you… https://www.instagram.com/p/B_lYHhkpZSY/?igshid=kk4eym5fg4c5"
This scene best depicts my perception on the Coronavirus. 
"So let me get this straight: Coronavirus deaths going up in Georgia, Kemp says, “We’re opening!” Coronavirus deaths going up so teenagers can drive with parent approval without passing test, right! Georgia has become the Burmuda Triangle!"
" Dr. Carol Osborne, DVM world-renowned integrative veterinarian on Fox and Friends, The Today Show, Animal Planet plus in USA Today, LA Times. The question is “Can dogs detect the Corona Virus” This could give new meaning to “Lab Test”. http://www.chagrinfallspetclinic.com"
"#WebsiteWednesday We have added a new Question to our Outline, to bring together in one place all our new Coronavirus lessons. We have added some notes, can add more, so opening it up: Any suggestions to offer as to pandemic management?"
"I also know that many people who died of Coronavirus were never tested and were not included in the death count, so there are 2 sides to that coin"
He'd jump over 100 tubs full of coronavirus and it would be fucking awesome.
Coronavirus live news: more cases of ‘Covid-linked’ syndrome in children as UK deaths top Spain and France https://www.theguardian.com/world/live/2020/apr/30/coronavirus-live-news-more-cases-of-covid-linked-syndrome-in-children-as-uk-deaths-top-spain-and-france?utm_term=Autofeed&amp;CMP=edit_2221&amp;utm_medium=Social&amp;utm_source=Twitter#Echobox=1588204024
@GovChrisSununu can you open up the nail salons we need to get our self care treatment going and we getting sick and tired of being home from the coronavirus!!! In NH.
Coronavirus hype biggest political hoax in history - Washington Times 
And so the #MediaGenerated #panicbuying begins again. This time it is meat. No fresh hamburger or chicken left on the shelves in 2 different stores this afternoon. I never imagined that living in the United States would be like this. #coronavirus
"After coronavirus, the U.S. will ‘never return to free-market capitalism as we knew it,’ says Guggenheim’s Minerd https://www.marketwatch.com/story/after-coronavirus-the-us-will-never-return-to-free-market-capitalism-as-we-knew-it-says-guggenheims-minerd-2020-04-27?reflink=mw_share_twitter Good. We do NOT want to go back to that broken mess ..."
Joe Burrow is the real coronavirus
#e_RadioUS Buddhist monk offers guidance on saying goodbye to dying loved ones when coronavirus keeps you apart https://e-radio.us/buddhist-monk-offers-guidance-on-saying-goodbye-to-dying-loved-ones-when-coronavirus-keeps-you-apart/
"Early Addition: Jared Kushner Declares Federal Coronavirus Response ""A Great Success Story"" https://gothamist.com/news/early-addition-dog-tug-of-war?amp=1&amp;utm_medium=social&amp;utm_source=twitter&amp;utm_campaign=shared_twitter via @gothamist"
Dr. Marty Makary: US is ‘neck-and-neck’ with China in race for coronavirus vaccine | Fox News 
Oops the memo didn't get to a few pastors who died from coronavirus
"How many of those 6 million are multiples for the administration? “Pence, who leads the White House's coronavirus task force, when asked about going maskless said that he is regularly tested for the virus, and so far has been shown to be negative for it.”"
So here’s my game theory on Arizona Corona virus testing and the May 15th expansion - hospital admissions are going to require COVID 19 testing. I know - I just had it.
"Kushner calls US coronavirus response a 'success story' as cases hit 1 million So Kushner doesn't know what success means. Yeah, that sounds right. "
"Trump you’re behind in the polls because nobody wants another 4 years of your bullshit. Embracing our enemies like Putin, Kim jong Un. The gigantic amount of lies you have told. Your criminal behavior. Your impeachment. Your Corona Virus disaster, which is 100% your fault."
O.C. District Attorney warns residents after release of 7 ‘high-risk’ sex offenders during coronavirus pandemic https://ktla.com/news/local-news/o-c-district-attorney-warns-residents-after-release-of-7-high-risk-sex-offenders-during-coronavirus-pandemic/?fbclid=IwAR2xLWf15EqBQ1rxsojKPo_QBGQSha695gYjRdWugNU21FESIFM-yM9M-gI
At a gas station near me (sent to me by a friend).... I thought this was all about the #coronavirus? #CoronaHoax #COVID19.
"Reported US coronavirus cases: 7 weeks ago: 1,000 cases 6 weeks ago: 6,135 cases 5 weeks ago: 52,976 cases 4 weeks ago: 185,499 cases 3 weeks ago: 398,809 cases 2 weeks ago: 609,240 cases 1 weeks ago: 824,438 cases Right now: 1,063,351 cases"
Anyone noticed ? Why R reporters across a number of #TV network Stations while reporting n #coronavirus seem to change/ ramp up tone of voice..? The goal not to calm viewers but to invite anxiety? @NbcnightyNews @ABC @CBS
Maybe trump and Jared can build another wall now that deaths from #coronavirus have surpassed the number killed in Viet Nam. 
New York let coronavirus-infected nurses work in upstate nursing home https://nypost.com/2020/04/29/ny-state-let-coronavirus-infected-nurses-work-in-nursing-home/?utm_source=twitter_sitebuttons&amp;utm_medium=site%20buttons&amp;utm_campaign=site%20buttons via @nypmetro
Coronavirus: Gilead says remdesivir trial showed positive results with early treatment - The Mercury News. ⁦@TuckerCarlson⁩
"Great job in handling the #coronavirus in #Florida #GovDeSantis. Keep up the good work, a model for other states on individual states leadership. You and your team worked hard to save Florida’s seniors and those most vulnerable! "
"OMG that is so sad, and yet sweet. I’am sure they had more years in them. Lease say thru didn’t die of The coronavirus "
You touch that thing and you’ll catch a helluva lot more than Corona virus
"Listen I don’t wish on no man, but this mf needs to die from the Coronavirus. "
"""Coronavirus: US top infectious disease doctor says drug trial shows 'quite good news'"" #Coronavirus "
"Dr. Anthony Fauci touts the results of a trial examining remdesivir, an experimental drug treatment for the novel coronavirus, calling it “good news.” Weird thing is: The trial has not yet been peer-reviewed..."
"U.S. Coronavirus Deaths Top 60,000 — Trump's Predicted Maximum "
"Go checkout my new single ""Dangerous"" and ""Mary Jane Rock"" Available on All Music Platforms!! #music #dance #love #rnb #clerks #newmusic #newartist #artist #Tidal #newyork #california #vibes #stayhome #coronavirus #pandemic #quarintine @ComplexMusic @RocNation @defjam"
GOP Senator Calls On Elected Officials To 'Lead By Example' And Follow Coronavirus Guidelines 
I just learned that a long time friend in New Jersey just lost her husband. #coronavirus. she couldn’t be with him and all she got was an urn full of ashes. Sorry for your loss. . #JaredKushnerForPrison
Experiment Shows Sunlight and Humidity Kill Coronavirus the Fastest #OrganiNews #NaturalMedicines Follow http://Organi.News https://ift.tt/2VMaqYi #OrganiNews #NaturalMedicine
China Uses Likely Fake Coronavirus Data to Slam U.S. for ‘High’ Case Numbers | Breitbart 
Donald Trump Encouraged Sean Hannity to Go After the New York Times for Its Coronavirus Coverage 
Wuhan lab blamed for coronavirus lied about safety precautions it took during bat tests https://www.the-sun.com/news/756677/wuhan-lab-blamed-for-coronavirus-lied-about-safety-precautions-it-took-during-controversial-bat-tests/?utm_campaign=sunustwitter&amp;utm_medium=Social&amp;utm_source=Twitter#Echobox=1588184469 #coronavirus #COVID
Somehow the stories of celebrities getting Coronavirus have disappeared entirely.
Now look here - remdesivir is now being authorized....SEE THROUGH THE AGENDA and how it will ultimately fizzle away...nothing they are trying has long lasting results folks!!! BREAKING: FDA Authorizes ‘Emergency Use’ of New Coronavirus Drug as Potential Rx 
followme - Studies leave question of ‘airborne’ coronavirus transmission unanswered - The Washington Post: * Studies leave question of ‘airborne’ coronavirus transmission unanswered The Washington Post * Airborne Coronavirus Detected… http://dlvr.it/RVjqHH - followforfollow
Why Georgia Is Reopening Amid the Coronavirus Pandemic - The Atlantic 
"Welcome to Hood Burger, a Phoenix pop-up feeding 'people that need it' during coronavirus "
:Speaker Pelosi announces her picks for the Select Committee on the #Coronavirus Crisis 
"Go checkout my new single ""Dangerous"" Available on All Music Platforms!! #music #dance #love #rnb #Elaine #newmusic #newartist #artist #Tidal #newyork #california #vibes #stayhome #coronavirus #pandemic #quarintine @ComplexMusic @RocNation @defjam @djkhaled @ReverbNation"
Report: North Korea to Lock Down Through 2020 Despite ‘Zero’ Coronavirus Cases | Breitbart 
".@realDonaldTrump Today backed away from a vow made less than 24 hours earlier that the United States ""very soon"" would be able to test up to 5m people per day for coronavirus, falsely contending he never uttered those words. #TrumpLiesEverytimeHeSpeaks"
Infiniti serves up ‘Carigami' models to ease coronavirus quarantine boredom https://qoo.ly/35rfis #infiniti
How Aid Workers Are Preparing The World's Biggest Refugee Camp For Coronavirus 
New Coronavirus Test Offers Advantages: Just Spit and Wait: Saliva tests like the one developed by Rutgers are less painful for patients and less risky to medical workers. https://www.nytimes.com/2020/04/29/health/coronavirus-saliva-spit-tests.html?utm_source=dlvr.it&amp;utm_medium=twitter
"...there are NO CASES OF CORONAVIRUS AT THE PRISON, the CRIMINAL Illegal Alien Foreign Nationals are SAFER inside the Prison as long as NO ONE comes in (visitors) so this is a Political Release from a “Left Coast” liberal Judge, APPEAL THE RULING IMMEDIATELY!"
"#AssassinsCreedValhalla This is awesome news in the heartache of the coronavirus. Can't wait to see the reveal, I hope it shows different weapon types, size of the map, mythical creatures/gods and the loot."
"So, if I'm understanding this. Lloyds of London & other insurance companies offering pandemic insurance to businesses, but because #COVID19 is 'Novel' they are refusing to honor the claims being filed? Even the #coronavirus is listed as covered. #WTAF ?!"
Trump's Focus On His Base Amid Coronavirus Crisis Complicates Path To Reelection 
2 million Australians have downloaded a coronavirus contact tracing app http://dlvr.it/RVjpq3
"There’s also these gems happening in New York, like Cuomo requiring that “stable” coronavirus positive elderly patients must be accepted into nursing homes, and now this: "
"Bombshell: Investigator, David Martin, opens a ""criminal conspiracy"" case against Dr. Fauci & The CDC!!! 4/27 http://youtu.be/C2CsNqHFx68 #Like #Save #Share #Retweet #Repost #Covid19 #CoronaVirus #Coronahoax"
Coronavirus testing chief says 'no way on Earth' US can test 5 million a day 
Federal judge orders immediate release of 250 immigrant detainees held in Adelanto amid coronavirus concerns 
"Tesla's Musk doubles down against coronavirus restrictions, calling it 'fascism': "
Dogs are being trained to sniff out coronavirus cases 
"Boston mayor: Trump using a ""fear tactic"" by threatening to withhold coronavirus aid from sanctuary cities "
Wait until the depression sets in from them having 10s of thousands of coronavirus deaths
Trump hating radical leftist Pelosi fills out Dem roster on the coronavirus oversight panel. All Strong Haters of Trump | Unite America First https://uniteamericafirst.com/pelosi-fills-out-dem-roster-on-the-coronavirus-oversight-panel-all-strong-haters-of-trump/
"What ticks me off is, if that patient was dying of cancer or whatever, if they had any covid systems & die, they died of covid-19. There is NO WAY 56,000 Americans have died from the Coronavirus! Nope..it’s "
"Watch ""Breaking: Hospital Killing Coronavirus Patients"" on YouTube https://youtu.be/937WMQMyp3U @SecAzar @Mike_Pence @nypost @IU_Health @IUMedSchool @IUImpact @MayoClinic @ClevelandClinic @LouDobbs ....this has happened in other Hospitals in Europe...."
I wonder why New York is having such a tough time with coronavirus cases... 
Should rent be canceled because of the coronavirus? @YahooNews's 360° look at issues with opinions from throughout the political spectrum #RentStrike #CoronavirusUSA
Dominos Start To Fall Judge Smacks Down Democrat Governor Over Coronavirus 
Some positive news & updates on #Covid_19 research! Kudos to my colleagues &amp; fellow-scientists! Please support science. #remdesivir #coronavirus #sciencematters #research #vaccines #BREAKING
@MittRomney says government's initial response to coronavirus 'will not stand out as a great moment in American leadership' #TrumpDisinfectant #TrumpIsALaughingStock
Death toll hits 70 in coronavirus outbreak at Holyoke Soldiers’ Home 
Coronavirus: The Wrong Numbers | The American Spectator. #FauciFraud
"#NotCanceled ""Find a new book and let it become beloved."" #stayhome #coronavirus #covid19 #socialdistancing #StayAtHomeAndStaySafe"
Fear of going to the emergency room during the nationwide coronavirus outbreak may be leading to unnecessary deaths and illnesses. 
Tucker: Big Tech censors dissent over coronavirus lockdowns https://youtu.be/sPrbGU0Wyh4 via @YouTube
British PM Johnson’s fiancée gives birth to boy amid coronavirus crisis – Reuters 
‘So what?’: Bolsonaro shrugs off Brazil’s rising coronavirus death toll – The Guardian 
"Watch ""Breaking: Hospital Killing Coronavirus Patients"" on YouTube https://youtu.be/937WMQMyp3U"
New story on NPR: NFL Commissioner Gives Up His $40 Million Salary And Will Cut League Employees' Pay The news of Roger Goodell's pay cut came as an internal league memo announced executive salary reductions and furloughs of league employees. He said coronavirus-control disr…
"Jared Kushner Calls Coronavirus Response ‘a Great Success Story’ as Death Toll Nears 60,000 – The Daily Beast "
Coronavirus ‘may lurk deep in lungs after patients recover’ https://www.scmp.com/news/china/society/article/3082200/coronavirus-may-lurk-deep-lungs-after-patients-recover-study?utm_source=Twitter&amp;utm_medium=share_widget&amp;utm_campaign=3082200 via @scmpnews
"If You're Ordering Out During the Coronavirus Pandemic, Follow a Doctor's 2 Essential Tips "
Coronavirus: Why the fashion industry faces an 'existential crisis' - BBC News https://ift.tt/35jfmqH #apparel #fashion
Doctors are treating Coronavirus patients with INH drugs ! Seems promising 
"It's a coronavirus. Studies have already shown high heat and high humidity kill the bug. It may ""resurge"" in the fal right before the election. Just watch. There is no election next year."
New video out! Junior doesn’t feel well! Junior goes to the store and comes across Blue Yoshi who has a virus! Junior then gets infected by the virus! How will Junior get better? Watch the video to find out! #coronavirus #Covid_19 #QuarantineLife #Quarantine #supermario #mario
I’ve worked the coronavirus front line — and I say it’s time to start opening up ⁦@NYGovCuomo⁩ ⁦@markpoloncarz⁩
"Whether it is cybersecurity, counterterrorism, infrastructure protection, election integrity, or disinformation campaigns levied by bad actors, the coronavirus has amplified gaps and exacerbated vulnerabilities. #CyberSecurity"
"What the f*** is going on in New York City! Y'all are crazy. Governor sending sick coronavirus patients to nursing homes with body bags, then this? Oh my God. You know I always wanted to go to New York City. I don't anymore."
"""...New York entered into the contract with Oren-Pines at the direct recommendation of the White House coronavirus task force."" I wonder who that was. "
"Gold's coronavirus rally has room to run, and it could jump 5% in the coming weeks, UBS said - "
Most Americans cannot or will not use coronavirus contact tracing apps https://techday24.com/most-individuals-cant-or-wont-use-coronavirus-contact-tracing-apps/
Remdisivir was reported to be effective against the Coronavirus by physicians overseas prior to Feb 2020. (Simple internet search). Dr Faux-ci &amp; FDA “suddenly “ discovered its effectiveness. Bizarre.
"Satan knows, as long as he can keep us blaming and pointing fingers at each other, we are not focusing on the problem ! #coronavirus #Leadership #StayHome"
Hope everyone is staying safe and washing their hands! #COVID19 #coronavirus #SaferAtHome #StayHome #StayHomeSaveLives #BrokenDollGamers #MaryJanesRascals
Nothing matters besides corona Virus
Utah aims to give coronavirus mask to every resident in state | Fox News 
"The controversial experiments and Wuhan lab suspected of starting the coronavirus pandemic https://www.newsweek.com/controversial-wuhan-lab-experiments-that-may-have-started-coronavirus-pandemic-1500503 Sounds like another ""The Hot Zone"" release ! #fbr"
Dr. Fauci Responds to Jim Acosta’s Coronavirus Conspiracies Question: ‘Nothing But a Distraction’ Read More: http://tinyurl.com/y6wpvk86 #AnthonyFauci #CNN #coronavirus #jimacosta
"I'm sure that was why, and why MERS vaccine developments have continued to this day, with none reaching a status of ""safe and effective"". The inconsistent and short lived nature of coronavirus immunities means that a vaccine will not effectively provide long term protection."
" Live Coronavirus Pandemic: Real Time Counter, World Map, News, Maps and Cases Update Read More: http://tinyurl.com/yavvuv9z #corona #CoronaLive #coronaliveupdatetoday #coronavirusbreakingnews #coronavirus #coronaviruschina #coronaviruslive #coronaviruslivemap"
Polls show propaganda is working to mislead Americans about coronavirus 
Trump set to travel to Arizona next week amid push to lift coronavirus restrictions https://anypoll.app/2020/04/29/trump-set-to-travel-to-arizona-next-week-amid-push-to-lift-coronavirus-restrictions/
Trump set to travel to Arizona next week amid push to lift coronavirus restrictions https://anypoll.app/2020/04/29/trump-set-to-travel-to-arizona-next-week-amid-push-to-lift-coronavirus-restrictions/
"New: Dr. @alexvespi &amp; @TheAtlantic's #GeorgePacker join @Isikoff @dklaidman @SkullduggeryPod. Dr. explains his #coronavirus model exposing an undetected silent chain of transmission early on. Packer, explains why #America is fast resembling a failed state."
I know that the coronavirus has caused a lot bad stuff for a lot of people but I can't help but be optimistic about you guys getting back on track soon. This revised schedule has me seeing for #KB1 &amp; @CGRTeams
SIGN: Stop Boiling Black Cats into Paste as Coronavirus 
CC:@IlhanMN IT'S You MORAN! PPL Like U FOREIGNERS/OUTSIDERS Who Bring Into OUR Country All Illnesse's &amp; Disease's! Stay Away! Go Back! Anyway's You Hate AMERICA! GET IT!! PPL like you gave me the #coronavirus Thank God I Made it! Still under Dr's Prov Home Health Care.
"The backlash over fumbled coronavirus stimulus is starting, and it's all on Trump #SmartNews"
Just a quick shout out to all of our health care workers and a big condolences to the people who have lost loved ones during these troubling times. Love you all #coronavirus #FightAgainstCorona
Coronavirus: We Need 1 Million Tests a Week - The Atlantic 
"Coronavirus crisis lays bare the risks of financial leverage, again https://finance.yahoo.com/m/764d4dce-3cd8-33d4-a39f-21dc7ea8ccbe/coronavirus-crisis-lays-bare.html?soc_src=social-sh&amp;soc_trk=tw via @YahooFinance"
"President @realDonaldTrump is leading an unprecedented coronavirus response, and the numbers don’t lie – he has delivered huge results! Read these great stories from across the country "
the north korean government when someone tests positive for coronavirus 
"Coronavirus Insights: Bank Reopening Checklist, Digital Ad Upheaval https://bit.ly/3f29iHo"
@Maddow I worked in Greeley meat packing plant while implementing health &amp; safety software. The work conditions were horrific then. And now? They’ll all get #coronavirus. The meat and packaging can spread #coronavirus so avoid meat unless you have local source. #COVID19
"Can we get a pic and a name? I miss my CC too, I haven’t seen him in weeks due to Coronavirus "
‘Operation Warp Speed’ aims to produce coronavirus vaccine by end of 2020: Report | Washington Examiner 
Cancer Cancer patients are at a greater risk of severe coronavirus complications due to their compromised immune system (American Cancer Society (ACS)). Individuals undergoing chemotherapy or having bone marrow transplants should remain highly cautious. 
"Trump plans on 'sacrificing others' with new coronavirus strategy, former Bush aide warns #SmartNews"
Coronavirus: Anger after Panorama claims government 'failed to stockpile crucial PPE' 
Statewide death toll from coronavirus climbs above 800 
Covid-19 coronavirus: Impact on the real estate market in China https://www.allenovery.com/en-gb/global/news-and-insights/publications/covid-19-coronavirus-impact-on-the-real-estate-market-in-china
Ben will be 80 someday too...unless he succumbs to coronavirus or his foolishness results in an earlier demise for some other reason.
'Enough is enough': Virginia GOP blasts Ralph Northam over lack of coronavirus testing after state ranks second-to-last #SmartNews
Coronavirus: Warning as major study claims most elderly victims 'would not have died otherwise' #SmartNews
"Folks, at the cars lined up at the Los Angeles Regional Food Bank! Poverty is just as harmful as Coronavirus! It’s time to #EndTheLockdown It’s time to #OpenUpAmericaAgain"
*gigglesnort* #WuhanVirus #CoronaVirus #PandemicHoax
Very eloquent..I feel exactly the same way! Eff’ the Coronavirus!!
Closed Gate with STOP CORONAVIRUS Sign on Saudi Arabian Flag Background https://1.envato.market/c/1301216/475676/4415?u=https://videohive.net/item/closed-gate-with-stop-coronavirus-sign-on-saudi-arabian-flag-background/26170501?ref=videogtx #coronavirus #covid-19 #dange
Can coronavirus spread in pools? 
3 ways to make your boss notice you even while #workingfromhome during coronavirus #quarantine https://bit.ly/2yQA2KC #remotework #wfh
Disease-modifying therapies used to treat several immune-mediated disorders in neurology may make patients more susceptible to the novel coronavirus. 
BBC Alert! Coronavirus: Madrid's balcony cinema screens films for people in lockdown https://j.mp/35hI3Ee #News
"Coronavirus live updates: U.S. surpasses 60,000 COVID-19 deaths "
They can take the guns of a coronavirus conspiracy theorist but they can't get the jews to properly social distance themselves in NYC...our government is pretty much completely useless.
"Thousands of cars lined up Weds. at a Houston food bank distribution center in Texas. As the #coronavirus pandemic wears on, more Americans are seeking food assistance. THURSDAY: @JanetShamlian looks at the pressures food banks are under as demand surges across the country."
Big commercial labs given priority for coronavirus testing equipment by feds 
'You all absolutely did this': Rutgers professor blames Trump supporters for coronavirus deaths #SmartNews
"Kidney disease Anyone who is on dialysis for kidney issues will have a weakened immune system, making them more susceptible to the coronavirus. The National Kidney Foundation notes that this is not a reason to stop dialysis, but it is necessary to take added precautions. "
"The deal is that some coronavirus cases popped up in meat processing plants. Tyson was afraid it would be sued, so by Trump calling for them to produce under the Defense Security Act, they are protected from liability."
"I know it’s crazy, but we can try to prevent deaths from both. We don’t have to choose between massive numbers of casualties from either starvation or coronavirus. That’s not a choice."
