"Commonwealth Bank, NAB home loan repayment changes sparked by coronavirus may hit borrowers "
"Kim Jong-un's North Korea claims to have zero cases of coronavirus, but with a weak health system some experts doubt this is possible "
Coronavirus: Tui extends holiday cancellations until mid-June 
Coronavirus: Wetherspoon targets June re-opening as beer garden hopes shattered 
Coronavirus: West Midlands Police officer's tearful thanks to NHS as he leaves hospital 
Coronavirus: Prince Charles's message to British Asians 
"Coronavirus: 'This isn't the first time we've had a virus come out of China,' says Mike Pompeo "
Coronavirus: Swiss children under 10 allowed to hug grandparents as they 'do not transmit COVID-19' 
Coronavirus: NHS warns BAME staff 'at potentially greater risk' 
Coronavirus: Warning as major study claims most elderly victims 'would not have died otherwise' 
Coronavirus: 'Worrying' rise in traffic as car use hits highest level since lockdown began 
