COVID-ALERT: Kushner calls US coronavirus response a 'success story' - Global Pandemic News | #Coronavirus #COVID19 - https://globalpandemic.net/news/kushner-calls-us-coronavirus-response-a-successstory/
Coronavirus: San Angelo Has Rent &amp; Mortgage Assistance Funds - San Angelo LIVE! 
'All hands on deck': Grocery store executives get a taste of the hard life on #coronavirus front lines http://business.financialpost.com/wcm/4772dbff-bb6d-4744-8e27-26b4e3639f4c via @nationalpost
COVID-ALERT: Fauci optimistic about remdesivir as treatment for COVID-19 - Global Pandemic News | #Coronavirus #COVID19 - https://globalpandemic.net/news/fauci-optimistic-about-remdesivir-as-treatment-forcovid-19/
A water company has said it has seen sewer blockages rise by almost 20% in some areas as a result of the #coronavirus lockdown 
Small Business Administration rule disqualifies many space startups from coronavirus relief loans – http://SpaceNews.com READ MORE: https://blog.iammarketingmedia.com/small-business-administration-rule-disqualifies-many-space-startups-from-coronavirus-relief-loans-spacenews-com/?utm_campaign=twitter&amp;utm_medium=twitter&amp;utm_source=twitter #Billion #business #Commerce #Company #Economics #Economy #Entrepreneur #Entrepreneurship #Founder #Funding
COVID-ALERT: Michelle Obama records call telling DC residents about free coronavirus testing - Global Pandemic News | #Coronavirus #COVID19 - https://globalpandemic.net/news/michelle-obama-records-call-telling-dc-residents-about-freecoronavirus-testing/
"Support the @RobPBirthdayPro Robert Pattinson 34th birthday Project! Money goes to @thegocampaign #covid19 Emergency Relief Fund! Let's support his fundamental belief of equal rights. DONATE https://gocampaign.org/campaigns/robs-birthday (Total: $3,385 4/29) #WeGOforRob #GOCampaign #coronavirus "
Netflix has a movie out about the Coronavirus
COVID-19 drama in Ekiti : Father Denied SON Entering His House so as to Prevent Coronavirus https://bacladtvonline.com/covid-19-drama-in-ekiti-father-denied-son-entering-his-house-so-as-to-prevent-coronavirus/
"COVID-ALERT: Broncos remaining flexible on season tickets, putting priority on partnership relations amid coronavirus pandemic - Global Pandemic News | #Coronavirus #COVID19 - https://globalpandemic.net/news/broncos-remaining-flexible-on-season-tickets-puttingpriority-on-partnership-relations-amid-coronavirus-pandemic/"
"Fighting Stigma — What Needs to Be Understood About Coronavirus and Obesity: ""But there is a weight stigma that doesn't get accounted for, and it needs to be,"" says Harrison. Weight stigma (aka weight bias or weight-based ... http://dlvr.it/RVjqmR"
COVID-ALERT: Illinois delays awarding 75 licenses for new marijuana dispensaries amid coronavirus outbreak - Global Pandemic News | #Coronavirus #COVID19 - https://globalpandemic.net/news/illinois-delays-awarding-75-licenses-for-new-marijuanadispensaries-amid-coronavirus-outbreak/
COVID-ALERT: The Coronavirus Stimulus Package Is a Mess - Global Pandemic News | #Coronavirus #COVID19 - https://globalpandemic.net/news/the-coronavirus-stimulus-package-is-a-mess/
" CHEER CHILDREN NOW AT HOME, WITH BABY TURTLE'S SONG OF HOPE ""I'm coming Mama, I'll see you soon, I know just how, I'll follow the moon."" http://Amazon.com/dp/B004BSGJFW • Proceeds to turtle charity • Bestseller — 2M sold! @stephanietara #Coronavirus #homeschooling #kids"
Half(!) of Americans say it’s hard to separate coronavirus facts from fiction READ MORE: https://blog.iammarketingmedia.com/half-of-americans-say-its-hard-to-separate-coronavirus-facts-from-fiction/?utm_campaign=twitter&amp;utm_medium=twitter&amp;utm_source=twitter #cdc #coronavirus #covid19 #mers #outbreak #pandemic #sars #ViralOutbreak #virus #who
"COVID-ALERT: As Fighting Surges, Yemen Is Hit With 1st Cluster of Covid-19 Infections - Global Pandemic News | #Coronavirus #COVID19 - https://globalpandemic.net/news/as-fighting-surges-yemen-is-hit-with-1st-cluster-ofcovid-19-infections/"
4 ways marketers can navigate the new normal during Coronavirus. More from our Publishing Partner. http://ow.ly/xeFi50zs4Po
Kansas Governor Says Medical Marijuana Still On The Table In 2020 Despite Coronavirus https://www.marijuanamoment.net/kansas-governor-says-medical-marijuana-still-on-the-table-in-2020-despite-coronavirus/ #MME #marijuana #cannabis #medicalmarijuana #Kansas
COVID-ALERT: Here Are The Last 34 Countries On Earth Yet To Report A Single COVID-19 Case - Global Pandemic News | #Coronavirus #COVID19 - https://globalpandemic.net/news/here-are-the-last-34-countries-on-earth-yet-to-report-asingle-covid-19-case/
Premier League players have doubts about restarting the season due to coronavirus pandemic (via @AlexShawESPN) #Footy #Soccer #PL #StayHome #COVID19
COVID-ALERT: Coronavirus pandemic halts climate research - Global Pandemic News | #Coronavirus #COVID19 - https://globalpandemic.net/news/coronavirus-pandemic-halts-climate-research/
"Dow Jones Futures: Tesla, Facebook, Microsoft, Apple In Buy Zones As Coronavirus Stock Market Rally Surges - Investor's Business Daily "
COVID-ALERT: BREAKING: Trump to Take Action Against China and WHO Over COVID-19 - Global Pandemic News | #Coronavirus #COVID19 - https://globalpandemic.net/news/breaking-trump-to-take-action-against-china-and-who-overcovid-19/
COVID-ALERT: Michigan's Frontline Coronavirus Workers Could Get Free College Tuition Under Governor's Plan - Global Pandemic News | #Coronavirus #COVID19 - https://globalpandemic.net/news/michigans-frontline-coronavirus-workers-could-get-freecollege-tuition-under-governors-plan/
Coronavirus: India's Alpine flag show and other claims checked 
Tucker: Big Tech censors dissent over coronavirus lockdowns https://youtu.be/sPrbGU0Wyh4 via @YouTube
Drug proves effective against virus as economic damage rises. https://apnews.com/923e7fe01b35888ff5562ca577a26aa4 #Coronavirus #covid19 #US #drug #effective #recovery
"Coronavirus live updates: GE warns of Q2 financial hit, Russia approaches 100,000 cases READ MORE: https://blog.iammarketingmedia.com/coronavirus-live-updates-ge-warns-of-q2-financial-hit-russia-approaches-100000-cases/?utm_campaign=twitter&amp;utm_medium=twitter&amp;utm_source=twitter #BillGates #ElonMusk #JeffBezos #LarryEllison #LarryPage #MarkBenioff #MichaelDell #MikeBloomberg #RichardBranson #RiedHoffman"
COVID-ALERT: Coronavirus Antibodies Present in 16 Percent of First Responders Tested Across New York - Global Pandemic News | #Coronavirus #COVID19 - https://globalpandemic.net/news/coronavirus-antibodies-present-in-16-percent-of-firstresponders-tested-across-new-york/
Using #AI AI to cope in the #coronavirus era - ​ http://rcnt.eu/le71z via @raconteur #ArtificialIntelligence #COVID19 #Covid_19india #Automation
"President Trump thinks the New York Yankees can play at Yankee Stadium with fans this year. The coronavirus is “going away,” he says. "
Maryland reports 906 newly confirmed coronavirus cases as number of tests increase READ MORE: https://blog.iammarketingmedia.com/maryland-reports-906-newly-confirmed-coronavirus-cases-as-number-of-tests-increase/?utm_campaign=twitter&amp;utm_medium=twitter&amp;utm_source=twitter #cdc #coronavirus #covid19 #mers #outbreak #pandemic #sars #ViralOutbreak #virus #who~
COVID-ALERT: North Carolina Tattoo Artist Arrested for Opening Store in Defiance of Coronavirus Lockdown Measures - Global Pandemic News | #Coronavirus #COVID19 - https://globalpandemic.net/news/north-carolina-tattoo-artist-arrested-for-opening-store-indefiance-of-coronavirus-lockdown-measures/
meanwhile BBC its all about your traitor PM Johnson new born baby never mind the #dead British public nurses and all BBC is a mouthpiece for deep state propaganda driven to brain wash UK public in this #coronavirus call it out for what it is BS Figures are inflated #covid19
The Bible tithe is crops and cattle inside Israel. The erroneous tithe churches require is monetary income. Now that churches face #coronavirus what inventions will be used to extract false tithes? https://store.bookbaby.com/book/kleptomaniac #tithenomore @drfrankchasejr.
COVID-ALERT: U.S. Navy Ship Sails in Disputed Sea Amid Escalating Tensions With China Over Coronavirus Pandemic - Global Pandemic News | #Coronavirus #COVID19 - https://globalpandemic.net/news/u-s-navy-ship-sails-in-disputed-sea-amid-escalatingtensions-with-china-over-coronavirus-pandemic/
"Coronavirus cure? - ""Put down the bleach, remdesivir is coming"" https://www.forexlive.com/news/!/coronavirus-cure-put-down-the-bleach-remdesivir-is-coming-20200429"
"한국말 - 朝鮮 : South Korea's healthcare response to the coronavirus: Much has been written about South Korea's phenomenal testing programme: with test numbers on a par with Singapore, South Korea rolled out ... View article... http://dlvr.it/RVjn5C"
Coronavirus: Japan's low testing rate raises questions 
"Nigeria, Brazil confirms first coronavirus case same day. As of today, Thursday, April 30 Brazil: 78,162 cases5,466 deaths and 339,552 test. Nigeria: 1,728 cases 51 deaths and 12,004 test. Population; Nigeria 200+ million Brazil 200+ million "
COVID-ALERT: Pompeo warns of consequences if any Americans wrongfully detained overseas die from coronavirus - Global Pandemic News | #Coronavirus #COVID19 - https://globalpandemic.net/news/pompeo-warns-of-consequences-if-any-americans-wrongfullydetained-overseas-die-from-coronavirus/
#AI steps up in the battle against #Coronavirus 
China will reopen the Forbidden City this week after it was closed three months ago due to coronavirus 
COVID-ALERT: U.S.-China tensions escalate over COVID-19 response - Global Pandemic News | #Coronavirus #COVID19 - https://globalpandemic.net/news/u-s-china-tensions-escalate-over-covid-19-response/
COVID-ALERT: Protests erupt in Lebanon as coronavirus outbreak fuels economic panic - Global Pandemic News | #Coronavirus #COVID19 - https://globalpandemic.net/news/protests-erupt-in-lebanon-as-coronavirus-outbreak-fuelseconomic-panic/
Gilead’s remdesivir improves recovery time of coronavirus patients in NIH trial https://wapo.st/2VLyOcm
COVID-ALERT: Sales of cheap beer are taking off during the coronavirus pandemic - Global Pandemic News | #Coronavirus #COVID19 -
China is taking these steps to avoid a second wave of COVID-19 https://bit.ly/3aGib6c #coronavirus #China
"We totally agree that more questioners need to be asking more questions surrounding Coronavirus=&gt;COVID19/Novel Coronavirus &amp; anything that is happening on our planet in connection with it. We also agree that ALL information uncovered, no matter what it is, MUST be shared openly."
How Concern Over Climate Change Correlates With Coronavirus Responses READ MORE: https://blog.iammarketingmedia.com/how-concern-over-climate-change-correlates-with-coronavirus-responses/?utm_campaign=twitter&amp;utm_medium=twitter&amp;utm_source=twitter #Adaptation #Antarctica #Arctic #CarbonDioxide #ClimateAction #ClimateChange #ClimateScience #climatology #Companies #Environment~
EXCLUSIVE: A 30-year-old Native American woman died from COVID-19 after giving birth in a prison where staffers had been warning that inmates were at risk of contracting the coronavirus. 
"""How the coronavirus came surging back in Singapore"" "
"We totally agree that more questioners need to be asking more questions surrounding Coronavirus=&gt;COVID19/Novel Coronavirus &amp; anything that is happening on our planet in connection with it. We also agree that ALL information uncovered, no matter what it is, MUST be shared openly."
COVID-ALERT: New Coronavirus Test Offers Advantages: Just Spit and Wait - Global Pandemic News | #Coronavirus #COVID19 - https://globalpandemic.net/news/new-coronavirus-test-offers-advantages-just-spit-andwait/
"We totally agree that more questioners need to be asking more questions surrounding Coronavirus=&gt;COVID19/Novel Coronavirus &amp; anything that is happening on our planet in connection with it. We also agree that ALL information uncovered, no matter what it is, MUST be shared openly."
And researchers in France are conducting tests believing that nicotine possibly kills the #coronavirus as fewer smokers succumb to the disease ... apparently
https://facebook.com/104857681107232/videos/250111502808327 The #communist party tentacles in #canada must end. #FireTam #TedrosResign #who #virus #covid19 #COVIDCanada #coronavirus
"True! When each one of us do small things to stop coronavirus, these small things are going to be huge and we'll get the beautiful world back again! So, we're gonna keep doing small things together for everyone! #Stay_Strong_Everyone #Stay_Safe #StayHome"
Online Chat | ‘We Are Working Together’: Pastor Shares How People in Detroit Are Uniting to Combat the Coronavirus https://christianschat.net/News/?p=26465
"""Frozen foods become ‘sales powerhouse’ during coronavirus pandemic"" https://ift.tt/2yRiTjZ #Supermarketnews"
COVID-ALERT: Dirty money piling up in L.A. as coronavirus cripples international money laundering - Global Pandemic News | #Coronavirus #COVID19 - https://globalpandemic.net/news/dirty-money-piling-up-in-l-a-as-coronavirus-cripplesinternational-money-laundering/
COVID-ALERT: Taiwan's Coronavirus Moment — And Delicate Balancing Act - Global Pandemic News | #Coronavirus #COVID19 - https://globalpandemic.net/news/taiwans-coronavirus-moment-and-delicate-balancingact/
"The boss of Wetherspoon's is targeting a re-opening of his pubs in late June, after bars were closed at the start of the #coronavirus lockdown "
COVID-ALERT: Medical experts on the lookout for new symptoms among children with COVID-19 - Global Pandemic News | #Coronavirus #COVID19 - https://globalpandemic.net/news/medical-experts-on-the-lookout-for-new-symptoms-amongchildren-with-covid-19/
WHO reports 3 million coronavirus infected worldwide https://ordonews.com/who-reports-3-million-coronavirus-infected-worldwide/
COVID-ALERT: Alleged cold case Livermore sex assault offender released from custody amid coronavirus concerns - Global Pandemic News | #Coronavirus #COVID19 - https://globalpandemic.net/news/alleged-cold-case-livermore-sex-assault-offender-releasedfrom-custody-amid-coronavirus-concerns/
"Once you carry your own #water, you'll learn the value of every drop. Here Pumulo Inambao collecting water from the Zambezi river in Mwandi, #Zambia. #coronavirus #africa #WeAreInThisTogether"
"Fighting stigma — What science can tell us about the psychological impacts of coronavirus isolation: For instance, one of the studies found that among hospital workers, being ... for other diseases like cancer, Alzheimer's, and cardiovascular disease. http://dlvr.it/RVjjp5"
"Fighting Stigma : Coronavirus Lockdown XI: Why India's health policy needs a course correction: He wrote how private healthcare ""should be the core of national health effort"", that India is passing through ""century's biggest crisis"" which calls for… http://dlvr.it/RVjjnx"
COVID-ALERT: Coronavirus compels The Weeknd to renew lease on Manhattan penthouse - Global Pandemic News | #Coronavirus #COVID19 - https://globalpandemic.net/news/coronavirus-compels-the-weeknd-to-renew-lease-on-manhattanpenthouse/
GREECE ENTERS THE SECOND STAGE OF THE PREVENTION PLAN OF CORONAVIRUS PANDEMIC https://www.bloglovin.com/blogs/ellwed-19143427/greece-enters-second-stage-prevention-plan-7447365545 on @bloglovin
COVID-ALERT: Federal inmate with coronavirus dies after giving birth on ventilator - Global Pandemic News | #Coronavirus #COVID19 - https://globalpandemic.net/news/federal-inmate-with-coronavirus-dies-after-giving-birth-onventilator/
"New Release! Preparing for a Lockdown. How to stay positive, safe and self sufficient. http://Amazon.com/dp/B086J6QZQV #health #eBook #coronavirus #bookboost @Suzanne_Lowe_ #SilvergumPublishing"
"Coronavirus live updates: deaths and cases – UK, Australia, Canada, Spain… news today READ MORE: https://blog.iammarketingmedia.com/coronavirus-live-updates-deaths-and-cases-uk-australia-canada-spain-news-today/?utm_campaign=twitter&amp;utm_medium=twitter&amp;utm_source=twitter #BillGates #ElonMusk #JeffBezos #LarryEllison #LarryPage #MarkBenioff #MichaelDell #MikeBloomberg #RichardBranson #RiedHoffman"
COVID-ALERT: Massachusetts sees spike in domestic abuse 911 calls during coronavirus lockdown - Global Pandemic News | #Coronavirus #COVID19 - https://globalpandemic.net/news/massachusetts-sees-spike-in-domestic-abuse-911-calls-duringcoronavirus-lockdown/
"With 74 new fatalities CT deaths near 2,000 in coronavirus pandemic READ MORE: https://blog.iammarketingmedia.com/with-74-new-fatalities-ct-deaths-near-2000-in-coronavirus-pandemic/?utm_campaign=twitter&amp;utm_medium=twitter&amp;utm_source=twitter #cdc #coronavirus #covid19 #mers #outbreak #pandemic #sars #ViralOutbreak #virus #who~"
COVID-ALERT: Here are the very latest Massachusetts town-by-town coronavirus numbers - Global Pandemic News | #Coronavirus #COVID19 - https://globalpandemic.net/news/here-are-the-very-latest-massachusetts-town-by-towncoronavirus-numbers/
"From education and economic opportunities to domestic violence, the #coronavirus pandemic has intensified preexisting gender gaps and inequalities. @WorldBank explains."
Remdesivir: early findings on experimental coronavirus drug offer 'quite good news' 
COVID-ALERT: Nancy Pelosi taps Bill Foster to new House COVID-19 watchdog panel - Global Pandemic News | #Coronavirus #COVID19 - https://globalpandemic.net/news/nancy-pelosi-taps-bill-foster-to-new-house-covid-19-watchdogpanel/
Austria says it might demand Lufthansa stake for Austrian Airlines aid: http://ow.ly/pcVc30qBRk9 #Aviation #Airline #COVID19 #Coronavirus 
COVID-ALERT: Uptown hospital successfully treats coronavirus patient with blood plasma from someone who recovered from the sickness - Global Pandemic News | #Coronavirus #COVID19 - https://globalpandemic.net/news/uptown-hospital-successfully-treats-coronavirus-patient-withblood-plasma-from-someone-who-recovered-from-the-sickness/
but the majority are not dying from #coronavirus Uk Gov is corrupt and has failed its people. Uk Gov #clown PM Johnson is an idiot and will wreck UK #economy BBC is a deep state mouthpiece all Brits need to unplug and stop paying them anything. UK is now a failed country
Coronavirus: Why so many US healthcare workers are out of work 
"Masergy is proud to support @MasksForDocs, a nonprofit whose sole mission is to get #PPE into the hands of #HealthCareWorkers. In addition to donating supplies, we are also matching employee cash contributions. To learn more, visit https://buff.ly/2VN0756 #coronavirus #COVID19"
COVID-ALERT: Who can get a coronavirus test and how long does it take to get results? - Global Pandemic News | #Coronavirus #COVID19 - https://globalpandemic.net/news/who-can-get-a-coronavirus-test-and-how-long-does-it-take-toget-results/
Coronavirus testing reveals dozens of cases at Marine Corps Recruit Depot San Diego 
"I lift my voice for all those facing the pain of the coronavirus pandemic. You are not alone, the Lord will rescue You! #Smule:"
Coronavirus Update: SF Mayor Breed Apologies To FEMA For PPE Hijacking Remarks; Feds Probe 3rd Party Supplier READ MORE: https://blog.iammarketingmedia.com/coronavirus-update-sf-mayor-breed-apologies-to-fema-for-ppe-hijacking-remarks-feds-probe-3rd-party-supplier/?utm_campaign=twitter&amp;utm_medium=twitter&amp;utm_source=twitter #BillGates #ElonMusk #JeffBezos #LarryEllison #LarryPage #MarkBenioff #MichaelDell #MikeBloomberg #RichardBranson #RiedHoffman~
Quebec to gradually lift travel restrictions in some regions amid coronavirus pandemic http://dlvr.it/RVjgCv #projecthopetravel #travel #news
"We’ll Proffer Local Cure For Coronavirus Soon, Says Ooni Of Ife https://www.chukslyonews.com/2020/04/29/well-proffer-local-cure-for-coronavirus-soon-says-ooni-of-ife/ #SavageRemix #VictimsOfAbujaMassacre #SaySoRemix #FreeMubarakBala #Cyprus #Estonia"
Tesla's profit streak not derailed by coronavirus as auto industry braces for losses http://dlvr.it/RVjg2y
"COVID-ALERT: Public, private health labs may never be able to meet demand for coronavirus testing over supply chain shortages - Global Pandemic News | #Coronavirus #COVID19 - https://globalpandemic.net/news/public-private-health-labs-may-never-be-able-to-meet-demandfor-coronavirus-testing-over-supply-chain-shortages/"
Tesla posts slight profit as the coronavirus puts a damper on expectations 
"Coronavirus cases spiked after these counties reopened. Now, officials are scaling back READ MORE: https://blog.iammarketingmedia.com/coronavirus-cases-spiked-after-these-counties-reopened-now-officials-are-scaling-back/?utm_campaign=twitter&amp;utm_medium=twitter&amp;utm_source=twitter #cdc #coronavirus #covid19 #mers #outbreak #pandemic #sars #ViralOutbreak #virus #who~"
MEDICAL COLUMN: Mental health in the time of the coronavirus READ MORE: https://blog.iammarketingmedia.com/medical-column-mental-health-in-the-time-of-the-coronavirus/?utm_campaign=twitter&amp;utm_medium=twitter&amp;utm_source=twitter #AnimalLiberation #Diabetes #EatPlants #Environment #GoVegan #Health #Healthspan #HealthTech #Lifespan #LifestyleMedicine~
Live: Global coronavirus cases pass 6 million READ MORE: https://blog.iammarketingmedia.com/live-global-coronavirus-cases-pass-6-million/?utm_campaign=twitter&amp;utm_medium=twitter&amp;utm_source=twitter #BillGates #ElonMusk #JeffBezos #LarryEllison #LarryPage #MarkBenioff #MichaelDell #MikeBloomberg #RichardBranson #RiedHoffman
"COVID-ALERT: Mom Survives COVID-19 After Being Given Experimental Drug, As Mandatory Vaccine Agenda Moves Forward - Global Pandemic News | #Coronavirus #COVID19 - https://globalpandemic.net/news/mom-survives-covid-19-after-being-given-experimental-drugas-mandatory-vaccine-agenda-moves-forward/"
Post-coronavirus fate differs among Shenzhen tech startups READ MORE: https://blog.iammarketingmedia.com/post-coronavirus-fate-differs-among-shenzhen-tech-startups/?utm_campaign=twitter&amp;utm_medium=twitter&amp;utm_source=twitter #Billion #business #Commerce #Company #Economics #Economy #Entrepreneur #Entrepreneurship #Founder #Funding
COVID-ALERT: What’s the Risk of Catching Coronavirus From a Surface? - Global Pandemic News | #Coronavirus #COVID19 - https://globalpandemic.net/news/whats-the-risk-of-catching-coronavirus-from-asurface/
"COVID-ALERT: Amid coronavirus crisis, Nuggets legend Dikembe Mutombo can’t stop playing defense - Global Pandemic News | #Coronavirus #COVID19 - https://globalpandemic.net/news/amid-coronavirus-crisis-nuggets-legend-dikembe-mutombocant-stop-playing-defense/"
Hope In The Worldwide Storm! Full video -> ​https://lov3rzcommunity.blogspot.com/2020/04/blog-post.html​ ​#30days30videos​ ​#MessageToChristians​ #MusicLov3rz #WW ​#Philippeans1v12​ ​#CoronaVirus​ ​#COVID19​ ​ &gt;&gt;
Protect yourself with #style ! #stylish #coronavirus #covid_19 #covid19 #pandemic #uk #face #facemask #fashion #fashionista #menswear #mensfashion #instagram #instagood https://www.instagram.com/p/CA1Jsn9pypa/?igshid=18ip18263zwsl
"Arsenal agreed a reduction in wages for players to cope with the coronavirus pandemic, with David Luiz’s salary around £120k a week. He is unlikely to be offered those terms but could be offered an incentivised deal with a lower basic salary to stay. (@TelegraphSport)"
"Amid coronavirus pandemic, protesters rally for pregnant inmates at Raleigh prison - Greensboro News &amp; Record "
Coronavirus: The self-isolation choir with worldwide members http://dlvr.it/RXgsqs
"COVID-ALERT: Coronavirus: Monterey County restaurants, other services get the all clear - Global Pandemic News | #Coronavirus #COVID19 - https://globalpandemic.net/news/coronavirus-monterey-county-restaurants-other-services-getthe-all-clear/"
Coronavirus &amp; Schools: • 91 in quarantine in South Korea • 6 Korean schools re-closed • 53 day high for CV19 infections in S. Korea • 154 in quarantine in Finland • 9 schools re-closed • 70 in quarantine in France • 6 schools closed Lesson? It’s too soon to open schools!
This may have something to do with their business models. Generally online businesses like have significantly grown during the coronavirus pandemic! Gates is so much in the news for his involvement in the vaccine.
"Front-line coronavirus workers could be vaccinated as soon as this year, Novavax CEO says READ MORE: https://blog.iammarketingmedia.com/front-line-coronavirus-workers-could-be-vaccinated-as-soon-as-this-year-novavax-ceo-says/?utm_campaign=twitter&amp;utm_medium=twitter&amp;utm_source=twitter #BillGates #cdc #GatesFoundation #GAVI #SDG #UN #Vaccination #Vaccine*"
"Saturday’s Coronavirus Updates: Florida positive cases reported surpass 55,000 READ MORE: https://blog.iammarketingmedia.com/saturdays-coronavirus-updates-florida-positive-cases-reported-surpass-55000/?utm_campaign=twitter&amp;utm_medium=twitter&amp;utm_source=twitter #cdc #coronavirus #covid19 #mers #outbreak #pandemic #sars #ViralOutbreak #virus #who"
Online Chat | End Time News – 1/22/2020 (Deadly Chinese coronavirus arrives in US) https://christianschat.net/News/?p=39126
"COVID-ALERT: Missouri reports 33 new COVID-19 deaths, making total 771 - Global Pandemic News | #Coronavirus #COVID19 - https://globalpandemic.net/news/missouri-reports-33-new-covid-19-deaths-making-total771/"
Fighting Stigma : Coronavirus | India's recovery rate improves to 47%: India's COVID-19 recovery rate improved to 47.4% on Saturday from 38.29% on May 18. The Union Health Ministry stated that to scale up testing and ... http://dlvr.it/RXgp3m
Coronavirus: Pret a Manger plans rent talks in bid to avoid closures 
Lufthansa Giving Up Frankfurt & Munich Slots: http://ow.ly/7mDE30qL6xB #Aviation #Airline #COVID19 #Coronavirus 
