"""We’ve come out of a bad place, not knowing what was going on & what the hospice’s role would be, we're now in a very good place"" We speak to @ThamesHospCare about adapting to #COVID19 https://bit.ly/3ewSibu @hospiceuk #pallicovid #coronavirus"
Wisconsin announces 20 more coronavirus deaths as positive cases rise with more testing READ MORE: https://blog.iammarketingmedia.com/wisconsin-announces-20-more-coronavirus-deaths-as-positive-cases-rise-with-more-testing/?utm_campaign=twitter&amp;utm_medium=twitter&amp;utm_source=twitter #cdc #coronavirus #covid19 #mers #outbreak #pandemic #sars #ViralOutbreak #virus #who
"With coronavirus devastating the economy, Democrats want to ... give the wealthy a tax break "
Coronavirus: Survival of ‘big five’ game reserve rests on return of tourists soon – KLFM 96.7 
Hong Kong Reveals New Rules for Transit Passengers as Air Travel Slowly Resumes: http://ow.ly/Ntvq30qL6vW #Aviation #Airport #Airlines #COVID19 #Coronavirus 
WATCH: Virginia Gov. Ralph Northam gives first coronavirus update since announcing mask requirement READ MORE: https://blog.iammarketingmedia.com/watch-virginia-gov-ralph-northam-gives-first-coronavirus-update-since-announcing-mask-requirement/?utm_campaign=twitter&amp;utm_medium=twitter&amp;utm_source=twitter #cdc #coronavirus #covid19 #mers #outbreak #pandemic #sars #ViralOutbreak #virus #who~
"Communities magazine is now seeking articles for issue #189, ""Isolation & Connection; Community in the Age of Coronavirus."" The issue will be out in Dec 2020. Please send your article ideas to editor@gen-us.net by 26/06/2020. Final article reach us by Friday, 28/08/2020."
WHO sounds warning on coronavirus ‘second peak’: Live updates READ MORE: https://blog.iammarketingmedia.com/who-sounds-warning-on-coronavirus-second-peak-live-updates/?utm_campaign=twitter&amp;utm_medium=twitter&amp;utm_source=twitter #BillGates #cdc #GatesFoundation #GAVI #SDG #UN #Vaccination #Vaccine*
Does a Plant-Based Diet Defend Against Coronavirus? | Grit Daily News READ MORE: https://blog.iammarketingmedia.com/does-a-plant-based-diet-defend-against-coronavirus-grit-daily-news/?utm_campaign=twitter&amp;utm_medium=twitter&amp;utm_source=twitter #AnimalLiberation #Diabetes #EatPlants #Environment #GoVegan #Health #Healthspan #HealthTech #Lifespan #LifestyleMedicine*
THE INTERNET OF MEDICAL THINGS: The coronavirus is catalyzing a need for healthcare IoT in the US — here’s how co READ MORE: https://blog.iammarketingmedia.com/the-internet-of-medical-things-the-coronavirus-is-catalyzing-a-need-for-healthcare-iot-in-the-us-heres-how-connectivity-and-technology-providers-are-carving-out-their-place-in-the-market/?utm_campaign=twitter&amp;utm_medium=twitter&amp;utm_source=twitter #BigData #ConnectedDevices #IndustrialIoT #Industry #Internet #InternetOfThings #IoT #ProductManagement #SmartDevices #Tech*
Coronavirus: Financial centres warn over protectionism risks READ MORE: https://blog.iammarketingmedia.com/coronavirus-financial-centres-warn-over-protectionism-risks/?utm_campaign=twitter&amp;utm_medium=twitter&amp;utm_source=twitter #business #Campaign #data #Finance #FinanceMinister #finances #Forex #Hiring #Investment #Job*
"Fighting Stigma — The first victims of coronavirus coped with an unexpected feeling: shame: ... one posting on Facebook that he gained ""a whole new appreciation for those who live under the cloud of stigma every single day of their lives.''. http://dlvr.it/RXgjPL"
"Fighting stigma — World coronavirus Dispatch: Alzheimers Disease Drug Market – Global Industry Analysis, Size ...: The Alzheimers Disease Drug market study is a well-researched report encompassing a detailed analysis of this industry with respect to… http://dlvr.it/RXgjNs"
"Fighting stigma — Global trade impact of the Coronavirus Rivastigmine Market 2019 Demand, Segments, Trends ...: With SWOT analysis, the business study highlights the strengths, weaknesses, opportunities and threats of each Rivastigmine market player in… http://dlvr.it/RXgjNM"
Coronavirus: UK government allows live sport to return behind closed doors from June 1 https://www.skysports.com/football/news/11095/11997488/coronavirus-uk-government-allows-live-sport-to-return-behind-closed-doors-from-june-1 via @SkySports
Fearful Flight Attendant Union Hits Back At United CEO: http://ow.ly/8QOn30qL6vs #Aviation #Airline #COVID19 #Coronavirus 
"COVID-ALERT: 61 more deaths raise Illinois coronavirus toll to 5,330 - Global Pandemic News | #Coronavirus #COVID19 - https://globalpandemic.net/news/61-more-deaths-raise-illinois-coronavirus-toll-to5330/"
"COVID-ALERT: Coronavirus cases could rise as protests continue, US city, health officials fear - Global Pandemic News | #Coronavirus #COVID19 - https://globalpandemic.net/news/coronavirus-cases-could-rise-as-protests-continue-us-cityhealth-officials-fear/"
"2 billion people without proper sanitation at high risk for coronavirus, a @IHME_UW study finds study."
Maine CDC reports 35 additional coronavirus cases and one new death – Portland Press Herald READ MORE: https://blog.iammarketingmedia.com/maine-cdc-reports-35-additional-coronavirus-cases-and-one-new-death-portland-press-herald/?utm_campaign=twitter&amp;utm_medium=twitter&amp;utm_source=twitter #cdc #coronavirus #covid19 #mers #outbreak #pandemic #sars #ViralOutbreak #virus #who*
Even mild coronavirus illness may confer some immunity: study READ MORE: https://blog.iammarketingmedia.com/even-mild-coronavirus-illness-may-confer-some-immunity-study/?utm_campaign=twitter&amp;utm_medium=twitter&amp;utm_source=twitter #Bacteriology #epidemiology #ImmuneSystem #Immunity #Immunization #virology*
"Coronavirus US live: Trump and Biden at heart of war over mask-wearing as deaths near 100,000 READ MORE: https://blog.iammarketingmedia.com/coronavirus-us-live-trump-and-biden-at-heart-of-war-over-mask-wearing-as-deaths-near-100000/?utm_campaign=twitter&amp;utm_medium=twitter&amp;utm_source=twitter #BillGates #ElonMusk #JeffBezos #LarryEllison #LarryPage #MarkBenioff #MichaelDell #MikeBloomberg #RichardBranson #RiedHoffman*"
"“The best therapy might actually be a drug that stabilizes the vascular endothelial. We’re building a drastically different concept.” Coronavirus May Be a Blood Vessel Disease, Which Explains Everything by @SmithDanaG in @elemental"
"Every action, even inaction, has an opportunity cost. These, as much as medical factors, determine political and policy choices. #coronavirus "
Why people are flouting coronavirus social distancing precautions that we know save lives https://news.yahoo.com/why-people-flouting-coronavirus-social-distancing-precautions-know-145700783--abc-news-topstories.html?soc_src=hl-viewer&amp;soc_trk=tw via @YahooNews
COVID19 Updates: Coronavirus: Spain extended the state of emergency until at least 12 April - BBC News - http://covid19updates.spiritualfoodtoday.com/2020/05/30/coronavirus-spain-extended-the-state-of-emergency-until-at-least-12-april-bbc-news/
#Troll #farms from #NorthMacedonia and the #Philippines #pushed #coronavirus #disinformation on #Facebook https://www.nbcnews.com/tech/tech-news/troll-farms-macedonia-philippines-pushed-coronavirus-disinformation-facebook-n1218376 via @nbcnews
Dow soars on big hopes for a coronavirus vaccine and the economy’s reopening READ MORE: https://blog.iammarketingmedia.com/dow-soars-on-big-hopes-for-a-coronavirus-vaccine-and-the-economys-reopening/?utm_campaign=twitter&amp;utm_medium=twitter&amp;utm_source=twitter #BillGates #cdc #GatesFoundation #GAVI #SDG #UN #Vaccination #Vaccine*
Let's just repeat this for those in the back... #Wearing A #Mask To #Reduce The #Spread Of #Coronavirus Will #Not #Give #You #CarbonDioxide #Poisoning via @forbes
COVID-ALERT: Pew: Democrats Represent 41 Of 44 Districts With Highest COVID-19 Death Tolls - Global Pandemic News | #Coronavirus #COVID19 - https://globalpandemic.net/news/pew-democrats-represent-41-of-44-districts-with-highestcovid-19-death-tolls/
Christopher Nolan's Tenet will be the first big movie to be shown since coronavirus and the stakes are high - ABC News http://dlvr.it/RXgch5
"Fighting Stigma : Coronavirus | CSIR chief flays hydroxychloroquine trial suspension: However, India's medical administration also relies on observational data ... trials — to recommend HCQ as a preventive drug to healthcare workers. http://dlvr.it/RXgcJv"
"Fighting Stigma : Coronavirus | Over 50% of COVID-19 cases, deaths are from five Indian cities: Dr. Ashish Awasthi from the Public Health Foundation of India (PHFI), Gurgaon, and Dr. Dileep Mavlanka, Director of the Indian Institute of Public ... http://dlvr.it/RXgcFy"
Coronavirus: Competitive sport to return behind closed doors from Monday - Sky News 
COVID-ALERT: Roberts joins liberals as Supreme Court rejects challenge to coronavirus limits on church services - Global Pandemic News | #Coronavirus #COVID19 - https://globalpandemic.net/news/roberts-joins-liberals-as-supreme-court-rejects-challenge-tocoronavirus-limits-on-church-services/
The relationship between coronavirus and thrombosis has been established 
Cannabis promising in reducing coronavirus infection: Alberta study https://calgaryherald.com/cannabis/cannabis-shows-promise-blocking-coronavirus-infection-alberta-researcher/ #MME #marijuana #cannabis #COVID19
"Two restaurateurs are shifting operations in response to the Coronavirus: an intimate sushi haven, now pivoting to takeout and delivery only and a once-bustling urban cafe that has closed its doors (for now) to focus on the future. Read their stories. "
Scientists talked about the new mortal danger of coronavirus 
"UCHealth offers coronavirus antibody tests, nasal swabs for all Coloradans READ MORE: https://blog.iammarketingmedia.com/uchealth-offers-coronavirus-antibody-tests-nasal-swabs-for-all-coloradans/?utm_campaign=twitter&amp;utm_medium=twitter&amp;utm_source=twitter #cdc #coronavirus #covid19 #mers #outbreak #pandemic #sars #ViralOutbreak #virus #who~"
IRS offers safe harbor for renewable energy tax credits in response to coronavirus READ MORE: https://blog.iammarketingmedia.com/irs-offers-safe-harbor-for-renewable-energy-tax-credits-in-response-to-coronavirus/?utm_campaign=twitter&amp;utm_medium=twitter&amp;utm_source=twitter #GeothermalEnergy #NuclearEnergy #RenewableEnergy #SolarEnergy #SolarPanels #SteamEnergy #WaveEnergy #WaveGenerators #WindEnergy #Windmills~
Coronavirus shutdowns emphasize agencies’ need for digital tools READ MORE: https://blog.iammarketingmedia.com/coronavirus-shutdowns-emphasize-agencies-need-for-digital-tools/?utm_campaign=twitter&amp;utm_medium=twitter&amp;utm_source=twitter #Accidents #Claims #DisasterMitigation #Insurance #InsuranceTechnology #InsurTech #Points #RiskMitigation #Technology*
Companies’ Financial Planning Comes Up Short in the Coronavirus Era READ MORE: https://blog.iammarketingmedia.com/companies-financial-planning-comes-up-short-in-the-coronavirus-era/?utm_campaign=twitter&amp;utm_medium=twitter&amp;utm_source=twitter #business #Campaign #data #Finance #FinanceMinister #finances #Forex #Hiring #Investment #Job+
Lufthansa Accepts Sweetened Bailout Deal Including Giving Up Fewer Slots: http://ow.ly/pLPH30qL6up #Aviation #Airline #COVID19 #Coronavirus 
Why is coronavirus killing BAME Britons? http://dlvr.it/RXgZFW #projecthopetravel #travel #news
EFL Announces Latest Coronavirus Testing Figures With 17 Individuals Testing Positive Across Leagues - https://lastwordonfootball.com/2020/05/30/efl-announces-latest-coronavirus-testing-figures-with-17-individuals-testing-positive-across-leagues/
COVID-ALERT: Russia extends Edward Snowden's residence permit due to coronavirus pandemic: State media - Global Pandemic News | #Coronavirus #COVID19 - https://globalpandemic.net/news/russia-extends-edward-snowdens-residence-permit-due-tocoronavirus-pandemic-state-media/
Antibody Tests Point To Lower Death Rate For The Coronavirus Than First Thought READ MORE: https://blog.iammarketingmedia.com/antibody-tests-point-to-lower-death-rate-for-the-coronavirus-than-first-thought/?utm_campaign=twitter&amp;utm_medium=twitter&amp;utm_source=twitter #cdc #coronavirus #covid19 #mers #outbreak #pandemic #sars #ViralOutbreak #virus #who~
"COVID-ALERT: Deep Ellum, popular Allston bar of 13 years, won't reopen after COVID-19 restrictions are lifted - Global Pandemic News | #Coronavirus #COVID19 - https://globalpandemic.net/news/deep-ellum-popular-allston-bar-of-13-years-wont-reopenafter-covid-19-restrictions-are-lifted/"
Meet the 26 healthcare startups that top VCs say are poised to take off amid the coronavirus pandemic READ MORE: https://blog.iammarketingmedia.com/meet-the-26-healthcare-startups-that-top-vcs-say-are-poised-to-take-off-amid-the-coronavirus-pandemic/?utm_campaign=twitter&amp;utm_medium=twitter&amp;utm_source=twitter #Billion #business #Commerce #Company #Economics #Economy #Entrepreneur #Entrepreneurship #Founder #Funding*
"RT Via: https://twitter.com/TiaraThompsonn Due to #COVID19 aka #Coronavirus Ill be sending the first 300 people to like &amp;amp; retweet this $300 -$1500 through CashApp, Apple Pay #, Venmo or Zelle drop all tags in comments) #Ca"
We ask #CFOs 10 key questions to help them navigate #coronavirus-related changes: https://www.tmf-group.com/en/news-insights/publications/2020/accounting-tax-reporting-covid19-crisis/?utm_source=twitter&amp;utm_medium=organic_social&amp;utm_campaign=covid_19&amp;utm_content=CFOs_Guide_video #Accounting #Tax #BusinessComplexity
Asymptomatic coronavirus cases seem very common – but those people might only be contagious for h... http://news.yahoo.com/asymptomatic-coronavirus-cases-seem-very-165200353.html?soc_src=community&amp;soc_trk=tw via @YahooNews
Newark Airport Embodies New Reality As Airlines Move To June Schedules: http://ow.ly/bICX30qL6tk #Aviation #Airport #Airlines #COVID19 #Coronavirus 
Premier League Clubs Record No New Positive Coronavirus Cases as Football Edges Closer to June Return 
Why Nigeria will fail to meet the three months’ 2 million Coronavirus tests target https://dutable.com/2020/05/30/why-nigeria-will-fail-to-meet-the-three-months-2-million-coronavirus-tests-target/
COVID-ALERT: Coronavirus in Illinois updates: Here’s what’s happening this weekend with COVID-19 in the Chicago area - Global Pandemic News | #Coronavirus #COVID19 - https://globalpandemic.net/news/coronavirus-in-illinois-updates-heres-whats-happeningthis-weekend-with-covid-19-in-the-chicago-area-2/
National coronavirus updates: Experts worry about case spikes as Americans try to go back to normal READ MORE: https://blog.iammarketingmedia.com/national-coronavirus-updates-experts-worry-about-case-spikes-as-americans-try-to-go-back-to-normal/?utm_campaign=twitter&amp;utm_medium=twitter&amp;utm_source=twitter #DeepFake #disinformation #FalseAdvertising #VideoFakes+
