"Nigeria, Brazil confirms first coronavirus case same day. As of today, Thursday, April 30 Brazil: 78,162 cases5,466 deaths and 339,552 test. Nigeria: 1,728 cases 51 deaths and 12,004 test. Population; Nigeria 200+ million Brazil 200+ million "
And researchers in France are conducting tests believing that nicotine possibly kills the #coronavirus as fewer smokers succumb to the disease ... apparently
"""Frozen foods become ‘sales powerhouse’ during coronavirus pandemic"" https://ift.tt/2yRiTjZ #Supermarketnews"
Quebec to gradually lift travel restrictions in some regions amid coronavirus pandemic http://dlvr.it/RVjgCv #projecthopetravel #travel #news
Coronavirus: UK government allows live sport to return behind closed doors from June 1 https://www.skysports.com/football/news/11095/11997488/coronavirus-uk-government-allows-live-sport-to-return-behind-closed-doors-from-june-1 via @SkySports
"“The best therapy might actually be a drug that stabilizes the vascular endothelial. We’re building a drastically different concept.” Coronavirus May Be a Blood Vessel Disease, Which Explains Everything by @SmithDanaG in @elemental"
Why is coronavirus killing BAME Britons? http://dlvr.it/RXgZFW #projecthopetravel #travel #news
EFL Announces Latest Coronavirus Testing Figures With 17 Individuals Testing Positive Across Leagues - https://lastwordonfootball.com/2020/05/30/efl-announces-latest-coronavirus-testing-figures-with-17-individuals-testing-positive-across-leagues/
