"Latest Show, listen now! This is the WIBR/Warn Radio #Endtime-report https://bit.ly/2Vamm4t Shaking Nations Christian News, Coronavirus, Christian persecution, Franklin Graham, Faith not fear, Native America, from Warn Radio | https://bit.ly/jytsoC #Christian-living #Faith"
Could the Power of the Sun Slow the Coronavirus? http://dlvr.it/RVjhv2
"GMB usage declines, but poised to become more powerful post-coronavirus: Google, and the pandemic, have made GMB into the most important local marketing tool for SMBs and multi-location brands. Please visit Search Engine Land for the full article. https://bit.ly/3d2xWFY"
I don't want her to come to US & risk getting the Coronavirus .She is too important to the world.
Just pulled this out of my mailbox. As if I'm ever stepping foot on another cruise ship again. LOL #coronavirus #COVID19 
Why are you following Democrats around? Shouldn’t you be in the White House trying to instill confidence about the COVID19 virus instead of lying and freaking everyone out? That’s why the stock market is crashing. ITS ON YOU. Loser.
You think #COVID19 efforts are adequately funded? You're wrong!
