,Tweets,Date
0,"About 91% of Chinese companies had resumed businesses by late April but only 4% were operating at full capacity. An improved but still very difficult April, a tough and slow recovery. Via https://www.bloomberg.com/news/articles/2020-04-29/chinese-factory-employment-shrank-in-april-beige-book-says @business @ChinaBeigeBook #covid19 #coronavirus",2020-04-29 23:42:09+00:00
1,"Don't get excited yet. Jury still out on how Gilead's potential #coronavirus drug works: 1) Fauci said the US trial met its target, but we have no details 2) Only large study w/ full data was the Chinese trial that showed the drug didn't help @quicktake",2020-04-29 23:13:33+00:00
2,Dying of coronavirus to own the Chinese gday mate ,2020-04-29 23:07:55+00:00
3,#MorningMilk Amazon is Wall Street's biggest winner from coronavirus https://www.reuters.com/article/us-amazon-stocks/amazon-is-wall-streets-biggest-winner-from-coronavirus-idUSKBN22B2ZU,2020-04-29 23:00:05+00:00
4,OMG... what is a corona virus ,2020-04-29 22:44:51+00:00
5,"US cases of the novel coronavirus were approaching 1 million yesterday, having doubled in 18 days, and made up one-third of all infections in the world. ",2020-04-29 22:16:05+00:00
6,How Germany tackled the coronavirus: 9 people tell us they are thankful for good leadership and a robust health system http://dlvr.it/RXgf34,2020-05-30 20:58:32+00:00
7,Alibaba extends its reach in China as coronavirus outbreak opens doors - https://www.shanghaibeat.com/alibaba-extends-its-reach-in-china-as-coronavirus-outbreak-opens-doors-7/ #Shanghai #China #上海,2020-05-30 20:10:16+00:00
8,China has confidence and capability to win the war against coronavirus: foreign ministry - https://www.shanghaibeat.com/china-has-confidence-and-capability-to-win-the-war-against-coronavirus-foreign-ministry/ #Shanghai #China #上海,2020-01-30 23:57:23+00:00
9,See how Shanghai's hospital that was originally built to treat #SARS patients is now dedicated to treating patients with the 2019 novel #coronavirus. ,2020-01-30 23:51:23+00:00
10,SARs and MERs were both coronavirus. Coronavirus is a family.of viruses.,2020-01-30 23:39:28+00:00
11,BBC News - Coronavirus declared global health emergency by WHO https://www.bbc.com/news/world-51318246 #toonenote,2020-01-30 23:36:13+00:00
12,Trump says coronavirus outbreak is 'very well under control' - The Edge Markets ,2020-01-30 23:35:08+00:00
13,"Return travel rush starts in China as the #ChineseNewYear holiday is coming to an end. Affected by the ongoing #coronavirus outbreak, most of the travelers wear masks during the trip. ",2020-01-30 23:30:14+00:00
14,"#Coronavirus cases in central China's Hubei: - 5,806 confirmed cases - 204 deaths - 5,486 hospitalized - 116 discharged from hospitals more: https://bit.ly/2S0X1Za",2020-01-30 23:24:34+00:00
15,Australia successfully grows Wuhan coronavirus sample from sick patient - Business Insider ,2020-01-30 23:20:53+00:00
16,#China gets global support for its fight against novel #coronavirus ,2020-01-30 23:20:00+00:00
17,This will complicate my return trip to Shanghai and back to Thailand for Pirate Jam. How many hours before Thailand blocks flights from China or Chinese airlines cancel outbound non-essential flights? It's a proper response but woo-boy is it going to create chaos. #coronavirus ,2020-01-30 23:16:29+00:00
18,Chinese foreign ministry spokesperson Hua Chunying responds to @WHO's #PHEIC decision: China has the confidence and capability to win the battle against #coronavirus and it is willing to work with @WHO and other countries to safeguard public health.,2020-01-30 23:16:23+00:00
19,"China has full confidence and capability to win the fight against epidemic caused by novel #coronavirus, a foreign ministry spokesperson said Friday ",2020-01-30 23:15:25+00:00
20,Foreign Ministry has also emphasised how the WHO and other countries have praised China's prevention and control efforts in this coronavirus outbreak. This comes as there's also been criticism on how the situation was handled.,2020-01-30 23:13:44+00:00
21,People across China are showing their support for those battling the spread of the 2019 novel #coronavirus. See how Guangzhou is lighting up with love. ,2020-01-30 23:09:28+00:00
22,"42 new deaths, 1,220 new cases #coronavirus reported in #Hubei province.",2020-01-30 22:43:31+00:00
23,"our everyday work in #wuhan, in the center of the catastrophic #coronavirus ... it s my work and way of my heart - #help for #peoples. And how are you making this world better?",2020-01-30 22:19:45+00:00
24,China’s Regime Grossly Underreporting Scale of Novel Coronavirus Outbrea... https://youtu.be/VBxZ1XIYmGc via @YouTube,2020-01-30 22:17:31+00:00
25,Coronavirus Latest: UN’s World Health Organization declares a global health emergency as India confirms first case and U.S. sets up coronavirus task force. https://www.caixinglobal.com/2020-01-30/wuhan-virus-latest-china-reports-second-pneumonia-linked-death-101505300.html?cxg=web&amp;Sfrom=twitter,2020-01-30 22:07:28+00:00
26,"Premier Li Keqiang called on Thursday for expedited steps to research and develop vaccines and effective pharmaceuticals against the novel #coronavirus, in an effort to improve medical treatment and reduce the mortality rate of the pneumonia-causing virus.",2020-01-30 21:45:00+00:00
27,President Xi Jinping said on Friday positive developments in the fight against novel #coronavirus pneumonia in China have been expanding thanks to the country's arduous efforts. #XiJinping #COVID19,2020-02-28 22:00:00+00:00
28,"China is willing to maintain close communication with #Japan and make good preparations for President Xi Jinping's state visit, a top Chinese diplomat said Friday, as Beijing and Tokyo agreed to step up cooperation over the novel coronavirus outbreak. #XiJinping #COVID19",2020-02-28 21:45:00+00:00
29,"Solano County, California, declares public health emergency over 1st possible community spread of #COVID19 in U.S. http://xhne.ws/dcVqQ",2020-02-28 21:11:36+00:00
30,"The novel #coronavirus epidemic has been easing in China, including in the epicenter city of #Wuhan, in #Hubei province, but great uncertainties remain and epidemic control efforts must not become lax in any case, the nation's top health authority said on Friday. #COVID19",2020-02-28 20:45:00+00:00
31,"Chinese President #XiJinping talked over phone with his Cuban counterpart, Miguel Diaz-Canel, on Friday to compare notes on the ongoing #COVID19 epidemic and how to further promote bilateral ties (file pic) ",2020-02-28 20:05:00+00:00
32,"China has offered convalescent plasma therapy for 245 #COVID19 patients by Friday, and 91 cases have shown improvement in clinical indicators and symptoms ",2020-02-28 20:01:30+00:00
33,"#Opinion: The #ROK and #Japanese governments and people have provided China with strong support since the start of the #epidemic, for which the latter is deeply grateful. While combating the virus at home, China is ready to reciprocate the kindness they have shown. #COVID19",2020-02-28 20:00:00+00:00
34,Here’s another great resource for chatting with kids about the current #COVID19 situation ,2020-02-28 19:41:38+00:00
35,"Chinese President #XiJinping and his Chilean counterpart, Sebastian Pinera, held a telephone conversation on Friday to discuss the ongoing #COVID19 epidemic and how to further deepen bilateral ties (file pic) ",2020-02-28 19:35:00+00:00
36,And how many of those with Flu symptoms are tested for COVID19?,2020-02-28 18:58:28+00:00
37,"The decisive measures Chinese government has taken to contain novel #coronavirus has resulted in great achievements in seven weeks, official of National Health Commission said on Friday. #COVID19 #China",2020-02-28 18:45:00+00:00
38,The pet dog of a novel #coronavirus patient in Hong Kong was weak positive for #COVID19 from nasal and oral samples. The dog has not shown any symptoms and will undergo more tests to confirm if it is really infected or if it was a result of environmental contamination. (file pic) ,2020-02-28 18:29:30+00:00
39,"#Iran is set to celebrate its traditional new year in one month, it may further aggravate the #COVID19 epidemic situation: Chinese nationals in Iran http://bit.ly/2I6ga7m",2020-02-28 17:40:03+00:00
40,"A total of 36,000 #COVID19 patients have been cured and discharged from hospitals, accounting for 45.9 percent of Chinese total confirmed cases, a health official said Friday. ",2020-02-28 16:53:14+00:00
41,"It was indicated that another case that tested positive for a first review in the State of Sinaloa, was under observation, and awaiting a second review. #Coronavirusmexico #coronavirus #COVID19 #Pandemia",2020-02-28 15:47:50+00:00
42,"China will firmly support Japan to hold the 2020 Tokyo Olympic Games, Yang said during the meeting while Abe spoke highly of China's achievements in the battle against the #COVID19 epidemic. ",2020-02-28 15:40:50+00:00
43,"Recovery rate of patients in severe condition has climbed significantly from 14 to 64 percent in #Wuhan, capital of Hubei province, the epicenter of the novel #coronavirus, senior official from the National Health Commission said on Friday. #COVID19",2020-02-28 15:40:33+00:00
44,"In the infamous WSJ, Lai wrote an article titled ""China's Facade of Stability"" to denounce efforts made by China in battling #COVID19. Now as the virus has spread worldwide, we're closely watching efforts in other countries as well. ",2020-02-28 15:37:09+00:00
45,"Yu Jinghai and Zhou Lingyi never thought that their #wedding venue would be a hospital. They are both members of a medical team from Shanghai that has been stationed in Leishenshan Hospital, which was speed-built to treat #coronavirus pneumonia patients in #Wuhan. #COVID19 ",2020-02-28 15:33:55+00:00
46,"Health authorities: a total of 36000 #COVID19 patients have been discharged from hospital after recovery in #China so far. Among the 8400 cases analyzed, 85% received antiviral treatment while 40% accepted a combination of Chinese and Western therapies. http://bit.ly/2Tu3rB0",2020-02-28 15:30:00+00:00
47,"Yeah, his track record on public health issues leaves much to be desired..and what health professionals state our readiness level is leaves much to be desired. 10,000 covid19 tests performanced in SK today, how many did we do? ",2020-02-28 15:01:16+00:00
48,Exclusive: GT has learned that China has sent the team of four disease control experts to #Iran to support the country's anti-epidemic effort. #COVID19 ,2020-02-28 14:50:02+00:00
49,COVID19 - Is a FFP2 Mask any good? Mask Review 3 from China. https://youtu.be/maBvFrPBRpg via @YouTube #covid19 #covid-19 #mask #covid2019 #coronaviruschina #coivd19usa #covid19Uk #covid19italy #covid19korea #covid19japan,2020-02-28 14:48:44+00:00
50,#COVID19 - Is a FFP2 Mask any good? Mask Review 3 from China. https://youtu.be/maBvFrPBRpg via @YouTube #coronaviruschina #coviduk,2020-02-28 14:34:36+00:00
51,"Recovery rate of novel #coronavirus patients in severe condition has climbed significantly from 14% to 64% in #Wuhan, the epicenter of #COVID19, basically due to the increase in the number of hospital beds, a senior official said on Friday. ",2020-02-28 14:34:23+00:00
52,"China is ready to strengthen communication with #Italy in professional fields in the fight against #COVID19, said Chinese State Councilor and Foreign Minister Wang Yi on Friday. http://bit.ly/396rUms",2020-02-28 14:30:35+00:00
53,"Of the over 8,400 discharged patients cured of the novel #coronavirus and studied by health experts, 85% underwent antiviral treatment, according to China's National Health Commission. #COVID19 #China",2020-02-28 14:00:01+00:00
54,The virus being studied in the Wuhan lab is 96% similar to COVID19 it turns out. ,2020-02-28 13:59:05+00:00
55,"That's really worrisome - will we experience #COVID19 -related 'censorship' like in CN soon? I hope not. Congrats on your content BTW - really good stuff! I was just about to join, but am hesitating now. My advice, prepare some sort of mirror-site/host, on a non US-based server.",2020-02-28 13:53:42+00:00
56,Premier Li urges major breakthroughs in #COVID19 vaccine research ,2020-02-28 13:46:04+00:00
57,"1 in 4 #COVID19 patients in #Wuhan have been treated in Fangcang hospitals, which have achieved zero infection and zero death. Now there are more than 7,600 patients and 5,600 spare beds. The construction of Fangcang hospitals has rapidly expanded medical resources in Wuhan.",2020-02-28 13:37:50+00:00
58,"A total of 36,000 #COVID19 patients have been cured and discharged from hospitals, accounting for 45.9 percent of the total confirmed cases, a health official said Friday. https://bit.ly/2wT8KSF",2020-02-28 13:37:38+00:00
59,#HCham member Future Leadership Academy at Blue Bay has been at the forefront of using available online technology to continue #education activities during #COVID19 #Hainan #onlinetraining https://hcham.org/hcham-member-fla-online-education/,2020-02-28 13:34:26+00:00
60,"A total of 36,000 #COVID19 patients have been cured and discharged from hospitals in China, accounting for 45.9% of the total confirmed cases, a health official said Friday ",2020-02-28 13:32:00+00:00
61,News #INBAR has donated 15 tonnes of #bamboo tissue paper to the Chinese Government to support the fight against #Covid19. The signing ceremony was held this week. #ThinkBamboo #Coronvirus #China ,2020-02-28 13:30:16+00:00
62,"With #COVID19 now impacting the global #economy as well as people's health, companies need to swiftly adopt countermeasures to shore up their finances. In a new article, the Deloitte China Restructuring &amp; Forensic Group sets out eight ways to fight back",2020-02-28 13:30:00+00:00
63,Kudos to both the #stylists and the calm #consumer gentlemen. #COVID19 #creative #workmanship #SMEs #worktogether #TideOverDifficultiesTogether #China #Jiayou #OneHealth,2020-02-28 13:22:57+00:00
64,I guess ttp is the biggest patient of covid19,2020-02-28 13:14:56+00:00
65,"Nigeria became the 3rd country in Africa to confirm a case of the novel #coronavirus, Nigerian health officials said. They said an Italian citizen who works in Nigeria and returned from Milan, Italy to Lagos, Nigeria, on February 25, was found to be infected. #COVID19",2020-02-28 12:30:00+00:00
66,Just added this radio station to the app: @UFM1003 . Check out the #beatit #coronavirus #covid19 song on their website. Get the free app to listen anywhere! ,2020-02-28 12:27:47+00:00
67,Governor of Japan's Hokkaido Naomichi Suzuki declared a state of emergency of the northernmost prefecture on Friday due to the spread of the #COVID19. https://bit.ly/2vqVQLf,2020-02-28 12:24:58+00:00
68,"Who's behind the mask? Car companies like @BYDCompany, it turns out, writes @yushan_shen as automakers push to add as much as 20% to China's face mask production #COVID19 ",2020-02-28 12:19:00+00:00
69,"The Geneva Motor Show, scheduled to open on March 2, has been cancelled after the Swiss government today banned large public events to curb the spread of the #COVID19 virus. ",2020-02-28 12:16:51+00:00
70,"This year, a record-breaking 8.74 million students in China are expected to graduate from college, many of whom worry about their career prospects in the post-virus era. #COVID19 ",2020-02-28 11:52:50+00:00
71,"According to an online chinese consumers survey, nearly 2/3 said they would be more “restrained” in spending while 12.6% said they would cut spending. In short, majority will be careful and prudent with their spending when #covid19 is over. Via @SCMPNews",2020-02-28 11:52:10+00:00
72,"Efforts to control and prevent the novel #coronavirus outbreak in China will not slow down despite the progress made, minister of health said on Friday. #COVID19",2020-02-28 11:50:16+00:00
73,"Update: As of Friday, there were 78,961 cumulative novel #coronavirus infections in China, 2,791 deaths, and 36,201 full recoveries, according to official data. #COVID19 ",2020-02-28 11:05:00+00:00
74,"#Wuhan's 16 makeshift hospitals provide 12,000 beds for #COVID19 patients. The daily number of newly recovered patients now greatly exceeds that of newly confirmed cases. The goal is to achieve zero new deaths, infections or returning cases: Chinese health official. ",2020-02-28 11:03:59+00:00
75,"Panic and insecurity are haunting some Chinese people in Italy as the #COVID19 outbreak have become more severe in the past week, and the local governments do not take effective measures which leads to local people not paying enough attention to the risk. http://bit.ly/2I7cq5u",2020-02-28 11:00:42+00:00
76,Governor of Japan's Hokkaido Naomichi Suzuki declared a state of emergency of the northernmost prefecture on Friday due to the spread of the #COVID19. ,2020-02-28 10:55:08+00:00
77,"The process of against #COVID19 Chinese researchers have released the first pathology report on #COVID19 patients, suggesting that the disease mainly affects the lungs, while effects on other organs need further analysis. from @PDChina",2020-02-28 10:52:53+00:00
78,"China's Gov't Should Stock Up on Base Metals to Keep Prices Stable, Alliance Says http://bit.ly/2Togcgb #COVID19 ",2020-02-28 10:40:32+00:00
79,"A company in the central Hunan province has apologized for trying to trademark Li Wenliang’s name, the doctor who tried to sound the alarm about #COVID19 and later died from the virus. Read more: http://ow.ly/tqQL50yykjD",2020-02-28 10:35:42+00:00
80,We should not be blindly optimistic as the #COVID19 epidemic in #China is still severe and there is a possibility of a resurgence: Chinese health official.,2020-02-28 10:26:32+00:00
81,"Majority of the passengers flying to #China from #SouthKorea since the outbreak of #COVID19 are Chinese nationals in South Korea: Chinese FM said, refuting claims that South Koreans are flying to China to seek refuge. ",2020-02-28 10:22:38+00:00
82,Novel heroes: Smart hospital plays an important role in virus prevention #COVID19 #coronavirus #China,2020-02-28 10:15:07+00:00
83,Experience and explore travel trade this moment facing #COVID19 outbreaks China and overall world Visit Holland as major tourism industry panel sharing us to keep moving and self improvement to warm welcome when recover ,2020-02-28 09:22:26+00:00
84,I used to tell people my city of #Chongqing #China was the #cyberpunk capital of the world. Now we're really the champs! What did a #hitech #megacity need? A #viralplague that keeps everyone indoors &amp; those brave to venture outside look like #offbrand #Burningman #covid19 #2020 ,2020-02-28 09:18:40+00:00
85,"#COVID19 As of 24:00 on Feb. 26, 381 cases in east China's Shandong had been cured and discharged from the hospital, with a cure rate of over 50 percent. http://english.sdchina.com/show/4494270.html",2020-02-28 09:13:38+00:00
86,a dog from covid19 patient has been tested positive for covid19. If the virus appears in the farm is not the whole farm to be culled.,2020-02-28 09:06:04+00:00
87,#COVID19 Shandong decides to postpone the opening of the spring semester and continue to conduct online education in primary and secondary schools as well as colleges and univeristies. http://english.sdchina.com/show/4494167.html,2020-02-28 09:05:16+00:00
88,A total of 108 #COVID19 patients have been cured and discharged from the two makeshift hospitals of Huoshenshan and Leishenshan on Thursday. ,2020-02-28 09:05:00+00:00
89,"#Japan's PM #ShinzoAbe Friday defended his call for schools across the country to close over the COVID19, as the country confirmed a fifth death linked to the outbreak. https://bit.ly/2waPFLq",2020-02-28 09:03:13+00:00
90,The current Corona Virus #COVID19 does not mutate....,2020-02-28 09:00:45+00:00
91,China’s top respiratory specialist Zhong Nanshang has called for a larger role for the China CDC in public health. What kind of role has it played in the fight against #COVID19? http://bit.ly/2HZpPwJ,2020-02-28 09:00:00+00:00
92,"#JD Super, China’s largest online supermarket, donates tons of food and medicine for animals in Wuhan. While #COVID19 has been tough on everyone, animals have been suffering as well: ",2020-02-28 08:59:36+00:00
93,"New Coronavirus Responsible for Wuhan Pneumonia, CCTV Says

A team of public health experts made the preliminary determination after sequencing the virus’ genome, according to China’s state broadcaster. #WuhanPneumoniahttps://www.sixthtone.com/news/1005058/new-coronavirus-responsible-for-wuhan-pneumonia%2C-cctv-says …",2020-01-09 08:50:19
94,Virologists weigh in on novel coronavirus in China's outbreak https://buff.ly/2tFV9g4 ,2020-01-09 03:33:59
95,Experts say preliminary progress has been made in the identification of a new coronavirus in Wuhan with an unexplained viral pneumonia epidemic #WuHanPneumonia #China #CBRN Source: @XHNewspic.twitter.com/nCmyX8ERQk,2020-01-09 02:54:43
96,"Experts say that Wuhan's previously unidentified ""pneumonia"" outbreak with 59 confirmed cases so far is believed to actually be a new type of coronavirus, the common types of which usually are not dangerous. pic.twitter.com/WLfTWzokP9",2020-01-09 02:46:43
97,It has determined that the #pneumonia originating in Wuhan is caused by a new coronavirus. Experts have obtained the virus' whole genome sequences: China' s national broadcaster pic.twitter.com/8Z2zTMHVlP,2020-01-09 01:09:18
98,"#BREAKING: The unidentified pneumonia in Wuhan, China's Hubei Province is believed to be a new type of coronavirus, say experts. pic.twitter.com/dkMIghIanC",2020-01-09 00:51:04
99,"#BREAKING Experts say the previously unidentified pneumonia in Wuhan, central China's Hubei Province, which has had 59 confirmed cases, is believed to be a new type of coronavirus. pic.twitter.com/tcmhOwHd0U",2020-01-09 00:38:04
100,"Mysterious coronavirus not spreading to new areas, says WHO https://news.cgtn.com/news/2020-01-13/Mysterious-coronavirus-not-spreading-to-new-areas-says-WHO-NdHbDNInHG/index.html …",2020-01-13 10:20:00
101,"One Dead, 41 Diagnosed With Coronavirus-Related Pneumonia in Wuhan http://bit.ly/30gDnfF pic.twitter.com/pafch5QVhX",2020-01-13 05:17:56
102,"Despite the first exported case of novel coronavirus from the Chinese city of #Wuhan, the World Health Organization said Tuesday that there is no clear evidence of human-to-human transmission based on available information.https://www.shine.cn/news/nation/2001159787/ …",2020-01-15 05:16:55
103,"#Wuhan's health authority said people in close contact with the traveler to #Thailand, who was confirmed to have been infected with the new #coronavirus, were under medical observation and no abnormality has been found. http://bit.ly/30iE6Ni pic.twitter.com/xOA8cNv6pj",2020-01-14 20:50:04
104,"""There may have been limited human-to-human transmission of a new coronavirus in China within families"" https://reut.rs/2FOKORD ",2020-01-14 13:41:21
105,"Chinese traveler diagnosed with coronavirus in Thailand
The first case of novel coronavirus infection outside China has been detected in a Chinese tourist in Thailand, said the World Health Organization (WHO) on Monday.
https://news.cgtn.com/news/2020-01-14/Chinese-traveler-diagnosed-with-coronavirus-in-Thailand-Nf4lbVS4Tu/index.html …",2020-01-14 05:32:23
106,A female tourist from the central Chinese city of #Wuhan has been confirmed as the first person in #Thailand infected with the novel coronavirus. She was sent from the airport to a hospital where she has recovered. pic.twitter.com/QcIzSGaEs2,2020-01-14 05:30:00
107,A female tourist from the central Chinese city of #Wuhan has been confirmed as the first person in Thailand infected with the novel #coronavirus. https://www.shine.cn/news/nation/2001149715/ …,2020-01-14 04:07:11
108,Taiwan re-elects Tsai Ing-wen as president — China reports first death from new coronavirus https://whatshappeninginchina.substack.com/p/taiwan-re-elects-tsai-ing-wen-as …,2020-01-11 13:27:47
109,"* Experts Cast Doubts on Chinese Official Claims Around 'New' Wuhan Coronavirus
https://www.rfa.org/english/news/china/wuhan-outbreak-01092020133656.html …",2020-01-11 08:05:56
110,"One patient died of the new type of coronavirus in the recent pneumonia outbreak in central China’s Wuhan city; additional 7 in critical condition, 2 have been discharged from hospital among the total 41 confirmed cases: local government pic.twitter.com/qWyFGy54QM",2020-01-11 05:37:39
111,"WHO on coronavirus: China has “strong public health capacities and resources to respond and manage respiratory disease outbreaks."" With the seasonal travel rush coming up, this will be a test for the leadership. 

Excellent coverage @gerryshih @bylenasunhttps://www.washingtonpost.com/world/asia_pacific/china-identifies-new-strain-of-coronavirus-as-source-of-pneumonia-outbreak/2020/01/09/f2625650-329f-11ea-971b-43bec3ff9860_story.html …",2020-01-11 04:56:58
112,"The bad news—more coronaviruses could be in our future. “We have a new coronavirus emerging every 10 years…As we come into contact with animals that we didn’t come into contact with before, I think we’re going to see this more and more often.”
@betswriteshttps://on.wsj.com/36HRTPZ ",2020-01-11 01:33:00
113,"Cases of #pneumonia linked to #coronavirus rose to 41, 2 dead: local authority in C China's #Wuhanpic.twitter.com/d2zJlQT5KA",2020-01-16 16:15:54
114,"Update: A Chinese man living in Japan has become the second case of infection outside China with the new coronavirus first discovered in Wuhan.
http://ow.ly/Nrhp50xWP1i ",2020-01-16 09:07:12
115,» #Japan confirms first case of new China coronavirus strain | The Guardian https://www.theguardian.com/world/2020/jan/16/japan-confirms-first-case-of-new-china-coronavirus-strain …,2020-01-16 07:17:47
