,Tweets,Date
220,"#Update: An additional 2,420 cases of #coronavirus and 139 more deaths confirmed in central China’s Hubei Province. The total number of confirmed coronavirus cases in Hubei reaches 54,406. pic.twitter.com/WOajwJEdvt",2020-02-14 23:29:51
221,"#HubeiProvince reports 4,823 new cases, 116 new dead. Global total now at 65,236 and 1,487 dead, based in #China media stats. #coronavirus",2020-02-13 23:51:22
222,"Coronavirus: No change in outbreak despite China spike, WHO says: The World Health Organization says it is ""not seeing a dramatic increase"" in cases outside China. http://dlvr.it/RQ0HYS pic.twitter.com/A7KmEvAeB5",2020-02-13 23:47:33
223,The local government is trying every possible means to increase product supply in Hainan province. They actively guide villagers to strengthen self-protection from illness and carry out agricultural production in an orderly manner. #coronavirus #COVID19pic.twitter.com/7mbhhG8mnm,2020-02-13 23:45:53
224,China's #5G development may delay due to #coronavirus. http://bit.ly/31R3J8u pic.twitter.com/8WDZmjbCWJ,2020-02-13 23:40:02
225,Happy Valentine’s Day! We hope the #Wuhan #Coronavirus will be defeated soon and people can come back to their loved one. Cherish every moment that you have with the people you love. #Valentine #ValentinesDay2020 #Yutong #2019nCoVpic.twitter.com/W3S2TXDCWx,2020-02-13 23:30:35
226,Wanna share your experiences of the coronavirus epidemic? Drop us a line at editor@thebeijinger.com  https://www.thebeijinger.com/blog/2020/02/13/beijing-bunker-entrepreneur-dane-christensen-staycationing-and-striving-normalcy …,2020-02-13 23:30:01
227,"Not too surprising. Consumers in #China very much on edge. @Apple says it won't meet quarterly revenue guidance due to #coronavirus hampering demand for $AAPL products, supply for #iPhone.https://twitter.com/onlyyoontv/status/1228337848987709440 …",2020-02-17 23:57:53
228,"I post important updates to help dispel rumors and conspiracy theories. http://marccurtis.com/coronavirus-life-in-china/ …
#Coronavirus #COVID19",2020-02-17 23:54:53
229,Apple will miss quarterly earnings estimates due to coronavirus - Axios https://www.axios.com/apple-will-miss-quarterly-earnings-estimates-due-to-coronavirus-558c2871-eea6-47b6-9ab8-c0b1cd3f96ce.html?stream=technology&utm_source=alert&utm_medium=email&utm_campaign=alerts_technology …,2020-02-17 23:48:14
230,"Wuhan local health authorities denied people-to-people transmissions at the early stage of #coronavirus outbreak, which analysts believe has misled residents and doctors and contributed to cross-infection. http://bit.ly/2Hy1gXr pic.twitter.com/JUaRzHW5YN",2020-02-17 23:40:01
231,The #coronavirus throws tons of fruits and vegetables in Southwest #China’s Yunnan Province – a key agricultural product exporter to ASEAN – at risk of rotting as exports have been hindered by transportation blocks. #COVID-19https://www.globaltimes.cn/content/1179905.shtml …,2020-02-17 23:30:00
232,"Coronavirus: Iran's deputy health minister tests positive as outbreak worsens: Iraj Harirchi, who has strongly denied any cover-up of a growing outbreak, has self-quarantined. http://dlvr.it/RQlP3h pic.twitter.com/sbqRpNL6qw",2020-02-25 23:56:05
233,"Thanks to @nytchinese there's now an excellent translation of my article on Chinese religious groups helping to fight the new coronavirus. Thanks to the great translating team for making the extra effort to check back on specialized vocab, such as 清醮!
https://cn.nytimes.com/china/20200225/china-religion-coronavirus-donations/ …",2020-02-25 23:49:23
234,Businesses ‘Getting Killed’ on Russian Border as Coronavirus Fears Rise https://nyti.ms/2Vjvohg  #business #Russia #Coronavirius #moscow #Pakistan #businessnetworking #backstronger #chinabackstrong,2020-02-24 23:56:46
235,"Latest #Coronavirus #Covid19 update:  I'll take ""Confusion"" for 1,000-RMB, Alexhttp://marccurtis.com/coronavirus-life-in-china/ …",2020-02-24 23:42:50
236,"Latest on #CoronavirusOutbreak in Italy:

- 888 cases reported
- 21 deaths
- 46 recovered

#COVID19 #coronavirus pic.twitter.com/bs3qvCRTMw",2020-02-28 23:57:44
237,"#Guangdong had reported 1 new case of the #coronavirus in #Dongguan, pushing the total number of infected patients to 1333. No new cases were confirmed in other cities
A special fund with a total of over 244 million yuan has been set up in to support frontline medical workers.pic.twitter.com/UK0K8T4Zs6",2020-02-21 23:51:50
238,Cracks appear in the cult of Xi.  China’s coronavirus and the pressure on the Party.  http://www.afr.com/news/world/asia/cracks-appear-in-the-cult-of-xi-20200219-p542gx?btis …,2020-02-21 23:51:49
239,FuntouchOS 10 release has been delayed due to Coronavirus outbreak #Vivo #FuntouchOS10 #news https://www.gizchina.com/2020/02/21/vivo-will-delay-the-rollout-of-funtouchos-10/ …pic.twitter.com/54NGopmjgR,2020-02-21 23:43:53
240,"CGTN talked to W. Ian Lipkin of Columbia University on the challenges China is facing as it deals with misconceptions people and the media have about #COVID19. Watch:
#coronavirus
https://newsus.cgtn.com/news/2020-02-22/Columbia-University-professor-on-misconceptions-of-COVID-19-OhueFx7CuI/index.html …pic.twitter.com/zZcyF2a0pv",2020-02-21 23:38:56
241,"I don’t know if Italian people think only China has coronavirus. But I think differently. Other countries didn’t find too many cases maybe just because they didn’t check. I think there is a possibility that Italian people infected in other countries, not only China.",2020-02-22 23:54:07
242,Coronavirus epidemic: Wuhan residents ordered to remain indoors https://www.aljazeera.com/news/2020/02/coronavirus-epidemic-wuhan-residents-ordered-remain-indoors-200222050246687.html …,2020-02-22 23:30:23
243,"Coronavirus: Five countries, five responses: How countries are battling the virus - from disinfectant lorries in China to roadblocks in Italy. http://dlvr.it/RQq3Sx pic.twitter.com/cz2Y4GsPjL",2020-02-26 23:57:02
244,"Coronavirus: How a 'drive-through' testing facility in London works: A new scheme is being introduced to ease pressure on health services, as experts expect more cases to emerge. http://dlvr.it/RQtf0Z pic.twitter.com/fXjp8N8Wsl",2020-02-27 23:59:32
245,RT @AFP: #UPDATES Eleven residential estates in south Beijing are locked down due to a fresh cluster of #coronavirus cases linked to the ne…,Sat Jun 13 07:51:13 +0000 2020
246,"#Beijing's Yuetan subdistrict has upgraded its #coronavirus risk level to medium, after detecting one confirmed… https://t.co/5Dn7B8ZkLF",Sat Jun 13 08:36:31 +0000 2020
247,"#China's approach when these post-#Wuhan #coronavirus clusters have appeared, like in the Nth East, has been to loc… https://t.co/TudER2DW40",Sat Jun 13 08:44:08 +0000 2020
248,@KKeaneBBC Do you think the @scotgov explanation is fair or are you saying that #COVID19 and the February rain is a convenient excuse?,Sat Jun 13 09:55:24 +0000 2020
249,Be safe.,Sat Jun 13 10:04:46 +0000 2020
250,"RT @GlblCtznImpact: Thank you 💙 @mileycyrus 💙 for calling on world leaders to unite &amp; commit billions of dollars to make testing, treatment…",Sat Jun 13 10:03:18 +0000 2020
251,RT @sarkodie: You guys got me on @JumiaGhana and I’m hooked 😊👌🏾 ... perfect way to shop without stepping out ... very essential in these #C…,Sat Jun 13 10:28:02 +0000 2020
252,New COVID-19 outbreak in Beijing,Sat Jun 13 11:03:45 +0000 2020
253,"“Being the voice of the British business community, we're cautiously optimistic about the recovery here in China,”… https://t.co/rhmQNilTWp",Sat Jun 13 11:06:14 +0000 2020
254,HPE Aruba Certification 'study materials' HPE6-A41| A45|A70|71 all are stable and pass. Those looking for HPE exams… https://t.co/YTfflVrYqw,Sat Jun 13 11:07:59 +0000 2020
255,"Apparently, after hearing about the new #COVID19 outbreak at the #Beijing #Xinfandi market, the Associated Press tr… https://t.co/k4SuE19D9B",Sat Jun 13 11:09:43 +0000 2020
256,"RT @SeanUM_China: Apparently, after hearing about the new #COVID19 outbreak at the #Beijing #Xinfandi market, the Associated Press tried to…",Sat Jun 13 11:17:38 +0000 2020
257,New research online: #COVID19 in patients with thoracic malignancies - first results the TERAVOLT registry study… https://t.co/Arcz53GEXj,Sat Jun 13 11:40:00 +0000 2020
258,"A total of 46 people have tested positive in throat swab #COVID19 tests in Beijing, after authorities conducted cit… https://t.co/WPiOs2Dtka",Sat Jun 13 11:41:53 +0000 2020
259,"RT @globaltimesnews: Beijing has entered a special period, as the capital reported confirmed #COVID19 infections and virus positive cases,…",Sat Jun 13 12:46:29 +0000 2020
260,"RT @antonioguterres: Saturday marks the 100-day countdown to #PeaceDay.

We are living through a difficult time, but we can turn the #COVID…",Sat Jun 13 09:57:14 +0000 2020
261,"Ready stock of finger pulse #oximeter in #India, #China and #USA 

#COVID19 #CoronavirusIndia https://t.co/VXRIfyvBl6",Sat Jun 13 12:55:21 +0000 2020
262,"@PMOIndia @drharshvardhan 

Popular apps like Paytm, google pay and bheem pay can be used for contact tracing. 

#COVID19 #CoronavirusIndia",Sat Jun 13 13:07:45 +0000 2020
263,"RT @shen_shiwei: Excuse me? In #China, we have been wearing face mask for half year... 🤦‍♂️🤦‍♂️🤦‍♂️
The #US latest research today said wear…",Sat Jun 13 09:58:44 +0000 2020
264,"RT @kiz4breakfast: #whiteOnWhite crime in our country I am appalled, how are you going to deal with this ????? I am scared to go outside  @…",Sat Jun 13 13:13:08 +0000 2020
265,RT @AIIB_Official: Today marks an important AIIB milestone—our debut #pandabond. The successfully priced RMB3 billion 3-year #SustainableDe…,Sat Jun 13 13:45:24 +0000 2020
266,Is your company’s response to the #COVID19 outbreak likely to impact customer attitudes towards doing business with… https://t.co/11FXbE6PbW,Sat Jun 13 13:59:00 +0000 2020
267,"Although China is farther along in the outbreak timeline than the US, consumer behavior in the two countries looks… https://t.co/LiMygszOre",Sat Jun 13 14:16:50 +0000 2020
268,"RT @shenzhenpages: Among 517 samples collected in #Xinfadi market in #Beijing, 45 were tested #positive for #COVID19. The market is shut do…",Sat Jun 13 14:36:38 +0000 2020
269,"Although most parks remain open but cap daily visitors, the most popular one #ForbiddenCity is closed. Spring is coming but crowds just start venturing out to appreciate the best season in Beijing amid #coronavirus #COVID2019pic.twitter.com/2BFmdUI6Cc",2020-03-02 23:59:17
270,"Coronavirus should encourage China to focus on policy, stimulus: Forbes Shanghai bureau chief - https://www.shanghaibeat.com/coronavirus-should-encourage-china-to-focus-on-policy-stimulus-forbes-shanghai-bureau-chief-10/ … #Shanghai #China #上海",2020-03-01 23:51:24
271,"Hello. Have you got any help yet? I just got some coronavirus IgM/G detection kits in Shenzhen, China. Do you need it? I can provide you for free.",2020-03-04 23:59:50
272,"Why do I get the feeling that this is a really, really bad idea?  https://www.bbc.co.uk/news/world-middle-east-51723398 … #Coronavirus #Covid_19",2020-03-03 23:59:20
273,"Due to coronavirus outbreak, #FIFA and the #AFC announced Thursday a formal proposal to postpone upcoming matches in the #AsianFIFAWorldCup2022 and #AFCAsianCup2023 qualifiers.pic.twitter.com/HAQnkw2aSW",2020-03-05 23:53:05
274,"President Trump to address the nation at 9am Beijing time (9pm ET) today. Earlier, @realDonaldTrump met with Wall Street executives to discuss ways to support small businesses and the market amid #coronavirus pandemic. https://twitter.com/realDonaldTrump/status/1237841878889840642 …",2020-03-11 23:57:36
275,Chinese officials push conspiracy theory coronavirus originated abroad https://www.theguardian.com/world/2020/mar/12/conspiracy-theory-that-coronavirus-originated-in-us-gaining-traction-in-china …,2020-03-12 23:57:26
276,"In face of the coronavirus(very similar with SARS) challenge,we must stay calm, believe the government, and the Prioriity is staying at home, the quarantine is very effective, because there is a precedent in Hubei,China.
After about 45days' fighting, now Hubei is return to normal",2020-03-15 23:58:49
277,"And sell them to you at 500x premium, because it is the luxury version of the gel. #coronavirus",2020-03-15 23:57:31
278,"Coronavirus: Barack Obama praises Giannis, Zion, and Curry after NBA stars make impressive gestures. Now can the Senate step up? https://sports.yahoo.com/coronavirus-barack-obama-praises-giannis-152543017.html?soc_src=social-sh&soc_trk=tw … via @YahooSports",2020-03-15 23:56:57
279,"The coronavirus was originally an elite monster. After losing a fight with China, the western media publicized that it was just a soldier. Now many people still don't pay attention to it, and the media should be responsible. Now human life is more important than political purpose",2020-03-20 23:59:44
280,Imported Coronavirus Cases in China Outpace Local Infections for Fifth Day - https://www.shanghaibeat.com/imported-coronavirus-cases-in-china-outpace-local-infections-for-fifth-day-4/ … #Shanghai #China #上海,2020-03-18 23:59:26
281,France says ibuprofen may aggravate coronavirus. Experts say more evidence is needed https://www.mercurynews.com/france-says-ibuprofen-may-aggravate-coronavirus-experts-say-more-evidence-is-needed …,2020-03-18 23:57:47
282,"Coronavirus≠Chinese virus!
Do you understand?",2020-03-17 23:59:46
283,"At a London hospital, a confirmed Coronavirus patient who died last week was attended to by 50 nurses and ""many"" doctors. ""None has been tested. All are still at work,"" hospital cardiologist Mark Gallagher told @guardianhttps://www.theguardian.com/world/2020/mar/17/there-is-a-policy-of-surrender-doctor-on-uks-covid-19-failures?utm_term=Autofeed&CMP=twt_b-gdnnews&utm_medium=Social&utm_source=Twitter#Echobox=1584488335 …",2020-03-17 23:57:11
284,"It’s COVID-19!  NOT Chinese Virus! Stop your stigmatization!
China has done a great job in fighting #coronavirus . We have gained so much time for the world with our sacrifice. But your action wasted that time!",2020-03-16 23:59:56
285,I don’t expect things to change any time soon if people keep comparing viruses. Way too many comments on the internet about the coronavirus not being as deadly as X or Y flu. https://twitter.com/esportslaw/status/1239568183389913091 …,2020-03-16 23:57:04
