,Tweets,Date
0,Because of Coronavirus my daughters and I get to experience and enjoy homeschooling. The kids are totally motivated and we're having a great time. What a shame it will have to come to an end soon. It should be a permanent option in Germany!,2020-04-29 23:48:32+00:00
1,"State gov announced expanded coronavirus testing at shopping centres, including mobile stations at Pacific Werribee &amp; Bunnings West Footscray. People should get tested, even if symptoms are only mild. More info: https://www.premier.vic.gov.au/coronavirus-testing-expands-at-shopping-centres/ Testing locations: http://www.dhhs.vic.gov.au/victorian-public-coronavirus-disease-covid-19#where-can-i-get-tested-for-coronavirus-covid-19",2020-04-29 23:47:55+00:00
2,"Halt destruction of nature or suffer even worse pandemics, say world’s top scientists. Only one species is responsible for #coronavirus – humans – say world’s leading #biodiversity experts https://www.theguardian.com/world/2020/apr/27/halt-destruction-nature-worse-pandemics-top-scientists #CoronaCrisis",2020-04-29 23:45:40+00:00
3,"161,525 #coronavirus cases (+1.0%) in #Germany as of 30/04 00:00 due to 401 districts stats. 37,721 currently infected. 117,299 recovered. Sources: https://bit.ly/38WabgE 6474 deaths (+154). #StayHome #COVID19 3/401 districts with 0 cases.",2020-04-29 23:26:40+00:00
4,"Wisconsin @GOP Assembly @SpeakerVos, telling people it was totally safe to vote while decked out in protective gear. @GOP appealed to courts to force in-person voting. At least 40 positive #coronavirus cases have been directly linked to the election. ",2020-04-29 23:20:32+00:00
5,"In December 2019, China reported about the danger of a padenemic outbreak of coronavirus to the WHO. Who was the person who denied all anout it, who called corona a flu - was it your twin, Mr. Trump? Maybe you forget what you have said five minutes before, but we are awake!",2020-04-29 23:13:28+00:00
6,Wisconsin finds more people who worked or voted in primary tested positive for coronavirus https://fxn.ws/2YjSiXw #FoxNews,2020-04-29 23:05:09+00:00
7,Still Flying Blind: Can Meteorologists Help Epidemiologists with Coronavirus? https://cliffmass.blogspot.com/2020/04/still-flying-blind-can-meteorologists.html,2020-04-29 22:50:19+00:00
8,"There's never been a vaccine for a coronavirus, and there's really no reason to get our hopes up that there'll be one for this coronavirus. No, that's not completely true. There are reasons to get people's hopes up and they come in a variety of currencies ",2020-04-29 22:47:39+00:00
9,"A thoughtful and balanced take on the economic consequences of #coronavirus. Not surprised - it's from @CFAinstitute, which is a solid.",2020-04-29 22:46:41+00:00
10,Meat Plant Workers and Your Dinner at Risk in Coronavirus Pandemic ,2020-04-29 22:39:27+00:00
11,"New post (Today’s coronavirus update: optimism about remdesivir, imagining a post-lockdown world) has been published on Coronavirus News - https://viruszone.org/todays-coronavirus-update-optimism-about-remdesivir-imagining-a-post-lockdown-world/",2020-04-29 22:30:33+00:00
12,Fire Fauci! Trump Coronavirus Advisor Approved $7.4 million Funding to Wuhan Lab ,2020-04-29 23:14:59+00:00
13,SIGN PLESE: Stop Boiling Black Cats into Paste as Coronavirus ,2020-04-29 22:22:35+00:00
14,Just Spit and Wait: New Coronavirus Test Offers Advantages ,2020-04-29 22:46:30+00:00
15,New Coronavirus Test Offers Advantages: Just Spit and Wait http://dlvr.it/RVjfhj,2020-04-29 22:15:33+00:00
16,"Front line coronavirus nurse: ‘Until you see the wards and the way people are dying, you can’t comprehend COVID-19′ ",2020-05-30 23:07:56+00:00
17,"Corona Virus COVID-19 False Flag : jay jericho : Free Download, Borrow, and Streaming : Internet Archive https://archive.org/details/coronavirusfalseflag via @internetarchive",2020-05-30 22:16:54+00:00
18,Current Events Inspire Two New Coronavirus Strategy Games http://www.youtube.com/watch?feature=player_embedded&amp;v=5cb90KQv2ls,2020-05-30 22:14:21+00:00
19,"If you've wondered how the coronavirus has been affecting the brewery, check out the @buffalocal716 blog post from our very own head brewer, Jason King! Stay safe, stay healthy &amp; grab a beer! ",2020-05-30 22:10:02+00:00
20,Africa's #women #journalists use radio against #coronavirus fake news ,2020-05-30 21:55:56+00:00
21,"BREAKING: Dominic Cummingss heading up new Coronavirus Operations, Training and Expediancy group or OPTREX as he wants it to be known.....",2020-05-30 21:36:12+00:00
22,Sorry. Cooking is one of the things you need to check off on the coronavirus bingo. Seems like you’re getting closer though.,2020-05-30 21:33:42+00:00
23,"To anyone in the US who goes to the protests: Please be safe! Not only in regard to the cops, but also because of the coronavirus. We don't need more outbreaks that will kill thousands of people. Wear a mask and distance yourself from others.",2020-05-30 21:15:36+00:00
24,Here's what you should expect as you ready yourself for your upcoming air travel. by @IntEngineering #coronavirus #COVID19 #health #COVIDー19 #travel #airlines #aviation,2020-05-30 21:12:40+00:00
25,Friend in Louisville told me the city has sent one text about Coronavirus during the entire pandemic but she has received two texts TODAY about the curfew the city has set to stop protesters from demanding #JusticeforBreonnaTaylor Pretty clear statement on the city’s priorities.,2020-05-30 21:11:27+00:00
26,What’s the Risk of Catching Coronavirus From a Surface? ,2020-05-30 23:54:16+00:00
27,"""Eventually, doctors will find a coronavirus vaccine, but black people will continue to wait, despite the futility of hope, for a cure for racism. We will live with the knowledge that a hashtag is not a vaccine for white supremacy"", writes @rgay.",2020-05-30 20:52:35+00:00
28,He didn’t mean what you are trying to make it sound like. You tried it when you told everybody that he called immigrants animals but he actually called gang members of the MS13 animals. You tried it when you told everybody that he called the Coronavirus a hoax but he actually...,2020-05-30 20:47:38+00:00
29,"Iran: Coronavirus fatalities in 323 cities exceed 48,000 - NCRI ",2020-05-30 23:31:00+00:00
30,"Coronavirus is real but if you listen to the science you can still go out, you just have to adjust a little and stay safe while keeping others safe too. Be creative.",2020-05-30 20:36:14+00:00
31,"German news: Australia tracing app flops after 4 weeks. Reasons for its minimum impact: too few users (⅓ of mobile users rather than 60%), communication problems betw Apple & Android phones, Bluetooth tech not exact enough. #tracingapp #coronavirus ",2020-05-30 20:23:32+00:00
32,Coronavirus: Cardiff City member of staff tests positive – NEWPAPER24 ,2020-05-30 20:19:38+00:00
33,New post (Fighter squadron taken off USS Gerald Ford after sailor tests positive for coronavirus) has been published on Coronavirus News - https://viruszone.org/fighter-squadron-taken-off-uss-gerald-ford-after-sailor-tests-positive-for-coronavirus/,2020-05-30 19:54:34+00:00
34,What if this introduced the corona virus to the @ISS_Research ,2020-05-30 19:53:43+00:00
35,Actor hit by car/ Restaurant owner makes creative proposal/ Troconis speaks out/ Grocery store worker dies of coronavirus: Month In Review https://trib.al/YXpginp,2020-05-30 19:43:10+00:00
36,Shouldn't we be contact tracing Corona Virus?,2020-05-30 19:34:11+00:00
37,How many hospitals are being built right now in the wealthy capitalist first world countries to contain #Coronavirus? I think that number will always be 0. ,2020-01-30 23:50:59+00:00
38,No body: Absolutely nobody: Igbo girls when they see broke guys #coronavirus ,2020-01-30 23:09:29+00:00
39,"I suppose it's uncertainty that's causing the panic. The new coronavirus isn't well understood and I guess that especially in countries with limited healthcare, medicals are unprepared. I'm not saying the panic is warranted, but I'm not really in a position to question the WHO.",2020-01-30 22:57:47+00:00
40,Even the coronavirus and kobe’s death ,2020-01-30 22:54:15+00:00
41,"yep, i actually wrote coronavirus in twitch cus i wanted to see someone talking about it yesterday. and most titles were just fucked up. today it looks calmer even tough a guys title: "".... still sick #coronavirus "". worst one so far was ""coronavirus waiting room""",2020-01-30 22:46:53+00:00
42,There are also 100s of new cases of coronavirus and more deaths in China's other provinces but these numbers will be released later.,2020-01-30 22:46:48+00:00
43,China coronavirus: US citizen evacuated from Wuhan quarantined after trying to flee base – NEWPAPER24 https://newpaper24.com/china-coronavirus-us-citizen-evacuated-from-wuhan-quarantined-after-trying-to-flee-base-newpaper24/,2020-01-30 22:45:18+00:00
44,"Coronavirus cant hurt Excel, its not a computer virus. ",2020-01-30 22:34:13+00:00
45,RT It is really annoying to know that even #Germany is affected by #coronavirus (South Germany/Bayern). But fortunately it was noticed very fast.,2020-01-30 22:17:44+00:00
46,BiG TrOuBLe in little #china #coronavirus cough cough ,2020-01-30 22:11:05+00:00
47,New coronavirus spreads as readily as 1918 Spanish flu - Los Angeles Times #CoronavirusOutbreak #coronarvirus,2020-01-30 22:08:07+00:00
48,"""W.H.O. Declares Global Emergency as Wuhan Coronavirus Spreads"" Check out via NYT https://ift.tt/2U9uuTX The New York Times",2020-01-30 21:42:15+00:00
49,Keep your workplace clean and help prevent the spread of #COVID19. #coronavirus,2020-02-28 23:30:09+00:00
50,An example of the #facts that―as a whole―constitute the idea of the #DeepState: #NancyMessonier (director[!] of the powerful―#COVID19-managing―#NCIRD) is the #sister of #RodRosenstein (37th #Deputy #AttorneyGeneral; special cousel in the #MuellerProbe against Pres. #Trump). #USA,2020-02-28 23:01:23+00:00
51,">> Online searches for ""corona beer virus"" spiked in early February, but have since declined. #covid19 #COVIDー19",2020-02-28 21:40:07+00:00
52,"SAP HANA Summit planned for March 4-5, 2020, is cancelled due to the increasing number of COVID-19 cases in Germany! Can we have this event online instead? #hanasummit #COVID19",2020-02-28 21:17:32+00:00
53,CDC : As long you stop touching your face we’re all going to be fine Me : Well it’s been a good run #COVID19 #coronavirus,2020-02-28 21:13:50+00:00
54,"It's official Due to the rapid spread of the #CoronaVirus, ITB #Berlin 2020 is cancelled until March 2021 For more info, please check the #ITB website. #ITBBerlin #COVID19 #Covid_19 #Corona #virus #infection #globalspread #tradefair #travel @ITB_Berlin https://www.messe-berlin.de/en/Press/PressReleases/News_73793.html?referrer=/en/Press/PressReleases/#news-en-73793",2020-02-28 21:09:40+00:00
55,Coughing in times of #COVID19? Rude.,2020-02-28 20:48:49+00:00
56,Like in Germany #COVID19 ,2020-02-28 20:06:03+00:00
57,The dominos have started to tumble ... where will it end ... #noITB2020 #COVID19,2020-02-28 19:49:25+00:00
58,"""It’s with regret that we have to inform you that due to the global health situation (#COVID19), the physical meeting of the Wikimedia Summit 2020 and related side events in Berlin have been cancelled.",2020-02-28 19:38:31+00:00
59,Don‘t panic #COVID19 ,2020-02-28 19:36:55+00:00
60,Thanks for the great media coverage today about our new free online doctor service for COVID-19 quarantine in France. Since yesterday we have 6 people in home quarantine & diagnosed 3 of them with most specific Corona virus symptoms. http://www.leparisien.fr/economie/coronavirus-le-site-arretmaladie-fr-ouvre-des-consultations-gratuites-desinteressees-27-02-2020-8268393.php #COVID19 #coronavirus,2020-02-28 18:41:01+00:00
61,"well, adults have more #Karma #COVID2019 #COVID19 #Covid_19 #CoronaVirusUpdates #Corona #Coronavid19",2020-02-28 16:32:47+00:00
62,#Italy reclassifying old pneumonia cases from January as #COVID19. This confirms that this has been community-spread for many weeks now. Italy is just the first country to uncover this hidden mess. Remember no other country was testing properly a few days ago. #coronavirusupdates,2020-02-28 16:26:13+00:00
63,How technology from drones to artificial intelligence is used to contain #COVID19: ,2020-02-28 16:24:15+00:00
64,Great timing #COVID19 ,2020-02-28 15:43:10+00:00
65,"Mentions report of joint mission. ""It calls for all countries to educate their populations, to expand surveillance, to find, isolate and care for every #COVID19 case, to trace every contact” … Says this takes all of government. “This is not a job for the health ministry alone""",2020-02-28 15:28:44+00:00
66,"""We do not see evidence as yet that the virus is spreading freely in communities”, says @DrTedros. ""As long as that’s the case, we still have a chance of containing #COVID19”",2020-02-28 15:27:36+00:00
67,"Question: why does the article say it's 400.000 chronic ill people? It's not saying, these people do/did have #COVID19",2020-02-28 14:47:53+00:00
68,"I guess a lot of (big) gigs will be affected by the fast way the #COVID19 epidemic spreads. Sucks for artists, promoters and the audience. Especially when ppl already have booked flights &amp; accommodations. Either the gigs will be cancelled or you decide to cancel. Damn. ",2020-02-28 14:37:44+00:00
69,"Turbulent times always create shifts in power structures, so infighting in these power structures will increase, with members fighting harder to get to the top. A public well prepared for a crisis might come to the realization that it doesn't need the state after all. #covid19",2020-02-28 13:56:30+00:00
70,"The top priority of the state is always to perpetuate its own existence, it's never about the survival of the general public. That is, policies are chosen to give an appearance of control, not necessarily by what works. Remember that in the weeks and months to come... #covid19",2020-02-28 13:56:30+00:00
71,"Nice initiative of @SZ that visualizes the spreading of #COVID19 in (almost) real time. (On the website that is linked, there is also a legend that tells you how to interpret the colors.) ",2020-02-28 13:24:08+00:00
72, Why are global markets reacting in such a strong way? #Covid19 #Coronavirus @ChelseyDulaney in #Frankfurt @FrankfurtStocks #Stocks #Stockmarket,2020-02-28 13:16:00+00:00
73,The IgM hyperimmunoglobulin pentaglobin from the German pharmaceutical company Biotest should work best in severe #COVID19 infections. Pentaglobin has already proven effective against SARS. ,2020-02-28 12:27:37+00:00
74,"#COVID19 could be a great test for remote office work, and also for how work is valued when so many jobs depend on a stable environment. Maybe this is also when we will shift our focus to actions that will save this planet?",2020-02-28 12:17:27+00:00
75,"Aren't such gatherings risky these days, with #COVID19 going round?",2020-02-28 12:06:40+00:00
76,"Studies on household transmission of #covid19 are underway in China, report says. „but preliminary studies ongoing in Guangdong estimate the secondary attack rate in households ranges from 3-10%“",2020-02-28 12:03:39+00:00
77,"Also worth noting that joint mission report on #covid19 points to household transmission as main driver of epidemic: „In China, human-to-human transmission of the COVID-19 virus is largely occurring in families.“",2020-02-28 11:58:48+00:00
78,T-cell count can sink and it is thought that #COVID19 possibly has HIV-like properties ,2020-02-28 11:52:47+00:00
79,"Congrats @WHO_Europe, very fine, mobile data platform for #COVID19 in #Europe!",2020-02-28 10:52:18+00:00
80,Covid19 virus so: 1001 attaaaack ... 999 nee du... ,2020-02-28 10:50:49+00:00
81,This is important: Report of joint @WHO-China mission on #covid19 has just been released. Guess I know what we’ll all be reading today... https://www.who.int/docs/default-source/coronaviruse/who-china-joint-mission-on-covid-19-final-report.pdf,2020-02-28 10:50:26+00:00
82,Just landed in Sao Paulo and this is the first news I read. Everyone I know was expecting #covid19 cases to be found in sub-Saharan Africa eventually. But still a huge concern. ,2020-02-28 10:47:59+00:00
83,Switzerland cancels the Geneva Auto Salon over #COVID19 concerns ... FYI @mohammedhersi,2020-02-28 10:47:43+00:00
84,"I was really looking forward to participate in the Hackathon and give a workshop about CMS in the cloud at #Cloudfest 2020. Now the conference was cancelled, due to #COVID19. I guess, it's the right decision, and can only imagine how hard it was taking it for the organizers.",2020-02-28 10:31:20+00:00
85,@MoHFW_INDIA is it true that you recommend #Globuli as a prophylactic treatment for #COVID19? As this German physician claims. ,2020-02-28 10:16:37+00:00
86,"I celebrate everybody who demonstrates responsibility in these days of #COVID19. For many measured suggestions, please read this: https://blogs.scientificamerican.com/observations/preparing-for-coronavirus-to-strike-the-u-s/ HT @zeynep -- awesome work",2020-02-28 09:00:13+00:00
87,"Only very limited information is available, but this looks like an outbreak of what could be a new respiratory (corona?)virus http://click.aaas.sciencepubs.org/?qs=3d34abe456454c9666afc32dd6decf4dc8bd4a55568cd5bffd591b1e4d38328801f062a5354e171f36ad8b01b4c7f05178503f4d363a1ab4 …",2020-01-05 08:29:26
88,"“No journal will reject a paper because this sequence has been made public.” C. Drosten #ChariteVirology @ChariteBerlin
https://www.sciencemag.org/news/2020/01/scientists-urge-china-quickly-share-data-virus-linked-pneumonia-outbreak …
#Wuhan #Coronavirus @kakape",2020-01-09 21:28:38
89,"#Wuhan #Coronavirus sequence also public available on GenBank:
https://www.ncbi.nlm.nih.gov/nuccore/MN908947 …",2020-01-12 18:12:49
90,First validated diagnostic real-time PCR for the detection of #Wuhan #coronavirus made available by our institute and recommended by #WHO #ChariteVirology #nCoV-2019 ⁦@vmcorman⁩ ⁦@ChariteBerlin⁩  https://www.who.int/health-topics/coronavirus/laboratory-diagnostics-for-novel-coronavirus …,2020-01-15 07:49:56
91,"We have developed an validated a set of real-time RT-PCRs for Wuhan Coronavirus:
Our protocol is public available on the @WHO website:
https://www.who.int/health-topics/coronavirus/laboratory-diagnostics-for-novel-coronavirus …",2020-01-15 07:33:04
92,"Not ""maybe"", the answer is ""yes""! But I totally agree with the second part.
""Serological Evidence of Bat SARS-Related Coronavirus Infection in Humans, China""
https://dx.doi.org/10.1007%2Fs12250-018-0012-7 …https://twitter.com/MattFrieman/status/1217138770174066690 …",2020-01-14 22:16:26
93,"Lab days are happy days!
#Wuhan #Coronavirus pic.twitter.com/EwiM2T2o2u",2020-01-11 21:37:23
94,"Led by Prof. Dr. Christian Drosten, researchers from #CharitéBerlin have developed the first diagnostic test for the novel #coronavirus in China. Their assay protocol has now been published by @WHO. https://bit.ly/30pjbIi  #nCoV2019 #ChariteVirology @DZIF #WuhanPneumoniapic.twitter.com/GuGDKKe3mH",2020-01-16 16:13:29
95,Yes. It's a novel coronavirus with SARS-like symptoms that seems to be coming out of (as expected) food markets in China. It's what most scenarios for a new pandemic predicted.,2020-01-16 05:26:23
96,This was to be expected: there is evidence of limited human-to-human transmission of the novel #coronavirus https://twitter.com/WHOWPRO/status/1218741294291308545 …,2020-01-19 07:09:39
97,"China reported 17 more cases of pneumonia caused by a new coronavirus strain on Sunday, stoking worries of it spreading as the country gears up to celebrate Chinese lunar new year when hundreds of millions of people travel.
https://www.reuters.com/article/us-china-health-pneumonia/china-virus-cases-spike-17-new-infections-reported-idUSKBN1ZI028?feedType=RSS&feedName=topNews&utm_source=feedburner&utm_medium=feed&utm_campaign=Feed%3A+reuters%2FtopNews+%28News+%2F+US+%2F+Top+News%29 …",2020-01-19 05:12:08
98,Does @HamburgAirport actually have thermal image scanning? Because many travelers come to the Hanseatic City from China. And a new #Coronavirus has just been discovered in Wuhan @WHO. Two travelers from Wuhan were discovered with the virus in Thailand and Japan. #Sayitoutloudpic.twitter.com/4rXNQ2UFje,2020-01-18 16:05:40
99,"Prof Ferguson: it is too early to be alarmist but he is substantially more concerned than a week ago […] People should be considering the possibility of substantial human-to-human transmission more seriously than they have so far.
#coronavirus #Wuhan https://www.bbc.co.uk/news/health-51148303 …",2020-01-18 08:46:37
100,"WHO warning of new coronavirus 2019-nCoV
 https://flutrackers.com/forum/forum/-2019-ncov-new-coronavirus/china-2019-ncov/821830-china-45-diagnosed-2019-ncov-new-coronavirus-cases-in-wuhan-hubei-province-december-30-2019-2-fatal-cases-98-under-observation/page12 …
https://www.who.int/docs/default-source/coronaviruse/20200114-interim-laboratory-guidance-version.pdf …
https://www.who.int/csr/don/16-january-2020-novel-coronavirus-japan-ex-china/en/ …pic.twitter.com/plQ1X72gFr",2020-01-18 04:23:16
101,The CDC and Homeland Security begin screening for Chinese Coronavirus at three major US airports as outbreak spreads in Asia http://dld.bz/hVKas ,2020-01-17 20:36:13
102,"A short escape from the lab work:
Today, I will give a talk about ""Bats and zoonotic diseases"" at #Tierärztekongress #10LTK @leipzigermesse
Thanks @MackayIM, it was easy to include slides about
#WuhanPneumonia #nCoV2019 #Wuhan #Coronavirus",2020-01-17 15:28:02
103,Novel Coronavirus that recently emerged in China: Research underway to address latest viral threat https://www.sciencedaily.com/releases/2020/01/200123170723.htm …,2020-01-23 23:17:04
104,anagram of corona virus = carnivorous ,2020-01-28 23:57:40
105,"Australian lab first outside of China to re-create coronavirus, helping vaccine push
 https://mobile.abc.net.au/news/2020-01-29/wuhan-coronavirus-created-in-australian-lab-outside-of-china/11906390?pfmredir=sm …",2020-01-28 23:57:29
106,Wow what a piece of shit that guy is. My first whiff of British conservatism and I think I have Coronavirus,2020-01-28 23:45:21
107,"#BREAKING
White House is considering to suspend all flights between US and China because of coronavirus.",2020-01-28 23:43:36
108,#China should inform the international community if they have the ability to test for new cases (test kit shortage). #coronavirus,2020-01-28 23:37:58
109,"A company of 40 people, 4 infected (here in Germany). Wuhan 11,000,000 people. Do the math. #coronavirus",2020-01-28 23:35:07
110,"I did not even consider that that Chinese Government was involved with the global  Cabal. I believed they were better than that. China leader calls coronavirus outbreak a grave situation as officials scramble to contain disease

https://www.foxnews.com/world/china-xi-jinping-coronavirus-outbreak …",2020-01-25 23:29:01
111,How many hospitals are being built right now in the wealthy capitalist first world countries to contain #Coronavirus? I think that number will always be 0. https://twitter.com/zlj517/status/1222895147697885185 …,2020-01-30 23:50:59
112,It looks like the N95 mask won't give full protection from the #Wuhan #coronavirus. A full-face respirator needed. https://twitter.com/shawnxyny/status/1220028131374813184 …,2020-01-22 23:24:26
113,First studies are out on the new coronavirus. For 51% of patients no source could be identified which either suggests smear or airborne infection (or both) https://twitter.com/hayesluk/status/1220027610547097600 …,2020-01-22 23:15:42
114,"References to the year 2000 are increasing. Not a bad time to hedge. 
#coronavirus #sp500 #dax #börse #aktien #wirtschaft #tradinghttps://twitter.com/sentimentrader/status/1216008414666665985 …",2020-01-22 22:56:26
115,"Fascinating - and concerning - thread on how the #coronavirus spread in Wuhan, China https://twitter.com/WilliamYang120/status/1219990902212456448 …",2020-01-22 22:42:58
116,Worries me...man made perhaps from China..!#coronavirus https://twitter.com/QuickTake/status/1220014347747045384 …,2020-01-22 22:29:03
117,Allegedly Wuhan hospital have reached maximum capacity today on handling suspected coronavirus patients https://twitter.com/RFA_Chinese/status/1219998975622705152 …,2020-01-22 22:27:40
118,"We live in a time of disrespect and violence towards nature, animals and even humans.
Nature will take revenge faster than expected. #CoronaVirus",2020-01-21 22:59:42
119,"Is there any way to fortify against today'snew Corona virus, @CDCFlu?
@CDCgov I have an invalid adult  daughter.",2020-01-21 22:34:39
120,*hundreds of Planes potentially carrying people that have been exposed to the virus. It's not like they take dead-sick patients from their hospital beds and send them around the world. Stop the fear-mongering. #coronavirus,2020-01-27 23:50:56
121,#Corona virus confirmed first case in #Germany https://twitter.com/PeterSweden7/status/1221939163882250240 …,2020-01-27 23:50:50
122,First confirmed case of #coronavirus infection in Germany SW of Munich. Press briefing Tuesday morning. | https://www.tagesschau.de/inland/coronavirus-deutschland-erster-fall-101.html …,2020-01-27 23:46:53
123,"The first case of the new coronavirus has been confirmed in Germany, a spokesman for the Munich health ministry said.

The patient is a man from the Starnberg area of Bavaria, some 30 km south-west of Munich, @dpa reports.",2020-01-27 23:39:08
124,"https://www.msn.com/en-us/news/us/arizona-california-cases-push-us-tally-of-new-virus-to-5/ar-BBZkVik?ocid=NL_ENUS_D1_20200127_3_2 …
Heck stop eating cats & dogs in #FuckingChina, and soon no more #CoronaVirus epedemies like this one, like #SARS or like #MERS will appear!!! #Snakes or #Bats might be the source either!!! 
@StarSuperfan42 @GrouciDjamila",2020-01-27 23:35:04
