,Tweets,Date
0,Covid 19 coronavirus: Mike Hosking - Labour playing us like a fiddle - NZ Herald ,2020-04-29 23:59:36+00:00
1,Coronavirus: SPCA not expecting influx of returned pets like US shelters http://dlvr.it/RVjrLY,2020-04-29 23:52:32+00:00
2,"The headline should be Mike Hosking is playing with us like a fiddle. Another 'opinion' piece whose tenets are unverified assumptions. Covid 19 coronavirus: Mike Hosking - Labour playing us like a fiddle, via @nzherald",2020-04-29 23:47:05+00:00
3,"Random Dumber Generator: Good News For Apple, As Coronavirus Has Little Impact On Sales In China https://randomdumber.blogspot.com/2020/04/good-news-for-apple-as-coronavirus-has.html?spref=tw",2020-04-29 23:27:00+00:00
4,New Coronavirus Test Offers Advantages: Just Spit and Wait ,2020-04-29 23:00:30+00:00
5,Finally good news Coronavirus: New antibody test 'with 99 percent accuracy' approved for use across Europe ,2020-04-29 22:52:13+00:00
6,"randomdumber: Good News For Apple, As Coronavirus Has Little Impact On Sales In China https://ift.tt/2VSiXcl",2020-04-29 22:48:34+00:00
7,Coronavirus: Non-contact sports poised to resume in the Cook Islands ,2020-04-29 22:22:42+00:00
8,"Bill De Blasio Fine With George Floyd Protests Even As Businesses, Other Gatherings Must Adhere To Coronavirus Rules Or Face Fines ",2020-05-30 22:10:24+00:00
9,Gotta love living in New Zealand right now. As if 30May - Zero new #coronavirus cases for 8days straight. Zero people in hospital care. Virus more or less eliminated. Amazing.,2020-05-30 21:36:07+00:00
10,So far that has worked for New Zealand. Coronavirus essentially eliminated.,2020-05-30 20:49:17+00:00
11,"and big government. Bill Gates, False Flags, & The Coronavirus:- The plan is to drive us to one world government, and the Illuminati have been working on it a long time. Myron Fagan on the Illuminati, the United Nations, &amp; World History: Through its control of the media, CIA-",2020-05-30 20:37:02+00:00
12,Fantastic place for a visit if you haven’t been. Coronavirus: Bilbo's back as Hobbiton reopens the doors to the Shire ,2020-05-30 20:16:11+00:00
13,Inspiring. Now why can't US get on top of coronavirus? One word answer. ,2020-05-30 19:58:11+00:00
14,Belgian prince tests positive for coronavirus ,2020-05-30 19:40:05+00:00
15,Bat Flash - Wuhan Coronavirus Leads to More Premature Scapegoating of Bats: https://mailchi.mp/6b1d12fa7dd1/bat-flash-wuhan-coronavirus-leads-to-more-premature-scapegoating-of-bats #bats #coronoravirus,2020-01-30 23:51:20+00:00
16,"And this advice, also from an antivax page suggesting how to avoid the new coronavirus sounds like great fun. ",2020-01-30 23:45:21+00:00
17,"Good conversation on my show @MagicTalkRadio last night asking why Air New Zealand isn’t reducing/halting flights to/from China due to the coronavirus, when many of the big airlines around the world have done just that..hello, media release this morning in my inbox; is it enough? ",2020-01-30 23:34:36+00:00
18,There is a lot about the #coronavirus in the media which is why our HS+E Rep wanted to share this link with you that gives standard recommendations for the general public to reduce exposure to &amp; Transmission of it. #foodforthought #healthandsafety http://bit.ly/2ta3ngw,2020-01-30 23:30:00+00:00
19,Could this coronavirus be Disease X? Everything you need to know about t... https://youtu.be/XDVP4vbeikk via @YouTube my thoughts and prayers are with the people of china right now,2020-01-30 22:58:34+00:00
20,Will A Mask Really Protect You From Coronavirus? - Cheddar Explains https://youtu.be/5M7saVTtBQI via @YouTube https://wild.link/walmart/AOuNFw #wildlink,2020-01-30 22:53:13+00:00
21,"While there are no confirmed cases of Coronavirus in NZ yet, it's a good reminder for us all to be extra vigilant when it comes to hygiene at home, and in the workplace. We've put together a guide which covers 8 ways to create better workplace hygiene. ",2020-01-30 22:06:59+00:00
22,"On the subject of #COVID19 though, this is the kind of government action we really don't need to see.. closed for ""rectification""... WTAF ",2020-02-28 21:15:57+00:00
23,I also want to thank Eric for helping me to identify this early and factor in the impact. Thanks mate from NZ (we got our first Covid19 case last night),2020-02-28 20:50:22+00:00
24,"After four weeks working alongside some fabulous @IFRCAsiaPacific people on #COVID19, I’m heading home from #KL (on the same day the first case of #coronavirus has been reported in #NZ). Feeling grateful, and ready to jump back in at @NZRedCross – at KLIA Satellite Terminal",2020-02-28 12:25:25+00:00
25,Do you expect the government to seal our borders leading to mass unemployment and food and fuel within weeks? Tough. How about you start washing your hands and covering your coughs and sneezes. #nzpol #coronavirus #COVID19,2020-02-28 11:49:54+00:00
26,"That's right. Nothing less reassuring than cover up PR talks. Rather than hiding behind top credentials or criticising 'misinformation', why can't a Harvard 'Public Health' Prof. give daily #COVID19 updates on YouTube? Doctors in Taiwan have already done this on TV for 5 weeks.",2020-02-28 10:47:21+00:00
27,All staff at @MasseyUni Auckland science are about to get axed including NZ's foremost disease modeller Mick Roberts and @freed_nikki a developer of the @ubiquitomebio platform for #COVID19 diagnosis https://www.newsroom.co.nz/2020/02/28/1059827/a-kiwi-device-for-mobile-virus-testing Sign here to save our science,2020-02-28 09:10:40+00:00
28,"New SARS like coronavirus identified in Japan. Human to human spread??
 https://www.bloomberg.com/amp/news/articles/2020-01-16/pneumonia-causing-virus-found-in-traveler-in-japan-sankei-says?__twitter_impression=true …",2020-01-16 19:48:50
29,"When everyone is getting scared of China's coronavirus and you're sitting at you desk like: Maybe I could write a story about that?

#WritingCommunity #Writers",2020-01-23 23:29:21
30,"Coronavirus, Protect yourself and family https://youtu.be/RECcmQQQOj8  via @YouTube",2020-01-28 23:45:16
31,"The timing of this Coronavirus outbreak seems manipulated to dominate the news cycle as President Trump's defense Rolls out in the Senate 
I find the whole Coronavirus thing totally suspicious ..
Almost like it has been manufactured in a lab and released among the public in Wuhan",2020-01-25 23:39:26
32,"Top google search right now...
Hair Loss
2nd...Coronavirus

Good to know that our vanity supersedes our health care",2020-01-25 23:35:32
33,Bat Flash - Wuhan Coronavirus Leads to More Premature Scapegoating of Bats: https://mailchi.mp/6b1d12fa7dd1/bat-flash-wuhan-coronavirus-leads-to-more-premature-scapegoating-of-bats … #bats #coronoravirus,2020-01-30 23:51:20
34,"And this advice, also from an antivax page suggesting how to avoid the new coronavirus sounds like great fun. pic.twitter.com/tRtLjXYv7u",2020-01-30 23:45:21
35,NASA looking for somewhere suitable for escaping to with the Coronavirus coming to get us all. https://twitter.com/kenradio/status/1219391772771532801 …,2020-01-22 23:15:37
36,"China's response to the coronavirus is an amazing example of efficient cooperative governance at work.

With pressure and support from central government, local authorities have effectively been able to do what is unprecedented.

I mean the mayor even offered to resign over this.",2020-01-27 23:45:42
37,"I’ve put together this (hopefully calming) explainer summarising what we know about the novel #coronavirus

Key points:

*Highly likely to come to NZ
*Spread wouldn't be same as in China due to smaller pop density
*NZ has lots of good structures in place

https://www.nzherald.co.nz/nz/news/article.cfm?c_id=1&objectid=12303887 …",2020-01-27 23:44:58
38,Do you think enough is being done in New Zealand to screen for the coronavirus? https://www.stuff.co.nz/travel/travel-troubles/119084862/coronavirus-new-zealands-response-is-too-weak?utm_campaign=apester&utm_source=twitter …,2020-01-27 23:36:07
39,"New resource: For clinicians at the front lines of the outbreak who are seeking the most current, evidence-based clinical decision support, the Coronavirus topic on UpToDate is available free worldwide in English and in Chinese - https://www.uptodate.cn/contents/coronaviruses … #NovelCoronavirus",2020-01-29 23:52:39
40,"According to the Lancet Medical Journal there are cases of transmission of the #coronavirus by people who are not showing any symptoms.  

How effective is our government's border control if this is the case? 

Asking for 5 million New Zealanders...
https://www.stuff.co.nz/world/asia/119139951/10yearold-boy-raises-fears-wuhan-coronavirus-could-spread-undetected …",2020-01-29 23:50:28
41,"Coronavirus: Air New Zealand continues flying to China, company doctor reassures passengers, via @nzherald https://www.nzherald.co.nz/business/news/article.cfm?c_id=3&objectid=12304495 …  Unless it is absolutely essential, stay well clear of Planes and China",2020-01-29 23:46:06
42,"Coronavirus: China accused of 'burning bodies in secret', via @nzherald https://www.nzherald.co.nz/world/news/article.cfm?c_id=2&objectid=12304547 …  Stay vigilant everybody, stay safe....",2020-01-29 23:40:33
43,"http://hugodeluca.com  2019 Coronavirus: Facts, FAQs, and how to help: As the 2019 coronavirus spreads, here's what you need to know about the disease as well as how World Vision is responding. The post 2019 Coronavirus: Facts, FAQs, and… http://dlvr.it/RPcHj1  With compassionpic.twitter.com/586pQ7oO44",2020-02-07 23:45:32
44,So who’s even working on a Coronavirus cure?,2020-02-05 23:57:42
45,China braces for return to work as coronavirus deaths exceed Sars https://www.theguardian.com/world/2020/feb/09/coronavirus-global-death-toll-overtakes-sars-epidemic?CMP=share_btn_tw …,2020-02-09 23:54:43
46,"Whitecliffe is following the  @minhealthnz lead on making sure domestic and international students feel safe and supported in regards to coronavirus restrictions. Please follow the link below to our FAQs page
https://www.whitecliffe.ac.nz/notice-coronavirus-outbreak-10th-feb-2020 …",2020-02-09 23:38:20
47,"New Zealand needs a national public health agency to tackle the challenges the country faces from infectious diseases like #Coronavirus and #Measles and from issues like climate change, researchers from @publichealthUOW write in #PublicHealthExpert blog https://blogs.otago.ac.nz/pubhealthexpert/2020/02/05/a-preventable-measles-epidemic-lessons-for-reforming-public-health-in-nz/#more-3803 …",2020-02-04 23:44:33
48,Why do people get xenophobic when diseases like coronavirus hit? http://dlvr.it/RPP9nt ,2020-02-04 23:37:32
49,warcraft is such a mental refresh from the coronavirus that is league of legends,2020-02-01 23:57:56
50,"Looks like something out of movies, reminds me of #contagion the movie  CORONAVIRUS UPDATE: LATEST IMAGES FROM WUHAN HUBEI PROVINCE #CDCUPDATES ... https://youtu.be/C0IzeP5oOg8  via @YouTube",2020-02-01 23:54:32
51,"This is appalling. Why is the PPTA meddling in Australian politics? I thought their job was to advocate for their members who will be working hard welcoming students back to school, issues like families not being able to afford uniforms and NZ’s response to coronavirus? https://twitter.com/NZPPTA/status/1224467158505099264 …",2020-02-03 23:44:52
52,"Can Coronavirus keep New Zealand workers from work?
 http://www.newssummedup.com/a/32fd63 ",2020-02-11 23:39:29
53,This article shows such a good example of scientists using new evidence to refine and refine their understanding of #COVID-19 #Coronavirus to make predictions https://www.stuff.co.nz/world/asia/119443356/coronavirus-could-spark-huge-numbers-of-infections--expert …,2020-02-11 23:31:45
54,"Too early to relax about coronavirus, top CSL scientist warns world markets http://dlvr.it/RQ9F9V ",2020-02-16 23:59:01
55,"Today’s #AdBreakChat is a little left field, even for the child. @Sam_Casey4 pipes up with: “You know what would be good content for @TheCountry? If I got #Coronavirus...” ",2020-02-16 23:27:45
56,"I'm going on about the fact that the Labour Fiscal Plan of 2017 didn't have money for contingencies like this $11m for coronavirus in it. Hence, that $11m is now part of me... Labour's Super Fat Fiscal Hole! ",2020-02-18 23:25:23
57,"Coronavirus causes mild disease in four in five patients, says WHO
https://www.theguardian.com/world/2020/feb/17/coronavirus-causes-mild-disease-in-four-in-five-patients-says-who …",2020-02-17 23:34:12
58,Some combination. Random statements of policy view aren’t sensible and the coronavirus position is clearly quite a bit worse than it was 2-3 weeks ago when their forecasts were signed off.,2020-02-24 23:51:35
59,"Mike Hosking on coronavirus: Now is not the time for benefit increases, via @nzheraldhttps://www.nzherald.co.nz/nz/news/article.cfm?c_id=1&objectid=12311343 …",2020-02-24 23:48:21
60,U.S. to push production of protective gear for coronavirus; new case confirmed in California http://www.kogonuso.com/2020/02/us-to-push-production-of-protective.html … via @SatankMKR,2020-02-28 23:59:12
61,BE SAFE EVERYONE  #coronavirus #personalhygiene #washyourhands #informyourself #doyourownresearch,2020-02-28 23:58:15
62,"You may need to improve your sales pitch. 

I hear it may possibly or possibly not protect people from the corona virus.",2020-02-28 23:55:09
63,"Trump: ""Pray Away HIV"" Pence in Charge of Coronavirus https://youtu.be/v0up0Say2gc  via @YouTube",2020-02-27 23:56:19
64,For some prime ministers coronavirus is a gift from God: perfect cover for previous blunders. Looking at you Samoa & Australia,2020-02-27 23:54:01
65,RT @AFP: #UPDATES Eleven residential estates in south Beijing are locked down due to a fresh cluster of #coronavirus cases linked to the ne…,Sat Jun 13 07:51:13 +0000 2020
66,"RT @ASIS_Intl: ""Why Are Women-Led Nations Doing Better With Covid-19?"" https://t.co/NeALtFJXwW #women #leadership #security #health #safety…",Sat Jun 13 08:09:11 +0000 2020
67,"RT @jwatsonsax: UK Performing Arts people:

Is there an impassioned &amp; eloquently written petition/open letter/campaign for govt funding for…",Sat Jun 13 08:47:50 +0000 2020
68,"This clearly indicates that sealing of #haryana borders didn’t help. 
We needed a smart lockdown &amp; gradual smart un… https://t.co/HDVe3FhmRN",Sat Jun 13 08:50:11 +0000 2020
69,"RT @hermannkelly: It's been widely accepted for years &amp; well attested in scientific studies that having sufficient vitamins A, C, D and zin…",Sat Jun 13 09:52:34 +0000 2020
70,"RT @GlblCtznImpact: Thank you 💙 @mileycyrus 💙 for calling on world leaders to unite &amp; commit billions of dollars to make testing, treatment…",Sat Jun 13 10:03:18 +0000 2020
71,RT @CDCgov: #Employers: Antibody tests for #COVID19 should not be used to determine if someone can return to work. There is not enough info…,Sat Jun 13 09:52:47 +0000 2020
72,"RT @Coltheman1: This is the best our PM gets talking economic  recovery from #COVID19  Do we really want another 3 yrs of this?
https://t.c…",Sat Jun 13 10:43:35 +0000 2020
73,"RT @allisonl: Thank you, thank you @francesbell and colleagues for your tireless work not only in creating  this special issue but in raisi…",Sat Jun 13 10:05:29 +0000 2020
74,"RT @zambezi40: Gogo Project, #Mbare #Zimbabwe 🇿🇼

Our youth led project supports grandmothers/grandchildren with basic groceries, #mentalhe…",Sat Jun 13 11:09:52 +0000 2020
75,"RT @sanchezcastejon: Spain is coleader in initiatives such as the ACT-Accelerator to achieve equitable access to vaccines, treatments and d…",Sat Jun 13 10:14:30 +0000 2020
76,Two things important. My phone had Coronavirus already in its prediction text right on day one. I’m getting notification telling me my contact is on twitter although it’s under a different account from their existing account. How’s that possible?,2020-03-02 23:58:50
77,Great to be able to bring this information to Aotearoa NZ to support our planning #coronavirus #COVIDー19https://twitter.com/ChiefSciCan/status/1234626530095005699 …,2020-03-02 23:57:46
78,all these peeps rushing to buy supplies for coronavirus when this is all you need to do!!!!!!! hygiene is cool https://twitter.com/quintabrunson/status/1233951652853370880 …,2020-03-01 23:50:46
79,I don't know where this braindead narrative that Trump fumbled the Coronavirus response by appointing the head of the state department's AIDS response team who just so happens to be a woman is coming from.,2020-03-01 23:50:29
80,"When will we just accept that we all have a fair chance of getting #coronavirus at some stage over the next year or two?
It will be like a bad flu.
Lets focus on keeping up healthy habits and taking care of ourselves and our families and friends.",2020-03-06 23:58:44
81,i hope all of you guys stay safe thru out the corona virus out Brake hopefully you have everything you need and you stay safe and if you don't end up getting wifi or power the hope for the best and try to survive and when the out brake ends thats when you might see me next,2020-03-04 23:51:22
82,When washing hands & internally singing #HappyBirthday do I go into Hip Horray and For s/he' a jolly good... after song? #CoronaVirus,2020-03-03 23:59:56
83,Thank you so much @JohnJCampbell @NZAgedCare for alerting the country to the situation our precious aged citizens are facing. @MOH_TT is not taking any action #Covid_19 #coronavirus #SARSCoV2https://www.tvnz.co.nz/one-news/new-zealand/nz-rest-homes-not-geared-up-coronavirus-outbreak-calls-national-action-plan …,2020-03-03 23:52:22
84,"Air NZ orders 'deep clean' after coronavirus victim flew on one international, two regional flights
https://www.tvnz.co.nz/one-news/new-zealand/air-nz-orders-deep-clean-after-coronavirus-victim-flew-one-international-two-regional-flights …pic.twitter.com/LoHxCjIhrW",2020-03-03 23:52:08
85,"Supporting Chinese Communities with Eden Ventures https://hubs.ly/H0nr6Mb0 

Find out how Eden Ventures, the active venture fund co-founded by The Icehouse, is helping the medical community tackle the Coronavirus.

#TheIcehouse #EdenVentures #SupportingGlobalCommunities",2020-03-08 23:59:59
86,"I know coronavirus is bad but this is time I can afford vacation so, yeah. Interesting times..",2020-03-08 23:58:54
87,Coronavirus: Can pets get Covid-19? Why the answer isn't completely straightforward http://dlvr.it/RRVjnT ,2020-03-08 23:50:31
88,"I genuinely hope that all the people who claim the Coronavirus is overblown are right. However, is risking the life of your parents & immune-compromised citizens a price you're willing to pay in order to not be inconvenienced.  Please be considerate.",2020-03-11 23:59:57
89,I guess no one is going to get tested then. Good thing biden isn't president now. He would put people in jail for not getting tested if it's found out the person has coronavirus.,2020-03-11 23:56:26
90,"Great to see 
Coronavirus: Aston Villa, Brighton & Fulham donate food to homeless http://www.bbc.com/sport/football/51882016 …",2020-03-13 23:57:48
91,"COVID-19: Keeping safe and The Icehouse Community https://hubs.ly/H0nJ-TJ0 

Now is the perfect time to update our network and friends on how we at The Icehouse are responding to the Coronavirus (COVID-19) situation. 

#covid-19 #theicehouse #strongertogetherpic.twitter.com/0A0DRvBTac",2020-03-19 23:59:59
92,Coronavirus: The jobs that could boom in the COVID-19 pandemic https://www.newshub.co.nz/home/money/2020/03/coronavirus-the-jobs-that-could-boom-in-the-covid-19-pandemic.html …,2020-03-19 23:59:13
93,"I'm #ChildfreeByChoice. I'm so grateful I don't have children to homeschool right now: parents who do have my sympathies

All I ask from these parents is that, once #coronavirus has passed, they remember how difficult it was, and they STOP pushing the #childfree to have children",2020-03-19 23:59:07
94,"Come now, and let us reason together,
Says the Lord,
Though your sins are like scarlet,
They shall be as white as snow;
Though they are red like crimson,
They shall be as wool.
#TrustGod #CoronaVirusUpdate #COVID19ON #coronavirus #StayAtHomeChallenge #FightCOVID19 #coronavirus",2020-03-19 23:58:16
95,Coronavirus: Destiny Church continues Sunday service with precautionary measures https://www.stuff.co.nz/national/health/coronavirus/120474471/coronavirus-destiny-church-continues-sunday-service-with-precautionary-measures …,2020-03-21 23:56:56
96,Killing coronavirus with kindness: how Kiwis are primed for goodwill during a pandemic http://dlvr.it/RSKQty pic.twitter.com/b9PUcE8JnI,2020-03-21 23:55:04
97,"Superb reporting by @mike_thepress – Coronavirus: Can New Zealand follow        Taiwan, Singapore and Hong Kong in containing the spread? https://www.stuff.co.nz/national/health/coronavirus/120449256/coronavirus-can-new-zealand-follow-taiwan-singapore-and-hong-kong-in-containing-the-spread …",2020-03-20 23:56:28
98,Fat-Assed Prepper Survival Tips for Preparing for a Coronavirus Quarantine https://buff.ly/3bactKi ,2020-03-18 23:59:14
99,"I have so much UHT milk in the cupboard, it's got me thinking if they could make UHT bread next. My freezer is full of pies and mixed veges. Any scientists who aren't busy figuring out coronavirus should get to work on bread that doesn't get mouly in two days.",2020-03-18 23:58:07
100,Air New Zealand not included in Government's multi-million coronavirus aviation support package  https://www.newshub.co.nz/home/travel/2020/03/coronavirus-government-will-not-bail-out-struggling-air-new-zealand-amid-coronavirus-pandemic.html …,2020-03-17 23:58:28
101,Keeping everyone safe from coronavirus in multi-generational households http://dlvr.it/RS4hjX pic.twitter.com/SUpwwdQspU,2020-03-17 23:58:04
