,Tweets,Date
0,"Join me in helping #CoronaVirus victims with #Ecoin and earn 600 Ecoins ( worth $3 ) free, Ecoin the world's fastest-growing crypto will donate 150 Ecoins when you Sign up. Earn 600 and donate 150 more Ecoins for referring #Donatewithoutspending",2020-04-29 23:34:23+00:00
1,"I presume 'Coronavirus' might be the next masterminded bioterrorism to mitigate increasing world population. 

No wonder China is the ideal country for experiment. 

Besides, animals are being domesticated for centuries without battling such pandemic disease. Just think about it.",2020-01-28 23:35:37
2,Any news a cure for this #coronavirus yet?,2020-02-13 23:33:12
3,"RT @FijiPM: This isn’t simply a short-term injection of climate finance. By focusing on capacity-building, Canada’s generosity will be felt…",Sat Jun 13 12:13:09 +0000 2020
4,"WHO says pacifc has ""unique vulnerabilities"" when it comes to #coronavirus but countries are ""preparing very assertively"". Listen to @WasukaEvan's interview with Sean Casey, WHO’s COVID-19 response lead in the Pacific.https://twitter.com/radioaustralia/status/1238250956267143169 …",2020-03-12 23:58:41
