,Tweets,Date
0,Thank you Singapore Govt for this #circuitbreakersg #circuitbreaker #Singapore #coronavirus ,2020-05-30 23:04:18+00:00
1,Football: 10 positive coronavirus tests in English Championship ,2020-05-30 21:38:03+00:00
2,Ten positive coronavirus tests in English Championship https://cna.asia/3cphLSN,2020-05-30 21:31:03+00:00
3,"Is immunity Your luck, decision, or fate? The tribe has spoken. by Bare Like this haiku? Upvote here https://quarantinehaikus.com/haiku/1589051686052x493892982913105900 .⁠ .⁠ .⁠ ⁠ Write one, tag us #quarantinehaikus⁠ ⁠ #covid19 #coronavirus #stayhome #quarantinelife #quarantinediaries #quarantinefun",2020-05-30 21:00:04+00:00
4,Football: No positives from latest Premier League coronavirus tests ,2020-05-30 19:58:52+00:00
5,Wuhan virus: China says it has confidence and capability to win war against coronavirus ,2020-01-30 23:40:32+00:00
6,"""...new artificial intelligence technology can automatically mine through news reports and online content from around the world, helping experts recognise anomalies that could lead to a potential epidemic or, worse, a pandemic"" #AI #Innovation #coronavirus ",2020-01-30 23:23:44+00:00
7,"Mr. Go, Don’t ever mention the word “proper”, same goes with you Mr. President, “protocol”... please lang wala kayo nyan!!! Stop your shits!!! #TravelBanNow #coronavirus #coronavirusPH #CoronavirusOutbreak",2020-01-30 23:07:42+00:00
8,"Robust R&D, healthcare systems paramount in #coronavirus fight #coronav #Covid19 ",2020-02-28 23:35:44+00:00
9,Thread about why some recovered #covid19 patients are testing positive again after recovery. ,2020-02-28 15:44:51+00:00
10,"Strategically well planned, knowing the covid19 will refrain ppl from going to thecstreets n keep them of the streets. Yet another power transition that went peacefully without any physical harm to the rakyat.",2020-02-28 12:27:57+00:00
11,I salute the Singapore Government for proactively taking measures to control the Covid-19 situation.The efforts of each of those daring hearts on the front line has helped this country's to protect one and all.God bless Singapore. #Singapore #COVID19 @leehsienloong,2020-02-28 12:26:47+00:00
12,"As #Singapore nears its 100th case, here’s a breakdown of #covid19 clusters: - Grace Assembly of God: 23 - Yong Thai Hang shop: 9 - The Life Church and Missions Singapore: 8 - Seletar Aerospace Heights construction site: 5 - Wizlearn Technologies (new): 4 - Grand Hyatt meeting: 3",2020-02-28 12:20:42+00:00
13,JUST IN: 2 new #COVID19 cases linked to Science Park cluster; 3 more patients discharged: MOH http://cna.asia/2Ps08sL,2020-02-28 12:03:08+00:00
14,"Heng on #COVID19: ""We must continue to be vigilant and continue to ensure that our responses are adequate as the situation evolves.” It’s like everything he says my brain is just like “ahbuden""",2020-02-28 10:41:35+00:00
15,Stay safe everyone and take all necessary precautions #COVID19,2020-02-28 10:30:37+00:00
16,"Online marketplace @Carousell has also initiated a giving campaign, encouraging people to list items they are willing to give away for free amidst #COVID19. Find out how you can contribute to initiatives like this: https://www.ourbetterworld.org/spread-love #OurBetterWorld #SGWholeCommunities",2020-02-28 10:30:00+00:00
17,I even brought in COVID19 into the exam paper....... wow,2020-02-28 10:15:30+00:00
18,Our first @doverct staff briefing this morning after a few weeks due to our #COVID19 precautions so a lovely opportunity to present some #resilience awards to colleagues supporting students. #dcissg – at Dover Court International School,2020-02-28 09:24:16+00:00
19,On the dog who supposedly tested positive for #COVID19 in #HongKong,2020-02-28 09:00:25+00:00
20,"Interesting review of what we know (or don't know) about the #pneumonia cases in #Wuhan province. It's neither a  human or avian strain of #influenza nor #Adenovirus. So good chance it's a #Coronavirus.
https://www.statnews.com/2020/01/04/mystery-pneumonia-outbreak-china/ …",2020-01-06 14:37:47
21,"Amazed at how fast data about this new Wuhan coronavirus is being discovered and shared! Credit to all those public health officials, clinicians and scientists! https://twitter.com/trvrb/status/1216118434850725888 …",2020-01-12 04:45:58
22,Some organic sweet apple tea in office for CNY eve because apples represent safety (平安)! We all need an extra dose of safety in times of the Wuhan coronavirus. @ Ngee Ann Polytechnic https://www.instagram.com/p/B7rnHkaBdOk/?igshid=738yweerg1ky …,2020-01-23 23:57:43
23,Be safe. Please get some smart scientists to work on a cure for #coronavirus soon! pic.twitter.com/XVTB0XgEqj,2020-01-23 23:57:31
24,"Scientists in #Australia have developed a lab-grown version of the #coronavirus, which will help speed up work towards a #vaccine for the #disease. #coronavirus #WuhanVirus #health #publichealthhttps://www.abc.net.au/news/2020-01-29/wuhan-coronavirus-created-in-australian-lab-outside-of-china/11906390?pfmredir=sm …",2020-01-28 23:58:31
25,"Fighting #coronavirus! #TRON is on the way! Wuhan, we are with you! Stay strong! @Tronfoundationpic.twitter.com/yVpYvBTiwt",2020-01-28 23:58:26
26,Dude....get the fact that they are spreading a coronavirus that has no cure till today....we dont bring any disease to china...and to add on..its like karma for they did to uyghur muslims... https://twitter.com/MothershipSG/status/1222081444874350592 …,2020-01-28 23:34:26
27,Wuhan virus: China says it has confidence and capability to win war against coronavirus https://www.straitstimes.com/asia/east-asia/wuhan-virus-chinas-un-envoy-says-beijing-assessing-who-coronavirus-declaration?utm_term=Autofeed&utm_campaign=sttw&utm_medium=Social&utm_source=Twitter#Echobox=1580427631 …,2020-01-30 23:40:32
28,Wuhan virus: China says it has confidence and capability to win war against coronavirus https://www.straitstimes.com/asia/east-asia/wuhan-virus-chinas-un-envoy-says-beijing-assessing-who-coronavirus-declaration?utm_term=Autofeed&utm_campaign=sttw&utm_medium=social&utm_source=Twitter#Echobox=1580427482 …,2020-01-30 23:38:03
29,"A good overview of #coronavirus, SARS, and MERS and the possible route they have taken to infect humans. https://www.sciencenews.org/article/how-new-wuhan-coronavirus-stacks-up-against-sars-mers …",2020-01-24 23:37:25
30,"Keeping ourselves healthy and fit is one way to protect against the Wuhan coronavirus. If our body is in a good condition, we will be less susceptible to infection and can recover faster from any illness. 

#running #keepingfit #personalresponsibilitypic.twitter.com/ivHTIYEAZF",2020-01-29 23:54:16
31,Lion dance troupe to get tested after performing at Grand Hyatt conference with coronavirus cases https://mothership.sg/2020/02/lion-dance-conference-grand-hyatt/ …,2020-02-07 23:58:11
32,Does it say anything interesting about coronavirus?,2020-02-07 23:54:55
33,"Stay safe and healthy baes 
Remember to wash your hands and wear your face masks if you're sick. Let's take preventive measure before the #Coronavirus situation gets worst. pic.twitter.com/pIpZTGUjC7",2020-02-07 23:52:36
34,Coronavirus: Scientists question work suggesting pangolin link https://str.sg/JpXV ,2020-02-07 23:40:19
35,actly have like 4 cases of human-human transmission of the coronavirus living within 15 min walking dist of my hse,2020-02-05 23:52:39
36,"Rob Hillman has issued a position statement on behalf of Ecotourism Australia that addresses bushfires, long-term recovery efforts and pre-empting the impacts of coronavirus on the ecotourism industry. Ecotourism Australia 

https://www.gaiadiscovery.com/planet/ecotourism-australia-bushfire-recovery-position-statement …",2020-02-05 23:47:39
37,Passengers on cruise liner docked in Japan test positive for coronavirus https://www.straitstimes.com/asia/east-asia/passengers-on-cruise-liner-docked-in-japan-test-positive-for-coronavirus?utm_term=Autofeed&utm_campaign=sttw&utm_medium=social&utm_source=Twitter#Echobox=1580860701 …,2020-02-04 23:58:21
38,Everyone in the ⁦@nytimes⁩ Beijing bureau was involved in this account of the crucial first weeks in Wuhan that explains how the government’s refusal to come clean with its people led to the spread of the coronavirus. We hope you’ll read it:   https://www.nytimes.com/2020/02/01/world/asia/china-coronavirus.html?referringSource=articleShare …,2020-02-01 23:40:11
39,"Wuhan Coronavirus Looks Increasingly Like a Pandemic, Experts Say 

Very well sourced NYT article reviewing perspectives and assessments of Western public health experts, worth reading in full.

#WuhanCoronaVirus
#2019-nCoV

My thread comments in brackets.https://nyti.ms/2GOL83q ",2020-02-02 23:44:05
40,"Global shipping has been hit by the coronavirus. Now goods are getting stranded

https://www.cnn.com/2020/02/05/business/shipping-coronavirus-impact/index.html …",2020-02-06 23:54:32
41,@weimankow's amazing infocomic shares with us 5 important precautions to take in order to protect yourself and loved ones from the Novel Coronavirus (2019-nCoV) and other contagious respiratory infections.  Stay safe… https://www.instagram.com/p/B8PoGo1gnhO/?igshid=9aft9moqz3wv …,2020-02-06 23:39:02
42,Higher chance Singapore will ease monetary policy as Asia faces rate-cut pressure from coronavirus https://www.straitstimes.com/business/economy/higher-chance-singapore-will-ease-monetary-policy-as-asia-faces-rate-cut-pressure?utm_term=Autofeed&utm_campaign=sttw&utm_medium=Social&utm_source=Twitter#Echobox=1580774247 …,2020-02-03 23:57:27
43,Higher chance Singapore will ease monetary policy as Asia faces rate-cut pressure from coronavirus https://www.straitstimes.com/business/economy/higher-chance-singapore-will-ease-monetary-policy-as-asia-faces-rate-cut-pressure?utm_term=Autofeed&utm_campaign=sttw&utm_medium=social&utm_source=Twitter#Echobox=1580774193 …,2020-02-03 23:56:33
44,"Well this is good effort. #Hongkong steeping up. Will #Singapore do the same by installing physical barriers too? 

#coronavirus #jtshttps://twitter.com/SCMPNews/status/1227378143209586689 …",2020-02-11 23:58:41
45,The novel #coronavirus has taught many the importance of purchasing travel insurance early. Here are other ways to protect yourself in the event of a trip cancellation. #travel #sg #adventure,2020-02-19 23:30:00
46,"This is a very good dashboard detailing the #coronavirus spread globally. 84 cases reported in Singapore. No deaths. China is another story altogether. 
https://gisanddata.maps.arcgis.com/apps/opsdashboard/index.html#/bda7594740fd40299423467b48e9ecf6 …",2020-02-19 23:24:16
47,Coronavirus can prompt a needed rethink on global trade and integration https://www.scmp.com/comment/opinion/article/3051228/coronavirus-chaos-can-prompt-needed-rethink-global-trade-and … via @scmpnews,2020-02-19 23:20:15
48,"Wage support, tax rebates, rental waivers and more in #SGBudget's #coronavirus relief measures http://bit.ly/31Yz1ut pic.twitter.com/DUkrX87j7c",2020-02-16 23:50:04
49,@leehsienloong shows how to be a compassionate state #leader. #respect #singapore #StandTogether against #coronavirus #COVIDー19https://twitter.com/leehsienloong/status/1229036054075695104 …,2020-02-16 23:32:49
50,"Three new cases of #coronavirus in #Singapore, two linked to Grace Assembly church http://bit.ly/2u3eQPk pic.twitter.com/HMAMJvR43s",2020-02-16 23:32:23
51,Coronavirus: 2nd test positive for US woman from cruise in Cambodia https://www.tnp.sg/news/world/coronavirus-2nd-test-positive-us-woman-cruise-cambodia?utm_term=Autofeed&utm_medium=Social&utm_source=Twitter#Echobox=1581891621 …pic.twitter.com/nxlHAPQGO0,2020-02-16 23:29:24
52,If teachers are looking to support their students and parents with Developing Number Strategies in Mathematics then check out @nicolefredtripp and my free book. A great resource for distance learning. #coronavirus #coronaviruschina https://books.apple.com/us/book/developing-number-strategies/id1422876165 …pic.twitter.com/XDl0BJWm9R,2020-02-13 23:45:39
53,US ready to allow North Korea sanctions exemption to combat coronavirus https://www.straitstimes.com/world/united-states/us-says-prepared-to-help-north-korea-combat-threat-from-coronavirus?utm_term=Autofeed&utm_campaign=sttw&utm_medium=Social&utm_source=Twitter#Echobox=1581637346 …,2020-02-13 23:42:26
54,US ready to allow North Korea sanctions exemption to combat coronavirus https://www.straitstimes.com/world/united-states/us-says-prepared-to-help-north-korea-combat-threat-from-coronavirus?utm_term=Autofeed&utm_campaign=sttw&utm_medium=social&utm_source=Twitter#Echobox=1581637203 …,2020-02-13 23:40:03
55,"Rally through Total Defence to combat coronavirus, like during Sars: Ng Eng Hen https://www.straitstimes.com/singapore/rally-through-total-defence-to-combat-coronavirus-like-during-sars-ng-eng-hen?utm_term=Autofeed&utm_campaign=sttw&utm_medium=social&utm_source=Twitter#Echobox=1581637198 …",2020-02-13 23:39:58
56,"“The question is not whether Indonesia's medical researchers can detect the virus. (...) But just one lab, the Ministry's Research and Development Laboratory Litbang, is currently running tests to confirm positive cases of #COVID19.” #coronavirus #SARSCoV2https://www.smh.com.au/world/asia/why-are-there-are-no-cases-of-coronavirus-in-indonesia-20200213-p540o1.html …",2020-02-13 23:33:01
57,Apple says will not meet revenue guidance for March quarter due to coronavirus impact https://cna.asia/2UXQf9K pic.twitter.com/Cv6hFM8rq5,2020-02-17 23:34:33
58,Some landlords offering #coronavirus relief packages to tenants http://bit.ly/2vZy49a pic.twitter.com/mzZd9rcEds,2020-02-24 23:47:11
59,I bet these smart machines could work for pest control in agriculture just as well.  Technology to the rescue.  #orchards #crops #locusts #fallarmyworm #plantations #coronavirus #vectorcontrol #pestcontrolhttps://twitter.com/XAG_official/status/1230434097543016448 …,2020-02-22 23:37:21
60,"Wow, Coronavirus buffet ",2020-02-26 23:56:40
61,"https://t.co/3EPzJNCAzU FREE listing

If you can DREAM it, you can DO it.

#coaching #coronavirus #COVID19… https://t.co/NFtmnA7obt",Sat Jun 13 08:44:15 +0000 2020
62,"Alhamdulillah! Over 50,000 Pakistanis have DEFEATED #coronavirus so far! Folded hands

Eat healthy, sleep well, say… https://t.co/DEEIKqvZXb",Sat Jun 13 09:10:56 +0000 2020
63,"RT @MileyCyrus: Spain, you united in solidarity with Black Lives Matter in the US. We must keep standing together to tackle #COVID19 and it…",Sat Jun 13 09:52:29 +0000 2020
64,RT @rajakumahrri: If can have ndp and elections why cannot have grand prix?,Sat Jun 13 10:00:03 +0000 2020
65,"RT @sanchezcastejon: Spain is coleader in initiatives such as the ACT-Accelerator to achieve equitable access to vaccines, treatments and d…",Sat Jun 13 10:14:30 +0000 2020
66,Get well soon!,Sat Jun 13 10:34:31 +0000 2020
67,"RT @AbraarKaran: Lungs of an otherwise healthy woman in her 20s who received the first lung transplant for #covid19 in the US. 

https://t.…",Sat Jun 13 10:10:15 +0000 2020
68,Excited for the final episode tonight! Thanks @TwitterSG for the support of this #COVID19 music project!… https://t.co/6jOUSPBPj8,Sat Jun 13 11:28:23 +0000 2020
69,"Please be safe everyone ! 
#covid19 #screening",Sat Jun 13 11:32:59 +0000 2020
70,"To ensure business continuity during #COVID19, GHD accelerated its digital transformation to successfully support i… https://t.co/tFHA3CeHWw",Sat Jun 13 12:02:50 +0000 2020
71,You have no idea how happy I am just knowing that football will start again next week. #covid19 #StayHome #football… https://t.co/pyeZauHrli,Sat Jun 13 12:15:18 +0000 2020
72,"RT @CTRavi_BJP: 30 COVID-19 patients discharged after ""Siddha Treatment"" in Chennai.

Traditional Bharatiya medicine comes to the rescue du…",Sat Jun 13 10:59:10 +0000 2020
73,When your friend likes to feed you. #covid19 https://t.co/03Buv20Cmg,Sat Jun 13 13:34:24 +0000 2020
74,"RT @miyaa_kukuduku: Rest in peace in advance dear madarsachap madarporki.

https://t.co/UbHEd7DevS",Sat Jun 13 12:46:48 +0000 2020
75,Welcome 40k. Till when then will it stop? I can't help but feel annoyed w those gullible humans who is so happy whe… https://t.co/jNk8s3bdrG,Sat Jun 13 14:21:47 +0000 2020
76,"RT @AsYouNotWish: Praying for your speedy recovery, Lala. You have to live to see how India reclaims POK and Baloch freedom fighters reclai…",Sat Jun 13 13:48:18 +0000 2020
77,"Dow roars back from coronavirus sell-off with biggest gain since 2009, surges 5.1% https://www.cnbc.com/2020/03/01/awaiting-us-stock-futures-open-at-6-pm-after-wall-streets-worst-week-since-2008.html?__source=sharebar|twitter&par=sharebar …",2020-03-02 23:59:47
78,"Is Coronavirus saving the earth? Destroying high polluted area?
Safe Earth, Safe Lives",2020-03-01 23:51:47
79,Right so I feel like people should seriously take note of this now as there are currently 35 new cases in the uk for Coronavirus. This applies to everyone now. The risk can be easily avoided with basic hygiene and washing your hands properly. https://twitter.com/TheRealWhatWait/status/1231836444664029184 …,2020-03-01 23:51:41
80,Rapid and efficient preparation of monoclonal antibodies against SARS-associated coronavirus nucleocapsid protein by immunizing mice http://dlvr.it/RRGFwN ,2020-03-04 23:53:02
81,Coronavirus '10 times deadlier than seasonal flu': US top infectious disease expert Fauci https://www.straitstimes.com/world/united-states/coronavirus-10-times-deadlier-than-seasonal-flu-us-top-infectious-disease-expert?utm_term=Autofeed&utm_campaign=sttw&utm_medium=Social&utm_source=Twitter#Echobox=1583971151 …,2020-03-11 23:59:11
82,Coronavirus '10 times deadlier than seasonal flu': US top infectious disease expert Fauci https://www.straitstimes.com/world/united-states/coronavirus-10-times-deadlier-than-seasonal-flu-us-top-infectious-disease-expert?utm_term=Autofeed&utm_campaign=sttw&utm_medium=social&utm_source=Twitter#Echobox=1583970987 …,2020-03-11 23:56:28
83,Forget all other leading economy indicator . New kids on the block - CoronaVirus Indicator is all you need . pic.twitter.com/VeNjgFDKac,2020-03-11 23:56:27
84,Give them a footnote saying *19/20 season prematurely cancelled due to coronavirus with Liverpool top of the table at the point of cancellation. They can frame up the league table at point of cancellation,2020-03-12 23:57:45
85,"Hey Skippy!

Put @Paula_White in charge of a move like this and USA is saved!

Amen.

#coronavirus
http://georgiatoday.ge/news/19979/Clergymen-Splash-Holy-Water-on-Tbilisi-Streets …",2020-03-17 23:57:25
